mouse,"n. any of numerous small rodents typically resembling diminutive rats having pointed snouts and small ears on elongated bodies with slender usually hairless tails
n. person who is quiet or timid
n. a hand-operated electronic device that controls the coordinates of a cursor on your computer screen as you move it around on a pad; on the bottom of the device is a ball that rolls on the surface of the pad
v. manipulate the mouse of a computer"
nourish,v. provide with nourishment
nurture,"n the properties acquired as a consequence of the way you were treated as a child
n helping someone grow up to be an accepted member of the community
v help develop, help grow
v bring up
v provide with nourishment"
palm,"n. the inner surface of the hand from the wrist to the base of the fingers
n. a linear unit based on the length or width of the human hand
n. any plant of the family Palmae having an unbranched trunk crowned by large pinnate or palmate leaves"
parasite,n. an animal or plant that lives in or on a host (another animal or plant); it obtains nourishment from the host without benefiting or killing the host
rat,"n. any of various long-tailed rodents similar to but larger than a mouse
n. a pad (usually made of hair) worn as part of a woman's coiffure
v. desert one's party or group of friends, for example, for one's personal advantage
v. employ scabs or strike breakers in"
reptile,"n. any cold-blooded vertebrate of the class Reptilia including tortoises, turtles, snakes, lizards, alligators, crocodiles, and extinct forms"
seal,"n. a device incised to make an impression; used to secure a closing or to authenticate documents
n. the pelt or fur (especially the underfur) of a seal
n. a stamp affixed to a document (as to attest to its authenticity or to seal it)
n. a finishing coat applied to exclude moisture"
spine,"n. a small sharp-pointed tip resembling a spike on a stem or leaf
n. the part of a book's cover that encloses the inner side of the book's pages and that faces outward when the book is shelved
n. a sharp rigid animal process or appendage; as a porcupine quill or a ridge on a bone or a ray of a fish fin"
squirrel,"n. a kind of arboreal rodent having a long bushy tail
n. the fur of a squirrel"
worm,"n. any of numerous relatively small elongated soft-bodied animals especially of the phyla Annelida and Chaetognatha and Nematoda and Nemertea and Platyhelminthes; also many insect larvae
n. a person who has a nasty or unethical character undeserving of respect
n. a software program capable of reproducing itself that can spread from one computer to the next over a network
n. screw thread on a gear with the teeth of a worm wheel or rack"
zebra,n. any of several fleet black-and-white striped African equines
providing,"v give something useful or necessary to
v give what is desired or needed, especially support, food or sustenance
v determine (what is to happen in certain contingencies), especially by including a proviso condition or stipulation
v mount or put up
v make a possibility or provide opportunity for; permit to be attainable or cause to remain
v supply means of subsistence; earn a living
v take measures in preparation for"
dip,"n. a depression in an otherwise level surface
n. (physics) the angle that a magnetic needle makes with the plane of the horizon
n. tasty mixture or liquid into which bite-sized foods are dipped
n. a brief immersion"
enough,"n. an adequate quantity; a quantity that is large enough to achieve a purpose
r. as much as necessary; (`plenty' is nonstandard) ""I've had plenty, thanks"""
default,"n. loss due to not showing up
n. act of failing to meet a financial obligation
v. fail to pay up"
surface,"n. the outer boundary of an artifact or a material layer constituting or resembling such a boundary
n. the extended two-dimensional outer boundary of a three-dimensional object
n. the outermost level of the land or sea
n. a superficial aspect as opposed to the real nature of something"
accuracy,"n. the quality of being near to the true value
n. (mathematics) the number of significant figures given in a number"
assimilation,"n. the state of being assimilated; people of different backgrounds come to see themselves as part of a larger national family
n. the social process of absorbing one cultural group into harmony with another
n. the process of absorbing nutrients into the body after digestion"
busy,"v. keep busy with
a. actively or fully engaged or occupied
s. overcrowded or cluttered with detail
s. crowded with or characterized by much activity"
digest,"n. a periodical that summarizes the news
v. convert food into absorbable substances
v. arrange and integrate in the mind
v. put up with something or somebody unpleasant"
empty,"n. a container that has been emptied
v. make void or empty of contents
v. become empty or void of its content
v. remove"
especially,"r to a distinctly greater extent or degree than is common
r in a special manner"
exactly,"r indicating exactness or preciseness
r just as it should be
r in a precise manner"
exhaust,"n. gases ejected from an engine as waste products
n. system consisting of the parts of an engine through which burned gases or steam are discharged
v. wear out completely
v. use up the whole supply of"
free,"n. people who are free
v. grant freedom to; free from confinement
v. make (information) available for publication
v. free from obligations or duties"
fulfil,"v put in effect
v fill or meet a want or need
v meet the requirements or expectations of"
full,"v. beat for the purpose of cleaning and thickening
v. make (a garment) fuller by pleating or gathering
a. containing as much or as many as is possible or normal
s. complete in extent or degree and in every particular"
immerse,"v. thrust or throw into
v. enclose or envelop completely, as if by swallowing"
incline,"v. bend or turn (one's ear) towards a speaker in order to listen well
v. lower or bend (the head or upper body), as in a nod or bow
v. feel favorably disposed or willing"
infer,"v reason by deduction; establish by deduction
v draw from specific cases for more general cases
v conclude by reasoning; in logic
v guess correctly; solve by guessing
v believe to be the case"
infinite,"a. having no limits or boundaries in time or space or extent or magnitude
a. of verbs; having neither person nor number nor mood (as a participle or gerund or infinitive)
s. total and all-embracing"
interpretation,"n. a mental representation of the meaning or significance of something
n. an explanation that results from interpreting something
n. an explanation of something that is not immediately obvious"
merely,r. and nothing more
mind,"n. that which is responsible for one's thoughts and feelings; the seat of the faculty of reason
n. recall or remembrance
n. attention
n. your intention; what you intend to do"
mourn,"v. feel sadness
v. observe the customs of mourning after the death of a loved one"
novel,"n. an extended fictional work in prose; usually in the form of a story
n. a printed and bound book that is an extended work of fiction
s. pleasantly new or different"
odd,"a. not divisible by two
s. not easily explained
s. an indefinite quantity more than that specified
s. of the remaining member of a pair, of socks e.g."
regular,"n. a regular patron
n. a soldier in the regular army
n. a dependable follower (especially in party politics)
n. a garment size for persons of average height and weight"
skim,"n. a thin layer covering the surface of a liquid
n. reading or glancing through quickly
v. cause to skip over a surface
v. coat (a liquid) with a layer"
slot,"n. a position in a grammatical linguistic construction in which a variety of alternative units are interchangeable
n. a small slit (as for inserting a coin or depositing mail)
n. a position in a hierarchy or organization
n. the trail of an animal (especially a deer)"
thought,n. the organized beliefs of a period or group or individual
evaporate,"v. lose or cause to lose liquid by vaporization leaving a more concentrated residue
v. cause to change into a vapor
v. change into a vapor"
float,"n. the time interval between the deposit of a check in a bank and its payment
n. the number of shares outstanding and available for trading by the public
n. an elaborate display mounted on a platform carried by a truck (or pulled by a truck) in a procession or parade
n. a hand tool with a flat face used for smoothing and finishing the surface of plaster or cement or stucco"
overflow,"n. the occurrence of surplus liquid (as water) exceeding the limit or capacity
v. flow or run over (a limit or brim)"
penetrate,"v. pass into or through, often by overcoming resistance
v. come to understand
v. make one's way deeper into or through
v. insert the penis into the vagina or anus of"
permeate,v. spread or diffuse through
pump,"n. a mechanical device that moves fluid or gas by pressure or suction
n. a low-cut shoe without fastenings
v. operate like a pump; move up and down, like a handle or a pedal
v. deliver forth"
recede,v. become faint or more distant
soak,"n. the process of becoming softened and saturated as a consequence of being immersed in water (or other liquid)
n. washing something by allowing it to soak
v. submerge in a liquid
v. beat severely"
spill,"n. liquid that is spilled
n. the act of allowing a fluid to escape
n. a sudden drop from an upright position
v. cause or allow (a liquid substance) to run or flow from a container"
spit,"n. a narrow strip of land that juts out into the sea
n. a skewer for holding meat over a fire
n. the act of spitting (forcefully expelling saliva)
v. expel or eject (saliva or phlegm or sputum) from the mouth"
splash,"n. the sound like water splashing
n. a patch of bright color
n. the act of scattering water about haphazardly
v. mark or overlay with patches of contrasting color or texture; cause to appear splashed or spattered"
spray,"n. a pesticide in suspension or solution; intended for spraying
n. a quantity of small objects flying through the air
n. flower arrangement consisting of a single branch or shoot bearing flowers and foliage
n. water in small drops in the atmosphere; blown from waves or thrown up by a waterfall"
sprinkle,"n. the act of sprinkling or splashing water
v. cause (a liquid) to spatter about, especially with force
v. rain gently
v. scatter with liquid; wet lightly"
submerge,"v. sink below the surface; go under or as if under water
v. cover completely or make imperceptible
v. put under water"
widespread,s. widely circulated or diffused
immediate,"s. of the present time and place
a. having no intervening medium
s. immediately before or after as in a chain of cause and effect
s. performed with little or no delay"
conjunction,"n. an uninflected function word that serves to conjoin words or phrases or clauses or sentences
n. the grammatical relation between linguistic units (words or phrases or clauses) that are connected by a conjunction
n. (astronomy) apparent meeting or passing of two or more celestial bodies in the same degree of the zodiac"
increasingly,r. advancing in amount or intensity
expectation,"n. belief about (or mental picture of) the future
n. the feeling that something is about to happen"
overlook,"n. a high place affording a good view
v. look past, fail to notice
v. watch over"
gap,"n. a conspicuous disparity or difference as between two figures
n. a narrow opening
n. a difference (especially an unfortunate difference) between two opinions or two views or two situations
v. make an opening or gap in"
academic,"a. associated with academia or an academy
s. hypothetical or theoretical and not expected to produce an immediate or practical result
s. marked by a narrow focus on or display of learning especially its trivial aspects"
application,"n. the act of bringing something to bear; using it for a particular purpose
n. a verbal or written request for assistance or employment or admission to a school
n. the work of applying something; 
n. a program that gives a computer instructions that provide the user with tools to accomplish a task"
await,v look forward to the probable occurrence of
condemn,"v. express strong disapproval of
v. declare or judge unfit for use or habitation
v. compel or force into a particular state or activity
v. demonstrate the guilt of (someone)"
credit,"n. money available for a client to borrow
n. an accounting entry acknowledging income or capital items
n. used in the phrase `to your credit' in order to indicate an achievement deserving praise; 
n. arrangement for deferred payment for goods and services"
depend,v. be contingent upon (something that is elided)
graduate,"n. a measuring instrument for measuring fluid volume; a glass container (cup or cylinder or flask) whose sides are marked with or divided into amounts
v. receive an academic degree upon completion of one's studies
v. confer an academic degree upon
s. of or relating to studies beyond a bachelor's degree"
hinder,"v be a hindrance or obstacle to
v hinder or prevent the progress or accomplishment of
v put at a disadvantage
s located at or near the back of an animal
s located at or near the back of an animal"
impact,"n. the striking of one body against another
n. a forceful consequence; a strong effect
v. press or wedge together; pack together"
independence,"n. freedom from control or influence of another or others
n. the successful ending of the American Revolution
n. a city in western Missouri; the beginning of the Santa Fe Trail"
inherent,"s existing as an essential constituent or characteristic
s in the nature of something though not readily apparent"
prepare,"v. to prepare verbally, either for written or spoken delivery
v. educate for a future role or function
v. lead up to and soften by sounding the dissonant note in it as a consonant note in the preceding chord"
pursuit,"n. the act of pursuing in an effort to overtake or capture
n. a search for an alternative that meets cognitive criteria"
silly,n. a word used for misbehaving children
struggle,"n. an energetic attempt to achieve something
n. strenuous effort
v. to exert strenuous effort against opposition"
absent,"v. go away or leave
a. not being in a specified place
s. lost in thought; showing preoccupation"
accommodation,"n. a settlement of differences
n. in the theories of Jean Piaget: the modification of internal representations in order to accommodate a changing knowledge of reality
n. living quarters provided for public convenience
n. the act of providing something (lodging or seat or food) to meet a need"
appraisal,"n. the classification of someone or something with respect to its worth
n. a document appraising the value of something (as for insurance or taxation)
n. an expert estimation of the quality, quantity, and other characteristics of someone or something"
auditorium,n. the area of a theater or concert hall where the audience sits
bibliography,n. a list of writings with time and place of publication (such as the writings of a single author or the works referred to in preparing a document etc.)
branch,"n. a division of some larger or more complex organization
n. a division of a stem, or secondary stem arising from the main stem of a plant
n. a part of a forked or branching shape
n. a stream or river connected to a larger one"
chorus,"n. any utterance produced simultaneously by a group
n. a group of people assembled to sing together
n. a body of dancers or singers who perform together
n. a company of actors who comment (by speaking or singing in unison) on the action in a classical Greek play"
compulsory,s. required by rule
credentials,"n a document attesting to the truth of certain stated facts
n a document attesting to the truth of certain stated facts"
diploma,n. a document certifying the successful completion of a course of study
dormitory,"n. a college or university building containing living quarters for students
n. a large sleeping room containing several beds"
expire,"v lose validity
v pass from physical life and lose all bodily attributes and functions necessary to sustain life
v expel air"
fee,"n. a fixed charge for a privilege or for professional services
n. an interest in land capable of being inherited"
forum,"n. a public meeting or assembly for open discussion
n. a public facility to meet for open discussion"
institute,"n. an association organized to promote art or science or education
v. advance or set forth in court"
orientation,"n. the act of orienting
n. an integrated set of attitudes and beliefs
n. position or alignment relative to points of the compass or other specific directions
n. a person's awareness of self with regard to position and time and place and personal relationships"
proceeding,n. (law) the institution of a sequence of steps by which legal judgments are invoked
projector,"n. an optical device for projecting a beam of light
n. an optical instrument that projects an enlarged image onto a screen"
semester,"n. one of two divisions of an academic year
n. half a year; a period of 6 months"
seminar,"n. any meeting for an exchange of ideas
n. a course offered for a small group of advanced students"
sophomore,"n. a second-year undergraduate
s. used of the second year in United States high school or college"
speciality,"n an asset of special worth or utility
n a distinguishing trait
n the special line of work you have adopted as your career"
stadium,n. a large structure for open-air sports or entertainments
subsidy,n. a grant paid by a government to an enterprise that benefits the public
symposium,n. a meeting or conference for the public discussion of some topic especially one in which the participants form an audience and make presentations
evolve,"v. work out
v. undergo development or evolution"
discipline-oriented,none
highly,"r. to a high degree or extent; favorably or with much respect
r. at a high rate or wage
r. in a high position or level or rank"
specialized,a. developed or designed for a special activity or function
problem-oriented,none
elsewhere,r. in or to another place
brief,"n. a document stating the facts and points of law of a client's case
n. a condensed written summary or abstract
v. give essential information to someone
s. of short duration or distance"
academia,n. the academic world
accumulation,"n. the act of accumulating
n. (finance) profits that are not paid out as dividends but are added to the capital base of the corporation"
adequate,"a. having the requisite qualities or resources to meet a task
s. sufficient for the purpose
s. about average; acceptable"
agro-technological,none
almost,r (of actions or states) slightly short of or not quite accomplished; all but
artificial,"a. contrived by art rather than nature
s. artificially formal
s. not arising from natural growth or characterized by vital processes"
assimilate,"v. become similar to one's environment
v. make similar
v. take (gas, light or heat) into a solution
v. become similar in sound"
creative,"a. having the ability or power to create
s. promoting construction or creation"
crop,"n. the yield from plants in a single growing season
n. a cultivated plant that is grown commercially on a large scale
n. a collection of people or things appearing together
n. the output of something in a season"
destruction,"n. the termination of something by causing so much damage to it that it cannot be repaired or no longer exists
n. an event (or the result of an event) that completely destroys something"
disciplinary,"a. relating to discipline in behavior
a. relating to a specific field of academic study"
doubtful,"s. open to doubt or suspicion
s. fraught with uncertainty or doubt
s. unsettled in mind or opinion"
enact,v. act out; represent or perform as if in a play
endeavor,v. attempt by employing effort
endeavour,"n a purposeful or industrious undertaking (especially one that requires effort or boldness)
n earnest and conscientious activity intended to do or accomplish something
v attempt by employing effort"
enormous,"s. extraordinarily large in size or extent or amount or power or degree; that a whole civilization should be dependent on technology""- Walter Lippman"
environmental,"a. of or relating to the external conditions or surroundings
a. concerned with the ecological effects of altering the environment"
eradicate,"v kill in large numbers
v destroy completely, as if down to the roots"
fertilizer,n. any substance such as manure or a mixture of nitrates used to make soil more fertile
flourish,"n. a showy gesture
n. an ornamental embellishment in writing
n. a display of ornamental speech or language
n. the act of waving"
focus,"n. the concentration of attention or energy on something
n. maximum clarity or distinctness of an image rendered by an optical system
n. maximum clarity or distinctness of an idea
n. a central point or locus of an infection in an organism"
humanity,n. the quality of being humane
inside,"n. the region that is inside of something
n. the inner or enclosed surface of something
a. relating to or being on the side closer to the center or within a defined space
s. being or applying to the inside of a building"
keyword,none
largely,"r. in large part; mainly or chiefly
r. on a large scale"
lest,s being ten more than forty
mainly,r for the most part
nominal,"a. relating to or constituting or bearing or giving a name
s. insignificantly small; a matter of form only (`tokenish' is informal)
a. pertaining to a noun or to a word group that functions as a noun
a. of, relating to, or characteristic of an amount that is not adjusted for inflation"
outside,"n. the region that is outside of something
n. the outer side or surface of something
a. relating to or being on or near the outer side or limit
s. originating or belonging beyond some bounds:""the outside world"""
prophet,"n. an authoritative person who divines the future
n. someone who speaks by divine inspiration; someone who is an interpreter of the will of God"
radical,"n. a person who has radical ideas or opinions
n. (mathematics) a quantity expressed as the root of another quantity
n. a character conveying the lexical meaning of a logogram
s. arising from or going to the root or source"
rapidly,r with rapid movements
saint,"n. a person who has died and has been declared a saint by canonization
n. person of exceptional holiness"
salute,"n. an act of honor or courteous recognition
n. a formal military gesture of respect
n. an act of greeting with friendly words and gestures like bowing or lifting the hat
v. greet in a friendly way"
scholarly,a. characteristic of scholars or scholarship
shame,"n. a painful emotion resulting from an awareness of inadequacy or guilt
n. a state of dishonor
v. compel through a sense of shame
v. cause to be ashamed"
social science,none
swell,"n. the undulating movement of the surface of the open sea
n. a rounded elevation (especially one on an ocean floor)
n. a crescendo followed by a decrescendo
v. increase in size, magnitude, number, or intensity"
system,"n. instrumentality that combines interrelated interacting artifacts designed to work as a coherent entity
n. a group of independent but interrelated elements comprising a unified whole
n. (physical chemistry) a sample of matter in which substances in different phases are in equilibrium
n. a complex of methods or rules governing behavior"
tackle,"n. the person who plays that position on a football team
n. (American football) a position on the line of scrimmage
n. (American football) grasping an opposing player with the intention of stopping by throwing to the ground
v. seize and throw down an opponent player, who usually carries the ball"
topic,n. some situation or event that is thought about
worldwide,s. spanning or extending throughout the entire world
steelworker,n a worker engaged in making steel
employee,n. a worker who is hired to perform a job
auto,n a motor vehicle with four wheels; usually propelled by an internal combustion engine
join,"v. become part of; become a member of a group or organization
v. cause to become joined or linked
v. come into the company of
v. make contact or come together"
million,"n. the number that is represented as a one followed by 6 zeros
n. a very large indefinite number (usually hyperbole)
s. (in Roman numerals, M written with a macron over it) denoting a quantity consisting of 1,000,000 items or units"
rate,"n. a magnitude or frequency relative to a time unit
n. amount of a charge or payment relative to some basis
n. a quantity or amount or measure considered as a proportion of another quantity or amount or measure
v. assign a rank or rating to"
stock,"n. the capital raised by a corporation through the issue of shares entitling holders to an ownership interest (equity)
n. the merchandise that a shop has on hand
n. the handle of a handgun or the butt end of a rifle or shotgun or part of the support of a machine gun or artillery gun
n. the reputation and popularity a person has"
fluctuation,"n. a wave motion
n. the quality of being unsteady and subject to changes"
harsh,"s. unpleasantly stern
s. disagreeable to the senses
s. unkind or cruel or uncivil
s. severe"
outlive,v. live longer than
retirement,"n. the state of being retired from one's business or occupation
n. withdrawal from your position or occupation
n. withdrawal for prayer and study and meditation"
absolute,"n. something that is conceived or that exists independently and not in relation to other things; something that does not depend on anything else and is beyond human control; something that is not relative
a. perfect or complete or pure
s. complete and without restriction or qualification; sometimes used informally as intensifiers
s. not limited by law"
acceleration,"n. an increase in rate of change
n. the act of accelerating; increasing the speed
n. (physics) a rate of increase of velocity"
