defensive,"n. an attitude of defensiveness (especially in the phrase `on the defensive')
a. intended or appropriate for defending against or deterring aggression or attack
s. attempting to justify or defend in speech or writing"
criticise,"v find fault with; express criticism of; point out real or perceived flaws
v act as a critic"
apply,"v. be pertinent or relevant or applicable
v. ask (for something)
v. refer (a word or name) to a person or thing
v. apply oneself to"
negative,"n. a reply of denial
n. a piece of photographic film showing an image with light and shade or colors reversed
a. characterized by or displaying negation or denial or opposition or resistance; having no positive features
a. expressing or consisting of a negation or refusal or denial"
stereotype,n. a conventional or formulaic conception or image
boost,"n. the act of giving hope or support to someone
n. the act of giving a push
v. give a boost to; be beneficial to
v. increase or raise"
esteem,n. the condition of being honored (esteemed or respected or well regarded)
affirm,"v. to declare or affirm solemnly and formally as true
v. say yes to"
boast,"n. speaking of yourself in superlatives
v. show off"
deliberate,s. carefully thought out in advance
empirical,a. derived from experiment and observation rather than theory
false,"a. not in accordance with the fact or reality or actuality
s. arising from error
s. erroneous and usually accidental
s. deliberately deceptive"
flatter,v. praise somewhat dishonestly
genuine,"a. not fake or counterfeit
s. not pretended; sincerely felt or expressed"
identify,"v. recognize as being; establish the identity of someone or something
v. consider (oneself) as similar to somebody else
v. conceive of as united or associated
v. identify as in botany or biology, for example"
intuition,"n. instinctive knowing (without the use of rational processes)
n. an impression that something might be the case"
oversee,v. watch and direct
paradise,n. (Christianity) the abode of righteous souls after death
participant,n. someone who takes part in an activity
portray,"v. portray in words
v. make a portrait of
v. represent abstractly, for example in a painting, drawing, or sculpture"
profile,"n. an analysis (often in graphical form) representing the extent to which something exhibits various characteristics
n. an outline of something (especially a human face as seen from one side)
n. biographical sketch
n. a vertical section of the Earth's crust showing the different horizons or layers"
profound,"a. showing intellectual penetration or emotional depth
s. of the greatest intensity; complete
s. coming from deep within one
s. situated at or extending to great depth; too deep to have been sounded or plumbed"
recognition,"n. the state or quality of being recognized or acknowledged
n. the process of recognizing something or someone by remembering
n. approval
n. (biology) the ability of one molecule to attach to another molecule that has a complementary shape"
reflection,"n. the phenomenon of a propagating wave (light or sound) being thrown back from a surface
n. the image of something as reflected by a mirror (or other reflective material)
n. (mathematics) a transformation in which the direction of one axis is reversed
n. the ability to reflect beams or rays"
scale,"n. an ordered reference standard
n. relative magnitude
n. the ratio between the size of something and a representation of it
n. a specialized leaf or bract that protects a bud or catkin"
sense,"n. a general conscious awareness
n. the meaning of a word or expression; the way in which a word or expression or situation can be interpreted
n. the faculty through which the external world is apprehended
n. a natural appreciation or ability"
superiority,"n. the quality of being superior
n. the quality of being at a competitive advantage
n. displaying a sense of being better than others"
vain,"s characteristic of false pride; having an exaggerated sense of self-importance
s unproductive of success"
complain,"v. express complaints, discontent, displeasure, or unhappiness
v. make a formal accusation; bring a formal charge"
curse,"n. profane or obscene expression usually of surprise or anger
n. a severe affliction
v. utter obscenities or profanities
v. heap obscenities upon"
damn,"n. something of little value
s. used as expletives"
despise,v look down on with disdain
humiliate,v. cause to feel shame; hurt the pride of
insult,n. a deliberately offensive act or something producing the effect of deliberate disrespect
lash,"n. leather strip that forms the flexible part of a whip
v. lash or flick about sharply
v. bind with a rope, chain, or cord"
offend,"v cause to feel resentment or indignation
v act in disregard of laws, rules, contracts, or promises
v strike with disgust or revulsion
v hurt the feelings of"
reproach,"n. a mild rebuke or criticism
n. disgrace or shame
v. express criticism towards"
scold,n. someone (especially a woman) who annoys people by constantly finding fault
underestimate,"n. an estimation that is too low; an estimate that is less than the true or actual value
v. make too low an estimate of"
devoted,"s. zealous in devotion or affection
s. (followed by `to') dedicated exclusively to a purpose or use"
concertgoer,none
reply,n. the speech act of continuing a conversational exchange
recording,"n. a signal that encodes something (e.g., picture or sound) that has been recorded
n. the act of making a record (especially an audio record)
n. a storage device on which information (sounds or images) have been recorded"
substitute,"n. a person or thing that takes or can take the place of another
n. an athlete who plays only when a starter on the team is replaced
v. put in the place of another; switch seemingly equivalent items
v. be a substitute"
live,"v. lead a certain kind of life; live in a certain style
v. pursue a positive and satisfying existence
a. actually being performed at the time of hearing or viewing
a. exerting force or containing energy"
performance,"n. a dramatic or musical entertainment
n. the act of presenting a play or a piece of music or other entertainment
n. the act of performing; of doing something successfully; using knowledge as distinguished from merely possessing it
n. any recognized accomplishment"
miss the point,none
abnormal,"a. not normal; not typical or usual or regular or conforming to a norm
a. departing from the normal in e.g. intelligence and development
s. much greater than the normal"
accustomed,"a. (often followed by `to') in the habit of or adapted to
s. commonly used or practiced; usual"
activate,"v. make active or more active
v. make more adsorptive
v. aerate (sewage) so as to favor the growth of organisms that decompose organic matter
v. make (substances) radioactive"
announcement,"n. a formal public statement
n. a public statement containing information about an event that has happened or is going to happen"
artistic,"a. relating to or characteristic of art or artists
s. satisfying aesthetic standards and sensibilities"
art-loving,none
attract,"v. direct toward itself or oneself by means of some psychological power or physical attributes
v. be attractive to
v. exert a force on (a body) causing it to approach or prevent it from moving away"
audience,"n. a gathering of spectators or listeners at a (usually public) performance
n. the part of the general public interested in a source of information or entertainment"
availability,n the quality of being at hand when needed
boot up,none
brisk,"v. become brisk
s. very active"
classical music,none
comparatively,r in a relative manner; by comparison to something else
conductor,"n. the person who leads a musical group
n. a substance that readily conducts e.g. electricity and heat
n. the person who collects fares on a public conveyance
n. a device designed to transmit electricity, heat, etc."
description,"n. a statement that represents something in words
n. the act of describing something
n. sort or variety"
divine,"v. perceive intuitively or through some inexplicable perceptive powers
v. search by divining, as if with a rod
s. emanating from God
s. being or having the nature of a god; 'tis God-like to create""-J.G.Saxe"
ever since,none
favorable,"a. encouraging or approving or pleasing
a. (of winds or weather) tending to promote or facilitate
s. occurring at a convenient or suitable time"
favourable,"a encouraging or approving or pleasing
a (of winds or weather) tending to promote or facilitate
s occurring at a convenient or suitable time
s presaging or likely to bring good luck"
formidable,"s. extremely impressive in strength or excellence
s. inspiring fear"
hitherto,r used in negative statement to describe a situation that has existed up to this point or up to the present time
holy,a. belonging to or derived from or associated with a divine power
impressive,"a. making a strong or vivid impression
s. producing a strong effect"
instrumentalist,n someone who plays a musical instrument (as a profession)
interesting,a. arousing or holding the attention
invisible,a. impossible or nearly impossible to see; imperceptible by the eye
iTunes,none
listener,n someone who listens attentively
markedly,r. in a clearly noticeable manner
museum,n. a depository for collecting and displaying objects having scientific or historical or artistic value
music director,none
musician,"n. someone who plays a musical instrument (as a profession)
n. artist who composes or conducts music as a profession"
mysterious,s. having an import not apparent to the senses nor obvious to the intelligence; beyond ordinary understanding
novelty,n. originality by virtue of being new and surprising
opera house,none
orchestra,"n. a musical organization consisting of a group of instrumentalists including string players
n. seating on the main floor in a theater"
philharmonic,"a. composing or characteristic of an orchestral group
s. devoted to or appreciative of music"
quality,"n. an essential and distinguishing attribute of something or someone
n. a degree or grade of excellence or worth
n. a characteristic property that defines the apparent individual nature of something
n. high social status"
relay,"n. the act of passing something along from one person or group to another
n. a crew of workers who relieve another crew
n. a fresh team to relieve weary draft animals
n. a race between teams; each member runs or swims part of the distance"
retrospect,n. contemplation of things past
sober,"v. cause to become sober
a. not affected by a chemical substance (especially alcohol)"
solemn,"s dignified and somber in manner or character and committed to keeping promises
s characterized by a firm and humorless belief in the validity of your opinions"
troupe,n organization of performers and associated personnel (especially theatrical)
unpretentious,a. lacking pretension or affectation
vibrant,"s. vigorous and animated
s. of sounds that are strong and resonating
s. of colors that are bright and striking"
ant,n. social insect living in organized colonies; characteristically the males and fertile queen have wings during breeding season; wingless sterile females are the workers
predatory,s. living by preying on other animals especially by catching living prey
insect,n. small air-breathing arthropod
aphid,n. any of various small plant-sucking insects
spammer,n. someone who sends unwanted email (often in bulk)
inbox,none
abuse,"n. a rude expression intended to offend or hurt
v. use foul or abusive language towards
v. use wrongly or improperly or excessively"
acquire,"v. locate (a moving entity) by means of a tracking system such as radar
v. win something through one's efforts"
appear,"v. come into sight or view
v. be issued or published
v. seem to be true, probable, or apparent
v. come into being or existence, or appear on the scene"
astonish,v affect with wonder
chain,"n. a series of things depending on each other as if linked together
n. (chemistry) a series of linked atoms (generally in an organic molecule)
n. a series of (usually metal) rings or links fitted into one another to make a flexible ligament
n. (business) a number of similar establishments (stores or restaurants or banks or hotels or theaters) under one ownership"
clumsy,"s lacking grace in movement or posture
s not elegant or graceful in expression
s difficult to handle or manage especially because of shape
s showing lack of skill or aptitude"
commission,"n. a fee for services rendered based on a percentage of an amount received or collected or agreed to be paid (as distinguished from a salary)
n. the act of granting authority to undertake certain functions
n. the state of being in good working order and ready for operation
n. a formal statement of a command or injunction to do something"
compare,"v. examine and note the similarities or differences of
v. be comparable
v. consider or describe as similar, equal, or analogous
v. to form the comparative or superlative form on an adjective or adverb"
compete,v. compete for something; engage in a contest; measure oneself against others
competition,"n. a business relation in which two parties compete to gain customers
n. the act of competing as for profit or a prize"
consume,"v. serve oneself to, or consume regularly
v. spend extravagantly
v. destroy completely
v. use up (resources or materials)"
convert,"n. a person who has been converted to another religious or political belief
v. change from one system to another or to a new plan or policy
v. change the nature, purpose, or function of something
v. change religious beliefs, or adopt a religious belief"
current,"n. a flow of electricity through a conductor
n. a steady flow of a fluid (usually from natural causes)
a. occurring in or belonging to the present time"
dominate,"v. be in control
v. have dominance or the power to defeat over
v. look down on"
enemy,"n. an opposing military force
n. an armed adversary (especially a member of an opposing military force)
n. any hostile group of people"
giant,"n. any creature of exceptional size
n. an unusually large enterprise
n. a very large person; impressive in size or qualities
n. someone or something that is abnormally large and powerful"
guarantee,"n. a written assurance that some product or service will be provided or will meet certain specifications
n. an unconditional commitment that something will happen or that something is true
n. a collateral agreement to answer for the debt of another in case that person defaults
v. give surety or assume responsibility"
identity,"n. the distinct personality of an individual regarded as a persisting entity
n. the individual characteristics by which a thing or person is recognized or known
n. an operator that leaves unchanged the element on which it operates
n. exact sameness"
imbalance,n. a lack of balance or state of disequilibrium
incidentally,r. of a minor or subordinate nature
incorporate,"v. include or contain; have as a component
v. form a corporation
v. unite or merge with something already in existence
s. formed or united into a whole"
input,"n. a component of production; something that goes into the production of output
v. enter (data or a program) into a computer"
intricate,s. having many complexly arranged elements; elaborate
liable,"s. subject to legal action
s. (often followed by `to') likely to be affected with
s. held legally responsible"
notwithstanding,r despite anything to the contrary (usually following a concession)
pace,"n. the rate of moving (especially walking or running)
n. the relative speed of progress or change
n. a step in walking or running
v. walk with slow or fast paces"
prosperous,"s in fortunate circumstances financially; moderately rich
s very lively and profitable
s marked by peace and prosperity
s presaging or likely to bring good luck"
purchase,"n. the acquisition of something for payment
n. something acquired by purchase
n. a means of exerting influence or gaining advantage"
reciprocal,"n. something (a term or expression or concept) that has a reciprocal relation to something else
a. concerning each of two or more persons or things; especially given or done in return
s. of or relating to the multiplicative inverse of a quantity or function"
record,"n. anything (such as a document or a phonograph record or a photograph) providing permanent evidence of or information about past events
n. the number of wins versus losses and ties a team has had
n. the sum of recognized accomplishments
n. a compilation of the known facts regarding something or someone"
repay,"v pay back
v make repayment for or return something
v act or give recompense in recognition of someone's behavior or actions
v answer back"
replace,"v. substitute a person or thing for (another that is broken or inefficient or lost or no longer working or yielding what is expected)
v. put something back where it belongs"
resort,n. a hotel located in a resort area
reveal,v. disclose directly or through prophets
scheme,"n. an elaborate and systematic plan of action
v. form intrigues (for) in an underhand manner
v. devise a system or form a scheme for"
undertake,"v. enter upon an activity or enterprise
v. accept as a challenge
v. promise to do or accomplish
v. accept as a charge"
update,"n. news that updates your information
v. modernize or bring up to date
v. bring up to date; supply with recent information
v. bring to the latest state of technology"
utilize,v. convert (from an investment trust to a unit trust)
venture,"n. any venturesome undertaking especially one with an uncertain outcome
n. a commercial undertaking that risks a loss but promises a profit
v. proceed somewhere despite the risk of possible dangers
v. put at risk"
via,"n. A road way.
prep. By the way of; as, to send a letter via Queenstown to
   London."
virtual,"s. being actually such in almost every respect
s. existing in essence or effect though not in actual fact"
whatsoever,s one or some or every or all without specification
whip,"n. an instrument with a handle and a flexible lash that is used for whipping
n. a legislator appointed by the party to enforce discipline
n. a dessert made of sugar and stiffly beaten egg whites or cream and usually flavored with fruit
n. (golf) the flexibility of the shaft of a golf club"
continue,"v. continue a certain state, condition, or activity
v. continue talking
v. keep or maintain in unaltered condition; cause to remain or last
v. do something repeatedly and showing no intention to stop"
treat,"n. an occurrence that causes special pleasure or delight
v. interact in a certain way
v. provide treatment for
v. provide with a gift or entertainment"
wholly,r. to a complete degree or to the full or entire extent (`whole' is often used informally for `wholly')
control,"n. power to direct or determine
n. a relation of constraint of one entity (thing or person or group) by another
n. (physiology) regulation or maintenance of a function or action or reflex etc
n. the activity of managing or exerting control over something"
unleash,"v. release or vent
v. release from a leash
v. turn loose or free from restraint"
necessity,"n. the condition of being essential or indispensable
n. anything indispensable"
adverse,"s. contrary to your interests or welfare
s. in an opposing direction"
agency,"n. an administrative unit of government
n. a business that serves other businesses
n. the state of being in action or exerting power"
aggravate,"v make worse
v exasperate or irritate"
agony,"n. intense feelings of suffering; acute mental or physical pain
n. a state of acute pain"
annual,"n. (botany) a plant that completes its entire life cycle within the space of a year
n. a reference book that is published regularly once every year
a. completing its life cycle within a year
s. occurring or payable every year"
ash,"n. the residue that remains when something is burned
n. any of various deciduous pinnate-leaved ornamental or timber trees of the genus Fraxinus
n. strong elastic wood of any of various ash trees; used for furniture and tool handles and sporting goods such as baseball bats
v. convert into ashes"
attack,"n. (military) an offensive against an enemy (using weapons)
n. an offensive move in a sport or game
n. the act of attacking
n. a decisive manner of beginning a musical tone or phrase"
billion,"n. the number that is represented as a one followed by 12 zeros; in the United Kingdom the usage followed in the United States is frequently seen
n. the number that is represented as a one followed by 9 zeros
s. denoting a quantity consisting of one thousand million items or units in the United States
s. denoting a quantity consisting of one million million items or units in Great Britain"
blast,"n. a very long fly ball
n. an explosion (as of dynamite)
v. make a strident sound
v. use explosives on"
blaze,"n. a strong flame that burns brightly
n. a light-colored marking
v. shine brightly and intensively
v. burn brightly and intensely"
burst,"n. a sudden flurry of activity (often for no obvious reason)
v. come open suddenly and violently, as if from internal pressure
v. move suddenly, energetically, or violently
v. emerge suddenly"
casualty,"n. someone injured or killed or captured or missing in a military engagement
n. someone injured or killed in an accident
n. a decrease of military personnel or equipment"
catastrophe,"n. a state of extreme (usually irremediable) ruin and misfortune
n. a sudden violent change in the earth's surface"
clash,"n. a state of conflict between persons
n. a state of conflict between colors
v. be incompatible; be or come into conflict
v. disagree violently"
disperse,"v. to cause to separate and go in different directions
v. move away from each other; 
v. separate (light) into spectral rays"
dissipate,"v. live a life of pleasure, especially with respect to alcoholic consumption"
district,n. a region marked off for administrative or other purposes
ecology,"n. the environment as it relates to living organisms
n. the branch of biology concerned with the relations between organisms and their environment"
emergency,"n. a sudden unforeseen crisis (usually involving danger) that requires immediate action
n. a state in which martial law applies"
emission,"n. the act of emitting; causing to flow forth
n. the release of electrons from parent atoms
n. the occurrence of a flow of water (as from a pipe)"
emit,"v. expel (gases or odors)
v. give off, send forth, or discharge; as of light, heat, or radiation, vapor, etc."
enclosure,"n. a structure consisting of an area that has been enclosed for some purpose
n. the act of enclosing something inside something else
n. a naturally enclosed space
n. something (usually a supporting document) that is enclosed in an envelope with a covering letter"
evacuate,"v. move out of an unsafe location into safety
v. empty completely
v. move people from their homes or country
v. create a vacuum in (a bulb, flask, reaction vessel)"
expenditure,"n money paid out; an amount spent
n the act of spending money for goods or services
n the act of consuming something"
expense,"n. amounts paid for goods and services that may be currently tax deductible (as opposed to capital expenditures)
n. a detriment or sacrifice
n. money spent to perform work and usually reimbursed by an employer
v. reduce the estimated value of something"
explode,"v. cause to burst with a violent release of energy
v. burst outward, usually with noise
v. show a violent emotional reaction
v. be unleashed; emerge with violence or noise"
extinguish,"v. terminate, end, or take out"
fight,"n. the act of fighting; any contest or struggle
n. an intense verbal dispute
n. a boxing or wrestling match
v. fight against or resist strongly"
flame,"v. be in flames or aflame
v. criticize harshly, usually via an electronic medium"
frequency,"n. the number of occurrences within a given time period
n. the ratio of the number of observations in a statistical category to the total number of observations
n. the number of observations in a given statistical category"
heap,"v. bestow in large quantities
v. fill to overflow"
ignite,v. cause to start burning; subject to fire or great heat
incidence,"n. the relative frequency of occurrence of something
n. the striking of a light beam on a surface"
incident,"n. a single distinct event
n. a public disturbance
a. falling or striking of light rays on something"
inclusive,a. including much or everything; and especially including stated limits
leak,"n. an accidental hole that allows something (fluid or light etc.) to enter or escape
n. soft watery rot in fruits and vegetables caused by fungi
n. a euphemism for urination
n. unauthorized (especially deliberate) disclosure of confidential information"
magnify,"v. increase in size, volume or significance"
percentage,n. a proportion in relation to a whole (which is usually the amount per hundred)
pile,"n. a collection of objects laid on top of each other
n. a large sum of money (especially as pay or profit)
n. a column of wood or steel or concrete that is driven into the ground to provide support for a structure
n. the yarn (as in a rug or velvet or corduroy) that stands up from the weave"
precaution,"n. a precautionary measure warding off impending danger or damage or injury etc.
n. the trait of practicing caution in advance"
problem,"n. a state of difficulty that needs to be resolved
n. a question raised for consideration or solution"
quench,"v. satisfy (thirst)
v. electronics: suppress (sparking) when the current is cut off in an inductive circuit, or suppress (an oscillation or discharge) in a component or device
v. reduce the degree of (luminescence or phosphorescence) in (excited molecules or a material) by adding a suitable substance"
