genius,"n. someone who has exceptional intellectual ability and originality
n. exceptional creative ability"
hero,"n. a man distinguished by exceptional courage and nobility and strength
n. the principal character in a play or movie or novel or poem
n. Greek mathematician and inventor who devised a way to determine the area of a triangle and who described various mechanical devices (first century)
n. (classical mythology) a being of great strength and courage celebrated for bold exploits; often the offspring of a mortal and a god"
heroine,"n. the main good female character in a work of fiction
n. a woman possessing heroic qualities or a woman who has performed heroic deeds"
host,"n. a person who invites guests to a social event (such as a party in his or her own home) and who is responsible for them while they are there
n. an animal or plant that nourishes and supports a parasite; it does not benefit and is often harmed by the association
n. archaic terms for army
n. any organization that provides resources and facilities for a function or event"
inhabitant,n. a person who inhabits a particular place
interval,"n. a set containing all points (or all real numbers) between two given endpoints
n. the distance between things
n. the difference in pitch between two notes"
main plot,none
majesty,n impressiveness in scale or proportion
monologue,"n. a long utterance by one person (especially one that prevents others from participating in the conversation)
n. a (usually long) dramatic speech by a single actor"
opera,"n. a drama set to music; consists of singing with orchestral accompaniment and an orchestral overture and interludes
n. a commercial browser
n. a building where musical dramas are performed"
perform,"v. carry out or perform an action
v. perform a function
v. give a performance (of something)"
play,"n. a dramatic work intended for performance by actors on a stage
n. a theatrical performance of a drama
n. a preset plan of action in team sports
n. a state in which action is feasible"
playhouse,n. plaything consisting of a small model of a house that children can play inside of
poetry,"n. literature in metrical form
n. any communication resembling poetry in beauty or the evocation of feeling"
popular,"a. regarded with great favor, approval, or affection especially by the general public
s. carried on by or for the people (or citizens) at large
s. (of music or art) new and of general appeal (especially among young people)"
professional,"n. a person engaged in one of the learned professions
n. an athlete who plays for pay
a. engaged in a profession or engaging in as a profession or means of livelihood
a. of or relating to or suitable as a profession"
prosper,v make steady progress; be at the high point in one's career or reach a high point in historical significance or importance
puppet,"n. a small figure of a person operated from above with strings by a puppeteer
n. a doll with a hollow head of a person or animal and a cloth body; intended to fit over the hand and be manipulated with the fingers"
repertoire,"n. a collection of works (plays, songs, operas, ballets) that an artist or company can perform and do perform for short intervals on a regular schedule"
sarcastic,a. expressing or expressive of ridicule that wounds
script,"n. a written version of a play or other dramatic composition; used in preparing for a performance
n. a particular orthography or writing system
v. write a script for"
spot,"n. a short section or illustration (as between radio or tv programs or in a magazine) that is often used for advertising
n. a small contrasting part of something
n. a section of an entertainment that is assigned to a specific performer or performance
n. a business establishment for entertainment"
stage,"n. a large platform on which people can stand and can be seen by an audience
n. the theater as a profession (usually `the stage')
n. a section or portion of a journey or course
n. any scene regarded as a setting for exhibiting or doing something"
symbol,"n. an arbitrary sign (written or printed) that has acquired a conventional significance
n. something visible that by association or convention represents something else that is invisible"
theater,n. a building where theatrical performances or motion-picture shows can be presented
trace,"n. a just detectable amount
n. an indication that something has been present
n. either of two lines that connect a horse's harness to a wagon or other vehicle or to a whiffletree
n. a visible mark (as a footprint) left by the passage of person or animal or vehicle"
tragedy,n. drama in which the protagonist is overcome by some superior force or circumstance; excites terror or pity
tragic,"s. very sad; especially involving grief or death or destruction
a. of or relating to or characteristic of tragedy"
triumph,n. the exultation of victory
classic,"n. a creation of the highest excellence
n. an artist who has created classic works"
classical,"a. of or relating to the most highly developed stage of an earlier civilisation and its culture
a. of or relating to the study of the literary works of ancient Greece and Rome
s. (language) having the form used by ancient standard authors
s. of or pertaining to or characteristic of the ancient Greek and Roman cultures"
climax,"n. the highest point of anything conceived of as growing or developing or unfolding
n. the decisive moment in a novel or play
n. the most severe stage of a disease
n. arrangement of clauses in ascending order of forcefulness"
compile,v. use a computer program to translate source code written in a particular programming language into computer-readable machine code that can be executed
contemporary,"n. a person of nearly the same age as another
s. characteristic of the present
s. belonging to the present time"
fable,n. a short moral story (often with animal characters)
fairy,"n. a small being, human in form, playful and having magical powers"
fantastic,"s. extraordinarily good or great; used especially as intensifiers
s. fanciful and unrealistic; foolish
s. existing in fancy only
s. extravagantly fanciful in design, construction, appearance"
ghost,"n. a mental representation of some haunting experience
n. the visible disembodied soul of a dead person
v. move like a ghost
v. write for someone else"
hollow,"n. a cavity or space in something
n. a small valley between mountains
v. remove the interior of
a. not solid; having a space or gap or cavity"
legend,n. a story about mythical or supernatural beings or events
manuscript,"n. the form of a literary work submitted for publication
n. handwritten book or document"
masterpiece,"n. the most outstanding work of a creative artist or craftsman
n. an outstanding achievement"
medieval,"a. relating to or belonging to the Middle Ages
s. as if belonging to the Middle Ages; old-fashioned and unenlightened"
metaphor,n. a figure of speech in which an expression is used to refer to something that it does not literally denote in order to suggest a similarity
orthodox,"a. of or pertaining to or characteristic of Judaism
a. adhering to what is commonly accepted
a. of or relating to or characteristic of the Eastern Orthodox Church"
pirate,"n. someone who robs at sea or plunders the land from the sea without having a commission from any sovereign nation
n. a ship that is manned by pirates
v. copy illegally; of published material"
poet,n. a writer of poems (the term is usually reserved for writers of good poetry)
preface,"n a short introductory essay preceding the text of a book
v furnish with a preface or introduction"
renaissance,n. the period of European history at the close of the Middle Ages and the rise of the modern world; a cultural rebirth from the 14th through the middle of the 17th centuries
satire,n witty language used to convey insults or scorn
serial,"n. a serialized set of programs
a. pertaining to or composed in serial technique
a. pertaining to or occurring in or producing a series
s. of or relating to the sequential performance of multiple operations"
tale,"n a message that tells the particulars of an act or occurrence or course of events; presented in writing or drama or cinema or as a radio or television program
n a trivial lie"
verse,"n. a piece of poetry
n. a line of metrical text
v. compose verses or put into verse
v. familiarize through thorough study or experience"
vivid,s. having the clarity and freshness of immediate experience
loyal,a. steadfast in allegiance or duty
favor,"n. an act of gracious kindness
n. an advantage to the benefit of someone or something
n. an inclination to approve"
favour,"n a feeling of favorable regard
n an inclination to approve
n an advantage to the benefit of someone or something
n souvenir consisting of a small gift given to a guest at a party
n an act of gracious kindness
v treat gently or carefully
v bestow a privilege upon
v promote over another
v consider as the favorite"
sustain,"v. supply with necessities and support
v. admit as valid"
aggressive,"a. having or showing determination and energetic pursuit of your ends; positive in his convictions""
s. tending to spread quickly
s. characteristic of an enemy or one eager to fight"
blunder,n. an embarrassing mistake
cease,n. (`cease' is a noun only in the phrase `without cease') end
circular,"n. an advertisement (usually printed on a page or in a leaflet) intended for wide distribution
s. describing a circle; moving in a circle"
circulate,"v. cause to become widely known
v. cause be distributed
v. move through a space, circuit or system, returning to the starting point
v. cause to move in a circuit or system"
commonplace,"s. completely ordinary and unremarkable
s. not challenging; dull and lacking excitement"
compact,"n. a small cosmetics case with a mirror; to be carried in a woman's purse
n. a small and economical car
v. have the property of being packable or of compacting easily
a. closely and firmly united or packed together"
competitor,n the contestant you hope to defeat
counterpart,"n. a person or thing having the same function or characteristics as another
n. a duplicate copy"
decline,"n. change toward something smaller or lower
n. a condition inferior to an earlier condition; a gradual falling off from a better state
v. grow smaller
v. go down"
discontinue,"v. put an end to a state or an activity
v. come to or be at an end"
dwarf,"n. a person who is markedly small
n. a plant or animal that is atypically small
v. check the growth of"
edition,"n. the form in which a text (especially a printed book) is published
n. all of the identical copies of something offered to the public at the same time
n. an issue of a newspaper"
essentially,r in essence; at bottom or by one's (or its) very nature
exposure,"n. vulnerability to the elements; to the action of heat or cold or wind or rain; 
n. the act of subjecting someone to an influencing experience
n. the disclosure of something secret
n. aspect resulting from the direction a building or window faces"
foresighted,s planning prudently for the future
market,"n. the world of commercial activity where goods and services are bought and sold
n. the customers for a particular product or service
n. the securities markets in the aggregate
v. engage in the commercial promotion, sale, or distribution of"
newsprint,n cheap paper made from wood pulp and used for printing newspapers
nostalgia,n. longing for something past
overpay,v. pay too much
press,"n. the print media responsible for gathering and publishing news in the form of newspapers or magazines
n. a machine used for printing
n. clamp to prevent wooden rackets from warping when not in use
n. any machine that exerts pressure to form or shape or cut materials or extract liquids or compress solids"
print,"n. the text appearing in a book, newspaper, or other printed publication
n. a picture or design printed from an engraving
n. availability in printed form
n. a copy of a movie on film (especially a particular version of it)"
publish,"v. prepare and issue for public distribution or sale
v. have (one's written work) issued for publication"
resume,"v. take up or begin anew
v. return to a previous location or condition
v. assume anew"
situation,"n. the general state of things; the combination of circumstances at a given time
n. a condition or position in which you find yourself
n. a complex or critical or unusual difficulty"
subscribe,"v. offer to buy, as of stocks and shares
v. adopt as a belief
v. receive or obtain regularly"
transition,"n. a change from one place or state or subject or stage to another
n. a musical passage moving from one key to another
n. a passage that connects a topic to one that follows
v. cause to convert or undergo a transition"
tremendous,"s extraordinarily large in size or extent or amount or power or degree; that a whole civilization should be dependent on technology""- Walter Lippman
s extraordinarily good or great; used especially as intensifiers
s extreme in degree or extent or amount or impact"
assist,"n. (sports) the act of enabling another player to make a good play
v. act as an assistant in a subordinate or supportive function"
auxiliary,s. functioning in a supporting capacity
avail,"n. a means of serving
v. use to one's advantage
v. be of use to, be useful to
v. take or use"
endow,"v. give qualities or abilities to
v. furnish with an endowment"
facilitate,"v. make easier
v. increase the likelihood of (a response)"
salvation,"n. a means of preserving from harm or unpleasantness
n. the state of being saved or preserved from harm
n. saving someone or something from harm or from an unpleasant situation"
policymaker,none
refocus,"v. focus once again; The physicist refocused the light beam""
v. focus anew
v. put again into focus or focus more sharply"
effort,n. use of physical or mental energy; hard work
improve,"v to make better
v get better"
rather than,none
simply,r. absolutely; altogether; really
worry,"n. a strong feeling of anxiety
v. be worried, concerned, anxious, troubled, or uneasy
v. be concerned with
v. disturb the peace of mind of; afflict with mental agitation or distress"
GDP,n the measure of an economy adopted by the United States in 1991; the total market values of goods and services produced by workers and capital within a nation's borders during a given period (usually 1 year)
figure,"n. a diagram or picture illustrating textual material
n. a model of a bodily form (especially of a person)
n. a combination of points and lines and planes that form a visible palpable shape
n. an amount of money expressed numerically"
avoid,"v. stay clear from; keep away from; keep out of the way of someone or something
v. refrain from doing something"
forecasted,"v predict in advance
v judge to be probable
v indicate by signs"
doom,"n. an unpleasant or disastrous destiny
v. make certain of the failure or destruction of"
progress,"n. the act of moving forward (as toward a goal)
n. a movement forward
v. develop in a positive way"
anticipate,"v. act in advance of; deal with ahead of time
v. realize beforehand
v. be excited or anxious about
v. be a forerunner of or occur earlier than"
apt,"s. (usually followed by `to') naturally disposed toward
s. at risk of or subject to experiencing something usually unpleasant
s. mentally quick and resourceful"
foresee,"v realize beforehand
v picture to oneself; imagine possible
v act in advance of; deal with ahead of time"
foretell,"v foreshadow or presage
v make a prediction about; tell in advance
v indicate by signs"
imminent,s close in time; about to occur
promising,s. showing possibility of achievement or excellence
tend,"v. have a tendency or disposition to do or be something; be inclined
v. have care of or look after
v. manage or run"
disaster,n. an act that has disastrous consequences
disastrous,s (of events) having extremely unfortunate or dire consequences; bringing ruin
distress,"n. psychological suffering
n. a state of adversity (danger or affliction or need)
n. extreme physical pain
n. the seizure and holding of property as security for payment of a debt or satisfaction of a claim"
misfortune,"n. unnecessary and unforeseen trouble resulting from an unfortunate event
n. an unfortunate state resulting from unfavorable outcomes"
unfortunate,"n. a person who suffers misfortune
a. not favored by fortune; marked or accompanied by or resulting in ill fortune
s. unsuitable or regrettable"
blossom,v. develop or come to a promising stage
boom,"n. a deep prolonged loud noise
n. a state of economic prosperity
n. a sudden happening that brings good fortune (as a sudden opportunity to make money)
n. a pole carrying an overhead microphone projected over a film or tv set"
develop,"v. make something new, such as a product or a mental or artistic creation
v. gain through experience
v. be gradually disclosed or unfolded; become manifest; 
v. grow, progress, unfold, or evolve through a process of evolution, natural growth, differentiation, or a conducive environment"
grow,"v. become larger, greater, or bigger; expand or gain
v. increase in size by natural process
v. cause to grow or develop
v. cultivate by growing, often involving improvements by means of agricultural techniques"
progressive,"n. a tense of verbs used in describing action that is on-going
a. favoring or promoting progress
s. favoring or promoting reform (often by government action)
a. (of taxes) adjusted so that the rate increases as the amount of income increases"
appoint,"v. create and charge with a task or function
v. assign a duty, responsibility or obligation to
v. furnish"
ballot,"n. a document listing the alternatives that is used in voting
v. vote by ballot"
bureau,"n an administrative unit of government
n furniture with drawers for keeping clothes"
bureaucracy,"n. nonelective government officials
n. a government that is administered primarily by bureaus that are staffed with nonelective officials
n. any organization in which action is obstructed by insistence on unnecessary procedures and red tape"
committee,"n. a special group delegated to consider some matter
n. a self-constituted organization to promote something"
conference,"n. a prearranged meeting for consultation or exchange of information or discussion (especially one with a formal agenda)
n. a discussion among participants who have an agreed (serious) topic"
congress,"n. the legislature of the United States government
n. a meeting of elected or appointed representatives
n. a national legislative assembly"
denial,"n. the act of refusing to comply (as with a request)
n. the act of asserting that something alleged is not true
n. (psychiatry) a defense mechanism that denies painful thoughts"
eloquent,"s. expressing yourself readily, clearly, effectively"
ethnic,n. a person who is a member of an ethnic group
federation,"n. an organization formed by merging several groups or parties
n. the act of constituting a political unity out of a number of separate states or colonies or provinces so that each member retains the management of its internal affairs"
metropolitan,"n. in the Eastern Orthodox Church this title is given to a position between bishop and patriarch; equivalent to archbishop in western Christianity
n. a person who lives in a metropolis
a. relating to or characteristic of a metropolis"
municipal,"a. relating or belonging to or characteristic of a municipality
s. of or relating to the government of a municipality"
nominate,"v. propose as a candidate for some honor
v. put forward; nominate for appointment to an office or for an honor or position"
parliament,n. a legislative assembly in certain countries
predecessor,n. one who precedes you in time (as in holding a position or office)
premier,"v. be performed for the first time
v. perform a work for the first time
s. first in rank or degree
s. preceding all others in time"
preside,v. act as president
regulate,"v. fix or adjust the time, amount, degree, or rate of
v. bring into conformity with rules or principles or usage; impose regulations"
sanction,"n. formal and explicit approval
n. a mechanism of social control for enforcing a society's standards
n. the act of final authorization
v. give authority or permission to"
senate,n. assembly possessing high legislative powers
veto,"n. a vote that blocks a decision
n. the power or right to prohibit or reject a proposed or intended act (especially the power of a chief executive to reject a bill passed by the legislature)
v. vote against; refuse to endorse; refuse to assent"
indeed,"r. in truth (often tends to intensify)
r. (used as an interjection) an expression of surprise or skepticism or irony etc."
absurd,"n. a situation in which life seems irrational and meaningless
s. inconsistent with reason or logic or common sense
s. incongruous; inviting ridicule"
state,"n. the territory occupied by one of the constituent administrative districts of a nation
n. the way something is with respect to its main attributes
n. the group of people comprising the government of a sovereign state
n. a politically organized body of people under a single government"
involve,"v. connect closely and often incriminatingly
v. engage as a participant
v. contain as a part
v. occupy or engage the interest of"
fundamentally,r in essence; at bottom or by one's (or its) very nature
grassroots,"s. fundamental
s. of or involving the common people as constituting a fundamental political and economic group"
community,"n. a group of people living in a particular local area
n. common ownership
n. a group of nations having common interests
n. agreement as to goals"
association,"n. a formal organization of people or groups of people
n. the act of consorting with or joining with others
n. the state of being connected together as in memory or imagination
n. the process of bringing ideas or events together in memory or imagination"
attend,"v. be present at (meetings, church services, university), etc.
v. take charge of or deal with
v. to accompany as a circumstance or follow as a result
v. give heed (to)"
participate,v. share in something
abroad,"s. in a foreign country
r. to or in a foreign country"
accelerate,"v. move faster
v. cause to move faster"
bat,"n. nocturnal mouselike mammal with forelimbs modified to form membranous wings and anatomical adaptations for echolocation by which they navigate
n. (baseball) a turn trying to get a hit
n. a club used for hitting a ball in various games
v. strike with, or as if with a baseball bat"
bruise,"n. an injury that doesn't break the skin but results in some discoloration
v. injure the underlying soft tissue or bone of
v. break up into small pieces for food preparation
v. damage (plant tissue) by abrasion or pressure"
champion,"n. someone who has won first place in a competition
n. someone who fights for a cause
v. protect or fight for as a champion
s. holding first place in a contest"
commemorate,"v. mark by some ceremony or observation
v. call to remembrance; keep alive the memory of someone or something, as in a ceremony
v. be or provide a memorial to a person or an event"
couch,"n. a flat coat of paint or varnish used by artists as a primer
n. a narrow bed on which a patient lies during psychiatric or psychoanalytic treatment"
distance,"n. the property created by the space between two objects or points
n. a distant region
n. size of the gap between two places
n. indifference by personal withdrawal"
distant,"a. separated in space or coming from or going to a distance
a. far apart in relevance or relationship or kinship
s. separate or apart in time
s. located far away spatially"
dive,"n. a headlong plunge into water
n. a steep nose-down descent by an aircraft
v. drop steeply
v. plunge into water"
drift,"n. a force that moves something along
n. the gradual departure from an intended course due to external influences (as a ship or plane)
n. a process of linguistic change over a period of time
n. a large mass of material that is heaped up by the wind or by water currents"
elite,n. a group or class of persons enjoying superior intellectual or social or economic status
fence,"n. a barrier that serves to enclose an area
n. a dealer in stolen property
v. enclose with a fence
v. receive stolen goods"
gasp,n. a short labored intake of breath with the mouth open
gymnasium,n. athletic facility equipped for sports or physical training
helmet,"n. armor plate that protects the head
n. a protective headgear made of hard material to resist blows"
inspire,"v. heighten or intensify
v. supply the inspiration for"
intimidate,"v. make timid or fearful
v. to compel or deter by or as if by threats"
legacy,n (law) a gift of personal property by will
minute,"n. a unit of time equal to 60 seconds or 1/60th of an hour
n. a unit of angular distance equal to a 60th of a degree
n. a short note
s. characterized by painstaking care and detailed examination"
obesity,n more than average fatness
parachute,n. rescue equipment consisting of a device that fills with air and retards your fall
pedal,"n. a lever that is operated with the foot
v. operate the pedals on a keyboard instrument
a. of or relating to the feet"
phenomenon,"n. any state or process known through the senses rather than by intuition or reasoning
n. a remarkable development"
pledge,"n. a deposit of personal property as security for a debt
n. someone accepted for membership but not yet fully admitted to the group
n. a drink in honor of or to the health of a person or event
v. promise solemnly and formally"
population,"n. the people who inhabit a territory or state
n. a group of organisms of the same species inhabiting a given area
n. (statistics) the entire aggregation of items from which samples can be drawn
n. the number of inhabitants (either the total number or the number of a particular race or class) in a given place (country or city etc.)"
