beginning,"n. the event consisting of the start of something
n. the time at which something is supposed to begin
n. the first part or section of something
n. the place where something begins, where it springs into being"
attempt,n. earnest and conscientious activity intended to do or accomplish something
bewildering,"v be a mystery or bewildering to
v cause to be confused emotionally"
characterize,v. be characteristic of
commonality,n. sharing of common attributes
courtship,n. a man's courting of a woman; seeking the affections of a woman (usually with the hope of marriage)
dimension,"n. the magnitude of something in a particular direction (especially length or width or height)
n. one of three Cartesian coordinates that determine a position in space
v. indicate the dimensions on
v. shape or form to required dimensions"
enterprise,"n. a purposeful or industrious undertaking (especially one that requires effort or boldness)
n. an organization created for business ventures
n. readiness to embark on bold new ventures"
equation,"n. a mathematical statement that two expressions are equal
n. the act of regarding as equal"
evolutionary,a. of or relating to or produced by evolution
explicatory,a. Explicative.
filter,"n. device that removes something from whatever passes through it
n. an electrical device that alters the frequency spectrum of signals passing through it
v. remove by passing through a filter"
generative,"a. having the ability to produce or originate
s. producing new life or offspring"
impulse,n. the act of applying force suddenly
in the light of,none
independent,"a. free from external control and constraint
a. (of a clause) capable of standing syntactically alone as a complete sentence
s. not controlled by a party or interest group"
pattern,"n. a model considered worthy of imitation
v. form a pattern"
previous,"s. just preceding something else in time or order
s. too soon or too hasty"
quest,"n. the act of searching for something
v. make a search (for)
v. search the trail of (game)
v. seek alms, as for religious purposes"
simplification,"n. an explanation that omits superfluous details and reduces complexity
n. elimination of superfluous details"
tendency,"n. a characteristic likelihood of or natural disposition toward a certain condition or character or effect
n. a general direction in which something tends to move"
trait,n. a distinguishing feature of your personal nature
unfold,"v. open to the view
v. extend or stretch out to a greater or the full length
v. spread out or open from a closed or folded state"
unification,"n an occurrence that involves the production of a union
n the state of being joined or united or linked
n the act of making or becoming a single unit"
universal,"n. (linguistics) a grammatical rule (or other linguistic feature) that is found in all languages
n. (logic) a proposition that asserts something of all members of a class
n. a behavioral convention or pattern characteristic of all members of a particular culture or of all human beings
s. applicable to or common to all members of a group or set"
invalid,"n. someone who is incapacitated by a chronic illness or injury
v. force to retire, remove from active duty, as of firemen
a. having no cogency or legal force
s. no longer valid"
lame,n. a fabric interwoven with threads of metal
subjective,a. taking place within the mind and modified by individual bias
homogeneous,a. all of the same or similar kind or nature
identical,"s. exactly alike; incapable of being perceived as different
s. being the exact same one; not any other:
a. (of twins) derived from a single egg or ovum
s. having properties with uniform values along all axes"
reconcile,v. come to terms
resemblance,n. similarity in appearance or external or superficial details
processor,"n. a business engaged in processing agricultural products and preparing them for market
n. someone who processes things (foods or photographs or applicants etc.)"
addition,"n. a component that is added to something to improve it
n. the act of adding one thing to another
n. a quantity that is added
n. a suburban area laid out in streets and lots for a future residential area"
deletion,"n. (genetics) the loss or absence of one or more nucleotides from a chromosome
n. the omission that is made when an editorial change shortens a written passage
n. the act of deleting something written or printed"
paragraph,"n. one of several distinct subdivisions of a text intended to separate ideas; the beginning is usually marked by a new indented line
v. divide into paragraphs, as of text
v. write about in a paragraph
v. write paragraphs; work as a paragrapher"
keyboard,"n. device consisting of a set of keys on a piano or organ or typewriter or typesetting machine or computer or the like
n. holder consisting of an arrangement of hooks on which keys or locks can be hung"
command,"n. an authoritative direction or instruction to do something
n. a military unit or region under the control of a single officer
n. the power or authority to command
n. availability for use"
adequately,r. in an adequate manner or to an adequate degree
assemble,"v. create by putting components or members together
v. get people together"
certain,"s. definite but not specified or identified
a. having or feeling no doubt or uncertainty; confident and assured
a. established beyond doubt or question; definitely known
a. certain to occur; destined or inevitable"
clarify,"v. make clear and (more) comprehensible
v. make clear by removing impurities or solids, as by heating"
clip,"n. any of various small fasteners used to hold loose articles together
n. an article of jewelry that can be clipped onto a hat or dress
n. the act of clipping or snipping
n. a sharp slanting blow"
conduct,"v. direct the course of; manage or control
v. lead, as in the performance of a composition; Barenboim conducted the Chicago symphony for years""
v. lead musicians in the performance of"
copy,"n. a thing made to be similar or identical to another thing
n. matter to be printed; exclusive of graphical materials
n. material suitable for a journalistic account
v. copy down as is"
correction,"n. the act of offering an improvement to replace a mistake; setting right
n. a quantity that is added or subtracted in order to increase the accuracy of a scientific measure
n. something substituted for an error
n. a rebuke for making a mistake"
delete,v. remove or make invisible
draft,"n. a document ordering the payment of money; drawn by one person or bank on another
n. a current of air (usually coming into a chimney or room or vehicle)
n. a preliminary sketch of a design or picture
n. a serving of drink (usually alcoholic) drawn from a keg"
element,"n. the most favorable environment for a plant or animal
n. one of four substances thought in ancient and medieval cosmology to constitute the physical universe
n. the situation in which you are happiest and most effective
n. a straight line that generates a cylinder or cone"
flesh out,none
flexible,"a. capable of being changed
a. able to flex; able to bend easily
s. bending and snapping back readily without breaking"
grammatical,"a. of or pertaining to grammar
a. conforming to the rules of grammar or usage accepted by native speakers"
introductory,"s. serving to open or begin
s. serving as an introduction or preface"
margin,"n. the boundary line or the area immediately inside the boundary
n. an amount beyond the minimum necessary
n. the amount of collateral a customer deposits with a broker when borrowing from the broker to buy securities
n. the blank space that surrounds the text on a page"
printout,n. the output of a computer in printed form
punctuation,"n. something that makes repeated and regular interruptions or divisions
n. the marks used to clarify meaning by indicating separation of words into sentences and clauses and phrases
n. the use of certain marks to clarify meaning of written material by grouping words grammatically into sentences and clauses and phrases"
railroad,"v. supply with railroad lines
v. transport by railroad"
relevant,a. having a bearing on or connection with the subject at issue
revision,"n. the act of revising or altering (involving reconsideration and modification)
n. the act of rewriting something"
setting,"n. the context and environment in which something is set
n. the state of the environment in which a situation exists
n. the physical position of something"
smoothly,"r. with no problems or difficulties
r. in a smooth and diplomatic manner"
software,n. (computer science) written programs or procedures or rules and associated documentation pertaining to the operation of a computer system and that are stored in read/write memory
spelling,n. forming words with letters according to the principles underlying accepted usage
substantiate,"v. solidify, firm, or strengthen"
haul,"v. draw slowly or heavily
v. transport in a vehicle"
tow,"n. the act of hauling something (as a vehicle) by means of a hitch or rope
v. drag behind"
tug,"n. a sudden abrupt pull
v. pull hard
v. strive and make an effort to reach a goal
v. tow (a vessel) with a tug"
quiver,"n. case for holding arrows
v. shake with fast, tremulous movements"
shiver,"v. shake, as from cold"
sway,n. controlling influence
swing,"n. a state of steady vigorous action that is characteristic of an activity
n. mechanical device used as a plaything to support someone swinging back and forth
n. a sweeping blow or stroke
n. changing location by moving back and forth"
toss,"n. an abrupt movement
v. agitate"
tremble,"n. a reflex motion caused by cold or fear or excitement
v. move or jerk quickly and involuntarily up and down or sideways"
vibrate,"v. shake, quiver, or throb; move back and forth rapidly, usually in an uncontrolled manner"
pierce,"n. 14th President of the United States (1804-1869)
v. cut or make a way through
v. move or affect (a person's emotions or bodily feelings) deeply or sharply
v. sound sharply or shrilly"
pinch,"n. a painful or straitened circumstance
n. an injury resulting from getting some body part squeezed
n. a squeeze with the fingers
v. squeeze tightly between the fingers"
poke,"n. tall coarse perennial American herb having small white flowers followed by blackish-red berries on long drooping racemes; young fleshy stems are edible; berries and root are poisonous
v. stir by poking
v. make a hole by poking"
prick,"n. the act of puncturing with a small point
v. cause a stinging pain
v. to cause a sharp emotional pain"
scrape,"n. a harsh noise made by scraping
n. a deep bow with the foot drawn backwards (indicating excessive humility)
v. scratch repeatedly
v. make by scraping"
scratch,"n. a competitor who has withdrawn from competition
n. (golf) a handicap of zero strokes
n. an indication of damage
v. cut the surface of; wear away the surface of"
stab,"n. a strong blow with a knife or other sharp pointed instrument
v. stab or pierce"
sting,"n. a kind of pain; something as sudden and painful as being stung
n. a painful wound caused by the thrust of an insect's stinger into skin
v. deliver a sting to
v. cause an emotional pain, as if by stinging"
thrust,"n. verbal criticism
v. push forcefully
v. press or force
v. force (molten rock) into pre-existing rock"
genetically,r. by genetic mechanisms
lead,"n. an advantage held by a competitor in a race
n. a soft heavy toxic malleable metallic element; bluish white when freshly cut but tarnishes readily to dull grey
n. evidence pointing to a possible solution
n. a position of leadership (especially in the phrase `take the lead')"
conclude,"v. bring to a close
v. reach a conclusion after a discussion or deliberation
v. come to a close
v. reach agreement on"
memorize,v. commit to memory; learn by heart
cognitive,a. of or being or relating to or involving cognition
exercise,"n. the activity of exerting your muscles in various ways to keep fit
n. systematic training by multiple repetitions
n. a task performed or problem solved in order to develop skill or understanding
n. (usually plural) a ceremony that involves processions and speeches"
intuitive,"s. spontaneously derived from or prompted by a natural tendency
s. obtained through intuition rather than from reasoning or observation"
achiever,n. a person with a record of successes
astrological,a. relating to or concerned with astrology
ballet,"n. a theatrical representation of a story that is performed to music by trained dancers
n. music written for a ballet"
biographical,a of or relating to or being biography
certificate,"n. a document attesting to the truth of certain stated facts
v. present someone with a certificate
v. authorize by certificate"
commonly,r under normal conditions
concentrate,"n. a concentrated form of a foodstuff; the bulk is reduced by removing water
n. a concentrated example of something
v. make denser, stronger, or purer
v. direct one's attention on something"
confer,"v. have a conference in order to talk something over
v. present"
digit,"n. one of the elements that collectively form a system of numeration
n. a finger or toe in human beings or corresponding body part in other vertebrates"
encode,v. convert information into code
exhibit,"n. an object or statement produced before a court of law and referred to while giving evidence
v. show an attribute, property, knowledge, or skill"
mania,"n. an irrational but irresistible motive for a belief or action
n. a mood disorder; an affective disorder in which the victim tends to respond excessively and sometimes violently"
meaningfully,r. in a meaningful manner; so as to be meaningful
noteworthy,"s. worthy of notice
s. worthy of notice"
obtain,v. come into possession of
overrate,v make too high an estimate of
oxygen,n. a nonmetallic bivalent element that is normally a colorless odorless tasteless nonflammable diatomic gas; constitutes 21 percent of the atmosphere by volume; the most abundant element in the earth's crust
player,"n. a person who participates in or is skilled at some game
n. a person who pursues a number of different social and sexual partners simultaneously
n. an important participant (as in a business deal)"
practice,"n. a customary way of operation or behavior
n. translating an idea into action
n. the exercise of a profession
n. knowledge of how something is usually done"
programming,n. creating a sequence of instructions to enable the computer to do something
quirk,"n. a narrow groove beside a beading
v. twist or curve abruptly"
repeat,"n. an event that repeats
v. to say, state, or perform again
v. to say again or imitate
v. do over"
span,"n. the complete duration of something
n. the distance or interval between two points
n. a unit of length based on the width of the expanded human hand (usually taken as 9 inches)"
springtime,n the season of growth
startling,s. so remarkably different or sudden as to cause momentary shock or alarm
strongly,r. with strength or in a strong manner
swamp,"n. low land that is seasonally flooded; has more woody plants than a marsh and better drainage than a bog
n. a situation fraught with difficulties and imponderables
v. drench or submerge or be drenched or submerged"
switch,"n. control consisting of a mechanical or electrical or electronic device for making or breaking or changing the connections in a circuit
n. hairpiece consisting of a tress of false hair; used by women to give shape to a coiffure
n. railroad track having two movable rails and necessary connections; used to turn a train from one track to another or to store rolling stock
n. a flexible implement used as an instrument of punishment"
task,v. assign a task to
winter-born,none
youth,"n. the time of life between childhood and maturity
n. early maturity; the state of being young or immature or inexperienced
n. an early period of development
n. the freshness and vitality characteristic of a young person"
Congress,"n. the legislature of the United States government
n. a meeting of elected or appointed representatives
n. a national legislative assembly"
always,"r. at all times; all the time and on every occasion
r. at any time or in any event
r. forever; throughout all time"
envision,v. picture to oneself; imagine possible
joint,"n. (anatomy) the point of connection between two bones or elements of a skeleton (especially if it allows motion)
n. a disreputable place of entertainment
n. junction by which parts or objects are joined together
n. marijuana leaves rolled into a cigarette for smoking"
federal,"n. a member of the Union Army during the American Civil War
n. any federal law-enforcement officer
s. national; especially in reference to the government of the United States as distinct from that of its member units
a. of or relating to the central government of a federation"
immigration,"n. migration into a place (especially migration to a country of which you are not a native in order to settle there)
n. the body of immigrants arriving during a specified interval"
enforcement,n. the act of enforcing; ensuring observance of or obedience to
explicitly,r. in an explicit manner
officer,"n. a person authorized to serve in a position of authority on a vessel
v. direct or command as an officer"
cooperate,v work together on a common enterprise of project
colleague,"n. an associate that one works with
n. a person who is member of one's class or profession"
assert,"v. state categorically
v. insist on having one's opinions and rights recognized"
avenue,"n. a line of approach
n. a wide street or thoroughfare"
balance,"n. a state of equilibrium
n. equality between the totals of the credit and debit sides of an account
n. equality of distribution
n. the difference between the totals of the credit and debit sides of an account"
border,"n. a strip forming the outer edge of something
v. provide with a border or edge
v. lie adjacent to another or share a boundary"
census,"n. a periodic count of the population
v. conduct a census"
citizenship,"n. the status of a citizen with rights and duties
n. conduct as a citizen"
civilian,"n. a nonmilitary citizen
a. associated with civil life or performed by persons who are not active members of the military"
contest,"n. an occasion on which a winner is selected from among two or more contestants
n. a struggle between rivals
v. to make the subject of dispute, contention, or litigation"
controversial,a. marked by or capable of arousing controversy
decision,"n. the act of making up your mind about something
n. a position or opinion or judgment reached after consideration
n. (boxing) a victory won on points when no knockout has occurred
n. the outcome of a game or contest"
defense,"n. (military) military action or resources protecting a country against potential enemies
n. protection from harm
n. (sports) the team that is trying to prevent the other team from scoring"
deliberately,"r with intention; in an intentional manner
r in a deliberate unhurried manner"
disagree,"v. be of different opinions
v. be different from one another"
exclusively,r without any others being included or involved
existing,"s. presently existing
s. existing in something specified"
federal government,none
immigration law,none
in essence,none
intrude,"v. enter uninvited
v. search or inquire in a meddlesome way
v. thrust oneself in as if by force"
invalidate,"v. declare invalid
v. show to be invalid
v. take away the legal force of or render ineffective"
knock out,n. a blow that renders the opponent unconscious
majority,"n. the property resulting from being or relating to the greater in number of two parts; the main part
n. (elections) more than half of the votes
n. the age at which persons are considered competent to manage their own affairs"
matter,"n. a vaguely specified concern
n. that which has mass and occupies space
n. a problem
n. (used with negation) having consequence"
non-controversial,a not likely to arouse controversy
overturn,"n. an improbable and unexpected victory
v. turn from an upright or normal position
v. cause to overturn from an upright or normal position"
parallel,"n. (mathematics) one of a set of parallel geometric figures (parallel lines or planes)
v. be parallel to
v. make or place parallel to something
a. being everywhere equidistant and not intersecting"
police,n. the force of policemen and officers
precede,"v. come before
v. be the predecessor of
v. move ahead (of others) in time or space
v. furnish with a preface or introduction"
reject,"v. refuse to accept or acknowledge
v. reject with contempt
v. refuse entrance or membership"
robust,"a. sturdy and strong in form, constitution, or construction
s. strong enough to withstand or overcome intellectual challenges or adversity
s. rough and crude"
sedition,n. an illegal action inciting resistance to lawful authority and tending to cause the disruption or overthrow of the government
Supreme Court,none
the Trump Administration,none
the White House,none
vote,"n. a choice that is made by counting the number of people in favor of each alternative
n. the opinion of a group as determined by voting
n. a body of voters who have the same interests
n. the total number of voters who participated"
warrant,"n. a writ from a court commanding police to perform specified acts
n. a type of security issued by a corporation (usually together with a bond or preferred stock) that gives the holder the right to purchase a certain amount of common stock at a stated price"
minister,"n. a person appointed to a high office in the government
n. a diplomat representing one government to another; ranks below ambassador
n. the job of a head of a government department
v. attend to the wants and needs of others"
certainty,"n. the state of being certain
n. something that is certain"
register,"n. an official written record of names or events or transactions
n. (music) the timbre that is characteristic of a certain range and manner of production of the human voice or of different pipe organ stops or of different musical instruments
n. a book in which names and transactions are listed
n. (computer science) memory device that is the part of computer memory that has a specific address and that is used to hold information of a specific kind"
revenue,"n the entire amount of income before any deductions are made
n government income due to taxation"
amount,"n. the relative magnitude of something with reference to a criterion
v. be tantamount or equivalent to"
borrow,v. get temporarily
cap,"n. a tight-fitting headdress
n. a top (as for a bottle)
n. something serving as a cover or protection
n. a fruiting structure resembling an umbrella or a cone that forms the top of a stalked fleshy fungus such as a mushroom"
chancellor,"n. the person who is head of state (in several countries)
n. the honorary or titular head of a university"
charge,"n. an impetuous rush toward someone or something
n. (criminal law) a pleading describing some wrong or offense
n. the price charged for some article or service
n. the quantity of unbalanced electricity in a body (either positive or negative) and construed as an excess or deficiency of electrons"
climate,"n. the weather in some location averaged over some long period of time
n. the prevailing psychological state"
government,"n. the organization that is the governing authority of a political unit
n. the act of governing; exercising authority
n. (government) the system or form by which a community or other political unit is governed"
indication,"n. something that serves to indicate or suggest
n. the act of indicating or pointing out by name
n. (medicine) a reason to prescribe a drug or perform a procedure
n. something (as a course of action) that is indicated as expedient or necessary"
introduce,"v. cause to come to know personally
v. bring something new to an environment
v. bring in or establish in a new place or environment
v. bring before the public for the first time, as of an actor, song, etc."
mention,"n. a remark that calls attention to something or someone
n. an official recognition of merit
v. make reference to
v. commend"
prejudice,"v. disadvantage by prejudice
v. influence (somebody's) opinion in advance"
railway,n. line that is the commercial organization responsible for operating a system of transportation for trains that pull passengers or freight
rectify,"v. math: determine the length of
v. set straight or right
v. convert into direct current"
return,"n. a coming to or returning home
n. the occurrence of a change in direction back in the opposite direction
n. the act of going back to a prior location
n. the income or profit arising from such transactions as the sale of land or other property"
shove,"n. the act of shoving (giving a push to someone or something)
v. push roughly"
term,"n. a word or expression used for some particular thing
n. a limited period of time
n. any distinct quantity contained in a polynomial
n. one of the substantive phrases in a logical proposition"
urgent,s compelling immediate action
welcome,"n. the state of being welcome
n. a greeting or reception
v. accept gladly
v. bid welcome to; greet upon arrival"
cabinet,"n. a piece of furniture resembling a cupboard with doors and shelves and drawers; for storage or display
n. persons appointed by a head of state to head executive departments of government and act as official advisers
n. a storage compartment for clothes and valuables; usually it has a lock
n. housing for electronic instruments, as radio or television"
cellar,n. storage space where wines are stored
cozy,"s. enjoying or affording comforting warmth and shelter especially in a small space
s. having or fostering a warm or friendly and informal atmosphere
s. suggesting connivance"
cushion,"n. the layer of air that supports a hovercraft or similar vehicle
n. a soft bag filled with air or a mass of padding such as feathers or foam rubber etc.
v. protect from impact"
