leach,"n. the process of leaching
v. cause (a liquid) to leach or percolate
v. permeate or penetrate gradually"
lease,"n. property that is leased or rented out or let
n. a contract granting use or occupation of property during a specified time for a specified payment
n. the period of time during which a contract conveying property to a person is in effect
v. grant use or occupation of under a term of contract"
leaven,"n. a substance used to produce fermentation in dough or a liquid
n. an influence that works subtly to lighten or modify something"
leery,s. openly distrustful and unwilling to confide
legitimate,"v. show or affirm to be just and legitimate
v. make (an illegitimate child) legitimate; declare the legitimacy of (someone)
a. of marriages and offspring; recognized as lawful
s. based on known statements or events or conditions"
lessen,"v decrease in size, extent, or range
v make smaller
v wear off or die down"
lethal,s of an instrument of certain death
letup,n. a pause during which things are calm or activities are diminished
levy,"n. a charge imposed and collected
n. the act of drafting into military service
v. impose and collect"
liable,"s. subject to legal action
s. (often followed by `to') likely to be affected with
s. held legally responsible"
limestone,n. a sedimentary rock consisting mainly of calcium that was deposited by the remains of marine animals
linear,"a. designating or involving an equation whose terms are of the first degree
a. of or in or along or relating to a line; involving a single dimension
s. (of a leaf shape) long and narrow
s. measured lengthwise"
lipoprotein,n. a conjugated protein having a lipid component; the principal means for transporting lipids in the blood
liquidation,n. termination of a business operation by using its assets to discharge its liabilities
listlessness,n. inactivity resulting from lethargy and lack of vigor or energy
literacy,n. the ability to read and write
literally,"r. in a literal sense
r. (intensifier before a figurative expression) without exaggeration"
litigant,n. (law) a party to a lawsuit; someone involved in litigation
liver,"n. large and complicated reddish-brown glandular organ located in the upper right portion of the abdominal cavity; secretes bile and functions in metabolism of protein and carbohydrate and fat; synthesizes substances involved in the clotting of the blood; synthesizes vitamin A; detoxifies poisonous substances and breaks down worn-out erythrocytes
n. liver of an animal used as meat
n. a person who has a special life style
n. someone who lives in a place"
lizard,n. relatively long-bodied reptile with usually two pairs of legs and a tapering tail
loaf,n. a quantity of food (other than bread) formed in a particular shape
lobby,"n. the people who support some common cause or business or principle or sectional interest
n. a group of people who try actively to influence legislation
v. detain in conversation by or as if by holding on to the outer garments of; as for political or economic favors"
lobe,"n. (anatomy) a somewhat rounded subdivision of a bodily organ or part
n. (botany) a part into which a leaf is divided
n. the enhanced response of an antenna in a given direction as indicated by a loop in its radiation pattern
n. a rounded projection that is part of a larger structure"
lobster,"n. flesh of a lobster
n. any of several edible marine crustaceans of the families Homaridae and Nephropsidae and Palinuridae"
locomotion,"n. the power or ability to move
n. self-propelled movement"
lodge,"n. English physicist who studied electromagnetic radiation and was a pioneer of radiotelegraphy (1851-1940)
n. small house at the entrance to the grounds of a country mansion; usually occupied by a gatekeeper or gardener
n. a small (rustic) house used as a temporary shelter
n. any of various Native American dwellings"
logotype,n a company emblem or device
longevity,"n. duration of service
n. the property of being long-lived"
loom,"n. a textile machine for weaving yarn into a textile
v. come into view indistinctly, often threateningly
v. appear very large or occupy a commanding position
v. weave on a loom"
lore,n. knowledge gained through tradition or anecdote
lounge,"n. a room (as in a hotel or airport) with seating where people can wait
v. sit or recline comfortably"
lucrative,s. producing a sizeable profit
lumber,"n. the wood of trees cut and prepared for use as building material
v. move heavily or clumsily"
lump,v. put together indiscriminately
lunar,a. of or relating to or associated with the moon
lure,n. qualities that attract by seeming to promise some kind of reward
lymph,n. a thin coagulable fluid (similar to plasma but) containing white blood cells (lymphocytes) and chyle; is conveyed to the blood stream by lymphatic vessels
lysis,"n. recuperation in which the symptoms of an acute disease gradually subside
n. (biochemistry) dissolution or destruction of cells such as blood cells or bacteria"
magmatic,none
magnesium,n. a light silver-white ductile bivalent metallic element; in pure form it burns with brilliant white flame; occurs naturally only in combination (as in magnesite and dolomite and carnallite and spinel and olivine)
magnet,n. (physics) a device that attracts iron and produces a magnetic field
magnitude,"n. the property of relative size or extent (whether large or small)
n. relative importance"
mainstream,n. the prevailing current of thought
malaria,n. an infective disease caused by sporozoan parasites that are transmitted through the bite of an infected Anopheles mosquito; marked by paroxysms of chills and fever
maldistribution,none
malfunction,"n. a failure to function normally
v. fail to function or function improperly"
malleable,"s easily influenced
s capable of being shaped or bent or drawn out"
malpractice,"n. professional wrongdoing that results in injury or damage
n. a wrongful act that the actor had no right to do; improper professional conduct"
mammalian,a. of or relating to the class Mammalia
mandatory,"n the recipient of a mandate
n a territory surrendered by Turkey or Germany after World War I and put under the tutelage of some other European power until they are able to stand by themselves
s required by rule"
maneuver,"n. a military training exercise
n. a deliberate coordinated movement requiring dexterity and skill
n. a move made to gain a tactical end"
manic,s affected with or marked by frenzy or mania uncontrolled by reason
manipulate,"v. influence or control shrewdly or deviously
v. hold something in one's hands and move it
v. control (others or oneself) or influence skillfully, usually to one's advantage
v. treat manually, as with massage, for therapeutic purposed"
mannerism,"n a behavioral attribute that is distinctive and peculiar to an individual
n a deliberate pretense or exaggerated display"
mantle,"n. the cloak as a symbol of authority
n. United States baseball player (1931-1997)
n. the layer of the earth between the crust and the core
n. (zoology) a protective layer of epidermis in mollusks or brachiopods that secretes a substance forming the shell"
manual,"n. a small handbook
a. of or relating to the hands
a. requiring human effort
s. doing or requiring physical work"
manufacture,"v. put together out of artificial or natural components or parts; He manufactured a popular cereal""
v. produce naturally
v. create or produce in a mechanical way"
manumission,n. the formal act of freeing from slavery
manuscript,"n. the form of a literary work submitted for publication
n. handwritten book or document"
margin,"n. the boundary line or the area immediately inside the boundary
n. an amount beyond the minimum necessary
n. the amount of collateral a customer deposits with a broker when borrowing from the broker to buy securities
n. the blank space that surrounds the text on a page"
marital,a. of or relating to the state of marriage
marrow,"n. the fatty network of connective tissue that fills the cavities of bones
n. any of various squash plants grown for their elongated fruit with smooth dark green skin and whitish flesh
n. very tender and very nutritious tissue from marrowbones
n. large elongated squash with creamy to deep green skins"
marshy,s (of soil) soft and watery
martial,"n. Roman poet noted for epigrams (first century BC)
s. of or relating to the armed forces"
masculine,"n. a gender that refers chiefly (but not exclusively) to males or to objects classified as male
a. of grammatical gender
a. associated with men and not with women
s. (music or poetry) ending on an accented beat or syllable"
mass,"n. the property of a body that causes it to have weight in a gravitational field
n. an ill-structured collection of similar things (objects or people)
n. (Roman Catholic Church and Protestant Churches) the celebration of the Eucharist
n. a body of matter without definite shape"
mass-transit,none
materialistic,s. marked by materialism
maternal,"a. characteristic of a mother
a. relating to or derived from one's mother"
matrix,"n. (mathematics) a rectangular array of quantities or expressions set out by rows and columns; treated as a single element and manipulated according to rules
n. (geology) amass of fine-grained rock in which fossils, crystals, or gems are embedded
n. an enclosure within which something originates or develops (from the Latin for womb)
n. the body substance in which tissue cells are embedded"
maturation,n. coming to full development; becoming mature
mature,"v. develop and reach maturity; undergo maturation
v. develop and work out fully in one's mind
v. become due for repayment
a. characteristic of maturity"
maxim,"n. a saying that is widely accepted on its own merits
n. English inventor (born in the United States) who invented the Maxim gun that was used in World War I (1840-1916)"
measles,n. an acute and highly contagious viral disease marked by distinct red spots followed by a rash; occurs primarily in children
mechanism,"n. the atomic process that occurs during a chemical reaction
n. the technical aspects of doing something
n. a natural object resembling a machine in structure or function
n. (philosophy) the philosophical theory that all phenomena can be explained in terms of physical or biological causes"
median,"n. the value below which 50% of the cases fall
s. relating to or constituting the middle value of an ordered set of values (or the average of the middle two in a set with an even number of values)
s. relating to or situated in or extending toward the middle"
mediate,"v. occupy an intermediate or middle position or form a connecting link or stage between two others
a. acting through or dependent on an intervening agency"
medication,n. the act of treating with medicines or remedies
medieval,"a. relating to or belonging to the Middle Ages
s. as if belonging to the Middle Ages; old-fashioned and unenlightened"
medium,"n. a means or instrumentality for storing or communicating information
n. the surrounding environment
n. an intervening substance through which signals can travel as a means for communication
n. a liquid with which pigment is mixed by a painter"
megalithic,a. of or relating to megaliths or the people who erected megaliths
melancholy,"n. a feeling of thoughtful sadness
n. a constitutional tendency to be gloomy and depressed
s. characterized by or causing or expressing sadness"
membrane,"n. a thin pliable sheet of material
n. a pliable sheet of tissue that covers or lines or connects the organs or cells of animals or plants"
memoir,"n. an account of the author's personal experiences
n. an essay on a scientific or scholarly topic"
merchant,n. a businessperson engaged in retail trade
metabolic,"a. of or relating to metabolism
a. undergoing metamorphosis"
metaphor,n. a figure of speech in which an expression is used to refer to something that it does not literally denote in order to suggest a similarity
meteor,n. a streak of light in the sky at night that results when a meteoroid hits the earth's atmosphere and air friction causes the meteoroid to melt or vaporize or explode
meteorological,"a of or pertaining to atmospheric phenomena, especially weather and weather conditions"
methane,n. a colorless odorless gas used as a fuel
metric,a. based on the meter as a standard of measurement
microbe,n. a minute life form (especially a disease-causing bacterium); the term is not in technical use
microorganism,n. any organism of microscopic size
microscopic,"a. of or relating to or used in microscopy
s. visible under a microscope; using a microscope
s. extremely precise with great attention to details
s. so small as to be invisible without a microscope"
migraine,n. a severe recurring vascular headache; occurs more frequently in women than men
mileage,"n. distance measured in miles
n. the ratio of the number of miles traveled to the number of gallons of gasoline burned
n. a travel allowance at a given rate per mile traveled"
milieu,n. the environmental condition
militancy,n a militant aggressiveness
millennium,"n. a span of 1000 years
n. (New Testament) in Revelations it is foretold that those faithful to Jesus will reign with Jesus over the earth for a thousand years; the meaning of these words have been much debated; some denominations (e.g. Jehovah's Witnesses) expect it to be a thousand years of justice and peace and happiness
n. the 1000th anniversary (or the celebration of it)"
mimic,"n. someone who mimics (especially an actor or actress)
v. imitate (a person or manner), especially for satirical effect
s. constituting an imitation"
miniature,"n. painting or drawing included in a book (especially in illuminated medieval manuscripts)
n. a copy that reproduces a person or thing in greatly reduced size
s. being on a very small scale"
minimum,"n. the smallest possible quantity
n. the point on a curve where the tangent changes from negative on the left to positive on the right"
mint,"n. any north temperate plant of the genus Mentha with aromatic leaves and small mauve flowers
n. any member of the mint family of plants
n. the leaves of a mint plant used fresh or candied
n. a candy that is flavored with a mint oil"
minus,"a. on the negative side or lower end of a scale
s. involving disadvantage or harm"
minute,"n. a unit of time equal to 60 seconds or 1/60th of an hour
n. a unit of angular distance equal to a 60th of a degree
n. a short note
s. characterized by painstaking care and detailed examination"
mishap,n. an instance of misfortune
misinterpret,v. interpret falsely
misrepresent,v. represent falsely
missile,n. a rocket carrying a warhead of conventional or nuclear explosives; may be ballistic or directed by remote control
mitigate,v. make less severe or harsh
modem,n. (from a combination of MOdulate and DEModulate) electronic equipment consisting of a device used to connect computers by a telephone line
modest,"a. marked by simplicity; having a humble opinion of yourself
s. not large but sufficient in size or amount
s. free from pomp or affectation
a. not offensive to sexual mores in conduct or appearance"
mold,"n. container into which liquid is poured to create a given shape when it hardens
n. loose soil rich in organic matter
n. a fungus that produces a superficial growth on various kinds of damp or decaying organic matter"
mole,"n. spicy sauce often containing chocolate
n. a small congenital pigmented spot on the skin
n. small velvety-furred burrowing mammal having small eyes and fossorial forefeet"
molecule,n. (physics and chemistry) the simplest structural unit of an element or compound
molten,s. reduced to liquid form by heating
monarch,n. large migratory American butterfly having deep orange wings with black and white markings; the larvae feed on milkweed
monitor,"n. an ironclad vessel built by Federal forces to do battle with the Merrimac
n. display produced by a device that takes signals and displays them on a television screen or a computer monitor
n. electronic equipment that is used to check the quality or content of electronic transmissions
n. a piece of electronic equipment that keeps track of the operation of a system continuously and warns of trouble"
mononucleosis,n an acute disease characterized by fever and swollen lymph nodes and an abnormal increase of mononuclear leucocytes or monocytes in the bloodstream; not highly contagious; some believe it can be transmitted by kissing
monopoly,"n. (economics) a market in which there are many buyers but only one seller
n. exclusive control or possession of something
n. a board game in which players try to gain a monopoly on real estate as pieces advance around the board according to the throw of a die"
monsoon,"n. a seasonal wind in southern Asia; blows from the southwest (bringing rain) in summer and from the northeast in winter
n. rainy season in southern Asia when the southwestern monsoon blows, bringing heavy rains
n. any wind that changes direction with the seasons"
mooring,"n. a place where a craft can be made fast
n. (nautical) a line that holds an object (especially a boat) in place"
morale,n. a state of individual psychological well-being based upon a sense of confidence and usefulness and purpose
morphine,"n. an alkaloid narcotic drug extracted from opium; a powerful, habit-forming narcotic used to relieve pain"
mortality,n. the quality or state of being mortal
mortgage,"n. a conditional conveyance of property as security for the repayment of a loan
v. put up as security or collateral"
mosque,n. (Islam) a Muslim place of worship that usually has a minaret
mosquito,n. two-winged insect whose female has a long proboscis to pierce the skin and suck the blood of humans and animals
motion,"n. a change of position that does not entail a change of location
n. a state of change
n. a formal proposal for action made to a deliberative assembly for discussion and vote
n. the act of changing location from one place to another"
mound,"n. (baseball) the slight elevation on which the pitcher stands
n. structure consisting of an artificial heap or bank usually of earth or stones
v. form into a rounded elevation"
mount,"n. a mounting consisting of a piece of metal (as in a ring or other jewelry) that holds a gem in place
v. attach to a support
v. fix onto a backing, setting, or support
v. put up or launch"
mow,v. cut with a blade or mower
multicellular,s. consisting of many cells
multiple,"n. the product of a quantity by an integer
a. having or involving or consisting of more than one part or entity or individual"
multiply,"v. combine by multiplication
v. combine or increase by multiplication
r. in several ways; in a multiple manner"
multitude,"n. a large gathering of people
n. the common people generally"
municipal,"a. relating or belonging to or characteristic of a municipality
s. of or relating to the government of a municipality"
mural,"n. a painting that is applied to a wall surface
a. of or relating to walls"
mutation,"n. (genetics) any event that changes genetic structure; any alteration in the inherited nucleic acid sequence of the genotype of an organism
n. a change or alteration in form or qualities"
mutual,"s common to or shared by two or more parties
a concerning each of two or more persons or things; especially given or done in return"
mystic,"n. someone who believes in the existence of realities beyond human comprehension
a. relating to or resembling mysticism
a. relating to or characteristic of mysticism"
mythic,a. relating to or having the nature of myth
mythology,"n. myths collectively; the body of stories associated with a culture or institution or person
n. the study of myths"
naturalize,"v. make into a citizen
v. explain with reference to nature
v. adopt to another place"
navy,n. an organization of military vessels belonging to a country and available for sea warfare
nebula,"n. a medicinal liquid preparation intended for use in an atomizer
n. cloudiness of the urine
n. an immense cloud of gas (mainly hydrogen) and dust in interstellar space"
necessitate,"v. require as useful, just, or proper
v. cause to be a concomitant"
needy,"n. needy people collectively
s. demanding or needing attention, affection, or reassurance to an excessive degree"
negative,"n. a reply of denial
n. a piece of photographic film showing an image with light and shade or colors reversed
a. characterized by or displaying negation or denial or opposition or resistance; having no positive features
a. expressing or consisting of a negation or refusal or denial"
negligence,"n. failure to act with the prudence that a reasonable person would exercise under the same circumstances
n. the trait of neglecting responsibilities and lacking concern"
negotiate,"v. succeed in passing through, around, or over"
nematode,n. unsegmented worms with elongated rounded body pointed at both ends; mostly free-living but some are parasitic
neural,a. of or relating to neurons
neuron,n a cell that is specialized to conduct nerve impulses
neutral,"n. one who does not side with any party in a war or dispute
s. not supporting or favoring either side in a war, dispute, or contest
a. possessing no distinctive quality or characteristics
s. lacking distinguishing quality or characteristics"
neutron,n. an elementary particle with 0 charge and mass about equal to a proton; enters into the structure of the atomic nucleus
newlywed,n. someone recently married
nexus,n. a connected series or group
niche,"n. a position particularly well suited to the person who occupies it
n. (ecology) the status of an organism within its environment and community (affecting its survival as a species)"
nihilism,"n. a revolutionary doctrine that advocates destruction of the social system for its own sake
n. complete denial of all established authority and institutions"
nocturnal,"a. belonging to or active during the night
a. of or relating to or occurring in the night"
nomad,n. a member of a people who have no permanent home but move about according to the seasons
nominate,"v. propose as a candidate for some honor
v. put forward; nominate for appointment to an office or for an honor or position"
nonbiodegradable,none
noncommittal,s. refusing to bind oneself to a particular course of action or view or the like
nonessential,"n anything that is not essential
s not of prime or central importance"
nonstarter,n. a horse that fails to run in a race for which it has been entered
note,"n. a brief written record
n. a short personal letter
n. a notation representing the pitch and duration of a musical sound
n. a tone of voice that shows what the speaker is feeling"
notify,v inform (somebody) of something
notorious,s known widely and usually unfavorably; 
novel,"n. an extended fictional work in prose; usually in the form of a story
n. a printed and bound book that is an extended work of fiction
s. pleasantly new or different"
novice,n. someone new to a field or activity
noxious,a. injurious to physical or mental health
nuclear,"a. (weapons) deriving destructive energy from the release of atomic energy
a. of or relating to or constituting the nucleus of an atom
a. of or relating to or constituting the nucleus of a cell
s. constituting or like a nucleus"
nucleon,n. a constituent (proton or neutron) of an atomic nucleus
nucleotide,n. a phosphoric ester of a nucleoside; the basic structural unit of nucleic acids (DNA or RNA)
nucleus,"n. a part of the cell containing DNA and RNA and responsible for growth and reproduction
n. the positively charged dense center of an atom
n. (astronomy) the center of the head of a comet; consists of small solid particles of ice and frozen gas that vaporizes on approaching the sun to form the coma and tail
n. any histologically identifiable mass of neural cell bodies in the brain or spinal cord"
numerator,n. the dividend of a fraction
nutrition,"n. (physiology) the organic process of nourishing or being nourished; the processes by which an organism assimilates food and uses it for growth and maintenance
n. the scientific study of food and drink (especially in humans)"
oats,"n annual grass of Europe and North Africa; grains used as food and fodder (referred to primarily in the plural: `oats')
n seed of the annual grass Avena sativa (spoken of primarily in the plural as `oats')"
obese,s excessively fat
objective,"n. the lens or system of lenses in a telescope or microscope that is nearest the object being viewed
a. undistorted by emotion or personal bias; based on observable phenomena
a. serving as or indicating the object of a verb or of certain prepositions and used for certain other purposes
s. emphasizing or expressing things as perceived without distortion of personal feelings, insertion of fictional matter, or interpretation"
oblique,"n. any grammatical case other than the nominative
a. slanting or inclined in direction or course or position--neither parallel nor perpendicular nor right-angled"
obscure,"v. make less visible or unclear
v. make obscure or unclear
v. reduce a vowel to a neutral one, such as a schwa
v. make undecipherable or imperceptible by obscuring or concealing"
observatory,n. a building designed and equipped to observe astronomical phenomena
obsess,v. be preoccupied with something
obsolescence,n. the process of becoming obsolete; falling into disuse or becoming out of date
obstacle,"n. something immaterial that stands in the way and must be circumvented or surmounted
n. an obstruction that stands in the way (and must be removed or surmounted or circumvented)"
odd,"a. not divisible by two
s. not easily explained
s. an indefinite quantity more than that specified
s. of the remaining member of a pair, of socks e.g."
odometer,n. a meter that shows mileage traversed
odor,"n any property detected by the olfactory system
n the sensation that results when olfactory receptors in the nose are stimulated by particular chemicals in gaseous form"
