abdicate,"v. give up, such as power, as of monarchs and emperors, or duties and obligations"
abnormal,"a. not normal; not typical or usual or regular or conforming to a norm
a. departing from the normal in e.g. intelligence and development
s. much greater than the normal"
abolish,v. do away with
absenteeism,n. habitual absence from work
absorb,"v. become imbued
v. take up mentally
v. take up, as of debts or payments
v. take in, also metaphorically"
abstract,"v. consider a concept without thinking of a specific example; consider abstractly or theoretically
v. consider apart from a particular case or instance
v. give an abstract (of)
a. existing only in the mind; separated from embodiment"
absurd,"n. a situation in which life seems irrational and meaningless
s. inconsistent with reason or logic or common sense
s. incongruous; inviting ridicule"
abundant,a. present in great quantity
academic,"a. associated with academia or an academy
s. hypothetical or theoretical and not expected to produce an immediate or practical result
s. marked by a narrow focus on or display of learning especially its trivial aspects"
accelerate,"v. move faster
v. cause to move faster"
access,"n. the right to obtain or make use of or take advantage of something (as services or membership)
n. a way of entering or leaving
n. a code (a series of characters or digits) that must be entered in some way (typed or dialed or spoken) to get the use of something (a telephone line or a computer or a local area network etc.)
n. (computer science) the operation of reading or writing stored information"
accommodate,"v. provide with something desired or needed
v. have room for; hold without crowding
v. make (one thing) compatible with (another)"
accompaniment,"n. an event or situation that happens at the same time as or in connection with another
n. a musical part (vocal or instrumental) that supports or provides background for other musical parts"
accord,"n. concurrence of opinion
n. sympathetic compatibility
v. allow to have"
accordingly,r. in accordance with
accountant,n. someone who maintains and audits business accounts
accretion,"n. an increase by natural growth or addition
n. something contributing to growth or increase
n. (astronomy) the formation of a celestial object by the effect of gravity pulling together surrounding objects and gases"
accrue,"v. grow by addition
v. come into the possession of"
accumulate,v. collect or gather
accuracy,"n. the quality of being near to the true value
n. (mathematics) the number of significant figures given in a number"
accurate,"a. conforming exactly or almost exactly to fact or to a standard or performing with total accuracy
s. (of ideas, images, representations, expressions) characterized by perfect conformity to fact or truth; strictly correct"
accustomed,"a. (often followed by `to') in the habit of or adapted to
s. commonly used or practiced; usual"
acquire,"v. locate (a moving entity) by means of a tracking system such as radar
v. win something through one's efforts"
acreage,n. an area of ground used for some particular purpose (such as building or farming)
activate,"v. make active or more active
v. make more adsorptive
v. aerate (sewage) so as to favor the growth of organisms that decompose organic matter
v. make (substances) radioactive"
acute,"a. having or experiencing a rapid onset and short but severe course
s. extremely sharp or intense
s. having or demonstrating ability to recognize or draw fine distinctions
a. of an angle; less than 90 degrees"
adapt,"v. make fit for, or change to suit a new purpose"
addict,"n. someone who is so ardently devoted to something that it resembles an addiction
n. someone who is physiologically dependent on a substance; abrupt deprivation of the substance produces withdrawal symptoms
v. to cause (someone or oneself) to become dependent (on something, especially a narcotic drug)"
additive,"n. something added to enhance food or gasoline or paint or medicine
a. characterized or produced by addition"
adept,s. having or showing knowledge and skill and aptitude
adhere,"v. be compatible or in accordance with
v. follow through or carry out a plan without deviation
v. be a devoted follower or supporter
v. stick to firmly"
adjacent,"s. nearest in space or position; immediately adjoining without intervening space
s. having a common boundary or edge; abutting; touching; Massachusetts and Conncecticut""
s. near or close to but not necessarily touching"
adjust,"v. alter or regulate so as to achieve accuracy or conform to a standard
v. adapt or conform oneself to new or different conditions
v. make correspondent or conformable
v. decide how much is to be paid on an insurance claim"
administer,"v. work in an administrative capacity; supervise or be in charge of
v. perform (a church sacrament) ritually
v. give or apply (medications)
v. direct the taking of"
admit,"v. declare to be true or admit the existence or reality or truth of
v. allow to enter; grant entry to
v. allow participation in or the right to be part of; permit to exercise the rights, functions, and responsibilities of
v. afford possibility"
adolescent,"n. a juvenile between the onset of puberty and maturity
a. relating to or peculiar to or suggestive of an adolescent
s. being of the age 13 through 19
s. displaying or suggesting a lack of maturity"
adoption,"n. the act of accepting with approval; favorable reception
n. a legal proceeding that creates a parent-child relation between persons not related by blood; the adopted child is entitled to all privileges belonging to a natural child of the adoptive parents (including the right to inherit)"
advent,"n. arrival that has been awaited (especially of something momentous)
n. the season including the four Sundays preceding Christmas"
adverse,"s. contrary to your interests or welfare
s. in an opposing direction"
advocate,"n. a person who pleads for a cause or propounds an idea
n. a lawyer who pleads cases in court"
aerodynamic,a. of or relating to aerodynamics
affirmative,"n. a reply of affirmation
a. affirming or giving assent
s. expecting the best"
afflict,"v. cause great unhappiness for; distress
v. cause physical pain or suffering in"
affluent,"n. an affluent person; a person who is financially well off
s. having an abundant supply of money or possessions of value"
aftermath,n. the consequences of an event (especially a catastrophic event)
aggregate,"n. material such as sand or gravel used with cement and water to make concrete, mortar, or plaster
n. a sum total of many heterogenous things taken together
v. amount in the aggregate to
v. gather in a mass, sum, or whole"
aggression,"n. a disposition to behave aggressively
n. a feeling of hostility that arouses thoughts of attack
n. violent action that is hostile and usually unprovoked
n. the act of initiating hostilities"
agrarian,s. relating to rural matters
ailment,n. an often persistent bodily disorder or disease; a cause for complaining
ale,n. a general name for beer made with a top fermenting yeast; in some of the United States an ale is (by law) a brew of more than 4% alcohol by volume
alga,n. primitive chlorophyll-containing mainly aquatic eukaryotic organisms lacking true stems and roots and leaves
alien,"v. transfer property or ownership
s. not contained in or deriving from the essential nature of something
s. being or from or characteristic of another place or part of the world"
allay,"v lessen the intensity of or calm
v satisfy (thirst)"
allege,v. report or maintain
allegiance,n. the loyalty that citizens owe to their country (or subjects to their sovereign)
allergy,n. hypersensitivity reaction to a particular allergen; symptoms can vary greatly in intensity
alleviate,"v provide physical relief, as from pain
v make easier"
alligator,"n. leather made from alligator's hide
n. either of two amphibious reptiles related to crocodiles but with shorter broader snouts
v. crack and acquire the appearance of alligator hide, as from weathering or improper application; of paint and varnishes"
allocate,v. distribute according to a plan or set apart for a special purpose
allowance,"n. an amount allowed or granted (as during a given period)
n. a sum granted as reimbursement for expenses
n. an amount added or deducted on the basis of qualifying circumstances
n. a permissible difference; allowing some freedom to move within limits"
allude,v. make a more or less disguised reference to
alluvial,a. of or relating to alluvium
ally,"n. a friendly nation
n. an associate who provides cooperation or assistance
v. become an ally or associate, as by a treaty or marriage"
alpha,"n. the 1st letter of the Greek alphabet
n. the beginning of a series or sequence
s. first in order of importance"
alter,"v. make an alteration to
v. remove the ovaries of"
alternate,"v. go back and forth; swing back and forth between two states or conditions
v. exchange people temporarily to fulfill certain jobs and functions
v. do something in turns
s. every second one of a series"
altitude,"n. elevation especially above sea level or above the earth's surface
n. the perpendicular distance from the base of a geometric figure to the opposite vertex (or side if parallel)"
altruism,n. the quality of unselfish concern for the welfare of others
aluminum,n. a silvery ductile metallic element found primarily in bauxite
alumna,n a person who has received a degree from a school (high school or college or university)
alumnus,n. a person who has received a degree from a school (high school or college or university)
amalgam,"n. an alloy of mercury with another metal (usually silver) used by dentists to fill cavities in teeth; except for iron and platinum all metals dissolve in mercury and chemists refer to the resulting mercury mixtures as amalgams
n. a combination or blend of diverse things"
amass,"v collect or gather
v get or gather together"
amateur,"n. someone who pursues a study or sport as a pastime
n. an athlete who does not play for pay
s. engaged in as a pastime"
amber,"n. a deep yellow color
n. a hard yellowish to brownish translucent fossil resin; used for jewelry
s. of a medium to dark brownish yellow color"
ambiguity,"n. an expression whose meaning cannot be determined from its context
n. unclearness by virtue of having more than one meaning"
ambiguous,"a. having more than one possible meaning
s. having no intrinsic or objective meaning; not organized in conventional patterns"
ambivalent,s. uncertain or unable to decide about what course to follow
amenable,"s. disposed or willing to comply
s. readily reacting to suggestions and influences
s. open to being acted upon in a certain way"
amend,v. make amendments to
amenity,n pleasantness resulting from agreeable conditions
amino acid,none
ample,"a. more than enough in size or scope or capacity
s. affording an abundant supply
s. fairly large"
amplify,v. increase the volume of
amplitude,"n. (physics) the maximum displacement of a periodic wave
n. the property of copious abundance
n. greatness of magnitude"
anaerobic,"a. living or active in the absence of free oxygen
a. not aerobic"
analog,"n something having the property of being analogous to something else
a of a circuit or device having an output that is proportional to the input"
analogue,"n. something having the property of being analogous to something else
a. of a circuit or device having an output that is proportional to the input"
analogy,"n. an inference that if things agree in some respects they probably agree in others
n. drawing a comparison in order to show a similarity in some respect"
analytic,"a. using or subjected to a methodology using algebra and calculus
a. using or skilled in using analysis (i.e., separating a whole--intellectual or substantial--into its elemental parts or basic principles)
a. expressing a grammatical category by using two or more words rather than inflection"
analytical,"a using or skilled in using analysis (i.e., separating a whole--intellectual or substantial--into its elemental parts or basic principles)
a of a proposition that is necessarily true independent of fact or experience"
anatomy,"n. the branch of morphology that deals with the structure of animals
n. a detailed analysis"
ancestor,n. someone from whom you are descended (but usually more remote than a grandparent)
ancestry,n. inherited properties shared with others of your bloodline
anecdotal,a. having the character of an anecdote
anesthesia,n. loss of bodily sensation with or without loss of consciousness
animate,"v. give new life or energy to
a. belonging to the class of nouns that denote living beings
a. endowed with animal life as distinguished from plant life"
animosity,n. a feeling of ill will arousing active hostility
anole,n small arboreal tropical American insectivorous lizards with the ability to change skin color
anomaly,"n. deviation from the normal or common order or form or rule
n. a person who is unusual
n. (astronomy) position of a planet as defined by its angular distance from its perihelion (as observed from the sun)"
anonymous,"a. having no known name or identity or known source
s. not known or lacking marked individuality"
answerable,"s. capable of being answered
s. morally or legally responsible to a higher authority"
antagonism,"n. the relation between opposing principles or forces or factors
n. an actively expressed feeling of dislike and hostility
n. (biochemistry) interference in or inhibition of the physiological action of a chemical substance by another having a similar structure"
antedate,"v be earlier in time; go back further
v establish something as being earlier relative to something else"
anterior,"a. of or near the head end or toward the front plane of a body
s. earlier in time"
anthropologist,n. a social scientist who specializes in anthropology
antibiotic,"n. a chemical substance derivable from a mold or bacterium that can kill microorganisms and cure bacterial infections
a. of or relating to antibiotic drugs"
antibody,"n. any of a large variety of proteins normally present in the body or produced in response to an antigen which it neutralizes, thus producing an immune response"
anticipate,"v. act in advance of; deal with ahead of time
v. realize beforehand
v. be excited or anxious about
v. be a forerunner of or occur earlier than"
antifreeze,n. a liquid added to the water in a cooling system to lower its freezing point
antiquated,"v make obsolete or old-fashioned
v give an antique appearance to
s so extremely old as seeming to belong to an earlier period"
antique,"n. any piece of furniture or decorative object or the like produced in a former period and valuable because of its beauty or rarity
v. shop for antiques
v. give an antique appearance to
s. made in or typical of earlier times and valued for its age"
antiquity,"n. the historic period preceding the Middle Ages in Europe
n. an artifact surviving from the past"
antitrust,s of laws and regulations; designed to protect trade and commerce from unfair business practices
apiece,r to or from every one of two or more (considered individually)
apparatus,"n. equipment designed to serve a specific function
n. (anatomy) a group of body parts that work together to perform a given function"
apparel,n. clothing in general
apparent,"s. clearly revealed to the mind or the senses or judgment
s. appearing as such but not necessarily so"
appeal,"n. attractiveness that interests or pleases or stimulates
n. (law) a legal proceeding in which the appellant resorts to a higher court for the purpose of obtaining a review of a lower court decision and a reversal of the lower court's judgment or the granting of a new trial
v. take a court case to a higher court for review
v. request earnestly (something from somebody); ask for aid or protection"
appetite,n. a feeling of craving something
appliance,"n. a device or control that is very useful for a particular job
n. durable goods for home or office use"
applicable,s. capable of being applied; having relevance
appoint,"v. create and charge with a task or function
v. assign a duty, responsibility or obligation to
v. furnish"
apportion,"v distribute according to a plan or set apart for a special purpose
v give out as one's portion or share"
apprentice,"n. works for an expert to learn a trade
v. be or work as an apprentice"
approbation,"n. official approval
n. official recognition or approval"
appropriate,"v. take possession of by force, as after an invasion
a. suitable for a particular person or place or condition etc"
appropriation,"n. money set aside (as by a legislature) for a specific purpose
n. a deliberate act of acquisition of something, often without the permission of the owner"
approve,"v. give sanction to
v. judge to be right or commendable; think well of"
approximate,"v. be close or similar
s. not quite exact or correct
s. very close in resemblance
s. located close together"
aquarium,n. a tank or pool or bowl filled with water for keeping live fish and underwater animals
aquatic,"n. a plant that lives in or on water
a. relating to or consisting of or being in water
a. operating or living or growing in water"
arable,s. (of farmland) capable of being farmed productively
arbitrary,a. based on or subject to individual discretion or preference or sometimes impulse or caprice
arch,"n. a curved shape in the vertical plane that spans an opening
n. a curved bony structure supporting or enclosing organs (especially the inner sides of the feet)
n. a passageway under a curved masonry construction
n. (architecture) a masonry construction (usually curved) for spanning an opening and supporting the weight above it"
archaeology,n the branch of anthropology that studies prehistoric people and their cultures
archenemy,"n. A principal enemy. Specifically, Satan, the grand
   adversary of mankind."
architect,n. someone who creates plans to be used in making something (such as buildings)
ardent,"s. characterized by intense emotion
s. characterized by strong enthusiasm
s. glowing or shining like fire"
arid,"s. lacking sufficient water or rainfall
s. lacking vitality or spirit; lifeless"
aristocracy,"n a privileged class holding hereditary titles
n the most powerful members of a society"
arithmetic,n. the branch of pure mathematics dealing with the theory of numerical calculations
array,"n. an orderly arrangement
n. an impressive display
n. especially fine or decorative clothing
n. an arrangement of aerials spaced to give desired directional characteristics"
artery,"n. a blood vessel that carries blood from the heart to the body
n. a major thoroughfare that bears important traffic"
arthritis,n. inflammation of a joint or joints
articulate,"v. unite by forming a joint or joints
v. express or state clearly
a. expressing yourself easily or characterized by clear expressive language"
artifact,n. a man-made object taken as a whole
artificial,"a. contrived by art rather than nature
s. artificially formal
s. not arising from natural growth or characterized by vital processes"
artisan,n a skilled worker who practices some trade or handicraft
ascending,a. moving or going or growing upward
ascribe,v attribute or credit to
aspersion,"n. a disparaging remark
n. an abusive attack on a person's character or good name
n. the act of sprinkling water in baptism (rare)"
aspiration,"n. a will to succeed
n. a manner of articulation involving an audible release of breath"
assemble,"v. create by putting components or members together
v. get people together"
assert,"v. state categorically
v. insist on having one's opinions and rights recognized"
assess,"v. charge (a person or a property) with a payment, such as a tax or a fine
v. estimate the value of (property) for taxation"
asset,n. a useful or valuable quality
assign,"v. give out
v. select something or someone for a specific purpose
v. transfer one's right to
v. decide as to where something belongs in a scheme"
assume,"v. take to be the case or to be true; accept without verification or proof
v. take on titles, offices, duties, responsibilities
v. take on a certain form, attribute, or aspect
v. occupy or take on"
asthma,n. respiratory disorder characterized by wheezing; usually of allergic origin
astronomy,n. the branch of physics that studies celestial bodies and the universe as a whole
attain,"v to gain with effort
v reach a point in time, or a certain state or level
v find unexpectedly
v reach a destination, either real or abstract"
attorney,n a professional person authorized to practice law; conducts lawsuits or gives legal advice
attribute,n. an abstraction belonging to or characteristic of an entity
attrition,"n. sorrow for sin arising from fear of damnation
n. a wearing down to weaken or destroy
n. the act of rubbing together; wearing something down by friction"
auction,"n. a variety of bridge in which tricks made in excess of the contract are scored toward game; now generally superseded by contract bridge
n. the public sale of something to the highest bidder
v. sell at an auction"
audit,"n. a methodical examination or review of a condition or situation
v. examine carefully for accuracy with the intent of verification
v. attend academic courses without getting credit"
aura,"n. a sensation (as of a cold breeze or bright light) that precedes the onset of certain disorders such as a migraine attack or epileptic seizure
n. an indication of radiant light drawn around the head of a saint"
aurora,"n. an atmospheric phenomenon consisting of bands of light caused by charged solar particles following the earth's magnetic lines of force
n. (Roman mythology) goddess of the dawn; counterpart of Greek Eos"
austere,"s. severely simple
s. of a stern or strict bearing or demeanor; forbidding in aspect"
authenticate,v. establish the authenticity of something
authority,"n. the power or right to give orders or make decisions
n. (usually plural) persons who exercise (administrative) control over others
n. an expert whose views are taken as definitive
n. official permission or approval"
authorize,v. grant authorization or clearance for
automate,v make automatic or control or operate automatically
autonomy,"n. immunity from arbitrary exercise of authority: political independence
n. personal independence"
availability,n the quality of being at hand when needed
aversion,n. the act of turning yourself (or your gaze) away
aviator,n. someone who operates an aircraft
avidly,r. in an avid manner
backwater,"n. a body of water that was created by a flood or tide or by being held or forced back by a dam
n. a place or condition in which no development or progress is occurring"
bacterium,n (microbiology) single-celled or noncellular spherical or spiral or rod-shaped organisms lacking chlorophyll that reproduce by fission; important as pathogens and for biochemical properties; taxonomy is difficult; often considered to be plants
balcony,"n. an upper floor projecting from the rear over the main floor in an auditorium
n. a platform projecting from the wall of a building and surrounded by a balustrade or railing or parapet"
ballistic,a. relating to or characteristic of the motion of objects moving under their own momentum and the force of gravity
bankruptcy,"n. a state of complete lack of some abstract property
n. inability to discharge all your debts as they come due
n. a legal process intended to insure equality among the creditors of a corporation declared to be insolvent"
bar,"n. a counter where you can obtain food or drink
n. a rigid piece of metal or wood; usually used as a fastening or obstruction or weapon
n. an obstruction (usually metal) placed at the top of a goal
n. (meteorology) a unit of pressure equal to a million dynes per square centimeter"
bark,"n. tough protective covering of the woody stems and roots of trees and other woody plants
n. a noise resembling the bark of a dog
n. a sailing ship with 3 (or more) masts
n. the sound made by a dog"
barracks,"n a building or group of buildings used to house military personnel
v lodge in barracks
v spur on or encourage especially by cheers and shouts
v laugh at with contempt and derision"
barrel,"n. a tube through which a bullet travels when a gun is fired
n. a cylindrical container that holds liquids
n. a bulging cylindrical shape; hollow with flat ends
n. the quantity that a barrel (of any size) will hold"
barren,"n. an uninhabited wilderness that is worthless for cultivation
s. not bearing offspring
s. completely wanting or lacking"
barrier,"n. a structure or object that impedes free movement
n. any condition that makes it difficult to make progress or to achieve an objective
n. anything serving to maintain separation by obstructing vision or access"
battalion,"n. an army unit usually consisting of a headquarters and three or more companies
n. a large indefinite number"
bead,"n. a small ball with a hole through the middle
v. form into beads, as of water or sweat, for example
v. decorate by sewing beads onto
v. string together like beads"
beam,"n. long thick piece of wood or metal or concrete, etc., used in construction
n. a group of nearly parallel lines of electromagnetic radiation
n. a column of light (as from a beacon)
n. (nautical) breadth amidships"
bearer,n. a messenger who bears or presents
beckon,"v. signal with the hands or nod
v. appear inviting
v. summon with a wave, nod, or some other gesture"
beehive,"n. any workplace where people are very busy
n. a structure that provides a natural habitation for bees; as in a hollow tree
n. a hairdo resembling a beehive"
bellows,n. a mechanical device that blows a strong current of air; used to make a fire burn more fiercely or to sound a musical instrument
benchmark,"n. a standard by which something can be measured or judged
n. a surveyor's mark on a permanent object of predetermined position and elevation used as a reference point"
