specialize,"v. become more focus on an area of activity or field of study
v. suit to a special purpose
v. devote oneself to a special area of work"
species,"n. (biology) taxonomic group whose members can interbreed
n. a specific kind of something"
specific,"n. a medicine that has a mitigating effect on a specific disease
a. (sometimes followed by `to') applying to or characterized by or distinguishing something particular or special or unique
s. stated explicitly or in detail
a. relating to or distinguishing or constituting a taxonomic species"
specify,"v. decide upon or fix definitely
v. determine the essential quality of
v. be specific about"
specimen,"n. an example regarded as typical of its class
n. a bit of tissue or blood or urine that is taken for diagnostic purposes"
specious,s. plausible but false
spectacular,"n. a lavishly produced performance
s. characteristic of spectacles or drama"
spectator,n. a close observer; someone who looks at something (such as an exhibition of some kind)
specter,"n a mental representation of some haunting experience
n a ghostly appearing figure"
spectrum,"n. an ordered array of the components of an emission or wave
n. a broad range of related objects or values or qualities or ideas or activities"
speculate,"v. to believe especially on uncertain or tentative grounds
v. talk over conjecturally, or review in an idle or casual way and with an element of doubt or without sufficient reason to reach a conclusion
v. invest at a risk"
sphere,"n. a particular environment or walk of life
n. any spherically shaped artifact
n. the geographical area in which one nation is very influential
n. a solid figure bounded by a spherical surface (including the space it encloses)"
spiced,"v make more interesting or flavorful
v add herbs or spices to"
spin,"n. a swift whirling motion (usually of a missile)
n. the act of rotating rapidly
n. a short drive in a car
n. a distinctive interpretation (especially as used by politicians to sway public opinion)"
spine,"n. a small sharp-pointed tip resembling a spike on a stem or leaf
n. the part of a book's cover that encloses the inner side of the book's pages and that faces outward when the book is shelved
n. a sharp rigid animal process or appendage; as a porcupine quill or a ridge on a bone or a ray of a fish fin"
spiral,"n. a plane curve traced by a point circling about the center but at increasing distances from the center
n. a continuously accelerating change in the economy
n. ornament consisting of a curve on a plane that winds around a center with an increasing distance from the center
n. flying downward in a helical path with a large radius"
spiteful,s showing malicious ill will and a desire to hurt; motivated by spite
splinter,"n. a small thin sharp bit or wood or glass or metal
v. break up into splinters or slivers"
splotchy,a. Covered or marked with splotches.
sponsor,"v. assume sponsorship of
v. assume responsibility for or leadership of"
sporadically,r. in a sporadic manner
spouse,n. a person's partner in marriage
spray,"n. a pesticide in suspension or solution; intended for spraying
n. a quantity of small objects flying through the air
n. flower arrangement consisting of a single branch or shoot bearing flowers and foliage
n. water in small drops in the atmosphere; blown from waves or thrown up by a waterfall"
spring,"n. the season of growth
n. a metal elastic device that returns to its shape or position when pushed or pulled or pressed
n. a natural flow of ground water
n. a point at which water issues forth"
sprinkler,n. mechanical device that attaches to a garden hose for watering lawn or garden
spruce,"n. light soft moderately strong wood of spruce trees; used especially for timbers and millwork
n. any coniferous tree of the genus Picea"
spur,"n. any sharply pointed projection
n. tubular extension at the base of the corolla in some flowers
n. a sharp prod fixed to a rider's heel and used to urge a horse onward
v. incite or stimulate"
squash,"n. any of numerous annual trailing plants of the genus Cucurbita grown for their fleshy edible fruits
n. edible fruit of a squash plant; eaten as a vegetable
n. a game played in an enclosed court by two or four players who strike the ball with long-handled rackets
v. to compress with violence, out of natural shape or condition"
staggering,"v walk as if unable to control one's movements
v walk with great difficulty
v to arrange in a systematic order
v astound or overwhelm, as with shock
s so surprisingly impressive as to stun or overwhelm"
stake,"n. instrument of execution consisting of a vertical post that a victim is tied to for burning
n. the money risked on a gamble
n. a strong wooden or metal post with a point at one end so it can be driven into the ground
v. mark with a stake"
stamina,n. enduring strength and energy
stance,n. standing posture
staple,"n. a natural fiber (raw cotton, wool, hemp, flax) that can be twisted to form yarn
n. a short U-shaped wire nail for securing cables
n. paper fastener consisting of a short length of U-shaped wire that can fasten papers together
v. secure or fasten with a staple or staples"
startlingly,r. in a startling manner
static,"n. a crackling or hissing noise caused by electrical interference
n. angry criticism
s. showing little if any change"
stationary,"s. standing still
s. not capable of being moved"
statistic,n. a datum that can be represented numerically
stature,"n. high level of respect gained by impressive development or achievement
n. (of a standing person) the distance from head to foot"
status,n. the relative position or standing of things or especially persons in a society
status quo ante,none
statute,"n an act passed by a legislative body
s enacted by a legislative body"
stave,"n. one of several thin slats of wood forming the sides of a barrel or bucket
v. furnish with staves
v. burst or force (a hole) into something"
steep,"n. a steep place (as on a hill)
v. devote (oneself) fully to
v. let sit in a liquid to extract a flavor or to cleanse
a. having a sharp inclination"
steer,"v. direct the course; determine the direction of travelling
v. direct (oneself) somewhere"
stem,"n. the tube of a tobacco pipe
v. grow out of, have roots in, originate in
v. cause to point inward
v. stop the flow of a liquid"
steppe,n. extensive plain without trees (associated with eastern Russia and Siberia)
stereotype,n. a conventional or formulaic conception or image
sterile,"a. incapable of reproducing
s. deficient in originality or creativity; lacking powers of invention"
stew,"n. food prepared by stewing especially meat or fish with vegetables
v. bear a grudge; harbor ill feelings
v. cook slowly and for a long time in liquid"
stimulant,"n. a drug that temporarily quickens some vital process
s. that stimulates"
sting,"n. a kind of pain; something as sudden and painful as being stung
n. a painful wound caused by the thrust of an insect's stinger into skin
v. deliver a sting to
v. cause an emotional pain, as if by stinging"
stipend,n. a sum of money allotted on a regular basis; usually for some specific purpose
stipulate,"v. specify as a condition or requirement in a contract or agreement; make an express demand or provision in an agreement
v. give a guarantee or promise of
v. make an oral contract or agreement in the verbal form of question and answer that is necessary to give it legal force"
stitch,"n. a link or loop or knot made by an implement in knitting, crocheting, embroidery, or sewing
n. a sharp spasm of pain in the side resulting from running"
stock,"n. the capital raised by a corporation through the issue of shares entitling holders to an ownership interest (equity)
n. the merchandise that a shop has on hand
n. the handle of a handgun or the butt end of a rifle or shotgun or part of the support of a machine gun or artillery gun
n. the reputation and popularity a person has"
storefront,n the front side of a store facing the street; usually contains display windows
strain,"n. (physics) deformation of a physical body under the action of applied forces
n. (psychology) nervousness resulting from mental stress
n. injury to a muscle (often caused by overuse); results in swelling and pain
n. an intense or violent exertion"
strait,"n. a narrow channel of the sea joining two larger bodies of water
s. narrow"
strand,"n. a pattern forming a unity within a larger structural whole
n. line consisting of a complex of fibers or filaments that are twisted together to form a thread or a rope or a cable
n. a poetic term for a shore (as the area periodically covered and uncovered by the tides)
n. a street in west central London famous for its theaters and hotels"
strategy,n. the branch of military science dealing with military command and the planning and conduct of a war
stratosphere,n. the atmospheric layer between the troposphere and the mesosphere
strenuous,s. characterized by or performed with much energy or force
strife,n. bitter conflict; heated often violent dissension
string,"n. a lightweight cord
n. a tightly stretched cord of wire or gut, which makes sound when plucked, struck, or bowed
n. a sequentially ordered set of things or events or ideas in which each successive member is related to the preceding
n. a linear sequence of symbols (characters or words or phrases)"
stringent,s demanding strict attention to rules and procedures
strive,v. to exert much effort or energy
stroke,"n. (sports) the act of swinging or striking at a ball with a club or racket or bat or cue or hand
n. a sudden loss of consciousness resulting when the rupture or occlusion of a blood vessel leads to oxygen lack in the brain
n. a light touch
n. a light touch with the hands"
stroll,v. walk leisurely and with no apparent aim
strut,"n. a proud stiff pompous gait
n. brace consisting of a bar or rod used to resist longitudinal compression"
studious,s. marked by care and effort
stumble,"v. walk unsteadily
v. miss a step and fall or nearly fall
v. encounter by chance
v. make an error"
stun,"v. make senseless or dizzy by or as if by a blow
v. overcome as with astonishment or disbelief"
stunt,"n. a difficult or unusual or dangerous feat; usually done to gain attention
n. a creature (especially a whale) that has been prevented from attaining full growth
v. check the growth or development of
v. perform a stunt or stunts"
sturdy,s. substantially made or constructed
subject,"n. the subject matter of a conversation or discussion
n. something (a person or object or scene) selected by an artist or photographer for graphic representation
n. (grammar) one of the two main constituents of a sentence; the grammatical constituent about which something is predicated
n. a person who is subjected to experimental or other observational procedures; someone who is an object of investigation"
submarine,"n. a submersible warship usually armed with torpedoes
v. move forward or under in a sliding motion
v. throw with an underhand motion
v. bring down with a blow to the legs"
submit,"v. refer for judgment or consideration
v. put before
v. yield to the control of another
v. yield to another's wish or opinion"
subordinate,"n. an assistant subject to the authority or control of another
v. rank or order as less important or consider of less value
v. make subordinate, dependent, or subservient
a. lower in rank or importance"
subscribe,"v. offer to buy, as of stocks and shares
v. adopt as a belief
v. receive or obtain regularly"
subsequent,a. following in time or order
subsidiary,"n an assistant subject to the authority or control of another
n a company that is completely controlled by another company
s functioning in a supporting capacity"
subsidize,"v. support through subsidies
v. secure the assistance of by granting a subsidy, as of nations or military forces"
subsidy,n. a grant paid by a government to an enterprise that benefits the public
subsistence,"n. minimal (or marginal) resources for subsisting
n. a means of surviving
n. the state of existing in reality; having substance"
substance,"n. the real physical matter of which a person or thing consists
n. material of a particular kind or constitution
n. a particular kind or species of matter with uniform properties"
substantial,"s. having a firm basis in reality and being therefore important, meaningful, or considerable
a. having substance or capable of being treated as fact; not imaginary"
substantiate,"v. solidify, firm, or strengthen"
substitute,"n. a person or thing that takes or can take the place of another
n. an athlete who plays only when a starter on the team is replaced
v. put in the place of another; switch seemingly equivalent items
v. be a substitute"
substrate,"n. the substance that is acted upon by an enzyme or ferment
n. a surface on which an organism grows or is attached
n. any stratum or layer lying underneath another"
subtle,s. able to make fine distinctions
subtract,"v. make a subtraction
v. take off or away"
succession,"n. a group of people or things arranged or following in order
n. the action of following in order
n. (ecology) the gradual and orderly process of change in an ecosystem brought about by the progressive replacement of one community by another until a stable climax is established
n. acquisition of property by descent or by will"
sue,n. French writer whose novels described the sordid side of city life (1804-1857)
summit,"n. a meeting of heads of governments
v. reach the summit (of a mountain)"
superb,s. surpassingly good
superficial,"a. concerned with or comprehending only what is apparent or obvious; not deep or penetrating emotionally or intellectually
a. of, affecting, or being on or near the surface
s. of little substance or significance"
superior,"n. one of greater rank or station or quality
n. the head of a religious community
n. a town in northwest Wisconsin on Lake Superior across from Duluth
a. of high or superior quality or performance"
supernova,n. a star that explodes and becomes extremely luminous in the process
supersede,v take the place or move into the position of
supplement,"n. a quantity added (e.g. to make up for a deficiency)
v. add as a supplement to what seems insufficient
v. serve as a supplement to"
suppress,"v. to put down by force or authority
v. put out of one's consciousness
v. reduce the incidence or severity of or stop"
supreme,"s. final or last in your life or progress
s. highest in excellence or achievement
s. greatest or maximal in degree; extreme"
surcharge,"n. an additional charge (as for items previously omitted or as a penalty for failure to exercise common caution or common skill)
v. charge an extra fee, as for a special service
v. fill to capacity with people
v. print a new denomination on a stamp or a banknote"
surge,"n. a sudden or abrupt strong increase
v. see one's performance improve"
surgeon,n. a physician who specializes in surgery
surpass,v. be or do something to a greater degree
surplus,"n a quantity much larger than is needed
s more than is needed, desired, or required"
survey,"n. a detailed critical inspection
v. consider in a comprehensive way
v. look over carefully or inspect
v. make a survey of; for statistical purposes"
susceptible,"a. (often followed by `of' or `to') yielding readily to or capable of
s. easily impressed emotionally"
suspect,"n. someone who is under suspicion
v. imagine to be the case or true or probable
v. hold in suspicion; believe to be guilty"
suspicion,"n. the state of being suspected
n. being of a suspicious nature"
sustain,"v. supply with necessities and support
v. admit as valid"
sustenance,n. the act of sustaining life by food or providing a means of subsistence
swiftly,r. in a swift manner
symbiotic,s. used of organisms (especially of different species) living together but not necessarily in a relation beneficial to each
sympathetic,"a. of or relating to the sympathetic nervous system
a. expressing or feeling or resulting from sympathy or compassion or friendly fellow feelings; disposed toward
a. (of characters in literature or drama) evoking empathic or sympathetic feelings
s. having similar disposition and tastes"
symptom,"n. (medicine) any sensation or change in bodily function that is experienced by a patient and is associated with a particular disease
n. anything that accompanies X and is regarded as an indication of X's existence"
synthesis,"n. the process of producing a chemical compound (usually by the union of simpler chemical compounds)
n. the combination of ideas into a complex whole"
taboo,"n. a prejudice (especially in Polynesia and other South Pacific islands) that prohibits the use or mention of something because of its sacred nature
n. an inhibition or ban resulting from social custom or emotional aversion
v. declare as sacred and forbidden
s. forbidden to profane use especially in South Pacific islands"
tactic,n. a plan for attaining a particular goal
tactile,s. producing a sensation of touch
takeover,n. a change by sale or merger in the controlling interest of a corporation
tangible,"a. perceptible by the senses especially the sense of touch
a. (of especially business assets) having physical substance and intrinsic monetary value"
tariff,v. charge a tariff
teem,"v. be teeming, be abuzz"
temblor,n shaking and vibration at the surface of the earth resulting from underground movement along a fault plane of from volcanic activity
temperance,"n. the trait of avoiding excesses
n. the act of tempering"
temperate,"a. (of weather or climate) free from extremes; mild; or characteristic of such weather or climate
a. not extreme in behavior"
temporary,"n a worker (especially in an office) hired on a temporary basis
a not permanent; not lasting
s lacking continuity or regularity"
tempt,"v. dispose or incline or entice to
v. give rise to a desire by being attractive or inviting
v. try to seduce
v. try presumptuously"
tenant,"n. someone who pays rent to use land or a building or a car that is owned by someone else
n. a holder of buildings or lands by any kind of title (as ownership or lease)
n. any occupant who dwells in a place
v. occupy as a tenant"
tenet,n a religious doctrine that is proclaimed as true without proof
tentative,"s under terms not final or fully worked out or agreed upon
s unsettled in mind or opinion"
tenure,"n. the term during which some position is held
n. the right to hold property; part of an ancient hierarchical system of holding lands
v. give life-time employment to"
terminate,"v bring to an end or halt
v have an end, in a temporal, spatial, or quantitative sense; either spatial or metaphorical
v be the end of; be the last or concluding part of
v terminate the employment of; discharge from an office or position"
terminology,n. a system of words used to name things in a particular discipline
termite,n. whitish soft-bodied ant-like social insect that feeds on wood
terrain,n. a piece of ground having specific characteristics or military potential
territory,"n. an area of knowledge or interest
n. the geographical area under the jurisdiction of a sovereign state"
testify,"v. give testimony in a court of law
v. provide evidence for"
testimony,"n. a solemn statement made under oath
n. an assertion offering firsthand authentication of a fact
n. something that serves as evidence"
theme,"n. a unifying idea that is a recurrent element in literary or artistic work
n. (music) melodic subject of a musical composition
v. provide with a particular theme or motive"
theophylline,n. a colorless crystalline alkaloid derived from tea leaves or made synthetically; used in medicine as a bronchial dilator
therapy,n. (medicine) the act of caring for someone (as by medication or remedial training etc.)
thereafter,r. from that time on
thermal,"n. rising current of warm air
a. relating to or associated with heat
a. of or relating to a hot spring
s. caused by or designed to retain heat"
threshold,"n. the starting point for a new state or experience
n. the smallest detectable sensation"
thrive,v. make steady progress; be at the high point in one's career or reach a high point in historical significance or importance
throne,"n. the chair of state for a monarch, bishop, etc.
n. the position and power of an exalted person (a sovereign or bishop) who is entitled to sit in a chair of state on ceremonial occasions
v. sit on the throne as a ruler"
tile,"n. a flat thin rectangular slab (as of fired clay or rubber or linoleum) used to cover surfaces
n. a thin flat slab of fired clay used for roofing
n. game equipment consisting of a flat thin piece marked with characters and used in board games like Mah-Jong, Scrabble, etc.
v. cover with tiles"
timber,"n. a beam made of wood
n. a post made of wood"
tissue,"n. part of an organism consisting of an aggregate of cells having a similar structure and function
n. a soft thin (usually translucent) paper"
toxic,a. of or relating to or caused by a toxin or poison
toxin,n. a poisonous substance produced during the metabolism and growth of certain microorganisms and some higher plant and animal species
tract,"n. an extended area of land
n. a system of body parts that together serve some particular purpose
n. a brief treatise on a subject of interest; published in the form of a booklet"
tragedy,n. drama in which the protagonist is overcome by some superior force or circumstance; excites terror or pity
trait,n. a distinguishing feature of your personal nature
transatlantic,a. crossing the Atlantic Ocean
transfer,"n. someone who transfers or is transferred from one position to another
n. the act of transfering something from one form to another
n. a ticket that allows a passenger to change conveyances
n. application of a skill learned in one situation to a different but similar situation"
transform,"v. subject to a mathematical transformation
v. change or alter in form, appearance, or nature
v. change in outward structure or looks
v. convert (one form of energy) to another"
transit,"v. make a passage or journey from one place to another
v. pass across (a sign or house of the zodiac) or pass across (the disk of a celestial body or the meridian of a place)
v. revolve (the telescope of a surveying transit) about its horizontal transverse axis in order to reverse its direction
v. cause or enable to pass through"
transmit,v. send from one person or place to another
transplant,"n. an operation moving an organ from one organism (the donor) to another (the recipient)
n. the act of removing something from one location and introducing it in another location
v. lift and reset in another soil or situation
v. be transplantable"
transport,"n. an exchange of molecules (and their kinetic energy and momentum) across the boundary between adjacent layers of a fluid or across cell membranes
v. move something or somebody around; usually over long distances
v. move while supporting, either in a vehicle or in one's hands or on one's body
v. transport commercially"
treasury,"n. the funds of a government or institution or individual
n. the government department responsible for collecting and managing and spending public revenues
n. negotiable debt obligations of the United States government which guarantees that interest and principal payments will be paid on time
n. the British cabinet minister responsible for economic strategy"
treaty,n. a written agreement between two states or sovereigns
tremendous,"s extraordinarily large in size or extent or amount or power or degree; that a whole civilization should be dependent on technology""- Walter Lippman
s extraordinarily good or great; used especially as intensifiers
s extreme in degree or extent or amount or impact"
trench,"n. a ditch dug as a fortification having a parapet of the excavated earth
n. a long steep-sided depression in the ocean floor
n. any long ditch cut in the ground
v. fortify by surrounding with trenches"
triangle,"n. a three-sided polygon
n. something approximating the shape of a triangle
n. any of various triangular drafting instruments used to draw straight lines at specified angles
n. a percussion instrument consisting of a metal bar bent in the shape of an open triangle"
tribal,a. relating to or characteristic of a tribe
tribute,"n. something given or done as an expression of esteem
n. payment by one nation for protection by another"
trigger,"n. a device that activates or releases or causes something to happen
n. an act that sets in motion some course of events
v. release or pull the trigger on"
triple,"n. a base hit at which the batter stops safely at third base
n. a quantity that is three times as great as another
v. increase threefold
v. hit a three-base hit"
tri-state,none
triumph,n. the exultation of victory
trivial,s. concerned with trivialities
tropical,"s. relating to or situated in or characteristic of the tropics (the region on either side of the equator)
a. of or relating to the tropics, or either tropic
s. characterized by or of the nature of a trope or tropes; changed from its literal sense
s. of weather or climate; hot and humid as in the tropics"
truce,n a state of peace agreed to between opponents so they can discuss peace terms
tuition,n. a fee paid for instruction (especially for higher education)
turbulent,"s characterized by unrest or disorder or insubordination
s (of a liquid) agitated vigorously; in a state of turbulence"
ultimate,"n. the finest or most superior quality of its kind
a. furthest or highest in degree or order; utmost or extreme
s. being the last or concluding element of a series"
ultrasound,n. very high frequency sound; used in ultrasonography
unbridled,s. not restrained or controlled
unconfined,"a. not confined
s. free from confinement or physical restraint"
undergo,v. pass through
underlie,"v. be or form the base for
v. lie underneath"
underline,v. draw a line or lines underneath to call attention to
underlying,s. located beneath or below
