demonstrate,v. march in protest; take part in a demonstration
denote,"v. be a sign or indication of
v. have as a meaning"
dense,"s. permitting little if any light to pass through because of denseness of matter
s. hard to pass through because of dense growth
s. having high relative density or specific gravity
s. slow to learn or understand; lacking intellectual acuity"
denunciatory,s containing warning of punishment
depart,"v. leave
v. go away or leave"
depict,"v show in, or as in, a picture
v give a description of
v make a portrait of"
deplete,v use up (resources or materials)
deposit,"n. the phenomenon of sediment or gravel accumulating
n. money deposited in a bank or some similar institution
n. money given as security for an article acquired for temporary use
n. a payment given as a guarantee that an obligation will be met"
deprecate,"v. express strong disapproval of; deplore
v. belittle"
depreciation,"n. a decrease in price or value
n. decrease in value of an asset due to obsolescence or use"
depress,"v. lower someone's spirits; make downhearted
v. lower (prices or markets)
v. lessen the activity or force of"
depression,"n. a mental state characterized by a pessimistic sense of inadequacy and a despondent lack of activity
n. a long-term economic state characterized by unemployment and low prices and low levels of trade and investment
n. sad feelings of gloom and inadequacy
n. a period during the 1930s when there was a worldwide economic depression and mass unemployment"
deprivation,"n a state of extreme poverty
n the disadvantage that results from losing something
n act of depriving someone of food or money or rights"
derive,"v. obtain
v. come from
v. develop or evolve from a latent or potential state
v. come from; be connected by a relationship of blood, for example"
descend,"v. move downward and lower, but not necessarily all the way"
description,"n. a statement that represents something in words
n. the act of describing something
n. sort or variety"
desegregation,n the action of incorporating a racial or religious group into a community
deserve,v. be worthy or deserving
designate,"v. assign a name or title to
s. appointed but not yet installed in office"
desire,"n. the feeling that accompanies an unsatisfied state
n. an inclination to want things
n. something that is desired
v. feel or have a desire for; want strongly"
despise,v look down on with disdain
detach,"v. cause to become detached or separated; take off
v. separate (a small unit) from a larger, especially for a special assignment
v. come to be detached"
detached,"s. being or feeling set or kept apart from others
s. no longer connected or joined
a. used of buildings; standing apart from others
s. lacking affection or warm feeling"
detection,"n. the perception that something has occurred or some state exists
n. the act of detecting something; catching sight of something
n. a police investigation to determine the perpetrator"
deter,v. try to prevent; show opposition to
deteriorate,v. become worse or disintegrate
devastate,v. overwhelm or overpower
devise,"n. a will disposing of real property
n. (law) a gift of real property by will
v. give by will, especially real property"
devoid,s completely wanting or lacking
dexterity,n. adroitness in using the hands
diagnose,"v. determine or distinguish the nature of a problem or an illness through a diagnostic analysis
v. subject to a medical analysis"
diagonal,"n. (geometry) a straight line connecting any two vertices of a polygon that are not adjacent
n. a line or cut across a fabric that is not at right angles to a side of the fabric
n. an oblique line of squares of the same color on a checkerboard
n. (mathematics) a set of entries in a square matrix running diagonally either from the upper left to lower right entry or running from the upper right to lower left entry"
dialect,n. the usage or vocabulary that is characteristic of a specific group of people
diameter,"n. the length of a straight line passing through the center of a circle and connecting two points on the circumference
n. a straight line connecting the center of a circle with two points on its perimeter (or the center of a sphere with two points on its surface)"
diaper,"n. garment consisting of a folded cloth drawn up between the legs and fastened at the waist; worn by infants to catch excrement
n. a fabric (usually cotton or linen) with a distinctive woven pattern of small repeated figures"
dichotomy,n. being twofold; a classification into two opposed parts or subclasses
dictate,"n. an authoritative rule
n. a guiding principle
v. say out loud for the purpose of recording
v. rule as a dictator"
diesel,"n. German engineer (born in France) who invented the diesel engine (1858-1913)
n. an internal-combustion engine that burns heavy oil"
dietary,"n. a regulated daily food allowance
a. of or relating to the diet"
differentiate,"v. calculate a derivative; take the derivative
v. become different during development
v. become distinct and acquire a different character"
digest,"n. a periodical that summarizes the news
v. convert food into absorbable substances
v. arrange and integrate in the mind
v. put up with something or somebody unpleasant"
digit,"n. one of the elements that collectively form a system of numeration
n. a finger or toe in human beings or corresponding body part in other vertebrates"
dilemma,n. state of uncertainty or perplexity especially as requiring a choice between equally unfavorable options
dilute,v. lessen the strength or flavor of a solution or mixture
dimension,"n. the magnitude of something in a particular direction (especially length or width or height)
n. one of three Cartesian coordinates that determine a position in space
v. indicate the dimensions on
v. shape or form to required dimensions"
diminish,"v. lessen the authority, dignity, or reputation of"
dinosaur,n. any of numerous extinct terrestrial reptiles of the Mesozoic era
dioxide,n. an oxide containing two atoms of oxygen in the molecule
diploma,n. a document certifying the successful completion of a course of study
diplomatic,"a. relating to or characteristic of diplomacy
a. using or marked by tact in dealing with sensitive matters or people"
dire,"s fraught with extreme danger; nearly hopeless
s causing fear or dread or terror"
disaster,n. an act that has disastrous consequences
discard,"n. anything that is cast aside or discarded
n. (cards) the act of throwing out a useless card or of failing to follow suit
n. getting rid something that is regarded as useless or undesirable
v. throw or cast away"
discern,v detect with the senses
discharge,"n. the sudden giving off of energy
n. the act of venting
n. a substance that is emitted or released
n. any of several bodily processes by which substances go out of the body"
disciple,n. someone who believes and helps to spread the doctrine of another
discipline,"n. a branch of knowledge
n. a system of rules of conduct or method of practice; 
n. the trait of being well behaved
n. training to improve strength or self-control"
discord,"n. lack of agreement or harmony
n. disagreement among those expected to cooperate
n. strife resulting from a lack of agreement"
discount,"n. the act of reducing the selling price of merchandise
v. give a reduction in price on"
discrepancy,"n. a difference between conflicting facts or claims or opinions
n. an event that departs from expectations"
discrete,s. constituting a separate entity or part
discretionary,"s. having or using the ability to act or decide according to your own discretion or judgment
s. (especially of funds) not earmarked; available for use as needed"
discriminate,"v. recognize or perceive the difference
v. treat differently on the basis of sex or race
v. distinguish
a. marked by the ability to see or make fine distinctions"
disdainful,s. having or showing arrogant superiority to and disdain of those one views as unworthy
disenchanted,a. freed from enchantment
disenfranchise,v. deprive of voting rights
disinclined,a. unwilling because of mild dislike or disapproval
dislocation,"n. an event that results in a displacement or discontinuity
n. the act of disrupting an established order so it fails to continue
n. a displacement of a part (especially a bone) from its normal position (as in the shoulder or the vertebral column)"
dislodge,"v. remove or force out from a position
v. remove or force from a position of dwelling previously occupied"
dismal,s causing dejection
dismantle,"v tear down so as to make flat with the ground
v take apart into its constituent pieces
v take off or remove"
dismay,v. fill with apprehension or alarm; cause to be unpleasantly surprised
disparaging,"v express a negative opinion of
s expressive of low opinion"
disparate,"s. fundamentally different or distinct in quality or kind
s. including markedly dissimilar elements"
dispel,"v force to go away; used both with concrete and metaphoric meanings
v to cause to separate and go in different directions"
dispense,v. grant a dispensation; grant an exemption
disperse,"v. to cause to separate and go in different directions
v. move away from each other; 
v. separate (light) into spectral rays"
dispose,"v. give, sell, or transfer to another
v. make receptive or willing towards an action or attitude or belief
v. place or put in a particular order"
disproportionate,"a. out of proportion
s. not proportionate"
disrupt,v. throw into disorder
disseminate,v cause to become widely known
dissent,"n. (law) the difference of one judge's opinion from that of the majority
n. a difference of opinion
v. withhold assent"
dissipate,"v. live a life of pleasure, especially with respect to alcoholic consumption"
dissociate,v. to undergo a reversible or temporary breakdown of a molecule into simpler molecules or atoms
distill,"v. undergo the process of distillation
v. extract by the process of distillation
v. give off (a liquid)"
distinct,"s. (often followed by `from') not alike; different in nature or quality
a. easy to perceive; especially clearly outlined
s. recognizable; marked"
distinguish,"v. mark as different
v. be a distinctive feature, attribute, or trait; sometimes in a very positive sense"
distort,"v make false by mutilation or addition; as of a message or story
v form into a spiral shape
v twist and press out of shape
v affect as in thought or feeling
v alter the shape of (something) by stress"
distribute,"v. administer or bestow, as in small portions
v. make available
v. give to several people
v. spread throughout a given area"
district,n. a region marked off for administrative or other purposes
disturb,"v. move deeply
v. damage as if by shaking or jarring"
diverge,"v. move or draw apart
v. have no limits as a mathematical series
v. extend in a different direction"
diverse,s. distinctly dissimilar or unlike
divest,"v. deprive of status or authority
v. reduce or dispose of; cease to hold (an investment)"
dividend,"n. that part of the earnings of a corporation that is distributed to its shareholders; usually paid quarterly
n. a number to be divided by another number
n. a bonus; something extra (especially a share of a surplus)"
divisible,a. capable of being or liable to be divided or separated
division,"n. an army unit large enough to sustain combat
n. the act or process of dividing
n. an administrative unit in government or business
n. discord that splits a group"
divisive,s dissenting (especially dissenting with the majority opinion)
divulge,v make known to the public information that was previously known only to a few people or that was meant to be kept a secret
doctorate,n one of the highest earned academic degrees conferred by a university
doctrine,n. a belief (or system of beliefs) accepted as authoritative by some group or school
dogma,"n. a religious doctrine that is proclaimed as true without proof
n. a doctrine or code of beliefs accepted as authoritative"
domain,"n. territory over which rule or control is exercised
n. (mathematics) the set of values of the independent variable for which a function is defined"
domestic,"n. a servant who is paid to perform menial tasks around the household
a. of concern to or concerning the internal affairs of a nation
a. of or relating to the home
a. of or involving the home or family"
domesticate,"v. adapt (a wild plant or unclaimed land) to the environment
v. overcome the wildness of; make docile and tractable
v. make fit for cultivation, domestic life, and service to humans"
dominate,"v. be in control
v. have dominance or the power to defeat over
v. look down on"
donate,v. give to a charity or good cause
dormant,"s. in a condition of biological rest or suspended animation
a. (of e.g. volcanos) not erupting and not extinct
s. lying with head on paws as if sleeping"
dose,"n. a measured portion of medicine taken at any one time
n. the quantity of an active agent (substance or radiation) taken in or absorbed at any one time
v. treat with an agent; add (an agent) to"
dough,n. a flour mixture stiff enough to knead or roll
downplay,"v represent as less significant or important
v understate the importance or quality of"
downstream,a. in the direction of a stream's current
drab,"s. lacking in liveliness or charm or surprise
s. lacking brightness or color; dull"
dramatize,"v. put into dramatic form
v. represent something in a dramatic manner"
drastic,s. forceful and extreme and rigorous
drift,"n. a force that moves something along
n. the gradual departure from an intended course due to external influences (as a ship or plane)
n. a process of linguistic change over a period of time
n. a large mass of material that is heaped up by the wind or by water currents"
drizzle,"n. very light rain; stronger than mist but less than a shower
v. rain lightly
v. moisten with fine drops"
dropout,"n. someone who quits school before graduation
n. someone who withdraws from a social group or environment"
drought,"n. a shortage of rainfall
n. a prolonged shortage"
dubious,s. not convinced
ductile,"s. easily influenced
s. capable of being shaped or bent or drawn out"
dump,"n. a piece of land where waste materials are dumped
n. (computer science) a copy of the contents of a computer storage device; sometimes used in debugging programs
n. a place where supplies can be stored
v. throw away as refuse"
dumpster,n. a container designed to receive and transport and dump waste
duplicate,"n. a copy that corresponds to an original exactly
v. make or do or perform again
v. make a duplicate or duplicates of
s. identically copied from an original"
durability,n permanence by virtue of the power to resist stress or force
dwarf,"n. a person who is markedly small
n. a plant or animal that is atypically small
v. check the growth of"
dwelling,n. housing that someone is living in
dye,"n. a usually soluble substance for staining or coloring e.g. fabrics or hair
v. color with dye"
dynamic,"a. characterized by action or forcefulness or force of personality
a. of or relating to dynamics"
ease,"n. freedom from difficulty or hardship or effort
n. a freedom from financial difficulty that promotes a comfortable state
n. freedom from constraint or embarrassment
v. move gently or carefully"
echolocation,n. determining the location of something by measuring the time it takes for an echo to return from it
eclipse,"n. one celestial body obscures another
v. cause an eclipse of (a celestial body) by intervention"
ecology,"n. the environment as it relates to living organisms
n. the branch of biology concerned with the relations between organisms and their environment"
ecosystem,n. a system formed by the interaction of a community of organisms with their physical environment
edge,"n. the boundary of a surface
n. a sharp side formed by the intersection of two surfaces of an object
n. the attribute of urgency in tone of voice
n. a slight competitive advantage"
edible,a. suitable for use as food
effect,"n. an impression (especially one that is artificial or contrived)
n. the central meaning or theme of a speech or literary work
n. (of a law) having legal validity
n. a symptom caused by an illness or a drug"
efficiency,"n. the ratio of the output to the input of any system
n. skillfulness in avoiding wasted time and effort"
effigy,n. a representation of a person (especially in the form of sculpture)
effluent,"n. water mixed with waste matter
s. that is flowing outward"
egalitarianism,n. the doctrine of the equality of mankind and the desirability of political and economic and social equality
egoistic,a. limited to or caring only about yourself and your own needs
eject,"v. put out or expel from a place
v. leave an aircraft rapidly, using an ejection seat or capsule"
elaborate,"v. add details, as to an account or idea; clarify the meaning of and discourse in a learned way, usually in writing
v. produce from basic elements or sources; change into a more developed product
v. work out in detail
s. marked by complexity and richness of detail"
elective,"a. subject to popular election
s. not compulsory"
electorate,n. the body of enfranchised citizens; those qualified to vote
electro,n. An electrotype.
electron,n. an elementary particle with negative charge
element,"n. the most favorable environment for a plant or animal
n. one of four substances thought in ancient and medieval cosmology to constitute the physical universe
n. the situation in which you are happiest and most effective
n. a straight line that generates a cylinder or cone"
elevate,"v give a promotion to or assign to a higher position
v raise from a lower to a higher position
v raise in rank or condition"
elicit,v. derive by reason
eligible,a. qualified for or allowed or worthy of being chosen
eliminate,"v. kill in large numbers
v. remove from a contest or race
v. remove (an unknown variable) from two or more equations"
elite,n. a group or class of persons enjoying superior intellectual or social or economic status
elliptical,"s rounded like an egg
s characterized by extreme economy of expression or omission of superfluous elements"
elongate,"v. make long or longer by pulling and stretching
s. having notably more length than width; being long and slender"
eloquent,"s. expressing yourself readily, clearly, effectively"
elude,"v. escape, either physically or mentally
v. be incomprehensible to; escape understanding by"
embalm,v. preserve a dead body
embargo,"n. a government order imposing a trade barrier
v. ban the publication of (documents), as for security or copyright reasons
v. prevent commerce"
embark,"v. go on board
v. set out on (an enterprise or subject of study)"
embarrass,v. cause to be embarrassed; cause to feel self-conscious
embed,"v. attach to, as a journalist to a military unit when reporting on a war"
embellish,"v add details to
v be beautiful to look at
v make more attractive by adding ornament, colour, etc.
v make more beautiful"
embrace,"n. the act of clasping another person in the arms (as in greeting or affection)
n. the state of taking in or encircling
n. a close affectionate and protective acceptance
v. include in scope; include as part of something broader; have as one's sphere or territory"
embryo,"n. (botany) a minute rudimentary plant contained within a seed or an archegonium
n. an animal organism in the early stages of growth and differentiation that in higher forms merge into fetal stages but in lower forms terminate in commencement of larval life"
emerge,"v. come out into view, as from concealment
v. become known or apparent
v. come up to the surface of or rise"
emergency,"n. a sudden unforeseen crisis (usually involving danger) that requires immediate action
n. a state in which martial law applies"
eminent,"s. standing above others in quality or position
s. of imposing height; especially standing out above others"
emission,"n. the act of emitting; causing to flow forth
n. the release of electrons from parent atoms
n. the occurrence of a flow of water (as from a pipe)"
empirical,a. derived from experiment and observation rather than theory
emulate,"v. strive to equal or match, especially by imitating
v. imitate the function of (another system), as by modifying the hardware or the software
v. compete with successfully; approach or reach equality with"
enact,v. act out; represent or perform as if in a play
encephalitis,n. inflammation of the brain usually caused by a virus; symptoms include headache and neck pain and drowsiness and nausea and fever (`phrenitis' is no longer in scientific use)
enclose,"v. close in; darkness enclosed him""
v. surround completely"
encode,v. convert information into code
encompass,v include in scope; include as part of something broader; have as one's sphere or territory
encounter,n. a casual meeting with a person or thing
encroach,v. advance beyond the usual limit
encyclopedia,n. a reference work (often in several volumes) containing articles on various topics (often arranged in alphabetical order) dealing with the entire range of human knowledge or with some particular specialty
endanger,v. pose a threat to; present a danger to
endeavor,v. attempt by employing effort
endemic,"n. a disease that is constantly present to a greater or lesser degree in people of a certain class or in people living in a particular location
n. a plant that is native to a certain limited area
a. of or relating to a disease (or anything resembling a disease) constantly present to greater or lesser extent in a particular locality
a. native to or confined to a certain region"
endorphin,n. a neurochemical occurring naturally in the brain and having analgesic properties
endorse,v. sign as evidence of legal transfer
endothermic,a. (of a chemical reaction or compound) occurring or formed with absorption of heat
enforce,"v. ensure observance of laws and rules; 
v. compel to behave in a certain way"
engage,"v. ask to represent; of legal counsel
v. get caught
v. carry on (wars, battles, or campaigns)
v. hire for work or assistance"
engender,v. call forth
engulf,v. flow over or cover completely
enhance,"v. increase
v. make better or more attractive"
enlightened,a. having knowledge and spiritual insight
enlist,"v. join the military
v. engage somebody to enter the army"
enormous,"s. extraordinarily large in size or extent or amount or power or degree; that a whole civilization should be dependent on technology""- Walter Lippman"
enrich,"v. make better or improve in quality
v. make wealthy or richer"
enroll,v. register formally as a participant or member
ensemble,"n. a group of musicians playing or singing together
n. a cast other than the principals
n. an assemblage of parts or details (as in a work of art) considered as forming a whole
n. a coordinated outfit (set of clothing)"
entail,"n. land received by fee tail
n. the act of entailing property; the creation of a fee tail from a fee simple
v. have as a logical consequence
v. impose, involve, or imply as a necessary accompaniment or result"
enterprise,"n. a purposeful or industrious undertaking (especially one that requires effort or boldness)
n. an organization created for business ventures
n. readiness to embark on bold new ventures"
entertainment,n. an activity that is diverting and that holds the attention
enthusiastically,r. with enthusiasm; in an enthusiastic manner
entice,v. provoke someone to do something through (often false or exaggerated) promises or persuasion
entitle,"v. give the right to
v. give a title to"
entity,n. that which is perceived or known or inferred to have its own distinct existence (living or nonliving)
entrant,"n. a commodity that enters competition with established merchandise
n. someone who enters
n. one who enters a competition"
entrapment,n. a defense that claims the defendant would not have broken the law if not tricked into doing it by law enforcement officials
entrepreneur,n. someone who organizes a business venture and assumes the risk for it
entry,"n. an item inserted in a written record
n. a written record of a commercial transaction"
enumerate,v. specify individually
envelop,v. enclose or enfold completely with or as if with a covering
envelope,"n. a flat (usually rectangular) container for a letter, thin package, etc.
n. any wrapper or covering
n. a curve that is tangent to each of a family of curves
n. a natural covering (as by a fluid)"
envision,v. picture to oneself; imagine possible
enzyme,n. any of several complex proteins that are produced by cells and act as catalysts in specific biochemical reactions
epic,"s. very imposing or impressive; surpassing the ordinary (especially in size or scale)
a. constituting or having to do with or suggestive of a literary epic"
epidemic,"n. a widespread outbreak of an infectious disease; many people are infected at the same time
a. (especially of medicine) of disease or anything resembling a disease; attacking or affecting many individuals in a community or a population simultaneously"
episode,"n. a happening that is distinctive in a series of related events
n. a brief section of a literary or dramatic work that forms part of a connected series
n. a part of a broadcast serial"
epochal,s. highly significant or important especially bringing about or marking the beginning of a new development or era
equalize,v. compensate; make the score equal
equip,"v. provide with (something) usually for a specific purpose
v. provide with abilities or understanding"
equity,"n. the difference between the market value of a property and the claims held against it
n. the ownership interest of shareholders in a corporation"
equivalent,"n. a person or thing equal to another in value or measure or force or effect or significance etc
n. the atomic weight of an element that has the same combining capacity as a given weight of another element; the standard is 8 for oxygen
s. being essentially equal to something"
