contemporary,"n. a person of nearly the same age as another
s. characteristic of the present
s. belonging to the present time"
modern,"n. a contemporary person
n. a typeface (based on an 18th century design by Gianbattista Bodoni) distinguished by regular shape and hairline serifs and heavy downstrokes
a. belonging to the modern era; since the Middle Ages
s. characteristic of present-day art and music and literature and architecture"
responsibility,n. a form of trustworthiness; the trait of being answerable to someone for something or being responsible for one's conduct
liability,"n. the state of being legally obliged and responsible
n. the quality of being something that holds you back"
transport,"n. an exchange of molecules (and their kinetic energy and momentum) across the boundary between adjacent layers of a fluid or across cell membranes
v. move something or somebody around; usually over long distances
v. move while supporting, either in a vehicle or in one's hands or on one's body
v. transport commercially"
traffic,"n. the aggregation of things (pedestrians or vehicles) coming and going in a particular locality during a specified period of time
n. buying and selling; especially illicit trade
n. the amount of activity over a communication system during a given period of time
v. deal illegally"
assault,"n. close fighting during the culmination of a military attack
n. a threatened or attempted physical attack by someone who appears to be able to cause bodily harm if not stopped
n. thoroughbred that won the triple crown in 1946"
attack,"n. (military) an offensive against an enemy (using weapons)
n. an offensive move in a sport or game
n. the act of attacking
n. a decisive manner of beginning a musical tone or phrase"
rein,"n. one of a pair of long straps (usually connected to the bit or the headpiece) used to control a horse
n. any means of control
v. stop or slow up one's horse or oneself by or as if by pulling the reins
v. stop or check by or as if by a pull at the reins"
curb,"n. an edge between a sidewalk and a roadway consisting of a line of curbstones (usually forming part of a gutter)
n. a horse's bit with an attached chain or strap to check the horse
v. keep to the curb"
distinct,"s. (often followed by `from') not alike; different in nature or quality
a. easy to perceive; especially clearly outlined
s. recognizable; marked"
distinctive,s. of a feature that helps to distinguish a person or thing
constant,"n. a quantity that does not vary
n. a number representing a quantity assumed to have a fixed value in a specified mathematical context
a. steadfast in purpose or devotion or affection"
continual,"a. occurring without interruption; chiefly restricted to what recurs regularly or frequently in a prolonged and closely spaced series
s. `continual' (meaning seemingly uninterrupted) is often used interchangeably with `continuous' (meaning without interruption)"
debate,"n. the formal presentation of a stated proposition and the opposition to it (usually followed by a vote)
v. argue with one another
v. discuss the pros and cons of an issue"
argue,"v. present reasons and arguments
v. have an argument about something
v. give evidence of"
dispute,"n. a disagreement or argument about something important
n. coming into conflict with"
accident,"n. an unfortunate mishap; especially one causing damage or injury
n. anything that happens suddenly or by chance without an apparent cause"
incident,"n. a single distinct event
n. a public disturbance
a. falling or striking of light rays on something"
event,"n. something that happens at a given place and time
n. a special set of circumstances
n. a phenomenon located at a single point in space-time; the fundamental observational entity in relativity theory"
design,"n. the act of working out the form of something (as by making a sketch or outline or plan)
n. an arrangement scheme
n. a decorative or artistic work
n. a preliminary sketch indicating the plan for something"
project,"n. a planned undertaking
v. communicate vividly
v. transfer (ideas or principles) from one domain into another
v. project on a screen"
scheme,"n. an elaborate and systematic plan of action
v. form intrigues (for) in an underhand manner
v. devise a system or form a scheme for"
meaning,"n. the message that is intended or expressed or signified
n. the idea that is intended
s. rich in significance or implication"
purport,"v. have the often specious appearance of being, intending, or claiming"
sense,"n. a general conscious awareness
n. the meaning of a word or expression; the way in which a word or expression or situation can be interpreted
n. the faculty through which the external world is apprehended
n. a natural appreciation or ability"
thrive,v. make steady progress; be at the high point in one's career or reach a high point in historical significance or importance
prosper,v make steady progress; be at the high point in one's career or reach a high point in historical significance or importance
flourish,"n. a showy gesture
n. an ornamental embellishment in writing
n. a display of ornamental speech or language
n. the act of waving"
admire,"v. feel admiration for
v. look at with admiration"
worship,"n. the activity of worshipping
n. a feeling of profound love and admiration
v. show devotion to (a deity)
v. attend religious services"
adore,v. love intensely
feature,"n. a prominent attribute or aspect of something
n. the characteristic parts of a person's face: eyes and nose and mouth and chin
n. the principal (full-length) film in a program at a movie theater
n. a special or prominent article in a newspaper or magazine"
characteristic,"n. a distinguishing quality
n. the integer part (positive or negative) of the representation of a logarithm; in the expression log 643 = 2.808 the characteristic is 2
n. any measurable property of a device measured under closely specified conditions
a. typical or distinctive"
trait,n. a distinguishing feature of your personal nature
bear,"n. massive plantigrade carnivorous or omnivorous mammals with long shaggy coats and strong claws
n. an investor with a pessimistic market outlook; an investor who expects prices to fall and so sells now in order to buy later at a lower price
v. have
v. move while holding up or supporting"
stand,"n. the position where a thing or person stands
n. a growth of similar plants (usually trees) in a particular area
n. a small table for holding articles of various kinds
n. an interruption of normal activity"
endure,"v put up with something or somebody unpleasant
v face and withstand with courage
v continue to live through hardship or adversity
v undergo or be subjected to
v last and be usable
v persist for a specified period of time
v continue to exist"
implement,"n. instrumentation (a piece of equipment or tool) used to effect an end
v. apply in a manner consistent with its purpose or design"
appliance,"n. a device or control that is very useful for a particular job
n. durable goods for home or office use"
equipment,n. an instrumentality needed for an undertaking or to perform a service
sophisticated,"a. having or appealing to those having worldly knowledge and refinement and savoir-faire
s. intellectually appealing"
complicated,s. difficult to analyze or understand
complex,"n. a conceptual whole made up of complicated and related parts
n. a compound described in terms of the central atom to which other atoms are bound or coordinated
n. (psychoanalysis) a combination of emotions and impulses that have been rejected from awareness but still influence a person's behavior
a. complicated in structure; consisting of interconnected parts"
claim,"n. an assertion of a right (as to money or property)
n. an assertion that something is true or factual
n. demand for something as rightful or due
n. an informal right to something"
request,"n. a formal message requesting something that is submitted to an authority
n. the verbal act of requesting
v. express the need or desire for; ask for
v. ask (a person) to do something"
require,"v require as useful, just, or proper
v consider obligatory; request and expect
v make someone do something
v have need of"
acquire,"v. locate (a moving entity) by means of a tracking system such as radar
v. win something through one's efforts"
obtain,v. come into possession of
secure,"v. assure payment of
a. free from fear or doubt; easy in mind
a. free from danger or risk
a. not likely to fail or give way"
merely,r. and nothing more
simply,r. absolutely; altogether; really
only,"r. with nevertheless the final result
r. in the final outcome
r. except that; only this time she came out better""
r. never except when"
alter,"v. make an alteration to
v. remove the ovaries of"
convert,"n. a person who has been converted to another religious or political belief
v. change from one system to another or to a new plan or policy
v. change the nature, purpose, or function of something
v. change religious beliefs, or adopt a religious belief"
modify,"v. make less severe or harsh or extreme
v. add a modifier to a constituent"
alternative,"s. necessitating a choice between mutually exclusive possibilities
s. pertaining to unconventional choices"
choice,"n. the person or thing chosen or selected
n. the act of choosing or selecting
s. of superior grade
s. appealing to refined taste"
option,"n. the right to buy or sell property at an agreed price; the right is purchased and if it is not exercised by a stated date the money is forfeited
n. one of a number of things from which only one can be chosen"
range,"n. the limits within which something can be effective
n. a large tract of grassy open land on which livestock can graze
n. a series of hills or mountains
n. a place for shooting (firing or driving) projectiles of various kinds"
extent,"n. the point or degree to which something extends
n. the distance or area or volume over which something extends"
field,"n. a piece of land cleared of trees and usually enclosed
n. somewhere (away from a studio or office or library or laboratory) where practical work is done or data is collected
n. the space around a radiating body within which its electromagnetic oscillations can exert force on another similar body not in contact with it
n. a particular kind of commercial enterprise"
scope,"n. an area in which something acts or operates or has power or control: ""the range of a supersonic jet"""
fairly,"r. without favoring one party, in a fair evenhanded manner
r. in conformity with the rules or laws and without fraud or cheating"
quite,"r. to a degree (not used with a negative)
r. to the greatest extent; completely
r. of an unusually noticeable or exceptional or remarkable kind (not used with a negative)
r. actually or truly or to an extreme"
rather,"r. on the contrary; rather (or instead), he wrote her a letter""
r. to some (great or small) extent"
pretty,"s. pleasing by delicacy or grace; not imposing
s. (used ironically) unexpectedly bad"
region,"n. the extended spatial location of something
n. a large indefinite location on the surface of the Earth
n. the approximate amount of something (usually used prepositionally as in `in the region of')
n. a knowledge domain that you are interested in or are communicating about"
area,"n. a particular geographical region of indefinite boundary (usually serving some special purpose or distinguished by its people or culture or geography)
n. a subject of study
n. a part of an animal that has a special function or is supplied by a given artery or nerve
n. a part of a structure having some specific characteristic or function"
victim,"n. an unfortunate person who suffers from some adverse circumstance
n. a person who is tricked or swindled"
prey,"n. a person who is the aim of an attack (especially a victim of ridicule or exploitation) by some hostile person or influence
n. animal hunted or caught for food
v. profit from in an exploitatory manner"
presume,"v. constitute reasonable evidence for
v. take liberties or act with too much confidence"
assume,"v. take to be the case or to be true; accept without verification or proof
v. take on titles, offices, duties, responsibilities
v. take on a certain form, attribute, or aspect
v. occupy or take on"
relevant,a. having a bearing on or connection with the subject at issue
related,"a. being connected either logically or causally or by shared characteristics
a. connected by kinship, common origin, or marriage"
moderate,"v. preside over
v. make less fast or intense
a. being within reasonable or average limits; not excessive or extreme
s. not extreme"
temperate,"a. (of weather or climate) free from extremes; mild; or characteristic of such weather or climate
a. not extreme in behavior"
ruin,"n. an irrecoverable state of devastation and destruction
n. a ruined building
n. an event that results in destruction
v. destroy or cause to fail"
destroy,"v. do away with, cause the destruction or undoing of
v. destroy completely; damage irreparably
v. put (an animal) to death"
protect,"v. shield from danger, injury, destruction, or damage
v. use tariffs to favor domestic industry"
defend,"v. argue or speak in defense of
v. be on the defensive; act against an attack
v. protect against a challenge or attack
v. be the defense counsel for someone in a trial"
cruel,s (of persons or their actions) able or disposed to inflict pain or suffering
brutal,"s. harsh
s. disagreeably direct and precise"
avert,v. turn away or aside
avoid,"v. stay clear from; keep away from; keep out of the way of someone or something
v. refrain from doing something"
humorous,a. full of or characterized by humor
funny,s. experiencing odd bodily sensations
fresh,"a. recently made, produced, or harvested
s. (of a cycle) beginning or occurring again
s. original and of a kind not seen before
a. not canned or otherwise preserved"
new,"a. not of long duration; having just (or relatively recently) come into being or been made or acquired or discovered
s. having no previous example or precedent or parallel
s. other than the former one(s); different
a. unaffected by use or exposure"
frank,"n. a member of the ancient Germanic peoples who spread from the Rhine into the Roman Empire in the 4th century
n. a smooth-textured sausage of minced beef or pork usually smoked; often served on a bread roll
v. exempt by means of an official pass or letter, as from customs or other checks
s. clearly manifest; evident"
sincere,a. open and genuine; not deceitful
drift,"n. a force that moves something along
n. the gradual departure from an intended course due to external influences (as a ship or plane)
n. a process of linguistic change over a period of time
n. a large mass of material that is heaped up by the wind or by water currents"
float,"n. the time interval between the deposit of a check in a bank and its payment
n. the number of shares outstanding and available for trading by the public
n. an elaborate display mounted on a platform carried by a truck (or pulled by a truck) in a procession or parade
n. a hand tool with a flat face used for smoothing and finishing the surface of plaster or cement or stucco"
rob,v. take something away by force or without the consent of the owner
steal,"n. a stolen base; an instance in which a base runner advances safely during the delivery of a pitch (without the help of a hit or walk or passed ball or wild pitch)
v. take without the owner's consent
v. move stealthily
v. steal a base"
rim,"n. the shape of a raised edge of a more or less circular object
n. (basketball) the hoop from which the net is suspended
n. the outer part of a wheel to which the tire is attached
v. run around the rim of"
edge,"n. the boundary of a surface
n. a sharp side formed by the intersection of two surfaces of an object
n. the attribute of urgency in tone of voice
n. a slight competitive advantage"
revolt,v. make revolution
rebel,"n. `Johnny' was applied as a nickname for Confederate soldiers by the Federal soldiers in the American Civil War; `greyback' derived from their grey Confederate uniforms
v. take part in a rebellion; renounce a former allegiance
v. break with established customs"
mistake,"n. a wrong action attributable to bad judgment or ignorance or inattention
n. an understanding of something that is not correct
v. identify incorrectly"
error,"n. a misconception resulting from incorrect information
n. (baseball) a failure of a defensive player to make an out when normal play would have sufficed
n. departure from what is ethically acceptable
n. (computer science) the occurrence of an incorrect result produced by a computer"
misfortune,"n. unnecessary and unforeseen trouble resulting from an unfortunate event
n. an unfortunate state resulting from unfavorable outcomes"
disaster,n. an act that has disastrous consequences
blunder,n. an embarrassing mistake
slip,"n. a minor inadvertent mistake usually observed in speech or writing or in small accidents or memory lapses etc.
n. potter's clay that is thinned and used for coating or decorating ceramics
n. a young and slender person
n. an accidental misstep threatening (or causing) a fall"
compulsory,s. required by rule
compulsive,"n. a person with a compulsive disposition; someone who feels compelled to do certain things
s. caused by or suggestive of psychological compulsion
s. strongly motivated to succeed"
notify,v inform (somebody) of something
inform,"v. impart knowledge of some fact, state or affairs, or event to
v. give character or essence to
v. act as an informer"
rent,"n. a payment or series of payments made by the lessee to an owner for use of some property, facility, equipment, or service
n. the act of rending or ripping or splitting something
v. let for money
v. hold under a lease or rental agreement; of goods and services"
hire,"n. a newly hired employee
n. the act of hiring something or someone
v. engage or hire for work"
historical,"a. of or relating to the study of history
s. having once lived or existed or taken place in the real world as distinct from being legendary"
historic,"s. belonging to the past; of what is important or famous in the past
s. important in history"
flee,v. run away quickly
escape,"n. the act of escaping physically
n. an inclination to retreat from unpleasant realities through diversion or fantasy
n. an avoidance of danger or difficulty
n. a means or way of escaping"
trench,"n. a ditch dug as a fortification having a parapet of the excavated earth
n. a long steep-sided depression in the ocean floor
n. any long ditch cut in the ground
v. fortify by surrounding with trenches"
ditch,"n. a long narrow excavation in the earth
n. any small natural waterway
v. forsake
v. make an emergency landing on water"
climate,"n. the weather in some location averaged over some long period of time
n. the prevailing psychological state"
weather,"n. the atmospheric conditions that comprise the state of the atmosphere in terms of temperature and wind and clouds and precipitation
v. face and withstand with courage
v. cause to slope
v. sail to the windward of"
appoint,"v. create and charge with a task or function
v. assign a duty, responsibility or obligation to
v. furnish"
nominate,"v. propose as a candidate for some honor
v. put forward; nominate for appointment to an office or for an honor or position"
infectious,"s. caused by infection or capable of causing infection
a. easily spread; children catch it from their elders""- Bertrand Russell
a. of or relating to infection"
contagious,s. easily diffused or spread as from one person to another
unfold,"v. open to the view
v. extend or stretch out to a greater or the full length
v. spread out or open from a closed or folded state"
open,"n. a clear or unobstructed space or expanse of land or water
n. a tournament in which both professionals and amateurs may play
n. information that has become public
v. cause to open or to become open"
feminine,"n. a gender that refers chiefly (but not exclusively) to females or to objects classified as female
a. associated with women and not with men
a. of grammatical gender
s. (music or poetry) ending on an unaccented beat or syllable"
female,"n. an animal that produces gametes (ova) that can be fertilized by male gametes (spermatozoa)
n. a person who belongs to the sex that can have babies
a. being the sex (of plant or animal) that produces fertilizable gametes (ova) from which offspring develop
s. characteristic of or peculiar to a woman"
vibrate,"v. shake, quiver, or throb; move back and forth rapidly, usually in an uncontrolled manner"
shake,"v. move or cause to move back and forth
v. move with or as if with a tremor
v. undermine or cause to waver
v. get rid of"
war,"n. the waging of armed conflict against an enemy
n. a legal state created by a declaration of war and ended by official declaration during which the international rules of war apply
n. an active struggle between competing entities
n. a concerted campaign to end something that is injurious"
warfare,"n the waging of armed conflict against an enemy
n an active struggle between competing entities"
walk,"n. the act of traveling by foot
n. manner of walking
n. the act of walking somewhere
n. a path set aside for walking"
step,"n. the act of changing location by raising the foot and setting it down
n. support consisting of a place to rest the foot while ascending or descending a stairway
n. a short distance
n. a solid block joined to the beams in which the heel of a ship's mast or capstan is fixed"
endeavor,v. attempt by employing effort
attempt,n. earnest and conscientious activity intended to do or accomplish something
try,"v. make an effort or attempt
v. give pain or trouble to
v. test the limits of
v. melt (fat or lard) in order to separate out impurities"
raise,"n. the amount a salary is increased
n. increasing the size of a bet (as in poker)
v. raise the level or amount of something
v. raise from a lower to a higher position"
arise,"v. originate or come into being
v. rise to one's feet
v. result or issue"
rise,"n. a growth in strength or number or importance
n. the act of changing location in an upward direction
n. a movement upward
n. an increase in cost"
diminish,"v. lessen the authority, dignity, or reputation of"
decrease,"n. a change downward
n. a process of becoming smaller or shorter
n. the amount by which something decreases
n. the act of decreasing or reducing something"
reduce,"v. cut down on; make a reduction in
v. make less complex
v. bring to humbler or weaker state or condition
v. simplify the form of a mathematical equation of expression by substituting one term for another"
disease,n. an impairment of health or a condition of abnormal functioning
illness,n. impairment of normal physiological function affecting part or all of an organism
disorder,"n. a physical condition in which there is a disturbance of normal functioning
n. a disturbance of the peace or of public order
v. bring disorder to"
transform,"v. subject to a mathematical transformation
v. change or alter in form, appearance, or nature
v. change in outward structure or looks
v. convert (one form of energy) to another"
vary,"v. be subject to change in accordance with a variable
v. make something more diverse and varied"
change,"n. an event that occurs when something passes from one state or phase to another
n. a relational difference between states; especially between states before and after some event
n. the action of changing something
n. the result of alteration or modification"
likely,"a. has a good chance of being the case or of coming about
s. expected to become or be; in prospect
s. within the realm of credibility"
apt,"s. (usually followed by `to') naturally disposed toward
s. at risk of or subject to experiencing something usually unpleasant
s. mentally quick and resourceful"
prone,"s. having a tendency (to); often used in combination
s. lying face downward"
appropriate,"v. take possession of by force, as after an invasion
a. suitable for a particular person or place or condition etc"
suitable,s. meant or adapted for an occasion or use
proper,"a. marked by suitability or rightness or appropriateness
s. having all the qualities typical of the thing specified; not just a snack""
s. limited to the thing specified
s. appropriate for a condition or purpose or occasion or a person's character, needs"
custom,"n. accepted or habitual practice
n. a specific practice of long standing
n. habitual patronage"
habit,"n. an established custom
n. (psychology) an automatic pattern of behavior in reaction to a specific situation; may be inherited or acquired through frequent repetition
n. a distinctive attire worn by a member of a religious order
n. the general form or mode of growth (especially of a plant or crystal)"
convention,"n. a large formal assembly
n. something regarded as a normative example
n. (diplomacy) an international agreement
n. the act of convening"
crush,"n. a dense crowd of people
n. the act of crushing
v. break into small pieces
v. humiliate or depress completely"
clash,"n. a state of conflict between persons
n. a state of conflict between colors
v. be incompatible; be or come into conflict
v. disagree violently"
crash,"n. a serious accident (usually involving one or more vehicles)
n. a sudden large decline of business or the prices of stocks (especially one that causes additional failures)
n. the act of colliding with something
n. (computer science) an event that causes a computer system to become inoperative"
creep,"n. someone unpleasantly strange or eccentric
n. a slow longitudinal movement or deformation
n. a pen that is fenced so that young animals can enter but adults cannot
v. grow or spread, often in such a way as to cover (a surface)"
