ease,"n. freedom from difficulty or hardship or effort
n. a freedom from financial difficulty that promotes a comfortable state
n. freedom from constraint or embarrassment
v. move gently or carefully"
list,"n. a database containing an ordered array of items (names or topics)
v. give or make a list of; name individually; give the names of
v. include in a list
v. cause to lean to the side"
major,"n. a commissioned military officer in the United States Army or Air Force or Marines; below lieutenant colonel and above captain
n. British statesman who was prime minister from 1990 until 1997 (born in 1943)
n. a university student who is studying a particular field as the principal subject
n. the principal field of study of a student at a university"
leave,"n. the period of time during which you are absent from work or duty
n. permission to do something
v. go away from a place
v. go and leave behind, either intentionally or by neglect or forgetfulness"
credit,"n. money available for a client to borrow
n. an accounting entry acknowledging income or capital items
n. used in the phrase `to your credit' in order to indicate an achievement deserving praise; 
n. arrangement for deferred payment for goods and services"
game,"n. a contest with rules to determine a winner
n. a single play of a sport or other contest
n. an amusement or pastime
n. animal hunted for food or sport"
department,"n. a specialized division of a large organization
n. the territorial and administrative division of some countries (such as France)
n. a specialized sphere of knowledge"
figure,"n. a diagram or picture illustrating textual material
n. a model of a bodily form (especially of a person)
n. a combination of points and lines and planes that form a visible palpable shape
n. an amount of money expressed numerically"
put,"v. put into a certain place or abstract location
v. cause to be in a certain state; cause to be in a certain relation
v. attribute or give
v. cause (someone) to undergo something"
free,"n. people who are free
v. grant freedom to; free from confinement
v. make (information) available for publication
v. free from obligations or duties"
inclusive,a. including much or everything; and especially including stated limits
key,"n. metal device shaped in such a way that when it is inserted into the appropriate lock the lock's mechanism can be rotated
n. something crucial for explaining
n. pitch of the voice
n. any of 24 major or minor diatonic scales that provide the tonal framework for a piece of music"
expense,"n. amounts paid for goods and services that may be currently tax deductible (as opposed to capital expenditures)
n. a detriment or sacrifice
n. money spent to perform work and usually reimbursed by an employer
v. reduce the estimated value of something"
equation,"n. a mathematical statement that two expressions are equal
n. the act of regarding as equal"
settle,"n. a long wooden bench with a back
v. settle into a position, usually on a surface or ground
v. settle conclusively; come to terms
v. take up residence and become established"
practice,"n. a customary way of operation or behavior
n. translating an idea into action
n. the exercise of a profession
n. knowledge of how something is usually done"
tease,"n. someone given to teasing (as by mocking or stirring curiosity)
n. the act of harassing someone playfully or maliciously (especially by ridicule); provoking someone with persistent annoyances
v. annoy persistently
v. harass with persistent criticism or carping"
line,"n. a formation of people or things one beside another
n. a mark that is long relative to its width
n. a formation of people or things one behind another
n. a length (straight or curved) without breadth or thickness; the trace of a moving point"
stiff,"n. an ordinary man
s. not moving or operating freely
s. powerful
r. extremely"
pluck,"n. the act of pulling and releasing a taut cord
v. pull or pull out sharply
v. pull lightly but sharply with a plucking motion
v. strip of feathers"
junior,"n. term of address for a disrespectful and annoying male
n. a third-year undergraduate
n. the younger of two persons
n. a son who has the same first name as his father"
plant,"n. buildings for carrying on industrial labor
n. (botany) a living organism lacking the power of locomotion
n. an actor situated in the audience whose acting is rehearsed but seems spontaneous to the audience
n. something planted secretly for discovery by another"
clear,"n. the state of being free of suspicion
v. make a way or path by removing objects
v. remove
v. be debited and credited to the proper bank accounts"
avoid,"v. stay clear from; keep away from; keep out of the way of someone or something
v. refrain from doing something"
trade,"n. the commercial exchange (buying and selling on domestic or international markets) of goods and services
n. the skilled practice of a practical occupation
n. the business given to a commercial establishment by its customers
v. engage in the trade of"
take,"n. the act of photographing a scene or part of a scene without interruption
v. carry out
v. require (time or space)
v. get into one's hands, take physically"
fill,"n. a quantity sufficient to satisfy
v. make full, also in a metaphorical sense
v. become full
v. assume, as of positions or roles"
point,"n. a geometric element that has position but no extension
n. the precise location of something; a spatially limited location
n. a brief version of the essential meaning of something
n. an instant of time"
content,"n. everything that is included in a collection and that is held or included in something
n. the proportion of a substance that is contained in a mixture or alloy etc.
n. the sum or range of what has been perceived, discovered, or learned
v. satisfy in a limited way"
secondary,"n. the defensive football players who line up behind the linemen
a. being of second rank or importance or value; not direct or immediate
s. depending on or incidental to what is original or primary
s. not of major importance"
take,"n. the act of photographing a scene or part of a scene without interruption
v. carry out
v. require (time or space)
v. get into one's hands, take physically"
personality,"n. the complex of all the attributes--behavioral, temperamental, emotional and mental--that characterize a unique individual
n. a person of considerable prominence"
promotion,"n. a message issued in behalf of some product or cause or idea or person or institution
n. act of raising in rank or position
n. encouragement of the progress or growth or acceptance of something"
paper,"n. a material made of cellulose pulp derived mainly from wood or rags or certain grasses
n. a medium for written communication
n. a scholarly article describing the results of observations or stating hypotheses
v. cover with paper"
miss,"n. a failure to hit (or meet or find etc)
n. a form of address for an unmarried woman
v. fail to perceive or to catch with the senses or the mind
v. feel or suffer from the lack of"
echo,"n. the repetition of a sound resulting from reflection of the sound waves
n. (Greek mythology) a nymph who was spurned by Narcissus and pined away until only her voice remained
n. a reply that repeats what has just been said
n. a reflected television or radio or radar beam"
spoil,"n. (usually plural) valuables taken by violence (especially in war)
n. the act of spoiling something by causing damage to it
n. the act of stripping and taking by force
v. become unfit for consumption or use"
stage,"n. a large platform on which people can stand and can be seen by an audience
n. the theater as a profession (usually `the stage')
n. a section or portion of a journey or course
n. any scene regarded as a setting for exhibiting or doing something"
hold,"n. power by which something or someone is affected or dominated
n. a stronghold
n. a cell in a jail or prison
v. have or hold in one's hands or grip"
shape,"n. any spatial attributes (especially as defined by outline)
n. the spatial arrangement of something as distinct from its substance
n. a concrete representation of an otherwise nebulous concept
v. make something, usually for a specific function"
assistant,n. a person who contributes to the fulfillment of a need or furtherance of an effort or purpose
string,"n. a lightweight cord
n. a tightly stretched cord of wire or gut, which makes sound when plucked, struck, or bowed
n. a sequentially ordered set of things or events or ideas in which each successive member is related to the preceding
n. a linear sequence of symbols (characters or words or phrases)"
gap,"n. a conspicuous disparity or difference as between two figures
n. a narrow opening
n. a difference (especially an unfortunate difference) between two opinions or two views or two situations
v. make an opening or gap in"
pack,"n. a complete collection of similar things
n. a convenient package or parcel (as of cigarettes or film)
n. a group of hunting animals
n. a cream that cleanses and tones the skin"
programming,n. creating a sequence of instructions to enable the computer to do something
start,"n. the beginning of anything
n. a turn to be a starter (in a game at the beginning)
n. a line indicating the location of the start of a race or a game
n. the advantage gained by beginning early (as in a race)"
gear,"n. a toothed wheel that engages another toothed mechanism in order to change the speed or direction of transmitted motion
n. a mechanism for transmitting motion for some specific purpose (as the steering gear of a vehicle)
n. equipment consisting of miscellaneous articles needed for a particular operation or sport etc.
v. set the level or character of"
turnover,n. a dish made by folding a piece of pastry over a filling
organize,"v. cause to be structured or ordered or operating according to some principle or idea
v. bring order and organization to
v. arrange by systematic planning and united effort"
industry,"n. the people or companies engaged in a particular kind of commercial enterprise
n. the organized action of making of goods and services for sale"
lend,"v. bestow a quality on
v. give temporarily; let have for a limited time
v. have certain characteristics of qualities for something; be open or vulnerable to"
crash,"n. a serious accident (usually involving one or more vehicles)
n. a sudden large decline of business or the prices of stocks (especially one that causes additional failures)
n. the act of colliding with something
n. (computer science) an event that causes a computer system to become inoperative"
list,"n. a database containing an ordered array of items (names or topics)
v. give or make a list of; name individually; give the names of
v. include in a list
v. cause to lean to the side"
push,"n. the act of applying force in order to move something away
n. the force used in pushing
n. an effort to advance
v. move with force, ""He pushed the table into a corner"""
designate,"v. assign a name or title to
s. appointed but not yet installed in office"
desperate,"n. a person who is frightened and in need of help
s. desperately determined
s. (of persons) dangerously reckless or violent as from urgency or despair
s. showing extreme courage; especially of actions courageously undertaken in desperation as a last resort"
job,"n. a specific piece of work required to be done as a duty or for a specific fee
n. a workplace; as in the expression ""on the job""; 
n. an object worked on; a result produced by working
n. the responsibility to do something"
monitor,"n. an ironclad vessel built by Federal forces to do battle with the Merrimac
n. display produced by a device that takes signals and displays them on a television screen or a computer monitor
n. electronic equipment that is used to check the quality or content of electronic transmissions
n. a piece of electronic equipment that keeps track of the operation of a system continuously and warns of trouble"
raise,"n. the amount a salary is increased
n. increasing the size of a bet (as in poker)
v. raise the level or amount of something
v. raise from a lower to a higher position"
block,"n. a solid piece of something (usually having flat rectangular sides)
n. a rectangular area in a city surrounded by streets and usually containing several buildings
n. a three-dimensional shape with six square or rectangular sides
n. a number or quantity of related things dealt with as a unit"
challenge,"n. a demanding or stimulating situation
n. a call to engage in a contest or fight
n. questioning a statement and demanding an explanation
n. a formal objection to the selection of a particular person as a juror"
approach,"n. ideas or actions intended to deal with a problem or situation
n. the act of drawing spatially closer to something
n. the event of one object coming closer to another
n. the temporal property of becoming nearer in time"
advance,"n. an amount paid before it is earned
n. increase in price or value
v. move forward, also in the metaphorical sense
v. bring forward for consideration or acceptance"
carry,"n. the act of carrying something
v. have with oneself; have on one's person
v. serve as a means for expressing something
v. bear or be able to bear the weight, pressure,or responsibility of"
schedule,"n. an ordered list of times at which things are planned to occur
v. plan for an activity or event
v. make a schedule; plan the time and place for events"
fuel,"n. a substance that can be consumed to produce energy
v. provide with a combustible substance that provides energy
v. provide with fuel
v. take in fuel, as of a ship"
note,"n. a brief written record
n. a short personal letter
n. a notation representing the pitch and duration of a musical sound
n. a tone of voice that shows what the speaker is feeling"
physical,"a. involving the body as distinguished from the mind or spirit
a. relating to the sciences dealing with matter and energy; especially physics
s. having substance or material existence; perceptible to the senses
s. according with material things or natural laws (other than those peculiar to living matter)"
purpose,"n. an anticipated outcome that is intended or that guides your planned actions
v. reach a decision"
dip,"n. a depression in an otherwise level surface
n. (physics) the angle that a magnetic needle makes with the plane of the horizon
n. tasty mixture or liquid into which bite-sized foods are dipped
n. a brief immersion"
surface,"n. the outer boundary of an artifact or a material layer constituting or resembling such a boundary
n. the extended two-dimensional outer boundary of a three-dimensional object
n. the outermost level of the land or sea
n. a superficial aspect as opposed to the real nature of something"
develop,"v. make something new, such as a product or a mental or artistic creation
v. gain through experience
v. be gradually disclosed or unfolded; become manifest; 
v. grow, progress, unfold, or evolve through a process of evolution, natural growth, differentiation, or a conducive environment"
prize,"n. something given for victory or superiority in a contest or competition or for winning a lottery
v. hold dear"
advance,"n. an amount paid before it is earned
n. increase in price or value
v. move forward, also in the metaphorical sense
v. bring forward for consideration or acceptance"
contrast,"n. the opposition or dissimilarity of things that are compared
n. the act of distinguishing by comparing differences
n. the perceptual effect of the juxtaposition of very different colors
n. the range of optical density and tone on a photographic negative or print (or the extent to which adjacent areas on a television screen differ in brightness)"
pattern,"n. a model considered worthy of imitation
v. form a pattern"
converge,"v. be adjacent or come together
v. approach a limit as the number of terms increases without limit
v. move or draw together at a certain location
v. come together so as to form a single product"
climb,"n. an event that involves rising to a higher point (as in altitude or temperature or intensity etc.)
n. the act of climbing something
v. go upward with gradual or continuous progress
v. move with difficulty, by grasping"
establish,"v. set up or found
v. set up or lay the groundwork for
v. bring about
v. use as a basis for; found on"
strike,"n. a group's refusal to work in protest against low pay or bad work conditions
n. an attack that is intended to seize or inflict damage on or destroy an objective
n. a score in tenpins: knocking down all ten with the first ball
n. (baseball) a pitch that the batter swings at and misses, or that the batter hits into foul territory, or that the batter does not swing at but the umpire judges to be in the area over home plate and between the batter's knees and shoulders"
dictate,"n. an authoritative rule
n. a guiding principle
v. say out loud for the purpose of recording
v. rule as a dictator"
suppress,"v. to put down by force or authority
v. put out of one's consciousness
v. reduce the incidence or severity of or stop"
brush,"n. a dense growth of bushes
n. an implement that has hairs or bristles firmly set into a handle
n. momentary contact
n. conducts current between rotating and stationary parts of a generator or motor"
diary,"n. a daily written record of (usually personal) experiences and observations
n. a personal journal (as a physical object)"
tight,"a. closely constrained or constricted or constricting
s. set so close together as to be invulnerable to penetration
s. affected by scarcity and expensive to borrow
a. of such close construction as to be impermeable"
carry,"n. the act of carrying something
v. have with oneself; have on one's person
v. serve as a means for expressing something
v. bear or be able to bear the weight, pressure,or responsibility of"
sheer,"v. cause to sheer
r. straight up or down without a break
r. directly"
volume,"n. the amount of 3-dimensional space occupied by an object
n. a publication that is one of a set of several similar publications
n. a relative amount
n. the magnitude of sound (usually in a specified direction)"
demand,"n. an urgent or peremptory request
n. the ability and desire to purchase goods and services
n. the act of demanding
v. request urgently and forcefully"
coach,"n. (sports) someone in charge of training an athlete or a team
n. a person who gives private instruction (as in singing, acting, etc.)
n. a carriage pulled by four horses with one driver
v. teach and supervise (someone); act as a trainer or coach (to), as in sports"
advance,"n. an amount paid before it is earned
n. increase in price or value
v. move forward, also in the metaphorical sense
v. bring forward for consideration or acceptance"
judge,"n. a public official authorized to decide questions brought before a court of justice
v. determine the result of (a competition)
v. put on trial or hear a case and sit as the judge at the trial of"
turn,"n. the act of changing or reversing the direction of the course
n. (game) the activity of doing something in an agreed succession
n. an unforeseen development
n. the act of turning away or in the opposite direction"
ride,"n. a mechanical device that you ride for amusement or excitement
v. sit and travel on the back of animal, usually while controlling its motions
v. be carried or travel on or in a vehicle
v. continue undisturbed and without interference"
since,"adv. From a definite past time until now; as, he went a month
   ago, and I have not seen him since.
adv. In the time past, counting backward from the present;
   before this or now; ago.
adv. When or that.
prep. From the time of; in or during the time subsequent to;
   subsequently to; after; -- usually with a past event or time for the
   object.
conj. Seeing that; because; considering; -- formerly followed
   by that."
wisdom,"n. accumulated knowledge or erudition or enlightenment
n. the trait of utilizing knowledge and experience with common sense and insight
n. ability to apply knowledge or experience or understanding or common sense and insight
n. the quality of being prudent and sensible"
draw,"n. a gully that is shallower than a ravine
n. the finish of a contest in which the score is tied and the winner is undecided
n. anything (straws or pebbles etc.) taken or chosen at random
n. a playing card or cards dealt or taken from the pack"
bargain,"n. an agreement between parties (usually arrived at after discussion) fixing obligations of each
n. an advantageous purchase
v. come to terms; arrive at an agreement"
division,"n. an army unit large enough to sustain combat
n. the act or process of dividing
n. an administrative unit in government or business
n. discord that splits a group"
clinically,r. in a clinical manner
close,"v. move so that an opening or passage is obstructed; make shut
v. become closed
v. finish or terminate (meetings, speeches, etc.)
v. complete a business deal, negotiation, or an agreement"
outline,"n. the line that appears to bound an object
n. a sketchy summary of the main points of an argument or theory
n. a schematic or preliminary plan"
appeal,"n. attractiveness that interests or pleases or stimulates
n. (law) a legal proceeding in which the appellant resorts to a higher court for the purpose of obtaining a review of a lower court decision and a reversal of the lower court's judgment or the granting of a new trial
v. take a court case to a higher court for review
v. request earnestly (something from somebody); ask for aid or protection"
grant,"n. any monetary aid
n. the act of providing a subsidy
n. (law) a transfer of property by deed of conveyance
n. Scottish painter; cousin of Lytton Strachey and member of the Bloomsbury Group (1885-1978)"
modest,"a. marked by simplicity; having a humble opinion of yourself
s. not large but sufficient in size or amount
s. free from pomp or affectation
a. not offensive to sexual mores in conduct or appearance"
navigate,"v. act as the navigator in a car, plane, or vessel and plan, direct, plot the path and position of the conveyance
v. direct carefully and safely"
energy,"n. (physics) a thermodynamic quantity equivalent to the capacity of a physical system to do work; the units of energy are joules or ergs
n. forceful exertion
n. enterprising or ambitious drive
n. an imaginative lively style (especially style of writing)"
objective,"n. the lens or system of lenses in a telescope or microscope that is nearest the object being viewed
a. undistorted by emotion or personal bias; based on observable phenomena
a. serving as or indicating the object of a verb or of certain prepositions and used for certain other purposes
s. emphasizing or expressing things as perceived without distortion of personal feelings, insertion of fictional matter, or interpretation"
regular,"n. a regular patron
n. a soldier in the regular army
n. a dependable follower (especially in party politics)
n. a garment size for persons of average height and weight"
absorb,"v. become imbued
v. take up mentally
v. take up, as of debts or payments
v. take in, also metaphorically"
buy,"v. obtain by purchase; acquire by means of a financial transaction
v. be worth or be capable of buying
v. acquire by trade or sacrifice or exchange
v. accept as true"
decent,"s. socially or conventionally correct; refined or virtuous
a. conforming to conventions of sexual behavior
s. decently clothed
s. observing conventional sexual mores in speech or behavior or dress"
weakness,"n. the property of lacking physical or mental strength; liability to failure under pressure or stress or strain
n. the condition of being financially weak
n. a penchant for something even though it might not be good for you"
far,"a. located at a great distance in time or space or degree
s. being of a considerable distance or length
s. being the animal or vehicle on the right or being on the right side of an animal or vehicle
s. beyond a norm in opinion or actions"
issue,"n. an important question that is in dispute and must be settled
n. one of a series published periodically
n. the act of providing an item for general use or for official purposes (usually in quantity)
n. supplies (as food or clothing or ammunition) issued by the government"
condition,"n. a state at a particular time
n. an assumption on which rests the validity or effect of something else
n. a mode of being or form of existence of a person or thing
n. the state of (good) health (especially in the phrases `in condition' or `in shape' or `out of condition' or `out of shape')"
cover,"n. the act of concealing the existence of something by obstructing the view of it
n. fire that makes it difficult for the enemy to fire on your own individuals or formations
n. a recording of a song that was first recorded or made popular by somebody else
n. a false identity and background (especially one created for an undercover agent)"
last,"n. the last or lowest in an ordering or series
n. a person's dying act; the final thing a person can do
n. a unit of weight equal to 4,000 pounds
n. a unit of capacity for grain equal to 80 bushels"
over,"n. (cricket) the division of play during which six balls are bowled at the batsman by one player from the other team from the same end of the pitch
r. at or to a point across intervening space etc.
r. throughout an area
r. throughout a period of time"
press,"n. the print media responsible for gathering and publishing news in the form of newspapers or magazines
n. a machine used for printing
n. clamp to prevent wooden rackets from warping when not in use
n. any machine that exerts pressure to form or shape or cut materials or extract liquids or compress solids"
signal,"n. any nonverbal action or gesture that encodes a message
n. any incitement to action
n. an electric quantity (voltage or current or field strength) whose modulation represents coded information about the source from which it comes
s. notably out of the ordinary"
