weigh,"v. have a certain weight
v. determine the weight of
v. to be oppressive or burdensome"
poison,"n. any substance that causes injury or illness or death of a living organism
n. anything that harms or destroys
v. spoil as if by poison
v. kill with poison"
design,"n. the act of working out the form of something (as by making a sketch or outline or plan)
n. an arrangement scheme
n. a decorative or artistic work
n. a preliminary sketch indicating the plan for something"
tough,"a. not given to gentleness or sentimentality
a. physically toughened
a. resistant to cutting or chewing"
appreciate,"v. recognize with gratitude; be grateful for
v. be fully aware of; realize fully
v. gain in value
v. increase the value of"
twist,"n. a jerky pulling movement
n. social dancing in which couples vigorously twist their hips and arms in time to the music; was popular in the 1960s
n. turning or twisting around (in place)
v. turn in the opposite direction"
condition,"n. a state at a particular time
n. an assumption on which rests the validity or effect of something else
n. a mode of being or form of existence of a person or thing
n. the state of (good) health (especially in the phrases `in condition' or `in shape' or `out of condition' or `out of shape')"
develop,"v. make something new, such as a product or a mental or artistic creation
v. gain through experience
v. be gradually disclosed or unfolded; become manifest; 
v. grow, progress, unfold, or evolve through a process of evolution, natural growth, differentiation, or a conducive environment"
concern,"n. something that interests you because it is important or affects you
n. an anxious feeling
n. a feeling of sympathy for someone or something
n. something or someone that causes anxiety; a source of unhappiness"
mass,"n. the property of a body that causes it to have weight in a gravitational field
n. an ill-structured collection of similar things (objects or people)
n. (Roman Catholic Church and Protestant Churches) the celebration of the Eucharist
n. a body of matter without definite shape"
index,"n. a numerical scale used to compare variables with one another or with some reference number
n. a number or ratio (a value on a scale of measurement) derived from a series of observed facts; can reveal relative changes as a function of time
n. an alphabetical listing of names and topics along with page numbers where they are discussed
n. the finger next to the thumb"
equal,"v. be identical or equivalent to
v. be equal to in quality or ability
v. make equal, uniform, corresponding, or matching
a. having the same quantity, value, or measure as another"
divide,"n. a serious disagreement between two groups of people (typically producing tension or hostility)
v. separate into parts or portions
v. perform a division"
square,"n. (geometry) a plane rectangle with four equal sides and four right angles; a four-sided regular polygon
n. the product of two equal terms
n. something approximating the shape of a square
n. someone who doesn't understand what is going on"
consider,"v. take into consideration for exemplifying purposes
v. show consideration for; take into account
v. think about carefully; weigh
v. regard or treat with consideration, respect, and esteem"
less,"a. (comparative of `little' usually used with mass nouns) a quantifier meaning not as great in amount or degree
s. (usually preceded by `no') lower in quality
s. (nonstandard in some uses but often idiomatic with measure phrases) fewer
r. used to form the comparative of some adjectives and adverbs"
fit,"n. a display of bad temper
n. the manner in which something fits
v. be the right size or shape; fit correctly or as desired
v. make fit"
while,n. a period of indeterminate length (usually short) marked by some action or condition
shape,"n. any spatial attributes (especially as defined by outline)
n. the spatial arrangement of something as distinct from its substance
n. a concrete representation of an otherwise nebulous concept
v. make something, usually for a specific function"
poor,"a. having little money or few possessions
a. characterized by or indicating poverty
a. lacking in specific resources, qualities or substances
s. unsatisfactory"
qualify,"v. prove capable or fit; meet requirements
v. pronounce fit or able
v. make more specific
v. make fit or prepared"
frame,"n. the framework for a pair of eyeglasses
n. a single one of a series of still transparent pictures forming a cinema, television or video film
n. a single drawing in a comic_strip
n. an application that divides the user's display into two or more windows that can be scrolled independently"
label,"n. a brief description given for purposes of identification
n. trade name of a company that produces musical recordings
n. a radioactive isotope that is used in a compound in order to trace the mechanism of a chemical reaction
n. an identifying or descriptive marker that is attached to an object"
picture,"n. a visual representation (of an object or scene or person or abstraction) produced on a surface
n. a situation treated as an observable object
n. illustrations used to decorate or explain a text
n. a typical example of some state or quality"
will,"n. a fixed and persistent intent or purpose
n. a legal document declaring a person's wishes regarding the disposal of their property when they die
v. decree or ordain
v. determine by choice"
harbor,"n. a place of refuge and comfort and security
v. maintain (a theory, thoughts, or feelings)
v. secretly shelter (as of fugitives or criminals)"
build,"v. build or establish something abstract
v. improve the cleansing action of
v. order, supervise, or finance the construction of
v. give form to, according to a plan"
ground,"n. a position to be won or defended in battle (or as if in battle)
n. a relatively homogeneous percept extending back of the figure on which attention is focused
n. a connection between an electrical device and a large conducting body, such as the earth (which is taken to be at zero voltage)
n. (art) the surface (as a wall or canvas) prepared to take the paint for a painting"
stimulate,"v. act as a stimulant
v. stir the feelings, emotions, or peace of
v. cause to be alert and energetic
v. stir feelings in"
institute,"n. an association organized to promote art or science or education
v. advance or set forth in court"
initiative,"n readiness to embark on bold new ventures
n the first of a series of actions
s serving to set in motion"
emerge,"v. come out into view, as from concealment
v. become known or apparent
v. come up to the surface of or rise"
fortune,"n. a large amount of wealth or prosperity
n. your overall circumstances or condition in life (including everything that happens to you)"
fantasy,"n. imagination unrestricted by reality
n. fiction with a large amount of imagination in it
v. indulge in fantasies"
vision,"n. a vivid mental image
n. the perceptual experience of seeing
n. a religious or mystical experience of a supernatural appearance"
fancy,"n. a kind of imagination that was held by Coleridge to be more casual and superficial than true imagination
v. have a fancy or particular liking or desire for
a. not plain; decorative or ornamented"
rich,"a. possessing material wealth
a. having an abundant supply of desirable qualities or substances (especially natural resources)
s. of great worth or quality
s. very productive"
slim,"v take off weight
s being of delicate or slender build
s small in quantity"
turn,"n. the act of changing or reversing the direction of the course
n. (game) the activity of doing something in an agreed succession
n. an unforeseen development
n. the act of turning away or in the opposite direction"
object,"n. a tangible and visible entity; an entity that can cast a shadow
n. (grammar) a constituent that is acted upon
n. the focus of cognitions or feelings
n. (computing) a discrete item that provides a description of virtually anything known to a computer"
lot,"n. a parcel of land having fixed boundaries
n. (Old Testament) nephew of Abraham; God destroyed Sodom and Gomorrah but chose to spare Lot and his family who were told to flee without looking back at the destruction
v. divide into lots, as of land, for example"
anxious,"s. eagerly desirous
s. causing or fraught with or showing anxiety"
mandate,"n. a document giving an official instruction or command
n. a territory surrendered by Turkey or Germany after World War I and put under the tutelage of some other European power until they are able to stand by themselves
n. the commission that is given to a government and its policies through an electoral victory"
room,"n. an area within a building enclosed by walls and floor and ceiling
n. space for movement
n. opportunity for
n. the people who are present in a room"
employ,"n the state of being employed or having a job
v put into service; make work or employ for a particular purpose or for its inherent or natural purpose
v engage or hire for work"
ocean,"n. a large body of water constituting a principal part of the hydrosphere
n. anything apparently limitless in quantity or volume"
rate,"n. a magnitude or frequency relative to a time unit
n. amount of a charge or payment relative to some basis
n. a quantity or amount or measure considered as a proportion of another quantity or amount or measure
v. assign a rank or rating to"
boost,"n. the act of giving hope or support to someone
n. the act of giving a push
v. give a boost to; be beneficial to
v. increase or raise"
stalk,"n. a slender or elongated structure that supports a plant or fungus or a plant part or plant organ
n. a hunt for game carried on by following it stealthily or waiting in ambush
n. the act of following prey stealthily
n. a stiff or threatening gait"
have,"v. have or possess, either in a concrete or an abstract sense
v. have as a feature
v. have a personal or business relationship with someone
v. have left"
read,"n. something that is read
v. interpret something that is written or printed
v. have or contain a certain wording or form
v. look at, interpret, and say out loud something that is written or printed"
match,"n. lighter consisting of a thin piece of wood or cardboard tipped with combustible chemical; ignites with friction
n. a formal contest in which two or more persons or teams compete
n. a burning piece of wood or cardboard
n. an exact duplicate"
conscious,"s. intentionally conceived
a. knowing and perceiving; having awareness of surroundings and sensations and thoughts
s. (followed by `of') showing realization or recognition of something"
deliberation,"n. (usually plural) discussion of all sides of a question
n. careful consideration
n. the trait of thoughtfulness in action or decision"
doctor,"n. a licensed medical practitioner
n. children take the roles of physician or patient or nurse and pretend they are at the physician's office
n. a person who holds Ph.D. degree (or the equivalent) from an academic institution
v. give medical treatment to"
scale,"n. an ordered reference standard
n. relative magnitude
n. the ratio between the size of something and a representation of it
n. a specialized leaf or bract that protects a bud or catkin"
reflection,"n. the phenomenon of a propagating wave (light or sound) being thrown back from a surface
n. the image of something as reflected by a mirror (or other reflective material)
n. (mathematics) a transformation in which the direction of one axis is reversed
n. the ability to reflect beams or rays"
recognise,"v show approval or appreciation of
v grant credentials to
v detect with the senses
v express greetings upon meeting someone
v express obligation, thanks, or gratitude for
v be fully aware or cognizant of
v perceive to be the same
v accept (someone) to be what is claimed or accept his power and authority"
paradise,n. (Christianity) the abode of righteous souls after death
wit,n. a message whose ingenuity or verbal skill or incongruity has the power to evoke laughter
cream,"n. the best people or things in a group
n. the part of milk containing the butterfat
n. toiletry consisting of any of various substances in the form of a thick liquid that have a soothing and moisturizing effect when applied to the skin
v. make creamy by beating"
profile,"n. an analysis (often in graphical form) representing the extent to which something exhibits various characteristics
n. an outline of something (especially a human face as seen from one side)
n. biographical sketch
n. a vertical section of the Earth's crust showing the different horizons or layers"
portray,"v. portray in words
v. make a portrait of
v. represent abstractly, for example in a painting, drawing, or sculpture"
boom,"n. a deep prolonged loud noise
n. a state of economic prosperity
n. a sudden happening that brings good fortune (as a sudden opportunity to make money)
n. a pole carrying an overhead microphone projected over a film or tv set"
bust,"n. a sculpture of the head and shoulders of a person
n. an occasion for excessive eating or drinking"
cycle,"n. an interval during which a recurring sequence of events occurs
n. a series of poems or songs on the same theme
n. a periodically repeated sequence of events
n. a single complete execution of a periodically repeated phenomenon"
certain,"s. definite but not specified or identified
a. having or feeling no doubt or uncertainty; confident and assured
a. established beyond doubt or question; definitely known
a. certain to occur; destined or inevitable"
appetite,n. a feeling of craving something
ease,"n. freedom from difficulty or hardship or effort
n. a freedom from financial difficulty that promotes a comfortable state
n. freedom from constraint or embarrassment
v. move gently or carefully"
highlight,"n. the most interesting or memorable part
n. an area of lightness in a picture
v. apply a highlighter to one's cheeks or eyebrows in order to make them more prominent"
performance,"n. a dramatic or musical entertainment
n. the act of presenting a play or a piece of music or other entertainment
n. the act of performing; of doing something successfully; using knowledge as distinguished from merely possessing it
n. any recognized accomplishment"
hail,"n. precipitation of ice pellets when there are strong rising air currents
n. many objects thrown forcefully through the air
n. enthusiastic greeting
v. be a native of"
immune,"n. a person who is immune to a particular infection
a. relating to the condition of immunity
s. secure against
s. relating to or conferring immunity (to disease or infection)"
miss,"n. a failure to hit (or meet or find etc)
n. a form of address for an unmarried woman
v. fail to perceive or to catch with the senses or the mind
v. feel or suffer from the lack of"
mind,"n. that which is responsible for one's thoughts and feelings; the seat of the faculty of reason
n. recall or remembrance
n. attention
n. your intention; what you intend to do"
formula,"n. a group of symbols that make a mathematical statement
n. a conventionalized statement expressing some fundamental principle
n. a representation of a substance using symbols for its constituent elements
n. a liquid food for infants"
exercise,"n. the activity of exerting your muscles in various ways to keep fit
n. systematic training by multiple repetitions
n. a task performed or problem solved in order to develop skill or understanding
n. (usually plural) a ceremony that involves processions and speeches"
touch,"n. the event of something coming in contact with the body
n. the faculty by which external objects or forces are perceived through contact with the body (especially the hands)
n. a suggestion of some quality
n. a distinguishing style"
institution,"n. an organization founded and united for a specific purpose
n. an establishment consisting of a building or complex of buildings where an organization for the promotion of some cause is situated
n. a custom that for a long time has been an important feature of some group or society"
practice,"n. a customary way of operation or behavior
n. translating an idea into action
n. the exercise of a profession
n. knowledge of how something is usually done"
sector,"n. a plane figure bounded by two radii and the included arc of a circle
n. a social group that forms part of the society or the economy
n. a particular aspect of life or activity
n. the minimum track length that can be assigned to store information; unless otherwise specified a sector of data consists of 512 bytes"
shoulder,"n. the part of the body between the neck and the upper arm
n. a cut of meat including the upper joint of the foreleg
n. a ball-and-socket joint between the head of the humerus and a cavity of the scapula
n. the part of a garment that covers or fits over the shoulder"
charged,"a. of a particle or body or system; having a net amount of positive or negative electric charge
s. fraught with great emotion
s. capable of producing violent emotion or arousing controversy"
desperate,"n. a person who is frightened and in need of help
s. desperately determined
s. (of persons) dangerously reckless or violent as from urgency or despair
s. showing extreme courage; especially of actions courageously undertaken in desperation as a last resort"
spending,n. the act of spending or disbursing money
review,"n. an essay or article that gives a critical evaluation (as of a book or play)
n. (accounting) a service (less exhaustive than an audit) that provides some assurance to interested parties as to the reliability of financial data
n. a periodical that publishes critical essays on current affairs or literature or art
n. (law) a judicial reexamination of the proceedings of a court (especially by an appellate court)"
address,"n. (computer science) the code that identifies where a piece of information is stored
n. the place where a person or organization can be found or communicated with
n. the act of delivering a formal spoken communication to an audience
n. the manner of speaking to another individual"
introduce,"v. cause to come to know personally
v. bring something new to an environment
v. bring in or establish in a new place or environment
v. bring before the public for the first time, as of an actor, song, etc."
cap,"n. a tight-fitting headdress
n. a top (as for a bottle)
n. something serving as a cover or protection
n. a fruiting structure resembling an umbrella or a cone that forms the top of a stalked fleshy fungus such as a mushroom"
grant,"n. any monetary aid
n. the act of providing a subsidy
n. (law) a transfer of property by deed of conveyance
n. Scottish painter; cousin of Lytton Strachey and member of the Bloomsbury Group (1885-1978)"
set,"n. a group of things of the same kind that belong together and are so used
n. (mathematics) an abstract collection of numbers or symbols
n. several exercises intended to be done in series
n. an unofficial association of people or groups"
coalition,n. the state of being combined into one body
emerge,"v. come out into view, as from concealment
v. become known or apparent
v. come up to the surface of or rise"
confines,n. a bounded scope
medium,"n. a means or instrumentality for storing or communicating information
n. the surrounding environment
n. an intervening substance through which signals can travel as a means for communication
n. a liquid with which pigment is mixed by a painter"
piece,"n. a separate part of a whole
n. an item that is an instance of some type; 
n. an instance of some kind
n. an artistic or literary composition"
work,"n. activity directed toward making or doing something
n. a product produced or accomplished through the effort or activity or agency of a person or thing
n. (physics) a manifestation of energy; the transfer of energy from one physical system to another expressed as the product of a force and the distance through which it moves a body in the direction of that force
v. exert oneself by doing mental or physical work for a purpose or out of necessity"
obscure,"v. make less visible or unclear
v. make obscure or unclear
v. reduce a vowel to a neutral one, such as a schwa
v. make undecipherable or imperceptible by obscuring or concealing"
point,"n. a geometric element that has position but no extension
n. the precise location of something; a spatially limited location
n. a brief version of the essential meaning of something
n. an instant of time"
tone,"n. the quality of a person's voice
n. (linguistics) a pitch or change in pitch of the voice that serves to distinguish words in tonal languages
n. a steady sound without overtones
n. a musical interval of two semitones"
feature,"n. a prominent attribute or aspect of something
n. the characteristic parts of a person's face: eyes and nose and mouth and chin
n. the principal (full-length) film in a program at a movie theater
n. a special or prominent article in a newspaper or magazine"
permeate,v. spread or diffuse through
like,"n. a similar kind
n. a kind of person
v. find enjoyable or agreeable
v. be fond of"
readily,r. without much difficulty
still,"n. a static photograph (especially one taken from a movie and used for advertising purposes)
n. an apparatus used for the distillation of liquids; consists of a vessel in which a substance is vaporized by heat and a condenser where the vapor is condensed
v. lessen the intensity of or calm
v. make motionless"
shot,"n. a solid missile discharged from a firearm
n. a chance to do something
n. a person who shoots (usually with respect to their ability to shoot)
n. an aggressive remark directed at a person like a missile and intended to have a telling effect"
modest,"a. marked by simplicity; having a humble opinion of yourself
s. not large but sufficient in size or amount
s. free from pomp or affectation
a. not offensive to sexual mores in conduct or appearance"
down,"n. soft fine feathers
n. (American football) a complete play to advance the football
n. English physician who first described Down's syndrome (1828-1896)
n. (usually plural) a rolling treeless highland with little soil"
say,"n. the chance to speak
v. communicate or express nonverbally
v. utter aloud
v. state as one's opinion or judgement; declare"
grant,"n. any monetary aid
n. the act of providing a subsidy
n. (law) a transfer of property by deed of conveyance
n. Scottish painter; cousin of Lytton Strachey and member of the Bloomsbury Group (1885-1978)"
scheme,"n. an elaborate and systematic plan of action
v. form intrigues (for) in an underhand manner
v. devise a system or form a scheme for"
given,"n. an assumption that is taken for granted
s. acknowledged as a supposition"
around,"r. by a circular or circuitous route
r. in a circle or circular motion
r. to a particular destination either specified or understood
r. in circumference"
means,"n. how a result is obtained or an end is achieved
n. an instrumentality for accomplishing some end
n. considerable capital (wealth or income)"
reverse,"n. a relation of direct opposition
n. the gears by which the motion of a machine can be reversed
n. an unfortunate happening that hinders or impedes; something that is thwarting or frustrating
n. the side of a coin or medal that does not bear the principal design"
work,"n. activity directed toward making or doing something
n. a product produced or accomplished through the effort or activity or agency of a person or thing
n. (physics) a manifestation of energy; the transfer of energy from one physical system to another expressed as the product of a force and the distance through which it moves a body in the direction of that force
v. exert oneself by doing mental or physical work for a purpose or out of necessity"
check,"n. a written order directing a bank to pay money
n. the bill in a restaurant
n. the act of inspecting or verifying
n. a mark left after a small piece has been chopped or broken off of something"
cash,"n. money in the form of bills or coins
n. prompt payment for goods or services in currency or by check
n. United States country music singer and songwriter (1932-2003)
v. exchange for cash"
writer,"n. writes (books or stories or articles or the like) professionally (for pay)
n. a person who is able to write and has written something"
interest,"n. a sense of concern with and curiosity about someone or something
n. the power of attracting or holding one's attention (because it is unusual or exciting etc.)
n. a fixed charge for borrowing money; usually a percentage of the amount borrowed
n. (law) a right or legal share of something; a financial involvement with something"
withdraw,"v. pull back or move away or backward
v. remove (a commodity) from (a supply source)"
raise,"n. the amount a salary is increased
n. increasing the size of a bet (as in poker)
v. raise the level or amount of something
v. raise from a lower to a higher position"
access,"n. the right to obtain or make use of or take advantage of something (as services or membership)
n. a way of entering or leaving
n. a code (a series of characters or digits) that must be entered in some way (typed or dialed or spoken) to get the use of something (a telephone line or a computer or a local area network etc.)
n. (computer science) the operation of reading or writing stored information"
field,"n. a piece of land cleared of trees and usually enclosed
n. somewhere (away from a studio or office or library or laboratory) where practical work is done or data is collected
n. the space around a radiating body within which its electromagnetic oscillations can exert force on another similar body not in contact with it
n. a particular kind of commercial enterprise"
violate,"v. fail to agree with; be in violation of; as of rules or patterns
v. destroy"
entitle,"v. give the right to
v. give a title to"
