abolish,v. do away with
cancel,"v. postpone indefinitely or annul something that was scheduled
v. make up for
v. declare null and void; make ineffective
v. make invalid for use"
accept,"v. consider or hold as true
v. receive willingly something given or offered
v. give an affirmative reply to; respond favorably to
v. react favorably to; consider right and proper"
receive,"v. get something; come into possession of
v. receive a specified treatment (abstract)
v. express willingness to have in one's home or environs
v. accept as true or valid"
accurate,"a. conforming exactly or almost exactly to fact or to a standard or performing with total accuracy
s. (of ideas, images, representations, expressions) characterized by perfect conformity to fact or truth; strictly correct"
precise,a. sharply exact or accurate or delimited
annoy,"v. cause annoyance in; disturb, especially by minor irritations"
irritate,"v. excite to an abnormal condition, or chafe or inflame
v. excite to some characteristic action or condition, such as motion, contraction, or nervous impulse, by the application of a stimulus"
beneficial,s. promoting or enhancing well-being
profitable,a. yielding material gain or profit
charge,"n. an impetuous rush toward someone or something
n. (criminal law) a pleading describing some wrong or offense
n. the price charged for some article or service
n. the quantity of unbalanced electricity in a body (either positive or negative) and construed as an excess or deficiency of electrons"
expense,"n. amounts paid for goods and services that may be currently tax deductible (as opposed to capital expenditures)
n. a detriment or sacrifice
n. money spent to perform work and usually reimbursed by an employer
v. reduce the estimated value of something"
cite,"n a short note recognizing a source of information or of a quoted passage
v make reference to
v commend
v refer to
v repeat a passage from
v refer to for illustration or proof
v advance evidence for
v call in an official matter, such as to attend court"
quote,"v. repeat a passage from
v. name the price of
v. refer to for illustration or proof
v. put quote marks around"
devote,v. set aside or apart for a specific purpose or use
dedicate,"v. open to public use, as of a highway, park, or building
v. inscribe or address by way of compliment
v. set apart to sacred uses with solemn rites, of a church"
economical,s. avoiding waste
economic,"a. of or relating to an economy, the system of production and management of material wealth
a. of or relating to the science of economics
s. using the minimum of time or resources necessary for effectiveness
s. concerned with worldly necessities of life (especially money)"
effective,"a. producing or capable of producing an intended result or having a striking effect
s. able to accomplish a purpose; functioning effectively
s. works well as a means or remedy
s. exerting force or influence"
efficient,a. being effective without wasting time or effort or expense
eliminate,"v. kill in large numbers
v. remove from a contest or race
v. remove (an unknown variable) from two or more equations"
exclude,"v. prevent from being included or considered or accepted
v. prevent from entering; shut out
v. lack or fail to include"
fancy,"n. a kind of imagination that was held by Coleridge to be more casual and superficial than true imagination
v. have a fancy or particular liking or desire for
a. not plain; decorative or ornamented"
imagination,"n. the formation of a mental image of something that is not perceived as real and is not present to the senses
n. the ability to form mental images of things or events"
favorable,"a. encouraging or approving or pleasing
a. (of winds or weather) tending to promote or facilitate
s. occurring at a convenient or suitable time"
favorite,"n. something regarded with special favor or liking
s. appealing to the general public"
genius,"n. someone who has exceptional intellectual ability and originality
n. exceptional creative ability"
talent,n. a person who possesses unusual innate ability in some field or activity
gift,n. something acquired without compensation
present,"n. the period of time that is happening now; any continuous stretch of time including the moment of speech
n. something presented as a gift
n. a verb tense that expresses actions or states at the time of speaking
v. bring forward and present to the mind"
grand,"s. large and impressive in physical size or extent
s. the most important and magnificent in adornment"
magnificent,s characterized by grandeur
heal,v. get healthy again
cure,"v. prepare by drying, salting, or chemical processing in order to preserve
v. make (substances) hard and improve their usability
v. be or become preserved"
ignorant,"s. uneducated in general; lacking knowledge or sophistication
s. uneducated in the fundamentals of a given art or branch of learning; lacking knowledge of a specific field
s. unaware because of a lack of relevant information or knowledge"
innocent,"n. a person who lacks knowledge of evil
a. free from evil or guilt
s. lacking intent or capacity to injure
s. lacking in sophistication or worldliness"
ignore,"v. refuse to acknowledge
v. fail to notice
v. be ignorant of or in the dark about"
disregard,"n. lack of attention and due care
n. willful lack of care and attention"
illustrate,"v. depict with an illustration
v. supply with illustrations"
interpret,"v. make sense of; assign a meaning to
v. give an interpretation or rendition of"
immerse,"v. thrust or throw into
v. enclose or envelop completely, as if by swallowing"
submerge,"v. sink below the surface; go under or as if under water
v. cover completely or make imperceptible
v. put under water"
imply,"v. express or state indirectly
v. suggest as a logically necessary consequence; in logic
v. have as a necessary feature"
infer,"v reason by deduction; establish by deduction
v draw from specific cases for more general cases
v conclude by reasoning; in logic
v guess correctly; solve by guessing
v believe to be the case"
importance,"n. the quality of being important and worthy of note
n. a prominent status"
consequence,"n. a phenomenon that follows and is caused by some previous phenomenon
n. the outcome of an event especially as relative to an individual
n. having important effects or influence"
increase,"n. a change resulting in an increase
n. a process of becoming larger or longer or more numerous or more important
n. the amount by which something increases
n. the act of increasing something"
magnify,"v. increase in size, volume or significance"
situation,"n. the general state of things; the combination of circumstances at a given time
n. a condition or position in which you find yourself
n. a complex or critical or unusual difficulty"
position,"n. the particular portion of space occupied by something
n. a way of regarding situations or topics etc.
n. the arrangement of the body and its limbs
n. a job in an organization"
technology,n. the practical application of science to commerce or industry
technique,n. a practical method or art applied to some particular task
label,"n. a brief description given for purposes of identification
n. trade name of a company that produces musical recordings
n. a radioactive isotope that is used in a compound in order to trace the mechanism of a chemical reaction
n. an identifying or descriptive marker that is attached to an object"
tag,"n. a label written or printed on paper, cardboard, or plastic that is attached to something to indicate its owner, nature, price, etc.
n. a label associated with something for the purpose of identification
n. a game in which one child chases the others; the one who is caught becomes the next chaser
n. (sports) the act of touching a player in a game (which changes their status in the game)"
venture,"n. any venturesome undertaking especially one with an uncertain outcome
n. a commercial undertaking that risks a loss but promises a profit
v. proceed somewhere despite the risk of possible dangers
v. put at risk"
adventure,n. a wild and exciting undertaking (not necessarily lawful)
mature,"v. develop and reach maturity; undergo maturation
v. develop and work out fully in one's mind
v. become due for repayment
a. characteristic of maturity"
ripe,"a. fully developed or matured and ready to be eaten or used
s. fully prepared or eager
s. at the highest point of development especially in judgment or knowledge"
rare,"s. not widely known; especially valued for its uncommonness
s. recurring only at long intervals
s. not widely distributed
s. having low density"
scarce,a. deficient in quantity or number compared with the demand
rate,"n. a magnitude or frequency relative to a time unit
n. amount of a charge or payment relative to some basis
n. a quantity or amount or measure considered as a proportion of another quantity or amount or measure
v. assign a rank or rating to"
ratio,n. the relative magnitudes of two quantities (usually expressed as a quotient)
limit,"n. the greatest possible degree of something
n. as far as something can go
n. the boundary of a specific area
n. the mathematical value toward which a function goes as the independent variable approaches infinity"
limitation,"n. the quality of being limited or restricted
n. (law) a time period after which suits cannot be brought
n. an act of limiting or restricting (as by regulation)"
stern,"n. the rear part of a ship
n. United States concert violinist (born in Russia in 1920)
s. severe and unremitting in making demands"
strict,"s rigidly accurate; allowing no deviation from a standard
s (of rules) stringently enforced
a characterized by strictness, severity, or restraint
s incapable of compromise or flexibility
s severe and unremitting in making demands"
ban,"n. 100 bani equal 1 leu in Moldova
n. 100 bani equal 1 leu in Romania
n. an official prohibition or edict against something
v. forbid the public distribution of ( a movie or a newspaper)"
prohibit,v command against
forbid,v. command against
hardly,r. almost not
scarcely,"r only a very short time before
r almost not"
barely,r. only a very short time before
beam,"n. long thick piece of wood or metal or concrete, etc., used in construction
n. a group of nearly parallel lines of electromagnetic radiation
n. a column of light (as from a beacon)
n. (nautical) breadth amidships"
glare,"n. a light within the field of vision that is brighter than the brightness to which the eyes are adapted
n. an angry stare
v. be sharply reflected
v. shine intensely"
flare,"n. a shape that spreads outward
n. a sudden burst of flame
n. a burst of light used to communicate or illuminate
n. reddening of the skin spreading outward from a focus of infection or irritation"
decline,"n. change toward something smaller or lower
n. a condition inferior to an earlier condition; a gradual falling off from a better state
v. grow smaller
v. go down"
refuse,"v. show unwillingness towards
v. refuse to accept"
reject,"v. refuse to accept or acknowledge
v. reject with contempt
v. refuse entrance or membership"
identify,"v. recognize as being; establish the identity of someone or something
v. consider (oneself) as similar to somebody else
v. conceive of as united or associated
v. identify as in botany or biology, for example"
distinguish,"v. mark as different
v. be a distinctive feature, attribute, or trait; sometimes in a very positive sense"
recognize,"v. be fully aware or cognizant of
v. perceive to be the same
v. exhibit recognition for (an antigen or a substrate)
v. show approval or appreciation of"
aim,"n. the goal intended to be attained (and which is believed to be attainable)
n. the action of directing something at an object
v. point or cause to go (blows, weapons, or objects such as photographic equipment) towards
v. propose or intend"
goal,"n. the state of affairs that a plan is intended to achieve and that (when achieved) terminates behavior intended to achieve it
n. game equipment consisting of the place toward which players of a game try to advance a ball or puck in order to score points
n. a successful attempt at scoring"
purpose,"n. an anticipated outcome that is intended or that guides your planned actions
v. reach a decision"
obscure,"v. make less visible or unclear
v. make obscure or unclear
v. reduce a vowel to a neutral one, such as a schwa
v. make undecipherable or imperceptible by obscuring or concealing"
ambiguous,"a. having more than one possible meaning
s. having no intrinsic or objective meaning; not organized in conventional patterns"
vague,"s not clearly understood or expressed
a not precisely limited, determined, or distinguished
s lacking clarity or distinctness"
obvious,a. easily perceived by the senses or grasped by the mind
evident,"s clearly revealed to the mind or the senses or judgment
s capable of being seen or noticed"
apparent,"s. clearly revealed to the mind or the senses or judgment
s. appearing as such but not necessarily so"
scenery,"n. the painted structures of a stage set that are intended to suggest a particular locale
n. the appearance of a place"
scene,"n. the place where some action occurs
n. an incident (real or imaginary)
n. a consecutive series of pictures that constitutes a unit of action in a film
n. a subdivision of an act of a play"
view,"n. the visual percept of a region
n. the act of looking or seeing or observing
n. the range of the eye
n. purpose; the phrase `with a view to' means `with the intention of' or `for the purpose of'"
justify,"v. show to be reasonable or provide adequate ground for
v. show to be right by providing justification or proof
v. adjust the spaces between words"
testify,"v. give testimony in a court of law
v. provide evidence for"
certify,"v. guarantee payment on; of checks
v. guarantee as meeting a certain standard
v. declare legally insane"
universal,"n. (linguistics) a grammatical rule (or other linguistic feature) that is found in all languages
n. (logic) a proposition that asserts something of all members of a class
n. a behavioral convention or pattern characteristic of all members of a particular culture or of all human beings
s. applicable to or common to all members of a group or set"
common,"a. belonging to or participated in by a community as a whole; public
a. having no special distinction or quality; widely known or commonly encountered; average or ordinary or usual
s. common to or shared by two or more parties
s. commonly encountered"
general,"n. a general officer of the highest rank
n. the head of a religious order or congregation
n. a fact about the whole (as opposed to particular)
v. command as a general"
vanish,"v. become invisible or unnoticeable
v. cease to exist
v. decrease rapidly and disappear"
disappear,"v. get lost, as without warning or explanation"
fade,"n. gradually ceasing to be visible
v. become less clearly visible or distinguishable; disappear gradually or seemingly
v. lose freshness, vigor, or vitality"
abandon,"n. the trait of lacking restraint or control; reckless freedom from inhibition or worry
v. forsake, leave behind
v. give up with the intent of never claiming again
v. stop maintaining or insisting on; of ideas or claims"
desert,"n. arid land with little or no vegetation
v. leave behind"
discard,"n. anything that is cast aside or discarded
n. (cards) the act of throwing out a useless card or of failing to follow suit
n. getting rid something that is regarded as useless or undesirable
v. throw or cast away"
basis,"n. the fundamental assumptions from which something is begun or developed or calculated or explained
n. the most important or necessary part of something"
base,"n. installation from which a military force initiates operations
n. a place that the runner must touch before scoring
n. the bottom or lowest part
n. (anatomy) the part of an organ nearest its point of attachment"
foundation,"n. the basis on which something is grounded
n. an institution supported by an endowment
n. lowest support of a structure
n. education or instruction in the fundamentals of a field of knowledge"
campaign,"n. a series of actions advancing a principle or tending toward a particular end
n. several related operations aimed at achieving a particular goal (usually within geographical and temporal constraints)
n. an overland journey by hunters (especially in Africa)
v. run, stand, or compete for an office or a position"
motion,"n. a change of position that does not entail a change of location
n. a state of change
n. a formal proposal for action made to a deliberative assembly for discussion and vote
n. the act of changing location from one place to another"
movement,"n. a natural event that involves a change in the position or location of something
n. a group of people with a common ideology who try together to achieve certain general goals
n. a major self-contained part of a symphony or sonata
n. the driving and regulating parts of a mechanism (as of a watch or clock)"
elementary,"s. easy and not involved or complicated
a. of or pertaining to or characteristic of elementary school or elementary education
s. of or being the essential or basic part"
basic,"n. a popular programming language that is relatively easy to learn; an acronym for beginner's all-purpose symbolic instruction code; no longer in general use
n. (usually plural) a necessary commodity for which demand is constant
a. pertaining to or constituting a base or basis
s. reduced to the simplest and most significant form possible without loss of generality"
essential,"s. absolutely necessary; vitally necessary
a. basic and fundamental
a. being or relating to or containing the essence of a plant etc"
fundamental,"n. any factor that could be considered important to the understanding of a particular business
n. the lowest tone of a harmonic series
s. being or involving basic facts or principles
s. far-reaching and thoroughgoing in effect especially on the nature of something"
pay,"v. give money, usually in exchange for goods or services
v. do or give something to somebody in return
v. be worth it
v. render"
payment,"n. a sum of money paid or a claim discharged
n. the act of paying money"
wage,n. something that remunerates
salary,n something that remunerates
grasp,v. hold firmly
grip,"n. the friction between a body and the surface on which it moves (as between an automobile tire and the road)
n. worker who moves the camera around while a film or television show is being made
n. an intellectual hold or understanding
v. hold fast or firmly"
guarantee,"n. a written assurance that some product or service will be provided or will meet certain specifications
n. an unconditional commitment that something will happen or that something is true
n. a collateral agreement to answer for the debt of another in case that person defaults
v. give surety or assume responsibility"
assure,"v. inform positively and with certainty and confidence
v. assure somebody of the truth of something with the intention of giving the listener confidence"
memory,"n. something that is remembered
n. the cognitive processes whereby past experience is remembered
n. the power of retaining and recalling past experience
n. an electronic memory device"
recollection,n. something recalled to the mind
sign,"n. a perceptible indication of something not immediately apparent (as a visible clue that something has happened)
n. a public display of a message
n. (medicine) any objective evidence of the presence of a disorder or disease
n. a gesture that is part of a sign language"
signal,"n. any nonverbal action or gesture that encodes a message
n. any incitement to action
n. an electric quantity (voltage or current or field strength) whose modulation represents coded information about the source from which it comes
s. notably out of the ordinary"
adjoining,"v lie adjacent to another or share a boundary
v be in direct physical contact with; make contact
v attach or add"
adjacent,"s. nearest in space or position; immediately adjoining without intervening space
s. having a common boundary or edge; abutting; touching; Massachusetts and Conncecticut""
s. near or close to but not necessarily touching"
admission,"n. the act of admitting someone to enter
n. an acknowledgment of the truth of something"
admittance,"n the right to enter
n the act of admitting someone to enter"
adapt,"v. make fit for, or change to suit a new purpose"
adjust,"v. alter or regulate so as to achieve accuracy or conform to a standard
v. adapt or conform oneself to new or different conditions
v. make correspondent or conformable
v. decide how much is to be paid on an insurance claim"
enlighten,"v. make understand
v. give spiritual insight to; in religion"
instruct,"v. give instructions or directions for some task
v. make aware of"
form,"n. the phonological or orthographic sound or appearance of a word that can be used to describe or identify something
n. a perceptual structure
n. the visual appearance of something or someone
n. a printed document with spaces in which to write"
shape,"n. any spatial attributes (especially as defined by outline)
n. the spatial arrangement of something as distinct from its substance
n. a concrete representation of an otherwise nebulous concept
v. make something, usually for a specific function"
fate,"n an event (or a course of events) that will inevitably happen in the future
n the ultimate agency regarded as predetermining the course of events (often personified as a woman)
n your overall circumstances or condition in life (including everything that happens to you)
v decree or designate beforehand"
fortune,"n. a large amount of wealth or prosperity
n. your overall circumstances or condition in life (including everything that happens to you)"
criminal,"n. someone who has committed a crime or has been legally convicted of a crime
s. guilty of crime or serious offense
s. involving or being or having the nature of a crime"
guilty,"a. responsible for or chargeable with a reprehensible act
s. showing a sense of guilt"
affect,"n. the conscious subjective aspect of feeling or emotion
v. have an effect upon
v. act physically on; have an effect upon
v. have an emotional or cognitive impact upon"
influence,"n. a power to affect persons or events especially power based on prestige etc
n. causing something without any direct or apparent effort
n. a cognitive factor that tends to have an effect on what you do
n. the effect of one thing (or person) on another"
affection,n. a positive feeling of liking
love,"n. a strong positive emotion of regard and affection
n. any object of warm affection or devotion; 
n. a deep feeling of sexual desire and attraction
n. a score of zero in tennis or squash"
agreeable,"a. conforming to your own liking or feelings or nature
s. prepared to agree or consent"
pleasant,"a. affording pleasure; being in harmony with your taste or likings
s. (of persons) having pleasing manners or behavior"
surprise,"n. the astonishment you feel when something totally unexpected happens to you
n. a sudden unexpected event
n. the act of surprising someone
v. cause to be surprised"
amaze,v. affect with wonder
comprise,"v be composed of
v include or contain; have as a component
v form or compose"
constitute,v. form or compose
conceive,v. become pregnant; undergo conception
imagine,v. form a mental image of something that is not present or that is not the case
concrete,"n. a strong hard building material composed of sand and gravel and cement and water
v. cover with cement
v. form into a solid mass; coalesce
a. capable of being perceived by the senses; not abstract or imaginary"
specific,"n. a medicine that has a mitigating effect on a specific disease
a. (sometimes followed by `to') applying to or characterized by or distinguishing something particular or special or unique
s. stated explicitly or in detail
a. relating to or distinguishing or constituting a taxonomic species"
indignity,n. an affront to one's dignity or self-esteem
insult,n. a deliberately offensive act or something producing the effect of deliberate disrespect
condemn,"v. express strong disapproval of
v. declare or judge unfit for use or habitation
v. compel or force into a particular state or activity
v. demonstrate the guilt of (someone)"
blame,"n. a reproach for some lapse or misdeed
v. put or pin the blame on
v. harass with constant criticism
v. attribute responsibility to"
admit,"v. declare to be true or admit the existence or reality or truth of
v. allow to enter; grant entry to
v. allow participation in or the right to be part of; permit to exercise the rights, functions, and responsibilities of
v. afford possibility"
confess,"v. confess to a punishable or reprehensible deed, usually under pressure
v. confess to God in the presence of a priest, as in the Catholic faith"
potential,"n. the inherent capacity for coming into being
a. existing in possibility"
implicit,"a. implied though not directly expressed; inherent in the nature of something
s. being without doubt or reserve"
practical,"a. concerned with actual use or practice
s. having or put to a practical purpose or use"
practicable,"s usable for a specific purpose
s capable of being done with means at hand and circumstances as they are"
precious,"s. of high worth or cost
r. extremely"
valuable,"n. something of value
a. having great material or monetary value especially for use or exchange
s. having worth or merit or value"
conscious,"s. intentionally conceived
a. knowing and perceiving; having awareness of surroundings and sensations and thoughts
s. (followed by `of') showing realization or recognition of something"
aware,a. (sometimes followed by `of') having or showing knowledge or understanding or realization or perception
predict,v. make a prediction about; tell in advance
forecast,v. predict in advance
