version,"n. an interpretation of a matter from a particular viewpoint
n. something a little different from others of the same type
n. manual turning of a fetus in the uterus (usually to aid delivery)"
unattractive,"a. lacking beauty or charm
s. lacking power to arouse interest
s. not appealing to the senses"
assistant,n. a person who contributes to the fulfillment of a need or furtherance of an effort or purpose
descend,"v. move downward and lower, but not necessarily all the way"
doubtless,r without doubt; certainly
scold,n. someone (especially a woman) who annoys people by constantly finding fault
imagine,v. form a mental image of something that is not present or that is not the case
bargain,"n. an agreement between parties (usually arrived at after discussion) fixing obligations of each
n. an advantageous purchase
v. come to terms; arrive at an agreement"
garment,n. an article of clothing
top-down,a. of an approach to a problem that begins at the highest conceptual level and works down to the details
feverish,"s. marked by intense agitation or emotion
s. having or affected by a fever"
label,"n. a brief description given for purposes of identification
n. trade name of a company that produces musical recordings
n. a radioactive isotope that is used in a compound in order to trace the mechanism of a chemical reaction
n. an identifying or descriptive marker that is attached to an object"
anticipate,"v. act in advance of; deal with ahead of time
v. realize beforehand
v. be excited or anxious about
v. be a forerunner of or occur earlier than"
inventory,"n. a detailed list of all the items in stock
n. (accounting) the value of a firm's current assets including raw materials and work in progress and finished goods
n. making an itemized list of merchandise or supplies on hand
v. make or include in an itemized record or report"
profit,"n. the advantageous quality of being beneficial
v. derive a benefit from
v. make a profit; gain money or materially"
disposable,"n. an item that can be disposed of after it has been used
a. free or available for use or disposition
a. designed to be disposed of after use"
advertise,"v. call attention to
v. make publicity for; try to sell (a product)"
conception,n. the act of becoming pregnant; fertilization of an ovum by a spermatozoon
indictment,"n. a formal document written for a prosecuting attorney charging a person with some offense
n. an accusation of wrongdoing"
react,"v. show a response or a reaction to something
v. act against or in opposition to
v. undergo a chemical reaction; react with another substance under certain conditions"
turnaround,"n. time need to prepare a vessel or ship for a return trip
n. an area sufficiently large for a vehicle to turn around
n. act or process of unloading and loading and servicing a vessel or aircraft for a return trip"
release,"n. merchandise issued for sale or public showing (especially a record or film)
n. a process that liberates or discharges something
n. a device that when pressed will release part of a mechanism
n. activity that frees or expresses creative energy or emotion"
renew,"v reestablish on a new, usually improved, basis or make new or like new
v cause to appear in a new form"
wardrobe,"n. a tall piece of furniture that provides storage space for clothes; has a door and rails or hooks for hanging clothes
n. collection of clothing belonging to one person
n. collection of costumes belonging to a theatrical company"
dirt-cheap,none
accustom,v make psychologically or physically used (to something)
on-trend,none
hijack,"n. seizure of a vehicle in transit either to rob it or divert it to an alternate destination
v. seize control of"
victim,"n. an unfortunate person who suffers from some adverse circumstance
n. a person who is tricked or swindled"
low-wage,none
volume,"n. the amount of 3-dimensional space occupied by an object
n. a publication that is one of a set of several similar publications
n. a relative amount
n. the magnitude of sound (usually in a specified direction)"
massive,"s. imposing in size or bulk or solidity
s. being the same substance throughout
s. imposing in scale or scope or degree or power
s. consisting of great mass; containing a great quantity of matter"
knit,"n. a fabric made by knitting
n. a basic knitting stitch
n. needlework created by interlacing yarn in a series of connected loops using straight eyeless needles or by machine
v. make (textiles) by knitting"
overseas,r. in a place across an ocean
strain,"n. (physics) deformation of a physical body under the action of applied forces
n. (psychology) nervousness resulting from mental stress
n. injury to a muscle (often caused by overuse); results in swelling and pain
n. an intense or violent exertion"
activist,s. advocating or engaged in activism
dilemma,n. state of uncertainty or perplexity especially as requiring a choice between equally unfavorable options
roughly,"r. with roughness or violence (`rough' is an informal variant for `roughly')
r. with rough motion as over a rough surface"
excess,"n. a quantity much larger than is needed
n. immoderation as a consequence of going beyond sufficient or permitted limits
s. more than is needed, desired, or required"
bestseller,n a book that has had a large and rapid sale
durable,"s. existing for a long time
s. capable of withstanding wear and tear and decay
s. very long lasting"
billion,"n. the number that is represented as a one followed by 12 zeros; in the United Kingdom the usage followed in the United States is frequently seen
n. the number that is represented as a one followed by 9 zeros
s. denoting a quantity consisting of one thousand million items or units in the United States
s. denoting a quantity consisting of one million million items or units in Great Britain"
ideal,"n. the idea of something that is perfect; something that one hopes to attain
n. model of excellence or perfection of a kind; one having no equal
s. conforming to an ultimate standard of perfection or excellence; embodying an ideal
s. constituting or existing only in the form of an idea or mental image or conception"
knock off,n. an unauthorized copy or imitation
craft,"n. a vehicle designed for navigation in or on water or air or through outer space
n. people who perform a particular kind of skilled work
n. skill in an occupation or trade
n. shrewdness as demonstrated by being skilled in deception"
make efforts,none
conscious,"s. intentionally conceived
a. knowing and perceiving; having awareness of surroundings and sensations and thoughts
s. (followed by `of') showing realization or recognition of something"
idealism,"n. (philosophy) the philosophical theory that ideas are the only reality
n. impracticality by virtue of thinking of things in their ideal form rather than as they really are"
sustainability,n. the property of being sustainable
vanity,n. the quality of being valueless or futile
sustainably,none
afford,"v. be able to spare or give up
v. have the financial means to do something or buy something
v. afford access to"
curb,"n. an edge between a sidewalk and a roadway consisting of a line of curbstones (usually forming part of a gutter)
n. a horse's bit with an attached chain or strap to check the horse
v. keep to the curb"
lasting,s. lasting a long time without change
advocate,"n. a person who pleads for a cause or propounds an idea
n. a lawyer who pleads cases in court"
constant,"n. a quantity that does not vary
n. a number representing a quantity assumed to have a fixed value in a specified mathematical context
a. steadfast in purpose or devotion or affection"
straightforward,"s. free from ambiguity
s. pointed directly ahead"
journal,"n. a periodical dedicated to a particular subject
n. a record book as a physical object
n. the part of the axle contained by a bearing"
affiliation,"n. a social or business relationship
n. the act of becoming formally connected or joined"
publication,"n. a copy of a printed work offered for distribution
n. the communication of something to the public; making information generally known
n. the business of issuing printed matter for sale or distribution"
copyright,"n. a document granting exclusive right to publish and sell literary or musical or artistic work
v. secure a copyright on a written work"
subscribe,"v. offer to buy, as of stocks and shares
v. adopt as a belief
v. receive or obtain regularly"
submit,"v. refer for judgment or consideration
v. put before
v. yield to the control of another
v. yield to another's wish or opinion"
editor,n. a person responsible for the editorial aspects of publication; the person who determines the final content of a text (especially of a newspaper or magazine)
comment,"n. a written explanation or criticism or illustration that is added to a book or other textual material
v. make or write a comment on
v. explain or interpret something"
decline,"n. change toward something smaller or lower
n. a condition inferior to an earlier condition; a gradual falling off from a better state
v. grow smaller
v. go down"
agency,"n. an administrative unit of government
n. a business that serves other businesses
n. the state of being in action or exerting power"
access,"n. the right to obtain or make use of or take advantage of something (as services or membership)
n. a way of entering or leaving
n. a code (a series of characters or digits) that must be entered in some way (typed or dialed or spoken) to get the use of something (a telephone line or a computer or a local area network etc.)
n. (computer science) the operation of reading or writing stored information"
co-operation,"n. joint operation or action
n. the practice of cooperating"
far-reaching,none
restrict,"v. place restrictions on
v. place under restrictions; limit access to
v. place limits on (extent or access)"
reality,"n. the state of being actual or real
n. the state of the world as it really is rather than as you might want it to be
n. the quality possessed by something that is real"
issue,"n. an important question that is in dispute and must be settled
n. one of a series published periodically
n. the act of providing an item for general use or for official purposes (usually in quantity)
n. supplies (as food or clothing or ammunition) issued by the government"
consequence,"n. a phenomenon that follows and is caused by some previous phenomenon
n. the outcome of an event especially as relative to an individual
n. having important effects or influence"
profit,"n. the advantageous quality of being beneficial
v. derive a benefit from
v. make a profit; gain money or materially"
element,"n. the most favorable environment for a plant or animal
n. one of four substances thought in ancient and medieval cosmology to constitute the physical universe
n. the situation in which you are happiest and most effective
n. a straight line that generates a cylinder or cone"
handsome,"s pleasing in appearance especially by reason of conformity to ideals of form and proportion
s given or giving freely"
signal,"n. any nonverbal action or gesture that encodes a message
n. any incitement to action
n. an electric quantity (voltage or current or field strength) whose modulation represents coded information about the source from which it comes
s. notably out of the ordinary"
endeavor,v. attempt by employing effort
distribution,"n. (statistics) an arrangement of values of a variable showing their observed or theoretical frequency of occurrence
n. the spatial or geographic property of being scattered about over a range, area, or volume
n. the act of distributing or spreading or apportioning
n. the commercial activity of transporting and selling goods from a producer to a consumer"
estimate,"n. an approximate calculation of quantity or degree or worth
n. a judgment of the qualities of something or somebody
n. a statement indicating the likely cost of some job
n. the respect with which a person is held"
association,"n. a formal organization of people or groups of people
n. the act of consorting with or joining with others
n. the state of being connected together as in memory or imagination
n. the process of bringing ideas or events together in memory or imagination"
specialize,"v. become more focus on an area of activity or field of study
v. suit to a special purpose
v. devote oneself to a special area of work"
core,"n. a small group of indispensable persons or things
n. the center of an object
n. the central part of the Earth
n. a cylindrical sample of soil or rock obtained with a hollow drill"
medical,"a. relating to the study or practice of medicine
a. requiring or amenable to treatment by medicine especially as opposed to surgery"
subject,"n. the subject matter of a conversation or discussion
n. something (a person or object or scene) selected by an artist or photographer for graphic representation
n. (grammar) one of the two main constituents of a sentence; the grammatical constituent about which something is predicated
n. a person who is subjected to experimental or other observational procedures; someone who is an object of investigation"
scholarly,a. characteristic of scholars or scholarship
emerge,"v. come out into view, as from concealment
v. become known or apparent
v. come up to the surface of or rise"
institutional,"a. relating to or constituting or involving an institution
a. organized as or forming an institution"
subscriber,"n. someone who expresses strong approval
n. someone who contracts to receive and pay for a service or a certain number of issues of a publication
n. someone who contributes (or promises to contribute) a sum of money"
archive,"n. a depository containing historical records and documents
v. put into an archive"
repository,"n. a person to whom a secret is entrusted
n. a burial vault (usually for some famous person)"
entirely,r. without any others being included or involved
identify,"v. recognize as being; establish the identity of someone or something
v. consider (oneself) as similar to somebody else
v. conceive of as united or associated
v. identify as in botany or biology, for example"
site-licensing,none
hybrid,"n. a composite of mixed origin
n. (genetics) an organism that is the offspring of genetically dissimilar parents or stock; especially offspring produced by breeding plants or animals of different varieties or breeds or species
s. produced by crossbreeding"
piracy,n. hijacking on the high seas or in similar contexts; taking a ship or plane away from the control of those who are legally entitled to it
legitimate,"v. show or affirm to be just and legitimate
v. make (an illegitimate child) legitimate; declare the legitimacy of (someone)
a. of marriages and offspring; recognized as lawful
s. based on known statements or events or conditions"
intellectual,"n. a person who uses the mind creatively
s. of or associated with or requiring the use of the mind
a. appealing to or using the intellect"
brand,"n. a recognizable kind
n. identification mark on skin, made by burning
n. a piece of wood that has been burned or is burning
v. burn with a branding iron to indicate ownership; of animals"
horrific,"s grossly offensive to decency or morality; causing horror
s causing fear or dread or terror"
artistic,"a. relating to or characteristic of art or artists
s. satisfying aesthetic standards and sensibilities"
journalism,"n. newspapers and magazines collectively
n. the profession of reporting or photographing or editing news stories for one of the media"
undermine,"v destroy property or hinder normal operations
v hollow out as if making a cave or opening"
deprive,"v. take away possessions from someone
v. keep from having, keeping, or obtaining
v. take away"
property,"n. something owned; any tangible or intangible possession that is owned by someone; 
n. a basic or essential attribute shared by all members of a class
n. a construct whereby objects or individuals can be distinguished
n. any movable articles or objects used on the set of a play or movie"
commercial,"n. a commercially sponsored ad on radio or television
a. connected with or engaged in or sponsored by or used in commerce or commercial enterprises
a. of or relating to commercialism
s. of the kind or quality used in commerce; average or inferior"
horn,"n. a noisemaker (as at parties or games) that makes a loud noise when you blow through it
n. one of the bony outgrowths on the heads of certain ungulates
n. a noise made by the driver of an automobile to give warning; 
n. a high pommel of a Western saddle (usually metal covered with leather)"
endeavour,"n a purposeful or industrious undertaking (especially one that requires effort or boldness)
n earnest and conscientious activity intended to do or accomplish something
v attempt by employing effort"
theft,n the act of taking something from someone unlawfully
principle,"n. a basic generalization that is accepted as true and that can be used as a basis for reasoning or conduct
n. a rule or standard especially of good behavior
n. a basic truth or law or assumption
n. a rule or law concerning a natural phenomenon or the function of a complex system"
despite,n. contemptuous disregard
software,n. (computer science) written programs or procedures or rules and associated documentation pertaining to the operation of a computer system and that are stored in read/write memory
cope,"n. a long cloak; worn by a priest or bishop on ceremonial occasions
v. come to terms with"
luxury,"n. something that is an indulgence rather than a necessity
n. wealth as evidenced by sumptuous living"
association,"n. a formal organization of people or groups of people
n. the act of consorting with or joining with others
n. the state of being connected together as in memory or imagination
n. the process of bringing ideas or events together in memory or imagination"
amount,"n. the relative magnitude of something with reference to a criterion
v. be tantamount or equivalent to"
advantage,"n. the quality of having a superior or more favorable position
n. (tennis) first point scored after deuce
n. benefit resulting from some event or action
v. give an advantage to"
track,"n. a pair of parallel rails providing a runway for wheels
n. an endless metal belt on which tracked vehicles move over the ground
n. (computer science) one of the circular magnetic paths on a magnetic disk that serve as a guide for writing and reading data
n. a groove on a phonograph recording"
Internet,n. a computer network consisting of a worldwide network of computer networks that use the TCP/IP network protocols to facilitate data transmission and exchange
statistic,n. a datum that can be represented numerically
album,"n. one or more recordings issued together; originally released on 12-inch phonograph records (usually with attractive record covers) and later on cassette audiotape and compact disc
n. a book of blank pages with pockets or envelopes; for organizing photographs or stamp collections etc"
initially,r. at the beginning
exploit,"v. use or manipulate to one's advantage
v. draw from; make good use of"
analyzer,n. an instrument that performs analyses
pirated,"v copy illegally; of published material
v take arbitrarily or by force"
advertiser,n. someone whose business is advertising
exchange,"n. chemical process in which one atom or ion or group changes places with another
n. a mutual expression of views (especially an unpleasant one)
n. the act of changing one thing for another thing
n. the act of giving something in return for something received"
network,"n. an interconnected system of things or people
n. (broadcasting) a communication system consisting of a group of broadcasting stations that all transmit the same programs
n. a system of intersecting lines or channels
n. (electronics) a system of interconnected electronic components or circuits"
reveal,v. disclose directly or through prophets
release,"n. merchandise issued for sale or public showing (especially a record or film)
n. a process that liberates or discharges something
n. a device that when pressed will release part of a mechanism
n. activity that frees or expresses creative energy or emotion"
reluctant,"s. disinclined to become involved
s. not eager"
data,n. a collection of facts from which conclusions may be drawn
extend,"v. make available; provide
v. reach outward in space
v. expand the influence of
v. open or straighten out; unbend"
negotiate,"v. succeed in passing through, around, or over"
schedule,"n. an ordered list of times at which things are planned to occur
v. plan for an activity or event
v. make a schedule; plan the time and place for events"
giant,"n. any creature of exceptional size
n. an unusually large enterprise
n. a very large person; impressive in size or qualities
n. someone or something that is abnormally large and powerful"
boost,"n. the act of giving hope or support to someone
n. the act of giving a push
v. give a boost to; be beneficial to
v. increase or raise"
switch,"n. control consisting of a mechanical or electrical or electronic device for making or breaking or changing the connections in a circuit
n. hairpiece consisting of a tress of false hair; used by women to give shape to a coiffure
n. railroad track having two movable rails and necessary connections; used to turn a train from one track to another or to store rolling stock
n. a flexible implement used as an instrument of punishment"
alternative,"s. necessitating a choice between mutually exclusive possibilities
s. pertaining to unconventional choices"
compete,v. compete for something; engage in a contest; measure oneself against others
tolerate,"v. recognize and respect (rights and beliefs of others)
v. have a tolerance for a poison or strong drug or pathogen or environmental condition"
revenue,"n the entire amount of income before any deductions are made
n government income due to taxation"
literally,"r. in a literal sense
r. (intensifier before a figurative expression) without exaggeration"
modify,"v. make less severe or harsh or extreme
v. add a modifier to a constituent"
pressure,"n. the force applied to a unit area of surface; measured in pascals (SI unit) or in dynes (cgs unit)
n. a force that compels
n. the somatic sensation that results from applying force to an area of skin
n. an oppressive condition of physical or mental or social or economic distress"
technology,n. the practical application of science to commerce or industry
eventually,r after an unspecified period of time or an especially long delay
genetically,r. by genetic mechanisms
tolerant,"a. showing respect for the rights or opinions or practices of others
s. able to tolerate environmental conditions or physiological stress
s. showing the capacity for endurance"
oppose,"v. be against; express opposition to
v. contrast with equal weight or force
v. be resistant to"
obtain,v. come into possession of
account,"n. a formal contractual relationship established to provide for regular banking or brokerage or business services
n. importance or value
n. a statement of recent transactions and the resulting balance
n. the quality of taking advantage"
presence,"n. the state of being present; current existence
n. the immediate proximity of someone or something
n. an invisible spiritual being felt to be nearby
n. the impression that something is present"
mass,"n. the property of a body that causes it to have weight in a gravitational field
n. an ill-structured collection of similar things (objects or people)
n. (Roman Catholic Church and Protestant Churches) the celebration of the Eucharist
n. a body of matter without definite shape"
positively,"r. extremely
r. so as to be positive; in a positive manner"
performance,"n. a dramatic or musical entertainment
n. the act of presenting a play or a piece of music or other entertainment
n. the act of performing; of doing something successfully; using knowledge as distinguished from merely possessing it
n. any recognized accomplishment"
causal,s. involving or constituting a cause; causing
implausible,a. having a quality that provokes disbelief
diverse,s. distinctly dissimilar or unlike
household,n a social unit living together
preserve,"n. a domain that seems to be specially reserved for someone
n. a reservation where animals are protected
v. prevent (food) from rotting
v. keep undisturbed for personal or private use for hunting, shooting, or fishing"
critical,"a. marked by a tendency to find and call attention to errors and flaws
a. at or of a point at which a property or phenomenon suffers an abrupt change especially having enough mass to sustain a chain reaction
a. characterized by careful evaluation and judgment
s. urgently needed; absolutely necessary"
senior,"n. an undergraduate student during the year preceding graduation
a. older; higher in rank; longer in length of tenure or service
s. used of the fourth and final year in United States high school or college"
correlate,"n. either of two or more related or complementary variables
v. to bear a reciprocal or mutual relation
v. bring into a mutual, complementary, or reciprocal relation"
demonstrate,v. march in protest; take part in a demonstration
link,"n. the means of connection between things linked in series
n. a fastener that serves to join or connect
n. a unit of length equal to 1/100 of a chain
n. (computing) an instruction that connects one part of a program or an element on a list to another program or list"
workforce,n the force of workers available
purchase,"n. the acquisition of something for payment
n. something acquired by purchase
n. a means of exerting influence or gaining advantage"
liberate,v. grant freedom to
domestic,"n. a servant who is paid to perform menial tasks around the household
a. of concern to or concerning the internal affairs of a nation
a. of or relating to the home
a. of or involving the home or family"
