crawl,"n. a very slow movement
n. a swimming stroke; arms are moved alternately overhead accompanied by a flutter kick
n. a slow mode of locomotion on hands and knees or dragging the body
v. move slowly; in the case of people or animals with the body near the ground"
climb,"n. an event that involves rising to a higher point (as in altitude or temperature or intensity etc.)
n. the act of climbing something
v. go upward with gradual or continuous progress
v. move with difficulty, by grasping"
mortal,"a. subject to death
s. unrelenting and deadly"
fatal,"a. bringing death
s. controlled or decreed by fate; predetermined"
deadly,"s. causing or capable of causing death
s. of an instrument of certain death
s. extremely poisonous or injurious; producing venom
s. involving loss of divine grace or spiritual death"
rock,"n. a lump or mass of hard consolidated mineral matter
n. material consisting of the aggregate of minerals like those making up the Earth's crust
n. United States gynecologist and devout Catholic who conducted the first clinical trials of the oral contraceptive pill (1890-1984)
n. (figurative) someone who is strong and stable and dependable"
swing,"n. a state of steady vigorous action that is characteristic of an activity
n. mechanical device used as a plaything to support someone swinging back and forth
n. a sweeping blow or stroke
n. changing location by moving back and forth"
sway,n. controlling influence
corporation,n. a business firm whose articles of incorporation have been approved in some state
company,"n. an institution created to conduct business
n. small military unit; usually two or three platoons
n. the state of being with someone
n. organization of performers and associated personnel (especially theatrical)"
firm,"n. the members of a business organization that owns or operates one or more establishments
s. marked by firm determination or resolution; not shakable
s. not soft or yielding to pressure
s. strong and sure"
boundary,"n. the line or plane indicating the limit or extent of something
n. a line determining the limits of an area"
border,"n. a strip forming the outer edge of something
v. provide with a border or edge
v. lie adjacent to another or share a boundary"
frontier,"n. a wilderness at the edge of a settled area of a country
n. an international boundary or the area (often fortified) immediately inside the boundary
n. an undeveloped field of study; a topic inviting research and development"
consent,n. permission to do something
assent,"n. agreement with a statement or proposal to do something
v. to agree or express agreement"
comply,"v. act in accordance with someone's rules, commands, or wishes"
vast,s unusually great in size or amount or degree or especially extent or scope
immense,s unusually great in size or amount or degree or especially extent or scope
huge,s. unusually great in size or amount or degree or especially extent or scope
massive,"s. imposing in size or bulk or solidity
s. being the same substance throughout
s. imposing in scale or scope or degree or power
s. consisting of great mass; containing a great quantity of matter"
voyage,"n. a journey to some distant place
v. travel on water propelled by wind or by other means"
journey,n. the act of traveling from one place to another
trip,"n. a journey for some purpose (usually including the return)
n. a hallucinatory experience induced by drugs
n. an exciting or stimulating experience
n. a light or nimble tread"
travel,"n. the act of going from one place to another
v. change location; move, travel, or proceed, also metaphorically
v. undertake a journey or trip
v. make a trip for pleasure"
soldier,"n. an enlisted man or woman who serves in an army
n. a wingless sterile ant or termite having a large head and powerful jaws adapted for defending the colony
v. serve as a soldier in the military"
veteran,"n. a serviceman who has seen considerable active service
n. a person who has served in the armed forces
n. an experienced person who has been through many battles; someone who has given long service"
glimpse,"n. a brief or incomplete view
n. a vague indication
v. catch a glimpse of or see briefly"
glance,"n. a quick look
v. throw a glance at; take a brief look at
v. hit at an angle"
fare,"n. the sum charged for riding in a public conveyance
n. a paying (taxi) passenger
n. the food and drink that are regularly served or consumed
v. eat well"
fee,"n. a fixed charge for a privilege or for professional services
n. an interest in land capable of being inherited"
deceive,"v. be false to; be dishonest with
v. cause someone to believe an untruth"
cheat,"n. a deception for profit to yourself
v. deprive somebody of something by deceit
v. defeat someone through trickery or deceit
v. engage in deceitful behavior; practice trickery or fraud"
mankind,n all of the living human inhabitants of the earth
man,"n. an adult person who is male (as opposed to a woman)
n. the generic use of the word to refer to any human being
n. a male subordinate
n. an adult male person who has a manly character (virile and courageous competent)"
idle,"n. the state of an engine or other mechanism that is idling
v. run disconnected or idle
v. be idle; exist in a changeless situation
a. not in action or at work"
lazy,s. moving slowly and gently
faithful,"n. any loyal and steadfast following
a. steadfast in affection or allegiance
a. not having sexual relations with anyone except your husband or wife, or your boyfriend or girlfriend"
loyal,a. steadfast in allegiance or duty
reward,"n. payment made in return for a service rendered
n. an act performed to strengthen approved behavior
n. the offer of money for helping to find a criminal or for returning lost property
v. act or give recompense in recognition of someone's behavior or actions"
award,"n. a grant made by a law court
n. a tangible symbol signifying approval or distinction
v. give, especially as an honor or reward
v. give as judged due or on the basis of merit"
complement,"n. a word or phrase used to complete a grammatical construction
n. a complete number or quantity
n. number needed to make up a whole force
n. something added to complete or embellish or make perfect"
supplement,"n. a quantity added (e.g. to make up for a deficiency)
v. add as a supplement to what seems insufficient
v. serve as a supplement to"
mutual,"s common to or shared by two or more parties
a concerning each of two or more persons or things; especially given or done in return"
common,"a. belonging to or participated in by a community as a whole; public
a. having no special distinction or quality; widely known or commonly encountered; average or ordinary or usual
s. common to or shared by two or more parties
s. commonly encountered"
dubious,s. not convinced
doubtful,"s. open to doubt or suspicion
s. fraught with uncertainty or doubt
s. unsettled in mind or opinion"
humble,"v. cause to be unpretentious
s. low or inferior in station or quality
a. marked by meekness or modesty; not arrogant or prideful
s. used of unskilled work (especially domestic work)"
modest,"a. marked by simplicity; having a humble opinion of yourself
s. not large but sufficient in size or amount
s. free from pomp or affectation
a. not offensive to sexual mores in conduct or appearance"
prospect,"n. the possibility of future success
v. search for something desirable
v. explore for useful or valuable things or substances, such as minerals"
perspective,n. the appearance of things relative to one another as determined by their distance from the viewer
sturdy,s. substantially made or constructed
vigorous,"s. characterized by forceful and energetic action or activity
s. strong and active physically or mentally"
resist,"v. stand up or offer resistance to somebody or something
v. withstand the force of something
v. resist immunologically the introduction of some foreign tissue or organ
v. refuse to comply"
withstand,"v resist or confront with resistance
v stand up or offer resistance to somebody or something"
progressive,"n. a tense of verbs used in describing action that is on-going
a. favoring or promoting progress
s. favoring or promoting reform (often by government action)
a. (of taxes) adjusted so that the rate increases as the amount of income increases"
advanced,"s. farther along in physical or mental development
s. comparatively late in a course of development
s. ahead of the times
s. at a higher level in training or knowledge or skill"
product,"n. an artifact that has been created by someone or some process
n. a quantity obtained by multiplication
n. a chemical substance formed as a result of a chemical reaction
n. a consequence of someone's efforts or of a particular set of circumstances"
produce,"n. fresh fruits and vegetable grown for the market
v. bring forth or yield
v. create or manufacture a man-made product
v. cause to happen, occur or exist"
doubt,"n. the state of being unsure of something
n. uncertainty about the truth or factuality or existence of something
v. consider unlikely or have doubts about
v. lack confidence in or have doubts about"
suspect,"n. someone who is under suspicion
v. imagine to be the case or true or probable
v. hold in suspicion; believe to be guilty"
assist,"n. (sports) the act of enabling another player to make a good play
v. act as an assistant in a subordinate or supportive function"
aid,"n. a resource
n. the activity of contributing to the fulfillment of a need or furtherance of an effort or purpose
n. money to support a worthy person or cause"
estimate,"n. an approximate calculation of quantity or degree or worth
n. a judgment of the qualities of something or somebody
n. a statement indicating the likely cost of some job
n. the respect with which a person is held"
evaluate,v. form a critical opinion of
requirement,n. required activity
requisite,"n anything indispensable
s necessary for relief or supply"
furnish,v. provide or equip with furniture
provide,"v. give what is desired or needed, especially support, food or sustenance
v. determine (what is to happen in certain contingencies), especially by including a proviso condition or stipulation
v. supply means of subsistence; earn a living
v. take measures in preparation for"
loyalty,"n. the quality of being loyal
n. feelings of allegiance"
devotion,"n. feelings of ardent love
n. commitment to some purpose
n. (usually plural) religious observance or prayers (usually spoken silently)"
hostage,n. a prisoner who is held by one party to insure that another party will meet specified terms
pawn,"n. an article deposited as security
n. (chess) the least powerful piece; moves only forward and captures only to the side; it can be promoted to a more powerful piece if it reaches the 8th rank
n. borrowing and leaving an article as security for repayment of the loan
v. leave as a guarantee in return for money"
hasty,"s. excessively quick
s. done with very great haste and without due deliberation"
reckless,"s marked by defiant disregard for danger or consequences
s characterized by careless unconcern"
disabled,"n. people collectively who are crippled or otherwise physically handicapped
s. incapable of functioning as a consequence of injury or illness"
handicapped,"n people collectively who are crippled or otherwise physically handicapped
v injure permanently
v attempt to forecast the winner (especially in a horse race) and assign odds for or against a contestant
v put at a disadvantage
s incapable of functioning as a consequence of injury or illness"
rhythm,"n. the basic rhythmic unit in a piece of music
n. recurring at regular intervals
n. the arrangement of spoken words alternating stressed and unstressed elements"
rhyme,"n. correspondence in the sounds of two or more lines (especially final sounds)
v. compose rhymes
v. be similar in sound, especially with respect to the last syllable"
shear,"n. (physics) a deformation of an object in which parallel planes remain parallel but are shifted in a direction parallel to themselves
n. a large edge tool that cuts sheet metal by passing a blade through it
v. cut with shears
v. cut or cut through with shears"
share,"n. assets belonging to or due to or contributed by an individual person or group
n. any of the equal portions into which the capital stock of a corporation is divided and ownership of which is evidenced by a stock certificate
v. have in common
v. use jointly or in common"
browse,"n. vegetation (such as young shoots, twigs, and leaves) that is suitable for animals to eat
n. reading superficially or at random
n. the act of feeding by continual nibbling
v. look around casually and randomly, without seeking anything in particular"
skim,"n. a thin layer covering the surface of a liquid
n. reading or glancing through quickly
v. cause to skip over a surface
v. coat (a liquid) with a layer"
brochure,n a small book usually having a paper cover
pamphlet,"n a small book usually having a paper cover
n a brief treatise on a subject of interest; published in the form of a booklet"
credible,"a. capable of being believed
s. (a common but incorrect usage where `credulous' would be appropriate) credulous
s. appearing to merit belief or acceptance"
credulous,"a. disposed to believe on little evidence
s. showing a lack of judgment or experience"
comprehension,n. an ability to understand the meaning or importance of something (or the knowledge acquired as a result)
understanding,"n. the cognitive condition of someone who understands
s. characterized by understanding based on comprehension and discernment and empathy"
evoke,"v call forth (emotions, feelings, and responses)
v evoke or provoke to appear or occur
v deduce (a principle) or construe (a meaning)
v summon into action or bring into existence, often as if by magic
v call to mind"
summon,"v. call in an official matter, such as to attend court
v. ask to come"
conquest,"n. the act of conquering
n. success in mastering something difficult"
triumph,n. the exultation of victory
victory,n. a successful ending of a struggle or contest
break,"n. an unexpected piece of good luck
n. the occurrence of breaking
n. an abrupt change in the tone or register of the voice (as at puberty or due to emotion)
n. the opening shot that scatters the balls in billiards or pool"
crack,"n. a long narrow opening
n. a sudden sharp noise
n. a blemish resulting from a break without complete separation of the parts
n. a purified and potent form of cocaine that is smoked rather than snorted; highly addictive"
snap,"n. a spell of cold weather
n. the noise produced by the rapid movement of a finger from the tip to the base of the thumb on the same hand
n. a sudden breaking
n. a fastener used on clothing; fastens with a snapping sound"
compound,"n. a whole formed by a union of two or more elements or parts
n. (chemistry) a substance formed by chemical union of two or more elements or ingredients in definite proportion by weight
n. an enclosure of residences and other building (especially in the Orient)
v. put or add together"
blend,"n. an occurrence of thorough mixing
n. a new word formed by joining two others and combining their meanings
n. the act of blending components together thoroughly
v. combine into one"
integrate,"v. make into a whole or make part of a whole
v. become one; become integrated
v. calculate the integral of; calculate by integration"
apparatus,"n. equipment designed to serve a specific function
n. (anatomy) a group of body parts that work together to perform a given function"
instrument,"n. a device that requires skill for proper use
n. the means whereby some act is accomplished
n. a person used by another to gain an end
v. equip with instruments for measuring, recording, or controlling"
device,"n. an instrumentality invented for a particular purpose
n. something in an artistic work designed to achieve a particular effect
n. any clever maneuver
n. any ornamental pattern or design (as in embroidery)"
beat,"n. a regular route for a sentry or policeman
n. a single pulsation of an oscillation produced by adding two waves of different frequencies; has a frequency equal to the difference between the two oscillations
n. the sound of stroke or blow
n. a regular rate of repetition"
hit,"n. (baseball) a successful stroke in an athletic contest (especially in baseball)
n. the act of contacting one thing with another
n. a conspicuous success
n. a dose of a narcotic drug"
strike,"n. a group's refusal to work in protest against low pay or bad work conditions
n. an attack that is intended to seize or inflict damage on or destroy an objective
n. a score in tenpins: knocking down all ten with the first ball
n. (baseball) a pitch that the batter swings at and misses, or that the batter hits into foul territory, or that the batter does not swing at but the umpire judges to be in the area over home plate and between the batter's knees and shoulders"
ordinary,"n. a judge of a probate court
n. the expected or commonplace condition or situation
n. a clergyman appointed to prepare condemned prisoners for death
n. an early bicycle with a very large front wheel and small back wheel"
common,"a. belonging to or participated in by a community as a whole; public
a. having no special distinction or quality; widely known or commonly encountered; average or ordinary or usual
s. common to or shared by two or more parties
s. commonly encountered"
general,"n. a general officer of the highest rank
n. the head of a religious order or congregation
n. a fact about the whole (as opposed to particular)
v. command as a general"
comment,"n. a written explanation or criticism or illustration that is added to a book or other textual material
v. make or write a comment on
v. explain or interpret something"
commentary,n a written explanation or criticism or illustration that is added to a book or other textual material
remark,"n. a statement that expresses a personal opinion or belief or adds information
n. explicit notice"
single,"n. a base hit on which the batter stops safely at first base
v. hit a single
a. used of flowers having usually only one row or whorl of petals
a. existing alone or consisting of one entity or part or aspect or individual"
separate,"n. a garment that can be purchased separately and worn in combinations with other garments
v. act as a barrier between; stand between
v. force, take, or pull apart
v. divide into components or constituents"
particular,"n. a fact about some part (as opposed to general)
n. (logic) a proposition that asserts something about some (but not all) members of a class
s. unique or specific to a person or thing or category
s. separate and distinct from others of the same group or category"
amplify,v. increase the volume of
expand,"v. extend in one or more directions
v. become larger in size or volume or quantity
v. make bigger or wider in size, volume, or quantity"
extend,"v. make available; provide
v. reach outward in space
v. expand the influence of
v. open or straighten out; unbend"
recreation,"n an activity that diverts or amuses or stimulates
n activity that refreshes and recreates; activity that renews your health and spirits by enjoyment and relaxation"
amusement,n. a feeling of delight at being entertained
entertainment,n. an activity that is diverting and that holds the attention
elevate,"v give a promotion to or assign to a higher position
v raise from a lower to a higher position
v raise in rank or condition"
hoist,"n. lifting device for raising heavy or cumbersome objects
v. raise or haul up with or as if with mechanical help
v. move from one place to another by lifting
v. raise"
lift,"n. the act of giving temporary assistance
n. a wave that lifts the surface of the water or ground
n. a device worn in a shoe or boot to make the wearer look taller or to correct a shortened leg
n. one of the layers forming the heel of a shoe or boot"
mend,"n. sewing that repairs a worn or torn hole (especially in a garment)
v. heal or recover"
repair,"n. the act of putting something in working order again
n. a formal way of referring to the condition of something
v. restore by replacing a part or putting together what is torn or broken
v. move, travel, or proceed toward some place"
patch,"n. a piece of cloth used as decoration or to mend or cover a hole
n. a short set of commands to correct a bug in a computer program
v. to join or unite the pieces of
v. provide with a patch; also used metaphorically"
obstacle,"n. something immaterial that stands in the way and must be circumvented or surmounted
n. an obstruction that stands in the way (and must be removed or surmounted or circumvented)"
hindrance,"n. something immaterial that interferes with or delays action or progress
n. any obstruction that impedes or is burdensome
n. the act of hindering or obstructing or impeding"
obstruction,"n. any structure that makes progress difficult
n. the physical condition of blocking or filling a passage with an obstruction
n. the act of obstructing
n. getting in someone's way"
tale,"n a message that tells the particulars of an act or occurrence or course of events; presented in writing or drama or cinema or as a radio or television program
n a trivial lie"
narrative,"n. a message that tells the particulars of an act or occurrence or course of events; presented in writing or drama or cinema or as a radio or television program
s. consisting of or characterized by the telling of a story"
anecdote,n. short account of an incident (especially a biographical one)
scatter,"n. a haphazard distribution in all directions
n. the act of scattering
v. distribute loosely
v. sow by scattering"
disperse,"v. to cause to separate and go in different directions
v. move away from each other; 
v. separate (light) into spectral rays"
spread,"n. process or result of distributing or extending over a wide expanse of space
n. a tasty mixture to be spread on bread or crackers or used in preparing other dishes
n. two facing pages of a book or other publication
n. the expansion of a person's girth (especially at middle age)"
conflict,"n. an open clash between two opposing groups (or individuals)
n. opposition between two simultaneous but incompatible feelings
n. a state of opposition between persons or ideas or interests
n. an incompatibility of dates or events"
contest,"n. an occasion on which a winner is selected from among two or more contestants
n. a struggle between rivals
v. to make the subject of dispute, contention, or litigation"
combat,n. an engagement fought between two military forces
fight,"n. the act of fighting; any contest or struggle
n. an intense verbal dispute
n. a boxing or wrestling match
v. fight against or resist strongly"
state,"n. the territory occupied by one of the constituent administrative districts of a nation
n. the way something is with respect to its main attributes
n. the group of people comprising the government of a sovereign state
n. a politically organized body of people under a single government"
declare,"v. state emphatically and authoritatively
v. state firmly
v. declare to be
v. authorize payments of"
announce,"v. make known; make an announcement
v. announce publicly or officially
v. give the names of
v. foreshadow or presage"
proclaim,"v. declare formally; declare someone to be something; of titles
v. state or announce"
release,"n. merchandise issued for sale or public showing (especially a record or film)
n. a process that liberates or discharges something
n. a device that when pressed will release part of a mechanism
n. activity that frees or expresses creative energy or emotion"
publish,"v. prepare and issue for public distribution or sale
v. have (one's written work) issued for publication"
alike,"a. having the same or similar characteristics
r. equally
r. in a like manner"
similar,"a. marked by correspondence or resemblance
s. (of words) expressing closely related meanings"
additional,s further or added
extra,"n. an additional edition of a newspaper (usually to report a crisis)
n. something additional of the same kind
s. added to a regular schedule
s. further or added"
assign,"v. give out
v. select something or someone for a specific purpose
v. transfer one's right to
v. decide as to where something belongs in a scheme"
allocate,v. distribute according to a plan or set apart for a special purpose
convict,"n. a person serving a sentence in a jail or prison
n. a person who has been convicted of a criminal offense
v. find or declare guilty"
sentence,"n. a string of words satisfying the grammatical rules of a language
v. pronounce a sentence on (somebody) in a court of law"
contend,"v. maintain or assert
v. be engaged in a fight; carry on a fight"
rival,"n. the contestant you hope to defeat
v. be the rival of, be in competition with"
slack,"n. dust consisting of a mixture of small coal fragments and coal dust and dirt that sifts out when coal is passed over a sieve
n. a stretch of water without current or movement
n. the quality of being loose (not taut)
n. a cord or rope or cable that is hanging loosely"
loose,"a. not compact or dense in structure or arrangement
s. (of a ball in sport) not in the possession or control of any player
a. not tight; not closely constrained or constricted or constricting
s. not tense or taut"
undermine,"v destroy property or hinder normal operations
v hollow out as if making a cave or opening"
weaken,"v. lessen the strength of
v. become weaker"
ornament,v. be an ornament to
decorate,"v. make more attractive by adding ornament, colour, etc.
v. award a mark of honor, such as a medal, to"
scar,"n. a mark left (usually on the skin) by the healing of injured tissue
v. mark with a scar"
seam,"n. joint consisting of a line formed by joining two pieces
n. a stratum of ore or coal thick enough to be mined with profit
v. put together with a seam"
