geographic,"a. of or relating to the science of geography
a. determined by geography"
saliva,n. a clear liquid secreted into the mouth by the salivary glands and mucous glands of the mouth; moistens the mouth and starts the digestion of starches
skeptical,"s denying or questioning the tenets of especially a religion
s marked by or given to doubt"
hawk,"n. diurnal bird of prey typically having short rounded wings and a long tail
n. an advocate of an aggressive policy on foreign relations
v. hunt with hawks"
sociologist,n. a social scientist who studies the institutions and development of human society
lineage,n. the descendants of one individual
chromosome,n. a threadlike strand of DNA in the cell nucleus that carries the genes in a linear order
inherit,"v. obtain from someone after their death
v. receive from a predecessor
v. receive by genetic transmission"
mitochondrial,none
reveal,v. disclose directly or through prophets
precision,n the quality of being reproducible in amount or performance
ancestry,n. inherited properties shared with others of your bloodline
number,"n. the property possessed by a sum or total or indefinite quantity of units or individuals
n. a concept of quantity involving zero and units
n. a select company of people
n. a numeral or string of numerals that is used for identification"
genetic,"a. pertaining to or referring to origin
a. of or relating to the science of genetics"
commercial,"n. a commercially sponsored ad on radio or television
a. connected with or engaged in or sponsored by or used in commerce or commercial enterprises
a. of or relating to commercialism
s. of the kind or quality used in commerce; average or inferior"
database,n. an organized body of related information
systematically,r. in a systematic or consistent manner
lump,v. put together indiscriminately
estimate,"n. an approximate calculation of quantity or degree or worth
n. a judgment of the qualities of something or somebody
n. a statement indicating the likely cost of some job
n. the respect with which a person is held"
peer,"n. a person who is of equal standing with another in a group
n. a nobleman (duke or marquis or earl or viscount or baron) who is a member of the British peerage
v. look searchingly"
reference,"n. the most direct or specific meaning of a word or expression; the class of objects that an expression refers to
n. the act of referring or consulting
n. a publication (or a passage from a publication) that is referred to
n. the relation between a word or phrase and the object or idea it refers to"
process,"n. (psychology) the performance of some composite cognitive activity; an operation that affects mental contents
n. a mental process that you are not directly aware of
n. a natural prolongation or projection from a part of an organism either animal or plant
n. a sustained phenomenon or one marked by gradual changes through a series of states"
patent,"n. a document granting an inventor sole rights to an invention
n. an official document granting a right or privilege
v. obtain a patent for
v. grant rights to; grant a patent for"
telecommuting,n. employment at home while communicating with the workplace by phone or fax or modem
alternative,"s. necessitating a choice between mutually exclusive possibilities
s. pertaining to unconventional choices"
reputation,"n. notoriety for some particular characteristic
n. the general estimation that the public has for a person"
electricity,"n. a physical phenomenon associated with stationary or moving electrons and protons
n. energy made available by the flow of electric charge through a conductor
n. keen and shared excitement"
digital,"a. displaying numbers rather than scale positions
a. relating to or performed with the fingers
a. of a circuit or device that represents magnitudes in digits"
consume,"v. serve oneself to, or consume regularly
v. spend extravagantly
v. destroy completely
v. use up (resources or materials)"
coal,"n. fossil fuel consisting of carbonized vegetable matter deposited in the Carboniferous period
v. supply with coal
v. take in coal"
kilo-watt,n. a unit of power equal to 1000 watts
surpass,v. be or do something to a greater degree
air-conditioning,"v control the humidity and temperature of
v equip with an apparatus for controlling the humidity and temperature"
furnace,"n. an enclosed chamber in which heat is produced to heat buildings, destroy refuse, smelt or refine ores, etc."
server,"n. (court games) the player who serves to start a point
n. (computer science) a computer that provides client stations with access to files and printers as shared resources to a computer network
n. utensil used in serving food or drink"
lifetime,n the period during which something is functional (as between birth and death)
sink,"n. plumbing fixture consisting of a water basin fixed to a wall or floor and having a drainpipe
n. (technology) a process that acts to absorb or remove energy or a substance from a system
v. fall or descend to a lower place or level
v. cause to sink"
overheat,"v. get excessively and undesirably hot
v. make excessively or undesirably hot"
rack,"n. framework for holding objects
n. rib section of a forequarter of veal or pork or especially lamb or mutton
n. an instrument of torture that stretches or disjoints or mutilates victims
n. a support for displaying various articles"
installation,n. the act of installing something (as equipment)
array,"n. an orderly arrangement
n. an impressive display
n. especially fine or decorative clothing
n. an arrangement of aerials spaced to give desired directional characteristics"
headquarter,v. provide with headquarters
maximize,"v. make as big or large as possible
v. make the most of"
funnel,"n. a conical shape with a wider and a narrower opening at the two ends
n. a conically shaped utensil having a narrow tube at the small end; used to channel the flow of substances into a container with a small mouth
n. (nautical) smokestack consisting of a shaft for ventilation or the passage of smoke (especially the smokestack of a ship)
v. move or pour through a funnel"
translate,"v. restate (words) from one language into another language
v. change from one form or medium into another
v. bring to a certain spiritual state
v. change the position of (figures or bodies) in space without rotation"
altitude,"n. elevation especially above sea level or above the earth's surface
n. the perpendicular distance from the base of a geometric figure to the opposite vertex (or side if parallel)"
solar,a. relating to or derived from the sun or utilizing the energies of the sun
peak,n. the top or extreme point of something (usually a mountain or hill)
renewable,"a. that can be renewed or extended
s. capable of being renewed; replaceable"
remark,"n. a statement that expresses a personal opinion or belief or adds information
n. explicit notice"
nickname,"n. a familiar name for a person (often a shortened version of a person's given name)
n. a descriptive name for a place or thing"
thermal,"n. rising current of warm air
a. relating to or associated with heat
a. of or relating to a hot spring
s. caused by or designed to retain heat"
geothermal,a. of or relating to the heat in the interior of the earth
meantime,"n the time between one event, process, or period and another
r during the intervening time"
stack,"n. an orderly pile
v. load or cover with stacks
v. arrange in stacks
v. arrange the order of so as to increase one's winning chances"
virtual,"s. being actually such in almost every respect
s. existing in essence or effect though not in actual fact"
consolidate,"v. unite into one
v. make firm or secure; strengthen
v. bring together into a single whole or system
v. form into a solid mass or whole"
trick,"n. a cunning or deceitful action or device
n. a period of work or duty
n. an attempt to get you to do something foolish or imprudent
n. (card games) in a single round, the sequence of cards played by all the players; the high card is the winner"
multiple,"n. the product of a quantity by an integer
a. having or involving or consisting of more than one part or entity or individual"
deploy,"v. place troops or weapons in battle formation
v. to distribute systematically or strategically"
backup,"n. an accumulation caused by clogging or a stoppage
n. (computer science) a copy of a file or directory on a separate storage device"
shift,"n. an event in which something is displaced without rotation
n. the time period during which you are at work
n. the act of moving from one place to another
n. a crew of workers who work for a specific period of time"
pack,"n. a complete collection of similar things
n. a convenient package or parcel (as of cigarettes or film)
n. a group of hunting animals
n. a cream that cleanses and tones the skin"
circuit,"n. an electrical device that provides a path for electrical current to flow
n. an established itinerary of venues or events that a particular group of people travel to
n. (law) a judicial division of a state or the United States (so-called because originally judges traveled and held court in different locations); one of the twelve groups of states in the United States that is covered by a particular circuit court of appeals
v. make a circuit"
microprocessor,n. integrated circuit semiconductor chip that performs the bulk of the processing and controls the parts of a system
substantial,"s. having a firm basis in reality and being therefore important, meaningful, or considerable
a. having substance or capable of being treated as fact; not imaginary"
performance,"n. a dramatic or musical entertainment
n. the act of presenting a play or a piece of music or other entertainment
n. the act of performing; of doing something successfully; using knowledge as distinguished from merely possessing it
n. any recognized accomplishment"
multi-core,none
processor,"n. a business engaged in processing agricultural products and preparing them for market
n. someone who processes things (foods or photographs or applicants etc.)"
separate,"n. a garment that can be purchased separately and worn in combinations with other garments
v. act as a barrier between; stand between
v. force, take, or pull apart
v. divide into components or constituents"
shrink,"v. reduce in size; reduce physically
v. become smaller or draw together
v. decrease in size, range, or extent"
industrialization,n. the development of industry on an extensive scale
massive,"s. imposing in size or bulk or solidity
s. being the same substance throughout
s. imposing in scale or scope or degree or power
s. consisting of great mass; containing a great quantity of matter"
chaotic,"s. lacking a visible order or organization
s. completely unordered and unpredictable and confusing
a. of or relating to a sensitive dependence on initial conditions"
growth,"n. (biology) the process of an individual organism growing organically; a purely biological unfolding of events involved in an organism changing gradually from a simple to a more complex level
n. a progression from simpler to more complex forms
n. vegetation that has grown
n. (pathology) an abnormal proliferation of tissue (as in a tumor)"
immigration,"n. migration into a place (especially migration to a country of which you are not a native in order to settle there)
n. the body of immigrants arriving during a specified interval"
urban,"a. relating to or concerned with a city or densely populated area
a. located in or characteristic of a city or city life"
technology,n. the practical application of science to commerce or industry
solution,"n. a homogeneous mixture of two or more substances; frequently (but not necessarily) a liquid solution
n. a statement that solves a problem or explains how to solve the problem
n. a method for solving a problem
n. the set of values that give a true statement when substituted into an equation"
solve,v. find the solution to (a problem or question) or understand the meaning of
politics,"n. social relations involving intrigue to gain authority or power
n. the study of government of states and other political units
n. the profession devoted to governing and to political affairs
n. the opinion you hold with respect to political questions"
confidence,"n. a feeling of trust (in someone or something)
n. a state of confident hopefulness that events will be favorable
n. a trustful relationship
n. a secret that is confided or entrusted to another"
prosperous,"s in fortunate circumstances financially; moderately rich
s very lively and profitable
s marked by peace and prosperity
s presaging or likely to bring good luck"
enthusiasm,"n. a feeling of excitement
n. a lively interest"
ensure,"v make certain of
v be careful or certain to do something; make certain of something"
democracy,"n. the political orientation of those who favor government by the people or by their elected representatives
n. a political system in which the supreme power lies in a body of citizens who can elect people to represent them"
certainty,"n. the state of being certain
n. something that is certain"
reform,"n. a change for the better as a result of correcting abuses
n. a campaign aimed to correct abuses or malpractices
n. self-improvement in behavior or morals by abandoning some vice
v. make changes for improvement in order to remove abuse and injustices"
depression,"n. a mental state characterized by a pessimistic sense of inadequacy and a despondent lack of activity
n. a long-term economic state characterized by unemployment and low prices and low levels of trade and investment
n. sad feelings of gloom and inadequacy
n. a period during the 1930s when there was a worldwide economic depression and mass unemployment"
expertise,n skillfulness by virtue of possessing special knowledge
academic,"a. associated with academia or an academy
s. hypothetical or theoretical and not expected to produce an immediate or practical result
s. marked by a narrow focus on or display of learning especially its trivial aspects"
humanistic,a. of or pertaining to Renaissance humanism
survival,"n. a state of surviving; remaining alive
n. a natural process resulting in the evolution of organisms best adapted to the environment
n. something that survives"
resist,"v. stand up or offer resistance to somebody or something
v. withstand the force of something
v. resist immunologically the introduction of some foreign tissue or organ
v. refuse to comply"
educational,"a. relating to the process of education
s. providing knowledge"
challenge,"n. a demanding or stimulating situation
n. a call to engage in a contest or fight
n. questioning a statement and demanding an explanation
n. a formal objection to the selection of a particular person as a juror"
discipline,"n. a branch of knowledge
n. a system of rules of conduct or method of practice; 
n. the trait of being well behaved
n. training to improve strength or self-control"
considerable,a. large or relatively large in number or amount or extent or degree
justified,s. having words so spaced that lines have straight even margins
essential,"s. absolutely necessary; vitally necessary
a. basic and fundamental
a. being or relating to or containing the essence of a plant etc"
strengthen,"v. make strong or stronger
v. gain strength"
engineering,"n. the discipline dealing with the art or science of applying scientific knowledge to practical problems
n. a room (as on a ship) in which the engine is located"
concern,"n. something that interests you because it is important or affects you
n. an anxious feeling
n. a feeling of sympathy for someone or something
n. something or someone that causes anxiety; a source of unhappiness"
leadership,"n. the activity of leading
n. the body of people who lead a group
n. the status of a leader
n. the ability to lead"
inevitably,r. in such a manner as could not be otherwise
elite,n. a group or class of persons enjoying superior intellectual or social or economic status
significant,"a. important in effect or meaning
s. fairly large
a. too closely correlated to be attributed to chance and therefore indicating a systematic relation"
decline,"n. change toward something smaller or lower
n. a condition inferior to an earlier condition; a gradual falling off from a better state
v. grow smaller
v. go down"
underfunded,none
foundation,"n. the basis on which something is grounded
n. an institution supported by an endowment
n. lowest support of a structure
n. education or instruction in the fundamentals of a field of knowledge"
faculty,n. one of the inherent cognitive or perceptual powers of the mind
generate,"v. bring into existence
v. produce (energy)"
credentials,"n a document attesting to the truth of certain stated facts
n a document attesting to the truth of certain stated facts"
institution,"n. an organization founded and united for a specific purpose
n. an establishment consisting of a building or complex of buildings where an organization for the promotion of some cause is situated
n. a custom that for a long time has been an important feature of some group or society"
regard,"n. (usually plural) a polite expression of desire for someone's welfare
n. a feeling of friendship and esteem
v. look at attentively"
grant,"n. any monetary aid
n. the act of providing a subsidy
n. (law) a transfer of property by deed of conveyance
n. Scottish painter; cousin of Lytton Strachey and member of the Bloomsbury Group (1885-1978)"
career,"n. the particular occupation for which you are trained
n. the general progression of your working or professional life
v. move headlong at high speed"
literacy,n. the ability to read and write
focus,"n. the concentration of attention or energy on something
n. maximum clarity or distinctness of an image rendered by an optical system
n. maximum clarity or distinctness of an idea
n. a central point or locus of an infection in an organism"
ruin,"n. an irrecoverable state of devastation and destruction
n. a ruined building
n. an event that results in destruction
v. destroy or cause to fail"
politician,"n. a leader engaged in civil administration
n. a person active in party politics
n. a schemer who tries to gain advantage in an organization in sly or underhanded ways"
absence,"n. the state of being absent
n. failure to be present
n. the time interval during which something or somebody is away
n. the occurrence of an abrupt, transient loss or impairment of consciousness (which is not subsequently remembered), sometimes with light twitching, fluttering eyelids, etc.; common in petit mal epilepsy"
vehicle,"n. a conveyance that transports people or objects
n. a medium for the expression or achievement of something
n. any substance that facilitates the use of a drug or pigment or other material that is mixed with it"
reward,"n. payment made in return for a service rendered
n. an act performed to strengthen approved behavior
n. the offer of money for helping to find a criminal or for returning lost property
v. act or give recompense in recognition of someone's behavior or actions"
aesthetic,"n. (philosophy) a philosophical theory as to what is beautiful
a. relating to or dealing with the subject of aesthetics
a. concerning or characterized by an appreciation of beauty or good taste
s. aesthetically pleasing"
intellectual,"n. a person who uses the mind creatively
s. of or associated with or requiring the use of the mind
a. appealing to or using the intellect"
inspiration,"n. arousal of the mind to special unusual activity or creativity
n. a product of your creative thinking and work
n. a sudden intuition as part of solving a problem"
ambiguity,"n. an expression whose meaning cannot be determined from its context
n. unclearness by virtue of having more than one meaning"
complex,"n. a conceptual whole made up of complicated and related parts
n. a compound described in terms of the central atom to which other atoms are bound or coordinated
n. (psychoanalysis) a combination of emotions and impulses that have been rejected from awareness but still influence a person's behavior
a. complicated in structure; consisting of interconnected parts"
turbulent,"s characterized by unrest or disorder or insubordination
s (of a liquid) agitated vigorously; in a state of turbulence"
aspire,v have an ambitious plan or a lofty goal
skepticism,"n doubt about the truth of something
n the disbelief in any claims of ultimate knowledge"
diverse,s. distinctly dissimilar or unlike
commit,"v. cause to be admitted; of persons to an institution
v. engage in or perform"
curricular,a. of or relating to an academic course of study
liberal-arts,none
collaborate,"v. work together on a common enterprise of project
v. cooperate as a traitor"
extraordinary,"a. beyond what is ordinary or usual; highly unusual or exceptional or remarkable
s. far more than usual or expected
s. (of an official) serving an unusual or special function in addition to those of the regular officials"
achievement,n the action of accomplishing something
complicated,s. difficult to analyze or understand
imagine,v. form a mental image of something that is not present or that is not the case
defined,"a. clearly characterized or delimited
s. showing clearly the outline or profile or boundary"
remarkable,s. unusual or striking
culture,"n. a particular society at a particular time and place
n. the tastes in art and manners that are favored by a social group
n. (biology) the growing of microorganisms in a nutrient medium (such as gelatin or agar)
n. the attitudes and behavior that are characteristic of a particular social group or organization"
untold,s. of an incalculable amount
traditional,"a. consisting of or derived from tradition
s. pertaining to time-honored orthodox doctrines"
instruction,n. (computer science) a line of code written as part of a computer program
vulnerable,"a. susceptible to attack
s. susceptible to criticism or persuasion or temptation
s. capable of being wounded or hurt"
fraud,"n. intentional deception resulting in injury to another person
n. something intended to deceive; deliberate trickery intended to gain an advantage"
official,"n. a worker who holds or is invested with an office
n. someone who administers the rules of a game or sport
a. having official authority or sanction
a. of or relating to an office"
enroll,v. register formally as a participant or member
flexibility,"n. the property of being flexible; easily bent or shaped
n. the quality of being adaptable or variable"
federal,"n. a member of the Union Army during the American Civil War
n. any federal law-enforcement officer
s. national; especially in reference to the government of the United States as distinct from that of its member units
a. of or relating to the central government of a federation"
inspector,n. a high ranking police officer
investigation,n. the work of inquiring into something thoroughly and systematically
evaluate,v. form a critical opinion of
potentially,r. with a possibility of becoming actual
participant,n. someone who takes part in an activity
complaint,"n. (formerly) a loud cry (or repeated cries) of pain or rage or sorrow
n. an expression of grievance or resentment
n. (civil law) the first pleading of the plaintiff setting out the facts on which the claim for relief is based"
involve,"v. connect closely and often incriminatingly
v. engage as a participant
v. contain as a part
v. occupy or engage the interest of"
rarely,r. not often
falsify,"v. make false by mutilation or addition; as of a message or story
v. prove false
v. falsify knowingly"
enrollment,"n the act of enrolling
n the body of people (such as students) who register or enroll at the same time"
obtain,v. come into possession of
identity,"n. the distinct personality of an individual regarded as a persisting entity
n. the individual characteristics by which a thing or person is recognized or known
n. an operator that leaves unchanged the element on which it operates
n. exact sameness"
community,"n. a group of people living in a particular local area
n. common ownership
n. a group of nations having common interests
n. agreement as to goals"
straw,"n. plant fiber used e.g. for making baskets and hats or as fodder
n. a thin paper or plastic tube used to suck liquids into the mouth
v. cover or provide with or as if with straw
s. of a pale yellow color like straw; straw-colored"
aid,"n. a resource
n. the activity of contributing to the fulfillment of a need or furtherance of an effort or purpose
n. money to support a worthy person or cause"
disburse,"v. expend, as from a fund"
allowable,"s. deductible according to the tax laws
s. deserving to be allowed or considered"
tuition,n. a fee paid for instruction (especially for higher education)
defendant,n. a person or institution against whom an action is brought in a court of law; the person being sued or accused
award,"n. a grant made by a law court
n. a tangible symbol signifying approval or distinction
v. give, especially as an honor or reward
v. give as judged due or on the basis of merit"
eligibility,n. the quality or state of being eligible
transportation,"n. the act of moving something from one location to another
n. the commercial enterprise of moving goods and materials"
expense,"n. amounts paid for goods and services that may be currently tax deductible (as opposed to capital expenditures)
n. a detriment or sacrifice
n. money spent to perform work and usually reimbursed by an employer
v. reduce the estimated value of something"
eligible,a. qualified for or allowed or worthy of being chosen
incur,v. make oneself subject to; bring upon oneself; become liable to
calculate,"v. make a mathematical calculation or computation
v. judge to be probable
v. specifically design a product, event, or activity for a certain public"
inmate,n. one of several resident of a dwelling (especially someone confined to a prison or hospital)
