proposition,"n. (logic) a statement that affirms or denies something and is either true or false
n. an offer for a private bargain (especially a request for sexual favors)
n. a task to be dealt with
v. suggest sex to"
publish,"v. prepare and issue for public distribution or sale
v. have (one's written work) issued for publication"
sexual,"a. of or relating to or characterized by sexuality
a. having or involving sex"
remarkably,"r to a remarkable degree or extent
r in a signal manner"
globally,r. throughout the world
annoyingly,r. in an annoying manner or to an annoying degree
growth,"n. (biology) the process of an individual organism growing organically; a purely biological unfolding of events involved in an organism changing gradually from a simple to a more complex level
n. a progression from simpler to more complex forms
n. vegetation that has grown
n. (pathology) an abnormal proliferation of tissue (as in a tumor)"
gap,"n. a conspicuous disparity or difference as between two figures
n. a narrow opening
n. a difference (especially an unfortunate difference) between two opinions or two views or two situations
v. make an opening or gap in"
debate,"n. the formal presentation of a stated proposition and the opposition to it (usually followed by a vote)
v. argue with one another
v. discuss the pros and cons of an issue"
ill-educated,none
inequality,n. lack of equality
stubborn,a. tenaciously unwilling or marked by tenacious unwillingness to yield
concentrate,"n. a concentrated form of a foodstuff; the bulk is reduced by removing water
n. a concentrated example of something
v. make denser, stronger, or purer
v. direct one's attention on something"
economic,"a. of or relating to an economy, the system of production and management of material wealth
a. of or relating to the science of economics
s. using the minimum of time or resources necessary for effectiveness
s. concerned with worldly necessities of life (especially money)"
narrow,"n. a narrow strait connecting two bodies of water
v. make or become more narrow or restricted
a. not wide
s. limited in size or scope"
surprising,a. causing surprise or wonder or amazement
sector,"n. a plane figure bounded by two radii and the included arc of a circle
n. a social group that forms part of the society or the economy
n. a particular aspect of life or activity
n. the minimum track length that can be assigned to store information; unless otherwise specified a sector of data consists of 512 bytes"
overall,"n. (usually plural) work clothing consisting of denim trousers (usually with a bib and shoulder straps)
n. a loose protective coverall or smock worn over ordinary clothing for dirty work
s. involving only main features
s. including everything"
brute,"n a cruelly rapacious person
n a living organism characterized by voluntary movement
s resembling a beast; showing lack of human sensibility"
wage,n. something that remunerates
striking,"n the physical coming together of two or more things
n the act of contacting one thing with another
v deliver a sharp blow, as with the hand, fist, or weapon
v have an emotional or cognitive impact upon
v hit against; come into sudden contact with
v make a strategic, offensive, assault against an enemy, opponent, or a target
v indicate (a certain time) by striking
v affect or afflict suddenly, usually adversely
v stop work in order to press demands
v touch or seem as if touching visually or audibly
v attain
v produce by manipulating keys or strings of musical instruments, also metaphorically
v cause to form (an electric arc) between electrodes of an arc lamp
v find unexpectedly
v produce by ignition or a blow
v remove by erasing or crossing out or as if by drawing a line
v cause to experience suddenly
v drive something violently into a location
v occupy or take on
v form by stamping, punching, or printing
v smooth with a strickle
v pierce with force
v arrive at after reckoning, deliberating, and weighing
s sensational in appearance or thrilling in effect
s having a quality that thrusts itself into attention"
traditionally,r. according to tradition; in a traditional manner
utterly,r completely and without qualification; used informally as intensifiers
sign,"n. a perceptible indication of something not immediately apparent (as a visible clue that something has happened)
n. a public display of a message
n. (medicine) any objective evidence of the presence of a disorder or disease
n. a gesture that is part of a sign language"
occupation,"n. the principal activity in your life that you do to earn money
n. the control of a country by military forces of a foreign power
n. any activity that occupies a person's attention
n. the act of occupying or taking possession of a building"
dominate,"v. be in control
v. have dominance or the power to defeat over
v. look down on"
beefy,s. muscular and heavily built
mining,"n. the act of extracting ores or coal etc from the earth
n. laying explosive mines in concealed places to destroy enemy personnel and equipment"
construction,"n. the act of constructing something
n. a group of words that form a constituent of a sentence and are considered as a single unit
n. the creation of a construct; the process of combining ideas into a congruous object of thought
n. drawing a figure satisfying certain conditions as part of solving a problem or proving a theorem"
transport,"n. an exchange of molecules (and their kinetic energy and momentum) across the boundary between adjacent layers of a fluid or across cell membranes
v. move something or somebody around; usually over long distances
v. move while supporting, either in a vehicle or in one's hands or on one's body
v. transport commercially"
hefty,s. of considerable weight and size
cluster,v. come together as in a cluster or flock
communications,n. the discipline that studies the principles of transmiting information and the methods by which it is delivered (as print or radio or television etc.)
retail,"n. the selling of goods to consumers; usually in small quantities and not for resale
v. be sold at the retail level
v. sell on the retail market
r. at a retail price"
administration,"n. a method of tending to or managing the affairs of a some group of people (especially the group's business affairs)
n. the persons (or committees or departments etc.) who make up a body for the purpose of administering something
n. the act of administering medication
n. the act of meting out justice according to the law"
regardless,r. in spite of everything; without regard to drawbacks
sort,"n. an approximate definition or example
n. a person of a particular character or nature
n. an operation that segregates items into groups according to a specified criterion"
disproportionately,"r. out of proportion
r. to a disproportionate degree"
exception,"n. a deliberate act of omission
n. an instance that does not conform to a rule or generalization; the only exception was her last child""
n. grounds for adverse criticism"
tend,"v. have a tendency or disposition to do or be something; be inclined
v. have care of or look after
v. manage or run"
discrimination,"n. unfair treatment of a person or group on the basis of prejudice
n. the cognitive process whereby two or more stimuli are distinguished"
capable,"a. (usually followed by `of') having capacity or ability
s. possibly accepting or permitting
a. (followed by `of') having the temperament or inclination for"
qualified,"a. meeting the proper standards and requirements and training for an office or position or task
a. limited or restricted; not absolute"
widespread,s. widely circulated or diffused
statistic,n. a datum that can be represented numerically
allocate,v. distribute according to a plan or set apart for a special purpose
advance,"n. an amount paid before it is earned
n. increase in price or value
v. move forward, also in the metaphorical sense
v. bring forward for consideration or acceptance"
universal,"n. (linguistics) a grammatical rule (or other linguistic feature) that is found in all languages
n. (logic) a proposition that asserts something of all members of a class
n. a behavioral convention or pattern characteristic of all members of a particular culture or of all human beings
s. applicable to or common to all members of a group or set"
housework,n. the work of cleaning and running a house
constrain,"v hold back
v restrict"
relax,"v. become less tense, rest, or take one's ease
v. make less taut
v. cause to feel relaxed
v. become less tense, less formal, or less restrained, and assume a friendlier manner"
vacation,"n. leisure time away from work devoted to rest or pleasure
n. the act of making something legally void
v. spend or take a vacation"
Indianapolis,n. the capital and largest city of Indiana; a major commercial center in the country's heartland; site of an annual 500-mile automobile race
maintain,v. state or assert
professional,"n. a person engaged in one of the learned professions
n. an athlete who plays for pay
a. engaged in a profession or engaging in as a profession or means of livelihood
a. of or relating to or suitable as a profession"
numerous,s. amounting to a large indefinite number
suburban,a. relating to or characteristic of or situated in suburbs
emotional,"a. determined or actuated by emotion rather than reason
a. of more than usual emotion
a. of or pertaining to emotion"
relaxation,"n. (physiology) the gradual lengthening of inactive muscle or muscle fibers
n. (physics) the exponential return of a system to equilibrium after a disturbance
n. an occurrence of control or strength weakening"
accomplish,"v put in effect
v to gain with effort"
primary,"n. a preliminary election where delegates or nominees are chosen
n. one of the main flight feathers projecting along the outer edge of a bird's wing
n. (astronomy) a celestial body (especially a star) relative to other objects in orbit around it
a. of first rank or importance or value; direct and immediate rather than secondary"
decrease,"n. a change downward
n. a process of becoming smaller or shorter
n. the amount by which something decreases
n. the act of decreasing or reducing something"
powerful,a. having great power or force or potency or effect
stress,"n. the relative prominence of a syllable or musical note (especially with regard to stress or pitch)
n. special emphasis attached to something
n. difficulty that causes worry or emotional tension
n. (physics) force that produces strain on a physical body"
meditation,"n. continuous and profound contemplation or musing on a subject or series of subjects of a deep or abstruse nature
n. (religion) contemplation of spiritual matters (usually on religious or philosophical subjects)"
physician,n a licensed medical practitioner
benefit,"n. financial assistance in time of need
n. something that aids or promotes well-being
n. a performance to raise money for a charitable cause
v. be beneficial for"
healing,n. the natural process by which the body repairs itself
echo,"n. the repetition of a sound resulting from reflection of the sound waves
n. (Greek mythology) a nymph who was spurned by Narcissus and pined away until only her voice remained
n. a reply that repeats what has just been said
n. a reflected television or radio or radar beam"
clinical,"a. relating to a clinic or conducted in or as if in a clinic and depending on direct observation of patients
s. scientifically detached; unemotional"
psychologist,n. a scientist trained in psychology
specialize,"v. become more focus on an area of activity or field of study
v. suit to a special purpose
v. devote oneself to a special area of work"
management,"n. the act of managing something
n. those in charge of running a business"
motivate,v. give an incentive for action
profound,"a. showing intellectual penetration or emotional depth
s. of the greatest intensity; complete
s. coming from deep within one
s. situated at or extending to great depth; too deep to have been sounded or plumbed"
perspective,n. the appearance of things relative to one another as determined by their distance from the viewer
combine,"n. harvester that heads and threshes and cleans grain while moving across the field
v. add together from different sources
v. join for a common purpose or in a common action"
ski,"n. narrow wood or metal or plastic runners used in pairs for gliding over snow
v. move along on skis"
schedule,"n. an ordered list of times at which things are planned to occur
v. plan for an activity or event
v. make a schedule; plan the time and place for events"
count,"n. the total number counted
n. the act of counting; reciting numbers in ascending order
n. a nobleman (in various countries) having rank equal to a British earl
v. determine the number or amount of"
cruise,"n. an ocean trip taken for pleasure
v. drive around aimlessly but ostentatiously and at leisure
v. travel at a moderate speed
v. look for a sexual partner in a public place"
beach,"n. an area of sand sloping down to the water of a sea or lake
v. land on a beach"
upcoming,s of the relatively near future
buffer,"n. (chemistry) an ionic compound that resists changes in its pH
n. (computer science) a part of RAM used for temporary storage of data that is waiting to be sent to a device; used to compensate for differences in the rate of flow of data between components of a computer system
n. a power tool used to buff surfaces
n. a cushion-like device that reduces shock due to an impact"
norm,n. a standard or model or pattern regarded as typical
conduct,"v. direct the course of; manage or control
v. lead, as in the performance of a composition; Barenboim conducted the Chicago symphony for years""
v. lead musicians in the performance of"
top,"n. the upper part of anything
n. the highest or uppermost side of anything
n. the first half of an inning; while the visiting team is at bat
n. the greatest possible intensity"
response,"n. a result
n. a phrase recited or sung by the congregation following a versicle by the priest or minister
n. the manner in which an electrical or mechanical device responds to an input signal or a range of input signals"
employer,n. a person or firm that employs workers
agency,"n. an administrative unit of government
n. a business that serves other businesses
n. the state of being in action or exerting power"
survey,"n. a detailed critical inspection
v. consider in a comprehensive way
v. look over carefully or inspect
v. make a survey of; for statistical purposes"
respondent,"n. the codefendant (especially in a divorce proceeding) who is accused of adultery with the corespondent
n. someone who responds"
individual,"n. a single organism
a. being or characteristic of a single thing or person
s. separate and distinct from others of the same kind
s. characteristic of or meant for a single person or thing"
glimmer,"n a flash of light (especially reflected light)
n a slight suggestion or vague understanding
v shine brightly, like a star or a light"
entirely,r. without any others being included or involved
media,"n a means or instrumentality for storing or communicating information
n the surrounding environment
n an intervening substance through which signals can travel as a means for communication
n (bacteriology) a nutrient substance (solid or liquid) that is used to cultivate micro-organisms
n a liquid with which pigment is mixed by a painter
n (biology) a substance in which specimens are preserved or displayed
n an intervening substance through which something is achieved
n a state that is intermediate between extremes; a middle position
n someone who serves as an intermediary between the living and the dead
n (usually plural) transmissions that are disseminated widely to the public
n an occupation for which you are especially well suited"
overwhelmingly,r. incapable of being resisted
behavior,"n. manner of acting or controlling yourself
n. the action or reaction of something (as a machine or substance) under specified circumstances
n. (psychology) the aggregate of the responses or reactions or movements made by an organism in any situation"
consumption,"n. the process of taking food into the body through the mouth (as by eating)
n. (economics) the utilization of economic goods to satisfy needs or in manufacturing
n. the act of consuming something"
immediacy,"n. lack of an intervening or mediating agency
n. immediate intuitive awareness
n. the quickness of action or occurrence"
underline,v. draw a line or lines underneath to call attention to
struggle,"n. an energetic attempt to achieve something
n. strenuous effort
v. to exert strenuous effort against opposition"
circulation,"n. the dissemination of copies of periodicals (as newspapers or magazines)
n. movement through a circuit; especially the movement of blood through the heart and blood vessels
n. (library science) the count of books that are loaned by a library over a specified period
n. number of copies of a newspaper or magazine that are sold"
differentiated,"a. made different (especially in the course of development) or shown to be different
s. exhibiting biological specialization; adapted during development to a specific function or environment"
innovative,s. being or producing something like nothing done or experienced or created before
silver bullet,none
potential,"n. the inherent capacity for coming into being
a. existing in possibility"
challenge,"n. a demanding or stimulating situation
n. a call to engage in a contest or fight
n. questioning a statement and demanding an explanation
n. a formal objection to the selection of a particular person as a juror"
address,"n. (computer science) the code that identifies where a piece of information is stored
n. the place where a person or organization can be found or communicated with
n. the act of delivering a formal spoken communication to an audience
n. the manner of speaking to another individual"
advertising,n. the business of drawing public attention to goods and services
revenue,"n the entire amount of income before any deductions are made
n government income due to taxation"
modest,"a. marked by simplicity; having a humble opinion of yourself
s. not large but sufficient in size or amount
s. free from pomp or affectation
a. not offensive to sexual mores in conduct or appearance"
insufficient,a. of a quantity not able to fulfill a need or requirement
compensate,"v. adjust for
v. make amends for; pay compensation for
v. make payment to; compensate"
hypothetical,"n. a hypothetical possibility, circumstance, statement, proposal, situation, etc."
version,"n. an interpretation of a matter from a particular viewpoint
n. something a little different from others of the same type
n. manual turning of a fetus in the uterus (usually to aid delivery)"
opportunity,n. a possibility due to a favorable combination of circumstances
digital,"a. displaying numbers rather than scale positions
a. relating to or performed with the fingers
a. of a circuit or device that represents magnitudes in digits"
informative,a. providing or conveying information
confidence,"n. a feeling of trust (in someone or something)
n. a state of confident hopefulness that events will be favorable
n. a trustful relationship
n. a secret that is confided or entrusted to another"
inspiring,a. stimulating or exalting to the spirit
specialized,a. developed or designed for a special activity or function
entertainment,n. an activity that is diverting and that holds the attention
automobile,v. travel in an automobile
finance,"n. the commercial activity of providing funds and capital
n. the branch of economics that studies the management of money and other assets
n. the management of money and credit and banking and investments
v. obtain or provide money for"
combination,"n. a collection of things that have been combined; an assemblage of separate parts or qualities
n. a coordinated sequence of chess moves
n. a sequence of numbers or letters that opens a combination lock
n. a group of people (often temporary) having a common purpose"
editorial,"a. of or relating to an article stating opinions or giving perspectives
a. relating to or characteristic of an editor"
practical use,none
inherent,"s existing as an essential constituent or characteristic
s in the nature of something though not readily apparent"
scope,"n. an area in which something acts or operates or has power or control: ""the range of a supersonic jet"""
real estate,none
commercial,"n. a commercially sponsored ad on radio or television
a. connected with or engaged in or sponsored by or used in commerce or commercial enterprises
a. of or relating to commercialism
s. of the kind or quality used in commerce; average or inferior"
crave,"v. have a craving, appetite, or great desire for
v. plead or ask for earnestly"
offer,"n. the verbal act of offering
n. something offered (as a proposal or bid)
v. make available or accessible, provide or furnish
v. present for acceptance or rejection"
disconnection,n. the act of breaking a connection
major,"n. a commissioned military officer in the United States Army or Air Force or Marines; below lieutenant colonel and above captain
n. British statesman who was prime minister from 1990 until 1997 (born in 1943)
n. a university student who is studying a particular field as the principal subject
n. the principal field of study of a student at a university"
variety,"n. (biology) a taxonomic category consisting of members of a species that differ from others of the same species in minor but heritable characteristics
n. a difference that is usually pleasant"
plug,"n. blockage consisting of an object designed to fill a hole tightly
n. an electrical device with two or three pins that is inserted in a socket to make an electrical connection
v. fill or close tightly with or as if with a plug
v. persist in working hard"
specific,"n. a medicine that has a mitigating effect on a specific disease
a. (sometimes followed by `to') applying to or characterized by or distinguishing something particular or special or unique
s. stated explicitly or in detail
a. relating to or distinguishing or constituting a taxonomic species"
option,"n. the right to buy or sell property at an agreed price; the right is purchased and if it is not exercised by a stated date the money is forfeited
n. one of a number of things from which only one can be chosen"
basis,"n. the fundamental assumptions from which something is begun or developed or calculated or explained
n. the most important or necessary part of something"
uninterrupted,s. having undisturbed continuity
refuse,"v. show unwillingness towards
v. refuse to accept"
enormous,"s. extraordinarily large in size or extent or amount or power or degree; that a whole civilization should be dependent on technology""- Walter Lippman"
align,"v. place in a line or arrange so as to be parallel or straight
v. be or come into adjustment with
v. align oneself with a group or a way of thinking
v. bring (components or parts) into proper or desirable coordination correlation"
regular,"n. a regular patron
n. a soldier in the regular army
n. a dependable follower (especially in party politics)
n. a garment size for persons of average height and weight"
ignore,"v. refuse to acknowledge
v. fail to notice
v. be ignorant of or in the dark about"
nester,n. a bird that has built (or is building) a nest
retiree,n. someone who has retired from active working
challenge,"n. a demanding or stimulating situation
n. a call to engage in a contest or fight
n. questioning a statement and demanding an explanation
n. a formal objection to the selection of a particular person as a juror"
coming-of-age,none
unite,"v. act in concert or unite in a common purpose or belief
v. have or possess in combination
v. bring together for a common purpose or action or ideology or in a shared situation
v. join or combine"
engage,"v. ask to represent; of legal counsel
v. get caught
v. carry on (wars, battles, or campaigns)
v. hire for work or assistance"
raise,"n. the amount a salary is increased
n. increasing the size of a bet (as in poker)
v. raise the level or amount of something
v. raise from a lower to a higher position"
version,"n. an interpretation of a matter from a particular viewpoint
n. something a little different from others of the same type
n. manual turning of a fetus in the uterus (usually to aid delivery)"
practically,"r. almost; nearly
r. in a practical manner"
transmit,v. send from one person or place to another
digital,"a. displaying numbers rather than scale positions
a. relating to or performed with the fingers
a. of a circuit or device that represents magnitudes in digits"
form,"n. the phonological or orthographic sound or appearance of a word that can be used to describe or identify something
n. a perceptual structure
n. the visual appearance of something or someone
n. a printed document with spaces in which to write"
wirelessly,none
transmission,"n. the act of sending a message; causing a message to be transmitted
n. communication by means of transmitted signals
n. the gears that transmit power from an automobile engine via the driveshaft to the live axle"
thaw,"n. the process whereby heat changes something from a solid to a liquid
n. warm weather following a freeze; snow and ice melt
n. a relaxation or slackening of tensions or reserve; becoming less hostile"
dominate,"v. be in control
v. have dominance or the power to defeat over
v. look down on"
unparalleled,s radically distinctive and without equal
freedom,n. the condition of being free; the power to act or speak or think without externally imposed restraints
direction,"n. a line leading to a place or point
n. the spatial relation between something and the course along which it points or moves
n. a general course along which something has a tendency to develop
n. a message describing how something is to be done"
