tissue,"n. part of an organism consisting of an aggregate of cells having a similar structure and function
n. a soft thin (usually translucent) paper"
infection,"n. the pathological state resulting from the invasion of the body by pathogenic microorganisms
n. (phonetics) the alteration of a speech sound under the influence of a neighboring sound
n. (medicine) the invasion of the body by pathogenic microorganisms and their multiplication which can lead to tissue damage and disease
n. an incident in which an infectious disease is transmitted"
secular,"a. of or relating to the doctrine that rejects religion and religious considerations
a. of or relating to clergy not bound by monastic vows"
avoid,"v. stay clear from; keep away from; keep out of the way of someone or something
v. refrain from doing something"
canal,"n. (astronomy) an indistinct surface feature of Mars once thought to be a system of channels; they are now believed to be an optical illusion
n. long and narrow strip of water made for boats or for irrigation
v. provide (a city) with a canal"
bipedal,a. having two feet
withstand,"v resist or confront with resistance
v stand up or offer resistance to somebody or something"
oversize,s larger than normal for its kind
constraint,"n. the state of being physically constrained
n. the act of constraining; the threat or use of force to control the thoughts or behavior of others"
organism,"n. a living thing that has (or can develop) the ability to act or function independently
n. a system considered analogous in structure or function to a living body"
substantial,"s. having a firm basis in reality and being therefore important, meaningful, or considerable
a. having substance or capable of being treated as fact; not imaginary"
upright,"n. a vertical structural member as a post or stake
n. a piano with a vertical sounding board
s. in a vertical position; not sloping"
posture,"n the arrangement of the body and its limbs
n characteristic way of bearing one's body
n a rationalized mental attitude
n capability in terms of personnel and materiel that affect the capacity to fight a war
v behave affectedly or unnaturally in order to impress others
v assume a posture as for artistic purposes"
impose,"v compel to behave in a certain way
v impose something unpleasant
v impose and collect"
limb,"n. one of the jointed appendages of an animal used for locomotion or grasping: arm; leg; wing; flipper
n. any of the main branches arising from the trunk or a bough of a tree
n. (astronomy) the circumferential edge of the apparent disc of the sun or the moon or a planet
n. either of the two halves of a bow from handle to tip"
architecture,"n. an architectural product or work
n. the discipline dealing with the principles of design and construction and ornamentation of fine buildings
n. the profession of designing buildings and environments with consideration for their esthetic effect"
maximum,"n. the largest possible quantity
n. the point on a curve where the tangent changes from positive on the left to negative on the right"
workstation,n. a desktop digital computer that is conventionally considered to be more powerful than a microcomputer
predict,v. make a prediction about; tell in advance
ensure,"v make certain of
v be careful or certain to do something; make certain of something"
alteration,n. the act of making something different (as e.g. the size of a garment)
equipment,n. an instrumentality needed for an undertaking or to perform a service
count,"n. the total number counted
n. the act of counting; reciting numbers in ascending order
n. a nobleman (in various countries) having rank equal to a British earl
v. determine the number or amount of"
emotional,"a. determined or actuated by emotion rather than reason
a. of more than usual emotion
a. of or pertaining to emotion"
concept,n. an abstract or general idea inferred or derived from specific instances
account for,none
intelligence,"n. the ability to comprehend; to understand and profit from experience
n. a unit responsible for gathering and interpreting information about an enemy
n. secret information about an enemy (or potential enemy)
n. the operation of gathering information about an enemy"
myth,n. a traditional story accepted as history; serves to explain the world view of a people
float,"n. the time interval between the deposit of a check in a bank and its payment
n. the number of shares outstanding and available for trading by the public
n. an elaborate display mounted on a platform carried by a truck (or pulled by a truck) in a procession or parade
n. a hand tool with a flat face used for smoothing and finishing the surface of plaster or cement or stucco"
management,"n. the act of managing something
n. those in charge of running a business"
misinterpretation,n. putting the wrong interpretation on
publish,"v. prepare and issue for public distribution or sale
v. have (one's written work) issued for publication"
constantly,"r. without variation or change, in every case
r. without interruption"
blogosphere,none
consultant,n an expert who gives advice
determinant,"n. a determining or causal element or factor
n. a square matrix used to solve simultaneous equations"
sense,"n. a general conscious awareness
n. the meaning of a word or expression; the way in which a word or expression or situation can be interpreted
n. the faculty through which the external world is apprehended
n. a natural appreciation or ability"
typically,r. in a typical manner
cognitive,a. of or being or relating to or involving cognition
accountant,n. someone who maintains and audits business accounts
executive,"n. a person responsible for the administration of a business
n. persons who administer the law
a. having the function of carrying out plans or orders etc."
intellect,"n knowledge and intellectual ability
n the capacity for rational thought or inference or discrimination
n a person who uses the mind creatively"
productive,"a. producing or capable of producing (especially abundantly)
s. yielding positive results"
effective,"a. producing or capable of producing an intended result or having a striking effect
s. able to accomplish a purpose; functioning effectively
s. works well as a means or remedy
s. exerting force or influence"
drive,"n. the act of applying force to propel something
n. a mechanism by which force or power is transmitted in a machine
n. the trait of being highly motivated
n. hitting a golf ball off of a tee with a driver"
outstanding,"s. distinguished from others in excellence
s. having a quality that thrusts itself into attention
s. owed as a debt"
predict,v. make a prediction about; tell in advance
handle,"n. the appendage to an object that is designed to be held in order to use or move it
v. touch, lift, or hold with the hands
v. show and train"
complexity,n. the quality of being intricate and compounded
physician,n a licensed medical practitioner
paradox,n. (logic) a statement that contradicts itself
emerge,"v. come out into view, as from concealment
v. become known or apparent
v. come up to the surface of or rise"
discipline,"n. a branch of knowledge
n. a system of rules of conduct or method of practice; 
n. the trait of being well behaved
n. training to improve strength or self-control"
empathy,n. understanding and entering into another's feelings
corporate,"a. of or belonging to a corporation
s. done by or characteristic of individuals acting together
s. organized and maintained as a legal corporation"
apply,"v. be pertinent or relevant or applicable
v. ask (for something)
v. refer (a word or name) to a person or thing
v. apply oneself to"
recruit,"n. a recently enlisted soldier
n. any new member or supporter (as in the armed forces)
v. seek to employ
v. cause to assemble or enlist in the military"
emphasis,"n. special importance or significance
n. special and significant stress by means of position or repetition e.g."
ignore,"v. refuse to acknowledge
v. fail to notice
v. be ignorant of or in the dark about"
claim,"n. an assertion of a right (as to money or property)
n. an assertion that something is true or factual
n. demand for something as rightful or due
n. an informal right to something"
survey,"n. a detailed critical inspection
v. consider in a comprehensive way
v. look over carefully or inspect
v. make a survey of; for statistical purposes"
aspect,"n. a distinct feature or element in a problem
n. a characteristic to be considered
n. the beginning or duration or completion or repetition of the action of a verb"
promotion,"n. a message issued in behalf of some product or cause or idea or person or institution
n. act of raising in rank or position
n. encouragement of the progress or growth or acceptance of something"
boom,"n. a deep prolonged loud noise
n. a state of economic prosperity
n. a sudden happening that brings good fortune (as a sudden opportunity to make money)
n. a pole carrying an overhead microphone projected over a film or tv set"
data,n. a collection of facts from which conclusions may be drawn
fanciful,"s. indulging in or influenced by fancy
s. not based on fact; unreal
s. having a curiously intricate quality"
personal,"n. a short newspaper article about a particular person or group
a. concerning or affecting a particular person or his or her private life and personality
s. particular to a given individual
a. of or arising from personality"
conclude,"v. bring to a close
v. reach a conclusion after a discussion or deliberation
v. come to a close
v. reach agreement on"
status,n. the relative position or standing of things or especially persons in a society
repeated,"v to say, state, or perform again
v make or do or perform again
v happen or occur again
v to say again or imitate
v do over
v repeat an earlier theme of a composition
s recurring again and again"
stem from,none
a wide range of,none
conclusion,"n. an intuitive assumption
n. the proposition arrived at by logical reasoning (such as the proposition that must follow from the major and minor premises of a syllogism)
n. a final settlement
n. the last section of a communication"
magical,s possessing or using or characteristic of or appropriate to supernatural powers
alternative,"s. necessitating a choice between mutually exclusive possibilities
s. pertaining to unconventional choices"
multiple,"n. the product of a quantity by an integer
a. having or involving or consisting of more than one part or entity or individual"
humanize,v. make more humane
consolation,"n. the comfort you feel when consoled in times of disappointment
n. the act of consoling; giving relief in affliction"
optimism,"n. the optimistic feeling that all is going to turn out well
n. a general disposition to expect the best in all things"
tide,"n. the periodic rise and fall of the sea level under the gravitational pull of the moon
n. something that may increase or decrease (like the tides of the sea)
n. there are usually two high and two low tides each day
v. rise or move forward"
conflict,"n. an open clash between two opposing groups (or individuals)
n. opposition between two simultaneous but incompatible feelings
n. a state of opposition between persons or ideas or interests
n. an incompatibility of dates or events"
flood,"n. the rising of a body of water and its overflowing onto normally dry land
n. an overwhelming number or amount
n. light that is a source of artificial illumination having a broad beam; used in photography
n. a large flow"
failure,"n. an act that fails
n. an event that does not accomplish its intended purpose
n. lack of success
n. a person with a record of failing; someone who loses consistently"
successful,a. having succeeded or being marked by a favorable outcome
erode,"v. become ground down or deteriorate
v. remove soil or rock"
violent,"a. acting with or marked by or resulting from great force or energy or emotional intensity
s. effected by force or injury rather than natural causes
s. (of colors or sounds) intensely vivid or loud"
tornado,n. a localized and violently destructive windstorm occurring over land characterized by a funnel-shaped cloud extending toward the ground
threat,"n. a warning that something unpleasant is imminent
n. declaration of an intention or a determination to inflict harm on another"
conduct,"v. direct the course of; manage or control
v. lead, as in the performance of a composition; Barenboim conducted the Chicago symphony for years""
v. lead musicians in the performance of"
optimistic,a. expecting the best in this best of all possible worlds
overly,r to a degree exceeding normal or proper limits
assumption,"n. a hypothesis that is taken for granted
n. the act of taking possession of or power over something
n. celebration in the Roman Catholic Church of the Virgin Mary's being taken up into heaven when her earthly life ended; corresponds to the Dormition in the Eastern Orthodox Church
n. (Christianity) the taking up of the body and soul of the Virgin Mary when her earthly life had ended"
miscalculation,n. a mistake in calculating
checkup,n. a thorough physical examination; includes a variety of tests depending on the age and sex and health of the person
bias,"n. a partiality that prevents objective consideration of an issue or situation
v. influence in an unfair way
v. cause to be biased
s. slanting diagonally across the grain of a fabric"
ledge,n. a projecting ridge on a mountain or submerged under water
venture,"n. any venturesome undertaking especially one with an uncertain outcome
n. a commercial undertaking that risks a loss but promises a profit
v. proceed somewhere despite the risk of possible dangers
v. put at risk"
dweller,n a person who inhabits a particular place
positive,"n. the primary form of an adjective or adverb; denotes a quality without qualification, comparison, or relation to increase or diminution
n. a film showing a photographic image whose tones correspond to those of the original subject
a. characterized by or displaying affirmation or acceptance or certainty etc.
a. indicating existence or presence of a suspected condition or pathogen"
disastrous,s (of events) having extremely unfortunate or dire consequences; bringing ruin
investment,"n. money that is invested with an expectation of profit
n. the commitment of something other than money (time, energy, or effort) to a project with the expectation of some worthwhile result
n. outer layer or covering of an organ or part or organism
n. the act of putting on robes or vestments"
inspire,"v. heighten or intensify
v. supply the inspiration for"
ancestor,n. someone from whom you are descended (but usually more remote than a grandparent)
tribe,"n. a social division of (usually preliterate) people
n. a federation (as of American Indians)
n. (biology) a taxonomic category between a genus and a subfamily"
huddle,"n. (informal) a quick private conference
n. a disorganized and densely packed crowd
v. crowd or draw together
v. crouch or curl up"
progress,"n. the act of moving forward (as toward a goal)
n. a movement forward
v. develop in a positive way"
faith,"n. complete confidence in a person or plan etc
n. loyalty or allegiance to a cause or a person"
pursue,"v. follow in or as if in pursuit
v. carry further or advance"
optimist,n. a person disposed to take a favorable view of things
triumph,n. the exultation of victory
achieve,v. to gain with effort
motivate,v. give an incentive for action
goal,"n. the state of affairs that a plan is intended to achieve and that (when achieved) terminates behavior intended to achieve it
n. game equipment consisting of the place toward which players of a game try to advance a ball or puck in order to score points
n. a successful attempt at scoring"
divorce,"n. the legal dissolution of a marriage
v. get a divorce; formally terminate a marriage"
illusion,"n. an erroneous mental representation
n. something many people believe that is false"
thereby,r. by that means or because of that
reveal,v. disclose directly or through prophets
initial,"n. the first letter of a word (especially a person's name)
v. mark with one's initials
s. occurring at the beginning"
vitamin,n. any of a group of organic substances essential in small quantities to normal metabolism
overall,"n. (usually plural) work clothing consisting of denim trousers (usually with a bib and shoulder straps)
n. a loose protective coverall or smock worn over ordinary clothing for dirty work
s. involving only main features
s. including everything"
pessimistic,a. expecting the worst possible outcome
evidence,"n. your basis for belief or disbelief; knowledge on which to base belief
n. an indication that makes something evident
n. (law) all the means by which any alleged matter of fact whose truth is investigated at judicial trial is established or disproved"
scorn,"n lack of respect accompanied by a feeling of intense dislike
n open disrespect for a person or thing
v look down on with disdain
v reject with contempt"
consciousness,n. an alert cognitive state in which you are aware of yourself and your situation
accumulating,"v get or gather together
v collect or gather"
constantly,"r. without variation or change, in every case
r. without interruption"
evolution,n. (biology) the sequence of events involved in the evolutionary development of a species or taxonomic group of organisms
smiley,n. an emoticon of a smiling face
psychology,n. the science of mental life
password,n. a secret word or phrase known only to a restricted group
typical,"a. exhibiting the qualities or characteristics that identify a group or kind or category
s. conforming to a type"
dozens of,none
account,"n. a formal contractual relationship established to provide for regular banking or brokerage or business services
n. importance or value
n. a statement of recent transactions and the resulting balance
n. the quality of taking advantage"
incredibly,r. not easy to believe
complicated,s. difficult to analyze or understand
mix,"n. a commercially prepared mixture of dry ingredients
n. an event that combines things in a mixture
n. the act of mixing together
v. combine (electronic signals)"
symbol,"n. an arbitrary sign (written or printed) that has acquired a conventional significance
n. something visible that by association or convention represents something else that is invisible"
outdated,s. old; no longer valid or fashionable
netizen,none
online,"a on a regular route of a railroad or bus or airline system
a connected to a computer network or accessible by computer
s being in progress now"
capital,"n. assets available for use in the production of further assets
n. wealth in the form of money or property owned by a person or business and human resources of economic value
n. a seat of government
n. one of the large alphabetic characters used as the first letter in writing or printing proper names and sometimes for emphasis; capitals were kept in the upper half of the type case and so became known as upper-case letters"""
stuff,"n. miscellaneous unspecified objects
n. informal terms for personal possessions
n. senseless talk
n. unspecified qualities required to do or be something"
financial,a involving financial matters
hacker,"n. someone who plays golf poorly
n. a programmer who breaks into computer systems in order to steal or change or destroy information as a form of cyber-terrorism
n. a programmer for whom computing is its own reward; may enjoy the challenge of breaking into other computers but does no harm"
frequently,r. many times at short intervals
expose,"n. the exposure of an impostor or a fraud
v. expose or make accessible to some action or influence
v. to show, make visible or apparent
v. expose to light, of photographic film"
attack,"n. (military) an offensive against an enemy (using weapons)
n. an offensive move in a sport or game
n. the act of attacking
n. a decisive manner of beginning a musical tone or phrase"
hack,"n. one who works hard at boring tasks
n. a mediocre and disdained writer
n. a tool (as a hoe or pick or mattock) used for breaking up the surface of the soil
n. an old or over-worked horse"
assume,"v. take to be the case or to be true; accept without verification or proof
v. take on titles, offices, duties, responsibilities
v. take on a certain form, attribute, or aspect
v. occupy or take on"
broken,"a. physically and forcibly separated into pieces or cracked or split
a. not continuous in space, time, or sequence or varying abruptly
s. subdued or brought low in condition or status
a. (especially of promises or contracts) having been violated or disregarded"
fingerprint,"n. a print made by an impression of the ridges in the skin of a finger; often used for biometric identification in criminal investigations
n. a generic term for any identifying characteristic
v. take an impression of a person's fingerprints"
hardware,"n. major items of military weaponry (as tanks or missile)
n. instrumentalities (tools or implements) made of metal
n. (computer science) the mechanical, magnetic, electronic, and electrical components making up a computer system"
token,"n. an individual instance of a type of symbol
n. something serving as a sign of something else
n. a metal or plastic disk that can be redeemed or used in designated slot machines"
security,"n. the state of being free from danger or injury
n. defense against financial failure; financial independence
n. freedom from anxiety or fear
n. a formal declaration that documents a fact of relevance to finance and investment; the holder has a right to receive interest or dividends"
attempt,n. earnest and conscientious activity intended to do or accomplish something
reader,"n. a person who enjoys reading
n. a person who can read; a literate person
n. one of a series of texts for students learning to read"
creepy,"s. annoying and unpleasant
s. causing a sensation as of things crawling on your skin"
approach,"n. ideas or actions intended to deal with a problem or situation
n. the act of drawing spatially closer to something
n. the event of one object coming closer to another
n. the temporal property of becoming nearer in time"
consultancy,n. the practice of giving expert advice within a particular field
veteran,"n. a serviceman who has seen considerable active service
n. a person who has served in the armed forces
n. an experienced person who has been through many battles; someone who has given long service"
obscure,"v. make less visible or unclear
v. make obscure or unclear
v. reduce a vowel to a neutral one, such as a schwa
v. make undecipherable or imperceptible by obscuring or concealing"
invent,"v. come up with (an idea, plan, explanation, theory, or principle) after a mental effort"
flat,"n. a level tract of land
n. a shallow box in which seedlings are started
n. a musical notation indicating one half step lower than the note named
n. a deflated pneumatic tire"
blank,"n. a piece of material ready to be made into something
n. a cartridge containing an explosive charge but no bullet
v. keep the opposing (baseball) team from winning
s. (of a surface) not written or printed on"
original,"n. something that serves as a model or a basis for making copies
s. preceding all others in time or being as first made or performed
s. (of e.g. information) not secondhand or by way of something intermediary
a. being or productive of something fresh and unusual; or being as first made or thought of"
evaluate,v. form a critical opinion of
enable,v. render capable or able for some task
keyword,none
concept,n. an abstract or general idea inferred or derived from specific instances
simplify,v. make simpler or easier or reduce in complexity or extent
technological,s. based in scientific and industrial progress
plus,"a. on the positive side or higher end of a scale
s. involving advantage or good"
additional,s further or added
ultimate,"n. the finest or most superior quality of its kind
a. furthest or highest in degree or order; utmost or extreme
s. being the last or concluding element of a series"
device,"n. an instrumentality invented for a particular purpose
n. something in an artistic work designed to achieve a particular effect
n. any clever maneuver
n. any ornamental pattern or design (as in embroidery)"
text-message,none
gadget,n a device or control that is very useful for a particular job
connectedness,"n the state of being connected
n a relation between things or events (as in the case of one causing the other or sharing features with it)"
respond,v. respond favorably or as hoped
on the go,none
fascinating,"v cause to be interested or curious
v to render motionless, as with a fixed stare or by arousing terror or awe
v attract; cause to be enamored
s capable of arousing and holding the attention
s capturing interest as if by a spell"
observe,"v. watch attentively
v. behave as expected during of holidays or rites
v. stick to correctly or closely
v. conform one's action or practice to"
portrait,"n. any likeness of a person, in any medium"
redefine,"v. give a new or different definition to
v. give a new or different definition of (a word)"
intimacy,"n close or warm friendship
n a usually secretive or illicit sexual relationship
n a feeling of being intimate and belonging together"
warn,"v. notify of danger, potential harm, or risk
v. admonish or counsel in terms of someone's behavior
v. ask to go away
v. notify, usually in advance"
virtual,"s. being actually such in almost every respect
s. existing in essence or effect though not in actual fact"
perception,"n. a way of conceiving something
n. the process of perceiving
n. knowledge gained by perceiving"
solitude,"n. a state of social isolation
n. the state or situation of being alone
n. a solitary place"
