giant,"n. any creature of exceptional size
n. an unusually large enterprise
n. a very large person; impressive in size or qualities
n. someone or something that is abnormally large and powerful"
beef up,none
badly,"r. to a severe or serious degree
r. evilly or wickedly
r. in a disobedient or naughty way
r. with great intensity (`bad' is a nonstandard variant for `badly')"
dismiss,"v. bar from attention or consideration
v. cease to consider; put out of judicial consideration
v. stop associating with
v. end one's encounter with somebody by causing or permitting the person to leave"
fade,"n. gradually ceasing to be visible
v. become less clearly visible or distinguishable; disappear gradually or seemingly
v. lose freshness, vigor, or vitality"
nuts,"n usually large hard-shelled seed
n Egyptian goddess of the sky
n a small (usually square or hexagonal) metal block with internal screw thread to be fitted onto a bolt
n half the width of an em
n a whimsically eccentric person
n someone who is so ardently devoted to something that it resembles an addiction
n one of the two male reproductive glands that produce spermatozoa and secrete androgens
v gather nuts
s informal or slang terms for mentally irregular"
assume,"v. take to be the case or to be true; accept without verification or proof
v. take on titles, offices, duties, responsibilities
v. take on a certain form, attribute, or aspect
v. occupy or take on"
discipline,"n. a branch of knowledge
n. a system of rules of conduct or method of practice; 
n. the trait of being well behaved
n. training to improve strength or self-control"
filter,"n. device that removes something from whatever passes through it
n. an electrical device that alters the frequency spectrum of signals passing through it
v. remove by passing through a filter"
arrangement,"n. an orderly grouping (of things or persons) considered as a unit; the result of arranging
n. an organized structure for arranging or classifying
n. the act of arranging and adapting a piece of music"
address,"n. (computer science) the code that identifies where a piece of information is stored
n. the place where a person or organization can be found or communicated with
n. the act of delivering a formal spoken communication to an audience
n. the manner of speaking to another individual"
red ink,v mark with red ink
straight,"n. a poker hand with 5 consecutive cards (regardless of suit)
s. successive (without a break)
a. having no deviations
a. (of hair) having no waves or curls"
squeeze,"n. the act of gripping and pressing firmly
n. a situation in which increased costs cannot be passed on to the customer
n. (slang) a person's girlfriend or boyfriend
n. a twisting squeeze"
measure,"n. any maneuver made as part of progress toward a goal
n. how much there is or how many there are of something that you can quantify
n. musical notation for a repeating pattern of musical beats
n. a container of some standard capacity that is used to obtain fixed amounts of a substance"
bare,"v. lay bare
s. completely unclothed
s. lacking in amplitude or quantity
a. lacking its natural or customary covering"
twin,"n. either of two offspring born at the same time from the same pregnancy
n. a waterfall in the Snake River in southern Idaho
v. duplicate or match
v. grow as twins"
house,"n. a dwelling that serves as living quarters for one or more families
n. the members of a religious community living together
n. the audience gathered together in a theatre or cinema
n. an official assembly having legislative powers"
wing,"n. a movable organ for flying (one of a pair)
n. one of the horizontal airfoils on either side of the fuselage of an airplane
n. a stage area out of sight of the audience
n. a unit of military aircraft"
story,n. a piece of fiction that narrates a chain of related events
emerge,"v. come out into view, as from concealment
v. become known or apparent
v. come up to the surface of or rise"
secretary,"n. a person who is head of an administrative department of government
n. an assistant who handles correspondence and clerical work for a boss or an organization
n. a desk used for writing"
cast,"n. the actors in a play
n. the distinctive form in which a thing is made
n. bandage consisting of a firm covering (often made of plaster of Paris) that immobilizes broken bones while they heal
n. object formed by a mold"
monumental,"a. relating or belonging to or serving as a monument
s. of outstanding significance"
cap,"n. a tight-fitting headdress
n. a top (as for a bottle)
n. something serving as a cover or protection
n. a fruiting structure resembling an umbrella or a cone that forms the top of a stalked fleshy fungus such as a mushroom"
yet,"r. up to the present time
r. within an indefinite time or at an unspecified future time"
company,"n. an institution created to conduct business
n. small military unit; usually two or three platoons
n. the state of being with someone
n. organization of performers and associated personnel (especially theatrical)"
attachment,"n. a feeling of affection for a person or an institution
n. a supplementary part or accessory
n. a writ authorizing the seizure of property that may be needed for the payment of a judgment in a judicial proceeding"
drag,"n. the phenomenon of resistance to motion through a fluid
n. something that slows or delays progress
n. something tedious and boring
n. clothing that is conventionally worn by the opposite sex (especially women's clothing when worn by a man)"
check,"n. a written order directing a bank to pay money
n. the bill in a restaurant
n. the act of inspecting or verifying
n. a mark left after a small piece has been chopped or broken off of something"
crash,"n. a serious accident (usually involving one or more vehicles)
n. a sudden large decline of business or the prices of stocks (especially one that causes additional failures)
n. the act of colliding with something
n. (computer science) an event that causes a computer system to become inoperative"
divert,"v. send on a course or in a direction different from the planned or intended one
v. withdraw (money) and move into a different location, often secretly and with dishonest intentions"
down,"n. soft fine feathers
n. (American football) a complete play to advance the football
n. English physician who first described Down's syndrome (1828-1896)
n. (usually plural) a rolling treeless highland with little soil"
finance,"n. the commercial activity of providing funds and capital
n. the branch of economics that studies the management of money and other assets
n. the management of money and credit and banking and investments
v. obtain or provide money for"
process,"n. (psychology) the performance of some composite cognitive activity; an operation that affects mental contents
n. a mental process that you are not directly aware of
n. a natural prolongation or projection from a part of an organism either animal or plant
n. a sustained phenomenon or one marked by gradual changes through a series of states"
public,"n. a body of people sharing some common interest
a. not private; open to or concerning the people as a whole
s. affecting the people or community as a whole"
screen,"n. a white or silvered surface where pictures can be projected for viewing
n. the display that is electronically created on the surface of the large end of a cathode-ray tube
n. a covering that serves to conceal or shelter something
n. a protective covering consisting of netting; can be mounted in a frame"
steep,"n. a steep place (as on a hill)
v. devote (oneself) fully to
v. let sit in a liquid to extract a flavor or to cleanse
a. having a sharp inclination"
calling,"n the particular occupation for which you are trained
v assign a specified (usually proper) proper name to
v ascribe a quality to or give a name of a common noun that reflects a quality
v get or try to get into communication (with someone) by telephone
v utter a sudden loud cry
v order, request, or command to come
v pay a brief visit
v call a meeting; invite or command to meet
v read aloud to check for omissions or absentees
v send a message or attempt to reach someone by radio, phone, etc.; make a signal to in order to transmit a message
v utter a characteristic note or cry
v stop or postpone because of adverse conditions, such as bad weather
v greet, as with a prescribed form, title, or name
v make a stop in a harbour
v demand payment of (a loan)
v make a demand, as for a card or a suit or a show of hands
v give the calls (to the dancers) for a square dance
v indicate a decision in regard to
v make a prediction about; tell in advance
v require the presentation of for redemption before maturation
v challenge (somebody) to make good on a statement; charge with or censure for an offense
v declare in the capacity of an umpire or referee
v lure by imitating the characteristic call of an animal
v order or request or give a command for
v order, summon, or request for a specific duty or activity, work, role
v utter in a loud voice or announce
v challenge the sincerity or truthfulness of
v consider or regard as being
v rouse somebody from sleep with a call"
dawn,"n. the first light of day
n. the earliest period
n. an opening time period
v. appear or develop"
occupation,"n. the principal activity in your life that you do to earn money
n. the control of a country by military forces of a foreign power
n. any activity that occupies a person's attention
n. the act of occupying or taking possession of a building"
promise,"n. a verbal commitment by one person to another agreeing to do (or not to do) something in the future
n. grounds for feeling hopeful about the future
v. make a promise or commitment
v. promise to undertake or give"
vocal,"a. relating to or designed for or using the singing voice
a. having or using the power to produce speech or sound
s. full of the sound of voices"
case,"n. an occurrence of something
n. the actual state of things
n. a portable container for carrying several objects
n. a person requiring professional services"
crash,"n. a serious accident (usually involving one or more vehicles)
n. a sudden large decline of business or the prices of stocks (especially one that causes additional failures)
n. the act of colliding with something
n. (computer science) an event that causes a computer system to become inoperative"
engagement,"n. employment for performers or performing groups that lasts for a limited period of time
n. contact by fitting together
n. the act of sharing in the activities of a group"
record,"n. anything (such as a document or a phonograph record or a photograph) providing permanent evidence of or information about past events
n. the number of wins versus losses and ties a team has had
n. the sum of recognized accomplishments
n. a compilation of the known facts regarding something or someone"
rounded,a. curving and somewhat round in shape rather than jagged
sharp,"n. a musical notation indicating one half step higher than the note named
n. a long thin sewing needle with a sharp point
s. harsh
a. keenly and painfully felt; as if caused by a sharp edge or point"
translate,"v. restate (words) from one language into another language
v. change from one form or medium into another
v. bring to a certain spiritual state
v. change the position of (figures or bodies) in space without rotation"
campaign,"n. a series of actions advancing a principle or tending toward a particular end
n. several related operations aimed at achieving a particular goal (usually within geographical and temporal constraints)
n. an overland journey by hunters (especially in Africa)
v. run, stand, or compete for an office or a position"
connection,"n. a relation between things or events (as in the case of one causing the other or sharing features with it)
n. the state of being connected
n. an instrumentality that connects
n. (usually plural) a person who is influential and to whom you are connected in some way (as by family or friendship)"
fan,"n. a device for creating a current of air by movement of a surface or surfaces
n. an ardent follower and admirer
v. strike out (a batter), (of a pitcher)
v. make (an emotion) fiercer"
favor,"n. an act of gracious kindness
n. an advantage to the benefit of someone or something
n. an inclination to approve"
find,"v. come upon, as if by accident; meet with
v. come upon after searching; find the location of something that was missed or lost
v. come to believe on the basis of emotion, intuitions, or indefinite grounds
v. obtain through effort or management"
inspire,"v. heighten or intensify
v. supply the inspiration for"
justice,"n. the quality of being just or fair
n. judgment involved in the determination of rights and the assignment of rewards and punishments"
official,"n. a worker who holds or is invested with an office
n. someone who administers the rules of a game or sport
a. having official authority or sanction
a. of or relating to an office"
pressure,"n. the force applied to a unit area of surface; measured in pascals (SI unit) or in dynes (cgs unit)
n. a force that compels
n. the somatic sensation that results from applying force to an area of skin
n. an oppressive condition of physical or mental or social or economic distress"
capture,"n. the act of forcibly dispossessing an owner of property
n. a process whereby a star or planet holds an object in its gravitational field
n. any process in which an atomic or nuclear system acquires an additional particle
n. the act of taking of a person by force"
craft,"n. a vehicle designed for navigation in or on water or air or through outer space
n. people who perform a particular kind of skilled work
n. skill in an occupation or trade
n. shrewdness as demonstrated by being skilled in deception"
earn,v. acquire or deserve by one's efforts or actions
figure,"n. a diagram or picture illustrating textual material
n. a model of a bodily form (especially of a person)
n. a combination of points and lines and planes that form a visible palpable shape
n. an amount of money expressed numerically"
hero,"n. a man distinguished by exceptional courage and nobility and strength
n. the principal character in a play or movie or novel or poem
n. Greek mathematician and inventor who devised a way to determine the area of a triangle and who described various mechanical devices (first century)
n. (classical mythology) a being of great strength and courage celebrated for bold exploits; often the offspring of a mortal and a god"
letter,"n. a written message addressed to a person or organization
n. the conventional characters of the alphabet used to represent speech
n. owner who lets another person use something (housing usually) for hire
n. a strictly literal interpretation (as distinct from the intention)"
modest,"a. marked by simplicity; having a humble opinion of yourself
s. not large but sufficient in size or amount
s. free from pomp or affectation
a. not offensive to sexual mores in conduct or appearance"
obscure,"v. make less visible or unclear
v. make obscure or unclear
v. reduce a vowel to a neutral one, such as a schwa
v. make undecipherable or imperceptible by obscuring or concealing"
respectable,a. characterized by socially or conventionally acceptable morals
runaway,"n. an easy victory
s. completely out of control"
sketch,"n. preliminary drawing for later elaboration
n. a brief literary description
n. short descriptive summary (of events)
v. make a sketch of"
alongside,r side by side
graduate,"n. a measuring instrument for measuring fluid volume; a glass container (cup or cylinder or flask) whose sides are marked with or divided into amounts
v. receive an academic degree upon completion of one's studies
v. confer an academic degree upon
s. of or relating to studies beyond a bachelor's degree"
identify,"v. recognize as being; establish the identity of someone or something
v. consider (oneself) as similar to somebody else
v. conceive of as united or associated
v. identify as in botany or biology, for example"
interest,"n. a sense of concern with and curiosity about someone or something
n. the power of attracting or holding one's attention (because it is unusual or exciting etc.)
n. a fixed charge for borrowing money; usually a percentage of the amount borrowed
n. (law) a right or legal share of something; a financial involvement with something"
meet,"n. a meeting at which a number of athletic contests are held
v. come together
v. get together socially or for a specific purpose
v. fill or meet a want or need"
present,"n. the period of time that is happening now; any continuous stretch of time including the moment of speech
n. something presented as a gift
n. a verb tense that expresses actions or states at the time of speaking
v. bring forward and present to the mind"
colorful,"a. having striking color
a. striking in variety and interest"
union,"n. an organization of employees formed to bargain with the employer
n. the United States (especially the northern states during the American Civil War)
n. the state of being joined or united or linked
n. healing process involving the growing together of the edges of a wound or the growing together of broken bones"
diet,"n. a prescribed selection of foods
n. a legislative assembly in certain countries (e.g., Japan)
n. the usual food and drink consumed by an organism (person or animal)
n. the act of restricting your food intake (or your intake of particular foods)"
address,"n. (computer science) the code that identifies where a piece of information is stored
n. the place where a person or organization can be found or communicated with
n. the act of delivering a formal spoken communication to an audience
n. the manner of speaking to another individual"
charter,"n. a document incorporating an institution and specifying its rights; includes the articles of incorporation and the certificate of incorporation
n. a contract to hire or lease transportation
v. grant a charter to"
fine,"n. money extracted as a penalty
s. minutely precise especially in differences in meaning
s. thin in thickness or diameter
s. characterized by elegance or refinement or accomplishment"
mass,"n. the property of a body that causes it to have weight in a gravitational field
n. an ill-structured collection of similar things (objects or people)
n. (Roman Catholic Church and Protestant Churches) the celebration of the Eucharist
n. a body of matter without definite shape"
alongside,r side by side
corrupt,"v. corrupt morally or by intemperance or sensuality
v. alter from the original
a. lacking in integrity
s. containing errors or alterations"
identify,"v. recognize as being; establish the identity of someone or something
v. consider (oneself) as similar to somebody else
v. conceive of as united or associated
v. identify as in botany or biology, for example"
pressure,"n. the force applied to a unit area of surface; measured in pascals (SI unit) or in dynes (cgs unit)
n. a force that compels
n. the somatic sensation that results from applying force to an area of skin
n. an oppressive condition of physical or mental or social or economic distress"
sentiment,"n. tender, romantic, or nostalgic feeling or emotion"
consideration,"n. the process of giving careful thought to something
n. a discussion of a topic (as in a meeting)
n. kind and considerate regard for others
n. a considerate and thoughtful act"
aggressive,"a. having or showing determination and energetic pursuit of your ends; positive in his convictions""
s. tending to spread quickly
s. characteristic of an enemy or one eager to fight"
aside,"n. a line spoken by an actor to the audience but not intended for others on the stage
r. on or to one side
r. out of the way (especially away from one's thoughts)
r. placed or kept separate and distinct as for a purpose"
dwarf,"n. a person who is markedly small
n. a plant or animal that is atypically small
v. check the growth of"
overhead,"n. (nautical) the top surface of an enclosed space on a ship
n. a hard return hitting the tennis ball above your head
a. located or originating from above
r. above your head; in the sky"
physical,"a. involving the body as distinguished from the mind or spirit
a. relating to the sciences dealing with matter and energy; especially physics
s. having substance or material existence; perceptible to the senses
s. according with material things or natural laws (other than those peculiar to living matter)"
upset,"n. the act of disturbing the mind or body
n. a tool used to thicken or spread metal (the end of a bar or a rivet etc.) by forging or hammering or swaging
n. the act of upsetting something
v. disturb the balance or stability of"
enlist,"v. join the military
v. engage somebody to enter the army"
navigate,"v. act as the navigator in a car, plane, or vessel and plan, direct, plot the path and position of the conveyance
v. direct carefully and safely"
point,"n. a geometric element that has position but no extension
n. the precise location of something; a spatially limited location
n. a brief version of the essential meaning of something
n. an instant of time"
setting,"n. the context and environment in which something is set
n. the state of the environment in which a situation exists
n. the physical position of something"
stuck,"a. caught or fixed
s. baffled"
mend,"n. sewing that repairs a worn or torn hole (especially in a garment)
v. heal or recover"
perfectly,r. in a perfect or faultless way
perspective,n. the appearance of things relative to one another as determined by their distance from the viewer
see,"n. the seat within a bishop's diocese where his cathedral is located
v. perceive by sight or have the power to perceive by sight
v. deem to be
v. be careful or certain to do something; make certain of something"
extraction,"n. the process of obtaining something from a mixture or compound by chemical or physical or mechanical means
n. the action of taking out something (especially using effort or force)"
functional,"a. designed for or capable of a particular function or use
a. involving or affecting function rather than physiology
a. relating to or based on function especially as opposed to structure; it is a functional one""
s. fit or ready for use or service"
subject,"n. the subject matter of a conversation or discussion
n. something (a person or object or scene) selected by an artist or photographer for graphic representation
n. (grammar) one of the two main constituents of a sentence; the grammatical constituent about which something is predicated
n. a person who is subjected to experimental or other observational procedures; someone who is an object of investigation"
indefensible,"s. (of theories etc) incapable of being defended or justified
s. not able to be protected against attack
s. incapable of being justified or explained"
novel,"n. an extended fictional work in prose; usually in the form of a story
n. a printed and bound book that is an extended work of fiction
s. pleasantly new or different"
swallow,"n. a small amount of liquid food
n. the act of swallowing
n. small long-winged songbird noted for swift graceful flight and the regularity of its migrations
v. pass through the esophagus as part of eating or drinking"
upset,"n. the act of disturbing the mind or body
n. a tool used to thicken or spread metal (the end of a bar or a rivet etc.) by forging or hammering or swaging
n. the act of upsetting something
v. disturb the balance or stability of"
drive,"n. the act of applying force to propel something
n. a mechanism by which force or power is transmitted in a machine
n. the trait of being highly motivated
n. hitting a golf ball off of a tee with a driver"
editorial,"a. of or relating to an article stating opinions or giving perspectives
a. relating to or characteristic of an editor"
literate,"n. a person who can read and write
a. able to read and write
a. versed in literature; dealing with literature
s. knowledgeable and educated in one or several fields"
model,"n. a hypothetical description of a complex entity or process
n. a type of product
n. a person who poses for a photographer or painter or sculptor
n. representation of something (sometimes on a smaller scale)"
panel,"n. sheet that forms a distinct (usually flat and rectangular) section or component of something
n. (law) a group of people summoned for jury service (from whom a jury will be chosen)
n. a group of people gathered for a special purpose as to plan or discuss an issue or judge a contest etc
n. a soft pad placed under a saddle"
screen,"n. a white or silvered surface where pictures can be projected for viewing
n. the display that is electronically created on the surface of the large end of a cathode-ray tube
n. a covering that serves to conceal or shelter something
n. a protective covering consisting of netting; can be mounted in a frame"
absence,"n. the state of being absent
n. failure to be present
n. the time interval during which something or somebody is away
n. the occurrence of an abrupt, transient loss or impairment of consciousness (which is not subsequently remembered), sometimes with light twitching, fluttering eyelids, etc.; common in petit mal epilepsy"
betray,"v. reveal unintentionally
v. deliver to an enemy by treachery"
circulation,"n. the dissemination of copies of periodicals (as newspapers or magazines)
n. movement through a circuit; especially the movement of blood through the heart and blood vessels
n. (library science) the count of books that are loaned by a library over a specified period
n. number of copies of a newspaper or magazine that are sold"
wound,"n. an injury to living tissue (especially an injury involving a cut or break in the skin)
n. a casualty to military personnel resulting from combat
n. a figurative injury (to your feelings or pride)
n. the act of inflicting a wound"
