state,"n. the territory occupied by one of the constituent administrative districts of a nation
n. the way something is with respect to its main attributes
n. the group of people comprising the government of a sovereign state
n. a politically organized body of people under a single government"
contract,"n. a binding agreement between two or more persons that is enforceable by law
n. (contract bridge) the highest bid becomes the contract setting the number of tricks that the bidder must make
n. a variety of bridge in which the bidder receives points toward game only for the number of tricks he bid
v. enter into a contractual arrangement"
suggest,"v. imply as a possibility
v. call to mind"
air,"n. a mixture of gases (especially oxygen) required for breathing; the stuff that the wind consists of
n. the region above the ground
n. a distinctive but intangible quality surrounding a person or thing
n. once thought to be one of four elements composing the universe (Empedocles)"
institution,"n. an organization founded and united for a specific purpose
n. an establishment consisting of a building or complex of buildings where an organization for the promotion of some cause is situated
n. a custom that for a long time has been an important feature of some group or society"
straight,"n. a poker hand with 5 consecutive cards (regardless of suit)
s. successive (without a break)
a. having no deviations
a. (of hair) having no waves or curls"
broadcast,"n. message that is transmitted by radio or television
n. a radio or television show
v. sow over a wide area, especially by hand"
board,"n. a committee having supervisory powers
n. a stout length of sawn timber; made in a wide variety of sizes and used for many purposes
n. a flat piece of material designed for a special purpose
n. food or meals in general"
cloud,"n. any collection of particles (e.g., smoke or dust) or gases that is visible
n. a visible mass of water or ice particles suspended at a considerable altitude
n. out of touch with reality
n. a cause of worry or gloom or trouble"
turnover,n. a dish made by folding a piece of pastry over a filling
sitting,"n. (photography) the act of assuming a certain position (as for a photograph or portrait)
n. the act of assuming or maintaining a seated position
n. a session as of a legislature or court"
approach,"n. ideas or actions intended to deal with a problem or situation
n. the act of drawing spatially closer to something
n. the event of one object coming closer to another
n. the temporal property of becoming nearer in time"
traffic,"n. the aggregation of things (pedestrians or vehicles) coming and going in a particular locality during a specified period of time
n. buying and selling; especially illicit trade
n. the amount of activity over a communication system during a given period of time
v. deal illegally"
voice,"n. the distinctive quality or pitch or condition of a person's speech
n. the sound made by the vibration of vocal folds modified by the resonance of the vocal tract
n. a sound suggestive of a vocal utterance
n. a means or agency by which something is expressed or communicated"
fulfill,"v put in effect
v meet the requirements or expectations of
v fill or meet a want or need"
feature,"n. a prominent attribute or aspect of something
n. the characteristic parts of a person's face: eyes and nose and mouth and chin
n. the principal (full-length) film in a program at a movie theater
n. a special or prominent article in a newspaper or magazine"
celebrate,v. have a celebration
humanity,n. the quality of being humane
discipline,"n. a branch of knowledge
n. a system of rules of conduct or method of practice; 
n. the trait of being well behaved
n. training to improve strength or self-control"
post,"n. the position where someone (as a guard or sentry) stands or is assigned to stand
n. an upright consisting of a piece of timber or metal fixed firmly in an upright position
n. United States aviator who in 1933 made the first solo flight around the world (1899-1935)
n. United States female author who wrote a book and a syndicated newspaper column on etiquette (1872-1960)"
grant,"n. any monetary aid
n. the act of providing a subsidy
n. (law) a transfer of property by deed of conveyance
n. Scottish painter; cousin of Lytton Strachey and member of the Bloomsbury Group (1885-1978)"
academic,"a. associated with academia or an academy
s. hypothetical or theoretical and not expected to produce an immediate or practical result
s. marked by a narrow focus on or display of learning especially its trivial aspects"
prospect,"n. the possibility of future success
v. search for something desirable
v. explore for useful or valuable things or substances, such as minerals"
plateau,n a relatively flat highland
scope,"n. an area in which something acts or operates or has power or control: ""the range of a supersonic jet"""
about,"s. on the move
r. all around or on all sides
r. in the area or vicinity
r. used of movement to or among many different places or in no particular direction"
casual,"s. marked by blithe unconcern
s. without or seeming to be without plan or method; offhand
s. appropriate for ordinary or routine occasions
s. occurring or appearing or singled out by chance"
elaborate,"v. add details, as to an account or idea; clarify the meaning of and discourse in a learned way, usually in writing
v. produce from basic elements or sources; change into a more developed product
v. work out in detail
s. marked by complexity and richness of detail"
foremost,"s. preceding all others in spatial position
s. situated closest to the bow
r. prominently forward"
stylist,n. an artist who is a master of a particular style
knight,"n. originally a person of noble birth trained to arms and chivalry; today in Great Britain a person honored by the sovereign for personal merit
n. a chessman shaped to resemble the head of a horse; can move two squares horizontally and one vertically (or vice versa)
v. raise (someone) to knighthood"
save,"n. (sports) the act of preventing the opposition from scoring
v. to keep up and reserve for personal or special use
v. bring into safety
v. spend less; buy at a reduced price"
move,"n. the act of deciding to do something
n. the act of changing your residence or place of business
n. (game) a player's turn to take some action permitted by the rules of the game
v. cause to move or shift into a new position or place, both in a concrete and in an abstract sense"
dismiss,"v. bar from attention or consideration
v. cease to consider; put out of judicial consideration
v. stop associating with
v. end one's encounter with somebody by causing or permitting the person to leave"
claim,"n. an assertion of a right (as to money or property)
n. an assertion that something is true or factual
n. demand for something as rightful or due
n. an informal right to something"
pool,"n. an excavation that is (usually) filled with water
n. an organization of people or resources that can be shared
n. any communal combination of funds
n. a small body of standing water (rainwater) or other liquid"
explosion,"n. a violent release of energy caused by a chemical or nuclear reaction
n. the act of exploding or bursting
n. a sudden great increase
n. the noise caused by an explosion"
issue,"n. an important question that is in dispute and must be settled
n. one of a series published periodically
n. the act of providing an item for general use or for official purposes (usually in quantity)
n. supplies (as food or clothing or ammunition) issued by the government"
practice,"n. a customary way of operation or behavior
n. translating an idea into action
n. the exercise of a profession
n. knowledge of how something is usually done"
hear,"v. perceive (sound) via the auditory sense
v. examine or hear (evidence or a case) by judicial process
v. receive a communication from someone"
signal,"n. any nonverbal action or gesture that encodes a message
n. any incitement to action
n. an electric quantity (voltage or current or field strength) whose modulation represents coded information about the source from which it comes
s. notably out of the ordinary"
obvious,a. easily perceived by the senses or grasped by the mind
supposed,"s. required or under orders
s. mistakenly believed"
embrace,"n. the act of clasping another person in the arms (as in greeting or affection)
n. the state of taking in or encircling
n. a close affectionate and protective acceptance
v. include in scope; include as part of something broader; have as one's sphere or territory"
variable,"n. something that is likely to vary; something that is subject to variation
n. a quantity that can assume any of a set of values
n. a symbol (like x or y) that is used in mathematical or logical expressions to represent a variable quantity
a. liable to or capable of change"
fetch,"n. the action of fetching
v. be sold for a certain price
v. take away or remove"
compromise,"n. a middle way between two extremes
n. an accommodation in which both sides make concessions
v. make a compromise; arrive at a compromise; we all must compromise""
v. settle by concession"
carry,"n. the act of carrying something
v. have with oneself; have on one's person
v. serve as a means for expressing something
v. bear or be able to bear the weight, pressure,or responsibility of"
cry,"n. a loud utterance; often in protest or opposition
n. a loud utterance of emotion (especially when inarticulate)
n. a fit of weeping
n. the characteristic utterance of an animal"
book,"n. a written work or composition that has been published (printed on pages bound together)
n. physical objects consisting of a number of pages bound together
n. a collection of playing cards satisfying the rules of a card game
n. a collection of rules or prescribed standards on the basis of which decisions are made"
hostility,"n. a hostile (very unfriendly) disposition
n. a state of deep-seated ill-will
n. the feeling of a hostile person"
invite,"n. a colloquial expression for invitation
v. increase the likelihood of
v. invite someone to one's house
v. ask someone in a friendly way to do something"
approach,"n. ideas or actions intended to deal with a problem or situation
n. the act of drawing spatially closer to something
n. the event of one object coming closer to another
n. the temporal property of becoming nearer in time"
range,"n. the limits within which something can be effective
n. a large tract of grassy open land on which livestock can graze
n. a series of hills or mountains
n. a place for shooting (firing or driving) projectiles of various kinds"
mask,"n. a covering to disguise or conceal the face
n. activity that tries to conceal something
n. a protective covering worn over the face
v. put a mask on or cover with a mask"
come,"v. move toward, travel toward something or somebody or approach something or somebody
v. come to pass; arrive, as in due course
v. reach or enter a state, relation, condition, use, or position
v. to be the product or result"
stand,"n. the position where a thing or person stands
n. a growth of similar plants (usually trees) in a particular area
n. a small table for holding articles of various kinds
n. an interruption of normal activity"
invent,"v. come up with (an idea, plan, explanation, theory, or principle) after a mental effort"
account,"n. a formal contractual relationship established to provide for regular banking or brokerage or business services
n. importance or value
n. a statement of recent transactions and the resulting balance
n. the quality of taking advantage"
point,"n. a geometric element that has position but no extension
n. the precise location of something; a spatially limited location
n. a brief version of the essential meaning of something
n. an instant of time"
game,"n. a contest with rules to determine a winner
n. a single play of a sport or other contest
n. an amusement or pastime
n. animal hunted for food or sport"
twist,"n. a jerky pulling movement
n. social dancing in which couples vigorously twist their hips and arms in time to the music; was popular in the 1960s
n. turning or twisting around (in place)
v. turn in the opposite direction"
drive,"n. the act of applying force to propel something
n. a mechanism by which force or power is transmitted in a machine
n. the trait of being highly motivated
n. hitting a golf ball off of a tee with a driver"
determine,"v. establish after a calculation, investigation, experiment, survey, or study
v. shape or influence; give direction to
v. fix conclusively or authoritatively
v. fix in scope; fix the boundaries of"
name,"n. a language unit by which a person or thing is known
n. a person's reputation
n. family based on male descent
n. a well-known or notable person"
bachelor,"n. a man who has never been married
v. lead a bachelor's existence"
equip,"v. provide with (something) usually for a specific purpose
v. provide with abilities or understanding"
gift,n. something acquired without compensation
principal,"n. the original amount of a debt on which interest is calculated
n. the educator who has executive authority for a school
n. capital as contrasted with the income derived from it
n. (criminal law) any person involved in a criminal offense, regardless of whether the person profits from such involvement"
underline,v. draw a line or lines underneath to call attention to
path,"n. a way especially designed for a particular use
n. an established line of travel or access
n. a line or route along which something travels or moves"
dismiss,"v. bar from attention or consideration
v. cease to consider; put out of judicial consideration
v. stop associating with
v. end one's encounter with somebody by causing or permitting the person to leave"
quick,"n. any area of the body that is highly sensitive to pain (as the flesh underneath the skin or a fingernail or toenail)
s. accomplished rapidly and without delay
s. apprehending and responding with speed and sensitivity
s. easily aroused or excited"
picture,"n. a visual representation (of an object or scene or person or abstraction) produced on a surface
n. a situation treated as an observable object
n. illustrations used to decorate or explain a text
n. a typical example of some state or quality"
makeup,"n. cosmetics applied to the face to improve or change your appearance
n. an event that is substituted for a previously cancelled event"
address,"n. (computer science) the code that identifies where a piece of information is stored
n. the place where a person or organization can be found or communicated with
n. the act of delivering a formal spoken communication to an audience
n. the manner of speaking to another individual"
farm,"n. workplace consisting of farm buildings and cultivated land as a unit
v. be a farmer; work as a farmer
v. collect fees or profits"
combat,n. an engagement fought between two military forces
retreat,"n. (military) withdrawal of troops to a more favorable position to escape the enemy's superior forces or after a defeat
n. a place of privacy; a place affording peace and quiet
n. (military) a signal to begin a withdrawal from a dangerous position
n. (military) a bugle call signaling the lowering of the flag at sunset"
ritual,"n. any customary observance or practice
n. the prescribed procedure for conducting religious ceremonies
n. stereotyped behavior
a. of or relating to or characteristic of religious rituals"
point,"n. a geometric element that has position but no extension
n. the precise location of something; a spatially limited location
n. a brief version of the essential meaning of something
n. an instant of time"
craft,"n. a vehicle designed for navigation in or on water or air or through outer space
n. people who perform a particular kind of skilled work
n. skill in an occupation or trade
n. shrewdness as demonstrated by being skilled in deception"
move,"n. the act of deciding to do something
n. the act of changing your residence or place of business
n. (game) a player's turn to take some action permitted by the rules of the game
v. cause to move or shift into a new position or place, both in a concrete and in an abstract sense"
stick,"n. an implement consisting of a length of wood
n. a small thin branch of a tree
n. a lever used by a pilot to control the ailerons and elevators of an airplane
n. a rectangular quarter pound block of butter or margarine"
flow,"n. the motion characteristic of fluids (liquids or gases)
n. the amount of fluid that flows in a given time
n. the act of flowing or streaming; continuous progression
n. any uninterrupted stream or discharge"
institute,"n. an association organized to promote art or science or education
v. advance or set forth in court"
title,"n. a heading that names a statute or legislative bill; may give a brief summary of the matters it deals with
n. the name of a work of art or literary composition etc.
n. a general or descriptive heading for a section of a written work
n. an identifying appellation signifying status or function: e.g. `Mr.' or `General'"
avenue,"n. a line of approach
n. a wide street or thoroughfare"
capital,"n. assets available for use in the production of further assets
n. wealth in the form of money or property owned by a person or business and human resources of economic value
n. a seat of government
n. one of the large alphabetic characters used as the first letter in writing or printing proper names and sometimes for emphasis; capitals were kept in the upper half of the type case and so became known as upper-case letters"""
mass,"n. the property of a body that causes it to have weight in a gravitational field
n. an ill-structured collection of similar things (objects or people)
n. (Roman Catholic Church and Protestant Churches) the celebration of the Eucharist
n. a body of matter without definite shape"
hold,"n. power by which something or someone is affected or dominated
n. a stronghold
n. a cell in a jail or prison
v. have or hold in one's hands or grip"
explanation,"n. a statement that makes something comprehensible by describing the relevant structure or operation or circumstances etc.
n. thought that makes something comprehensible
n. the act of explaining; making something plain or intelligible"
follow,"v. to travel behind, go after, come after
v. come as a logical consequence; follow logically
v. travel along a certain course
v. come after in time, as a result"
absence,"n. the state of being absent
n. failure to be present
n. the time interval during which something or somebody is away
n. the occurrence of an abrupt, transient loss or impairment of consciousness (which is not subsequently remembered), sometimes with light twitching, fluttering eyelids, etc.; common in petit mal epilepsy"
end,"n. either extremity of something that has length
n. the point in time at which something ends
n. the concluding parts of an event or occurrence
n. a final part or section"
potential,"n. the inherent capacity for coming into being
a. existing in possibility"
demand,"n. an urgent or peremptory request
n. the ability and desire to purchase goods and services
n. the act of demanding
v. request urgently and forcefully"
throw,"n. the act of throwing (propelling something with a rapid movement of the arm and wrist)
n. a single chance or instance
n. the maximum movement available to a pivoted or reciprocating piece by a cam
n. bedclothes consisting of a lightweight cloth covering (an afghan or bedspread) that is casually thrown over something"
event,"n. something that happens at a given place and time
n. a special set of circumstances
n. a phenomenon located at a single point in space-time; the fundamental observational entity in relativity theory"
staff,"n. personnel who assist their superior in carrying out an assigned task
n. a strong rod or stick with a specialized utilitarian purpose
n. the body of teachers and administrators at a school
n. building material consisting of plaster and hair; used to cover external surfaces of temporary structure (as at an exposition) or for decoration"
lever,"n. a rigid bar pivoted about a fulcrum
n. a simple machine that gives a mechanical advantage when given a fulcrum
n. a flat metal tumbler in a lever lock"
fit,"n. a display of bad temper
n. the manner in which something fits
v. be the right size or shape; fit correctly or as desired
v. make fit"
image,"n. an iconic mental representation
n. (mathematics) the set of values of the dependent variable for which a function is defined
n. the general impression that something (a person or organization or product) presents to the public
v. render visible, as by means of MRI"
line,"n. a formation of people or things one beside another
n. a mark that is long relative to its width
n. a formation of people or things one behind another
n. a length (straight or curved) without breadth or thickness; the trace of a moving point"
shine,"v. emit light; be bright, as of the sun or a light
v. be distinguished or eminent
v. be clear and obvious
v. throw or flash the light of (a lamp)"
stress,"n. the relative prominence of a syllable or musical note (especially with regard to stress or pitch)
n. special emphasis attached to something
n. difficulty that causes worry or emotional tension
n. (physics) force that produces strain on a physical body"
state,"n. the territory occupied by one of the constituent administrative districts of a nation
n. the way something is with respect to its main attributes
n. the group of people comprising the government of a sovereign state
n. a politically organized body of people under a single government"
squeeze,"n. the act of gripping and pressing firmly
n. a situation in which increased costs cannot be passed on to the customer
n. (slang) a person's girlfriend or boyfriend
n. a twisting squeeze"
engagement,"n. employment for performers or performing groups that lasts for a limited period of time
n. contact by fitting together
n. the act of sharing in the activities of a group"
absorb,"v. become imbued
v. take up mentally
v. take up, as of debts or payments
v. take in, also metaphorically"
tablet,"n. a slab of stone or wood suitable for bearing an inscription
n. a small flat compressed cake of some substance"
verbal,"s. communicated in the form of words
a. of or relating to or formed from words in general
a. of or relating to or formed from a verb
a. relating to or having facility in the use of words"
separate,"n. a garment that can be purchased separately and worn in combinations with other garments
v. act as a barrier between; stand between
v. force, take, or pull apart
v. divide into components or constituents"
tension,"n. (psychology) a state of mental or emotional strain or suspense
n. the physical condition of being stretched or strained
n. a balance between and interplay of opposing elements or tendencies (especially in art or literature)
n. (physics) a stress that produces an elongation of an elastic physical body"
excited,a. in an aroused state
bid,"n. an attempt to get something
n. a formal proposal to buy at a specified price
n. (bridge) the number of tricks a bridge player is willing to contract to make
v. ask for or request earnestly"
blank,"n. a piece of material ready to be made into something
n. a cartridge containing an explosive charge but no bullet
v. keep the opposing (baseball) team from winning
s. (of a surface) not written or printed on"
still,"n. a static photograph (especially one taken from a movie and used for advertising purposes)
n. an apparatus used for the distillation of liquids; consists of a vessel in which a substance is vaporized by heat and a condenser where the vapor is condensed
v. lessen the intensity of or calm
v. make motionless"
expression,"n. the feelings expressed on a person's face
n. expression without words
n. the communication (in speech or writing) of your beliefs or opinions
n. (genetics) the process of expressing a gene"
white,"n. a member of the Caucasoid race
n. the quality or state of the achromatic color of greatest lightness (bearing the least resemblance to black)
n. United States jurist appointed chief justice of the United States Supreme Court in 1910 by President Taft; noted for his work on antitrust legislation (1845-1921)
n. Australian writer (1912-1990)"
class,"n. a collection of things sharing a common attribute
n. a body of students who are taught together
n. people having the same social, economic, or educational status
n. a league ranked by quality"
available,"a. obtainable or accessible and ready for use or service
s. not busy; not otherwise committed
s. convenient for use or disposal"
conjunction,"n. an uninflected function word that serves to conjoin words or phrases or clauses or sentences
n. the grammatical relation between linguistic units (words or phrases or clauses) that are connected by a conjunction
n. (astronomy) apparent meeting or passing of two or more celestial bodies in the same degree of the zodiac"
strange,"a. being definitely out of the ordinary and unexpected; slightly odd or even a bit weird
s. not known before"
while,n. a period of indeterminate length (usually short) marked by some action or condition
blow,"n. a powerful stroke with the fist or a weapon
n. an impact (as from a collision)
n. forceful exhalation through the nose or mouth
v. exhale hard"
throw,"n. the act of throwing (propelling something with a rapid movement of the arm and wrist)
n. a single chance or instance
n. the maximum movement available to a pivoted or reciprocating piece by a cam
n. bedclothes consisting of a lightweight cloth covering (an afghan or bedspread) that is casually thrown over something"
lower,"v. move something or somebody to a lower position
v. set lower
v. cause to drop or sink"
