have a peculiar interest in ...,none
stay up late,none
keep a balanced diet,none
burning midnight oil,none
be harmful to ...,none
currently,r at this time or period; now
widespread,s. widely circulated or diffused
concern,"n. something that interests you because it is important or affects you
n. an anxious feeling
n. a feeling of sympathy for someone or something
n. something or someone that causes anxiety; a source of unhappiness"
regarding,"v deem to be
v look at attentively
v connect closely and often incriminatingly"
previously,r. at an earlier time or formerly
neglected,s. lacking a caretaker
connection,"n. a relation between things or events (as in the case of one causing the other or sharing features with it)
n. the state of being connected
n. an instrumentality that connects
n. (usually plural) a person who is influential and to whom you are connected in some way (as by family or friendship)"
portray,"v. portray in words
v. make a portrait of
v. represent abstractly, for example in a painting, drawing, or sculpture"
accompany,v. go or travel along with
extinction,"n. no longer active; extinguished
n. no longer in existence
n. the reduction of the intensity of radiation as a consequence of absorption and radiation"
wildlife,n. all living things (except people) that are undomesticated
correlation,"n. a reciprocal relation between two or more things
n. a statistical relation between two or more variables such that systematic changes in the value of one variable are accompanied by systematic changes in the other"
exert,"v. put to use
v. make a great effort at a mental or physical task"
tremendously,r extremely
negative,"n. a reply of denial
n. a piece of photographic film showing an image with light and shade or colors reversed
a. characterized by or displaying negation or denial or opposition or resistance; having no positive features
a. expressing or consisting of a negation or refusal or denial"
aforementioned,s being the one previously mentioned or spoken of
booming,"s. very lively and profitable
s. used of the voice"
inhabit,v. be present in
grassland,n. land where grass or grasslike vegetation grows and is the dominant form of plant life
industrialization,n. the development of industry on an extensive scale
urbanization,"n. the condition of being urbanized
n. the social process whereby cities grow and societies become more urban"
generate,"v. bring into existence
v. produce (energy)"
severe,"s. intensely or extremely bad or unpleasant in degree or quality
s. unsparing and uncompromising in discipline or judgment
s. very bad in degree or extent"
essentially,r in essence; at bottom or by one's (or its) very nature
ecosystem,n. a system formed by the interaction of a community of organisms with their physical environment
forecast,v. predict in advance
unpromising,s. unlikely to bring about favorable results or enjoyment
eliminate,"v. kill in large numbers
v. remove from a contest or race
v. remove (an unknown variable) from two or more equations"
regulation,"n. an authoritative rule
n. the state of being controlled or governed
n. (embryology) the ability of an early embryo to continue normal development after its structure has been somehow damaged or altered
n. the act of bringing to uniformity; making regular"
enforce,"v. ensure observance of laws and rules; 
v. compel to behave in a certain way"
unspoiled,"s not left to spoil
s not decayed or decomposed"
drastic,s. forceful and extreme and rigorous
measure,"n. any maneuver made as part of progress toward a goal
n. how much there is or how many there are of something that you can quantify
n. musical notation for a repeating pattern of musical beats
n. a container of some standard capacity that is used to obtain fixed amounts of a substance"
apply,"v. be pertinent or relevant or applicable
v. ask (for something)
v. refer (a word or name) to a person or thing
v. apply oneself to"
ensure,"v make certain of
v be careful or certain to do something; make certain of something"
remove,"n. degree of figurative distance or separation; 
v. remove something concrete, as by lifting, pushing, or taking off, or remove something abstract
v. remove from a position or an office
v. shift the position or location of, as for business, legal, educational, or military purposes"
accompanied by ...,none
exert a tremendously ... influence on ...,none
natural resources,none
be responsible for ...,none
to satisfy the ... demands of ...,none
in addition,none
be applied to ...,none
apparent,"s. clearly revealed to the mind or the senses or judgment
s. appearing as such but not necessarily so"
graph,"n. a visual representation of the relations between certain quantities plotted with reference to a set of axes
v. represent by means of a graph
v. plot upon a graph"
whereas,"adv. At which place; where.
conj. Considering that; it being the case that; since; --
   used to introduce a preamble which is the basis of declarations,
   affirmations, commands, requests, or like, that follow.
conj. When in fact; while on the contrary; the case being in
   truth that; although; -- implying opposition to something that
   precedes; or implying recognition of facts, sometimes followed by a
   different statement, and sometimes by inferences or something
   consequent."
mysterious,s. having an import not apparent to the senses nor obvious to the intelligence; beyond ordinary understanding
indicate,"v. indicate a place, direction, person, or thing; either spatially or figuratively
v. to state or express briefly
v. suggest the necessity of an intervention; in medicine"
appreciate,"v. recognize with gratitude; be grateful for
v. be fully aware of; realize fully
v. gain in value
v. increase the value of"
globalization,n. growth to a global or worldwide scale
irresistible,"a. impossible to resist; overpowering
s. overpoweringly attractive"
mutual,"s common to or shared by two or more parties
a concerning each of two or more persons or things; especially given or done in return"
preserve,"n. a domain that seems to be specially reserved for someone
n. a reservation where animals are protected
v. prevent (food) from rotting
v. keep undisturbed for personal or private use for hunting, shooting, or fishing"
cherish,v be fond of; be attached to
spiritual,"n. a kind of religious song originated by Blacks in the southern United States
s. concerned with or affecting the spirit or soul
s. lacking material body or form or substance"
advocate,"n. a person who pleads for a cause or propounds an idea
n. a lawyer who pleads cases in court"
controversial,a. marked by or capable of arousing controversy
absurd,"n. a situation in which life seems irrational and meaningless
s. inconsistent with reason or logic or common sense
s. incongruous; inviting ridicule"
nevertheless,r despite anything to the contrary (usually following a concession)
confront,"v. oppose, as in hostility or a competition
v. deal with (something unpleasant) head on
v. present somebody with something, usually to accuse or criticize
v. be face to face with"
sensible,"a. able to feel or perceive
s. readily perceived by the senses
s. aware intuitively or intellectually of something sensed"
resist,"v. stand up or offer resistance to somebody or something
v. withstand the force of something
v. resist immunologically the introduction of some foreign tissue or organ
v. refuse to comply"
multidimensional,a. having or involving or marked by several dimensions or aspects
vigorous,"s. characterized by forceful and energetic action or activity
s. strong and active physically or mentally"
line graph,none
on a steady rise,none
to some extent,none
the trend of,none
at first sight,none
in the long run,none
be confronted with,none
to absorb its virtues and to resist its dark side,none
commerce,"n. transactions (sales and purchases) having the objective of supplying commodities (goods and services)
n. social exchange, especially of opinions, attitudes, etc."
dramatically,"r. in a very impressive manner
r. in a dramatic manner
r. with respect to dramatic value"
phenomenon,"n. any state or process known through the senses rather than by intuition or reasoning
n. a remarkable development"
boom,"n. a deep prolonged loud noise
n. a state of economic prosperity
n. a sudden happening that brings good fortune (as a sudden opportunity to make money)
n. a pole carrying an overhead microphone projected over a film or tv set"
foremost,"s. preceding all others in spatial position
s. situated closest to the bow
r. prominently forward"
mature,"v. develop and reach maturity; undergo maturation
v. develop and work out fully in one's mind
v. become due for repayment
a. characteristic of maturity"
convince,"v make (someone) agree, understand, or realize the truth or validity of something"
formality,"n. a requirement of etiquette or custom
n. a manner that strictly observes all forms and ceremonies
n. compliance with formal rules"
teleworker,none
inevitable,"n. an unavoidable event
a. incapable of being avoided or prevented
s. invariably occurring or appearing"
irretrievable,s. impossible to recover or recoup or overcome
contribute to,none
have access to,none
give birth to,none
get prepared to,none
apparent,"s. clearly revealed to the mind or the senses or judgment
s. appearing as such but not necessarily so"
splendid,"s having great beauty and splendor
s very good; of the highest quality
s characterized by grandeur"
expand,"v. extend in one or more directions
v. become larger in size or volume or quantity
v. make bigger or wider in size, volume, or quantity"
vision,"n. a vivid mental image
n. the perceptual experience of seeing
n. a religious or mystical experience of a supernatural appearance"
mutual,"s common to or shared by two or more parties
a concerning each of two or more persons or things; especially given or done in return"
boost,"n. the act of giving hope or support to someone
n. the act of giving a push
v. give a boost to; be beneficial to
v. increase or raise"
crucial,"a. of extreme importance; vital to the resolution of a crisis
s. having crucial relevance"
upgrade,"n. software that provides better performance than an earlier version did
n. a reservation that is improved
n. the property possessed by a slope or surface that rises
n. hardware that provides better performance than an earlier version did"
prejudice,"v. disadvantage by prejudice
v. influence (somebody's) opinion in advance"
bias,"n. a partiality that prevents objective consideration of an issue or situation
v. influence in an unfair way
v. cause to be biased
s. slanting diagonally across the grain of a fabric"
at a growth rate of,none
account for,none
first and foremost,none
reform and opening-up,none
scope of knowledge,none
at the same time,none
make good use of,none
awareness,"n. having knowledge of
n. state of elementary or undifferentiated consciousness"
dependability,n. the quality of being dependable or reliable
responsibility,n. a form of trustworthiness; the trait of being answerable to someone for something or being responsible for one's conduct
punctuality,n. the quality or habit of adhering to an appointed time
cultivate,"v. foster the growth of
v. prepare for crops"
foster,"n. United States songwriter whose songs embody the sentiment of the South before the American Civil War (1826-1864)
v. promote the growth of
v. bring up under fosterage; of children
v. help develop, help grow"
accomplishment,n. the action of accomplishing something
assume,"v. take to be the case or to be true; accept without verification or proof
v. take on titles, offices, duties, responsibilities
v. take on a certain form, attribute, or aspect
v. occupy or take on"
participate in,none
interact with sb.,none
in addition,none
last but not least,none
case in point,none
generally speaking,none
fit in with sb.,none
reveal,v. disclose directly or through prophets
ownership,"n. the relation of an owner to the thing possessed; possession with the right to transfer possession to others
n. the state or fact of being an owner"
possess,"v. have as an attribute, knowledge, or skill
v. enter into and control, as of emotions or ideas"
mobility,n. the quality of moving freely
confine,"v. prevent from leaving or from being removed
v. deprive of freedom; take into confinement"
immediate,"s. of the present time and place
a. having no intervening medium
s. immediately before or after as in a chain of cause and effect
s. performed with little or no delay"
maintain,v. state or assert
volume,"n. the amount of 3-dimensional space occupied by an object
n. a publication that is one of a set of several similar publications
n. a relative amount
n. the magnitude of sound (usually in a specified direction)"
poisonous,"s. having the qualities or effects of a poison
s. not safe to eat
s. marked by deep ill will; deliberately harmful"
congestion,"n. excessive accumulation of blood or other fluid in a body part
n. excessive crowding"
frustration,"n. the feeling that accompanies an experience of being thwarted in attaining your goals
n. an act of hindering someone's plans or efforts
n. a feeling of annoyance at being hindered or criticized"
eliminate,"v. kill in large numbers
v. remove from a contest or race
v. remove (an unknown variable) from two or more equations"
a rise of,none
in the meantime,none
rely on,none
to the full,none
give off,none
contribute to,none
cancel out,none
traffic jam,none
witness,"n. someone who sees an event and reports what happened
n. testimony by word or deed to your religious faith
n. (law) a person who attests to the genuineness of a document or signature by adding their own signature
n. (law) a person who testifies under oath in a court of law"
ownership,"n. the relation of an owner to the thing possessed; possession with the right to transfer possession to others
n. the state or fact of being an owner"
percentage,n. a proportion in relation to a whole (which is usually the amount per hundred)
considerably,r to a great extent or degree
approximately,r. (of quantities) imprecise but fairly close to correct
corresponding,"s. accompanying
s. similar especially in position or purpose"
dramatically,"r. in a very impressive manner
r. in a dramatic manner
r. with respect to dramatic value"
installment,"n. a payment of part of a debt; usually paid at regular intervals
n. a part of a published serial"
subsidy,n. a grant paid by a government to an enterprise that benefits the public
forthcoming,s. available when required or as promised
attainable,s. capable of being attained or accomplished
authority,"n. the power or right to give orders or make decisions
n. (usually plural) persons who exercise (administrative) control over others
n. an expert whose views are taken as definitive
n. official permission or approval"
account for,none
result in,none
economic condition,none
put in force,none
a series of,none
real estate investment,none
be able to,none
column,"n. a line of units following one after another
n. a vertical glass tube used in column chromatography; a mixture is poured in the top and washed through a stationary substance where components of the mixture are adsorbed selectively to form colored bands
n. a vertical array of numbers or other information
n. anything that approximates the shape of a column or tower"
entertain,"v. provide entertainment for
v. take into consideration, have in view"
deserve,v. be worthy or deserving
opponent,s. characterized by active hostility
bomb,n. an explosive device fused to explode under specific conditions
violent,"a. acting with or marked by or resulting from great force or energy or emotional intensity
s. effected by force or injury rather than natural causes
s. (of colors or sounds) intensely vivid or loud"
induce,"v. cause to arise
v. cause to do; cause to act in a specified manner
v. cause to occur rapidly
v. reason or establish by induction"
indulge,"v. give free rein to
v. enjoy to excess"
irritable,s. abnormally sensitive to a stimulus
malnutrition,n. a state of poor nutrition; can result from insufficient or excessive or unbalanced diet or from inability to absorb foods
a rise of,none
first and foremost,none
the majority of,none
turn of mind,none
what is more,none
indulge in,none
do harm to,none
be lack of,none
be inclined to,none
significant,"a. important in effect or meaning
s. fairly large
a. too closely correlated to be attributed to chance and therefore indicating a systematic relation"
frequent,"v. be a regular or frequent visitor to a certain place
a. coming at short intervals or habitually
s. frequently encountered;"
habitually,r. according to habit or custom
sharply,"r. in a well delineated manner
r. changing suddenly in direction and degree"
summarize,v. be a summary of
quality,"n. an essential and distinguishing attribute of something or someone
n. a degree or grade of excellence or worth
n. a characteristic property that defines the apparent individual nature of something
n. high social status"
pupil,n. the contractile aperture in the center of the iris of the eye; resembles a large black dot
reference,"n. the most direct or specific meaning of a word or expression; the class of objects that an expression refers to
n. the act of referring or consulting
n. a publication (or a passage from a publication) that is referred to
n. the relation between a word or phrase and the object or idea it refers to"
available,"a. obtainable or accessible and ready for use or service
s. not busy; not otherwise committed
s. convenient for use or disposal"
consequence,"n. a phenomenon that follows and is caused by some previous phenomenon
n. the outcome of an event especially as relative to an individual
n. having important effects or influence"
thirst,"n. a physiological need to drink
v. feel the need to drink"
quench,"v. satisfy (thirst)
v. electronics: suppress (sparking) when the current is cut off in an inductive circuit, or suppress (an oscillation or discharge) in a component or device
v. reduce the degree of (luminescence or phosphorescence) in (excited molecules or a material) by adding a suitable substance"
treaty,n. a written agreement between two states or sovereigns
periodical,n. a publication that appears at fixed intervals
crucial,"a. of extreme importance; vital to the resolution of a crisis
s. having crucial relevance"
as well as,none
a jump of,none
as follows,none
as a consequence,none
at the same time,none
increasingly,r. advancing in amount or intensity
prior,n. the head of a religious order; in an abbey the prior is next below the abbot
entrepreneur,n. someone who organizes a business venture and assumes the risk for it
category,n. a general concept that marks divisions or coordinations in a conceptual scheme
cautious,"a. showing careful forethought; never making swift decisions""
s. avoiding excess"
entrepreneurial,"a. of or relating to an entrepreneur
s. willing to take risks in order to make a profit"
insight,"n. a feeling of understanding
n. the clear (and often sudden) understanding of a complex situation
n. grasping the inner nature of things intuitively"
mere,"n. a small pond of standing water
s. being nothing more than specified"
handy,"n. United States blues musician who transcribed and published traditional blues music (1873-1958)
s. easy to reach
s. easy to use
s. skillful with the hands"
despite,n. contemptuous disregard
crucial,"a. of extreme importance; vital to the resolution of a crisis
s. having crucial relevance"
academic,"a. associated with academia or an academy
s. hypothetical or theoretical and not expected to produce an immediate or practical result
s. marked by a narrow focus on or display of learning especially its trivial aspects"
priority,n. preceding in time
allocate,v. distribute according to a plan or set apart for a special purpose
schedule,"n. an ordered list of times at which things are planned to occur
v. plan for an activity or event
v. make a schedule; plan the time and place for events"
exploratory,a. serving in or intended for exploration or discovery
spirit,"n. the vital principle or animating force within living things
n. the general atmosphere of a place or situation and the effect that it has on people
n. a fundamental emotional and activating principle determining one's character
n. any incorporeal supernatural being that can become visible (or audible) to human beings"
paycheck,n. a check issued in payment of wages or salary
pie chart,none
account for,none
as long as,none
above all,none
as a result of,none
in addition,none
regardless of,none
come in handy,none
not to mention,none
column,"n. a line of units following one after another
n. a vertical glass tube used in column chromatography; a mixture is poured in the top and washed through a stationary substance where components of the mixture are adsorbed selectively to form colored bands
n. a vertical array of numbers or other information
n. anything that approximates the shape of a column or tower"
clearly,"r. without doubt or question
r. in an easily perceptible manner"
illustrate,"v. depict with an illustration
v. supply with illustrations"
weekly,"n. a periodical that is published every week (or 52 issues per year)
s. of or occurring every seven days"
earnings,"n the excess of revenues over outlays in a given period of time (including depreciation and other non-cash expenses)
n something that remunerates
v earn on some commercial or business transaction; earn as salary or wages
v acquire or deserve by one's efforts or actions"
bureau,"n an administrative unit of government
n furniture with drawers for keeping clothes"
steady,"v. make steady
a. not subject to change or variation especially in behavior
s. securely in position; not shaky
s. not easily excited or upset"
average,"n. a statistic describing the location of a distribution
n. (sports) the ratio of successful performances to opportunities
n. an intermediate scale value regarded as normal or usual
v. amount to or come to an average, without loss or gain"
diploma,n. a document certifying the successful completion of a course of study
doctoral,a. of or relating to a doctor or doctorate
pre-requisite,"n. something that is required in advance
s. required as a prior condition or course of study"
promising,s. showing possibility of achievement or excellence
imply,"v. express or state indirectly
v. suggest as a logically necessary consequence; in logic
v. have as a necessary feature"
progression,n. a series with a definite pattern of advance
whereby,"adv. By which; -- used relatively.
adv. By what; how; -- used interrogatively."
progress,"n. the act of moving forward (as toward a goal)
n. a movement forward
v. develop in a positive way"
responsible,"a. worthy of or requiring responsibility or trust; or held accountable
s. being the agent or cause"
commensurate,a. corresponding in size or degree or extent
highly,"r. to a high degree or extent; favorably or with much respect
r. at a high rate or wage
r. in a high position or level or rank"
hardly,r. almost not
bachelor,"n. a man who has never been married
v. lead a bachelor's existence"
analysis,"n. an investigation of the component parts of a whole and their relations in making up the whole
n. the abstract separation of a whole into its constituent parts in order to study the parts and their relations
n. a form of literary criticism in which the structure of a piece of writing is analyzed
n. the use of closed-class words instead of inflections: e.g., `the father of the bride' instead of `the bride's father'"
predict,v. make a prediction about; tell in advance
competitive,"a. involving competition or competitiveness
s. subscribing to capitalistic competition
s. showing a fighting disposition"
workplace,n. a place where work is done
mounting,n. framework used for support or display
range from ... to ...,none
as follows,none
in the first place,none
in the second place,none
it can be said that ...,none
at least,none
continue on,none
bar,"n. a counter where you can obtain food or drink
n. a rigid piece of metal or wood; usually used as a fastening or obstruction or weapon
n. an obstruction (usually metal) placed at the top of a goal
n. (meteorology) a unit of pressure equal to a million dynes per square centimeter"
illustrate,"v. depict with an illustration
v. supply with illustrations"
perspective,n. the appearance of things relative to one another as determined by their distance from the viewer
rank,"n. a row or line of people (especially soldiers or police) standing abreast of one another
n. relative status
v. take or have a position relative to others
v. take precedence or surpass others in rank"
respectively,r. in the order given
grim,s. not to be placated or appeased or moved by entreaty
keen,"n. a funeral lament sung with loud wailing
s. having a sharp cutting edge or point"
otherwise,"s. other than as supposed or expected
r. in other respects or ways"
foothold,n. a place providing support for the foot in standing or climbing
adequate,"a. having the requisite qualities or resources to meet a task
s. sufficient for the purpose
s. about average; acceptable"
meanwhile,"r. at the same time but in another place
r. during the intervening time"
corporation,n. a business firm whose articles of incorporation have been approved in some state
expectation,"n. belief about (or mental picture of) the future
n. the feeling that something is about to happen"
realistic,"a. aware or expressing awareness of things as they really are
a. of or relating to the philosophical doctrine of realism"
career,"n. the particular occupation for which you are trained
n. the general progression of your working or professional life
v. move headlong at high speed"
