alienate,v. make withdrawn or isolated or emotionally dissociated
restrain,"v. keep under control; keep in check
v. to close within bounds, limit or hold back from movement
v. hold back"
overindulgence,n. excessive indulgence
surf on line,none
meet the needs of,none
separate A from B,none
attempt to do sth.,none
isolate A from B,none
register for,none
be addicted to,none
face-to-face contact,none
concentrate on,none
restrain sb. from doing sth.,none
after all,none
set barriers,none
portray,"v. portray in words
v. make a portrait of
v. represent abstractly, for example in a painting, drawing, or sculpture"
discard,"n. anything that is cast aside or discarded
n. (cards) the act of throwing out a useless card or of failing to follow suit
n. getting rid something that is regarded as useless or undesirable
v. throw or cast away"
leftover,"n. a small part or portion that remains after the main part no longer exists
s. not used up"
container,n. any object that can be used to hold things (especially a large metal boxlike object of standardized dimensions that can be loaded from one form of transport to another)
rind,n. the natural outer covering of food (usually removed before eating)
spoil,"n. (usually plural) valuables taken by violence (especially in war)
n. the act of spoiling something by causing damage to it
n. the act of stripping and taking by force
v. become unfit for consumption or use"
boom,"n. a deep prolonged loud noise
n. a state of economic prosperity
n. a sudden happening that brings good fortune (as a sudden opportunity to make money)
n. a pole carrying an overhead microphone projected over a film or tv set"
ignore,"v. refuse to acknowledge
v. fail to notice
v. be ignorant of or in the dark about"
ecological,"a. characterized by the interdependence of living organisms in an environment
a. of or relating to the science of ecology"
excessively,r. to a degree exceeding normal or proper limits
ban,"n. 100 bani equal 1 leu in Moldova
n. 100 bani equal 1 leu in Romania
n. an official prohibition or edict against something
v. forbid the public distribution of ( a movie or a newspaper)"
unchecked,s not restrained or controlled
render,"n. a substance similar to stucco but exclusively applied to masonry walls
v. cause to become
v. give or supply
v. pass down"
unsustainable,none
rectify,"v. math: determine the length of
v. set straight or right
v. convert into direct current"
be filled with,none
be flooded with,none
serve as,none
shrug off,none
exert pressure on,none
shore up,none
enhance one's awareness,none
take sth. into consideration,none
vividly,r. in a vivid manner
tough,"a. not given to gentleness or sentimentality
a. physically toughened
a. resistant to cutting or chewing"
postgraduate,"n a student who continues studies after graduation
s of or relating to studies beyond a bachelor's degree"
preference,"n. a strong liking
n. the right or chance to choose
n. grant of favor or advantage to one over another (especially to a country or countries in matters of international trade, such as levying duties)"
entrepreneurial,"a. of or relating to an entrepreneur
s. willing to take risks in order to make a profit"
ambition,"n. a cherished desire
n. a strong drive for success
v. have as one's ambition"
undergraduate,n. a university student who has not yet received a first degree
financial,a involving financial matters
strain,"n. (physics) deformation of a physical body under the action of applied forces
n. (psychology) nervousness resulting from mental stress
n. injury to a muscle (often caused by overuse); results in swelling and pain
n. an intense or violent exertion"
intended,"a. resulting from one's intentions
s. future; betrothed"
gloomy,s. filled with melancholy and despondency
prospect,"n. the possibility of future success
v. search for something desirable
v. explore for useful or valuable things or substances, such as minerals"
optimal,s most desirable possible under a restriction expressed or implied
the vast majority of ...,none
start one's own business,none
a variety of ...,none
run one's own business,none
financial status,none
financial situation,none
financial strain,none
take sth. into account,none
career prospect,none
symbolically,"r. in a symbolic manner
r. by means of symbols"
illustrate,"v. depict with an illustration
v. supply with illustrations"
emphasize,"v to stress, single out as important
v give extra weight to (a communication)"
innovation,"n a creation (a new device or process) resulting from study and experimentation
n the creation of something in the mind
n the act of starting something for the first time; introducing something new"
portrayal,"n. a word picture of a person's appearance and character
n. acting the part of a character on stage; dramatically representing the character by speech and action and gesture"
intimidate,"v. make timid or fearful
v. to compel or deter by or as if by threats"
strengthen,"v. make strong or stronger
v. gain strength"
impasse,"n a situation in which no progress can be made or no advancement is possible
n a street with only one way in or out"
brilliant,"s. of surpassing excellence
s. characterized by grandeur
s. full of light; shining intensely"
unemployed,a. not engaged in a gainful occupation
clinical,"a. relating to a clinic or conducted in or as if in a clinic and depending on direct observation of patients
s. scientifically detached; unemotional"
depression,"n. a mental state characterized by a pessimistic sense of inadequacy and a despondent lack of activity
n. a long-term economic state characterized by unemployment and low prices and low levels of trade and investment
n. sad feelings of gloom and inadequacy
n. a period during the 1930s when there was a worldwide economic depression and mass unemployment"
despair,"n. a state in which all hope is lost or absent
n. the feeling that everything is wrong and nothing will turn out well
v. abandon hope; give up hope; lose heart"
best-selling,s. selling in great numbers
hardship,n. something that causes or entails suffering
unavoidable,"s impossible to avoid or evade:""inescapable conclusion"""
triumph,n. the exultation of victory
unbeatable,s. hard to defeat
course selective system,none
an either-or choice,none
take a shortcut,none
strengthen one's will,none
lead sb. out of ...,none
commit suicide,none
under such circumstances,none
in summary,none
curb,"n. an edge between a sidewalk and a roadway consisting of a line of curbstones (usually forming part of a gutter)
n. a horse's bit with an attached chain or strap to check the horse
v. keep to the curb"
shortage,"n the property of being an amount by which something is less than expected or required
n an acute insufficiency"
leftover,"n. a small part or portion that remains after the main part no longer exists
s. not used up"
approach,"n. ideas or actions intended to deal with a problem or situation
n. the act of drawing spatially closer to something
n. the event of one object coming closer to another
n. the temporal property of becoming nearer in time"
recycle,"v. cause to repeat a cycle
v. use again after processing"
disposable,"n. an item that can be disposed of after it has been used
a. free or available for use or disposition
a. designed to be disposed of after use"
depletion,"n. the act of decreasing something markedly
n. the state of being depleted"
degradation,n. changing to a lower state (a less respected state)
be aware of,none
cut down on,none
climate change,none
make a positive difference,none
stand for,none
turn off,"n. something causing antagonism or loss of interest
n. a side road where you can turn off"
grasp,v. hold firmly
caption,"n. taking exception; especially a quibble based on a captious argument
n. brief description accompanying an illustration
v. provide with a caption, as of a photograph or a drawing"
indicate,"v. indicate a place, direction, person, or thing; either spatially or figuratively
v. to state or express briefly
v. suggest the necessity of an intervention; in medicine"
universal,"n. (linguistics) a grammatical rule (or other linguistic feature) that is found in all languages
n. (logic) a proposition that asserts something of all members of a class
n. a behavioral convention or pattern characteristic of all members of a particular culture or of all human beings
s. applicable to or common to all members of a group or set"
multitude,"n. a large gathering of people
n. the common people generally"
deem,v. keep in mind or convey as a conviction or view
clarify,"v. make clear and (more) comprehensible
v. make clear by removing impurities or solids, as by heating"
individual,"n. a single organism
a. being or characteristic of a single thing or person
s. separate and distinct from others of the same kind
s. characteristic of or meant for a single person or thing"
graduate,"n. a measuring instrument for measuring fluid volume; a glass container (cup or cylinder or flask) whose sides are marked with or divided into amounts
v. receive an academic degree upon completion of one's studies
v. confer an academic degree upon
s. of or relating to studies beyond a bachelor's degree"
admission,"n. the act of admitting someone to enter
n. an acknowledgment of the truth of something"
convince,"v make (someone) agree, understand, or realize the truth or validity of something"
advisable,a. worthy of being recommended or suggested; prudent or wise
derive,"v. obtain
v. come from
v. develop or evolve from a latent or potential state
v. come from; be connected by a relationship of blood, for example"
depend on,none
long for,none
contribute to,none
average people,none
lie in,n. a long stay in bed in the morning
in view of,none
vividly,r. in a vivid manner
reveal,v. disclose directly or through prophets
tenacity,n persistent determination
quickness,"n skillful performance or ability without difficulty
n intelligence as revealed by an ability to give correct responses without delay
n a rate that is rapid"
coincidence,"n. an event that might have been arranged although it was really accidental
n. the quality of occupying the same position or area in space"
random,a. lacking any definite plan or order or purpose; governed by or depending on chance
exploit,"v. use or manipulate to one's advantage
v. draw from; make good use of"
forfeit,"n. something that is lost or surrendered as a penalty; 
n. a penalty for a fault or mistake that involves losing or giving up something
n. the act of losing or surrendering something as a penalty for a mistake or fault or failure to perform etc.
v. lose (s.th.) or lose the right to (s.th.) by some error, offense, or crime"
throne,"n. the chair of state for a monarch, bishop, etc.
n. the position and power of an exalted person (a sovereign or bishop) who is entitled to sit in a chair of state on ceremonial occasions
v. sit on the throne as a ruler"
mindset,n a habitual or characteristic mental attitude that determines how you will interpret and respond to situations
enterprise,"n. a purposeful or industrious undertaking (especially one that requires effort or boldness)
n. an organization created for business ventures
n. readiness to embark on bold new ventures"
perseverance,n. the act of persisting or persevering; continuing or repeating behavior
utilize,v. convert (from an investment trust to a unit trust)
endowment,"n. natural abilities or qualities
n. the capital that provides income for an institution
n. the act of endowing with a permanent source of income"
play a role in,none
in addition to,none
stem from,none
take advantage of,none
in sum,none
a combination of,none
make the most of,none
capitalize on,none
ax,"n. an edge tool with a heavy bladed head mounted across a handle
v. terminate"
hew,"v. make or shape as with an axe
v. strike with an axe; cut down, strike"
despair,"n. a state in which all hope is lost or absent
n. the feeling that everything is wrong and nothing will turn out well
v. abandon hope; give up hope; lose heart"
precious,"s. of high worth or cost
r. extremely"
caption,"n. taking exception; especially a quibble based on a captious argument
n. brief description accompanying an illustration
v. provide with a caption, as of a photograph or a drawing"
indicate,"v. indicate a place, direction, person, or thing; either spatially or figuratively
v. to state or express briefly
v. suggest the necessity of an intervention; in medicine"
conservatism,n. a political or theological orientation advocating the preservation of the best in society and opposing radical changes
regression,"n. (psychiatry) a defense mechanism in which you flee from reality by assuming a more infantile state
n. the relation between selected values of x and observed values of y (from which the most probable value of y can be predicted for any value of x)
n. returning to a former state"
utmost,n. the greatest possible degree
innovation,"n a creation (a new device or process) resulting from study and experimentation
n the creation of something in the mind
n the act of starting something for the first time; introducing something new"
watchword,"n a slogan used to rally support for a cause
n a secret word or phrase known only to a restricted group"
innumerable,s too numerous to be counted
vaccine,n. immunogen consisting of a suspension of weakened or dead pathogenic cells injected in order to stimulate the production of antibodies
ascribe,v attribute or credit to
entrepreneur,n. someone who organizes a business venture and assumes the risk for it
endeavor,v. attempt by employing effort
dedicated,a. devoted to a cause or ideal or purpose
ideal,"n. the idea of something that is perfect; something that one hopes to attain
n. model of excellence or perfection of a kind; one having no equal
s. conforming to an ultimate standard of perfection or excellence; embodying an ideal
s. constituting or existing only in the form of an idea or mental image or conception"
hew out,none
attach importance to,none
to begin with,none
carry out,none
live trial,none
be ascribed to,none
for instance,none
put emphasis on,none
reward sb. with sth.,none
treasure,"n. accumulated wealth in the form of money or jewels etc.
n. any possession that is highly valued by its owner
n. a collection of precious things"
civilization,"n. a society in an advanced state of social development (e.g., with complex legal and political and religious organizations)
n. the social process whereby societies achieve an advanced stage of development and organization"
pleasantly,"r. in a cheerful manner
r. in an enjoyable manner"
appreciate,"v. recognize with gratitude; be grateful for
v. be fully aware of; realize fully
v. gain in value
v. increase the value of"
obviously,r. unmistakably (`plain' is often used informally for `plainly')
elegant,"a. refined and tasteful in appearance or behavior or style
s. suggesting taste, ease, and wealth
s. displaying effortless beauty and simplicity in movement or execution"
charm,"n. something believed to bring good luck
n. (physics) one of the six flavors of quark
v. control by magic spells, as by practicing witchcraft
v. protect through supernatural powers or charms"
survive,"v. continue to live through hardship or adversity
v. continue in existence after (an adversity, etc.)"
thrive,v. make steady progress; be at the high point in one's career or reach a high point in historical significance or importance
prosper,v make steady progress; be at the high point in one's career or reach a high point in historical significance or importance
preservation,"n. the activity of protecting something from loss or danger
n. the condition of being (well or ill) preserved
n. a process that saves organic substances from decay"
commercialization,n. the act of commercializing something; involving something in commerce
widespread,s. widely circulated or diffused
growing,"n. (electronics) the production of (semiconductor) crystals by slow crystallization from the molten state
a. relating to or suitable for growth"
age-old,s. belonging to or lasting from times long ago
modernization,"n. making modern in appearance or behavior
n. a modernized version (as of a play)"
perish,v pass from physical life and lose all bodily attributes and functions necessary to sustain life
tragedy,n. drama in which the protagonist is overcome by some superior force or circumstance; excites terror or pity
immeasurable,a. impossible to measure
proportion,"n. the quotient obtained when the magnitude of a part is divided by the magnitude of the whole
n. magnitude or extent
n. the relation between things (or parts of things) with respect to their comparative quantity, magnitude, or degree
n. harmonious arrangement or relation of parts or elements within a whole (as in a design)"
unwavering,"s marked by firm determination or resolution; not shakable
s not showing abrupt variations"
secure,"v. assure payment of
a. free from fear or doubt; easy in mind
a. free from danger or risk
a. not likely to fail or give way"
in the photo above,none
in my opinion,none
traditional Chinese culture,none
be destined to,none
contribute to,none
on the part of,none
a developing country,none
in the shadow of,none
as a result of,none
Tai Chi,n a Chinese system of slow meditative physical exercise designed for relaxation and balance and health
Kung Fu,none
Peking opera,none
inseparable,s. not capable of being separated
vividly,r. in a vivid manner
depict,"v show in, or as in, a picture
v give a description of
v make a portrait of"
click,"n. depression of a button on a computer mouse
v. make a clicking or ticking sound
v. produce a click
v. become clear or enter one's consciousness or emotions"
actually,"r. in actual fact
r. used to imply that one would expect the fact to be the opposite of that stated; surprisingly
r. at the present moment
r. as a sentence modifier to add slight emphasis"
surf,"n. waves breaking on the shore
v. switch channels, on television"
routine,"n. an unvarying or habitual method or procedure
n. a set sequence of steps, part of larger computer program"
ironic,s. characterized by often poignant difference or incongruity between what is expected and what actually is
cord,"n. a line made of twisted fibers or threads
n. a unit of amount of wood cut for burning; 128 cubic feet
n. a light insulated conductor for household use
n. a cut pile fabric with vertical ribs; usually made of cotton"
exaggerative,a. Tending to exaggerate; involving exaggeration.
impressive,"a. making a strong or vivid impression
s. producing a strong effect"
portrayal,"n. a word picture of a person's appearance and character
n. acting the part of a character on stage; dramatically representing the character by speech and action and gesture"
subtly,r. in a subtle manner
reveal,v. disclose directly or through prophets
duality,"n. (physics) the property of matter and electromagnetic radiation that is characterized by the fact that some properties can be explained best by wave theory and others by particle theory
n. (geometry) the interchangeability of the roles of points and planes in the theorems of projective geometry"
currently,r at this time or period; now
considerably,r to a great extent or degree
veteran,"n. a serviceman who has seen considerable active service
n. a person who has served in the armed forces
n. an experienced person who has been through many battles; someone who has given long service"
purchase,"n. the acquisition of something for payment
n. something acquired by purchase
n. a means of exerting influence or gaining advantage"
wholesome,"a. conducive to or characteristic of physical or moral well-being
s. sound or exhibiting soundness in body or mind"
resemble,v. appear like; be similar or bear a likeness to
kaleidoscope,"n. a complex pattern of constantly changing colors and shapes
n. an optical toy in a tube; it produces symmetrical patterns as bits of colored glass are reflected by mirrors"
pattern,"n. a model considered worthy of imitation
v. form a pattern"
illusion,"n. an erroneous mental representation
n. something many people believe that is false"
indulge,"v. give free rein to
v. enjoy to excess"
fictitious,"s formed or conceived by the imagination
s adopted in order to deceive"
barely,r. only a very short time before
consequently,"r. (sentence connectors) because of the reason given
r. as a consequence"
immoderately,r. without moderation; in an immoderate manner
skip,"n. a gait in which steps and hops alternate
v. bound off one point after another"
inevitably,r. in such a manner as could not be otherwise
restrain,"v. keep under control; keep in check
v. to close within bounds, limit or hold back from movement
v. hold back"
overindulgence,n. excessive indulgence
shackle,"n. a restraint that confines or restricts freedom (especially something used to tie down or restrain a prisoner)
n. a U-shaped bar; the open end can be passed through chain links and closed with a bar"
develop a relationship with sb.,none
be convenient for sb. to do sth.,none
surf online,none
become a daily routine in our life,none
the relationship between ... and ...,none
discussions on,none
on the one hand,none
people from different walks of life,none
benefit from,none
register for,none
web courses,none
exchange information with sb.,none
a net friend,none
download music,none
a veteran online shopper,none
at much lower prices,none
on the other hand,none
a good many,none
be addicted to,none
indulge in,none
concentrate on,none
play computer games,none
lead to failure in exams,none
in a reasonable way,none
restrain from,none
after all,none
enrich our life,none
improve the efficiency of,none
shackle sb. with a chain,none
inform,"v. impart knowledge of some fact, state or affairs, or event to
v. give character or essence to
v. act as an informer"
extensively,r. in a widespread way
tendency,"n. a characteristic likelihood of or natural disposition toward a certain condition or character or effect
n. a general direction in which something tends to move"
disturbing,"v move deeply
v change the arrangement or position of
v tamper with
v destroy the peace or tranquility of
v damage as if by shaking or jarring
s causing distress or worry or anxiety"
derive,"v. obtain
v. come from
v. develop or evolve from a latent or potential state
v. come from; be connected by a relationship of blood, for example"
companionship,n the state of being with someone
instruction,n. (computer science) a line of code written as part of a computer program
foremost,"s. preceding all others in spatial position
s. situated closest to the bow
r. prominently forward"
faithful,"n. any loyal and steadfast following
a. steadfast in affection or allegiance
a. not having sexual relations with anyone except your husband or wife, or your boyfriend or girlfriend"
contentment,n. happiness with one's situation in life
lessen,"v decrease in size, extent, or range
v make smaller
v wear off or die down"
marvel,v. express astonishment or surprise about something
mingle,v. get involved or mixed-up with
throng,v. press tightly together or cram
stroll,v. walk leisurely and with no apparent aim
boulevard,n a wide street or thoroughfare
intellectual,"n. a person who uses the mind creatively
s. of or associated with or requiring the use of the mind
a. appealing to or using the intellect"
advent,"n. arrival that has been awaited (especially of something momentous)
n. the season including the four Sundays preceding Christmas"
replace,"v. substitute a person or thing for (another that is broken or inefficient or lost or no longer working or yielding what is expected)
v. put something back where it belongs"
be absorbed in,none
concentrate on,none
first and foremost,none
a wide range of,none
marvel at,none
Niagara Falls,none
last but not least,none
intellectual ability,none
broaden one's mind,none
appearance,"n. outward or visible aspect of a person or thing
n. the event of coming into sight
n. formal attendance (in court or at a hearing) of a party in an action
n. a mental representation"
depict,"v show in, or as in, a picture
v give a description of
v make a portrait of"
slim,"v take off weight
s being of delicate or slender build
s small in quantity"
therapeutic,a. relating to or involved in therapy
cosmetic,"n. a toiletry designed to beautify the body
s. serving an esthetic rather than a useful purpose
s. serving an aesthetic purpose in beautifying the body"
tremendous,"s extraordinarily large in size or extent or amount or power or degree; that a whole civilization should be dependent on technology""- Walter Lippman
s extraordinarily good or great; used especially as intensifiers
s extreme in degree or extent or amount or impact"
enlargement,"n. the state of being enlarged
n. a photographic print that has been enlarged"
diagnose,"v. determine or distinguish the nature of a problem or an illness through a diagnostic analysis
v. subject to a medical analysis"
mammary,a. of or relating to the milk-giving gland of the female
gland,n. any of various organs that synthesize substances needed by the body and release it through ducts or directly into the bloodstream
mainstream,n. the prevailing current of thought
cultivation,"n. socialization through training and education to develop one's mind or manners
n. (agriculture) production of food by preparing the land to grow crops (especially on a large scale)
n. the process of fostering the growth of something"
outweigh,v. be heavier than
a great many,none
fall into the category,none
plastic surgery,none
breast feed,v. give suck to
bring about,none
lay more attention on,none
in the long run,none
symbolically,"r. in a symbolic manner
r. by means of symbols"
illustrate,"v. depict with an illustration
v. supply with illustrations"
