universal,"n. (linguistics) a grammatical rule (or other linguistic feature) that is found in all languages
n. (logic) a proposition that asserts something of all members of a class
n. a behavioral convention or pattern characteristic of all members of a particular culture or of all human beings
s. applicable to or common to all members of a group or set"
remain,"v. be left; of persons, questions, problems, results, evidence, etc."
the Spring and Autumn Period,none
The Analects,none
be recorded by,none
thought on Heaven and people,none
not only ... but also ...,none
unfortunately,r. by bad luck
diagnose,"v. determine or distinguish the nature of a problem or an illness through a diagnostic analysis
v. subject to a medical analysis"
infection,"n. the pathological state resulting from the invasion of the body by pathogenic microorganisms
n. (phonetics) the alteration of a speech sound under the influence of a neighboring sound
n. (medicine) the invasion of the body by pathogenic microorganisms and their multiplication which can lead to tissue damage and disease
n. an incident in which an infectious disease is transmitted"
surgery,"n. the branch of medical science that treats disease or injury by operative procedures
n. a room where a doctor or dentist can be consulted"
postpone,v. hold back to a later time
apologize,"v. acknowledge faults or shortcomings or failing
v. defend, explain, clear away, or make excuses for by reasoning"
inconvenience,"n. an inconvenient discomfort
n. the quality of not being useful or convenient"
inform,"v. impart knowledge of some fact, state or affairs, or event to
v. give character or essence to
v. act as an informer"
meet with sb.,none
be diagnosed with,none
ear infection,none
on the same day as ...,none
make the interview,none
postpone the interview,none
apologize for sth.,none
look forward to doing sth.,none
hear from sb.,none
be sorry for sth.,none
excuse sb. for doing sth.,none
inform sb. of sth.,none
cordially,r in a hearty manner
outstanding,"s. distinguished from others in excellence
s. having a quality that thrusts itself into attention
s. owed as a debt"
available,"a. obtainable or accessible and ready for use or service
s. not busy; not otherwise committed
s. convenient for use or disposal"
allocate,v. distribute according to a plan or set apart for a special purpose
session,"n. a meeting for execution of a group's functions
n. a meeting devoted to a particular activity"
on behalf of,none
be interested in,none
look forward to,none
seriously,r. in a serious manner
committee,"n. a special group delegated to consider some matter
n. a self-constituted organization to promote something"
contact,"n. close interaction
n. the act of touching physically
n. the state or condition of touching or of being in immediate proximity
n. the physical coming together of two or more things"
donate,v. give to a charity or good cause
expense,"n. amounts paid for goods and services that may be currently tax deductible (as opposed to capital expenditures)
n. a detriment or sacrifice
n. money spent to perform work and usually reimbursed by an employer
v. reduce the estimated value of something"
sufficient,a. of a quantity that can fulfill a need or requirement but without being abundant
imperative,"n. some duty that is essential and urgent
a. requiring attention or action
a. relating to verbs in the imperative mood"
transfer,"n. someone who transfers or is transferred from one position to another
n. the act of transfering something from one form to another
n. a ticket that allows a passenger to change conveyances
n. application of a skill learned in one situation to a different but similar situation"
generously,r in a generous manner
specialized medical treatment,none
on campus,none
set up,n. the way something is organized or arranged
be able to,none
platform,"n. a raised horizontal surface
n. a document stating the aims and principles of a political party
n. the combination of a particular computer and a particular operating system
n. any military structure or vehicle bearing weapons"
demonstrate,v. march in protest; take part in a demonstration
outstanding,"s. distinguished from others in excellence
s. having a quality that thrusts itself into attention
s. owed as a debt"
stage,"n. a large platform on which people can stand and can be seen by an audience
n. the theater as a profession (usually `the stage')
n. a section or portion of a journey or course
n. any scene regarded as a setting for exhibiting or doing something"
extra-curricular,"s. outside the regular academic curriculum
s. outside the regular duties of your job or profession"
multiple,"n. the product of a quantity by an integer
a. having or involving or consisting of more than one part or entity or individual"
participation,n. the condition of sharing in common with others (as fellows or partners etc.)
strengthen,"v. make strong or stronger
v. gain strength"
interpersonal,s. occurring among or involving several people
proficiency,"n. the quality of having great facility and competence
n. skillfulness in the command of fundamentals deriving from practice and familiarity"
command,"n. an authoritative direction or instruction to do something
n. a military unit or region under the control of a single officer
n. the power or authority to command
n. availability for use"
enable,v. render capable or able for some task
edge,"n. the boundary of a surface
n. a sharp side formed by the intersection of two surfaces of an object
n. the attribute of urgency in tone of voice
n. a slight competitive advantage"
peer,"n. a person who is of equal standing with another in a group
n. a nobleman (duke or marquis or earl or viscount or baron) who is a member of the British peerage
v. look searchingly"
submit,"v. refer for judgment or consideration
v. put before
v. yield to the control of another
v. yield to another's wish or opinion"
deadline,n. the point in time at which something must be completed
serve as,none
develop a range of skills,none
be involved in,none
a variety of,none
musical dramas,none
group discussions,none
Oscar-winning movies,none
take part in,none
in multiple regards,none
sense of responsibility,none
develop interpersonal relations,none
level of proficiency,none
a good command of English,none
enable sb. to do sth.,none
get an edge over sb.,none
a written application,none
attraction,"n. the force by which one object attracts another
n. an entertainment that is offered to the public
n. the quality of arousing interest; being attractive or something that attracts
n. a characteristic that provides pleasure and attracts"
opposite,"s. being directly across from each other; facing
a. of leaves etc; growing in pairs on either side of a stem
s. moving or facing away from each other
s. the other one of a complementary pair"
illustrate,"v. depict with an illustration
v. supply with illustrations"
emotional,"a. determined or actuated by emotion rather than reason
a. of more than usual emotion
a. of or pertaining to emotion"
regard,"n. (usually plural) a polite expression of desire for someone's welfare
n. a feeling of friendship and esteem
v. look at attentively"
sublime,"v. vaporize and then condense right back again
v. change or cause to change directly from a solid into a vapor without first melting
s. lifted up or set high"
ethnicity,n. an ethnic quality or affiliation resulting from racial or cultural ties
victim,"n. an unfortunate person who suffers from some adverse circumstance
n. a person who is tricked or swindled"
deadly,"s. causing or capable of causing death
s. of an instrument of certain death
s. extremely poisonous or injurious; producing venom
s. involving loss of divine grace or spiritual death"
hesitate,"v. pause or hold back in uncertainty or unwillingness
v. interrupt temporarily an activity before continuing"
needy,"n. needy people collectively
s. demanding or needing attention, affection, or reassurance to an excessive degree"
complete,"v. come or bring to a finish or an end; others finished in over 4 hours""
v. bring to a whole, with all the necessary parts or elements
v. complete a pass
v. write all the required information onto a form"
sorrow,"n. an emotion of great sadness associated with loss or bereavement
n. sadness associated with some wrong done or some disappointment"
as a matter of fact,none
regard sth. as sth.,none
take an example to ...,none
respond to sth.,none
all over the country,none
hesitate to do sth.,none
not hesitate to do sth.,none
be it money or goods,none
with no thought of gain or reward,none
be ready to do sth.,none
give a helping hand to sb.,none
be in trouble,none
complete strangers,none
make the world a better place,none
as the picture shows,none
depict,"v show in, or as in, a picture
v give a description of
v make a portrait of"
accessory,"n. clothing that is worn or carried, but not part of your main clothing
n. a supplementary component that improves capability
n. someone who helps another person commit a crime
s. furnishing added support"
undoubtedly,r. without doubt; certainly
convey,"v. make known; pass on, of information
v. transfer to another
v. transmit a title or property"
implication,"n. an accusation that brings into intimate and usually incriminating connection
n. a logical relation between propositions p and q of the form `if p then q'; if p is true then q cannot be false
n. a relation implicated by virtue of involvement or close connection (especially an incriminating involvement)"
mysterious,s. having an import not apparent to the senses nor obvious to the intelligence; beyond ordinary understanding
indicate,"v. indicate a place, direction, person, or thing; either spatially or figuratively
v. to state or express briefly
v. suggest the necessity of an intervention; in medicine"
appreciate,"v. recognize with gratitude; be grateful for
v. be fully aware of; realize fully
v. gain in value
v. increase the value of"
unique,"s. (followed by `to') applying exclusively to a given category or condition or locality
s. highly unusual or rare but not the single instance"
worldwide,s. spanning or extending throughout the entire world
globalization,n. growth to a global or worldwide scale
irresistible,"a. impossible to resist; overpowering
s. overpoweringly attractive"
preserve,"n. a domain that seems to be specially reserved for someone
n. a reservation where animals are protected
v. prevent (food) from rotting
v. keep undisturbed for personal or private use for hunting, shooting, or fishing"
priceless,"s having incalculable monetary, intellectual, or spiritual worth"
spiritual,"n. a kind of religious song originated by Blacks in the southern United States
s. concerned with or affecting the spirit or soul
s. lacking material body or form or substance"
advocate,"n. a person who pleads for a cause or propounds an idea
n. a lawyer who pleads cases in court"
internationalize,"v. put under international control
v. make international in character"
controversial,a. marked by or capable of arousing controversy
absurd,"n. a situation in which life seems irrational and meaningless
s. inconsistent with reason or logic or common sense
s. incongruous; inviting ridicule"
perspective,n. the appearance of things relative to one another as determined by their distance from the viewer
observe,"v. watch attentively
v. behave as expected during of holidays or rites
v. stick to correctly or closely
v. conform one's action or practice to"
confront,"v. oppose, as in hostility or a competition
v. deal with (something unpleasant) head on
v. present somebody with something, usually to accuse or criticize
v. be face to face with"
promote,"v. contribute to the progress or growth of
v. give a promotion to or assign to a higher position
v. be changed for a superior chess or checker piece
v. change a pawn for a better piece by advancing it to the eighth row, or change a checker piece for a more valuable piece by moving it to the row closest to your opponent"
multidimensional,a. having or involving or marked by several dimensions or aspects
vigorous,"s. characterized by forceful and energetic action or activity
s. strong and active physically or mentally"
with a sweet smile on one's face,none
be characteristic of,none
a certain Chinese minority group,none
oriental charm,none
go far beyond,none
cultural implication,none
be attracted to sth.,none
to some extent,none
economic and cultural exchange,none
at first sight,none
in the long run,none
be confronted with,none
be sensible enough to do sth.,none
absorb its virtues and to resist its dark side,none
destiny,"n. an event (or a course of events) that will inevitably happen in the future
n. the ultimate agency regarded as predetermining the course of events (often personified as a woman)"
circumstance,"n. a condition that accompanies or influences some event or activity
n. information that should be kept in mind when making a decision
n. formal ceremony about important occasions"
shelter,"n. a structure that provides privacy and protection from danger
n. protective covering that provides protection from the weather
n. temporary housing for homeless or displaced persons
v. provide shelter for"
expose,"n. the exposure of an impostor or a fraud
v. expose or make accessible to some action or influence
v. to show, make visible or apparent
v. expose to light, of photographic film"
wither,"v wither, as with a loss of moisture
v lose freshness, vigor, or vitality"
withstand,"v resist or confront with resistance
v stand up or offer resistance to somebody or something"
symbolic,"a. relating to or using or proceeding by means of symbols
a. using symbolism"
delicate,"a. exquisitely fine and subtle and pleasing; susceptible to injury
s. marked by great skill especially in meticulous technique
s. easily broken or damaged or destroyed
s. easily hurt"
specific,"n. a medicine that has a mitigating effect on a specific disease
a. (sometimes followed by `to') applying to or characterized by or distinguishing something particular or special or unique
s. stated explicitly or in detail
a. relating to or distinguishing or constituting a taxonomic species"
epitomize,v embody the essential characteristics of or be a typical example of
shield,"n. a protective covering or structure
n. armor carried on the arm to intercept blows
v. protect, hide, or conceal from danger or harm"
implication,"n. an accusation that brings into intimate and usually incriminating connection
n. a logical relation between propositions p and q of the form `if p then q'; if p is true then q cannot be false
n. a relation implicated by virtue of involvement or close connection (especially an incriminating involvement)"
competitive,"a. involving competition or competitiveness
s. subscribing to capitalistic competition
s. showing a fighting disposition"
in full bloom,none
shelter ... from ...,none
on the contrary,none
take ... seriously,none
in the face of,none
derive ... from ...,none
reveal,v. disclose directly or through prophets
phenomenon,"n. any state or process known through the senses rather than by intuition or reasoning
n. a remarkable development"
pitiful,"s inspiring mixed contempt and pity
s bad; unfortunate
s deserving or inciting pity"
unjust,a. violating principles of justice
arouse,"v. call forth (emotions, feelings, and responses)
v. to begin moving, ""As the thunder started the sleeping children began to stir""
v. stimulate sexually"
indignation,n. a feeling of righteous anger
virtue,"n. the quality of doing what is right and avoiding what is wrong
n. morality with respect to sexual relations
n. a particular moral excellence"
reiterate,"v to say, state, or perform again"
indebted,"s. owing gratitude or recognition to another for help or favors etc
s. under a legal obligation to someone"
prick,"n. the act of puncturing with a small point
v. cause a stinging pain
v. to cause a sharp emotional pain"
take care of,none
filial piety,none
try every means to do sth.,none
look after,none
bear in mind,none
live up to,none
vividly,r. in a vivid manner
superstar,n someone who is dazzlingly skilled in any field
striking,"n the physical coming together of two or more things
n the act of contacting one thing with another
v deliver a sharp blow, as with the hand, fist, or weapon
v have an emotional or cognitive impact upon
v hit against; come into sudden contact with
v make a strategic, offensive, assault against an enemy, opponent, or a target
v indicate (a certain time) by striking
v affect or afflict suddenly, usually adversely
v stop work in order to press demands
v touch or seem as if touching visually or audibly
v attain
v produce by manipulating keys or strings of musical instruments, also metaphorically
v cause to form (an electric arc) between electrodes of an arc lamp
v find unexpectedly
v produce by ignition or a blow
v remove by erasing or crossing out or as if by drawing a line
v cause to experience suddenly
v drive something violently into a location
v occupy or take on
v form by stamping, punching, or printing
v smooth with a strickle
v pierce with force
v arrive at after reckoning, deliberating, and weighing
s sensational in appearance or thrilling in effect
s having a quality that thrusts itself into attention"
popularity,n. the quality of being widely admired or accepted or sought after
adolescent,"n. a juvenile between the onset of puberty and maturity
a. relating to or peculiar to or suggestive of an adolescent
s. being of the age 13 through 19
s. displaying or suggesting a lack of maturity"
appear,"v. come into sight or view
v. be issued or published
v. seem to be true, probable, or apparent
v. come into being or existence, or appear on the scene"
caption,"n. taking exception; especially a quibble based on a captious argument
n. brief description accompanying an illustration
v. provide with a caption, as of a photograph or a drawing"
indicate,"v. indicate a place, direction, person, or thing; either spatially or figuratively
v. to state or express briefly
v. suggest the necessity of an intervention; in medicine"
worship,"n. the activity of worshipping
n. a feeling of profound love and admiration
v. show devotion to (a deity)
v. attend religious services"
chic,"n. elegance by virtue of being fashionable
s. elegant and stylish"
imitate,"v. reproduce someone's behavior or looks
v. appear like, as in behavior or appearance
v. make a reproduction or copy of"
undoubtedly,r. without doubt; certainly
subtly,r. in a subtle manner
phenomenon,"n. any state or process known through the senses rather than by intuition or reasoning
n. a remarkable development"
prevalent,s most frequent or common
idolize,v. love unquestioningly and uncritically or to excess; venerate as an idol
excel,v. distinguish oneself
represent,"v. take the place of or be parallel or equivalent to
v. be representative or typical for
v. be a delegate or spokesperson for; represent somebody's interest or be a proxy or substitute for, as of politicians and office holders representing their constituents, or of a tenant representing other tenants in a housing dispute
v. serve as a means of expressing something"
appearance,"n. outward or visible aspect of a person or thing
n. the event of coming into sight
n. formal attendance (in court or at a hearing) of a party in an action
n. a mental representation"
unparalleled,s radically distinctive and without equal
passionately,r. with passion
adore,v. love intensely
likewise,"r in like or similar manner
r in addition
r equally"
provoke,"v. evoke or provoke to appear or occur
v. provide the needed stimulus for"
idolatry,"n. religious zeal; the willingness to serve God
n. the worship of idols; the worship of images that are not God"
thought-provoking,s stimulating interest or thought
pursue,"v. follow in or as if in pursuit
v. carry further or advance"
unreasonably,"r. not in a reasonable or intelligent manner
r. to a degree that exceeds the bounds or reason or moderation"
obsession,n. an unhealthy and compulsive preoccupation with something or someone
endanger,v. pose a threat to; present a danger to
efficiency,"n. the ratio of the output to the input of any system
n. skillfulness in avoiding wasted time and effort"
accordingly,r. in accordance with
adopt,"v. choose and follow; as of theories, ideas, policies, strategies or plans
v. take up and practice as one's own
v. take into one's family"
enjoy a striking popularity,none
chic style,none
briefly speaking,none
be inclined to do sth.,none
win one's fame overnight,none
a double-edged sword,none
exert profound influence on ...,none
on the contrary,none
endeavor to do sth.,none
bridge the gap between A and B,none
lead a positive life,none
symbolically,"r. in a symbolic manner
r. by means of symbols"
illustrate,"v. depict with an illustration
v. supply with illustrations"
striker,"n. a forward on a soccer team
n. someone receiving intensive training for a naval technical rating
n. an employee on strike against an employer
n. the part of a mechanical device that strikes something"
defend,"v. argue or speak in defense of
v. be on the defensive; act against an attack
v. protect against a challenge or attack
v. be the defense counsel for someone in a trial"
insurmountable,a. not capable of being surmounted or overcome
predicament,n. a situation from which extrication is difficult especially an unpleasant or trying one
possess,"v. have as an attribute, knowledge, or skill
v. enter into and control, as of emotions or ideas"
self-confidence,n freedom from doubt; belief in yourself and your abilities
utmost,n. the greatest possible degree
significance,"n. the quality of being significant
n. a meaning that is not expressly stated but can be inferred"
encounter,n. a casual meeting with a person or thing
determine,"v. establish after a calculation, investigation, experiment, survey, or study
v. shape or influence; give direction to
v. fix conclusively or authoritatively
v. fix in scope; fix the boundaries of"
illustration,"n. artwork that helps make something clear or attractive
n. a visual representation (a picture or diagram) that is used make some subject more pleasing or easier to understand"
conquer,v. overcome by conquest
multiple,"n. the product of a quantity by an integer
a. having or involving or consisting of more than one part or entity or individual"
handicap,"n. advantage given to a competitor to equalize chances of winning
v. attempt to forecast the winner (especially in a horse race) and assign odds for or against a contestant
v. put at a disadvantage"
inspiration,"n. arousal of the mind to special unusual activity or creativity
n. a product of your creative thinking and work
n. a sudden intuition as part of solving a problem"
effectively,r. in actuality or reality or fact
overestimate,"n. an appraisal that is too high
n. a calculation that results in an estimate that is too high
v. make too high an estimate of"
underestimate,"n. an estimation that is too low; an estimate that is less than the true or actual value
v. make too low an estimate of"
in one's mind,none
fill up,none
in the face of,none
regardless of,none
there be bound to be,none
at critical times,none
play a role in sth.,none
play a role in doing sth.,none
turn failure into victory,none
be an inspiration to sb.,none
be confronted with sth.,none
stretch,"n. a large and unbroken expanse or distance
n. a straightaway section of a racetrack
n. exercise designed to extend the limbs and muscles to their full extent
n. extension to or beyond the ordinary limit"
entertain,"v. provide entertainment for
v. take into consideration, have in view"
ironic,s. characterized by often poignant difference or incongruity between what is expected and what actually is
isolate,"v. place or set apart
v. obtain in pure form
v. separate (experiences) from the emotions relating to them"
impressive,"a. making a strong or vivid impression
s. producing a strong effect"
metaphorical,s. expressing one thing in terms normally denoting another
portrayal,"n. a word picture of a person's appearance and character
n. acting the part of a character on stage; dramatically representing the character by speech and action and gesture"
subtly,r. in a subtle manner
reveal,v. disclose directly or through prophets
duality,"n. (physics) the property of matter and electromagnetic radiation that is characterized by the fact that some properties can be explained best by wave theory and others by particle theory
n. (geometry) the interchangeability of the roles of points and planes in the theorems of projective geometry"
interpersonal,s. occurring among or involving several people
register,"n. an official written record of names or events or transactions
n. (music) the timbre that is characteristic of a certain range and manner of production of the human voice or of different pipe organ stops or of different musical instruments
n. a book in which names and transactions are listed
n. (computer science) memory device that is the part of computer memory that has a specific address and that is used to hold information of a specific kind"
indulge,"v. give free rein to
v. enjoy to excess"
fictitious,"s formed or conceived by the imagination
s adopted in order to deceive"
reluctant,"s. disinclined to become involved
s. not eager"
approach,"n. ideas or actions intended to deal with a problem or situation
n. the act of drawing spatially closer to something
n. the event of one object coming closer to another
n. the temporal property of becoming nearer in time"
concentrate,"n. a concentrated form of a foodstuff; the bulk is reduced by removing water
n. a concentrated example of something
v. make denser, stronger, or purer
v. direct one's attention on something"
