cocaine,n. a narcotic (alkaloid) extracted from coca leaves; used as a surface anesthetic or taken for pleasure; can become powerfully addictive
verse,"n. a piece of poetry
n. a line of metrical text
v. compose verses or put into verse
v. familiarize through thorough study or experience"
prominent,"s having a quality that thrusts itself into attention
s conspicuous in position or importance"
series,"n. similar things placed in order or happening one after another
n. a periodical that appears at scheduled times
n. (sports) several contests played successively by the same teams
n. (electronics) connection of components in such a manner that current flows first through one and then through the other"
differentiate,"v. calculate a derivative; take the derivative
v. become different during development
v. become distinct and acquire a different character"
void,"n. an empty area or space
v. clear (a room, house, place) of occupants or empty or clear (a place or receptacle) of something
s. containing nothing"
affirm,"v. to declare or affirm solemnly and formally as true
v. say yes to"
consecutive,"s. in regular succession without gaps
r. in a consecutive manner"
overhear,"v hear, usually without the knowledge of the speakers"
behave,"v. behave in a certain manner
v. behave well or properly"
extensive,"s. large in spatial extent or range or scope or quantity
a. of agriculture; increasing productivity by using large areas with minimal outlay and labor"
sink,"n. plumbing fixture consisting of a water basin fixed to a wall or floor and having a drainpipe
n. (technology) a process that acts to absorb or remove energy or a substance from a system
v. fall or descend to a lower place or level
v. cause to sink"
eclipse,"n. one celestial body obscures another
v. cause an eclipse of (a celestial body) by intervention"
sophisticated,"a. having or appealing to those having worldly knowledge and refinement and savoir-faire
s. intellectually appealing"
inflation,"n. a general and progressive increase in prices
n. (cosmology) a brief exponential expansion of the universe (faster than the speed of light) postulated to have occurred shortly after the big bang
n. the act of filling something with air"
philosophy,"n. the rational investigation of questions about existence and knowledge and ethics
n. any personal belief about how to live or how to deal with a situation"
wreath,n. flower arrangement consisting of a circular band of foliage or flowers for ornamental purposes
dine,"v. have supper; eat dinner
v. give dinner to; host for dinner"
suspicion,"n. the state of being suspected
n. being of a suspicious nature"
complicate,"v. make more complicated
v. make more complex, intricate, or richer"
infant,n a very young child (birth to 1 year) who has not yet begun to walk or talk
excursion,n. a journey taken for pleasure
fraction,"n. a component of a mixture that has been separated by a fractional process
n. a small part or item forming a piece of a whole
n. the quotient of two rational numbers"
enthusiasm,"n. a feeling of excitement
n. a lively interest"
fulfill,"v put in effect
v meet the requirements or expectations of
v fill or meet a want or need"
discriminate,"v. recognize or perceive the difference
v. treat differently on the basis of sex or race
v. distinguish
a. marked by the ability to see or make fine distinctions"
simply,r. absolutely; altogether; really
exclaim,"v. utter aloud; often with surprise, horror, or joy"
passion,"n. a strong feeling or emotion
n. a feeling of strong sexual desire
n. the suffering of Jesus at the Crucifixion"
morality,n. concern with the distinction between good and evil or right and wrong; right or good conduct
competent,"a. properly or sufficiently qualified or capable or efficient
s. adequate for the purpose
a. legally qualified or sufficient"
ideology,n. imaginary or visionary theorization
drift,"n. a force that moves something along
n. the gradual departure from an intended course due to external influences (as a ship or plane)
n. a process of linguistic change over a period of time
n. a large mass of material that is heaped up by the wind or by water currents"
summarize,v. be a summary of
parade,"n. a ceremonial procession including people marching
n. an extended (often showy) succession of persons or things
n. a visible display
v. walk ostentatiously"
echo,"n. the repetition of a sound resulting from reflection of the sound waves
n. (Greek mythology) a nymph who was spurned by Narcissus and pined away until only her voice remained
n. a reply that repeats what has just been said
n. a reflected television or radio or radar beam"
scorn,"n lack of respect accompanied by a feeling of intense dislike
n open disrespect for a person or thing
v look down on with disdain
v reject with contempt"
realistic,"a. aware or expressing awareness of things as they really are
a. of or relating to the philosophical doctrine of realism"
mysterious,s. having an import not apparent to the senses nor obvious to the intelligence; beyond ordinary understanding
slogan,n a favorite saying of a sect or political group
tuition,n. a fee paid for instruction (especially for higher education)
namely,r. as follows
program,"n. a system of projects or services intended to meet a public need
n. an announcement of the events that will occur as part of a theatrical or sporting event
n. (computer science) a sequence of instructions that a computer can interpret and execute
n. a performance (or series of performances) at a public presentation"
hijack,"n. seizure of a vehicle in transit either to rob it or divert it to an alternate destination
v. seize control of"
ignite,v. cause to start burning; subject to fire or great heat
ignorant,"s. uneducated in general; lacking knowledge or sophistication
s. uneducated in the fundamentals of a given art or branch of learning; lacking knowledge of a specific field
s. unaware because of a lack of relevant information or knowledge"
retain,"v. hold back within
v. allow to remain in a place or position or maintain a property or feature
v. secure and keep for possible future use or application
v. keep in one's mind"
disperse,"v. to cause to separate and go in different directions
v. move away from each other; 
v. separate (light) into spectral rays"
rotate,"v. exchange on a regular basis
v. perform a job or duty on a rotating basis
v. cause to turn on an axis or center"
bore,"n. a person who evokes boredom
n. diameter of a tube or gun barrel
n. a hole or passage made by a drill; usually made for exploratory purposes
v. cause to be bored"
trivial,s. concerned with trivialities
steer,"v. direct the course; determine the direction of travelling
v. direct (oneself) somewhere"
bosom,"n. the chest considered as the place where secret thoughts are kept
n. a person's breast or chest
n. cloth that covers the chest or breasts
v. hide in one's bosom"
rotten,s. having decayed or disintegrated; usually implies foulness
equation,"n. a mathematical statement that two expressions are equal
n. the act of regarding as equal"
cathedral,"n. any large and important church
n. the principal Christian church building of a bishop's diocese
a. relating to or containing or issuing from a bishop's office or throne"
massive,"s. imposing in size or bulk or solidity
s. being the same substance throughout
s. imposing in scale or scope or degree or power
s. consisting of great mass; containing a great quantity of matter"
impose,"v compel to behave in a certain way
v impose something unpleasant
v impose and collect"
sack,"n. a bag made of paper or plastic for holding customer's purchases
n. the quantity contained in a sack
n. any of various light dry strong white wine from Spain and Canary Islands (including sherry)
n. a woman's full loose hiplength jacket"
overlap,"n. a representation of common ground between theories or phenomena
n. the property of partial coincidence in time
v. coincide partially or wholly
v. extend over and cover a part of"
descendant,"n. a person considered as descended from some ancestor or race
s. going or coming down
s. proceeding by descent from an ancestor"
gulf,"n. an arm of a sea or ocean partly enclosed by land; larger than a bay
n. an unbridgeable disparity (as from a failure of understanding)
n. a deep wide chasm"
sue,n. French writer whose novels described the sordid side of city life (1804-1857)
disposition,"n. your usual mood
n. a natural or acquired habit or characteristic tendency in a person or thing"
savage,"n. a member of an uncivilized people
v. attack brutally and fiercely
v. criticize harshly or violently"
tactic,n. a plan for attaining a particular goal
scent,"n. an odor left in passing by which a person or animal can be traced
v. catch the scent of; get wind of"
check,"n. a written order directing a bank to pay money
n. the bill in a restaurant
n. the act of inspecting or verifying
n. a mark left after a small piece has been chopped or broken off of something"
scrape,"n. a harsh noise made by scraping
n. a deep bow with the foot drawn backwards (indicating excessive humility)
v. scratch repeatedly
v. make by scraping"
cellar,n. storage space where wines are stored
denial,"n. the act of refusing to comply (as with a request)
n. the act of asserting that something alleged is not true
n. (psychiatry) a defense mechanism that denies painful thoughts"
gut,"n. a narrow channel or strait
v. empty completely; destroy the inside of
v. remove the guts of"
appearance,"n. outward or visible aspect of a person or thing
n. the event of coming into sight
n. formal attendance (in court or at a hearing) of a party in an action
n. a mental representation"
prophet,"n. an authoritative person who divines the future
n. someone who speaks by divine inspiration; someone who is an interpreter of the will of God"
proposition,"n. (logic) a statement that affirms or denies something and is either true or false
n. an offer for a private bargain (especially a request for sexual favors)
n. a task to be dealt with
v. suggest sex to"
exclude,"v. prevent from being included or considered or accepted
v. prevent from entering; shut out
v. lack or fail to include"
brisk,"v. become brisk
s. very active"
ingredient,"n. a component of a mixture or compound
n. food that is a component of a mixture in cooking"
artistic,"a. relating to or characteristic of art or artists
s. satisfying aesthetic standards and sensibilities"
reassure,"v. cause to feel sure; give reassurance to
v. give or restore confidence in; cause to feel sure or certain"
rebellion,"n. refusal to accept some authority or code or convention
n. organized opposition to authority; a conflict in which one faction tries to wrest control from another"
chill,"n. coldness due to a cold environment
n. a sensation of cold that often marks the start of an infection and the development of a fever
n. a sudden numbing dread
v. depress or discourage"
obstacle,"n. something immaterial that stands in the way and must be circumvented or surmounted
n. an obstruction that stands in the way (and must be removed or surmounted or circumvented)"
reconcile,v. come to terms
generate,"v. bring into existence
v. produce (energy)"
climax,"n. the highest point of anything conceived of as growing or developing or unfolding
n. the decisive moment in a novel or play
n. the most severe stage of a disease
n. arrangement of clauses in ascending order of forcefulness"
clothe,v. cover as if with clothing
deputy,"n. someone authorized to exercise the powers of sheriff in emergencies
n. an assistant with power to act when his superior is absent
n. a member of the lower chamber of a legislative assembly (such as in France)
n. a person appointed to represent or act on behalf of others"
concise,a. expressing much in few words
momentum,"n. an impelling force or strength
n. the product of a body's mass and its velocity"
conviction,"n. an unshakable belief in something without need for proof or evidence
n. (criminal law) a final judgment of guilty in a criminal case and the punishment that is imposed"
sample,"n. a small part of something intended as representative of the whole
n. all or part of a natural object that is collected and preserved as an example of its class
v. take a sample of"
refund,"n. money returned to a payer
n. the act of returning money received previously
v. pay back"
approval,"n. a feeling of liking something or someone good
n. acceptance as satisfactory
n. a message expressing a favorable opinion"
turbulent,"s characterized by unrest or disorder or insubordination
s (of a liquid) agitated vigorously; in a state of turbulence"
deck,"n. any of various platforms built into a vessel
n. street name for a packet of illegal drugs
n. a porch that resembles the deck on a ship
v. be beautiful to look at"
proceed,"v. move ahead; travel onward in time or space
v. follow a certain course"
deficiency,"n the state of needing something that is absent or unavailable
n lack of an adequate quantity or number"
sector,"n. a plane figure bounded by two radii and the included arc of a circle
n. a social group that forms part of the society or the economy
n. a particular aspect of life or activity
n. the minimum track length that can be assigned to store information; unless otherwise specified a sector of data consists of 512 bytes"
defect,"n. an imperfection in a bodily system
n. a failing or deficiency
n. an imperfection in an object or machine
v. desert (a cause, a country or an army), often in order to join the opposing cause, country, or army"
arrange,"v. put into a proper or systematic order
v. make arrangements for
v. adapt for performance in a different way
v. arrange thoughts, ideas, temporal events"
confer,"v. have a conference in order to talk something over
v. present"
destiny,"n. an event (or a course of events) that will inevitably happen in the future
n. the ultimate agency regarded as predetermining the course of events (often personified as a woman)"
hamper,"n. a basket usually with a cover
v. prevent the progress or free movement of"
removal,"n. the act of removing
n. dismissal from office"
specialize,"v. become more focus on an area of activity or field of study
v. suit to a special purpose
v. devote oneself to a special area of work"
renew,"v reestablish on a new, usually improved, basis or make new or like new
v cause to appear in a new form"
likewise,"r in like or similar manner
r in addition
r equally"
attorney,n a professional person authorized to practice law; conducts lawsuits or gives legal advice
repetition,"n. the act of doing or performing again
n. the repeated use of the same word or word pattern as a rhetorical device"
characterize,v. be characteristic of
immigrant,n. a person who comes to a country where they were not born in order to settle there
repression,"n. a state of forcible subjugation
n. (psychiatry) the classical defense mechanism that protects you from impulses or ideas that would cause anxiety by preventing them from becoming conscious
n. the act of repressing; control by holding down"
inherent,"s existing as an essential constituent or characteristic
s in the nature of something though not readily apparent"
vicious,"s (of persons or their actions) able or disposed to inflict pain or suffering
s having the nature of vice
s bringing or deserving severe rebuke or censure
s marked by deep ill will; deliberately harmful"
retort,"n. a vessel where substances are distilled or decomposed by heat
v. answer back"
stake,"n. instrument of execution consisting of a vertical post that a victim is tied to for burning
n. the money risked on a gamble
n. a strong wooden or metal post with a point at one end so it can be driven into the ground
v. mark with a stake"
rim,"n. the shape of a raised edge of a more or less circular object
n. (basketball) the hoop from which the net is suspended
n. the outer part of a wheel to which the tire is attached
v. run around the rim of"
controversy,n. a contentious speech act; a dispute where there is strong disagreement
romance,"n. the group of languages derived from Latin
n. a novel dealing with idealized events remote from everyday life
v. have a love affair with
v. tell romantic or exaggerated lies"
establish,"v. set up or found
v. set up or lay the groundwork for
v. bring about
v. use as a basis for; found on"
dew,n. water that has condensed on a cool surface overnight from water vapor in the air
infect,"v. communicate a disease to
v. contaminate with a disease or microorganism
v. corrupt with ideas or an ideology
v. affect in a contagious way"
diagnose,"v. determine or distinguish the nature of a problem or an illness through a diagnostic analysis
v. subject to a medical analysis"
confidence,"n. a feeling of trust (in someone or something)
n. a state of confident hopefulness that events will be favorable
n. a trustful relationship
n. a secret that is confided or entrusted to another"
rumor,"n. gossip (usually a mixture of truth and untruth) passed around by word of mouth
v. tell or spread rumors"
illusion,"n. an erroneous mental representation
n. something many people believe that is false"
gasp,n. a short labored intake of breath with the mouth open
acquire,"v. locate (a moving entity) by means of a tracking system such as radar
v. win something through one's efforts"
rural,"a. living in or characteristic of farming or country life
a. of or relating to the countryside as opposed to the city"
neglect,"n. the state of something that has been unused and neglected
v. leave undone or leave out
v. fail to attend to
v. give little or no attention to"
skeleton,"n. something reduced to its minimal form
n. a scandal that is kept secret
n. the internal supporting structure that gives an artifact its shape"
trace,"n. a just detectable amount
n. an indication that something has been present
n. either of two lines that connect a horse's harness to a wagon or other vehicle or to a whiffletree
n. a visible mark (as a footprint) left by the passage of person or animal or vehicle"
sketch,"n. preliminary drawing for later elaboration
n. a brief literary description
n. short descriptive summary (of events)
v. make a sketch of"
propose,"v. make a proposal, declare a plan for something
v. ask (someone) to marry you"
extravagant,s. recklessly wasteful
faithful,"n. any loyal and steadfast following
a. steadfast in affection or allegiance
a. not having sexual relations with anyone except your husband or wife, or your boyfriend or girlfriend"
reluctant,"s. disinclined to become involved
s. not eager"
assist,"n. (sports) the act of enabling another player to make a good play
v. act as an assistant in a subordinate or supportive function"
foul,"n. an act that violates the rules of a sport
v. hit a foul ball
v. commit a foul; break the rules
v. spot, stain, or pollute"
oblige,"v. bind by an obligation; cause to be indebted
v. provide a service or favor for someone"
slender,"s. being of delicate or slender build
s. very narrow
s. having little width in proportion to the length or height
s. small in quantity"
operational,"a. pertaining to a process or series of actions for achieving a result
a. (military) of or intended for or involved in military operations
s. being in effect or operation"
verge,"n. the limit beyond which something happens or changes
n. a grass border along a road
v. border on; come close to"
stress,"n. the relative prominence of a syllable or musical note (especially with regard to stress or pitch)
n. special emphasis attached to something
n. difficulty that causes worry or emotional tension
n. (physics) force that produces strain on a physical body"
slipper,n. low footwear that can be slipped on and off easily; usually worn indoors
clip,"n. any of various small fasteners used to hold loose articles together
n. an article of jewelry that can be clipped onto a hat or dress
n. the act of clipping or snipping
n. a sharp slanting blow"
dispose,"v. give, sell, or transfer to another
v. make receptive or willing towards an action or attitude or belief
v. place or put in a particular order"
sociable,"n. a party of people assembled to promote sociability and communal activity
a. inclined to or conducive to companionship with others
s. friendly and pleasant"
issue,"n. an important question that is in dispute and must be settled
n. one of a series published periodically
n. the act of providing an item for general use or for official purposes (usually in quantity)
n. supplies (as food or clothing or ammunition) issued by the government"
versatile,"s. having great diversity or variety
s. changeable or inconstant
s. competent in many areas and able to turn with ease from one thing to another
s. able to move freely in all directions"
republican,"n. a member of the Republican Party
n. an advocate of a republic (usually in opposition to a monarchy)
n. a tributary of the Kansas River that flows from eastern Colorado eastward through Nebraska and Kansas
a. relating to or belonging to the Republican Party"
prey,"n. a person who is the aim of an attack (especially a victim of ridicule or exploitation) by some hostile person or influence
n. animal hunted or caught for food
v. profit from in an exploitatory manner"
betray,"v. reveal unintentionally
v. deliver to an enemy by treachery"
ego,"n. an inflated feeling of pride in your superiority to others
n. (psychoanalysis) the conscious mind"
spill,"n. liquid that is spilled
n. the act of allowing a fluid to escape
n. a sudden drop from an upright position
v. cause or allow (a liquid substance) to run or flow from a container"
feat,n. a notable achievement
sprinkle,"n. the act of sprinkling or splashing water
v. cause (a liquid) to spatter about, especially with force
v. rain gently
v. scatter with liquid; wet lightly"
conscious,"s. intentionally conceived
a. knowing and perceiving; having awareness of surroundings and sensations and thoughts
s. (followed by `of') showing realization or recognition of something"
synthetic,"n. a compound made artificially by chemical reactions
a. involving or of the nature of synthesis (combining separate elements to form a coherent whole) as opposed to analysis
a. systematic combining of root and modifying elements into single words
a. of a proposition whose truth value is determined by observation or facts"
fruitful,a. productive or conducive to producing in abundance
furious,"s marked by extreme and violent energy
s marked by extreme anger
s (of the elements) as if showing violent anger"
uncover,"v. make visible
v. remove all or part of one's clothes to show one's body"
profession,"n. the body of people in a learned occupation
n. an occupation requiring special education (especially in the liberal arts or sciences)
n. an open avowal (true or false) of some belief or opinion
n. affirmation of acceptance of some religion or faith"
character,"n. the inherent complex of attributes that determines a persons moral and ethical actions and reactions
n. an actor's portrayal of someone in a play
n. a person of a specified kind (usually with many eccentricities)
n. good repute"
appreciate,"v. recognize with gratitude; be grateful for
v. be fully aware of; realize fully
v. gain in value
v. increase the value of"
literally,"r. in a literal sense
r. (intensifier before a figurative expression) without exaggeration"
criticism,"n. disapproval expressed by pointing out faults or shortcomings
n. a serious examination and judgment of something
n. a written evaluation of a work of literature"
gasoline,n. a volatile flammable mixture of hydrocarbons (hexane and heptane and octane etc.) derived from petroleum; used mainly as a fuel in internal-combustion engines
presence,"n. the state of being present; current existence
n. the immediate proximity of someone or something
n. an invisible spiritual being felt to be nearby
n. the impression that something is present"
opportunity,n. a possibility due to a favorable combination of circumstances
wagon,"n. any of various kinds of wheeled vehicles drawn by an animal or a tractor
n. a child's four-wheeled toy cart sometimes used for coasting"
retreat,"n. (military) withdrawal of troops to a more favorable position to escape the enemy's superior forces or after a defeat
n. a place of privacy; a place affording peace and quiet
n. (military) a signal to begin a withdrawal from a dangerous position
n. (military) a bugle call signaling the lowering of the flag at sunset"
patch,"n. a piece of cloth used as decoration or to mend or cover a hole
n. a short set of commands to correct a bug in a computer program
v. to join or unite the pieces of
v. provide with a patch; also used metaphorically"
gaze,"n. a long fixed look
v. look at with fixed eyes"
slaughter,"n. the killing of animals (as for food)
n. the savage and excessive killing of many people"
harassment,"n. a feeling of intense annoyance caused by being tormented
n. the act of tormenting by continued persistent attacks and criticism"
intuition,"n. instinctive knowing (without the use of rational processes)
n. an impression that something might be the case"
jewel,"n. a precious or semiprecious stone incorporated into a piece of jewelry
n. a person who is as brilliant and precious as a piece of jewelry"
orthodox,"a. of or pertaining to or characteristic of Judaism
a. adhering to what is commonly accepted
a. of or relating to or characteristic of the Eastern Orthodox Church"
gear,"n. a toothed wheel that engages another toothed mechanism in order to change the speed or direction of transmitted motion
n. a mechanism for transmitting motion for some specific purpose (as the steering gear of a vehicle)
n. equipment consisting of miscellaneous articles needed for a particular operation or sport etc.
v. set the level or character of"
