shoot,"n. a new branch
n. the act of shooting at targets
v. hit with a missile from a weapon
v. kill by firing a missile"
regulate,"v. fix or adjust the time, amount, degree, or rate of
v. bring into conformity with rules or principles or usage; impose regulations"
bleak,s. unpleasantly cold and damp
bind,"n. something that hinders as if with bonds
v. create social or emotional ties
v. make fast; tie or secure, with or as if with a rope
v. wrap around with something so as to cover or enclose"
projector,"n. an optical device for projecting a beam of light
n. an optical instrument that projects an enlarged image onto a screen"
sphere,"n. a particular environment or walk of life
n. any spherically shaped artifact
n. the geographical area in which one nation is very influential
n. a solid figure bounded by a spherical surface (including the space it encloses)"
verdict,n. (law) the findings of a jury on issues of fact submitted to it for decision; can be used in formulating a judgment
blade,"n. especially a leaf of grass or the broad portion of a leaf as distinct from the petiole
n. a dashing young man
n. something long and thin resembling a blade of grass
n. a cut of beef from the shoulder blade"
underlying,s. located beneath or below
feminine,"n. a gender that refers chiefly (but not exclusively) to females or to objects classified as female
a. associated with women and not with men
a. of grammatical gender
s. (music or poetry) ending on an unaccented beat or syllable"
exhaust,"n. gases ejected from an engine as waste products
n. system consisting of the parts of an engine through which burned gases or steam are discharged
v. wear out completely
v. use up the whole supply of"
poverty,n. the state of having little or no money and few or no material possessions
portfolio,"n. a large, flat, thin case for carrying loose papers or drawings or maps; usually leather
n. a set of pieces of creative work collected to be shown to potential customers or employers
n. a list of the financial assets held by an individual or a bank or other financial institution
n. the role of the head of a government department"
priority,n. preceding in time
composite,"n. considered the most highly evolved dicotyledonous plants, characterized by florets arranged in dense heads that resemble single flowers
s. consisting of separate interconnected parts
a. of or relating to or belonging to the plant family Compositae"
resume,"v. take up or begin anew
v. return to a previous location or condition
v. assume anew"
fertile,a. capable of reproducing
pronoun,n. a function word that is used in place of a noun or noun phrase
counsel,"n a lawyer who pleads cases in court
n something that provides direction or advice as to a decision or course of action
v give advice to"
intimate,"v. give to understand
s. marked by close acquaintance, association, or familiarity
s. involved in a sexual relationship
s. thoroughly acquainted through study or experience"
royalty,"n. payment to the holder of a patent or copyright or resource for the right to use their property
n. royal persons collectively"
applaud,"v. clap one's hands or shout after performances to indicate approval
v. express approval of"
undergraduate,n. a university student who has not yet received a first degree
disorder,"n. a physical condition in which there is a disturbance of normal functioning
n. a disturbance of the peace or of public order
v. bring disorder to"
rub,"n. the act of rubbing or wiping
v. move over something with pressure
v. cause friction
v. scrape or rub as if to relieve itching"
inclusive,a. including much or everything; and especially including stated limits
implicit,"a. implied though not directly expressed; inherent in the nature of something
s. being without doubt or reserve"
propaganda,n. information that is spread for the purpose of promoting some cause
gauge,"n. a measuring instrument for measuring and indicating a quantity such as the thickness of wire or the amount of rain etc.
n. accepted or approved instance or example of a quantity or quality against which others are judged or measured or compared
n. the distance between the rails of a railway or between the wheels of a train
n. the thickness of wire"
crisis,"n. an unstable situation of extreme danger or difficulty
n. a crucial stage or turning point in the course of something"
profound,"a. showing intellectual penetration or emotional depth
s. of the greatest intensity; complete
s. coming from deep within one
s. situated at or extending to great depth; too deep to have been sounded or plumbed"
panel,"n. sheet that forms a distinct (usually flat and rectangular) section or component of something
n. (law) a group of people summoned for jury service (from whom a jury will be chosen)
n. a group of people gathered for a special purpose as to plan or discuss an issue or judge a contest etc
n. a soft pad placed under a saddle"
marine,"n. a member of the United States Marine Corps
n. a soldier who serves both on shipboard and on land
a. of or relating to the sea
a. of or relating to military personnel who serve both on land and at sea (specifically the U.S. Marine Corps)"
structure,"n. a thing constructed; a complex entity constructed of many parts
n. the manner of construction of something and the arrangement of its parts
n. the complex composition of knowledge as elements and their combinations
n. a particular complex anatomical part of a living thing"
simultaneous,s occurring or operating at the same time
indispensable,"a. not to be dispensed with; essential
s. unavoidable"
disgust,"n. strong feelings of dislike
v. fill with distaste
v. cause aversion in; offend the moral sense of"
porch,n. a structure attached to the exterior of a building often forming a covered entrance
discern,v detect with the senses
swamp,"n. low land that is seasonally flooded; has more woody plants than a marsh and better drainage than a bog
n. a situation fraught with difficulties and imponderables
v. drench or submerge or be drenched or submerged"
fluctuate,"v. cause to fluctuate or move in a wavelike pattern
v. move or sway in a rising and falling or wavelike pattern
v. be unstable"
voltage,n. the rate at which energy is drawn from a source that produces a flow of electricity in a circuit; expressed in volts
skeptical,"s denying or questioning the tenets of especially a religion
s marked by or given to doubt"
inspiration,"n. arousal of the mind to special unusual activity or creativity
n. a product of your creative thinking and work
n. a sudden intuition as part of solving a problem"
displace,"v. cause to move, usually with force or pressure
v. terminate the employment of; discharge from an office or position"
flush,"n. a poker hand with all 5 cards in the same suit
n. a sudden rapid flow (as of water)
v. flow freely
v. glow or cause to glow with warm color or light"
undoubtedly,r. without doubt; certainly
thumb,"n. the thick short innermost digit of the forelimb
n. the part of a glove that provides a covering for the thumb"
ruby,"n. a transparent piece of ruby that has been cut and polished and is valued as a precious gem
n. a transparent deep red variety of corundum; used as a gemstone and in lasers"
foam,"n. a mass of small bubbles formed in or on a liquid
n. a lightweight material in cellular form; made by introducing gas bubbles during manufacture
v. become bubbly or frothy or foaming"
skilled,a. having or showing or requiring special skill
rug,n. floor covering consisting of a piece of thick heavy fabric (usually with nap or pile)
scramble,"n. an unceremonious and disorganized struggle
v. to move hurriedly
v. bring into random order
v. make unintelligible"
spiral,"n. a plane curve traced by a point circling about the center but at increasing distances from the center
n. a continuously accelerating change in the economy
n. ornament consisting of a curve on a plane that winds around a center with an increasing distance from the center
n. flying downward in a helical path with a large radius"
interact,v. act together or towards others or with others
disposal,"n. the power to use something or someone
n. the act or means of getting rid of something
n. a kitchen appliance for disposing of garbage"
preferable,s. more desirable than another
consumption,"n. the process of taking food into the body through the mouth (as by eating)
n. (economics) the utilization of economic goods to satisfy needs or in manufacturing
n. the act of consuming something"
scrap,"n. a small piece of something that is left over after the rest has been used
v. make into scrap or refuse"
volt,n. a unit of potential equal to the potential difference between two points on a conductor carrying a current of 1 ampere when the power dissipated between the two points is 1 watt; equivalent to the potential difference across a resistance of 1 ohm when 1 ampere of current flows through it
miserable,"s. very unhappy; full of misery
s. characterized by physical misery"
inject,"v. give an injection to
v. to introduce (a new aspect or element)
v. force or drive (a fluid or gas) into by piercing
v. take by injection"
earnest,"n. something of value given by one person to another to bind a contract
s. characterized by a firm and humorless belief in the validity of your opinions"
fore,"a. situated at or toward the bow of a vessel
r. near or toward the bow of a ship or cockpit of a plane"
aspect,"n. a distinct feature or element in a problem
n. a characteristic to be considered
n. the beginning or duration or completion or repetition of the action of a verb"
comparison,"n. the act of examining resemblances
n. relation based on similarities and differences
n. qualities that are comparable"
ebb,"n. a gradual decline (in size or strength or power or number)
n. the outward flow of the tide
v. flow back or recede"
snowstorm,n a storm with widespread snowfall accompanied by strong winds
reward,"n. payment made in return for a service rendered
n. an act performed to strengthen approved behavior
n. the offer of money for helping to find a criminal or for returning lost property
v. act or give recompense in recognition of someone's behavior or actions"
ventilate,"v. expose to the circulation of fresh air so as to retard spoilage
v. circulate through and freshen
v. furnish with an opening to allow air to circulate or gas to escape"
syndrome,"n. a complex of concurrent things
n. a pattern of symptoms indicative of some disease"
synthesis,"n. the process of producing a chemical compound (usually by the union of simpler chemical compounds)
n. the combination of ideas into a complex whole"
flourish,"n. a showy gesture
n. an ornamental embellishment in writing
n. a display of ornamental speech or language
n. the act of waving"
shrewd,"s marked by practical hardheaded intelligence
s used of persons"
velocity,n distance travelled per unit time
zinc,"n. a bluish-white lustrous metallic element; brittle at ordinary temperatures but malleable when heated; used in a wide variety of alloys and in galvanizing iron; it occurs naturally as zinc sulphide in zinc blende
v. coat or cover with zinc"
enclosure,"n. a structure consisting of an area that has been enclosed for some purpose
n. the act of enclosing something inside something else
n. a naturally enclosed space
n. something (usually a supporting document) that is enclosed in an envelope with a covering letter"
layout,"n. a plan or design of something that is laid out
n. the act of laying out (as by making plans for something)"
contribution,"n. the part played by a person in bringing about a result
n. a voluntary gift (as of money or service or ideas) made to some worthwhile cause
n. act of giving in common with others for a common purpose especially to a charity
n. an amount of money contributed"
gang,"n. an association of criminals
n. an organized group of workmen
n. tool consisting of a combination of implements arranged to work together
v. act as an organized group"
soak,"n. the process of becoming softened and saturated as a consequence of being immersed in water (or other liquid)
n. washing something by allowing it to soak
v. submerge in a liquid
v. beat severely"
comparative,"n. the comparative form of an adjective or adverb
a. relating to or based on or involving comparison"
integrity,"n. an undivided or unbroken completeness or totality with nothing wanting
n. moral soundness"
encyclopedia,n. a reference work (often in several volumes) containing articles on various topics (often arranged in alphabetical order) dealing with the entire range of human knowledge or with some particular specialty
porcelain,n. ceramic ware made of a more or less translucent ceramic
brim,"n. the top edge of a vessel or other container
n. a circular projection that sticks outward from the crown of a hat
v. be completely full
v. fill as much as possible"
subtract,"v. make a subtraction
v. take off or away"
engagement,"n. employment for performers or performing groups that lasts for a limited period of time
n. contact by fitting together
n. the act of sharing in the activities of a group"
cultivate,"v. foster the growth of
v. prepare for crops"
remains,n. any object that is left unused or still extant
brittle,"n. caramelized sugar cooled in thin sheets
s. having little elasticity; hence easily cracked or fractured or snapped
s. lacking warmth and generosity of spirit
s. (of metal or glass) not annealed and consequently easily cracked or fractured"
remarkable,s. unusual or striking
affect,"n. the conscious subjective aspect of feeling or emotion
v. have an effect upon
v. act physically on; have an effect upon
v. have an emotional or cognitive impact upon"
proposal,"n. something proposed (such as a plan or assumption)
n. the act of making a proposal"
subway,"n an electric railway operating below the surface of the ground (usually in a city)
n an underground tunnel or passage enabling pedestrians to cross a road or railway"
spite,"n feeling a need to see others suffer
n malevolence by virtue of being malicious or spiteful or nasty
v hurt the feelings of"
cemetery,n. a tract of land used for burials
linguistic,"a. consisting of or related to language
a. of or relating to the scientific study of language"
grieve,"v. feel grief
v. cause to feel sorrow"
saturate,"v. cause (a chemical compound, vapour, solution, magnetic material) to unite with the greatest possible amount of another substance"
sauce,"n. flavorful relish or dressing or topping served as an accompaniment to food
v. behave saucily or impudently towards
v. dress (food) with a relish
v. add zest or flavor to, make more interesting"
considerable,a. large or relatively large in number or amount or extent or degree
discard,"n. anything that is cast aside or discarded
n. (cards) the act of throwing out a useless card or of failing to follow suit
n. getting rid something that is regarded as useless or undesirable
v. throw or cast away"
beneficial,s. promoting or enhancing well-being
distinct,"s. (often followed by `from') not alike; different in nature or quality
a. easy to perceive; especially clearly outlined
s. recognizable; marked"
relativity,"n. (physics) the theory that space and time are relative concepts rather than absolute concepts
n. the quality of being relative and having significance only in relation to something else"
distress,"n. psychological suffering
n. a state of adversity (danger or affliction or need)
n. extreme physical pain
n. the seizure and holding of property as security for payment of a debt or satisfaction of a claim"
breach,"n. a failure to perform some promised act or obligation
n. an opening (especially a gap in a dike or fortification)"
stern,"n. the rear part of a ship
n. United States concert violinist (born in Russia in 1920)
s. severe and unremitting in making demands"
enclose,"v. close in; darkness enclosed him""
v. surround completely"
commission,"n. a fee for services rendered based on a percentage of an amount received or collected or agreed to be paid (as distinguished from a salary)
n. the act of granting authority to undertake certain functions
n. the state of being in good working order and ready for operation
n. a formal statement of a command or injunction to do something"
reciprocal,"n. something (a term or expression or concept) that has a reciprocal relation to something else
a. concerning each of two or more persons or things; especially given or done in return
s. of or relating to the multiplicative inverse of a quantity or function"
endow,"v. give qualities or abilities to
v. furnish with an endowment"
deteriorate,v. become worse or disintegrate
illustrate,"v. depict with an illustration
v. supply with illustrations"
flock,"n. a church congregation guided by a pastor
n. a group of birds
n. a group of sheep or goats
v. move as a crowd or in a group"
parachute,n. rescue equipment consisting of a device that fills with air and retards your fall
deviate,"v. turn aside; turn away from
v. be at variance with; be out of line with
v. cause to turn away from a previous or expected course"
geology,n. a science that deals with the history of the earth as recorded in rocks
devil,"n. an evil supernatural being
n. a word used in exclamations of confusion
v. coat or stuff with a spicy paste"
notion,"n. a general inclusive concept
n. an odd or fanciful or capricious idea
n. (usually plural) small personal articles or clothing or sewing items"
transfer,"n. someone who transfers or is transferred from one position to another
n. the act of transfering something from one form to another
n. a ticket that allows a passenger to change conveyances
n. application of a skill learned in one situation to a different but similar situation"
giant,"n. any creature of exceptional size
n. an unusually large enterprise
n. a very large person; impressive in size or qualities
n. someone or something that is abnormally large and powerful"
overall,"n. (usually plural) work clothing consisting of denim trousers (usually with a bib and shoulder straps)
n. a loose protective coverall or smock worn over ordinary clothing for dirty work
s. involving only main features
s. including everything"
misery,"n. a state of ill-being due to affliction or misfortune
n. a feeling of intense unhappiness"
extinct,"a. no longer in existence; lost or especially having died out leaving no living representatives
a. (of e.g. volcanos) permanently inactive
s. being out or having grown cold"
forge,"n. furnace consisting of a special hearth where metal is heated before shaping
n. a workplace where metal is worked by heating and hammering
v. create by hammering
v. make a copy of with the intent to deceive"
heir,n. a person who is entitled by law or by the terms of a will to inherit the estate of another
assume,"v. take to be the case or to be true; accept without verification or proof
v. take on titles, offices, duties, responsibilities
v. take on a certain form, attribute, or aspect
v. occupy or take on"
chin,"n. the protruding part of the lower jaw
v. raise oneself while hanging from one's hands until one's chin is level with the support bar"
insult,n. a deliberately offensive act or something producing the effect of deliberate disrespect
staircase,n a way of access (upward and downward) consisting of a set of steps
monetary,a. relating to or involving money
productivity,n. (economics) the ratio of the quantity and quality of units produced to the labor per unit of time
complaint,"n. (formerly) a loud cry (or repeated cries) of pain or rage or sorrow
n. an expression of grievance or resentment
n. (civil law) the first pleading of the plaintiff setting out the facts on which the claim for relief is based"
hysterical,s. marked by excessive or uncontrollable emotion
suppress,"v. to put down by force or authority
v. put out of one's consciousness
v. reduce the incidence or severity of or stop"
despair,"n. a state in which all hope is lost or absent
n. the feeling that everything is wrong and nothing will turn out well
v. abandon hope; give up hope; lose heart"
clergy,"n. in Christianity, clergymen collectively (as distinguished from the laity)"
idle,"n. the state of an engine or other mechanism that is idling
v. run disconnected or idle
v. be idle; exist in a changeless situation
a. not in action or at work"
maintain,v. state or assert
infectious,"s. caused by infection or capable of causing infection
a. easily spread; children catch it from their elders""- Bertrand Russell
a. of or relating to infection"
interference,n. (American football) blocking a player's path with your body
fertilizer,n. any substance such as manure or a mixture of nitrates used to make soil more fertile
darling,"n. a special loved one
n. an Australian river; tributary of the Murray River"
hemisphere,"n. half of the terrestrial globe
n. half of a sphere
n. either half of the cerebrum"
intact,"s. (of a woman) having the hymen unbroken
s. undamaged in any way"
daunt,v. cause to lose courage
feudal,a. of or relating to or characteristic of feudalism
layoff,n. the act of laying off an employee or a work force
stalk,"n. a slender or elongated structure that supports a plant or fungus or a plant part or plant organ
n. a hunt for game carried on by following it stealthily or waiting in ambush
n. the act of following prey stealthily
n. a stiff or threatening gait"
legacy,n (law) a gift of personal property by will
decimal,"n. a number in the decimal system
s. numbered or proceeding by tens; based on ten"
circular,"n. an advertisement (usually printed on a page or in a leaflet) intended for wide distribution
s. describing a circle; moving in a circle"
stall,"n. a compartment in a stable where a single animal is confined and fed
n. a booth where articles are displayed for sale
n. a malfunction in the flight of an aircraft in which there is a sudden loss of lift that results in a downward plunge
n. seating in the forward part of the main level of a theater"
offspring,"n. the immediate descendants of a person
n. something that comes into existence as a result"
patron,"n. a regular customer
n. the proprietor of an inn
n. someone who supports or champions something"
grant,"n. any monetary aid
n. the act of providing a subsidy
n. (law) a transfer of property by deed of conveyance
n. Scottish painter; cousin of Lytton Strachey and member of the Bloomsbury Group (1885-1978)"
edible,a. suitable for use as food
famine,n. a severe shortage of food (as through crop failure) resulting in violent hunger and starvation and death
stale,"v. urinate, of cattle and horses
a. lacking freshness, palatability, or showing deterioration from age"
fracture,"n. breaking of hard tissue such as bone
n. the act of cracking something
v. violate or abuse
v. interrupt, break, or destroy"
paw,"n. a clawed foot of an animal especially a quadruped
v. scrape with the paws
v. touch clumsily"
moss,n. tiny leafy-stemmed flowerless plants
prospective,a. of or concerned with or related to the future
odor,"n any property detected by the olfactory system
n the sensation that results when olfactory receptors in the nose are stimulated by particular chemicals in gaseous form"
pebble,n. a small smooth rounded rock
viewpoint,"n a mental position from which things are viewed
n a place from which something can be viewed"
context,"n. discourse that surrounds a language unit and helps to determine its interpretation
n. the set of facts or circumstances that surround a situation or event"
neutral,"n. one who does not side with any party in a war or dispute
s. not supporting or favoring either side in a war, dispute, or contest
a. possessing no distinctive quality or characteristics
s. lacking distinguishing quality or characteristics"
franchise,"n. an authorization to sell a company's goods or services in a particular place
n. a business established or operated under an authorization to sell or distribute a company's goods or services in a particular area
n. a statutory right or privilege granted to a person or group by a government (especially the rights of citizenship and the right to vote)
v. grant a franchise to"
coalition,n. the state of being combined into one body
elapse,v. pass by
eject,"v. put out or expel from a place
v. leave an aircraft rapidly, using an ejection seat or capsule"
coil,"n. a structure consisting of something wound in a continuous series of loops
n. a round shape formed by a series of concentric circles (as formed by leaves or flower petals)
n. a transformer that supplies high voltage to spark plugs in a gasoline engine"
collide,"v. cause to collide
v. crash together with violent impact"
plural,"n. the form of a word that is used to denote more than one
a. composed of more than one member, set, or kind
a. grammatical number category referring to two or more items or units"
pneumonia,n. respiratory disease characterized by inflammation of the lung parenchyma (excluding the bronchi) with congestion caused by viruses or bacteria or irritants
proceeding,n. (law) the institution of a sequence of steps by which legal judgments are invoked
mosaic,"n. art consisting of a design made of small pieces of colored stone or glass
n. viral disease in solanaceous plants (tomatoes, potatoes, tobacco) resulting in mottling and often shriveling of the leaves
n. a freeware browser
n. a pattern resembling a mosaic"
obedience,"n. the act of obeying; dutiful or submissive behavior with respect to another person
n. the trait of being willing to obey
n. behavior intended to please your parents"
prosecute,"v. conduct a prosecution in a court of law
v. bring a criminal action against (in a trial)
v. carry out or participate in an activity; be involved in"
mutter,n. a low continuous indistinct sound; often accompanied by movement of the lips without the production of articulate speech
