rap,"n. a gentle blow
n. voluble conversation
n. genre of African-American music of the 1980s and 1990s in which rhyming lyrics are chanted to a musical accompaniment; several forms of rap have emerged
v. strike sharply"
commute,"n. a regular journey of some distance to and from your place of work
v. exchange positions without a change in value
v. travel back and forth regularly, as between one's place of work and home
v. exchange a penalty for a less severe one"
divine,"v. perceive intuitively or through some inexplicable perceptive powers
v. search by divining, as if with a rod
s. emanating from God
s. being or having the nature of a god; 'tis God-like to create""-J.G.Saxe"
shove,"n. the act of shoving (giving a push to someone or something)
v. push roughly"
charter,"n. a document incorporating an institution and specifying its rights; includes the articles of incorporation and the certificate of incorporation
n. a contract to hire or lease transportation
v. grant a charter to"
dread,"n fearful expectation or anticipation
v be afraid or scared of; be frightened of
s causing fear or dread or terror"
interview,"n. the questioning of a person (or a conversation in which information is elicited); often conducted by journalists
v. conduct an interview in television, newspaper, and radio reporting
v. discuss formally with (somebody) for the purpose of an evaluation
v. go for an interview in the hope of being hired"
refugee,n. an exile who flees for safety
bureau,"n an administrative unit of government
n furniture with drawers for keeping clothes"
dwarf,"n. a person who is markedly small
n. a plant or animal that is atypically small
v. check the growth of"
excessive,"s. beyond normal limits
s. unrestrained, especially with regard to feelings"
renovate,v. restore to a previous or better condition
accompany,v. go or travel along with
reverse,"n. a relation of direct opposition
n. the gears by which the motion of a machine can be reversed
n. an unfortunate happening that hinders or impedes; something that is thwarting or frustrating
n. the side of a coin or medal that does not bear the principal design"
soda,"n a sodium salt of carbonic acid; used in making soap powders and glass and paper
n a sweet drink containing carbonated water and flavoring"
previous,"s. just preceding something else in time or order
s. too soon or too hasty"
shutter,"n. a mechanical device on a camera that opens and closes to control the time of a photographic exposure
n. a hinged blind for a window
v. close with shutters"
remain,"v. be left; of persons, questions, problems, results, evidence, etc."
solemn,"s dignified and somber in manner or character and committed to keeping promises
s characterized by a firm and humorless belief in the validity of your opinions"
outrage,n. a wantonly cruel act
burn,"n. pain that feels hot as if it were on fire
n. an injury caused by exposure to heat or chemicals or radiation
n. a place or area that has been burned (especially on a person's body)
n. damage inflicted by fire"
reproach,"n. a mild rebuke or criticism
n. disgrace or shame
v. express criticism towards"
skillful,"s having or showing knowledge and skill and aptitude
s done with delicacy and skill"
disclose,v. disclose to view as by removing a cover
recur,"v. happen or occur again
v. return in thought or speech to something"
solo,"n. any activity that is performed alone without assistance
n. a musical composition for one voice or instrument (with or without accompaniment)
n. a flight in which the aircraft pilot is unaccompanied
v. fly alone, without a co-pilot or passengers"
primary,"n. a preliminary election where delegates or nominees are chosen
n. one of the main flight feathers projecting along the outer edge of a bird's wing
n. (astronomy) a celestial body (especially a star) relative to other objects in orbit around it
a. of first rank or importance or value; direct and immediate rather than secondary"
skull,n. the bony skeleton of the head of vertebrates
uneasy,"a. lacking a sense of security or affording no ease or reassurance
s. relating to bodily unease that causes discomfort"
vegetation,"n. all the plant life in a particular region or period
n. the process of growth in plants
n. an abnormal growth or excrescence (especially a warty excrescence on the valves of the heart)
n. inactivity that is passive and monotonous, comparable to the inactivity of plant life"
mechanical,"a. using (or as if using) mechanisms or tools or devices
a. relating to or concerned with machinery or tools
a. relating to or governed by or in accordance with mechanics"
slippery,"a. causing or tending to cause things to slip or slide
s. not to be trusted"
lest,s being ten more than forty
stability,"n. the quality or attribute of being firm and steadfast
n. a stable order (especially of society)"
essence,n. any substance possessing to a high degree the predominant properties of a plant or drug or other natural product from which it is extracted
pit,"n. a sizeable hole (usually in the ground)
n. a concavity in a surface (especially an anatomical depression)
n. an enclosure in which animals are made to fight
n. (commodity exchange) the part of the floor of a commodity exchange where trading in a particular commodity is carried on"
responsible,"a. worthy of or requiring responsibility or trust; or held accountable
s. being the agent or cause"
assignment,"n. a duty that you are assigned to perform (especially in the armed forces)
n. the instrument by which a claim or right or interest or property is transferred from one person to another
n. the act of distributing something to designated places or persons
n. an undertaking that you have been assigned to do (as by an instructor)"
strain,"n. (physics) deformation of a physical body under the action of applied forces
n. (psychology) nervousness resulting from mental stress
n. injury to a muscle (often caused by overuse); results in swelling and pain
n. an intense or violent exertion"
plague,"n. a serious (sometimes fatal) infection of rodents caused by Yersinia pestis and accidentally transmitted to humans by the bite of a flea that has bitten an infected animal
n. any epidemic disease with a high death rate
n. any large scale calamity (especially when thought to be sent by God)
n. an annoyance"
entail,"n. land received by fee tail
n. the act of entailing property; the creation of a fee tail from a fee simple
v. have as a logical consequence
v. impose, involve, or imply as a necessary accompaniment or result"
shave,"n. the act of removing hair with a razor
v. remove body hair with a razor
v. cut closely
v. cut the price of"
token,"n. an individual instance of a type of symbol
n. something serving as a sign of something else
n. a metal or plastic disk that can be redeemed or used in designated slot machines"
sheer,"v. cause to sheer
r. straight up or down without a break
r. directly"
dismiss,"v. bar from attention or consideration
v. cease to consider; put out of judicial consideration
v. stop associating with
v. end one's encounter with somebody by causing or permitting the person to leave"
commonplace,"s. completely ordinary and unremarkable
s. not challenging; dull and lacking excitement"
introduction,"n. the act of beginning something new
n. the first section of a communication
n. a basic or elementary instructional text
n. a new proposal"
polar,"s. having a pair of equal and opposite charges
a. located at or near or coming from the earth's poles
a. of or existing at or near a geographical pole or within the Arctic or Antarctic Circles"
underestimate,"n. an estimation that is too low; an estimate that is less than the true or actual value
v. make too low an estimate of"
complement,"n. a word or phrase used to complete a grammatical construction
n. a complete number or quantity
n. number needed to make up a whole force
n. something added to complete or embellish or make perfect"
revenue,"n the entire amount of income before any deductions are made
n government income due to taxation"
cop,"n uncomplimentary terms for a policeman
v take by theft
v take into custody"
absence,"n. the state of being absent
n. failure to be present
n. the time interval during which something or somebody is away
n. the occurrence of an abrupt, transient loss or impairment of consciousness (which is not subsequently remembered), sometimes with light twitching, fluttering eyelids, etc.; common in petit mal epilepsy"
pope,"n. the head of the Roman Catholic Church
n. English poet and satirist (1688-1744)"
formula,"n. a group of symbols that make a mathematical statement
n. a conventionalized statement expressing some fundamental principle
n. a representation of a substance using symbols for its constituent elements
n. a liquid food for infants"
copper,"n. a ductile malleable reddish-brown corrosion-resistant diamagnetic metallic element; occurs in various minerals but is the only metal that occurs abundantly in large masses; used as an electrical and thermal conductor
n. a copper penny
n. a reddish-brown color resembling the color of polished copper
n. any of various small butterflies of the family Lycaenidae having coppery wings"
naive,"a. marked by or showing unaffected simplicity and lack of guile or worldly experience
s. inexperienced"
predominant,"s most frequent or common
s having superior power and influence"
lean,"v. to incline or bend from a vertical position
v. cause to lean or incline
v. rely on for support
a. lacking in mineral content or combustible material"
cord,"n. a line made of twisted fibers or threads
n. a unit of amount of wood cut for burning; 128 cubic feet
n. a light insulated conductor for household use
n. a cut pile fabric with vertical ribs; usually made of cotton"
summon,"v. call in an official matter, such as to attend court
v. ask to come"
premium,"n. payment for insurance
n. the amount that something in scarce supply is valued above its nominal value
n. a prize, bonus, or award given as an inducement to purchase products, enter competitions initiated by business interests, etc.
s. having or reflecting superior quality or value"
reign,"n. a period during which something or somebody is dominant or powerful
n. the period during which a monarch is sovereign
n. royal authority; the dominion of a monarch
v. have sovereign power"
defy,"v. resist or confront with resistance
v. elude, especially in a baffling way
v. challenge"
cast,"n. the actors in a play
n. the distinctive form in which a thing is made
n. bandage consisting of a firm covering (often made of plaster of Paris) that immobilizes broken bones while they heal
n. object formed by a mold"
degenerate,"n a person whose behavior deviates from what is acceptable especially in sexual behavior
v grow worse
s unrestrained by convention or morality"
elementary,"s. easy and not involved or complicated
a. of or pertaining to or characteristic of elementary school or elementary education
s. of or being the essential or basic part"
formal,"a. being in accord with established forms and conventions and requirements (as e.g. of formal dress)
s. characteristic of or befitting a person in authority
a. (of spoken and written language) adhering to traditional standards of correctness and without casual, contracted, and colloquial forms
s. logically deductive"
massacre,v. kill a large number of people indiscriminately
disturbance,"n. an unhappy and worried mental state
n. a disorderly outburst or tumult
n. the act of disturbing something or someone; setting something in motion"
toll,"n. a fee levied for the use of roads or bridges (used for maintenance)
v. ring slowly
v. charge a fee for using"
procession,n. the group action of a collection of people or animals or vehicles moving ahead in more or less regular formation
capable,"a. (usually followed by `of') having capacity or ability
s. possibly accepting or permitting
a. (followed by `of') having the temperament or inclination for"
ditch,"n. a long narrow excavation in the earth
n. any small natural waterway
v. forsake
v. make an emergency landing on water"
exploit,"v. use or manipulate to one's advantage
v. draw from; make good use of"
process,"n. (psychology) the performance of some composite cognitive activity; an operation that affects mental contents
n. a mental process that you are not directly aware of
n. a natural prolongation or projection from a part of an organism either animal or plant
n. a sustained phenomenon or one marked by gradual changes through a series of states"
progressive,"n. a tense of verbs used in describing action that is on-going
a. favoring or promoting progress
s. favoring or promoting reform (often by government action)
a. (of taxes) adjusted so that the rate increases as the amount of income increases"
heighten,"v. become more extreme
v. make more extreme; raise in quantity, degree, or intensity
v. increase the height of"
eloquent,"s. expressing yourself readily, clearly, effectively"
proficiency,"n. the quality of having great facility and competence
n. skillfulness in the command of fundamentals deriving from practice and familiarity"
quench,"v. satisfy (thirst)
v. electronics: suppress (sparking) when the current is cut off in an inductive circuit, or suppress (an oscillation or discharge) in a component or device
v. reduce the degree of (luminescence or phosphorescence) in (excited molecules or a material) by adding a suitable substance"
amplify,v. increase the volume of
exceed,"v. be greater in scope or size than some standard
v. be superior or better than some standard"
objective,"n. the lens or system of lenses in a telescope or microscope that is nearest the object being viewed
a. undistorted by emotion or personal bias; based on observable phenomena
a. serving as or indicating the object of a verb or of certain prepositions and used for certain other purposes
s. emphasizing or expressing things as perceived without distortion of personal feelings, insertion of fictional matter, or interpretation"
excerpt,"n. a passage selected from a larger work
v. take out of a literary work in order to cite or copy"
advance,"n. an amount paid before it is earned
n. increase in price or value
v. move forward, also in the metaphorical sense
v. bring forward for consideration or acceptance"
quiver,"n. case for holding arrows
v. shake with fast, tremulous movements"
stripe,"n. a piece of braid, usually on the sleeve, indicating military rank or length of service
n. a kind or category
n. a narrow marking of a different color or texture from the background
v. mark with stripes"
excess,"n. a quantity much larger than is needed
n. immoderation as a consequence of going beyond sufficient or permitted limits
s. more than is needed, desired, or required"
anonymous,"a. having no known name or identity or known source
s. not known or lacking marked individuality"
exterior,a. situated in or suitable for the outdoors or outside of a building
mortal,"a. subject to death
s. unrelenting and deadly"
fake,"n. something that is a counterfeit; not what it seems to be
s. not genuine or real; being an imitation of the genuine article; it's real synthetic fur"""
strategy,n. the branch of military science dealing with military command and the planning and conduct of a war
periodical,n. a publication that appears at fixed intervals
deliberate,s. carefully thought out in advance
persevere,"v. be persistent, refuse to stop"
acclaim,"n. enthusiastic approval
v. praise vociferously"
generator,"n. an apparatus that produces a vapor or gas
n. engine that converts mechanical energy into electrical energy by electromagnetic induction
n. someone who originates or causes or initiates something
n. an electronic device for producing a signal voltage"
prompt,"n. a cue given to a performer (usually the beginning of the next line to be spoken)
n. (computer science) a symbol that appears on the computer screen to indicate that the computer is ready to receive a command
v. serve as the inciting cause of
v. assist (somebody acting or reciting) by suggesting the next words of something forgotten or imperfectly learned"
ballot,"n. a document listing the alternatives that is used in voting
v. vote by ballot"
gently,"r. in a gradual manner
r. in a gentle manner"
spacious,"s very large in expanse or scope
s (of buildings and rooms) having ample space"
tempt,"v. dispose or incline or entice to
v. give rise to a desire by being attractive or inviting
v. try to seduce
v. try presumptuously"
hasty,"s. excessively quick
s. done with very great haste and without due deliberation"
mount,"n. a mounting consisting of a piece of metal (as in a ring or other jewelry) that holds a gem in place
v. attach to a support
v. fix onto a backing, setting, or support
v. put up or launch"
career,"n. the particular occupation for which you are trained
n. the general progression of your working or professional life
v. move headlong at high speed"
hatred,n the emotion of intense dislike; a feeling of dislike so strong that it demands action
desirable,"a. worth having or seeking or achieving
s. worthy of being chosen especially as a spouse"
advocate,"n. a person who pleads for a cause or propounds an idea
n. a lawyer who pleads cases in court"
glamor,n. alluring beauty or charm (often with sex-appeal)
sculpture,"n. a three-dimensional work of plastic art
n. creating figures or designs in three dimensions"
intersection,"n. a point where lines intersect
n. a junction where one street or road crosses another
n. a point or set of points common to two or more geometric configurations"
unexpected,a. not expected or anticipated
refute,"v. overthrow by argument, evidence, or proof
v. prove to be false or incorrect"
permeate,v. spread or diffuse through
ponder,v reflect deeply on a subject
junction,"n. the place where two or more things come together
n. the state of being joined together
n. something that joins or connects
n. an act of joining or adjoining things"
motivate,v. give an incentive for action
rehearse,v. engage in a rehearsal (of)
outlook,"n a habitual or characteristic mental attitude that determines how you will interpret and respond to situations
n belief about (or mental picture of) the future
n the act of looking out"
overhaul,"n. periodic maintenance on a car or machine
v. make repairs, renovations, revisions or adjustments to"
manifest,"n. a customs document listing the contents put on a ship or plane
v. record in a ship's manifest
v. reveal its presence or make an appearance"
knit,"n. a fabric made by knitting
n. a basic knitting stitch
n. needlework created by interlacing yarn in a series of connected loops using straight eyeless needles or by machine
v. make (textiles) by knitting"
evil,"n. morally objectionable behavior
n. that which causes harm or destruction or misfortune; the good is oft interred with their bones""- Shakespeare
n. the quality of being morally wrong in principle or practice
a. morally bad or wrong"
scenario,"n. an outline or synopsis of a play (or, by extension, of a literary work)
n. a setting for a work of art or literature
n. a postulated sequence of possible events"
scout,"n. a Boy Scout or Girl Scout
n. someone employed to discover and recruit talented persons (especially in the worlds of entertainment or sports)
n. someone who can find paths through unexplored territory
v. explore, often with the goal of finding something or somebody"
conscientious,"s. characterized by extreme care and great effort
a. guided by or in accordance with conscience or sense of right and wrong"
microphone,n. device for converting sound waves into electrical energy
midst,n. the location of something surrounded by other things
concession,"n. a contract granting the right to operate a subsidiary business
n. the act of conceding or yielding
n. a point conceded or yielded"
romantic,"n. a soulful or amorous idealist
a. belonging to or characteristic of Romanticism or the Romantic Movement in the arts"
navigation,"n. the guidance of ships or airplanes from place to place
n. ship traffic"
neutron,n. an elementary particle with 0 charge and mass about equal to a proton; enters into the structure of the atomic nucleus
heritage,n. practices that are handed down from the past by tradition
prime,"n. a number that has no factor but itself and 1
n. the second canonical hour; about 6 a.m.
n. the time of maturity when power and vigor are greatest
v. insert a primer into (a gun, mine, or charge) preparatory to detonation or firing"
object,"n. a tangible and visible entity; an entity that can cast a shadow
n. (grammar) a constituent that is acted upon
n. the focus of cognitions or feelings
n. (computing) a discrete item that provides a description of virtually anything known to a computer"
knob,"n. a circular rounded projection or protuberance
n. a round handle
n. an ornament in the shape of a ball on the hilt of a sword or dagger"
label,"n. a brief description given for purposes of identification
n. trade name of a company that produces musical recordings
n. a radioactive isotope that is used in a compound in order to trace the mechanism of a chemical reaction
n. an identifying or descriptive marker that is attached to an object"
canvas,"n. a heavy, closely woven fabric (used for clothing or chairs or sails or tents)
n. an oil painting on canvas fabric
n. the setting for a narrative or fictional or dramatic account
n. the mat that forms the floor of the ring in which boxers or professional wrestlers compete"
deny,"v. declare untrue; contradict
v. refuse to accept or believe
v. refuse to grant, as of a petition or request
v. refuse to let have"
layer,"n. single thickness of usually some homogeneous substance
n. a relatively thin sheetlike expanse or region lying over or under another
n. a hen that lays eggs
n. thin structure composed of a single thickness of cells"
carbohydrate,n. an essential structural component of living cells and source of energy for animals; includes simple sugars with small molecules as well as macromolecular substances; are classified according to the number of monosaccharide groups they contain
publication,"n. a copy of a printed work offered for distribution
n. the communication of something to the public; making information generally known
n. the business of issuing printed matter for sale or distribution"
render,"n. a substance similar to stucco but exclusively applied to masonry walls
v. cause to become
v. give or supply
v. pass down"
lever,"n. a rigid bar pivoted about a fulcrum
n. a simple machine that gives a mechanical advantage when given a fulcrum
n. a flat metal tumbler in a lever lock"
magnet,n. (physics) a device that attracts iron and produces a magnetic field
cease,n. (`cease' is a noun only in the phrase `without cease') end
liability,"n. the state of being legally obliged and responsible
n. the quality of being something that holds you back"
erroneous,s. containing or characterized by error
vivid,s. having the clarity and freshness of immediate experience
majesty,n impressiveness in scale or proportion
manuscript,"n. the form of a literary work submitted for publication
n. handwritten book or document"
screw,"n. a simple machine of the inclined-plane type consisting of a spirally threaded cylindrical rod that engages with a similarly threaded hole
n. a propeller with several angled blades that rotates to push against water or air
n. a fastener with a tapered threaded shank and a slotted head
v. turn like a screw"
lane,"n. a narrow way or road
n. a well-defined track or path; for e.g. swimmers or lines of traffic"
seam,"n. joint consisting of a line formed by joining two pieces
n. a stratum of ore or coal thick enough to be mined with profit
v. put together with a seam"
fragment,"n. a piece broken off or cut off of something else
n. an incomplete piece"
latent,"s. potentially existing but not presently evident or realized
s. (pathology) not presently active"
sham,"n something that is a counterfeit; not what it seems to be
n a person who makes deceitful pretenses
v make a pretence of
v make believe with the intent to deceive
s adopted in order to deceive"
lad,"n a boy or man
n a male child (a familiar term of address to a boy)"
formulate,v. prepare according to a formula
fuse,"n. an electrical device that can interrupt the flow of electrical current when it is overloaded
n. any igniter that is used to initiate the burning of a propellant
v. become plastic or fluid or liquefied from heat
v. equip with a fuse; provide with a fuse"
lavatory,"n a room or building equipped with one or more toilets
n a bathroom sink that is permanently installed and connected to a water supply and drainpipe; where you can wash your hands and face
n a toilet that is cleaned of waste by the flow of water through it"
shatter,"v. break into many pieces
v. damage or destroy
v. cause to break into many pieces"
foster,"n. United States songwriter whose songs embody the sentiment of the South before the American Civil War (1826-1864)
v. promote the growth of
v. bring up under fosterage; of children
v. help develop, help grow"
vocation,"n the particular occupation for which you are trained
n a body of people doing the same kind of work"
specify,"v. decide upon or fix definitely
v. determine the essential quality of
v. be specific about"
brutal,"s. harsh
s. disagreeably direct and precise"
specimen,"n. an example regarded as typical of its class
n. a bit of tissue or blood or urine that is taken for diagnostic purposes"
influence,"n. a power to affect persons or events especially power based on prestige etc
n. causing something without any direct or apparent effort
n. a cognitive factor that tends to have an effect on what you do
n. the effect of one thing (or person) on another"
liable,"s. subject to legal action
s. (often followed by `to') likely to be affected with
s. held legally responsible"
