solve,v. find the solution to (a problem or question) or understand the meaning of
density,n. the amount per unit size
organic,"n. a fertilizer that is derived from animal or vegetable matter
a. relating or belonging to the class of chemical compounds having a carbon basis
a. being or relating to or derived from or having properties characteristic of living organisms
a. involving or affecting physiology or bodily organs"
nurture,"n the properties acquired as a consequence of the way you were treated as a child
n helping someone grow up to be an accepted member of the community
v help develop, help grow
v bring up
v provide with nourishment"
clash,"n. a state of conflict between persons
n. a state of conflict between colors
v. be incompatible; be or come into conflict
v. disagree violently"
apologize,"v. acknowledge faults or shortcomings or failing
v. defend, explain, clear away, or make excuses for by reasoning"
fatigue,"n. temporary loss of strength and energy resulting from hard physical or mental work
n. used of materials (especially metals) in a weakened state caused by long stress
n. (always used with a modifier) boredom resulting from overexposure to something"
department,"n. a specialized division of a large organization
n. the territorial and administrative division of some countries (such as France)
n. a specialized sphere of knowledge"
optimum,"n. most favorable conditions or greatest degree or amount possible under given circumstances
s. most desirable possible under a restriction expressed or implied"
justify,"v. show to be reasonable or provide adequate ground for
v. show to be right by providing justification or proof
v. adjust the spaces between words"
striking,"n the physical coming together of two or more things
n the act of contacting one thing with another
v deliver a sharp blow, as with the hand, fist, or weapon
v have an emotional or cognitive impact upon
v hit against; come into sudden contact with
v make a strategic, offensive, assault against an enemy, opponent, or a target
v indicate (a certain time) by striking
v affect or afflict suddenly, usually adversely
v stop work in order to press demands
v touch or seem as if touching visually or audibly
v attain
v produce by manipulating keys or strings of musical instruments, also metaphorically
v cause to form (an electric arc) between electrodes of an arc lamp
v find unexpectedly
v produce by ignition or a blow
v remove by erasing or crossing out or as if by drawing a line
v cause to experience suddenly
v drive something violently into a location
v occupy or take on
v form by stamping, punching, or printing
v smooth with a strickle
v pierce with force
v arrive at after reckoning, deliberating, and weighing
s sensational in appearance or thrilling in effect
s having a quality that thrusts itself into attention"
impulse,n. the act of applying force suddenly
fellowship,n. money granted (by a university or foundation or other agency) for advanced study or research
sober,"v. cause to become sober
a. not affected by a chemical substance (especially alcohol)"
appall,"v strike with disgust or revulsion
v fill with apprehension or alarm; cause to be unpleasantly surprised"
standpoint,n a mental position from which things are viewed
overflow,"n. the occurrence of surplus liquid (as water) exceeding the limit or capacity
v. flow or run over (a limit or brim)"
blossom,v. develop or come to a promising stage
fleet,"n. group of aircraft operating together under the same ownership
n. group of motor vehicles operating together under the same ownership
n. a group of steamships operating together under the same ownership
n. a group of warships organized as a tactical unit"
weave,"n. pattern of weaving or structure of a fabric
v. interlace by or as if by weaving
v. create a piece of cloth by interlacing strands of fabric, such as wool or cotton
v. to move or cause to move in a sinuous, spiral, or circular course"
spur,"n. any sharply pointed projection
n. tubular extension at the base of the corolla in some flowers
n. a sharp prod fixed to a rider's heel and used to urge a horse onward
v. incite or stimulate"
manufacture,"v. put together out of artificial or natural components or parts; He manufactured a popular cereal""
v. produce naturally
v. create or produce in a mechanical way"
limitation,"n. the quality of being limited or restricted
n. (law) a time period after which suits cannot be brought
n. an act of limiting or restricting (as by regulation)"
evade,"v. practice evasion
v. use cunning or deceit to escape or avoid"
fling,"n. the act of flinging
v. throw with force or recklessness
v. move in an abrupt or headlong manner"
wedge,"n. any shape that is triangular in cross section
n. (golf) an iron with considerable loft and a broad sole
n. something solid that is usable as an inclined plane (shaped like a V) that can be pushed between two things to separate them
v. squeeze like a wedge into a tight space"
undermine,"v destroy property or hinder normal operations
v hollow out as if making a cave or opening"
overtake,v. catch up with and possibly overtake
complain,"v. express complaints, discontent, displeasure, or unhappiness
v. make a formal accusation; bring a formal charge"
acrobat,n. an athlete who performs acts requiring skill and agility and coordination
glide,"n. the activity of flying a glider
v. move smoothly and effortlessly
v. fly in or as if in a glider plane
v. cause to move or pass silently, smoothly, or imperceptibly"
habitat,n. the type of environment in which an organism or group normally lives or occurs
nevertheless,r despite anything to the contrary (usually following a concession)
adhere,"v. be compatible or in accordance with
v. follow through or carry out a plan without deviation
v. be a devoted follower or supporter
v. stick to firmly"
prudent,a. careful and sensible; marked by sound judgment
conceive,v. become pregnant; undergo conception
applause,n. a demonstration of approval by clapping the hands together
pitch,"n. the property of sound that varies with variation in the frequency of vibration
n. (baseball) the act of throwing a baseball by a pitcher to a batter
n. a vendor's position (especially on the sidewalk)
n. degree of deviation from a horizontal plane"
individual,"n. a single organism
a. being or characteristic of a single thing or person
s. separate and distinct from others of the same kind
s. characteristic of or meant for a single person or thing"
handbook,n. a concise reference book providing specific information about a subject or location
workshop,"n. small workplace where handcrafts or manufacturing are done
n. a brief intensive course for a small group; emphasizes problem solving"
genre,"n. a kind of literary or artistic work
n. a class of art (or artistic endeavor) having a characteristic form or technique"
cling,"n. fruit (especially peach) whose flesh adheres strongly to the pit
v. come or be in close contact with; stick or hold together and resist separation
v. to remain emotionally or intellectually attached
v. hold on tightly or tenaciously"
plantation,"n. an estate where cash crops are grown on a large scale (especially in tropical areas)
n. a newly established colony (especially in the colonization of North America)"
honor,"n. the state of being honored
n. the quality of being honorable and having a good name
n. a woman's virtue or chastity"
chip,"n. a triangular wooden float attached to the end of a log line
n. a piece of dried bovine dung
n. a thin crisp slice of potato fried in deep fat
n. a small disk-shaped counter used to represent money when gambling"
blend,"n. an occurrence of thorough mixing
n. a new word formed by joining two others and combining their meanings
n. the act of blending components together thoroughly
v. combine into one"
realize,"v. make real or concrete; give reality or substance to
v. convert into cash; of goods and property
v. expand or complete (a part in a piece of baroque music) by supplying the harmonies indicated in the figured bass"
intellectual,"n. a person who uses the mind creatively
s. of or associated with or requiring the use of the mind
a. appealing to or using the intellect"
claim,"n. an assertion of a right (as to money or property)
n. an assertion that something is true or factual
n. demand for something as rightful or due
n. an informal right to something"
prior,n. the head of a religious order; in an abbey the prior is next below the abbot
loan,n. the temporary provision of money (usually at interest)
worship,"n. the activity of worshipping
n. a feeling of profound love and admiration
v. show devotion to (a deity)
v. attend religious services"
advent,"n. arrival that has been awaited (especially of something momentous)
n. the season including the four Sundays preceding Christmas"
classical,"a. of or relating to the most highly developed stage of an earlier civilisation and its culture
a. of or relating to the study of the literary works of ancient Greece and Rome
s. (language) having the form used by ancient standard authors
s. of or pertaining to or characteristic of the ancient Greek and Roman cultures"
inevitable,"n. an unavoidable event
a. incapable of being avoided or prevented
s. invariably occurring or appearing"
formation,"n. an arrangement of people or things acting as a unit
n. the act of fabricating something in a particular shape
n. a particular spatial arrangement
n. natural process that causes something to form"
zeal,n. excessive fervor to do something or accomplish some end
misfortune,"n. unnecessary and unforeseen trouble resulting from an unfortunate event
n. an unfortunate state resulting from unfavorable outcomes"
necessitate,"v. require as useful, just, or proper
v. cause to be a concomitant"
heal,v. get healthy again
plough,"n a group of seven bright stars in the constellation Ursa Major
n a farm tool having one or more heavy blades to break the soil and cut a furrow prior to sowing
v move in a way resembling that of a plow cutting into or going through the soil
v to break and turn over earth especially with a plow"
boost,"n. the act of giving hope or support to someone
n. the act of giving a push
v. give a boost to; be beneficial to
v. increase or raise"
nominate,"v. propose as a candidate for some honor
v. put forward; nominate for appointment to an office or for an honor or position"
keen,"n. a funeral lament sung with loud wailing
s. having a sharp cutting edge or point"
undertake,"v. enter upon an activity or enterprise
v. accept as a challenge
v. promise to do or accomplish
v. accept as a charge"
fund,"n. a reserve of money set aside for some purpose
v. convert (short-term floating debt) into long-term debt that bears fixed interest and is represented by bonds
v. place or store up in a fund for accumulation
v. provide a fund for the redemption of principal or payment of interest"
superstition,n. an irrational belief arising from ignorance or fear
numerous,s. amounting to a large indefinite number
horizontal,"n. something that is oriented horizontally
a. parallel to or in the plane of the horizon or a base line"
essential,"s. absolutely necessary; vitally necessary
a. basic and fundamental
a. being or relating to or containing the essence of a plant etc"
magnetic,"a. of or relating to or caused by magnetism
a. having the properties of a magnet; i.e. of attracting iron or steel
a. capable of being magnetized
a. determined by earth's magnetic fields"
nuisance,n. (law) a broad legal concept including anything that disturbs the reasonable use of your property or endangers life and health or is offensive
horsepower,n. a unit of power equal to 746 watts
slum,"n. a district of a city marked by poverty and inferior living conditions
v. spend time at a lower socio-economic level than one's own, motivated by curiosity or desire for adventure; usage considered condescending and insensitive"
novelty,n. originality by virtue of being new and surprising
legislation,"n. law enacted by a legislative body
n. the act of making or enacting laws"
offensive,"s. violating or tending to violate or offend against
a. for the purpose of attack rather than defense
a. causing anger or annoyance
a. unpleasant or disgusting especially to the senses"
peer,"n. a person who is of equal standing with another in a group
n. a nobleman (duke or marquis or earl or viscount or baron) who is a member of the British peerage
v. look searchingly"
depict,"v show in, or as in, a picture
v give a description of
v make a portrait of"
meditation,"n. continuous and profound contemplation or musing on a subject or series of subjects of a deep or abstruse nature
n. (religion) contemplation of spiritual matters (usually on religious or philosophical subjects)"
virgin,"n. a person who has never had sex
s. being used or worked for the first time"
fiscal,a. involving financial matters
smuggle,v. import or export without paying customs duties
restrict,"v. place restrictions on
v. place under restrictions; limit access to
v. place limits on (extent or access)"
behavior,"n. manner of acting or controlling yourself
n. the action or reaction of something (as a machine or substance) under specified circumstances
n. (psychology) the aggregate of the responses or reactions or movements made by an organism in any situation"
exclusive,"n. a news report that is reported first by one news organization
s. not divided or shared with others
a. excluding much or all; especially all but a particular group or minority"
revolve,v. turn on or around an axis or a center
staple,"n. a natural fiber (raw cotton, wool, hemp, flax) that can be twisted to form yarn
n. a short U-shaped wire nail for securing cables
n. paper fastener consisting of a short length of U-shaped wire that can fasten papers together
v. secure or fasten with a staple or staples"
maiden,"n an unmarried girl (especially a virgin)
n (cricket) an over in which no runs are scored
s serving to set in motion"
shrug,"n. a gesture involving the shoulders
v. raise one's shoulders to indicate indifference or resignation"
occasional,s. occurring from time to time
superfluous,"s serving no useful purpose; having no excuse for being
s more than is needed, desired, or required"
solitary,"n confinement of a prisoner in isolation from other prisoners
n one who lives in solitude
s characterized by or preferring solitude
s of plants and animals; not growing or living in groups or colonies
s lacking companions or companionship
s being the only one; single and isolated from others
s devoid of creatures"
costly,s. having a high price
epidemic,"n. a widespread outbreak of an infectious disease; many people are infected at the same time
a. (especially of medicine) of disease or anything resembling a disease; attacking or affecting many individuals in a community or a population simultaneously"
inference,n. the reasoning involved in drawing a conclusion or making a logical judgment on the basis of circumstantial evidence and prior conclusions rather than on the basis of direct observation
abound,"v. be abundant or plentiful; exist in large quantities
v. be in a state of movement or action"
breeze,"n. a slight wind (usually refreshing)
v. blow gently and lightly
v. to proceed quickly and easily"
delegate,"n. a person appointed or elected to represent others
v. transfer power to someone
v. give an assignment to (a person) to a post, or assign a task to (a person)"
adjoin,v. attach or add
quote,"v. repeat a passage from
v. name the price of
v. refer to for illustration or proof
v. put quote marks around"
sip,"n. a small drink
v. drink in sips"
stem,"n. the tube of a tobacco pipe
v. grow out of, have roots in, originate in
v. cause to point inward
v. stop the flow of a liquid"
artery,"n. a blood vessel that carries blood from the heart to the body
n. a major thoroughfare that bears important traffic"
intend,"v. have in mind as a purpose
v. design or destine"
utter,"v. express audibly; utter sounds (not necessarily words)
v. put into circulation"
valve,"n. a structure in a hollow organ (like the heart) with a flap to insure one-way flow of fluid through it
n. device in a brass wind instrument for varying the length of the air column to alter the pitch of a tone
n. control consisting of a mechanical device for controlling the flow of a fluid
n. the entire one-piece shell of a snail and certain other molluscs"
identical,"s. exactly alike; incapable of being perceived as different
s. being the exact same one; not any other:
a. (of twins) derived from a single egg or ovum
s. having properties with uniform values along all axes"
transmit,v. send from one person or place to another
resistance,"n. the action of opposing something that you disapprove or disagree with
n. any mechanical force that tends to retard or oppose motion
n. the military action of resisting the enemy's advance
n. the capacity of an organism to defend itself against harmful environmental agents"
cabin,"n. small room on a ship or boat where people sleep
n. a small house built of wood; usually in a wooded area
n. the enclosed compartment of an aircraft or spacecraft where passengers are carried
v. confine to a small space, such as a cabin"
vein,"n. a blood vessel that carries blood from the capillaries toward the heart
n. a distinctive style or manner
n. any of the vascular bundles or ribs that form the branching framework of conducting and supporting tissues in a leaf or other plant organ
n. a layer of ore between layers of rock"
release,"n. merchandise issued for sale or public showing (especially a record or film)
n. a process that liberates or discharges something
n. a device that when pressed will release part of a mechanism
n. activity that frees or expresses creative energy or emotion"
curiosity,n. a state in which you want to learn more about something
scope,"n. an area in which something acts or operates or has power or control: ""the range of a supersonic jet"""
cable,"n. a telegram sent abroad
n. a conductor for transmitting electrical or optical signals or electric power
n. a very strong thick rope made of twisted hemp or steel wire
n. a nautical unit of depth"
verify,"v. confirm the truth of
v. attach or append a legal verification to (a pleading or petition)"
entity,n. that which is perceived or known or inferred to have its own distinct existence (living or nonliving)
criticize,v. act as a critic
dedicate,"v. open to public use, as of a highway, park, or building
v. inscribe or address by way of compliment
v. set apart to sacred uses with solemn rites, of a church"
violet,"n. any of numerous low-growing violas with small flowers
n. a variable color that lies beyond blue in the spectrum"
drip,"n. flowing in drops; the formation and falling of drops of liquid
n. the sound of a liquid falling drop by drop
n. (architecture) a projection from a cornice or sill designed to protect the area below from rainwater (as over a window or doorway)
v. fall in drops"
explosion,"n. a violent release of energy caused by a chemical or nuclear reaction
n. the act of exploding or bursting
n. a sudden great increase
n. the noise caused by an explosion"
amiable,s. disposed to please
console,"n. a scientific instrument consisting of displays and an input device that an operator can use to monitor and control a system (especially a computer system)
n. an ornamental scroll-shaped bracket (especially one used to support a wall fixture)"
so-called,s doubtful or suspect
proportion,"n. the quotient obtained when the magnitude of a part is divided by the magnitude of the whole
n. magnitude or extent
n. the relation between things (or parts of things) with respect to their comparative quantity, magnitude, or degree
n. harmonious arrangement or relation of parts or elements within a whole (as in a design)"
fable,n. a short moral story (often with animal characters)
diabetes,n. a polygenic disease characterized by abnormally high glucose levels in the blood; any of several metabolic disorders marked by excessive urination and persistent thirst
consent,n. permission to do something
stationary,"s. standing still
s. not capable of being moved"
escort,"n. the act of accompanying someone or something in order to protect them
n. an attendant who is employed to accompany someone
v. accompany as an escort"
deem,v. keep in mind or convey as a conviction or view
resolve,"v. make clearly visible
v. find the solution"
depress,"v. lower someone's spirits; make downhearted
v. lower (prices or markets)
v. lessen the activity or force of"
misunderstand,v interpret in the wrong way
executive,"n. a person responsible for the administration of a business
n. persons who administer the law
a. having the function of carrying out plans or orders etc."
client,n. a person who seeks the advice of a lawyer
whip,"n. an instrument with a handle and a flexible lash that is used for whipping
n. a legislator appointed by the party to enforce discipline
n. a dessert made of sugar and stiffly beaten egg whites or cream and usually flavored with fruit
n. (golf) the flexibility of the shaft of a golf club"
descend,"v. move downward and lower, but not necessarily all the way"
moderate,"v. preside over
v. make less fast or intense
a. being within reasonable or average limits; not excessive or extreme
s. not extreme"
decisive,"a. determining or having the power to determine an outcome
s. unmistakable
a. characterized by decision and firmness"
wink,"n. closing one eye quickly as a signal
v. signal by winking
v. force to go away by blinking"
skim,"n. a thin layer covering the surface of a liquid
n. reading or glancing through quickly
v. cause to skip over a surface
v. coat (a liquid) with a layer"
benign,"a. not dangerous to health; not recurrent or progressive (especially of a tumor)
a. pleasant and beneficial in nature or influence
s. kindness of disposition or manner"
historical,"a. of or relating to the study of history
s. having once lived or existed or taken place in the real world as distinct from being legendary"
mortgage,"n. a conditional conveyance of property as security for the repayment of a loan
v. put up as security or collateral"
region,"n. the extended spatial location of something
n. a large indefinite location on the surface of the Earth
n. the approximate amount of something (usually used prepositionally as in `in the region of')
n. a knowledge domain that you are interested in or are communicating about"
daylight,n. light during the daytime
manual,"n. a small handbook
a. of or relating to the hands
a. requiring human effort
s. doing or requiring physical work"
dean,"n. an administrator in charge of a division of a university or college
n. United States film actor whose moody rebellious roles made him a cult figure (1931-1955)
n. a man who is the senior member of a group
n. (Roman Catholic Church) the head of the College of Cardinals"
sneak,"n. a person who is regarded as underhanded and furtive and contemptible
v. to go stealthily or furtively
v. put, bring, or take in a secretive or furtive manner"
residence,"n. any address at which you dwell more than temporarily
n. the official house or establishment of an important person (as a sovereign or president)"
combat,n. an engagement fought between two military forces
compartment,"n. a space into which an area is subdivided
n. a partitioned section, chamber, or separate room within a larger enclosed area"
confess,"v. confess to a punishable or reprehensible deed, usually under pressure
v. confess to God in the presence of a priest, as in the Catholic faith"
modernization,"n. making modern in appearance or behavior
n. a modernized version (as of a play)"
fairy,"n. a small being, human in form, playful and having magical powers"
normal,"a. conforming with or constituting a norm or standard or level or type or social norm; not abnormal
a. in accordance with scientific laws
a. being approximately average or within certain limits in e.g. intelligence and development
s. forming a right angle"
sprout,"n. any new growth of a plant such as a new branch or a bud
n. a newly grown bud (especially from a germinating seed)
v. put forth and grow sprouts or shoots"
fall,"n. the season when the leaves fall from the trees
n. the lapse of mankind into sinfulness because of the sin of Adam and Eve
n. a lapse into sin; a loss of innocence or of chastity
n. a sudden decline in strength or number or importance"
arise,"v. originate or come into being
v. rise to one's feet
v. result or issue"
default,"n. loss due to not showing up
n. act of failing to meet a financial obligation
v. fail to pay up"
perspective,n. the appearance of things relative to one another as determined by their distance from the viewer
destructive,a. causing destruction or much damage
soar,"n. the act of rising upward into the air
v. rise rapidly
v. fly upwards or high in the sky
v. go or move upward"
defer,"v hold back to a later time
v yield to another's wish or opinion"
hinder,"v be a hindrance or obstacle to
v hinder or prevent the progress or accomplishment of
v put at a disadvantage
s located at or near the back of an animal
s located at or near the back of an animal"
prestige,n. a high standing achieved through success or influence or wealth etc.
compact,"n. a small cosmetics case with a mirror; to be carried in a woman's purse
n. a small and economical car
v. have the property of being packable or of compacting easily
a. closely and firmly united or packed together"
henceforth,r. from this time forth; from now on
implement,"n. instrumentation (a piece of equipment or tool) used to effect an end
v. apply in a manner consistent with its purpose or design"
thrift,n. any of numerous sun-loving low-growing evergreens of the genus Armeria having round heads of pink or white flowers
