sigh,"n. an utterance made by exhaling audibly
n. a sound like a person sighing
v. heave or utter a sigh; breathe deeply and heavily
v. utter with a sigh"
recoil,"n. the backward jerk of a gun when it is fired
n. a movement back from an impact"
uphold,"v. stand up for; stick up for; of causes, principles, or ideals
v. support against an opponent"
grab,"n. a mechanical device for gripping an object
v. make a grasping or snatching motion with the hand
v. obtain illegally or unscrupulously
v. take or grasp suddenly"
stride,"n. significant progress (especially in the phrase ""make strides"")
v. walk with long steps
v. cover or traverse by taking long steps"
thrust,"n. verbal criticism
v. push forcefully
v. press or force
v. force (molten rock) into pre-existing rock"
gnaw,v. bite or chew on with the teeth
spew,"v. eject or send out in large quantities, also metaphorical"
dab,"n. a small quantity of something moist or liquid
v. apply (usually a liquid) to a surface
v. hit lightly"
plunge,"n. a steep and rapid fall
v. dash violently or with great speed or impetuosity
v. begin with vigor
v. cause to be immersed"
dart,"n. a small narrow pointed missile that is thrown or shot
n. a tapered tuck made in dressmaking
v. run or move very quickly or hastily
v. move with sudden speed"
shove,"n. the act of shoving (giving a push to someone or something)
v. push roughly"
drag,"n. the phenomenon of resistance to motion through a fluid
n. something that slows or delays progress
n. something tedious and boring
n. clothing that is conventionally worn by the opposite sex (especially women's clothing when worn by a man)"
haul,"v. draw slowly or heavily
v. transport in a vehicle"
shake,"v. move or cause to move back and forth
v. move with or as if with a tremor
v. undermine or cause to waver
v. get rid of"
jolt,"n. a sudden jarring impact
v. move or cause to move with a sudden jerky motion
v. disturb (someone's) composure"
embrace,"n. the act of clasping another person in the arms (as in greeting or affection)
n. the state of taking in or encircling
n. a close affectionate and protective acceptance
v. include in scope; include as part of something broader; have as one's sphere or territory"
heave,"n. an upward movement (especially a rhythmical rising and falling)
n. (geology) a horizontal dislocation
n. the act of lifting something with great effort
n. an involuntary spasm of ineffectual vomiting"
slap,"n. a blow from a flat object (as an open hand)
v. hit with something flat, like a paddle or the open hand"
clutch,"n. a tense critical situation
n. a number of birds hatched at the same time
n. a pedal or lever that engages or disengages a rotating shaft and a driving mechanism
n. a coupling that connects or disconnects driving and driven parts of a driving mechanism"
flush,"n. a poker hand with all 5 cards in the same suit
n. a sudden rapid flow (as of water)
v. flow freely
v. glow or cause to glow with warm color or light"
sprawl,"n. an ungainly posture with arms and legs spread about
v. sit or lie with one's limbs spread out
v. go, come, or spread in a rambling or irregular way"
sway,n. controlling influence
spring,"n. the season of growth
n. a metal elastic device that returns to its shape or position when pushed or pulled or pressed
n. a natural flow of ground water
n. a point at which water issues forth"
footbeat,none
industrial,"a. of or relating to or resulting from industry
a. having highly developed industries
s. employed in industry
s. suitable to stand up to hard wear"
practical,"a. concerned with actual use or practice
s. having or put to a practical purpose or use"
instrument,"n. a device that requires skill for proper use
n. the means whereby some act is accomplished
n. a person used by another to gain an end
v. equip with instruments for measuring, recording, or controlling"
instrumental,a. relating to or designed for or performed on musical instruments
textile,a. of or relating to fabrics or fabric making
outfit,"n. any cohesive unit such as a military company
n. a set of clothing (with accessories)"
mine,"n. excavation in the earth from which ores and minerals are extracted
n. explosive device that explodes on contact; designed to destroy vehicles or ships or to kill or maim personnel
v. get from the earth by excavation
v. lay mines"
gear,"n. a toothed wheel that engages another toothed mechanism in order to change the speed or direction of transmitted motion
n. a mechanism for transmitting motion for some specific purpose (as the steering gear of a vehicle)
n. equipment consisting of miscellaneous articles needed for a particular operation or sport etc.
v. set the level or character of"
fixture,n. an object firmly fixed in place (especially in a household)
monitor,"n. an ironclad vessel built by Federal forces to do battle with the Merrimac
n. display produced by a device that takes signals and displays them on a television screen or a computer monitor
n. electronic equipment that is used to check the quality or content of electronic transmissions
n. a piece of electronic equipment that keeps track of the operation of a system continuously and warns of trouble"
device,"n. an instrumentality invented for a particular purpose
n. something in an artistic work designed to achieve a particular effect
n. any clever maneuver
n. any ornamental pattern or design (as in embroidery)"
equipment,n. an instrumentality needed for an undertaking or to perform a service
cement,"n. concrete pavement is sometimes referred to as cement
n. a building material that is a powder made of a mixture of calcined limestone and clay; used with water and sand or gravel to make concrete and mortar
n. something that hardens to act as adhesive material
n. any of various materials used by dentists to fill cavities in teeth"
pivot,"n. the person in a rank around whom the others wheel and maneuver
n. axis consisting of a short shaft that supports something that turns
n. the act of turning on (or as if on) a pivot
v. turn on a pivot"
axis,"n. a straight line through a body or figure that satisfies certain conditions
n. the main stem or central part about which plant organs or plant parts such as branches are arranged
n. in World War II the alliance of Germany and Italy in 1936 which later included Japan and other nations
n. the 2nd cervical vertebra; serves as a pivot for turning the head"
release,"n. merchandise issued for sale or public showing (especially a record or film)
n. a process that liberates or discharges something
n. a device that when pressed will release part of a mechanism
n. activity that frees or expresses creative energy or emotion"
load,"n. weight to be borne or conveyed
n. a quantity that can be processed or transported at one time
n. an amount of alcohol sufficient to intoxicate
n. the power output of a generator or power plant"
behave,"v. behave in a certain manner
v. behave well or properly"
erect,a. upright in position or posture
raise,"n. the amount a salary is increased
n. increasing the size of a bet (as in poker)
v. raise the level or amount of something
v. raise from a lower to a higher position"
manipulate,"v. influence or control shrewdly or deviously
v. hold something in one's hands and move it
v. control (others or oneself) or influence skillfully, usually to one's advantage
v. treat manually, as with massage, for therapeutic purposed"
construct,"v. make by combining materials and parts
v. draw with suitable instruments and under specified conditions
v. create by linking linguistic units
v. create by organizing and linking ideas, arguments, or concepts"
convey,"v. make known; pass on, of information
v. transfer to another
v. transmit a title or property"
fabricate,v. make up something artificial or untrue
manufacture,"v. put together out of artificial or natural components or parts; He manufactured a popular cereal""
v. produce naturally
v. create or produce in a mechanical way"
conserve,"n. fruit preserved by cooking with sugar
v. keep constant through physical or chemical reactions or evolutionary change
v. keep in safety and protect from harm, decay, loss, or destruction
v. use cautiously and frugally"
hoist,"n. lifting device for raising heavy or cumbersome objects
v. raise or haul up with or as if with mechanical help
v. move from one place to another by lifting
v. raise"
concrete,"n. a strong hard building material composed of sand and gravel and cement and water
v. cover with cement
v. form into a solid mass; coalesce
a. capable of being perceived by the senses; not abstract or imaginary"
mill,"n. Scottish philosopher who expounded Bentham's utilitarianism; father of John Stuart Mill (1773-1836)
n. English philosopher and economist remembered for his interpretations of empiricism and utilitarianism (1806-1873)
n. machinery that processes materials by grinding or crushing
v. move about in a confused manner"
profitable,a. yielding material gain or profit
productive,"a. producing or capable of producing (especially abundantly)
s. yielding positive results"
domestic,"n. a servant who is paid to perform menial tasks around the household
a. of concern to or concerning the internal affairs of a nation
a. of or relating to the home
a. of or involving the home or family"
idyllic,"s. excellent and delightful in all respects
s. suggestive of an idyll; charmingly simple and serene"
scale,"n. an ordered reference standard
n. relative magnitude
n. the ratio between the size of something and a representation of it
n. a specialized leaf or bract that protects a bud or catkin"
furniture,n. furnishings that make a room or other area ready for occupancy
rubbish,"n. worthless material that is to be disposed of
v. attack strongly"
trash,"n. worthless people
v. dispose of (something useless or old)"
hurdle,"n. a light movable barrier that competitors must leap over in certain races
n. an obstacle that you are expected to overcome
v. jump a hurdle"
sustenance,n. the act of sustaining life by food or providing a means of subsistence
nostalgia,n. longing for something past
singe,v. burn superficially or lightly
baggage,"n. cases used to carry belongings when traveling
n. a worthless or immoral woman
n. the portable equipment and supplies of an army"
outing,"n a journey taken for pleasure
n a day devoted to an outdoor social gathering
v to state openly and publicly one's homosexuality
v reveal (something) about somebody's identity or lifestyle
v be made known; be disclosed or revealed"
regimen,n. (medicine) a systematic plan for therapy (often including diet)
slag,"n. the scum formed by oxidation at the surface of molten metals
v. convert into slag"
sojourn,"n. a temporary stay (e.g., as a guest)
v. spend a certain length of time; reside temporarily"
dwell,"v. originate (in)
v. exist or be situated within"
babysit,none
tease,"n. someone given to teasing (as by mocking or stirring curiosity)
n. the act of harassing someone playfully or maliciously (especially by ridicule); provoking someone with persistent annoyances
v. annoy persistently
v. harass with persistent criticism or carping"
inhabit,v. be present in
scorch,"n. a surface burn
n. a plant disease that produces a browning or scorched appearance of plant tissues
n. a discoloration caused by heat
v. become superficially burned"
nurture,"n the properties acquired as a consequence of the way you were treated as a child
n helping someone grow up to be an accepted member of the community
v help develop, help grow
v bring up
v provide with nourishment"
reside,v. make one's home in a particular place or community
resident,"n. someone who lives at a particular place for a prolonged period or who was born there
a. living in a particular place"
deserted,"v leave someone who needs or counts on you; leave in the lurch
v desert (a cause, a country or an army), often in order to join the opposing cause, country, or army
v leave behind
s forsaken by owner or inhabitants"
desolate,s. crushed by grief
bleak,s. unpleasantly cold and damp
sterile,"a. incapable of reproducing
s. deficient in originality or creativity; lacking powers of invention"
barren,"n. an uninhabited wilderness that is worthless for cultivation
s. not bearing offspring
s. completely wanting or lacking"
agrarian,s. relating to rural matters
clay,"n. a very fine-grained soil that is plastic when moist but hard when fired
n. United States general who commanded United States forces in Europe from 1945 to 1949 and who oversaw the Berlin airlift (1897-1978)
n. United States politician responsible for the Missouri Compromise between free and slave states (1777-1852)"
clod,"n a compact mass
n an awkward stupid person"
stodgy,"s. heavy and starchy and hard to digest
s. excessively conventional and unimaginative and hence dull"
stout,"n. a strong very dark heavy-bodied ale made from pale malt and roasted unmalted barley and (often) caramel malt with hops
n. a garment size for a large or heavy person"
obese,s excessively fat
corpulent,s. excessively fat
shabby,s. mean and unworthy and despicable
ragged,"s. being or dressed in clothes that are worn or torn
s. worn out from stress or strain
s. having an irregular outline"
bald,"v. grow bald; lose hair on one's head
s. with no effort to conceal
s. lacking hair on all or most of the scalp
s. without the natural or usual covering"
aspect,"n. a distinct feature or element in a problem
n. a characteristic to be considered
n. the beginning or duration or completion or repetition of the action of a verb"
costume,"n. the attire worn in a play or at a fancy dress ball
n. unusual or period attire not characteristic of or appropriate to the time and place
n. the prevalent fashion of dress (including accessories and hair style as well as garments)
n. the attire characteristic of a country or a time or a social class"
attire,n. clothing of a distinctive style or for a particular occasion
outfit,"n. any cohesive unit such as a military company
n. a set of clothing (with accessories)"
garb,"n clothing of a distinctive style or for a particular occasion
v provide with clothes or put clothes on"
strap,"n. an elongated leather strip (or a strip of similar material) for binding things together or holding something in position
n. hanger consisting of a loop of leather suspended from the ceiling of a bus or train; passengers hold onto it
n. a band that goes over the shoulder and supports a garment or bag
n. whip consisting of a strip of leather used in flogging"
guise,n. an artful or simulated semblance
clothing,n. a covering designed to be worn on a person's body
array,"n. an orderly arrangement
n. an impressive display
n. especially fine or decorative clothing
n. an arrangement of aerials spaced to give desired directional characteristics"
cosmetics,n a toiletry designed to beautify the body
suit,"n. a set of garments (usually including a jacket and trousers or skirt) for outerwear all of the same fabric and color
n. (slang) a businessman dressed in a business suit
n. a petition or appeal made to a person of superior status or rank
n. playing card in any of four sets of 13 cards in a pack; each set has its own symbol and color"
sole,"n. the underside of footwear or a golf club
n. lean flesh of any of several flatfish
n. the underside of the foot
n. right-eyed flatfish; many are valued as food; most common in warm seas especially European"
drowsy,"s. half asleep
s. showing lack of attention or boredom"
nap,"n. a soft or fuzzy surface texture
n. sleeping for a short period of time (usually not in bed)
v. take a siesta"
recreation,"n an activity that diverts or amuses or stimulates
n activity that refreshes and recreates; activity that renews your health and spirits by enjoyment and relaxation"
lull,"n. a period of calm weather
v. calm by deception
v. become quiet or less intensive"
beguile,"v influence by slyness
v attract; cause to be enamored"
doze,n. a light fitful sleep
bask,v. be exposed
fateful,"s. having momentous consequences; of decisive importance
s. ominously prophetic"
imminent,s close in time; about to occur
estimable,"a. deserving of respect or high regard
s. deserving of esteem and respect"
apt,"s. (usually followed by `to') naturally disposed toward
s. at risk of or subject to experiencing something usually unpleasant
s. mentally quick and resourceful"
promising,s. showing possibility of achievement or excellence
provident,"a. providing carefully for the future
s. careful in regard to your own interests"
prospect,"n. the possibility of future success
v. search for something desirable
v. explore for useful or valuable things or substances, such as minerals"
prospective,a. of or concerned with or related to the future
perspective,n. the appearance of things relative to one another as determined by their distance from the viewer
auspice,n. a favorable omen
tendency,"n. a characteristic likelihood of or natural disposition toward a certain condition or character or effect
n. a general direction in which something tends to move"
precursor,"n. a substance from which another substance is formed (especially by a metabolic reaction)
n. a person who goes before or announces the coming of another"
prediction,"n. the act of predicting (as by reasoning about the future)
n. a statement made about the future"
surmise,v. infer from incomplete evidence
foretell,"v foreshadow or presage
v make a prediction about; tell in advance
v indicate by signs"
foresee,"v realize beforehand
v picture to oneself; imagine possible
v act in advance of; deal with ahead of time"
foresight,n. providence by virtue of planning prudently for the future
current,"n. a flow of electricity through a conductor
n. a steady flow of a fluid (usually from natural causes)
a. occurring in or belonging to the present time"
forecast,v. predict in advance
disaster,n. an act that has disastrous consequences
helpless,"s. lacking in or deprived of strength or power
s. unable to function; without help
s. unable to manage independently"
disastrous,s (of events) having extremely unfortunate or dire consequences; bringing ruin
unfortunately,r. by bad luck
calamity,n. an event resulting in great loss and misfortune
holocaust,"n. an act of mass destruction and loss of life (especially in war or by fire)
n. the mass murder of Jews under the German Nazi regime from 1941 until 1945"
carnage,n the savage and excessive killing of many people
cataclysm,"n a sudden violent change in the earth's surface
n an event resulting in great loss and misfortune"
avalanche,"n. a slide of large masses of snow and ice and mud down a mountain
n. a sudden appearance of an overwhelming number of things
v. gather into a huge mass and roll down a mountain, of snow"
catastrophe,"n. a state of extreme (usually irremediable) ruin and misfortune
n. a sudden violent change in the earth's surface"
plague,"n. a serious (sometimes fatal) infection of rodents caused by Yersinia pestis and accidentally transmitted to humans by the bite of a flea that has bitten an infected animal
n. any epidemic disease with a high death rate
n. any large scale calamity (especially when thought to be sent by God)
n. an annoyance"
casualty,"n. someone injured or killed or captured or missing in a military engagement
n. someone injured or killed in an accident
n. a decrease of military personnel or equipment"
mishap,n. an instance of misfortune
adversity,"n. a state of misfortune or affliction
n. a stroke of ill fortune; a calamitous event"
afflict,"v. cause great unhappiness for; distress
v. cause physical pain or suffering in"
defunct,"s. no longer in force or use; inactive
s. having ceased to exist or live"
lethal,s of an instrument of certain death
deadly,"s. causing or capable of causing death
s. of an instrument of certain death
s. extremely poisonous or injurious; producing venom
s. involving loss of divine grace or spiritual death"
demise,v. transfer by a lease or by a will
choke,"n. a coil of low resistance and high inductance used in electrical circuits to pass direct current and attenuate alternating current
n. a valve that controls the flow of air into the carburetor of a gasoline engine
v. breathe with great difficulty, as when experiencing a strong emotion
v. be too tight; rub or press"
smother,"n. a stifling cloud of smoke
v. envelop completely
v. deprive of oxygen and prevent from breathing
v. conceal or hide"
expire,"v lose validity
v pass from physical life and lose all bodily attributes and functions necessary to sustain life
v expel air"
mortal,"a. subject to death
s. unrelenting and deadly"
sedate,"v. cause to be calm or quiet as by administering a sedative to
s. characterized by dignity and propriety"
tranquil,"s (of a body of water) free from disturbance by heavy waves
s not agitated; without losing self-possession"
placid,s. (of a body of water) free from disturbance by heavy waves
static,"n. a crackling or hissing noise caused by electrical interference
n. angry criticism
s. showing little if any change"
serene,s. completely clear and fine
serenity,"n a disposition free from stress or emotion
n the absence of mental stress or anxiety"
still,"n. a static photograph (especially one taken from a movie and used for advertising purposes)
n. an apparatus used for the distillation of liquids; consists of a vessel in which a substance is vaporized by heat and a condenser where the vapor is condensed
v. lessen the intensity of or calm
v. make motionless"
lull,"n. a period of calm weather
v. calm by deception
v. become quiet or less intensive"
disgraced,"v bring shame or dishonor upon
v reduce in worth or character, usually verbally
v damage the reputation of
s suffering shame"
dingy,"s thickly covered with ingrained dirt or soot
s (of color) discolored by impurities; not bright and clear
s causing dejection"
messy,s. dirty and disorderly
slovenly,s negligent of neatness especially in dress and person; habitually dirty and unkempt
frowzy,s negligent of neatness especially in dress and person; habitually dirty and unkempt
obscene,s. designed to incite to indecency or lust
indecent,"s. not in keeping with accepted standards of what is right or proper in polite society
a. offensive to good taste especially in sexual matters
s. offending against sexual mores in conduct or appearance"
impure,"a. combined with extraneous elements
a. (used of persons or behaviors) immoral or obscene"
blemish,"n. a mark or flaw that spoils the appearance of something (especially on a person's body)
v. mar or impair with a flaw"
smear,"n. slanderous defamation
n. a thin tissue or blood sample spread on a glass slide and stained for cytologic examination and diagnosis under a microscope
v. stain by smearing or daubing with a dirty substance
v. make a smudge on; soil by smudging"
defile,"n. a narrow pass (especially one between mountains)
v. place under suspicion or cast doubt upon"
spot,"n. a short section or illustration (as between radio or tv programs or in a magazine) that is often used for advertising
n. a small contrasting part of something
n. a section of an entertainment that is assigned to a specific performer or performance
n. a business establishment for entertainment"
incompetent,"n. someone who is not competent to take effective action
a. legally not qualified or sufficient
a. not qualified or suited for a purpose
s. not doing a good job"
unbecoming,s not in keeping with accepted standards of what is right or proper in polite society
inept,s. revealing lack of perceptiveness or judgment or finesse
unseemly,s not in keeping with accepted standards of what is right or proper in polite society
ineligible,"a. not eligible
s. prohibited by official rules"
impropriety,"n. an improper demeanor
n. the condition of being improper"
immature,"a. characteristic of a lack of maturity
a. not yet mature"
fervent,s. extremely hot
rough,"n. the part of a golf course bordering the fairway where the grass is not cut short
a. having or caused by an irregular surface
s. (of persons or behavior) lacking refinement or finesse
a. of the margin of a leaf shape; having the edge cut or fringed or scalloped"
roughly,"r. with roughness or violence (`rough' is an informal variant for `roughly')
r. with rough motion as over a rough surface"
intense,"a. possessing or displaying a distinctive feature to a heightened degree
s. (of color) having the highest saturation"
intensive,"s. characterized by a high degree or intensity; often used as a combining form
a. tending to give force or emphasis
a. of agriculture; intended to increase productivity of a fixed area by expending more capital and labor"
intensely,r. in an intense manner
exorbitant,s. greatly exceeding bounds of reason or moderation
probable,"n. an applicant likely to be chosen
a. likely but not certain to be or become true or real
s. apparently destined"
violent,"a. acting with or marked by or resulting from great force or energy or emotional intensity
s. effected by force or injury rather than natural causes
s. (of colors or sounds) intensely vivid or loud"
drastic,s. forceful and extreme and rigorous
dead,"n. people who are no longer living
n. a time when coldness (or some other quality associated with death) is intense
a. no longer having or seeming to have or expecting to have life
a. not showing characteristics of life especially the capacity to sustain life; no longer exerting force or having energy or heat"
deadly,"s. causing or capable of causing death
s. of an instrument of certain death
s. extremely poisonous or injurious; producing venom
s. involving loss of divine grace or spiritual death"
sharp,"n. a musical notation indicating one half step higher than the note named
n. a long thin sewing needle with a sharp point
s. harsh
a. keenly and painfully felt; as if caused by a sharp edge or point"
categorical,a. relating to or included in a category or categories
