parasite,n. an animal or plant that lives in or on a host (another animal or plant); it obtains nourishment from the host without benefiting or killing the host
parasitic,"a. relating to or caused by parasites
s. of plants or persons; having the nature or habits of a parasite or leech; living off another"
mimicry,n. the resemblance of an animal species to another species or to natural objects; provides concealment and protection from predators
symbiosis,n. the relation between two different species of organisms that are interdependent; each gains benefits from the other
symbiotic,s. used of organisms (especially of different species) living together but not necessarily in a relation beneficial to each
creature,"n. a human being; `wight' is an archaic term
n. a person who is controlled by others and is used to perform unpleasant or dishonest tasks for someone else"
organism,"n. a living thing that has (or can develop) the ability to act or function independently
n. a system considered analogous in structure or function to a living body"
strain,"n. (physics) deformation of a physical body under the action of applied forces
n. (psychology) nervousness resulting from mental stress
n. injury to a muscle (often caused by overuse); results in swelling and pain
n. an intense or violent exertion"
species,"n. (biology) taxonomic group whose members can interbreed
n. a specific kind of something"
vital,"s. performing an essential function in the living body
s. manifesting or characteristic of life"
ripe,"a. fully developed or matured and ready to be eaten or used
s. fully prepared or eager
s. at the highest point of development especially in judgment or knowledge"
evolve,"v. work out
v. undergo development or evolution"
evolutionary,a. of or relating to or produced by evolution
Darwinism,n. a theory of organic evolution claiming that new species arise and are perpetuated by natural selection
extinct,"a. no longer in existence; lost or especially having died out leaving no living representatives
a. (of e.g. volcanos) permanently inactive
s. being out or having grown cold"
extinction,"n. no longer active; extinguished
n. no longer in existence
n. the reduction of the intensity of radiation as a consequence of absorption and radiation"
breed,"n. a special variety of domesticated animals within a species
n. a special type
v. copulate with a female, used especially of horses
v. cause to procreate (animals)"
reproduction,"n. the process of generating offspring
n. recall that is hypothesized to work by storing the original stimulus input and reproducing it during recall
n. the act of making copies
n. the sexual activity of conceiving and bearing offspring"
proliferate,"v. grow rapidly
v. cause to grow or increase rapidly"
propagate,"v. transmit from one generation to the next
v. travel through the air
v. transmit
v. transmit or cause to broaden or spread"
subsist,v support oneself
exist,"v. have an existence, be extant
v. support oneself"
posterity,n. all future generations
fermentation,"n a state of agitation or turbulent change or development
n a process in which an agent causes an organic substance to break down into simpler substances; especially, the anaerobic breakdown of sugar into alcohol"
respiration,"n. the metabolic processes whereby certain organisms obtain energy from organic molecules; processes that take place in the cells and tissues during which energy is released and carbon dioxide is produced and absorbed by the blood to be transported to the lungs
n. a single complete act of breathing in and out"
stodgy,"s. heavy and starchy and hard to digest
s. excessively conventional and unimaginative and hence dull"
secrete,"v. generate and separate from cells or bodily fluids
v. place out of sight; keep secret"
secretion,"n. the organic process of synthesizing and releasing some substance
n. a functionally specialized substance (especially one that is not a waste) released from a gland or cell"
assimilate,"v. become similar to one's environment
v. make similar
v. take (gas, light or heat) into a solution
v. become similar in sound"
immune,"n. a person who is immune to a particular infection
a. relating to the condition of immunity
s. secure against
s. relating to or conferring immunity (to disease or infection)"
immunity,"n. (medicine) the condition in which an organism can resist disease
n. the quality of being unaffected by something"
metabolism,n. the organic processes (in a cell or organism) that are necessary for life
morphology,"n. the branch of biology that deals with the structure of animals and plants
n. studies of the rules for forming admissible words
n. the admissible arrangement of sounds in words"
microscope,n. magnifier of the image of small objects
calorie,"n. a unit of heat equal to the amount of heat required to raise the temperature of one kilogram of water by one degree at one atmosphere pressure; used by nutritionists to characterize the energy-producing potential in food
n. unit of heat defined as the quantity of heat required to raise the temperature of 1 gram of water by 1 degree centigrade at atmospheric pressure"
carbohydrate,n. an essential structural component of living cells and source of energy for animals; includes simple sugars with small molecules as well as macromolecular substances; are classified according to the number of monosaccharide groups they contain
glucose,n. a monosaccharide sugar that has several forms; an important source of physiological energy
protein,n. any of a large group of nitrogenous organic compounds that are essential constituents of living cells; consist of polymers of amino acids; essential in the diet of animals for growth and for repair of tissues; can be obtained from meat and eggs and milk and legumes
organ,"n. a fully differentiated structural and functional unit in an animal that is specialized for some particular function
n. a government agency or instrument devoted to the performance of some specific function
n. a periodical that is published by a special interest group
n. wind instrument whose sound is produced by means of pipes arranged in sets supplied with air from a bellows and controlled from a large complex musical keyboard"
bacteria,n. (microbiology) single-celled or noncellular spherical or spiral or rod-shaped organisms lacking chlorophyll that reproduce by fission; important as pathogens and for biochemical properties; taxonomy is difficult; often considered to be plants
vaccine,n. immunogen consisting of a suspension of weakened or dead pathogenic cells injected in order to stimulate the production of antibodies
fungus,n. an organism of the kingdom Fungi lacking chlorophyll and feeding on organic matter; ranging from unicellular or multicellular organisms to spore-bearing syncytia
membrane,"n. a thin pliable sheet of material
n. a pliable sheet of tissue that covers or lines or connects the organs or cells of animals or plants"
viability,"n. (of living things) capable of normal growth and development
n. capable of being done in a practical and useful way"
picturesque,"s. suggesting or suitable for a picture; pretty as a picture
s. strikingly expressive"
vivid,s. having the clarity and freshness of immediate experience
sculpture,"n. a three-dimensional work of plastic art
n. creating figures or designs in three dimensions"
statue,n. a sculpture representing a human or animal
draw,"n. a gully that is shallower than a ravine
n. the finish of a contest in which the score is tied and the winner is undecided
n. anything (straws or pebbles etc.) taken or chosen at random
n. a playing card or cards dealt or taken from the pack"
gallery,"n. spectators at a golf or tennis match
n. a room or series of rooms where works of art are exhibited
n. a long usually narrow room used for some specific purpose
n. a covered corridor (especially one extending along the wall of a building and supported with arches or columns)"
portrait,"n. any likeness of a person, in any medium"
impressionism,n. a school of late 19th century French painters who pictured appearances by strokes of unmixed colors to give the impression of reflected light
portray,"v. portray in words
v. make a portrait of
v. represent abstractly, for example in a painting, drawing, or sculpture"
mold,"n. container into which liquid is poured to create a given shape when it hardens
n. loose soil rich in organic matter
n. a fungus that produces a superficial growth on various kinds of damp or decaying organic matter"
embroider,"v. decorate with needlework
v. add details to"
tragedy,n. drama in which the protagonist is overcome by some superior force or circumstance; excites terror or pity
opera,"n. a drama set to music; consists of singing with orchestral accompaniment and an orchestral overture and interludes
n. a commercial browser
n. a building where musical dramas are performed"
enact,v. act out; represent or perform as if in a play
pose,"n. a posture assumed by models for photographic or artistic purposes
v. pretend to be someone you are not; sometimes with fraudulent intentions
v. behave affectedly or unnaturally in order to impress others"
rehearse,v. engage in a rehearsal (of)
prelude,"n. music that precedes a fugue or introduces an act in an opera
v. serve as a prelude or opening to
v. play as a prelude"
character,"n. the inherent complex of attributes that determines a persons moral and ethical actions and reactions
n. an actor's portrayal of someone in a play
n. a person of a specified kind (usually with many eccentricities)
n. good repute"
role,n. normal or customary activity of a person in a particular social setting
design,"n. the act of working out the form of something (as by making a sketch or outline or plan)
n. an arrangement scheme
n. a decorative or artistic work
n. a preliminary sketch indicating the plan for something"
profile,"n. an analysis (often in graphical form) representing the extent to which something exhibits various characteristics
n. an outline of something (especially a human face as seen from one side)
n. biographical sketch
n. a vertical section of the Earth's crust showing the different horizons or layers"
renaissance,n. the period of European history at the close of the Middle Ages and the rise of the modern world; a cultural rebirth from the 14th through the middle of the 17th centuries
conjure,"v summon into action or bring into existence, often as if by magic
v ask for or request earnestly
v engage in plotting or enter into a conspiracy, swear together"
aesthetic,"n. (philosophy) a philosophical theory as to what is beautiful
a. relating to or dealing with the subject of aesthetics
a. concerning or characterized by an appreciation of beauty or good taste
s. aesthetically pleasing"
romantic,"n. a soulful or amorous idealist
a. belonging to or characteristic of Romanticism or the Romantic Movement in the arts"
mythology,"n. myths collectively; the body of stories associated with a culture or institution or person
n. the study of myths"
arcade,"n. a covered passageway with shops and stalls on either side
n. a structure composed of a series of arches supported by columns"
pottery,"n. ceramic ware made from clay and baked in a kiln
n. the craft of making earthenware
n. a workshop where clayware is made"
virtuoso,n. a musician who is a consummate master of technique and artistry
fresco,"n. a mural done with watercolors on wet plaster
n. a durable method of painting on a wall by using watercolors on wet plaster
v. paint onto wet plaster on a wall"
baroque,"n. the historic period from about 1600 until 1750 when the baroque style of art, architecture, and music flourished in Europe
n. elaborate and extensive ornamentation in decorative art and architecture that flourished in Europe in the 17th century
s. having elaborate symmetrical ornamentation
a. of or relating to or characteristic of the elaborately ornamented style of architecture, art, and music popular in Europe between 1600 and 1750"
Dadaism,n a nihilistic art movement (especially in painting) that flourished in Europe early in the 20th century; based on irrationality and negation of the accepted laws of beauty
gregarious,"a. (of animals) tending to form a group with others of the same species
s. instinctively or temperamentally seeking and enjoying the company of others
a. (of plants) growing in groups that are close together"
swarm,n. a group of many things in the air or on the ground
flock,"n. a church congregation guided by a pastor
n. a group of birds
n. a group of sheep or goats
v. move as a crowd or in a group"
herd,"n. a group of cattle or sheep or other domestic mammals all of the same kind that are herded by humans
n. a group of wild mammals of one species that remain together: antelope or elephants or seals or whales or zebra
v. cause to herd, drive, or crowd together
v. move together, like a herd"
mammal,n. any warm-blooded vertebrate having the skin more or less covered with hair; young are born alive except for the small subclass of monotremes and nourished with milk
carnivore,"n. a terrestrial or aquatic flesh-eating mammal
n. any animal that feeds on flesh"
carnivorous,"a. relating to or characteristic of carnivores
a. (used of plants as well as animals) feeding on animals"
appetite,n. a feeling of craving something
herbivorous,a. feeding only on plants
omnivorous,a. feeding on both plants and animals
predator,n. any animal that lives by preying on other animals
predatory,s. living by preying on other animals especially by catching living prey
prey,"n. a person who is the aim of an attack (especially a victim of ridicule or exploitation) by some hostile person or influence
n. animal hunted or caught for food
v. profit from in an exploitatory manner"
poikilotherm,n an animal whose body temperature varies with the temperature of its surroundings; any animal except birds and mammals
rodent,n. relatively small placental mammals having a single pair of constantly growing incisor teeth specialized for gnawing
scavenger,"n. a chemical agent that is added to a chemical mixture to counteract the effects of impurities
n. any animal that feeds on refuse and other decaying organic matter"
microbe,n. a minute life form (especially a disease-causing bacterium); the term is not in technical use
reptile,"n. any cold-blooded vertebrate of the class Reptilia including tortoises, turtles, snakes, lizards, alligators, crocodiles, and extinct forms"
homotherm,n an animal that has a body temperature that is relatively constant and independent of the environmental temperature
primate,n. any placental mammal of the order Primates; has good eyesight and flexible hands and feet
primates,n. an animal order including lemurs and tarsiers and monkeys and apes and human beings
mollusk,n. invertebrate having a soft unsegmented body usually enclosed in a shell
coelenterate,n. radially symmetrical animals having saclike bodies with only one opening and tentacles with stinging structures; they occur in polyp and medusa forms
vertebrate,"n. animals having a bony or cartilaginous skeleton with a segmented spinal column and a large brain enclosed in a skull or cranium
a. having a backbone or spinal column"
invertebrate,"n. any animal lacking a backbone or notochord; the term is not used as a scientific classification
a. lacking a backbone or spinal column"
finch,n. any of numerous small songbirds with short stout bills adapted for crushing seeds
fowl,"v. hunt fowl
v. hunt fowl in the forest"
monster,"n. an imaginary creature usually having various human and animal parts
n. a cruel wicked and inhuman person
n. (medicine) a grossly malformed and usually nonviable fetus"
hordes,"n. a vast multitude
n. a nomadic community
n. a moving crowd"
insect,n. small air-breathing arthropod
worm,"n. any of numerous relatively small elongated soft-bodied animals especially of the phyla Annelida and Chaetognatha and Nematoda and Nemertea and Platyhelminthes; also many insect larvae
n. a person who has a nasty or unethical character undeserving of respect
n. a software program capable of reproducing itself that can spread from one computer to the next over a network
n. screw thread on a gear with the teeth of a worm wheel or rack"
beast,n. a cruelly rapacious person
aquatic,"n. a plant that lives in or on water
a. relating to or consisting of or being in water
a. operating or living or growing in water"
amphibian,"n. a flat-bottomed motor vehicle that can travel on land or water
n. an airplane designed to take off and land on water
n. cold-blooded vertebrate typically living on land but breeding in water; aquatic larvae undergo metamorphosis into adult form"
migrate,"v. move from one country or region to another and settle there
v. move periodically or seasonally"
graze,"n. a superficial abrasion
n. the act of grazing
v. break the skin (of a body part) by scraping
v. scrape gently"
gasp,n. a short labored intake of breath with the mouth open
peck,"n. a British imperial capacity measure (liquid or dry) equal to 2 gallons
n. a United States dry measure equal to 8 quarts or 537.605 cubic inches
v. hit lightly with a picking motion
v. eat by pecking at, like a bird"
trot,"n. a gait faster than a walk; diagonally opposite legs strike the ground together
v. run at a moderately swift pace
v. ride at a trot
v. cause to trot"
dormant,"s. in a condition of biological rest or suspended animation
a. (of e.g. volcanos) not erupting and not extinct
s. lying with head on paws as if sleeping"
offspring,"n. the immediate descendants of a person
n. something that comes into existence as a result"
spawn,"n. the mass of eggs deposited by fish or amphibians or molluscs
v. lay spawn"
pregnant,a. carrying developing offspring within the body or being about to produce new life
hatch,"n. the production of young from an egg
n. shading consisting of multiple crossing lines
n. a movable barrier covering a hatchway
v. emerge from the eggs"
breed,"n. a special variety of domesticated animals within a species
n. a special type
v. copulate with a female, used especially of horses
v. cause to procreate (animals)"
domesticate,"v. adapt (a wild plant or unclaimed land) to the environment
v. overcome the wildness of; make docile and tractable
v. make fit for cultivation, domestic life, and service to humans"
fertilize,"v. provide with fertilizers or add nutrients to
v. make fertile or productive"
regeneration,"n. (biology) growth anew of lost tissue or destroyed parts or organs
n. the activity of spiritual or physical renewal"
reproduce,"v. make a copy or equivalent of
v. have offspring or produce more individuals of a given animal or plant
v. recreate a sound, image, idea, mood, atmosphere, etc."
squeak,n. a short high-pitched noise
chirp,n. a sharp sound made by small birds or insects
hibernate,"v. sleep during winter
v. be in an inactive or dormant state"
camouflage,"n. fabric dyed with splotches of green and brown and black and tan; intended to make the wearer of a garment made of this fabric hard to distinguish from the background
n. device or stratagem for concealment or deceit
v. disguise by camouflaging; exploit the natural surroundings to disguise something"
extinction,"n. no longer active; extinguished
n. no longer in existence
n. the reduction of the intensity of radiation as a consequence of absorption and radiation"
monogamous,a. (used of relationships and of individuals) having one mate
polyandrous,s. having more than one husband at a time
nest,"n. a structure in which animals lay eggs or give birth to their young
n. a kind of gun emplacement
n. a cosy or secluded retreat
n. a gang of people (criminals or spies or terrorists) assembled in one locality"
niche,"n. a position particularly well suited to the person who occupies it
n. (ecology) the status of an organism within its environment and community (affecting its survival as a species)"
pest,"n. a persistently annoying person
n. any unwanted and destructive insect or other animal that attacks food or crops or livestock etc."
habitat,n. the type of environment in which an organism or group normally lives or occurs
rhinoceros,n. massive powerful herbivorous odd-toed ungulate of southeast Asia and Africa having very thick skin and one or two horns on the snout
chimpanzee,n. intelligent somewhat arboreal ape of equatorial African forests
baboon,n. large terrestrial monkeys having doglike muzzles
gorilla,n. largest anthropoid ape; terrestrial and vegetarian; of forests of central west Africa
lizard,n. relatively long-bodied reptile with usually two pairs of legs and a tapering tail
moth,n. typically crepuscular or nocturnal insect having a stout body and feathery or hairlike antennae
canary,"n. a female singer
n. any of several small Old World finches
s. having the color of a canary; of a light to moderate yellow"
caterpillar,"n. a wormlike and often brightly colored and hairy or spiny larva of a butterfly or moth
n. a large tracked vehicle that is propelled by two endless metal belts; frequently used for moving earth in construction and farm work"
dinosaur,n. any of numerous extinct terrestrial reptiles of the Mesozoic era
chameleon,"n. a changeable or inconstant person
n. lizard of Africa and Madagascar able to change skin color and having a projectile tongue"
larva,n. the immature free-living form of most invertebrates and amphibians and fish which at hatching from the egg is fundamentally unlike its parent and must metamorphose
bat,"n. nocturnal mouselike mammal with forelimbs modified to form membranous wings and anatomical adaptations for echolocation by which they navigate
n. (baseball) a turn trying to get a hit
n. a club used for hitting a ball in various games
v. strike with, or as if with a baseball bat"
family,"n. a social unit living together
n. primary social group; parents and children
n. people descended from a common ancestor
n. (biology) a taxonomic group containing one or more genera"
class,"n. a collection of things sharing a common attribute
n. a body of students who are taught together
n. people having the same social, economic, or educational status
n. a league ranked by quality"
suborder,n. (biology) taxonomic group that is a subdivision of an order
order,"n. (often plural) a command given by a superior (e.g., a military or law enforcement officer) that must be obeyed
n. a degree in a continuum of size or quantity
n. established customary state (especially of society)
n. a commercial document used to request someone to supply something in return for payment and providing specifications and quantities"
genus,"n. a general kind of something
n. (biology) taxonomic group containing one or more species"
antenna,"n. an electrical device that sends or receives radio or television signals
n. sensitivity similar to that of a receptor organ
n. one of a pair of mobile appendages on the head of e.g. insects and crustaceans; typically sensitive to touch and taste"
tentacle,"n. something that acts like a tentacle in its ability to grasp and hold
n. any of various elongated tactile or prehensile flexible organs that occur on the head or near the mouth in many animals; used for feeling or grasping or locomotion"
spleen,n. a large dark-red oval organ on the left side of the body between the stomach and the diaphragm; produces cells involved in immune responses
hide,"n. the dressed skin of an animal (especially a large animal)
n. body covering of a living animal
v. prevent from being seen or discovered
v. be or go into hiding; keep out of sight, as for protection and safety"
spine,"n. a small sharp-pointed tip resembling a spike on a stem or leaf
n. the part of a book's cover that encloses the inner side of the book's pages and that faces outward when the book is shelved
n. a sharp rigid animal process or appendage; as a porcupine quill or a ridge on a bone or a ray of a fish fin"
spineless,a. lacking spiny processes
toe,"n. one of the digits of the foot
n. the part of footwear that provides a covering for the toes
n. forepart of a hoof
n. (golf) the part of a clubhead farthest from the shaft"
bill,"n. a statute in draft before it becomes law
n. an itemized statement of money owed for goods shipped or services rendered
n. a piece of paper money (especially one issued by a central bank)
n. the entertainment offered at a public presentation"
beak,"n. beaklike mouth of animals other than birds (e.g., turtles)
n. horny projecting mouth of a bird
n. a beaklike, tapering tip on certain plant structures
n. informal terms for the nose"
fuzzy,s. confused and not coherent; not clearly thought out
hump,"n something that bulges out or is protuberant or projects from its surroundings
v round one's back by bending forward and drawing the shoulders forward
v have sexual intercourse with"
scale,"n. an ordered reference standard
n. relative magnitude
n. the ratio between the size of something and a representation of it
n. a specialized leaf or bract that protects a bud or catkin"
wing,"n. a movable organ for flying (one of a pair)
n. one of the horizontal airfoils on either side of the fuselage of an airplane
n. a stage area out of sight of the audience
n. a unit of military aircraft"
fluffy,s like down or as soft as down
carnal,a. of or relating to the body or flesh
nervous,"s. easily agitated
a. of or relating to the nervous system"
fat,"n. a soft greasy substance occurring in organic tissue and consisting of a mixture of lipids (mostly triglycerides)
a. having an (over)abundance of flesh
s. having a relatively large diameter
s. lucrative"
grease,"n. a thick fatty oil (especially one used to lubricate machinery)
v. lubricate with grease"
greasy,"s. containing an unusual amount of grease or oil
s. smeared or soiled with grease or oil"
