electromagnetism,"n. magnetism produced by an electric current
n. the branch of physics concerned with electromagnetic phenomena"
electronic,"a. of or relating to electronics; concerned with or using devices that operate on principles governing the behavior of electrons
a. of or concerned with electrons"
electronics,n. the branch of physics that deals with the emission and effects of electrons and with the use of electronic devices
amplifier,n. electronic equipment that increases strength of signals passing through it
battery,"n. group of guns or missile launchers operated together at one place
n. a device that produces electricity; may have several primary or secondary cells arranged in parallel or series
n. a collection of related things intended for use together
n. a unit composed of the pitcher and catcher"
chip,"n. a triangular wooden float attached to the end of a log line
n. a piece of dried bovine dung
n. a thin crisp slice of potato fried in deep fat
n. a small disk-shaped counter used to represent money when gambling"
conductor,"n. the person who leads a musical group
n. a substance that readily conducts e.g. electricity and heat
n. the person who collects fares on a public conveyance
n. a device designed to transmit electricity, heat, etc."
insulator,n. a material such as glass or porcelain with negligible electrical or thermal conductivity
magnet,n. (physics) a device that attracts iron and produces a magnetic field
magnetism,"n. attraction for iron; associated with electric currents as well as magnets; characterized by fields of force
n. the branch of science that studies magnetism"
semiconductor,n. a substance as germanium or silicon whose electrical conductivity is intermediate between that of a metal and an insulator; its conductivity increases with temperature and in the presence of impurities
transistor,n. a semiconductor device capable of amplification
ultraviolet,"n. radiation lying in the ultraviolet range; wave lengths shorter than light but longer than X rays
s. having or employing wavelengths shorter than light but longer than X-rays; lying outside the visible spectrum at its violet end"
microwave,"n. a short electromagnetic wave (longer than infrared but shorter than radio waves); used for radar and microwave ovens and for transmitting telephone, facsimile, video and data
n. kitchen appliance that cooks food by passing an electromagnetic wave through it; heat results from the absorption of energy by the water molecules in the food
v. cook or heat in a microwave oven"
mechanics,n. the branch of physics concerned with the motion of bodies in a frame of reference
gravitation,"n. movement downward resulting from gravitational attraction
n. a figurative movement toward some attraction"
oscillation,"n. the process of oscillating between states
n. (physics) a regular periodic variation in value about a mean"
statics,n. the branch of mechanics concerned with forces in equilibrium
relativity,"n. (physics) the theory that space and time are relative concepts rather than absolute concepts
n. the quality of being relative and having significance only in relation to something else"
velocity,n distance travelled per unit time
dynamics,n. the branch of mechanics concerned with the forces that cause motions of bodies
force,"n. a powerful effect or influence
n. (physics) the influence that produces a change in a physical quantity
n. physical energy or intensity
n. group of people willing to obey orders"
current,"n. a flow of electricity through a conductor
n. a steady flow of a fluid (usually from natural causes)
a. occurring in or belonging to the present time"
accelerate,"v. move faster
v. cause to move faster"
acceleration,"n. an increase in rate of change
n. the act of accelerating; increasing the speed
n. (physics) a rate of increase of velocity"
transparent,s. easily understood or seen through (because of a lack of subtlety)
opaque,"a. not transmitting or reflecting light or radiant energy; impenetrable to sight
s. not clearly understood or expressed"
translucent,s. allowing light to pass through diffusely
optical,a. of or relating to or involving light or optics
optics,"n. the branch of physics that studies the physical properties of light
n. optical properties"
ray,"n. a branch of an umbel or an umbelliform inflorescence
n. (mathematics) a straight line extending from a point
n. any of the stiff bony spines in the fin of a fish
n. cartilaginous fishes having horizontally flattened bodies and enlarged winglike pectoral fins with gills on the underside; most swim by moving the pectoral fins"
spectrum,"n. an ordered array of the components of an emission or wave
n. a broad range of related objects or values or qualities or ideas or activities"
wavelength,"n. the distance (measured in the direction of propagation) between two points in the same phase in consecutive cycles of a wave
n. a shared orientation leading to mutual understanding"
magnifier,n. a scientific instrument that magnifies an image
lens,"n. a transparent optical device used to converge or diverge transmitted light and to form images
n. genus of small erect or climbing herbs with pinnate leaves and small inconspicuous white flowers and small flattened pods: lentils
n. (metaphor) a channel through which something can be seen or understood
n. biconvex transparent body situated behind the iris in the eye; its role (along with the cornea) is to focuses light on the retina"
vortex,"n the shape of something rotating rapidly
n a powerful circular current of water (usually the result of conflicting tides)"
buffer,"n. (chemistry) an ionic compound that resists changes in its pH
n. (computer science) a part of RAM used for temporary storage of data that is waiting to be sent to a device; used to compensate for differences in the rate of flow of data between components of a computer system
n. a power tool used to buff surfaces
n. a cushion-like device that reduces shock due to an impact"
fission,"n. reproduction of some unicellular organisms by division of the cell into two more or less equal parts
n. a nuclear reaction in which a massive nucleus splits into smaller nuclei with the simultaneous release of energy"
factious,s dissenting (especially dissenting with the majority opinion)
partisan,"n. a fervent and even militant proponent of something
n. a pike with a long tapering double-edged blade with lateral projections; 16th and 17th centuries
a. devoted to a cause or party"
board,"n. a committee having supervisory powers
n. a stout length of sawn timber; made in a wide variety of sizes and used for many purposes
n. a flat piece of material designed for a special purpose
n. food or meals in general"
Senate,n. assembly possessing high legislative powers
Congress,"n. the legislature of the United States government
n. a meeting of elected or appointed representatives
n. a national legislative assembly"
diplomatic,"a. relating to or characteristic of diplomacy
a. using or marked by tact in dealing with sensitive matters or people"
diplomacy,n. negotiation between nations
confederate,"n. a supporter of the Confederate States of America
n. someone who assists in a plot
v. form a confederation with; of nations
s. of or having to do with the southern Confederacy during the American Civil War"
league,"n. an association of sports teams that organizes matches for its members
n. an association of states or organizations or individuals for common action
n. an obsolete unit of distance of variable length (usually 3 miles)
v. unite to form a league"
affiliate,"n. a subordinate or subsidiary associate; a person who is affiliated with another or with an organization
n. a subsidiary or subordinate organization that is affiliated with another organization
v. join in an affiliation"
unconventional,"a. not conforming to accepted rules or standards
a. not conventional or conformist"
dictatorial,a. of or characteristic of a dictator
domestic,"n. a servant who is paid to perform menial tasks around the household
a. of concern to or concerning the internal affairs of a nation
a. of or relating to the home
a. of or involving the home or family"
potent,"s. having great influence
s. having or wielding force or authority
a. having a strong physiological or chemical effect
a. (of a male) capable of copulation"
authoritative,"s. having authority or ascendancy or influence
s. of recognized authority or excellence
s. sanctioned by established authority"
influential,a. having or exercising influence or power
centralized,a. drawn toward a center or brought under the control of a central authority
authority,"n. the power or right to give orders or make decisions
n. (usually plural) persons who exercise (administrative) control over others
n. an expert whose views are taken as definitive
n. official permission or approval"
privilege,"n. a special advantage or immunity or benefit not enjoyed by all
n. (law) the right to refuse to divulge information obtained in a confidential relationship
v. bestow a privilege upon"
democracy,"n. the political orientation of those who favor government by the people or by their elected representatives
n. a political system in which the supreme power lies in a body of citizens who can elect people to represent them"
petition,v. write a petition for something to somebody; request formally and in writing
domain,"n. territory over which rule or control is exercised
n. (mathematics) the set of values of the independent variable for which a function is defined"
territory,"n. an area of knowledge or interest
n. the geographical area under the jurisdiction of a sovereign state"
nationality,"n. people having common origins or traditions and often comprising a nation
n. the status of belonging to a particular nation by birth or naturalization"
kingdom,"n. a domain in which something is dominant
n. a country with a king as head of state
n. the domain ruled by a king or queen
n. a monarchy with a king or queen as head of state"
realm,"n a domain in which something is dominant
n the domain ruled by a king or queen
n a knowledge domain that you are interested in or are communicating about"
regimen,n. (medicine) a systematic plan for therapy (often including diet)
sovereignty,"n. government free from external control
n. the authority of a state to govern another state"
autonomy,"n. immunity from arbitrary exercise of authority: political independence
n. personal independence"
commission,"n. a fee for services rendered based on a percentage of an amount received or collected or agreed to be paid (as distinguished from a salary)
n. the act of granting authority to undertake certain functions
n. the state of being in good working order and ready for operation
n. a formal statement of a command or injunction to do something"
committee,"n. a special group delegated to consider some matter
n. a self-constituted organization to promote something"
election,"n. a vote to select the winner of a position or political office
n. the act of selecting someone or something; the exercise of deliberate choice
n. the status or fact of being elected
n. the predestination of some individuals as objects of divine mercy (especially as conceived by Calvinists)"
ballot,"n. a document listing the alternatives that is used in voting
v. vote by ballot"
ideology,n. imaginary or visionary theorization
parade,"n. a ceremonial procession including people marching
n. an extended (often showy) succession of persons or things
n. a visible display
v. walk ostentatiously"
govern,"v. direct or strongly influence the behavior of
v. exercise authority over; as of nations
v. require to be in a certain grammatical case, voice, or mood"
confer,"v. have a conference in order to talk something over
v. present"
entitle,"v. give the right to
v. give a title to"
exploit,"v. use or manipulate to one's advantage
v. draw from; make good use of"
maneuver,"n. a military training exercise
n. a deliberate coordinated movement requiring dexterity and skill
n. a move made to gain a tactical end"
reform,"n. a change for the better as a result of correcting abuses
n. a campaign aimed to correct abuses or malpractices
n. self-improvement in behavior or morals by abandoning some vice
v. make changes for improvement in order to remove abuse and injustices"
inspect,v. look over carefully
emigrate,v. leave one's country of residence for a new one
immigrate,"v. migrate to a new environment
v. introduce or send as immigrants
v. come into a new country and change residency"
exile,"n. a person who is voluntarily absent from home or country
n. a person who is expelled from home or country by authority
n. the act of expelling a person from their native land"
enslave,v. make a slave of; bring into servitude
hustle,"v. cause to move furtively and hurriedly
v. sell something to or obtain something from by energetic and especially underhanded activity
v. get by trying hard
v. pressure or urge someone into an action"
impel,v. urge or force (a person) to an action; constrain or motivate
oust,"v. remove from a position or office
v. remove and replace"
banish,"v. expel from a community or group
v. ban from a place of residence, as for punishment
v. expel, as if by official decree
v. drive away"
deport,"v behave in a certain manner
v hand over to the authorities of another country
v expel from a country"
enable,v. render capable or able for some task
reign,"n. a period during which something or somebody is dominant or powerful
n. the period during which a monarch is sovereign
n. royal authority; the dominion of a monarch
v. have sovereign power"
dominate,"v. be in control
v. have dominance or the power to defeat over
v. look down on"
abdicate,"v. give up, such as power, as of monarchs and emperors, or duties and obligations"
administer,"v. work in an administrative capacity; supervise or be in charge of
v. perform (a church sacrament) ritually
v. give or apply (medications)
v. direct the taking of"
administration,"n. a method of tending to or managing the affairs of a some group of people (especially the group's business affairs)
n. the persons (or committees or departments etc.) who make up a body for the purpose of administering something
n. the act of administering medication
n. the act of meting out justice according to the law"
institute,"n. an association organized to promote art or science or education
v. advance or set forth in court"
amendment,"n. the act of amending or correcting
n. a statement that is added to or revises or improves a proposal or document (a bill or constitution etc.)"
colonize,"v. settle as a colony; of countries in the developing world
v. settle as colonists or establish a colony (in)"
check,"n. a written order directing a bank to pay money
n. the bill in a restaurant
n. the act of inspecting or verifying
n. a mark left after a small piece has been chopped or broken off of something"
monarchy,n. an autocracy governed by a monarch who usually inherits the authority
republican,"n. a member of the Republican Party
n. an advocate of a republic (usually in opposition to a monarchy)
n. a tributary of the Kansas River that flows from eastern Colorado eastward through Nebraska and Kansas
a. relating to or belonging to the Republican Party"
anarchism,n. a political theory favoring the abolition of governments
doctrine,n. a belief (or system of beliefs) accepted as authoritative by some group or school
immigrant,n. a person who comes to a country where they were not born in order to settle there
municipal,"a. relating or belonging to or characteristic of a municipality
s. of or relating to the government of a municipality"
strike,"n. a group's refusal to work in protest against low pay or bad work conditions
n. an attack that is intended to seize or inflict damage on or destroy an objective
n. a score in tenpins: knocking down all ten with the first ball
n. (baseball) a pitch that the batter swings at and misses, or that the batter hits into foul territory, or that the batter does not swing at but the umpire judges to be in the area over home plate and between the batter's knees and shoulders"
scandal,"n. disgraceful gossip about the private lives of other people
n. a disgraceful event"
vote,"n. a choice that is made by counting the number of people in favor of each alternative
n. the opinion of a group as determined by voting
n. a body of voters who have the same interests
n. the total number of voters who participated"
welfare,"n governmental provision of economic assistance to persons in need
n something that aids or promotes well-being
n a contented state of being happy and healthy and prosperous"
bureaucracy,"n. nonelective government officials
n. a government that is administered primarily by bureaus that are staffed with nonelective officials
n. any organization in which action is obstructed by insistence on unnecessary procedures and red tape"
parliament,n. a legislative assembly in certain countries
designation,n. the act of designating or identifying something
euphonious,"a. having a pleasant sound
s. (of speech or dialect) pleasing in sound; not harsh or strident"
harsh,"s. unpleasantly stern
s. disagreeable to the senses
s. unkind or cruel or uncivil
s. severe"
jazz,"n. a genre of popular music that originated in New Orleans around 1900 and developed through increasingly complex styles
n. a style of dance music popular in the 1920s; similar to New Orleans jazz but played by large bands
v. play something in the style of jazz"
movement,"n. a natural event that involves a change in the position or location of something
n. a group of people with a common ideology who try together to achieve certain general goals
n. a major self-contained part of a symphony or sonata
n. the driving and regulating parts of a mechanism (as of a watch or clock)"
note,"n. a brief written record
n. a short personal letter
n. a notation representing the pitch and duration of a musical sound
n. a tone of voice that shows what the speaker is feeling"
score,"n. a written form of a musical composition; parts for different instruments appear on separate staves on large pages
n. a number that expresses the accomplishment of a team or an individual in a game or contest
n. a set of twenty members
n. grounds"
instrument,"n. a device that requires skill for proper use
n. the means whereby some act is accomplished
n. a person used by another to gain an end
v. equip with instruments for measuring, recording, or controlling"
lyric,"n. the text of a popular song or musical-comedy number
n. a short poem of songlike quality
v. write lyrics for (a song)
s. expressing deep emotion"
conservatory,"n. the faculty and students of a school specializing in one of the fine arts
n. a schoolhouse with special facilities for fine arts
n. a greenhouse in which plants are arranged in a pleasing manner"
episode,"n. a happening that is distinctive in a series of related events
n. a brief section of a literary or dramatic work that forms part of a connected series
n. a part of a broadcast serial"
orchestra,"n. a musical organization consisting of a group of instrumentalists including string players
n. seating on the main floor in a theater"
chorus,"n. any utterance produced simultaneously by a group
n. a group of people assembled to sing together
n. a body of dancers or singers who perform together
n. a company of actors who comment (by speaking or singing in unison) on the action in a classical Greek play"
concert,"n. a performance of music by players or singers not involving theatrical staging
v. contrive (a plan) by mutual agreement
v. settle by agreement"
band,"n. instrumentalists not including string players
n. a stripe or stripes of contrasting color
n. an adornment consisting of a strip of a contrasting color or material
n. a range of frequencies between two limits"
record,"n. anything (such as a document or a phonograph record or a photograph) providing permanent evidence of or information about past events
n. the number of wins versus losses and ties a team has had
n. the sum of recognized accomplishments
n. a compilation of the known facts regarding something or someone"
percussion,"n. the act of playing a percussion instrument
n. the act of exploding a percussion cap
n. tapping a part of the body for diagnostic purposes"
string,"n. a lightweight cord
n. a tightly stretched cord of wire or gut, which makes sound when plucked, struck, or bowed
n. a sequentially ordered set of things or events or ideas in which each successive member is related to the preceding
n. a linear sequence of symbols (characters or words or phrases)"
wind,"n. air moving (sometimes with considerable force) from an area of high pressure to an area of low pressure
n. a tendency or force that influences events
n. breath
n. empty rhetoric or insincere or exaggerated talk"
counsel,"n a lawyer who pleads cases in court
n something that provides direction or advice as to a decision or course of action
v give advice to"
crew,"n. the men and women who man a vehicle (ship, aircraft, etc.)
n. the team of men manning a racing shell
v. serve as a crew member on"
aviator,n. someone who operates an aircraft
playwright,n someone who writes plays
operator,"n. (mathematics) a symbol or function representing a mathematical operation
n. an agent that operates some apparatus or machine
n. someone who owns or operates a business
n. a speculator who trades aggressively on stock or commodity markets"
clergy,"n. in Christianity, clergymen collectively (as distinguished from the laity)"
auditor,"n. a student who attends a course but does not take it for credit
n. a qualified accountant who inspects the accounting records and practices of a business or other organization"
athlete,n. a person trained to compete in sports
satirist,n. a humorist who uses ridicule and irony and sarcasm
sculptor,"n. an artist who creates sculptures
n. a faint constellation in the southern hemisphere near Phoenix and Cetus"
mathematician,n. a person skilled in mathematics
astronaut,n. a person trained to travel in a spacecraft
astronomer,n. a physicist who studies astronomy
spaceman,n a person trained to travel in a spacecraft
botanist,n. a biologist specializing in the study of plants
choreographer,n. someone who creates new dances
scout,"n. a Boy Scout or Girl Scout
n. someone employed to discover and recruit talented persons (especially in the worlds of entertainment or sports)
n. someone who can find paths through unexplored territory
v. explore, often with the goal of finding something or somebody"
geographer,n. an expert on geography
geologist,n. a specialist in geology
educator,n. someone who educates young people
faculty,n. one of the inherent cognitive or perceptual powers of the mind
treasurer,n. an officer charged with receiving and disbursing funds
archeologist,n. an anthropologist who studies prehistoric people and their culture
paleoanthropologist,none
pilot,"n. someone who is licensed to operate an aircraft in flight
n. a person qualified to guide ships through difficult waters going into or out of a harbor"
meteorologist,n. a specialist who studies processes in the earth's atmosphere that cause weather conditions
anthropologist,n. a social scientist who specializes in anthropology
artist,n. a person whose creative work shows sensitivity and imagination
imagist,none
inventor,n. someone who is the first to think of or make something
mechanic,s. resembling the action of a machine
biographer,n. someone who writes an account of a person's life
censor,"n. someone who censures or condemns
n. a person who is authorized to read publications or correspondence or to watch theatrical performances and suppress in whole or in part anything considered obscene or politically unacceptable
v. subject to political, religious, or moral censorship"
physician,n a licensed medical practitioner
hermit,n. one who lives in solitude
recluse,s. withdrawn from society; seeking solitude
ecologist,n. a biologist who studies the relation between organisms and their environment
critic,"n. a person who is professionally engaged in the analysis and interpretation of works of art
n. anyone who expresses a reasoned judgment of something
n. someone who frequently finds fault or makes harsh and unfair judgments"
philanthropist,n. someone who makes charitable donations intended to increase human well-being
attorney,n a professional person authorized to practice law; conducts lawsuits or gives legal advice
congressman,n. a member of the United States House of Representatives
connoisseur,n. an expert able to appreciate a field; especially in the fine arts
entrepreneur,n. someone who organizes a business venture and assumes the risk for it
principal,"n. the original amount of a debt on which interest is calculated
n. the educator who has executive authority for a school
n. capital as contrasted with the income derived from it
n. (criminal law) any person involved in a criminal offense, regardless of whether the person profits from such involvement"
staff,"n. personnel who assist their superior in carrying out an assigned task
n. a strong rod or stick with a specialized utilitarian purpose
n. the body of teachers and administrators at a school
n. building material consisting of plaster and hair; used to cover external surfaces of temporary structure (as at an exposition) or for decoration"
commander,"n. someone in an official position of authority who can command or control others
n. a commissioned naval officer who ranks above a lieutenant commander and below a captain"
commentator,n. a writer who reports and analyzes events of the day
