disability,n. the condition of being unable to perform as a consequence of physical or mental unfitness
disabled,"n. people collectively who are crippled or otherwise physically handicapped
s. incapable of functioning as a consequence of injury or illness"
hearing,"n. (law) a proceeding (usually by a court) where evidence is taken for the purpose of determining an issue of fact and reaching a decision based on that evidence
n. an opportunity to state your case and be heard
n. a session (of a committee or grand jury) in which witnesses are called and testimony is taken
n. the ability to hear; the auditory faculty"
eyesight,n. normal use of the faculty of vision
syndrome,"n. a complex of concurrent things
n. a pattern of symptoms indicative of some disease"
infantile paralysis,none
Rosalyn,none
lap,"n. the upper side of the thighs of a seated person
n. an area of control or responsibility
n. the part of a piece of clothing that covers the thighs
n. a flap that lies over another part"
ambition,"n. a cherished desire
n. a strong drive for success
v. have as one's ambition"
ambitious,"a. having a strong desire for success or achievement
s. requiring full use of your abilities or resources"
dictation,"n. speech intended for reproduction in writing
n. matter that has been dictated and transcribed; a dictated passage"
Sally,n. a venture off the beaten path
noisy,"a. full of or characterized by loud and nonmusical sounds
s. attracting attention by showiness or bright colors"
suitable,s. meant or adapted for an occasion or use
entry,"n. an item inserted in a written record
n. a written record of a commercial transaction"
beneficial,s. promoting or enhancing well-being
Marty Fielding,none
in other words,none
clumsy,"s lacking grace in movement or posture
s not elegant or graceful in expression
s difficult to handle or manage especially because of shape
s showing lack of skill or aptitude"
bump,"n. a lump on the body caused by a blow
v. knock against with force or violence
v. dance erotically or dance with the pelvis thrust forward"
outgoing,"a. leaving a place or a position
a. retiring from a position or office"
adapt,"v. make fit for, or change to suit a new purpose"
adapt to,none
bench,"n. a long seat for more than one person
n. the magistrate or judge or judges sitting in court in judicial capacity to compose the court collectively
n. the reserve players on a team
n. (law) the seat for judges in a courtroom"
cut out,"n. a switch that interrupts an electric circuit in the event of an overload
n. a photograph from which the background has been cut away
n. a part that is cut out or is intended to be cut out"
microscope,n. magnifier of the image of small objects
out of breath,none
absence,"n. the state of being absent
n. failure to be present
n. the time interval during which something or somebody is away
n. the occurrence of an abrupt, transient loss or impairment of consciousness (which is not subsequently remembered), sometimes with light twitching, fluttering eyelids, etc.; common in petit mal epilepsy"
fellow,"n. a member of a learned society
n. an informal form of address for a man"
annoy,"v. cause annoyance in; disturb, especially by minor irritations"
annoyed,"s. aroused to impatience or anger
s. troubled persistently especially with petty annoyances"
annoyance,"n. anger produced by some annoying irritation
n. something or someone that causes trouble; a source of unhappiness
n. the act of troubling or annoying someone"
all in all,none
firm,"n. the members of a business organization that owns or operates one or more establishments
s. marked by firm determination or resolution; not shakable
s. not soft or yielding to pressure
s. strong and sure"
software,n. (computer science) written programs or procedures or rules and associated documentation pertaining to the operation of a computer system and that are stored in read/write memory
sit around,none
as well as,none
parrot,"n. usually brightly colored zygodactyl tropical birds with short hooked beaks and the ability to mimic sounds
n. a copycat who does not understand the words or acts being imitated
v. repeat mindlessly"
tank,"n. an enclosed armored military vehicle; has a cannon and moves on caterpillar treads
n. a large (usually metallic) vessel for holding gases or liquids
n. as much as a tank will hold
v. store in a tank by causing (something) to flow into it"
tortoise,n. usually herbivorous land turtles having clawed elephant-like limbs; worldwide in arid area except Australia and Antarctica
in many ways,none
psychology,n. the science of mental life
psychologically,"r. with regard to psychology
r. in terms of psychology"
make fun of,none
encouragement,"n. the expression of approval and support
n. the feeling of being encouraged"
conduct,"v. direct the course of; manage or control
v. lead, as in the performance of a composition; Barenboim conducted the Chicago symphony for years""
v. lead musicians in the performance of"
mainstream,n. the prevailing current of thought
fulfilling,"v put in effect
v fill or meet a want or need
v meet the requirements or expectations of
v put in effect
v meet the requirements or expectations of
v fill or meet a want or need"
never mind,none
politics,"n. social relations involving intrigue to gain authority or power
n. the study of government of states and other political units
n. the profession devoted to governing and to political affairs
n. the opinion you hold with respect to political questions"
abolish,v. do away with
abolition,n. the act of abolishing a system or practice or institution (especially abolishing slavery)
resign,v. accept as inevitable
slavery,"n. the practice of owning slaves
n. work done under harsh conditions for little or no pay"
literature,"n. creative writing of recognized artistic value
n. the humanistic study of a body of literature
n. published writings in a particular style on a particular subject
n. the profession or art of a writer"
Barry Minto,none
Mount Kilimanjaro,none
companion,"n. a friend who is frequently in the company of another
n. a traveler who accompanies you
n. one paid to accompany or assist or live with another"
assistance,"n the activity of contributing to the fulfillment of a need or furtherance of an effort or purpose
n a resource"
congratulate,v. express congratulations
congratulation,"n. the act of acknowledging that someone has an occasion for celebration
n. (usually plural) an expression of pleasure at the success or good fortune of another"
bowling,"n. a game in which balls are rolled at an object or group of objects with the aim of knocking them over or moving them
n. (cricket) the act of delivering a cricket ball to the batsman
n. the playing of a game of tenpins or duckpins etc"
graduation,"n. the successful completion of a program of study
n. a line (as on a vessel or ruler) that marks a measurement"
certificate,"n. a document attesting to the truth of certain stated facts
v. present someone with a certificate
v. authorize by certificate"
all the best,none
architect,n. someone who creates plans to be used in making something (such as buildings)
Sanders,n a power tool used for sanding wood; an endless loop of sandpaper is moved at high speed by an electric motor
adequate,"a. having the requisite qualities or resources to meet a task
s. sufficient for the purpose
s. about average; acceptable"
access,"n. the right to obtain or make use of or take advantage of something (as services or membership)
n. a way of entering or leaving
n. a code (a series of characters or digits) that must be entered in some way (typed or dialed or spoken) to get the use of something (a telephone line or a computer or a local area network etc.)
n. (computer science) the operation of reading or writing stored information"
accessible,"a. capable of being reached
s. capable of being read with comprehension
s. easily obtained
s. easy to get along with or talk to; friendly"
wheelchair,n. a movable chair mounted on large wheels; for invalids or those who cannot walk; frequently propelled by the occupant
handy,"n. United States blues musician who transcribed and published traditional blues music (1873-1958)
s. easy to reach
s. easy to use
s. skillful with the hands"
earphone,n. electro-acoustic transducer for converting electric signals into sounds; it is held over or inserted into the ear
impair,v. make worse or less effective
row,"n. an arrangement of objects or people side by side in a line
n. a long continuous strip (usually running horizontally)
n. a linear array of numbers, letters, or symbols side by side
n. a continuous chronological succession without an interruption"
basement,"n. the lowermost portion of a structure partly or wholly below ground level; often used for storage
n. the ground floor facade or interior in Renaissance architecture"
outwards,r toward the outside
exit,"n. an opening that permits escape or release
n. the act of going out
v. move out of or depart from
v. lose the lead"
meet with,none
approval,"n. a feeling of liking something or someone good
n. acceptance as satisfactory
n. a message expressing a favorable opinion"
dignity,"n. the quality of being worthy of esteem or respect
n. formality in bearing and appearance
n. high office or rank or station"
profit,"n. the advantageous quality of being beneficial
v. derive a benefit from
v. make a profit; gain money or materially"
italics,"n a style of handwriting with the letters slanting to the right
n a branch of the Indo-European languages of which Latin is the chief representative
n a typeface with letters slanting upward to the right"
community,"n. a group of people living in a particular local area
n. common ownership
n. a group of nations having common interests
n. agreement as to goals"
household,n a social unit living together
fiction,n. a literary work based on the imagination and not necessarily on fact
desire,"n. the feeling that accompanies an unsatisfied state
n. an inclination to want things
n. something that is desired
v. feel or have a desire for; want strongly"
Isaac Asimov,none
satisfaction,"n. the contentment one feels when one has fulfilled a desire, need, or expectation
n. (law) the payment of a debt or fulfillment of an obligation
n. act of fulfilling a desire or need or appetite"
Larry Belmont,none
test out,none
Claire,none
bonus,"n. anything that tends to arouse
n. an additional payment (or other remuneration) to employees as a means of increasing output"
alarm,"n. fear resulting from the awareness of danger
n. a device that signals the occurrence of some undesirable event
n. an automatic signal (usually a sound) warning of danger
v. warn or arouse to a sense of danger or call to a state of preparedness"
alarmed,s. experiencing a sudden sense of danger
apron,"n. a garment of cloth or leather or plastic that is tied about the waist and worn to protect your clothing
n. (golf) the part of the fairway leading onto the green
n. a paved surface where aircraft stand while not being used"
sympathy,"n. an inclination to support or be loyal to or to agree with an opinion
n. sharing the feelings of others (especially feelings of sorrow or anguish)
n. a relation of affinity or harmony between people; whatever affects one correspondingly affects the other"
overweight,"n the property of excessive fatness
s usually describes a large person who is fat but has a large frame to carry it"
elegant,"a. refined and tasteful in appearance or behavior or style
s. suggesting taste, ease, and wealth
s. displaying effortless beauty and simplicity in movement or execution"
Gladys Claffern,none
favour,"n a feeling of favorable regard
n an inclination to approve
n an advantage to the benefit of someone or something
n souvenir consisting of a small gift given to a guest at a party
n an act of gracious kindness
v treat gently or carefully
v bestow a privilege upon
v promote over another
v consider as the favorite"
pile,"n. a collection of objects laid on top of each other
n. a large sum of money (especially as pay or profit)
n. a column of wood or steel or concrete that is driven into the ground to provide support for a structure
n. the yarn (as in a rug or velvet or corduroy) that stands up from the weave"
scan,"n. the act of scanning; systematic examination of a prescribed region
n. an image produced by scanning
v. examine minutely or intensely
v. examine hastily"
fingernail,n. the nail at the end of a finger
absurd,"n. a situation in which life seems irrational and meaningless
s. inconsistent with reason or logic or common sense
s. incongruous; inviting ridicule"
haircut,"n. the style in which hair has been cut
n. the act of cutting the hair"
makeup,"n. cosmetics applied to the face to improve or change your appearance
n. an event that is substituted for a previously cancelled event"
accompany,v. go or travel along with
cushion,"n. the layer of air that supports a hovercraft or similar vehicle
n. a soft bag filled with air or a mass of padding such as feathers or foam rubber etc.
v. protect from impact"
bedding,"n coverings that are used on a bed
n material used to provide a bed for animals
v furnish with a bed
v place (plants) in a prepared bed of soil
v put to bed
v have sexual intercourse with
v prepare for sleep"
necklace,n. jewelry consisting of a cord or chain (often bearing gems) worn about the neck as an ornament (especially by women)
clerk,"n. an employee who performs clerical work (e.g., keeps records or accounts)
v. work as a clerk, as in the legal business"
counter,"n. table consisting of a horizontal surface over which business is transacted
n. game equipment (as a piece of wood, plastic, or ivory) used for keeping a count or reserving a space in various card or board games
n. a calculator that keeps a record of the number of times something happens
n. a person who counts things"
ring up,none
turn around,"n. time need to prepare a vessel or ship for a return trip
n. an area sufficiently large for a vehicle to turn around
n. act or process of unloading and loading and servicing a vessel or aircraft for a return trip"
awful,s. causing fear or dread or terror
affair,"n. a usually secretive or illicit sexual relationship
n. a vaguely specified social event"
armchair,n. chair with a support on each side for arms
declare,"v. state emphatically and authoritatively
v. state firmly
v. declare to be
v. authorize payments of"
cuisine,n. the practice or manner of preparing food or the food so prepared
envy,"n. a feeling of grudging admiration and desire to have something that is possessed by another
n. spite and resentment at seeing the success of another (personified as one of the deadly sins)
v. feel envious towards; admire enviously
v. be envious of; set one's heart on"
leave ... alone,none
digital,"a. displaying numbers rather than scale positions
a. relating to or performed with the fingers
a. of a circuit or device that represents magnitudes in digits"
mailbox,n. a private box for delivery of mail
aside,"n. a line spoken by an actor to the audience but not intended for others on the stage
r. on or to one side
r. out of the way (especially away from one's thoughts)
r. placed or kept separate and distinct as for a purpose"
set aside,s reserved in advance
grand,"s. large and impressive in physical size or extent
s. the most important and magnificent in adornment"
Marion,none
alphabetical,"a relating to or expressed by a writing system that uses an alphabet
a arranged in order according to the alphabet"
receiver,"n. set that receives radio or tv signals
n. the tennis player who receives the serve
n. a football player who catches (or is supposed to catch) a forward pass"
in all,none
affection,n. a positive feeling of liking
bound,"v. form the boundary of; be contiguous to
a. confined by bonds
a. held with another element, substance or material in chemical or physical union
a. secured with a cover or binding; often used as a combining form"
be bound to,none
biography,n. an account of the series of events making up a person's life
holy,a. belonging to or derived from or associated with a divine power
imagination,"n. the formation of a mental image of something that is not perceived as real and is not present to the senses
n. the ability to form mental images of things or events"
transfusion,"n. the introduction of blood or blood plasma into a vein or artery
n. the action of pouring a liquid from one vessel to another"
part-time,a. involving less than the standard or customary time for an activity
master's degree,none
staff,"n. personnel who assist their superior in carrying out an assigned task
n. a strong rod or stick with a specialized utilitarian purpose
n. the body of teachers and administrators at a school
n. building material consisting of plaster and hair; used to cover external surfaces of temporary structure (as at an exposition) or for decoration"
Philadelphia,n. the largest city in Pennsylvania; located in the southeastern part of the state on the Delaware river; site of Independence Hall where the Declaration of Independence and the Constitution were signed; site of the University of Pennsylvania
navy,n. an organization of military vessels belonging to a country and available for sea warfare
junior,"n. term of address for a disrespectful and annoying male
n. a third-year undergraduate
n. the younger of two persons
n. a son who has the same first name as his father"
PhD,d a doctorate usually based on at least 3 years graduate study and a dissertation; the highest degree awarded graduate study
Doctor of Philosophy,none
biochemistry,n. the organic chemistry of compounds and processes occurring in organisms; the effort to understand biology within the context of chemistry
Boston,n. state capital and largest city of Massachusetts; a major center for banking and financial services
talent,n. a person who possesses unusual innate ability in some field or activity
chapter,"n. a subdivision of a written work; usually numbered and titled
n. any distinct period in history or in a person's life
n. a local branch of some fraternity or association
n. an ecclesiastical assembly of the monks in a monastery or even of the canons of a church"
the Foundation trilogy,none
empire,"n. the domain ruled by an emperor or empress; the region over which imperial dominion is exercised
n. a group of countries under a single authority
n. a monarchy with an emperor as head of state
n. an eating apple that somewhat resembles a McIntosh; used as both an eating and a cooking apple"
theoretical,"a. concerned primarily with theories or hypotheses rather than practical considerations
a. concerned with theories rather than their practical applications"
framework,"n. the underlying structure
n. a structure supporting or containing something"
thinking,n. the process of using your mind to consider something carefully
divorce,"n. the legal dissolution of a marriage
v. get a divorce; formally terminate a marriage"
obey,v. be obedient to
disobey,v. refuse to go along with; refuse to follow; be disobedient
assessment,"n. an amount determined as payable
n. the market value set on assets"
snorkel,"n. breathing device consisting of a bent tube fitting into a swimmer's mouth and extending above the surface; allows swimmer to breathe while face down in the water
n. air passage provided by a retractable device containing intake and exhaust pipes; permits a submarine to stay submerged for extended periods of time
v. dive with a snorkel"
aquarium,n. a tank or pool or bowl filled with water for keeping live fish and underwater animals
anecdote,n. short account of an incident (especially a biographical one)
Clancy,none
baleen,n a horny material from the upper jaws of certain whales; used as the ribs of fans or as stays in corsets
baleen whale,none
annual,"n. (botany) a plant that completes its entire life cycle within the space of a year
n. a reference book that is published regularly once every year
a. completing its life cycle within a year
s. occurring or payable every year"
migration,"n. the movement of persons from one country or locality to another
n. a group of people migrating together (especially in some given time period)
n. (chemistry) the nonrandom movement of an atom or radical from one place to another within a molecule"
witness,"n. someone who sees an event and reports what happened
n. testimony by word or deed to your religious faith
n. (law) a person who attests to the genuineness of a document or signature by adding their own signature
n. (law) a person who testifies under oath in a court of law"
accommodation,"n. a settlement of differences
n. in the theories of Jean Piaget: the modification of internal representations in order to accommodate a changing knowledge of reality
n. living quarters provided for public convenience
n. the act of providing something (lodging or seat or food) to meet a need"
shore,"n. the land along the edge of a body of water
n. a beam or timber that is propped against a structure to provide support
v. serve as a shore to"
offshore,"a. (of winds) coming from the land
s. at some distance from the shore
r. away from shore; away from land"
opposite,"s. being directly across from each other; facing
a. of leaves etc; growing in pairs on either side of a stem
s. moving or facing away from each other
s. the other one of a complementary pair"
yell,v. utter or declare in a very loud voice
pause,"n. a time interval during which there is a temporary cessation of something
n. temporary inactivity
v. cease an action temporarily"
oar,n. an implement used to propel or steer a boat
telescope,"n. a magnifier of images of distant objects
v. crush together or collapse
v. make smaller or shorter"
teamwork,n. cooperative work done by a team (especially when it is effective)
blow-hole,n. the spiracle of a cetacean located far back on the skull
dive,"n. a headlong plunge into water
n. a steep nose-down descent by an aircraft
v. drop steeply
v. plunge into water"
flee,v. run away quickly
harpoon,"n. a spear with a shaft and barbed point for throwing; used for catching large fish or whales; a strong line is attached to it
v. spear with a harpoon"
drag,"n. the phenomenon of resistance to motion through a fluid
n. something that slows or delays progress
n. something tedious and boring
n. clothing that is conventionally worn by the opposite sex (especially women's clothing when worn by a man)"
depth,"n. the extent downward or backward or inward
n. degree of psychological or intellectual profundity
n. (usually plural) the deepest and most remote part
n. (usually plural) a low moral state"
meantime,"n the time between one event, process, or period and another
r during the intervening time"
in the meantime,none
lip,"n. either of two fleshy folds of tissue that surround the mouth and play a role in speaking
n. (botany) either of the two parts of a bilabiate corolla or calyx
n. either the outer margin or the inner margin of the aperture of a gastropod's shell"
overboard,"r. to extremes
r. from on board a vessel into the water"
urge,"n. an instinctive motive
n. a strong restless desire
v. force or impel in an indicated direction"
abandon,"n. the trait of lacking restraint or control; reckless freedom from inhibition or worry
v. forsake, leave behind
v. give up with the intent of never claiming again
v. stop maintaining or insisting on; of ideas or claims"
shark,"n. any of numerous elongate mostly marine carnivorous fishes with heterocercal caudal fins and tough skin covered with small toothlike scales
n. a person who is ruthless and greedy and dishonest
n. a person who is unusually skilled in certain ways
v. play the shark; act with trickery"
help out,none
help ... out,none
relationship,"n. a relation between people; (`relationship' is often used where `relation' would serve, as in `the relationship between inflation and unemployment', but the preferred usage of `relationship' is for human relations or states of relatedness)
n. a state of connectedness between people (especially an emotional connection)
n. a state involving mutual dealings between people or parties or countries"
conservation,"n. an occurrence of improvement by virtue of preventing loss or injury or other change
n. the preservation and careful management of the environment and of natural resources
n. (physics) the maintenance of a certain quantities unchanged during chemical reactions or physical transformations"
iceberg,n. a large mass of ice floating at sea; usually broken off of a polar glacier
jog,"n. a sharp change in direction
n. a slow pace of running
v. run for exercise
v. give a slight push to"
seaside,n. the shore of a sea or ocean regarded as a resort
net,"n. a trap made of netting to catch fish or birds or insects
n. a goal lined with netting (as in soccer or hockey)
n. game equipment consisting of a strip of netting dividing the playing area in tennis or badminton
n. an open fabric of string or rope or wire woven together at regular intervals"
target,"n. a reference point to shoot at
n. the location of the target that is to be hit
n. sports equipment consisting of an object set up for a marksman or archer to aim at
v. intend (something) to move towards a certain goal"
tide,"n. the periodic rise and fall of the sea level under the gravitational pull of the moon
n. something that may increase or decrease (like the tides of the sea)
n. there are usually two high and two low tides each day
v. rise or move forward"
driftnet,none
dimension,"n. the magnitude of something in a particular direction (especially length or width or height)
n. one of three Cartesian coordinates that determine a position in space
v. indicate the dimensions on
v. shape or form to required dimensions"
