reflect,"v. manifest or bring back
v. to throw or bend back (from a surface)
v. be bright by reflecting or casting light
v. show an image of"
pure,"a. free of extraneous elements of any kind
s. free from discordant qualities
s. concerned with theory and data rather than practice; opposed to applied
a. (used of persons or behaviors) having no faults; sinless"
cell,"n. any small compartment
n. (biology) the basic structural and functional unit of all organisms; they may exist as independent units of life (as in monads) or may form colonies or tissues as in higher plants and animals
n. a device that delivers an electric current as the result of a chemical reaction
n. a small unit serving as part of or as the nucleus of a larger political movement"
aware,a. (sometimes followed by `of') having or showing knowledge or understanding or realization or perception
be aware of,none
become aware of,none
vivid,s. having the clarity and freshness of immediate experience
neat,"s. clean or organized
s. showing care in execution
s. free from what is tawdry or unbecoming
s. without water"
seaweed,"n. plant growing in the sea, especially marine algae"
narrow,"n. a narrow strait connecting two bodies of water
v. make or become more narrow or restricted
a. not wide
s. limited in size or scope"
flashlight,n. a small portable battery-powered electric lamp
upside down,s being in such a position that top and bottom are reversed
suck,"v. draw into the mouth by creating a practical vacuum in the mouth
v. draw something in by or as if by a vacuum
v. attract by using an inexorable force, inducement, etc.
v. be inadequate or objectionable"
sea-slug," A holothurian.
 A nudibranch mollusk."
turtle,"n. any of various aquatic and land reptiles having a bony shell and flipper-like limbs for swimming
v. hunt for turtles, especially as an occupation"
eel,"n. the fatty flesh of eel; an elongate fish found in fresh water in Europe and America; large eels are usually smoked or pickled
n. voracious snakelike marine or freshwater fishes with smooth slimy usually scaleless skin and having a continuous vertical fin but no ventral fins"
sharp,"n. a musical notation indicating one half step higher than the note named
n. a long thin sewing needle with a sharp point
s. harsh
a. keenly and painfully felt; as if caused by a sharp edge or point"
tasty,a. pleasing to the sense of taste
giant,"n. any creature of exceptional size
n. an unusually large enterprise
n. a very large person; impressive in size or qualities
n. someone or something that is abnormally large and powerful"
clam,"n. burrowing marine mollusk living on sand or mud; the shell closes with viselike firmness
n. flesh of either hard-shell or soft-shell clams
v. gather clams, by digging in the sand by the ocean"
grey,"n. United States writer of western adventure novels (1875-1939)
n. Queen of England for nine days in 1553; she was quickly replaced by Mary Tudor and beheaded for treason (1537-1554)
n. Englishman who as Prime Minister implemented social reforms including the abolition of slavery throughout the British Empire (1764-1845)
n. any organization or party whose uniforms or badges are grey"
scare,n. a sudden attack of fear
scared to death,none
be scared to death,none
shallow,"v. make shallow
v. become shallow
a. lacking physical depth; having little spatial extension downward or inward from an outer surface or backward or outward from a center
a. not deep or strong; not affecting one deeply"
steep,"n. a steep place (as on a hill)
v. devote (oneself) fully to
v. let sit in a liquid to extract a flavor or to cleanse
a. having a sharp inclination"
boundary,"n. the line or plane indicating the limit or extent of something
n. a line determining the limits of an area"
Antarctic,n. the region around the south pole: Antarctica and surrounding waters
the Antarctic,none
awesome,s inspiring awe or admiration or wonder
leap,"n. a light, self-propelled movement upwards or forwards
n. an abrupt transition
n. the distance leaped (or to be leaped)
v. pass abruptly from one state or topic to another"
seal,"n. a device incised to make an impression; used to secure a closing or to authenticate documents
n. the pelt or fur (especially the underfur) of a seal
n. a stamp affixed to a document (as to attest to its authenticity or to seal it)
n. a finishing coat applied to exclude moisture"
refund,"n. money returned to a payer
n. the act of returning money received previously
v. pay back"
pension,"n. a regular payment to a person that is intended to allow them to subsist without working
v. grant a pension to"
pensioner,n. the beneficiary of a pension fund
airmail,"n. letters and packages that are transported by aircraft
n. a system of conveying mail by aircraft
v. send or transport by airmail"
Papua New Guinea,none
fortnight,n. a period of fourteen consecutive days
hear from,none
dying to,none
be dying to,none
roof,"n. a protective covering that covers or forms the top of a building
n. protective covering on top of a motor vehicle
n. the inner top surface of a covered area or hollow space
v. provide a building with a roof; cover a building with a roof"
muddy,"v. dirty with mud
v. cause to become muddy
v. make turbid"
textbook,n. a book prepared for use in schools or colleges
concept,n. an abstract or general idea inferred or derived from specific instances
bucket,"n. a roughly cylindrical vessel that is open at the top
n. the quantity contained in a bucket
v. put into a bucket
v. carry in a bucket"
the other day,none
weekly,"n. a periodical that is published every week (or 52 issues per year)
s. of or occurring every seven days"
bubble,"n. a hollow globule of gas (e.g., air or carbon dioxide)
n. an impracticable and illusory idea
n. a dome-shaped covering made of transparent glass or plastic
v. form, produce, or emit bubbles"
relevant,a. having a bearing on or connection with the subject at issue
remote,"n a device that can be used to control a machine or apparatus from a distance
s located far away spatially
s very unlikely
s separate or apart in time
s inaccessible and sparsely populated; 
a far apart in relevance or relationship or kinship"
ridge,"n. a long narrow natural elevation or striation
n. any long raised strip
n. a long narrow natural elevation on the floor of the ocean
n. a long narrow range of hills"
weed,"n. any plant that crowds out cultivated plants
n. a black band worn by a man (on the arm or hat) as a sign of mourning
v. clear of weeds"
hut,n. temporary military shelter
rectangle,n. a parallelogram with four right angles
rectangular,s. having four right angles
adjust,"v. alter or regulate so as to achieve accuracy or conform to a standard
v. adapt or conform oneself to new or different conditions
v. make correspondent or conformable
v. decide how much is to be paid on an insurance claim"
platform,"n. a raised horizontal surface
n. a document stating the aims and principles of a political party
n. the combination of a particular computer and a particular operating system
n. any military structure or vehicle bearing weapons"
broom,"n. a cleaning implement for sweeping; bundle of straws or twigs attached to a long handle
n. any of various shrubs of the genera Cytisus or Genista or Spartium having long slender branches and racemes of yellow flowers
v. finish with a broom"
tin,"n. a silvery malleable metallic element that resists corrosion; used in many alloys and to coat other metals to prevent corrosion; obtained chiefly from cassiterite where it occurs as tin oxide
n. a vessel (box, can, pan, etc.) made of tinplate and used mainly in baking
v. plate with tin
v. prepare (a metal) for soldering or brazing by applying a thin layer of solder to the surface"
jar,"n. a vessel (usually cylindrical) with a wide mouth and without handles
n. the quantity contained in a jar
v. shock physically
v. affect in a disagreeable way"
sniff,"n. sensing an odor by inhaling through the nose
v. perceive by inhaling through the nose
v. inhale audibly through the nose"
participate,v. share in something
interpreter,"n. someone who mediates between speakers of different languages
n. someone who uses art to represent something
n. (computer science) a program that translates and executes source language statements one line at a time"
grill,"n. a framework of metal bars used as a partition or a grate
v. cook over a grill
v. examine thoroughly"
dry out,none
leftover,"n. a small part or portion that remains after the main part no longer exists
s. not used up"
evil,"n. morally objectionable behavior
n. that which causes harm or destruction or misfortune; the good is oft interred with their bones""- Shakespeare
n. the quality of being morally wrong in principle or practice
a. morally bad or wrong"
dry up,none
otherwise,"s. other than as supposed or expected
r. in other respects or ways"
privilege,"n. a special advantage or immunity or benefit not enjoyed by all
n. (law) the right to refuse to divulge information obtained in a confidential relationship
v. bestow a privilege upon"
paperwork,n. work that involves handling papers: forms or letters or reports etc.
arrangement,"n. an orderly grouping (of things or persons) considered as a unit; the result of arranging
n. an organized structure for arranging or classifying
n. the act of arranging and adapting a piece of music"
toast,"n. slices of bread that have been toasted
n. a celebrity who receives much acclaim and attention
v. propose a toast to"
comb,"n. a flat device with narrow pointed teeth on one edge; disentangles or arranges hair
n. the fleshy red crest on the head of the domestic fowl and other gallinaceous birds
n. any of several tools for straightening fibers
n. ciliated comb-like swimming plate of a ctenophore"
astronaut,n. a person trained to travel in a spacecraft
angle,"n. the space between two lines or planes that intersect; the inclination of one line to another; measured in degrees or radians
n. a member of a Germanic people who conquered England and merged with the Saxons and Jutes to become Anglo-Saxons
v. move or proceed at an angle
v. fish with a hook"
catalogue,"v. make an itemized list or catalog of; classify
v. make a catalogue, compile a catalogue"
donate,v. give to a charity or good cause
voluntary,"n. composition (often improvised) for a solo instrument (especially solo organ) and not a regular part of a religious service or musical performance
a. of your own free will or design; done by choice; not forced or compelled
a. controlled by individual volition"
in need,none
purchase,"n. the acquisition of something for payment
n. something acquired by purchase
n. a means of exerting influence or gaining advantage"
anniversary,n. the date on which an event occurred in some previous year (or the celebration of it)
seed,"n. a small hard fruit
n. a mature fertilized plant ovule consisting of an embryo and its food source and having a protective coat or testa
v. go to seed; shed seeds
v. help (an enterprise) in its early stages of development by providing seed money"
seedling,n. young plant or tree grown from a seed
vaccination,n. the scar left following inoculation with a vaccine
loan,n. the temporary provision of money (usually at interest)
sew,"v. fasten by sewing; do needlework
v. create (clothes) with cloth"
sewing machine,none
supplement,"n. a quantity added (e.g. to make up for a deficiency)
v. add as a supplement to what seems insufficient
v. serve as a supplement to"
ox,"n. an adult castrated bull of the genus Bos; especially Bos taurus
n. any of various wild bovines especially of the genera Bos or closely related Bibos"
plough,"n a group of seven bright stars in the constellation Ursa Major
n a farm tool having one or more heavy blades to break the soil and cut a furrow prior to sowing
v move in a way resembling that of a plow cutting into or going through the soil
v to break and turn over earth especially with a plow"
trunk,"n. the main stem of a tree; usually covered with bark; the bole is usually the part that is commercially useful for lumber
n. luggage consisting of a large strong case used when traveling or for storage"
trunk library,none
tractor,"n. a wheeled vehicle with large wheels; used in farming and other applications
n. a truck that has a cab but no body; used for pulling large trailers or vans"
Kenya,n. a republic in eastern Africa; achieved independence from the United Kingdom in 1963; major archeological discoveries have been made in the Great Rift Valley in Kenya
Bangladesh,n. a Muslim republic in southern Asia bordered by India to the north and west and east and the Bay of Bengal to the south; formerly part of India and then part of Pakistan; it achieved independence in 1971
click,"n. depression of a button on a computer mouse
v. make a clicking or ticking sound
v. produce a click
v. become clear or enter one's consciousness or emotions"
tailor,"n. a person whose occupation is making and altering garments
v. adjust to a specific need or market"
Tanzania,n. a republic in eastern Africa
economic,"a. of or relating to an economy, the system of production and management of material wealth
a. of or relating to the science of economics
s. using the minimum of time or resources necessary for effectiveness
s. concerned with worldly necessities of life (especially money)"
political,"a. involving or characteristic of politics or parties or politicians
a. of or relating to your views about social relationships involving authority or power
a. of or relating to the profession of governing"
Nepal,n. a small landlocked Asian country high in the Himalayas between India and China
Uganda,n. a landlocked republic in eastern Africa; achieved independence from the United Kingdom in 1962
distribute,"v. administer or bestow, as in small portions
v. make available
v. give to several people
v. spread throughout a given area"
distribution,"n. (statistics) an arrangement of values of a variable showing their observed or theoretical frequency of occurrence
n. the spatial or geographic property of being scattered about over a range, area, or volume
n. the act of distributing or spreading or apportioning
n. the commercial activity of transporting and selling goods from a producer to a consumer"
financial,a involving financial matters
security,"n. the state of being free from danger or injury
n. defense against financial failure; financial independence
n. freedom from anxiety or fear
n. a formal declaration that documents a fact of relevance to finance and investment; the holder has a right to receive interest or dividends"
operate,"v. direct or control; projects, businesses, etc.
v. handle and cause to function
v. happen"
Sudan,"n. a republic in northeastern Africa on the Red Sea; achieved independence from Egypt and the United Kingdom in 1956
n. a region of northern Africa to the south of the Sahara and Libyan deserts; extends from the Atlantic to the Red Sea"
clinic,"n. a medical establishment run by a group of medical specialists
n. meeting for diagnosis of problems and instruction or remedial work in a particular activity
n. a healthcare facility for outpatient care"
Malawi,n. a landlocked republic in southern central Africa; achieved independence from the United Kingdom in 1964
adjust to,none
keep it up,none
fit in,none
motherland,n the country where you were born
visa,"n. an endorsement made in a passport that allows the bearer to enter the country issuing it
v. provide (a passport) with a visa
v. approve officially"
queue,"n. a line of people or vehicles waiting for something
n. (information processing) an ordered list of tasks to be performed or messages to be transmitted
n. a braid of hair at the back of the head"
cafeteria,n. a restaurant where you serve yourself and pay a cashier
lecture,"n. a speech that is open to the public
n. a lengthy rebuke
n. teaching by giving a discourse on some subject (typically to a class)
v. deliver a lecture or talk"
qualification,"n. an attribute that must be met or complied with and that fits a person for something
n. the act of modifying or changing the strength of some idea"
preparation,"n. the activity of putting or setting in order in advance of some act or purpose
n. (music) a note that produces a dissonant chord is first heard in a consonant chord"
recommend,"v. push for something
v. make attractive or acceptable"
shopkeeper,n. a merchant who owns or manages a shop
idiom,n. an expression whose meanings cannot be inferred from the meanings of the words that make it up
comfort,"n. a state of being relaxed and feeling no pain
n. a feeling of freedom from worry or disappointment
n. satisfaction or physical well-being provided by a person or thing
n. assistance, such as that provided to an enemy or to a known criminal"
substitute,"n. a person or thing that takes or can take the place of another
n. an athlete who plays only when a starter on the team is replaced
v. put in the place of another; switch seemingly equivalent items
v. be a substitute"
academic,"a. associated with academia or an academy
s. hypothetical or theoretical and not expected to produce an immediate or practical result
s. marked by a narrow focus on or display of learning especially its trivial aspects"
requirement,n. required activity
essay,"n. an analytic or interpretive literary composition
n. a tentative attempt"
tutor,"v. be a tutor to someone; give individual instruction
v. act as a guardian to someone"
revise,v. make revisions in
revision,"n. the act of revising or altering (involving reconsideration and modification)
n. the act of rewriting something"
draft,"n. a document ordering the payment of money; drawn by one person or bank on another
n. a current of air (usually coming into a chimney or room or vehicle)
n. a preliminary sketch of a design or picture
n. a serving of drink (usually alcoholic) drawn from a keg"
numb,"v. make numb or insensitive
s. so frightened as to be unable to move; stunned or paralyzed with terror; petrified"
acknowledge,"v. report the receipt of
v. express obligation, thanks, or gratitude for
v. accept as legally binding and valid
v. accept (someone) to be what is claimed or accept his power and authority"
as far as one is concerned,none
contradict,"v. be in contradiction with
v. deny the truth of"
autonomous,"s. (of political bodies) not controlled by outside forces
s. existing as an independent entity
s. (of persons) free from external control and constraint in e.g. action and judgment"
occupy,"v. live (in a certain place)
v. occupy the whole of"
be occupied with,none
enterprise,"n. a purposeful or industrious undertaking (especially one that requires effort or boldness)
n. an organization created for business ventures
n. readiness to embark on bold new ventures"
apology,"n. an expression of regret at having caused trouble for someone
n. a formal written defense of something you believe in strongly
n. a poor example"
seminar,"n. any meeting for an exchange of ideas
n. a course offered for a small group of advanced students"
videophone,none
Rugby,n. a form of football played with an oval ball
bachelor,"n. a man who has never been married
v. lead a bachelor's existence"
bachelor's degree,none
routine,"n. an unvarying or habitual method or procedure
n. a set sequence of steps, part of larger computer program"
minibus,n. a light bus (4 to 10 passengers)
optional,a. possible but not necessary; left to personal choice
day in and day out,none
cage,"n. an enclosure made or wire or metal bars in which birds or animals can be kept
n. something that restricts freedom as a cage restricts movement
n. United States composer of avant-garde music (1912-1992)
n. the net that is the goal in ice hockey"
bark,"n. tough protective covering of the woody stems and roots of trees and other woody plants
n. a noise resembling the bark of a dog
n. a sailing ship with 3 (or more) masts
n. the sound made by a dog"
battery,"n. group of guns or missile launchers operated together at one place
n. a device that produces electricity; may have several primary or secondary cells arranged in parallel or series
n. a collection of related things intended for use together
n. a unit composed of the pitcher and catcher"
site,"n. the piece of land on which something is located (or is to be located)
n. physical position in relation to the surroundings"
Julie,none
Abigail,n. A lady's waiting-maid.
drill,"n. a tool with a sharp point and cutting edges for making holes in hard materials (usually rotating rapidly or by repeated blows)
n. similar to the mandrill but smaller and less brightly colored
n. (military) the training of soldiers to march (as in ceremonial parades) or to perform the manual of arms
v. train in the military, e.g., in the use of weapons"
oilfield,n. a region rich in petroleum deposits (especially one with producing oil wells)
Jamie,none
Sam,n a guided missile fired from land or shipboard against an airborne target
Lima,n. capital and largest city and economic center of Peru; located in western Peru; was capital of the Spanish empire in the New World until the 19th century
Cuzco,n. a town in the Andes in southern Peru; formerly the capital of the Inca empire
the Andes mountains,none
Peru,n. a republic in western South America; achieved independence from Spain in 1821; was the heart of the Inca empire from the 12th to 16th centuries
Lia,none
agent,"n. an active and efficient cause; capable of producing a certain effect
n. a representative who acts on behalf of other persons or organizations
n. a substance that exerts some force or effect
n. a businessman who buys or sells for another in exchange for a commission"
travel agent,none
geographical,"a of or relating to the science of geography
a determined by geography"
parallel,"n. (mathematics) one of a set of parallel geometric figures (parallel lines or planes)
v. be parallel to
v. make or place parallel to something
a. being everywhere equidistant and not intersecting"
Lake Titicaca,none
abundant,a. present in great quantity
Inca,"n. a ruler of the Incas (or a member of his family)
n. a member of the Quechuan people living in the Cuzco valley in Peru
n. the small group of Quechua living in the Cuzco Valley in Peru who established hegemony over their neighbors in order to create an empire that lasted from about 1100 until the Spanish conquest in the early 1530s"
govern,"v. direct or strongly influence the behavior of
v. exercise authority over; as of nations
v. require to be in a certain grammatical case, voice, or mood"
onwards,r in a forward direction
destination,n. the ultimate goal for which something is done
Machu Picchu,none
inn,n a hotel providing overnight lodging for travelers
out of the question,none
hike,"n. a long walk usually for exercise or pleasure
v. increase
v. walk a long way, as for pleasure or physical exercise"
Puno,none
tomb,n a place for the burial of a corpse (especially beneath the ground and marked by a tombstone)
the Amazon,none
settle in,none
