programme,"n an announcement of the events that will occur as part of a theatrical or sporting event
n an integrated course of academic studies
n a radio or television show
n (computer science) a sequence of instructions that a computer can interpret and execute
n a system of projects or services intended to meet a public need
n a series of steps to be carried out or goals to be accomplished
n a performance (or series of performances) at a public presentation
v write a computer program
v arrange a program of or for"
cartoon,"n. a humorous or satirical drawing published in a newspaper or magazine
n. a film made by photographing a series of cartoon drawings to give the illusion of movement when projected in rapid sequence
v. draw cartoons of"
nature,"n. the essential qualities or characteristics by which something is recognized
n. a causal agent creating and controlling things in the universe
n. the natural physical world including plants and animals and landscapes etc.
n. the complex of emotional and intellectual attributes that determine a person's characteristic actions and reactions"
vacation,"n. leisure time away from work devoted to rest or pleasure
n. the act of making something legally void
v. spend or take a vacation"
reviewer,n. someone who reads manuscripts and judges their suitability for publication
score,"n. a written form of a musical composition; parts for different instruments appear on separate staves on large pages
n. a number that expresses the accomplishment of a team or an individual in a game or contest
n. a set of twenty members
n. grounds"
result,"n. something that results
v. issue or terminate (in a specified way, state, etc.); end
v. come about or follow as a consequence"
movie,n. a form of entertainment that enacts a story by sound and a sequence of images giving the illusion of continuous movement
actor,"n. a theatrical performer
n. a person who acts and gets things done"
fantastic,"s. extraordinarily good or great; used especially as intensifiers
s. fanciful and unrealistic; foolish
s. existing in fancy only
s. extravagantly fanciful in design, construction, appearance"
earn,v. acquire or deserve by one's efforts or actions
adopt,"v. choose and follow; as of theories, ideas, policies, strategies or plans
v. take up and practice as one's own
v. take into one's family"
deaf,"n. people who have severe hearing impairments
a. lacking or deprived of the sense of hearing wholly or in part
s. (usually followed by `to') unwilling or refusing to pay heed"
moving,"a. in motion
a. arousing or capable of arousing deep emotion
a. used of a series of photographs presented so as to create the illusion of motion"
dinosaur,n. any of numerous extinct terrestrial reptiles of the Mesozoic era
die,"n. a small cube with 1 to 6 spots on the six faces; used in gambling to generate random numbers
n. a device used for shaping metal
n. a cutting tool that is fitted into a diestock and used for cutting male (external) screw threads on screws or bolts or pipes or rods
v. pass from physical life and lose all bodily attributes and functions necessary to sustain life"
climate,"n. the weather in some location averaged over some long period of time
n. the prevailing psychological state"
channel,"n. a path over which electrical signals can pass
n. a passage for water (or other fluids) to flow through
n. a deep and relatively narrow body of water (as in a river or a harbor or a strait linking two larger bodies) that allows the best passage for vessels
n. (often plural) a means of communication or access"
bored,s. tired of the world
interview,"n. the questioning of a person (or a conversation in which information is elicited); often conducted by journalists
v. conduct an interview in television, newspaper, and radio reporting
v. discuss formally with (somebody) for the purpose of an evaluation
v. go for an interview in the hope of being hired"
character,"n. the inherent complex of attributes that determines a persons moral and ethical actions and reactions
n. an actor's portrayal of someone in a play
n. a person of a specified kind (usually with many eccentricities)
n. good repute"
conversation,n. the use of speech for informal exchange of views or ideas or information etc.
grammar,n. the branch of linguistics that deals with syntax and morphology (and sometimes also deals with semantics)
passage,"n. the act of passing from one state or place to the next
n. a section of text; particularly a section of medium length
n. a way through or along which someone or something may pass
n. a journey usually by ship"
pronunciation,"n. the manner in which someone utters a word
n. the way a word or a language is customarily spoken"
vocabulary,"n. a listing of the words used in some enterprise
n. a language user's knowledge of words
n. the system of techniques or symbols serving as a means of expression (as in arts or crafts)"
quite,"r. to a degree (not used with a negative)
r. to the greatest extent; completely
r. of an unusually noticeable or exceptional or remarkable kind (not used with a negative)
r. actually or truly or to an extreme"
rule,"n. a principle or condition that customarily governs behavior
n. prescribed guide for conduct or action
n. (linguistics) a rule describing (or prescribing) a linguistic practice
n. the duration of a monarch's or government's power"
experience,"n. the accumulation of knowledge or skill that results from direct participation in events or activities
n. the content of direct observation or participation in an event
n. an event as apprehended
v. go or live through"
carefully,r. taking care or paying attention
take notes,none
field,"n. a piece of land cleared of trees and usually enclosed
n. somewhere (away from a studio or office or library or laboratory) where practical work is done or data is collected
n. the space around a radiating body within which its electromagnetic oscillations can exert force on another similar body not in contact with it
n. a particular kind of commercial enterprise"
extremely,r. to an extreme degree
fit,"n. a display of bad temper
n. the manner in which something fits
v. be the right size or shape; fit correctly or as desired
v. make fit"
agree,"v. be in accord; be in agreement
v. consent or assent to a condition, or agree to do something
v. show grammatical agreement
v. be agreeable or suitable"
certainly,r definitely or positively (`sure' is sometimes used informally for `surely')
pass,"n. (military) a written leave of absence
n. (American football) a play that involves one player throwing the ball to a teammate
n. the location in a range of mountains of a geological formation that is lower than the surrounding peaks
n. any authorization to pass or go somewhere"
goal,"n. the state of affairs that a plan is intended to achieve and that (when achieved) terminates behavior intended to achieve it
n. game equipment consisting of the place toward which players of a game try to advance a ball or puck in order to score points
n. a successful attempt at scoring"
score a goal,none
kick,"n. the act of delivering a blow with the foot
n. the sudden stimulation provided by strong drink (or certain drugs)
n. a rhythmic thrusting movement of the legs as in swimming or calisthenics
v. drive or propel with the foot"
basket,"n. a container that is usually woven and has handles
n. the quantity contained in a basket
n. horizontal circular metal hoop supporting a net through which players try to throw the basketball
n. a score in basketball made by throwing the ball through the hoop"
make a basket,none
foul,"n. an act that violates the rules of a sport
v. hit a foul ball
v. commit a foul; break the rules
v. spot, stain, or pollute"
kid,"n. soft smooth leather from the hide of a young goat
n. young goat
v. be silly or tease one another"
call,"n. a telephone connection
n. a special disposition (as if from a divine source) to pursue a particular course
n. a demand especially in the phrase ""the call of duty""
n. a brief social visit"
terrible,"s causing fear or dread or terror
s exceptionally bad or displeasing
s intensely or extremely bad or unpleasant in degree or quality
s extreme in degree or extent or amount or impact"
shame,"n. a painful emotion resulting from an awareness of inadequacy or guilt
n. a state of dishonor
v. compel through a sense of shame
v. cause to be ashamed"
What a shame!,none
should,"imp. of Shall
imp. Used as an auxiliary verb, to express a conditional or
   contingent act or state, or as a supposition of an actual fact; also,
   to express moral obligation (see Shall); e. g.: they should have come
   last week; if I should go; I should think you could go."
complain,"v. express complaints, discontent, displeasure, or unhappiness
v. make a formal accusation; bring a formal charge"
hit,"n. (baseball) a successful stroke in an athletic contest (especially in baseball)
n. the act of contacting one thing with another
n. a conspicuous success
n. a dose of a narcotic drug"
court,"n. an assembly (including one or more judges) to conduct judicial business
n. a room in which a lawcourt sits
n. the sovereign and his advisers who are the governing power of a state
n. a specially marked horizontal area within which a game is played"
form,"n. the phonological or orthographic sound or appearance of a word that can be used to describe or identify something
n. a perceptual structure
n. the visual appearance of something or someone
n. a printed document with spaces in which to write"
in top form,none
win,"n. a victory (as in a race or other competition)
v. be the winner in a contest or competition; be victorious"
break,"n. an unexpected piece of good luck
n. the occurrence of breaking
n. an abrupt change in the tone or register of the voice (as at puberty or due to emotion)
n. the opening shot that scatters the balls in billiards or pool"
prize,"n. something given for victory or superiority in a contest or competition or for winning a lottery
v. hold dear"
lose,"v. fail to keep or to maintain; cease to have, either physically or in an abstract sense
v. fail to win
v. suffer the loss of a person through death or removal
v. miss from one's possessions; lose sight of"
fall,"n. the season when the leaves fall from the trees
n. the lapse of mankind into sinfulness because of the sin of Adam and Eve
n. a lapse into sin; a loss of innocence or of chastity
n. a sudden decline in strength or number or importance"
magic,n. any art that invokes supernatural powers
tortoise,n. usually herbivorous land turtles having clawed elephant-like limbs; worldwide in arid area except Australia and Antarctica
run after,none
deer,n. distinguished from Bovidae by the male's having solid deciduous antlers
sky,n. the atmosphere and outer space as viewed from the earth
whale,"n. any of the larger cetacean mammals having a streamlined body and breathing through a blowhole on the head
v. hunt for whales"
ocean,"n. a large body of water constituting a principal part of the hydrosphere
n. anything apparently limitless in quantity or volume"
photographer,n. someone who takes photographs professionally
cameraman,n. a photographer who operates a movie camera
host,"n. a person who invites guests to a social event (such as a party in his or her own home) and who is responsible for them while they are there
n. an animal or plant that nourishes and supports a parasite; it does not benefit and is often harmed by the association
n. archaic terms for army
n. any organization that provides resources and facilities for a function or event"
explain,"v. make plain and comprehensible
v. define"
habit,"n. an established custom
n. (psychology) an automatic pattern of behavior in reaction to a specific situation; may be inherited or acquired through frequent repetition
n. a distinctive attire worn by a member of a religious order
n. the general form or mode of growth (especially of a plant or crystal)"
scenery,"n. the painted structures of a stage set that are intended to suggest a particular locale
n. the appearance of a place"
explanation,"n. a statement that makes something comprehensible by describing the relevant structure or operation or circumstances etc.
n. thought that makes something comprehensible
n. the act of explaining; making something plain or intelligible"
continue,"v. continue a certain state, condition, or activity
v. continue talking
v. keep or maintain in unaltered condition; cause to remain or last
v. do something repeatedly and showing no intention to stop"
play,"n. a dramatic work intended for performance by actors on a stage
n. a theatrical performance of a drama
n. a preset plan of action in team sports
n. a state in which action is feasible"
experiment,"n. the act of conducting a controlled test or investigation
n. the testing of an idea
n. a venture at something new or different
v. to conduct a test or investigation"
musical,"n. a play or film whose action and dialogue is interspersed with singing and dancing
a. characterized by or capable of producing music
a. talented in or devoted to music
a. characteristic of or resembling or accompanied by music"
instrument,"n. a device that requires skill for proper use
n. the means whereby some act is accomplished
n. a person used by another to gain an end
v. equip with instruments for measuring, recording, or controlling"
teamwork,n. cooperative work done by a team (especially when it is effective)
bottle,"n. a glass or plastic vessel used for storing drinks or other liquids; typically cylindrical without handles and with a narrow neck that can be plugged or capped
n. the quantity contained in a bottle
n. a vessel fitted with a flexible teat and filled with milk or formula; used as a substitute for breast feeding infants and very young children
v. store (liquids or gases) in bottles"
camera,n. equipment for taking photographs (usually consisting of a lightproof box with a lens at one end and light-sensitive film at the other)
chopsticks,n one of a pair of slender sticks used as oriental tableware to eat food with
glue,"n. cement consisting of a sticky substance that is used as an adhesive
v. join or attach with or as if with glue
v. be fixed as if by glue"
metal,v. cover with metal
paper,"n. a material made of cellulose pulp derived mainly from wood or rags or certain grasses
n. a medium for written communication
n. a scholarly article describing the results of observations or stating hypotheses
v. cover with paper"
plastic,"n. generic name for certain synthetic or semisynthetic materials that can be molded or extruded into objects or films or filaments or used for making e.g. coatings and adhesives
s. capable of being influenced or formed"
wood,"n. the hard fibrous lignified substance under the bark of trees
n. United States film actress (1938-1981)
n. English conductor (1869-1944)
n. English writer of novels about murders and thefts and forgeries (1814-1887)"
material,"n. the tangible substance that goes into the makeup of a physical object
n. information (data or ideas or observations) that can be used or reworked into a finished form
n. things needed for doing or making something
n. a person judged suitable for admission or employment"
object,"n. a tangible and visible entity; an entity that can cast a shadow
n. (grammar) a constituent that is acted upon
n. the focus of cognitions or feelings
n. (computing) a discrete item that provides a description of virtually anything known to a computer"
build,"v. build or establish something abstract
v. improve the cleansing action of
v. order, supervise, or finance the construction of
v. give form to, according to a plan"
describe,v. give a description of
video,"n. the visible part of a television transmission
n. (computer science) the appearance of text and graphics on a video display"
second,"n. 1/60 of a minute; the basic unit of time adopted under the Systeme International d'Unites
n. following the first in an ordering or series
n. a 60th part of a minute of arc
n. the official attendant of a contestant in a duel or boxing match"
possible,"n. something that can be done
n. an applicant who might be suitable
a. capable of happening or existing"
return,"n. a coming to or returning home
n. the occurrence of a change in direction back in the opposite direction
n. the act of going back to a prior location
n. the income or profit arising from such transactions as the sale of land or other property"
on,"a. in operation or operational
a. (of events) planned or scheduled
r. indicates continuity or persistence or concentration
r. in a state required for something to function or be effective"
seat,"n. a space reserved for sitting (as in a theater or on a train or airplane)
n. furniture that is designed for sitting on
n. any support where you can sit (especially the part of a chair or bench etc. on which you sit)
n. a center of authority (as a city from which authority is exercised)"
exam,n a set of questions or exercises evaluating skill or knowledge
together,"s. mentally and emotionally stable
r. in contact with each other or in proximity
r. assembled in one place
r. in each other's company"
politely,r. in a polite manner
role,n. normal or customary activity of a person in a particular social setting
question,"n. an instance of questioning
n. the subject matter at issue
n. a sentence of inquiry that asks for a reply
n. an informal reference to a marriage proposal"
discussion,"n. an extended communication (often interactive) dealing with some particular topic
n. an exchange of views on some topic"
research,"n. systematic investigation to establish facts
v. attempt to find out in a systematically and scientific manner
v. inquire into"
alone,"s. isolated from others
s. lacking companions or companionship
s. exclusive of anyone or anything else
s. radically distinctive and without equal"
share,"n. assets belonging to or due to or contributed by an individual person or group
n. any of the equal portions into which the capital stock of a corporation is divided and ownership of which is evidenced by a stock certificate
v. have in common
v. use jointly or in common"
anyone,"n. One taken at random rather than by selection; anybody.
   [Commonly written as two words.]"
mind,"n. that which is responsible for one's thoughts and feelings; the seat of the faculty of reason
n. recall or remembrance
n. attention
n. your intention; what you intend to do"
hate,"n. the emotion of intense dislike; a feeling of dislike so strong that it demands action
v. dislike intensely; feel antipathy or aversion towards"
sound,"n. the particular auditory effect produced by a given cause
n. the subjective sensation of hearing something
n. mechanical vibrations transmitted by an elastic medium
n. the sudden occurrence of an audible event"
crazy,"n. someone deranged and possibly dangerous
s. foolish; totally unsound
s. possessed by inordinate excitement
s. bizarre or fantastic"
stick,"n. an implement consisting of a length of wood
n. a small thin branch of a tree
n. a lever used by a pilot to control the ailerons and elevators of an airplane
n. a rectangular quarter pound block of butter or margarine"
argue,"v. present reasons and arguments
v. have an argument about something
v. give evidence of"
choose,"v. pick out, select, or choose from a number of alternatives
v. select as an alternative over another
v. see fit or proper to act in a certain way; decide to act in a certain way"
suggest,"v. imply as a possibility
v. call to mind"
excellent,s. very good; of the highest quality
poor,"a. having little money or few possessions
a. characterized by or indicating poverty
a. lacking in specific resources, qualities or substances
s. unsatisfactory"
participate,v. share in something
task,v. assign a task to
stand,"n. the position where a thing or person stands
n. a growth of similar plants (usually trees) in a particular area
n. a small table for holding articles of various kinds
n. an interruption of normal activity"
speech,"n. (language) communication by word of mouth
n. something spoken
n. the exchange of spoken words"
give speeches,none
special,"n. a special offering (usually temporary and at a reduced price) that is featured in advertising
n. a dish or meal given prominence in e.g. a restaurant
n. a television production that features a particular person or work or topic
s. for a special service or occasion"
last,"n. the last or lowest in an ordering or series
n. a person's dying act; the final thing a person can do
n. a unit of weight equal to 4,000 pounds
n. a unit of capacity for grain equal to 80 bushels"
couple,"n. a pair who associate with one another
n. a pair of people who live together
n. a small indefinite number
n. two items of the same kind"
on holiday,none
resort,n. a hotel located in a resort area
take a walk,none
shake,"v. move or cause to move back and forth
v. move with or as if with a tremor
v. undermine or cause to waver
v. get rid of"
completely,r. so as to be complete; with everything necessary
earthquake,"n. shaking and vibration at the surface of the earth resulting from underground movement along a fault plane of from volcanic activity
n. a disturbance that is extremely disruptive"
one by one,none
dark,"n. absence of light or illumination
n. an unenlightened state
a. devoid of or deficient in light or brightness; shadowed or black
a. (used of color) having a dark hue"
heavily,"r. to a considerable degree
r. in a heavy-footed manner
r. with great force
r. in a manner designed for heavy duty"
moment,"n. a particular point in time
n. an indefinitely short time
n. a turning force produced by an object acting at a distance (or a measure of that force)
n. the n-th moment of a distribution is the expected value of the n-th power of the deviations from a fixed value"
at that moment,none
decide,"v. reach, make, or come to a decision about something
v. bring to an end; settle conclusively
v. cause to decide
v. influence or determine"
call for one's attention,none
until,"prep. To; unto; towards; -- used of material objects.
prep. To; up to; till; before; -- used of time; as, he staid
   until evening; he will not come back until the end of the month.
conj. As far as; to the place or degree that; especially, up to
   the time that; till. See Till, conj."
ruin,"n. an irrecoverable state of devastation and destruction
n. a ruined building
n. an event that results in destruction
v. destroy or cause to fail"
look for,none
blanket,"n. bedding that keeps a person warm in bed
n. anything that covers
n. a layer of lead surrounding the highly reactive core of a nuclear reactor
v. cover as if with a blanket"
enough,"n. an adequate quantity; a quantity that is large enough to achieve a purpose
r. as much as necessary; (`plenty' is nonstandard) ""I've had plenty, thanks"""
divide,"n. a serious disagreement between two groups of people (typically producing tension or hostility)
v. separate into parts or portions
v. perform a division"
collect,"n. a short prayer generally preceding the lesson in the Church of Rome or the Church of England
v. call for and obtain payment of
v. get or bring together
v. gather or collect"
flashlight,n. a small portable battery-powered electric lamp
flash,"n. a sudden intense burst of radiant energy
n. a momentary brightness
n. a short vivid experience
n. a sudden brilliant understanding"
journey,n. the act of traveling from one place to another
encourage,"v. inspire with confidence; give hope or courage to
v. spur on"
support,"n. the activity of providing for or maintaining by supplying with money or necessities
n. aiding the cause or policy or interests of
n. something providing immaterial assistance to a person or cause or interest
n. a military operation (often involving new supplies of men and materiel) to strengthen a military force or aid in the performance of its mission"
safely,r. with safety; in a safe manner
lucky,"s. occurring by chance
a. having or bringing good fortune"
hope,"n. a specific instance of feeling hopeful
n. the general feeling that some desire will be fulfilled
n. someone (or something) on which expectations are centered
n. United States comedian (born in England) who appeared in films with Bing Crosby (1903-2003)"
solve,v. find the solution to (a problem or question) or understand the meaning of
problem,"n. a state of difficulty that needs to be resolved
n. a question raised for consideration or solution"
into,"prep. To the inside of; within. It is used in a variety of
   applications.
prep. Expressing entrance, or a passing from the outside of a
   thing to its interior parts; -- following verbs expressing motion; as,
   come into the house; go into the church; one stream falls or runs into
   another; water enters into the fine vessels of plants.
prep. Expressing penetration beyond the outside or surface, or
   access to the inside, or contents; as, to look into a letter or book;
   to look into an apartment.
prep. Indicating insertion; as, to infuse more spirit or
   animation into a composition.
prep. Denoting inclusion; as, put these ideas into other words.
prep. Indicating the passing of a thing from one form,
   condition, or state to another; as, compound substances may be resolved
   into others which are more simple; ice is convertible into water, and
   water into vapor; men are more easily drawn than forced into
   compliance; we may reduce many distinct substances into one mass; men
   are led by evidence into belief of truth, and are often enticed into
   the commission of crimes'into; she burst into tears; children are
   sometimes frightened into fits; all persons are liable to be seduced
   into error and folly."
astronaut,n. a person trained to travel in a spacecraft
several,"s. (used with count nouns) of an indefinite number more than 2 or 3 but not many
s. distinct and individual"
everybody,n. Every person.
