gather,"n. sewing consisting of small folds or puckers made by pulling tight a thread in a line of stitching
n. the act of gathering something
v. assemble or get together
v. conclude from evidence"
gather around,none
not ... anymore,none
pack,"n. a complete collection of similar things
n. a convenient package or parcel (as of cigarettes or film)
n. a group of hunting animals
n. a cream that cleanses and tones the skin"
sharply,"r. in a well delineated manner
r. changing suddenly in direction and degree"
let sb. down,n a feeling of dissatisfaction that results when your expectations are not realized
onto,"prep. On the top of; upon; on. See On to, under On, prep."
extra,"n. an additional edition of a newspaper (usually to report a crisis)
n. something additional of the same kind
s. added to a regular schedule
s. further or added"
pay off,n. the final payment of a debt
keep up with,none
energy,"n. (physics) a thermodynamic quantity equivalent to the capacity of a physical system to do work; the units of energy are joules or ergs
n. forceful exertion
n. enterprising or ambitious drive
n. an imaginative lively style (especially style of writing)"
crowd,"n. a large number of things or people considered together
n. an informal body of friends
v. fill or occupy to the point of overflowing
v. to gather together in large numbers"
clap,"v. put quickly or forcibly
v. cause to strike the air in flight
v. clap one's hands together
v. strike the air in flight"
earn,v. acquire or deserve by one's efforts or actions
boxing,n. fighting with the fists
bounce,"n. the quality of a substance that is able to rebound
n. rebounding from an impact (or series of impacts)
v. spring back; spring away from an impact
v. hit something so that it bounces"
belt,"n. endless loop of flexible material between two rotating shafts or pulleys
n. a band to tie or buckle around the body (usually at the waist)
n. an elongated region where a specific condition or characteristic is found
n. ammunition (usually of small caliber) loaded in flexible linked strips for use in a machine gun"
announcement,"n. a formal public statement
n. a public statement containing information about an event that has happened or is going to happen"
defence,"n (psychiatry) an unconscious process that tries to reduce the anxiety associated with instinctive desires
n (sports) the team that is trying to prevent the other team from scoring
n the defendant and his legal advisors collectively
n an organization of defenders that provides resistance against attack
n the speech act of answering an attack on your assertions
n the justification for some act or belief
n a structure used to defend against attack
n a defendant's answer or plea denying the truth of the charges against him
n (military) military action or resources protecting a country against potential enemies
n protection from harm
n the act of defending someone or something against attack or injury"
audience,"n. a gathering of spectators or listeners at a (usually public) performance
n. the part of the general public interested in a source of information or entertainment"
remind,v. put in the mind of someone
bite,"n. a wound resulting from biting by an animal or a person
n. a light informal meal
n. (angling) an instance of a fish taking the bait
n. the act of gripping or chewing off with the teeth and jaws"
prohibit,v command against
case,"n. an occurrence of something
n. the actual state of things
n. a portable container for carrying several objects
n. a person requiring professional services"
in case,"v enclose in, or as if in, a case"
sign up,none
annual,"n. (botany) a plant that completes its entire life cycle within the space of a year
n. a reference book that is published regularly once every year
a. completing its life cycle within a year
s. occurring or payable every year"
application,"n. the act of bringing something to bear; using it for a particular purpose
n. a verbal or written request for assistance or employment or admission to a school
n. the work of applying something; 
n. a program that gives a computer instructions that provide the user with tools to accomplish a task"
warm-up,n. exercising in preparation for strenuous activity
quit,"v put an end to a state or an activity
v give up or retire from a position
v go away or leave
v turn away from; give up
v give up in the face of defeat of lacking hope; admit defeat"
halfway,"s. at a point midway between two extremes
s. including only half or a portion
r. at half the distance; at the middle"
tip,"n. the extreme end of something; especially something pointed
n. an indication of potential opportunity
v. cause to tilt
v. mark with a tip"
ought to,none
occupy,"v. live (in a certain place)
v. occupy the whole of"
disappointment,"n. a feeling of dissatisfaction that results when your expectations are not realized
n. an act (or failure to act) that disappoints someone"
amazingly,r. in an amazing manner; to everyone's surprise
relieve,"v. provide physical relief, as from pain
v. free from a burden, evil, or distress
v. take by stealing
v. alleviate or remove (pressure or stress) or make less oppressive"
strengthen,"v. make strong or stronger
v. gain strength"
immune,"n. a person who is immune to a particular infection
a. relating to the condition of immunity
s. secure against
s. relating to or conferring immunity (to disease or infection)"
system,"n. instrumentality that combines interrelated interacting artifacts designed to work as a coherent entity
n. a group of independent but interrelated elements comprising a unified whole
n. (physical chemistry) a sample of matter in which substances in different phases are in equilibrium
n. a complex of methods or rules governing behavior"
immune system,none
cheer up,none
weekly,"n. a periodical that is published every week (or 52 issues per year)
s. of or occurring every seven days"
be fed up with,none
awkward,"s. causing inconvenience
a. lacking grace or skill in manner or movement or performance
s. difficult to handle or manage especially because of shape
s. not elegant or graceful in expression"
particular,"n. a fact about some part (as opposed to general)
n. (logic) a proposition that asserts something about some (but not all) members of a class
s. unique or specific to a person or thing or category
s. separate and distinct from others of the same group or category"
in particular,none
benefit,"n. financial assistance in time of need
n. something that aids or promotes well-being
n. a performance to raise money for a charitable cause
v. be beneficial for"
membership,"n. the body of members of an organization or group
n. the state of being a member"
equipment,n. an instrumentality needed for an undertaking or to perform a service
capable,"a. (usually followed by `of') having capacity or ability
s. possibly accepting or permitting
a. (followed by `of') having the temperament or inclination for"
be capable of,none
prevent,"v. keep from happening or arising; make impossible
v. stop (someone or something) from doing something or being in a certain state"
disease,n. an impairment of health or a condition of abnormal functioning
upper,"n. piece of leather or synthetic material that forms the part of a shoe or boot above the sole that encases the foot
s. the topmost one of two
s. higher in place or position
s. superior in rank or accomplishment"
flow,"n. the motion characteristic of fluids (liquids or gases)
n. the amount of fluid that flows in a given time
n. the act of flowing or streaming; continuous progression
n. any uninterrupted stream or discharge"
oxygen,n. a nonmetallic bivalent element that is normally a colorless odorless tasteless nonflammable diatomic gas; constitutes 21 percent of the atmosphere by volume; the most abundant element in the earth's crust
relief,"n. the feeling that comes when something burdensome is removed or reduced
n. the condition of being comfortable or relieved (especially after being relieved of distress)
n. (law) redress awarded by a court
n. assistance in time of difficulty"
ache,"n. a dull persistent (usually moderately intense) pain
v. have a desire for something or someone who is not present
v. be the source of pain"
guideline,n. a light line that is used in lettering to help align the letters
click,"n. depression of a button on a computer mouse
v. make a clicking or ticking sound
v. produce a click
v. become clear or enter one's consciousness or emotions"
detail,"n. an isolated fact that is considered separately from the whole
n. a small part that can be considered separately from the whole
n. extended treatment of particulars
n. a crew of workers selected for a particular task"
principle,"n. a basic generalization that is accepted as true and that can be used as a basis for reasoning or conduct
n. a rule or standard especially of good behavior
n. a basic truth or law or assumption
n. a rule or law concerning a natural phenomenon or the function of a complex system"
amount,"n. the relative magnitude of something with reference to a criterion
v. be tantamount or equivalent to"
shortcut,n. a route shorter than the usual one
overnight,"r. during or for the length of one night
r. happening in a short time or with great speed"
achievable,s capable of existing or taking place or proving true; possible to do
make sure,none
muscle,"n. one of the contractile organs of the body
n. animal tissue consisting predominantly of contractile cells
n. authority or power or force (especially when used in a coercive way)
v. make one's way by force"
bone,"n. rigid connective tissue that makes up the skeleton of vertebrates
n. the porous calcified substance from which bones are made
n. a shade of white the color of bleached bones
v. remove the bones from"
satisfaction,"n. the contentment one feels when one has fulfilled a desire, need, or expectation
n. (law) the payment of a debt or fulfillment of an obligation
n. act of fulfilling a desire or need or appetite"
sweat,"n. condensation of moisture on a cold surface
v. excrete perspiration through the pores in the skin"
overdo,v. do something to an excessive degree
sight,"n. an instance of visual perception
n. anything that is seen
n. the ability to see; the visual faculty
n. a range of mental vision"
cyclist,n. a person who rides a bicycle
overtake,v. catch up with and possibly overtake
amazed,s. filled with the emotional impact of overwhelming surprise or shock
sportsmanship,n. fairness in following the rules of the game
bronze,"n. an alloy of copper and tin and sometimes other elements; also any copper-base alloy containing other elements in place of tin
n. a sculpture made of bronze
v. give the color and appearance of bronze to something
s. of the color of bronze"
medal,n an award for winning a championship or commemorating some other event
response,"n. a result
n. a phrase recited or sung by the congregation following a versicle by the priest or minister
n. the manner in which an electrical or mechanical device responds to an input signal or a range of input signals"
gesture,"n. motion of hands or body to emphasize or help to express a thought or feeling
n. the use of movements (especially of the hands) to communicate familiar or prearranged signals
n. something done as an indication of intention"
take advantage of sth.,none
defend,"v. argue or speak in defense of
v. be on the defensive; act against an attack
v. protect against a challenge or attack
v. be the defense counsel for someone in a trial"
flexibility,"n. the property of being flexible; easily bent or shaped
n. the quality of being adaptable or variable"
occasion,"n. reason
n. the time of a particular event
n. an opportunity to do something
v. give occasion to"
dragon,"n. a creature of Teutonic mythology; usually represented as breathing fire and having a reptilian body and sometimes wings
n. a fiercely vigilant and unpleasant woman
n. any of several small tropical Asian lizards capable of gliding by spreading winglike membranes on each side of the body"
Dragon-Boat Festival,none
graduation,"n. the successful completion of a program of study
n. a line (as on a vessel or ruler) that marks a measurement"
lunar,a. of or relating to or associated with the moon
lunar month,none
barbecue,"n. meat that has been barbecued or grilled in a highly seasoned sauce
n. a cookout in which food is cooked over an open fire; especially a whole animal carcass roasted on a spit
n. a rack to hold meat for cooking over hot charcoal usually out of doors"
sticky,"s. moist as with undried perspiration and with clothing sticking to the body
s. covered with an adhesive material"
adult,"n. a fully developed person from maturity onward
n. any mature animal
s. (of animals) fully developed"
lantern,n. light in a transparent protective case
pudding,"n. any of various soft thick unsweetened baked dishes
n. (British) the dessert course of a meal (`pud' is used informally)
n. any of various soft sweet desserts thickened usually with flour and baked or boiled or steamed"
turkey,"n. large gallinaceous bird with fan-shaped tail; widely domesticated for food
n. a Eurasian republic in Asia Minor and the Balkans; on the collapse of the Ottoman Empire in 1918, the Young Turks, led by Kemal Ataturk, established a republic in 1923
n. flesh of large domesticated fowl usually roasted
n. an event that fails badly or is totally ineffectual"
congratulation,"n. the act of acknowledging that someone has an occasion for celebration
n. (usually plural) an expression of pleasure at the success or good fortune of another"
decorate,"v. make more attractive by adding ornament, colour, etc.
v. award a mark of honor, such as a medal, to"
tradition,n. an inherited pattern of thought or action
monster,"n. an imaginary creature usually having various human and animal parts
n. a cruel wicked and inhuman person
n. (medicine) a grossly malformed and usually nonviable fetus"
immediately,"r. without delay or hesitation; with no time intervening
r. near or close by
r. bearing an immediate relation"
gathering,n. a group of persons together in one place
snack,"n a light informal meal
v eat a snack; eat lightly"
put up,s. planned secretly
decoration,"n. something used to beautify
n. an award for winning a championship or commemorating some other event
n. the act of decorating something (in the hope of making it more attractive)"
let off,"n. A device for letting off, releasing, or giving forth, as
   the warp from the cylinder of a loom."
account,"n. a formal contractual relationship established to provide for regular banking or brokerage or business services
n. importance or value
n. a statement of recent transactions and the resulting balance
n. the quality of taking advantage"
summarise,"v be a summary of
v give a summary (of)"
host,"n. a person who invites guests to a social event (such as a party in his or her own home) and who is responsible for them while they are there
n. an animal or plant that nourishes and supports a parasite; it does not benefit and is often harmed by the association
n. archaic terms for army
n. any organization that provides resources and facilities for a function or event"
sweep,"n. a wide scope
n. a long oar used in an open boat
n. a movement in an arc
v. move with sweeping, effortless, gliding motions"
sweep away,none
character,"n. the inherent complex of attributes that determines a persons moral and ethical actions and reactions
n. an actor's portrayal of someone in a play
n. a person of a specified kind (usually with many eccentricities)
n. good repute"
attach,"v. cause to be attached
v. be attached; be in contact with
v. become attached"
upside down,s being in such a position that top and bottom are reversed
expectant,"s marked by eager anticipation
s in an advanced stage of pregnancy"
scare,n. a sudden attack of fear
scare sb. away,none
scare sth. away,none
flight,"n. a formation of aircraft in flight
n. an instance of traveling by air
n. a stairway (set of steps) between one floor or landing and the next
n. an air force unit smaller than a squadron"
wine,"n. fermented juice (of grapes especially)
n. a red as dark as red wine
v. drink wine
v. treat to wine"
surround,v. extend on all sides of simultaneously; encircle
accent,"n. distinctive manner of oral expression
n. a diacritical mark used to indicate stress or placed above a vowel to indicate a special pronunciation"
hotpot,n a stew of meat and potatoes cooked in a tightly covered pot
firecracker,n. firework consisting of a small explosive charge and fuse in a heavy paper casing
retired,s. no longer active in your work or profession
buzz,"n. sound of rapid vibration
n. a confusion of activity and gossip
v. make a buzzing sound
v. fly low"
joy,"n. the emotion of great happiness
n. something or someone that provides a source of happiness"
throughout,r. from first to last
original,"n. something that serves as a model or a basis for making copies
s. preceding all others in time or being as first made or performed
s. (of e.g. information) not secondhand or by way of something intermediary
a. being or productive of something fresh and unusual; or being as first made or thought of"
custom,"n. accepted or habitual practice
n. a specific practice of long standing
n. habitual patronage"
wedding,"n. the social event at which the ceremony of marriage is performed
n. a party of people at a wedding"
greet,"v. express greetings upon meeting someone
v. send greetings to
v. react to in a certain way
v. be perceived by"
beer,n. a general name for alcoholic beverages made by fermenting a cereal (or mixture of cereals) flavored with hops
teenager,n a juvenile between the onset of puberty and maturity
studio,"n. workplace for the teaching or practice of an art
n. workplace consisting of a room or building where movies or television shows or radio programs are produced and recorded"
as far as,none
appropriately,r. in an appropriate manner
specific,"n. a medicine that has a mitigating effect on a specific disease
a. (sometimes followed by `to') applying to or characterized by or distinguishing something particular or special or unique
s. stated explicitly or in detail
a. relating to or distinguishing or constituting a taxonomic species"
neat,"s. clean or organized
s. showing care in execution
s. free from what is tawdry or unbecoming
s. without water"
suit,"n. a set of garments (usually including a jacket and trousers or skirt) for outerwear all of the same fabric and color
n. (slang) a businessman dressed in a business suit
n. a petition or appeal made to a person of superior status or rank
n. playing card in any of four sets of 13 cards in a pack; each set has its own symbol and color"
jeans,"n (usually plural) close-fitting trousers of heavy denim for manual work or casual wear
n a coarse durable twill-weave cotton fabric"
in general,none
effort,n. use of physical or mental energy; hard work
make an effort,none
represent,"v. take the place of or be parallel or equivalent to
v. be representative or typical for
v. be a delegate or spokesperson for; represent somebody's interest or be a proxy or substitute for, as of politicians and office holders representing their constituents, or of a tenant representing other tenants in a housing dispute
v. serve as a means of expressing something"
extend,"v. make available; provide
v. reach outward in space
v. expand the influence of
v. open or straighten out; unbend"
fortunate,"a. having unexpected good fortune
s. supremely favored
s. presaging good fortune"
memory,"n. something that is remembered
n. the cognitive processes whereby past experience is remembered
n. the power of retaining and recalling past experience
n. an electronic memory device"
stocking,"n. close-fitting hosiery to cover the foot and leg; come in matched pairs (usually used in the plural)
n. the activity of supplying a stock of something"
move in,none
somehow,"r. in some unspecified way or manner; or by some unspecified means
r. for some unspecified reason;"
slightly,r. to a small degree or extent
pole,"n. a long (usually round) rod of wood or metal or plastic
n. a native or inhabitant of Poland
n. one of two divergent or mutually exclusive opinions
n. one of two points of intersection of the Earth's axis and the celestial sphere"
envelope,"n. a flat (usually rectangular) container for a letter, thin package, etc.
n. any wrapper or covering
n. a curve that is tangent to each of a family of curves
n. a natural covering (as by a fluid)"
stuff,"n. miscellaneous unspecified objects
n. informal terms for personal possessions
n. senseless talk
n. unspecified qualities required to do or be something"
lap,"n. the upper side of the thighs of a seated person
n. an area of control or responsibility
n. the part of a piece of clothing that covers the thighs
n. a flap that lies over another part"
frosty,s. covered with frost
patience,n. good-natured tolerance of delay or incompetence
over and over,none
eve,"n. (Old Testament) Adam's wife in Judeo-Christian mythology: the first woman and mother of the human race; God created Eve from Adam's rib and placed Adam and Eve in the Garden of Eden
n. the day before
n. the period immediately before something"
branch,"n. a division of some larger or more complex organization
n. a division of a stem, or secondary stem arising from the main stem of a plant
n. a part of a forked or branching shape
n. a stream or river connected to a larger one"
plate,"n. a sheet of metal or wood or glass or plastic
n. a full-page illustration (usually on slick paper)
n. dish on which food is served or from which food is eaten
n. the quantity contained in a plate"
behaviour,"n the action or reaction of something (as a machine or substance) under specified circumstances
n (behavioral attributes) the way a person behaves toward other people
n (psychology) the aggregate of the responses or reactions or movements made by an organism in any situation
n manner of acting or controlling yourself"
whisper,"n. speaking softly without vibration of the vocal cords
v. speak softly; in a low voice"
merry,"s full of or showing high-spirited merriment
s offering fun and gaiety
s quick and energetic"
ballet,"n. a theatrical representation of a story that is performed to music by trained dancers
n. music written for a ballet"
roll,"n. a list of names
n. photographic film rolled up inside a container to protect it from light
n. anything rolled up in cylindrical form
n. walking with a swaying gait"
catch sb.'s eye,none
wave,"n. one of a series of ridges that moves across the surface of a liquid (especially across a large body of water)
n. a movement like that of a sudden occurrence or increase in a specified phenomenon
n. (physics) a movement up and down or back and forth
n. something that rises rapidly"
affair,"n. a usually secretive or illicit sexual relationship
n. a vaguely specified social event"
swallow,"n. a small amount of liquid food
n. the act of swallowing
n. small long-winged songbird noted for swift graceful flight and the regularity of its migrations
v. pass through the esophagus as part of eating or drinking"
pass away,none
no longer,none
event,"n. something that happens at a given place and time
n. a special set of circumstances
n. a phenomenon located at a single point in space-time; the fundamental observational entity in relativity theory"
description,"n. a statement that represents something in words
n. the act of describing something
n. sort or variety"
awesome,s inspiring awe or admiration or wonder
downstairs,"a. on or of lower floors of a building
r. on a floor below"
nowhere,"n. an insignificant place
r. not anywhere; in or at or to no place"
select,"v pick out, select, or choose from a number of alternatives
s of superior grade
s selected or chosen for special qualifications"
album,"n. one or more recordings issued together; originally released on 12-inch phonograph records (usually with attractive record covers) and later on cassette audiotape and compact disc
n. a book of blank pages with pockets or envelopes; for organizing photographs or stamp collections etc"
calm,"v. make calm or still
v. become quiet or calm, especially after a state of agitation
s. not agitated; without losing self-possession
a. (of weather) free from storm or wind"
calm down,none
uniform,"n. clothing of distinctive design worn by members of a particular group as a means of identification
v. provide with uniforms
a. always the same; showing a single form or character in all occurrences
s. evenly spaced"
tear,"n. a drop of the clear salty saline solution secreted by the lacrimal glands
n. the act of tearing
v. separate or cause to separate abruptly
v. to separate or be separated by force"
cuisine,n. the practice or manner of preparing food or the food so prepared
thoroughly,"r. in an exhaustive manner
r. completely and absolutely (`good' is sometimes used informally for `thoroughly')"
humbly,r. in a humble manner
