to one's surprise,none
delicious,n. variety of sweet eating apples
dream,"n. a series of mental images and emotions occurring during sleep
n. imaginative thoughts indulged in while awake
n. a state of mind characterized by abstraction and release from reality
n. someone or something wonderful"
bear,"n. massive plantigrade carnivorous or omnivorous mammals with long shaggy coats and strong claws
n. an investor with a pessimistic market outlook; an investor who expects prices to fall and so sells now in order to buy later at a lower price
v. have
v. move while holding up or supporting"
teddy bear,none
gift,n. something acquired without compensation
sunglasses,n. spectacles that are darkened or polarized to protect the eyes from the glare of the sun
get on,none
statue,n. a sculpture representing a human or animal
title,"n. a heading that names a statute or legislative bill; may give a brief summary of the matters it deals with
n. the name of a work of art or literary composition etc.
n. a general or descriptive heading for a section of a written work
n. an identifying appellation signifying status or function: e.g. `Mr.' or `General'"
unexplained,"s. not explained
s. having the reason or cause not made clear"
monster,"n. an imaginary creature usually having various human and animal parts
n. a cruel wicked and inhuman person
n. (medicine) a grossly malformed and usually nonviable fetus"
UFO,n an (apparently) flying object whose nature is unknown; especially those considered to have extraterrestrial origins
unusual,"a. not usual or common or ordinary
s. not commonly encountered"
strange,"a. being definitely out of the ordinary and unexpected; slightly odd or even a bit weird
s. not known before"
creature,"n. a human being; `wight' is an archaic term
n. a person who is controlled by others and is used to perform unpleasant or dishonest tasks for someone else"
natural,"n. someone regarded as certain to succeed
n. a notation cancelling a previous sharp or flat
n. (craps) a first roll of 7 or 11 that immediately wins the stake
a. in accordance with nature; relating to or concerning nature"
sense,"n. a general conscious awareness
n. the meaning of a word or expression; the way in which a word or expression or situation can be interpreted
n. the faculty through which the external world is apprehended
n. a natural appreciation or ability"
smell,"n. the sensation that results when olfactory receptors in the nose are stimulated by particular chemicals in gaseous form
n. the faculty that enables us to distinguish scents
n. the act of perceiving the odor of something
v. inhale the odor of; perceive by the olfactory sense"
taste,"n. the sensation that results when taste buds in the tongue and throat convey information about the chemical composition of a soluble stimulus
n. delicate discrimination (especially of aesthetic values)
n. a brief experience of something
n. a small amount eaten or drunk"
touch,"n. the event of something coming in contact with the body
n. the faculty by which external objects or forces are perceived through contact with the body (especially the hands)
n. a suggestion of some quality
n. a distinguishing style"
amazing,"s. surprising greatly
s. inspiring awe or admiration or wonder"
relax,"v. become less tense, rest, or take one's ease
v. make less taut
v. cause to feel relaxed
v. become less tense, less formal, or less restrained, and assume a friendlier manner"
disappear,"v. get lost, as without warning or explanation"
search,"n. the activity of looking thoroughly in order to find something or someone
n. an investigation seeking answers
n. an operation that determines whether one or more of a set of items has a specified property
n. the examination of alternative hypotheses"
yard,"n. a unit of length equal to 3 feet; defined as 91.44 centimeters; originally taken to be the average length of a stride
n. the enclosed land around a house or other building
n. a tract of land enclosed for particular activities (sometimes paved and usually associated with buildings)
n. a tract of land where logs are accumulated"
fence,"n. a barrier that serves to enclose an area
n. a dealer in stolen property
v. enclose with a fence
v. receive stolen goods"
strangely,r in a strange manner
noise,"n. sound of any kind (especially unintelligible or dissonant sound)
n. the auditory experience of sound that lacks musical quality; sound that is a disagreeable auditory experience
n. electrical or acoustic activity that can disturb communication
n. a loud outcry of protest or complaint"
wake,"n. the wave that spreads behind a boat as it moves forward
n. a vigil held over a corpse the night before burial
v. be awake, be alert, be there
v. make aware of"
hairy,"a. having or covered with hair
s. hazardous and frightening"
scary,s provoking fear terror
scared,"v cause fear in
v cause to lose courage
v mark with a scar
s made afraid"
throw,"n. the act of throwing (propelling something with a rapid movement of the arm and wrist)
n. a single chance or instance
n. the maximum movement available to a pivoted or reciprocating piece by a cam
n. bedclothes consisting of a lightweight cloth covering (an afghan or bedspread) that is casually thrown over something"
newspaper,"n. a daily or weekly publication on folded sheets; contains news and articles and advertisements
n. a business firm that publishes newspapers
n. the physical object that is the product of a newspaper publisher
n. cheap paper made from wood pulp and used for printing newspapers"
sailor,n. any member of a ship's crew
row,"n. an arrangement of objects or people side by side in a line
n. a long continuous strip (usually running horizontally)
n. a linear array of numbers, letters, or symbols side by side
n. a continuous chronological succession without an interruption"
boat,"n. a small vessel for travel on water
v. ride in a boat on water"
toward,"prep. Alt. of Towards
adv. Alt. of Towards
prep. Approaching; coming near.
prep. Readly to do or learn; compliant with duty; not froward;
   apt; docile; tractable; as, a toward youth.
prep. Ready to act; forward; bold; valiant."
dive,"n. a headlong plunge into water
n. a steep nose-down descent by an aircraft
v. drop steeply
v. plunge into water"
side,"n. a place within a region identified relative to a center or reference location
n. one of two or more contesting groups
n. either the left or right half of a body
n. a surface forming part of the outside of an object"
imaginary,"n (mathematics) a number of the form a+bi where a and b are real numbers and i is the square root of -1
s not based on fact; unreal"
might,n. physical strength
right now,none
prove,"v. be shown or be found to be
v. establish the validity of something, as by an example, explanation or experiment
v. prove formally; demonstrate by a mathematical, formal proof
v. take a trial impression of"
brain,"n. that part of the central nervous system that includes all the higher nervous centers; enclosed within the skull; continuous with the spinal cord
n. mental ability
n. the brain of certain animals used as meat
v. hit on the head"
asleep,"a. in a state of sleep
s. lacking sensation
s. dead
r. into a sleeping state"
probably,r. with considerable certainty; without much doubt
human,"a. characteristic of humanity
a. relating to a person
a. having human form or attributes as opposed to those of animals or divine beings"
common,"a. belonging to or participated in by a community as a whole; public
a. having no special distinction or quality; widely known or commonly encountered; average or ordinary or usual
s. common to or shared by two or more parties
s. commonly encountered"
realise,"v earn on some commercial or business transaction; earn as salary or wages
v convert into cash; of goods and property
v expand or complete (a part in a piece of baroque music) by supplying the harmonies indicated in the figured bass
v make real or concrete; give reality or substance to
v be fully aware or cognizant of
v perceive (an idea or situation) mentally"
radio,"n. medium for communication
n. a communication system based on broadcasting electromagnetic waves
v. transmit messages via radio waves
a. indicating radiation or radioactivity"
pyjama,"n a pair of loose trousers tied by a drawstring around the waist; worn by men and women in some Asian countries
n (usually plural) loose-fitting nightclothes worn for sleeping or lounging; have a jacket top and trousers"
in fact,none
wake up,none
France,"n. a republic in western Europe; the largest country wholly in Europe
n. French writer of sophisticated novels and short stories (1844-1924)"
Germany,n. a republic in central Europe; split into East Germany and West Germany after World War II and reunited in 1990
the Pyramids,none
the Temple of Heaven,none
Japan,"n. a string of more than 3,000 islands to the east of Asia extending 1,300 miles between the Sea of Japan and the western Pacific Ocean
n. a constitutional monarchy occupying the Japanese Archipelago; a world leader in electronics and automobile manufacture and ship building
n. lacquerware decorated and varnished in the Japanese manner with a glossy durable black lacquer"
Russia,"n. a former empire in eastern Europe and northern Asia created in the 14th century with Moscow as the capital; powerful in the 17th and 18th centuries under Peter the Great and Catherine the Great when Saint Petersburg was the capital; overthrown by revolution in 1917
n. a federation in northeastern Europe and northern Asia; formerly Soviet Russia; since 1991 an independent state"
Brazil,n. the largest Latin American country and the largest Portuguese speaking country in the world; located in the central and northeastern part of South America; world's leading coffee exporter
the North Pole,none
the South Pole,none
Maikhao Beach,none
Thailand,n. a country of southeastern Asia that extends southward along the Isthmus of Kra to the Malay Peninsula
Bigfoot,n. large hairy humanoid creature said to live in wilderness areas of the United States and Canada
Loch Ness Monster,none
Scotland,n. one of the four countries that make up the United Kingdom of Great Britain and Northern Ireland; located on the northern part of the island of Great Britain; famous for bagpipes and plaids and kilts
the Atlantic Ocean,none
