cooperate,v work together on a common enterprise of project
puzzle,"n. a particularly baffling problem that is said to have a correct solution
n. a game that tests your ingenuity
v. be uncertain about; think about without fully understanding or being able to decide"
discuss,"n an athletic competition in which a disk-shaped object is thrown as far as possible
n a disk used in throwing competitions
v to consider or examine in speech or writing
v speak with others about (something); talk (something) over in detail; have a discussion"
band,"n. instrumentalists not including string players
n. a stripe or stripes of contrasting color
n. an adornment consisting of a strip of a contrasting color or material
n. a range of frequencies between two limits"
high jump,none
long jump,none
popular,"a. regarded with great favor, approval, or affection especially by the general public
s. carried on by or for the people (or citizens) at large
s. (of music or art) new and of general appeal (especially among young people)"
push-up,n. an arm exercise performed lying face to the floor and pushing the body up and down with the arms
sit-up,n. a stomach exercise in which a person sits up from a supine position without using the arms for leverage
race,"n. any competition
n. a contest of speed
n. people who are believed to belong to the same genetic stock
v. compete in a race"
rope,"n. a strong line
v. fasten with a rope"
after-class,none
record,"n. anything (such as a document or a phonograph record or a photograph) providing permanent evidence of or information about past events
n. the number of wins versus losses and ties a team has had
n. the sum of recognized accomplishments
n. a compilation of the known facts regarding something or someone"
break the record,none
bit,"n. a small fragment of something broken off from the whole
n. piece of metal held in horse's mouth by reins and used to control the horse while riding
n. a unit of measurement of information (from binary + digit); the amount of information in a system having two equiprobable states
n. the part of a key that enters a lock and lifts the tumblers"
a bit, 3d sing. pres. of Abide.
sick,"n. people who are sick
s. deeply affected by a strong feeling"
active,"n. a person who is a participating member of an organization
a. tending to become more severe or wider in scope
s. engaged in or ready for military or naval operations
a. disposed to take action or effectuate change"
joke,"n. a humorous anecdote or remark intended to provoke laughter
n. a triviality not to be taken seriously
v. tell a joke; speak humorously
v. act in a funny or teasing way"
joke around,none
weak,"a. wanting in physical strength
s. tending downward in price
s. deficient or lacking in some skill
s. (used of verbs) having standard (or regular) inflection"
size,"n. the physical magnitude of something (how big it is)
n. the property resulting from being one of a series of graduated measurements (as of clothing)
n. any glutinous material used to fill pores in surfaces or to stiffen fabrics
n. the actual state of affairs"
average,"n. a statistic describing the location of a distribution
n. (sports) the ratio of successful performances to opportunities
n. an intermediate scale value regarded as normal or usual
v. amount to or come to an average, without loss or gain"
Olympic,a. of or relating to the Olympic Games
diving,n. an athletic competition that involves diving into water
gymnastics,n. a sport that involves exercises intended to display strength and balance and agility
horse-riding,none
weightlifting,"n. bodybuilding by exercise that involves lifting weights
v. lift weights"
athlete,n. a person trained to compete in sports
horse-rider,none
compete,v. compete for something; engage in a contest; measure oneself against others
at the age of ...,none
national,"n. a person who owes allegiance to that nation
a. of or relating to or belonging to a nation or country
a. limited to or in the interests of a particular nation
a. concerned with or applicable to or belonging to an entire nation or country"
champion,"n. someone who has won first place in a competition
n. someone who fights for a cause
v. protect or fight for as a champion
s. holding first place in a contest"
gymnast,n. an athlete who is skilled in gymnastics
diver,"n. someone who works underwater
n. someone who dives (into water)"
medal,n an award for winning a championship or commemorating some other event
competition,"n. a business relation in which two parties compete to gain customers
n. the act of competing as for profit or a prize"
metre,"n the basic unit of length adopted under the Systeme International d'Unites (approximately 1.094 yards)
n (prosody) the accent in a metrical foot of verse
n rhythm as given by division into parts of equal duration"
gold,"n. coins made of gold
n. a soft yellow malleable ductile (trivalent and univalent) metallic element; occurs mainly as nuggets in rocks and alluvial deposits; does not react with most chemicals but is attacked by chlorine and aqua regia
n. great wealth
n. something likened to the metal in brightness or preciousness or superiority etc."
weightlifter,n. an athlete who lifts barbells
runner,"n. someone who travels on foot by running
n. a person who is employed to deliver messages or documents
n. a trained athlete who competes in foot races
n. a long narrow carpet"
expedition,"n. a military campaign designed to achieve a specific objective in a foreign country
n. an organized group of people undertaking a journey for a particular purpose
n. a journey organized for a particular purpose"
pole,"n. a long (usually round) rod of wood or metal or plastic
n. a native or inhabitant of Poland
n. one of two divergent or mutually exclusive opinions
n. one of two points of intersection of the Earth's axis and the celestial sphere"
explorer,n. someone who travels into little known regions (especially for some scientific purpose)
north,"n. the region of the United States lying to the north of the Mason-Dixon line
n. the cardinal compass point that is at 0 or 360 degrees
n. a location in the northern part of a country, region, or city
n. the direction corresponding to the northward cardinal compass point"
worst,"n. the least favorable outcome
n. the greatest damage or wickedness of which one is capable
n. the weakest effort or poorest achievement one is capable of
v. defeat thoroughly"
accident,"n. an unfortunate mishap; especially one causing damage or injury
n. anything that happens suddenly or by chance without an apparent cause"
prepare,"v. to prepare verbally, either for written or spoken delivery
v. educate for a future role or function
v. lead up to and soften by sounding the dissonant note in it as a consonant note in the preceding chord"
artificial,"a. contrived by art rather than nature
s. artificially formal
s. not arising from natural growth or characterized by vital processes"
careful,"a. exercising caution or showing care or attention
s. cautiously attentive
s. unhurried and with care and dignity
s. full of cares or anxiety"
ice,"n. water frozen in the solid state
n. the frozen part of a body of water
n. diamonds
n. a frozen dessert with fruit flavoring (especially one containing no milk)"
better,"n. something superior in quality or condition or effect
n. a superior person having claim to precedence
n. the superior one of two alternatives
v. surpass in excellence"
worse,"n. something inferior in quality or condition or effect
a. (comparative of `bad') inferior to another in quality or condition or desirability
a. changed for the worse in health or fitness
r. (comparative of `ill') in a less effective or successful or desirable manner"
arrive,"v. reach a destination; arrive by movement or progress
v. succeed in a big way; get to the top"
arrive at,none
brave,"n. a North American Indian warrior
n. people who are brave
a. possessing or displaying courage; able to face and deal with danger or fear without flinching
s. brightly colored and showy"
success,"n. an event that accomplishes its intended purpose
n. an attainment that is successful
n. a state of prosperity or fame"
pull-up,n. an arm exercise performed by pulling yourself up on a horizontal bar until your chin is level with the bar
event,"n. something that happens at a given place and time
n. a special set of circumstances
n. a phenomenon located at a single point in space-time; the fundamental observational entity in relativity theory"
jumper,"n. a person who jumps
n. an athlete who competes at jumping
n. a coverall worn by children
n. a small connector used to make temporary electrical connections"
health,"n. a healthy state of wellbeing free from disease
n. the general condition of body and mind"
cough,"n. a sudden noisy expulsion of air from the lungs that clears the air passages; a common symptom of upper respiratory infection or bronchitis or pneumonia or tuberculosis
v. exhale abruptly, as when one has a chest cold or congestion"
fever,"n. a rise in the temperature of the body; frequently a symptom of infection
n. intense nervous anticipation"
headache,n. pain in the head caused by dilation of cerebral arteries or muscle contractions or a reaction to drugs
runny,s characteristic of a fluid; capable of flowing and easily changing shape
sore,n. an open skin infection
throat,"n. the passage to the stomach and lungs; in the front part of the neck below the chin and above the collarbone
n. an opening in the vamp of a shoe at the instep
n. a passage resembling a throat in shape or function; 
n. the part of an animal's body that corresponds to a person's throat"
stomachache,n. an ache localized in the stomach or abdominal region
toothache,n. an ache localized in or around a tooth
plenty,n. a full supply
plenty of,none
dentist,n. a person qualified to practice dentistry
matter,"n. a vaguely specified concern
n. that which has mass and occupies space
n. a problem
n. (used with negation) having consequence"
temperature,"n. the degree of hotness or coldness of a body or environment (corresponding to its molecular activity)
n. the somatic sensation of cold or heat"
deep,"n. the central and most intense or profound part
n. literary term for an ocean
a. relatively deep or strong; affecting one deeply
s. marked by depth of thinking"
breath,"n. the process of taking in and expelling air during breathing
n. the air that is inhaled and exhaled in respiration
n. a short respite
n. a slight movement of the air"
flu,n an acute febrile highly contagious viral disease
serious,"a. concerned with work or important matters rather than play or trivialities
s. of great consequence
s. requiring effort or concentration; complex and not easy to answer or solve"
twice,r. two times
note,"n. a brief written record
n. a short personal letter
n. a notation representing the pitch and duration of a musical sound
n. a tone of voice that shows what the speaker is feeling"
patient,"n. a person who requires medical care
a. enduring trying circumstances with even temper or characterized by such endurance"
date,"n. the specified day of the month
n. a participant in a date
n. a meeting arranged in advance
n. a particular but unspecified point in time"
symptom,"n. (medicine) any sensation or change in bodily function that is experienced by a patient and is associated with a particular disease
n. anything that accompanies X and is regarded as an indication of X's existence"
treatment,"n. care provided to improve a situation (especially medical procedures or applications that are intended to relieve illness or injury)
n. the management of someone or something
n. a manner of dealing with something artistically"
cold,"n. a mild viral infection involving the nose and respiratory passages (but not the lungs)
n. the sensation produced by low temperatures
a. having a low or inadequate temperature or feeling a sensation of coldness or having been made cold by e.g. ice or refrigeration
a. extended meanings; especially of psychological coldness; without human warmth or emotion"
once,"r. on one occasion
r. as soon as
r. at a previous time;"
advice,n. a proposal for an appropriate course of action
sleepy,s. ready to fall asleep
harmful,a. causing or capable of causing harm
for example,none
bird flu,none
sneeze,"n. a symptom consisting of the involuntary expulsion of air from the nose
v. exhale spasmodically, as when an irritant entered one's nose"
soap,"n. a cleansing agent made from the salts of vegetable or animal fats
n. money offered as a bribe
n. street names for gamma hydroxybutyrate
v. rub soap all over, usually with the purpose of cleaning"
time,"n. an instance or single occasion for some event
n. a period of time considered as a resource under your control and sufficient to accomplish something
n. an indefinite period (usually marked by specific attributes or activities)
n. a suitable moment"
air,"n. a mixture of gases (especially oxygen) required for breathing; the stuff that the wind consists of
n. the region above the ground
n. a distinctive but intangible quality surrounding a person or thing
n. once thought to be one of four elements composing the universe (Empedocles)"
earphone,n. electro-acoustic transducer for converting electric signals into sounds; it is held over or inserted into the ear
volume,"n. the amount of 3-dimensional space occupied by an object
n. a publication that is one of a set of several similar publications
n. a relative amount
n. the magnitude of sound (usually in a specified direction)"
harm,v. cause or do harm to
care,"n. the work of providing treatment for or attending to someone or something
n. a cause for feeling concern
n. attention and management implying responsibility for safety
n. activity involved in maintaining something in good working order"
wonder,"n. the feeling aroused by something strange and surprising
n. something that causes feelings of wonder
v. have a wish or desire to know something
v. place in doubt or express doubtful speculation"
bone,"n. rigid connective tissue that makes up the skeleton of vertebrates
n. the porous calcified substance from which bones are made
n. a shade of white the color of bleached bones
v. remove the bones from"
blood,"n. the fluid (red in vertebrates) that is pumped through the body by the heart and contains plasma, blood cells, and platelets
n. temperament or disposition
n. people viewed as members of a group
v. smear with blood, as in a hunting initiation rite, where the face of a person is smeared with the blood of the kill"
hold,"n. power by which something or someone is affected or dominated
n. a stronghold
n. a cell in a jail or prison
v. have or hold in one's hands or grip"
although,"conj. Grant all this; be it that; supposing that;
   notwithstanding; though."
outside,"n. the region that is outside of something
n. the outer side or surface of something
a. relating to or being on or near the outer side or limit
s. originating or belonging beyond some bounds:""the outside world"""
inside,"n. the region that is inside of something
n. the inner or enclosed surface of something
a. relating to or being on the side closer to the center or within a defined space
s. being or applying to the inside of a building"
nutrient,n. any substance (such as a chemical element or inorganic compound) that can be taken in by a green plant and used in organic synthesis
waste,"n. any materials unused and rejected as worthless or unwanted
n. useless or profitless activity; using or expending or consuming thoughtlessly or carelessly
n. (law) reduction in the value of an estate caused by act or neglect
v. spend thoughtlessly; throw away"
calcium,n. a white metallic element that burns with a brilliant light; the fifth most abundant element in the earth's crust; an important component of most plants and animals
solid,"n. matter that is solid at room temperature and pressure
n. the state in which a substance has no tendency to flow under moderate stress; resists forces (such as compression) that tend to deform it; and retains a definite size and shape
n. a three-dimensional shape
s. characterized by good substantial quality"
vitamin,n. any of a group of organic substances essential in small quantities to normal metabolism
stair,n support consisting of a place to rest the foot while ascending or descending a stairway
lunchtime,n. the customary or habitual hour for eating lunch
ping-pong,n a game (trademark Ping-Pong) resembling tennis but played on a table with paddles and a light hollow ball
less,"a. (comparative of `little' usually used with mass nouns) a quantifier meaning not as great in amount or degree
s. (usually preceded by `no') lower in quality
s. (nonstandard in some uses but often idiomatic with measure phrases) fewer
r. used to form the comparative of some adjectives and adverbs"
letter,"n. a written message addressed to a person or organization
n. the conventional characters of the alphabet used to represent speech
n. owner who lets another person use something (housing usually) for hire
n. a strictly literal interpretation (as distinct from the intention)"
blank,"n. a piece of material ready to be made into something
n. a cartridge containing an explosive charge but no bullet
v. keep the opposing (baseball) team from winning
s. (of a surface) not written or printed on"
potato chip,none
protect,"v. shield from danger, injury, destruction, or damage
v. use tariffs to favor domestic industry"
environment,"n. the totality of surrounding conditions
n. the area in which something exists or lives"
recycle,"v. cause to repeat a cycle
v. use again after processing"
save,"n. (sports) the act of preventing the opposition from scoring
v. to keep up and reserve for personal or special use
v. bring into safety
v. spend less; buy at a reduced price"
electricity,"n. a physical phenomenon associated with stationary or moving electrons and protons
n. energy made available by the flow of electric charge through a conductor
n. keen and shared excitement"
off,"a. not in operation or operational
s. below a satisfactory level
a. (of events) no longer planned or scheduled
s. in an unpalatable state"
turn off,"n. something causing antagonism or loss of interest
n. a side road where you can turn off"
community,"n. a group of people living in a particular local area
n. common ownership
n. a group of nations having common interests
n. agreement as to goals"
similar,"a. marked by correspondence or resemblance
s. (of words) expressing closely related meanings"
ever,"r. at any time
r. (intensifier for adjectives) very"
volunteer,"n. (military) a person who freely enlists for service
n. a person who performs voluntary work
v. tell voluntarily
v. agree freely"
helper,"n a person who contributes to the fulfillment of a need or furtherance of an effort or purpose
n a person who helps people or institutions (especially with financial help)"
complete,"v. come or bring to a finish or an end; others finished in over 4 hours""
v. bring to a whole, with all the necessary parts or elements
v. complete a pass
v. write all the required information onto a form"
clean-up,n. (baseball) the fourth position in the batting order (usually filled by the best batter on the team)
seem,"v. appear to exist
v. appear to one's own mind or opinion"
can,"n. airtight sealed metal container for food or drink or paint etc.
n. the quantity contained in a can
n. a buoy with a round bottom and conical top
v. preserve in a can or tin"
piece,"n. a separate part of a whole
n. an item that is an instance of some type; 
n. an instance of some kind
n. an artistic or literary composition"
finished,"a. (of materials or goods) brought to the desired final state
a. ended or brought to an end
s. (of skills or the products of skills) brought to or having the greatest excellence; perfected
s. having a surface coating or finish applied"
litter,"n. the offspring at one birth of a multiparous mammal
n. rubbish carelessly dropped or left about (especially in public places)
n. conveyance consisting of a chair or bed carried on two poles by bearers
v. strew"
put up,s. planned secretly
notice,"n. an announcement containing information about an event
n. the act of noticing or paying attention
n. advance notification (usually written) of the intention to withdraw from an arrangement of contract
n. polite or favorable attention"
request,"n. a formal message requesting something that is submitted to an authority
n. the verbal act of requesting
v. express the need or desire for; ask for
v. ask (a person) to do something"
reply,n. the speech act of continuing a conversational exchange
fight,"n. the act of fighting; any contest or struggle
n. an intense verbal dispute
n. a boxing or wrestling match
v. fight against or resist strongly"
laugh at,none
polite,"a. showing regard for others in manners, speech, behavior, etc."
avoid,"v. stay clear from; keep away from; keep out of the way of someone or something
v. refrain from doing something"
actually,"r. in actual fact
r. used to imply that one would expect the fact to be the opposite of that stated; surprisingly
r. at the present moment
r. as a sentence modifier to add slight emphasis"
step,"n. the act of changing location by raising the foot and setting it down
n. support consisting of a place to rest the foot while ascending or descending a stairway
n. a short distance
n. a solid block joined to the beams in which the heel of a ship's mast or capstan is fixed"
without,"prep. On or at the outside of; out of; not within; as,
   without doors.
prep. Out of the limits of; out of reach of; beyond.
prep. Not with; otherwise than with; in absence of,
   separation from, or destitution of; not with use or employment of;
   independently of; exclusively of; with omission; as, without labor;
   without damage.
conj. Unless; except; -- introducing a clause.
adv. On or art the outside; not on the inside; not within;
   outwardly; externally.
adv. Outside of the house; out of doors."
lead,"n. an advantage held by a competitor in a race
n. a soft heavy toxic malleable metallic element; bluish white when freshly cut but tarnishes readily to dull grey
n. evidence pointing to a possible solution
n. a position of leadership (especially in the phrase `take the lead')"
dare,"n. a challenge to do something dangerous or foolhardy
v. to be courageous enough to try or do something"
textbook,n. a book prepared for use in schools or colleges
copy,"n. a thing made to be similar or identical to another thing
n. matter to be printed; exclusive of graphical materials
n. material suitable for a journalistic account
v. copy down as is"
appear,"v. come into sight or view
v. be issued or published
v. seem to be true, probable, or apparent
v. come into being or existence, or appear on the scene"
surprise,"n. the astonishment you feel when something totally unexpected happens to you
n. a sudden unexpected event
n. the act of surprising someone
v. cause to be surprised"
from then on,none
present,"n. the period of time that is happening now; any continuous stretch of time including the moment of speech
n. something presented as a gift
n. a verb tense that expresses actions or states at the time of speaking
v. bring forward and present to the mind"
public,"n. a body of people sharing some common interest
a. not private; open to or concerning the people as a whole
s. affecting the people or community as a whole"
in public,none
garden,"n. a plot of ground where plants are cultivated
n. the flowers or vegetables or fruits or herbs that are cultivated in a garden
n. a yard or lawn adjoining a house
v. work in the garden"
lie,"n. a statement that deviates from or perverts the truth
n. Norwegian diplomat who was the first Secretary General of the United Nations (1896-1968)
n. position or manner in which something is situated
v. be located or situated somewhere; occupy a certain position"
hero,"n. a man distinguished by exceptional courage and nobility and strength
n. the principal character in a play or movie or novel or poem
n. Greek mathematician and inventor who devised a way to determine the area of a triangle and who described various mechanical devices (first century)
n. (classical mythology) a being of great strength and courage celebrated for bold exploits; often the offspring of a mortal and a god"
tsunami,n. a cataclysm resulting from a destructive sea wave caused by an earthquake or volcanic eruption
Christmas,"n. period extending from Dec. 24 to Jan. 6
n. a Christian holiday celebrating the birth of Christ; a quarter day in England, Wales, and Ireland"
bubble,"n. a hollow globule of gas (e.g., air or carbon dioxide)
n. an impracticable and illusory idea
n. a dome-shaped covering made of transparent glass or plastic
v. form, produce, or emit bubbles"
at once,none
shout,"v. utter in a loud voice; talk in a loud voice (usually denoting characteristic manner of speaking)
v. utter a sudden loud cry"
warn,"v. notify of danger, potential harm, or risk
v. admonish or counsel in terms of someone's behavior
v. ask to go away
v. notify, usually in advance"
hotel,n. a building where travelers can pay for lodging and meals and other services
because of,none
guest,"n. a visitor to whom hospitality is extended
n. United States journalist (born in England) noted for his syndicated homey verse (1881-1959)
n. a customer of a hotel or restaurant etc."
kill,"n. the destruction of an enemy plane or ship or tank or missile
v. cause to die; put to death, usually intentionally or knowingly
v. thwart the passage of
v. be fatal"
thousand,"n. the cardinal number that is the product of 10 and 100
s. denoting a quantity consisting of 1,000 items or units"
empty,"n. a container that has been emptied
v. make void or empty of contents
v. become empty or void of its content
v. remove"
shake hands,none
show ... around,none
