senior,"n. an undergraduate student during the year preceding graduation
a. older; higher in rank; longer in length of tenure or service
s. used of the fourth and final year in United States high school or college"
secondary,"n. the defensive football players who line up behind the linemen
a. being of second rank or importance or value; not direct or immediate
s. depending on or incidental to what is original or primary
s. not of major importance"
stressful,s extremely irritating to the nerves
challenging,"s. stimulating interest or thought
s. disturbingly provocative"
differ,v. be different
previous,"s. just preceding something else in time or order
s. too soon or too hasty"
dynamic,"a. characterized by action or forcefulness or force of personality
a. of or relating to dynamics"
campus,n. a field on which the buildings of a university are situated
schedule,"n. an ordered list of times at which things are planned to occur
v. plan for an activity or event
v. make a schedule; plan the time and place for events"
expectation,"n. belief about (or mental picture of) the future
n. the feeling that something is about to happen"
confidence,"n. a feeling of trust (in someone or something)
n. a state of confident hopefulness that events will be favorable
n. a trustful relationship
n. a secret that is confided or entrusted to another"
competence,n. the quality of being adequately or well qualified physically and intellectually
chapter,"n. a subdivision of a written work; usually numbered and titled
n. any distinct period in history or in a person's life
n. a local branch of some fraternity or association
n. an ecclesiastical assembly of the monks in a monastery or even of the canons of a church"
all in all,none
apartment,n. a suite of rooms usually on one floor of an apartment house
am,"n a radioactive transuranic metallic element; discovered by bombarding uranium with helium atoms
n a master's degree in arts and sciences
n modulation of the amplitude of the (radio) carrier wave
v have the quality of being; (copula, used with an adjective or a predicate noun)
v be identical to; be someone or something
v occupy a certain position or area; be somewhere
v have an existence, be extant
v happen, occur, take place; this was during the visit to my parents' house""
v be identical or equivalent to
v form or compose
v work in a specific place, with a specific subject, or in a specific function
v represent, as of a character on stage
v spend or use time
v have life, be alive
v to remain unmolested, undisturbed, or uninterrupted -- used only in infinitive form
v be priced at"
shift,"n. an event in which something is displaced without rotation
n. the time period during which you are at work
n. the act of moving from one place to another
n. a crew of workers who work for a specific period of time"
pressure,"n. the force applied to a unit area of surface; measured in pascals (SI unit) or in dynes (cgs unit)
n. a force that compels
n. the somatic sensation that results from applying force to an area of skin
n. an oppressive condition of physical or mental or social or economic distress"
leisure,"n. time available for ease and relaxation
n. freedom to choose a pastime or enjoyable activity"
recover,"v. get or find back; recover the use of
v. regain a former condition after a financial loss
v. regain or make up for
v. cover anew"
injury,"n. any physical damage to the body caused by violence or accident or fracture etc.
n. an accident that results in physical damage or hurt
n. an act that causes someone or something to receive physical damage
n. wrongdoing that violates another's rights and is unjustly inflicted"
plus,"a. on the positive side or higher end of a scale
s. involving advantage or good"
unfortunately,r. by bad luck
challenge,"n. a demanding or stimulating situation
n. a call to engage in a contest or fight
n. questioning a statement and demanding an explanation
n. a formal objection to the selection of a particular person as a juror"
arise,"v. originate or come into being
v. rise to one's feet
v. result or issue"
lifestyle,n a manner of living that reflects the person's values and attitudes
chat,n. an informal conversation
surf,"n. waves breaking on the shore
v. switch channels, on television"
surf the Internet,none
voluntary,"n. composition (often improvised) for a solo instrument (especially solo organ) and not a regular part of a religious service or musical performance
a. of your own free will or design; done by choice; not forced or compelled
a. controlled by individual volition"
engine,"n. motor that converts thermal energy to mechanical work
n. something used to achieve a purpose
n. an instrument or machine that is used in warfare, such as a battering ram, catapult, artillery piece, etc."
search engine,none
definitely,r without question and beyond doubt
teen,"n a juvenile between the onset of puberty and maturity
s being of the age 13 through 19"
laptop,n. a portable computer small enough to use in your lap
digital,"a. displaying numbers rather than scale positions
a. relating to or performed with the fingers
a. of a circuit or device that represents magnitudes in digits"
native,"n. an indigenous person who was born in a particular place
n. a person born in a particular place or country
n. indigenous plants and animals
a. characteristic of or existing by virtue of geographic origin"
range,"n. the limits within which something can be effective
n. a large tract of grassy open land on which livestock can graze
n. a series of hills or mountains
n. a place for shooting (firing or driving) projectiles of various kinds"
various,"s of many different kinds purposefully arranged but lacking any uniformity
s considered individually
s distinctly dissimilar or unlike
s having great diversity or variety"
hardware,"n. major items of military weaponry (as tanks or missile)
n. instrumentalities (tools or implements) made of metal
n. (computer science) the mechanical, magnetic, electronic, and electrical components making up a computer system"
necessity,"n. the condition of being essential or indispensable
n. anything indispensable"
convenient,a. suited to your comfort or purpose or needs
quality,"n. an essential and distinguishing attribute of something or someone
n. a degree or grade of excellence or worth
n. a characteristic property that defines the apparent individual nature of something
n. high social status"
from time to time,none
living room,n a room in a private house or establishment where people can sit and talk and relax
addict,"n. someone who is so ardently devoted to something that it resembles an addiction
n. someone who is physiologically dependent on a substance; abrupt deprivation of the substance produces withdrawal symptoms
v. to cause (someone or oneself) to become dependent (on something, especially a narcotic drug)"
according to,none
in person,s an appearance carried out personally in someone else's physical presence
media,"n a means or instrumentality for storing or communicating information
n the surrounding environment
n an intervening substance through which signals can travel as a means for communication
n (bacteriology) a nutrient substance (solid or liquid) that is used to cultivate micro-organisms
n a liquid with which pigment is mixed by a painter
n (biology) a substance in which specimens are preserved or displayed
n an intervening substance through which something is achieved
n a state that is intermediate between extremes; a middle position
n someone who serves as an intermediary between the living and the dead
n (usually plural) transmissions that are disseminated widely to the public
n an occupation for which you are especially well suited"
social media,none
actually,"r. in actual fact
r. used to imply that one would expect the fact to be the opposite of that stated; surprisingly
r. at the present moment
r. as a sentence modifier to add slight emphasis"
drag,"n. the phenomenon of resistance to motion through a fluid
n. something that slows or delays progress
n. something tedious and boring
n. clothing that is conventionally worn by the opposite sex (especially women's clothing when worn by a man)"
tend to do sth,none
goal,"n. the state of affairs that a plan is intended to achieve and that (when achieved) terminates behavior intended to achieve it
n. game equipment consisting of the place toward which players of a game try to advance a ball or puck in order to score points
n. a successful attempt at scoring"
aim,"n. the goal intended to be attained (and which is believed to be attainable)
n. the action of directing something at an object
v. point or cause to go (blows, weapons, or objects such as photographic equipment) towards
v. propose or intend"
target,"n. a reference point to shoot at
n. the location of the target that is to be hit
n. sports equipment consisting of an object set up for a marksman or archer to aim at
v. intend (something) to move towards a certain goal"
update,"n. news that updates your information
v. modernize or bring up to date
v. bring up to date; supply with recent information
v. bring to the latest state of technology"
meanwhile,"r. at the same time but in another place
r. during the intervening time"
distance,"n. the property created by the space between two objects or points
n. a distant region
n. size of the gap between two places
n. indifference by personal withdrawal"
volunteer,"n. (military) a person who freely enlists for service
n. a person who performs voluntary work
v. tell voluntarily
v. agree freely"
revise,v. make revisions in
saying,n. a word or phrase that particular people use in particular situations
ahead,"s. having the leading position or higher score in a contest
r. at or in the front
r. toward the future; forward in time
r. in a forward direction"
get ahead,none
café,none
downtown,"a. of or located in the lower part of a town, or in the business center
r. toward or in the lower or central part of town"
stress,"n. the relative prominence of a syllable or musical note (especially with regard to stress or pitch)
n. special emphasis attached to something
n. difficulty that causes worry or emotional tension
n. (physics) force that produces strain on a physical body"
suffer,"v. undergo or be subjected to
v. undergo (as of injuries and illnesses)
v. experience (emotional) pain
v. get worse"
suffer from,none
reduce,"v. cut down on; make a reduction in
v. make less complex
v. bring to humbler or weaker state or condition
v. simplify the form of a mathematical equation of expression by substituting one term for another"
expert,n. a person with special knowledge or ability who performs skillfully
frank,"n. a member of the ancient Germanic peoples who spread from the Rhine into the Roman Empire in the 4th century
n. a smooth-textured sausage of minced beef or pork usually smoked; often served on a bread roll
v. exempt by means of an official pass or letter, as from customs or other checks
s. clearly manifest; evident"
to be frank,none
editor,n. a person responsible for the editorial aspects of publication; the person who determines the final content of a text (especially of a newspaper or magazine)
remove,"n. degree of figurative distance or separation; 
v. remove something concrete, as by lifting, pushing, or taking off, or remove something abstract
v. remove from a position or an office
v. shift the position or location of, as for business, legal, educational, or military purposes"
entirely,r. without any others being included or involved
position,"n. the particular portion of space occupied by something
n. a way of regarding situations or topics etc.
n. the arrangement of the body and its limbs
n. a job in an organization"
military,"n. the military forces of a nation
a. of or relating to the study of the principles of warfare
a. characteristic of or associated with soldiers or the military
a. associated with or performed by members of the armed services as contrasted with civilians"
due to,none
absolutely,"r. completely and without qualification; used informally as intensifiers
r. totally and definitely; without question"
stressed,"s. suffering severe physical strain or distress
a. bearing a stress or accent"
extent,"n. the point or degree to which something extends
n. the distance or area or volume over which something extends"
thus,r. in the way indicated; (`thusly' is a nonstandard variant)
tension,"n. (psychology) a state of mental or emotional strain or suspense
n. the physical condition of being stretched or strained
n. a balance between and interplay of opposing elements or tendencies (especially in art or literature)
n. (physics) a stress that produces an elongation of an elastic physical body"
organise,"v bring order and organization to
v create (as an entity)
v form or join a union
v cause to be structured or ordered or operating according to some principle or idea
v arrange by systematic planning and united effort
v plan and direct (a complex undertaking)"
in other words,none
function,"n. (mathematics) a mathematical relation such that each element of a given set (the domain of the function) is associated with an element of another set (the range of the function)
n. what something is used for
n. the actions and activities assigned to or required or expected of a person or group
n. a relation such that one thing is dependent on another"
seek,"n. the movement of a read/write head to a specific data track on a disk
v. try to get or reach
v. go to or towards
v. inquire for"
professional,"n. a person engaged in one of the learned professions
n. an athlete who plays for pay
a. engaged in a profession or engaging in as a profession or means of livelihood
a. of or relating to or suitable as a profession"
feature,"n. a prominent attribute or aspect of something
n. the characteristic parts of a person's face: eyes and nose and mouth and chin
n. the principal (full-length) film in a program at a movie theater
n. a special or prominent article in a newspaper or magazine"
typical,"a. exhibiting the qualities or characteristics that identify a group or kind or category
s. conforming to a type"
province,n. the proper sphere or extent of your activities
graduate,"n. a measuring instrument for measuring fluid volume; a glass container (cup or cylinder or flask) whose sides are marked with or divided into amounts
v. receive an academic degree upon completion of one's studies
v. confer an academic degree upon
s. of or relating to studies beyond a bachelor's degree"
graduate from,none
certificate,"n. a document attesting to the truth of certain stated facts
v. present someone with a certificate
v. authorize by certificate"
inspire,"v. heighten or intensify
v. supply the inspiration for"
apply,"v. be pertinent or relevant or applicable
v. ask (for something)
v. refer (a word or name) to a person or thing
v. apply oneself to"
apply for,none
eager,a. having or showing keen interest or intense desire or impatient expectancy
sort,"n. an approximate definition or example
n. a person of a particular character or nature
n. an operation that segregates items into groups according to a specified criterion"
sort of,none
independently,"r. on your own; without outside help
r. apart from others"
power,"n. possession of controlling influence
n. (physics) the rate of doing work; measured in watts (= joules/second)
n. one possessing or exercising power or influence or authority
v. supply the force or power for the functioning of"
supply,"n. an amount of something available for use
n. offering goods and services for sale
v. give something useful or necessary to"
unstable,"a. lacking stability or fixity or firmness
s. highly or violently reactive
s. disposed to psychological variability"
dusty,s. covered with a layer of dust
muddy,"v. dirty with mud
v. cause to become muddy
v. make turbid"
tough,"a. not given to gentleness or sentimentality
a. physically toughened
a. resistant to cutting or chewing"
flash,"n. a sudden intense burst of radiant energy
n. a momentary brightness
n. a short vivid experience
n. a sudden brilliant understanding"
give up,none
deal with,none
responsible,"a. worthy of or requiring responsibility or trust; or held accountable
s. being the agent or cause"
be responsible for,none
attractive,"a. pleasing to the eye or mind especially through beauty or charm
s. having power to arouse interest
a. having the properties of a magnet; the ability to draw or pull;"
as well as ...,none
laughter,n. the activity of laughing; the manifestation of joy or mirth or scorn
confident,"a. having or marked by confidence or assurance
s. not liable to error in judgment or action"
besides,"r. making an additional point; anyway; besides, we can't afford it""
r. in addition"
contact,"n. close interaction
n. the act of touching physically
n. the state or condition of touching or of being in immediate proximity
n. the physical coming together of two or more things"
charity,"n. a foundation created to promote the public good (not for assistance to any particular individuals)
n. a kindly and lenient attitude toward people
n. an activity or gift that benefits the public at large
n. an institution set up to provide help to the needy"
organisation,"n the persons (or committees or departments etc.) who make up a body for the purpose of administering something
n a group of people who work together
n an organized structure for arranging or classifying
n an ordered manner; orderliness by virtue of being methodical and well organized
n the act of organizing a business or an activity related to a business
n the activity or result of distributing or disposing persons or things properly or methodically
n the act of forming or establishing something"
contribution,"n. the part played by a person in bringing about a result
n. a voluntary gift (as of money or service or ideas) made to some worthwhile cause
n. act of giving in common with others for a common purpose especially to a charity
n. an amount of money contributed"
intend,"v. have in mind as a purpose
v. design or destine"
junior,"n. term of address for a disrespectful and annoying male
n. a third-year undergraduate
n. the younger of two persons
n. a son who has the same first name as his father"
formal,"a. being in accord with established forms and conventions and requirements (as e.g. of formal dress)
s. characteristic of or befitting a person in authority
a. (of spoken and written language) adhering to traditional standards of correctness and without casual, contracted, and colloquial forms
s. logically deductive"
informal,"a. not formal
s. not officially recognized or controlled
a. used of spoken and written language"
adapt,"v. make fit for, or change to suit a new purpose"
adapt to sth.,none
gym,n athletic facility equipped for sports or physical training
moment,"n. a particular point in time
n. an indefinitely short time
n. a turning force produced by an object acting at a distance (or a measure of that force)
n. the n-th moment of a distribution is the expected value of the n-th power of the deviations from a fixed value"
at the moment,none
presentation,"n. the activity of formally presenting something (as a prize or reward)
n. a show or display; the act of presenting something to sight or view
n. the act of making something publicly available; presenting news or other information by broadcasting or printing it
n. the act of presenting a proposal"
slide,"n. a small flat rectangular piece of glass on which specimens can be mounted for microscopic study
n. (geology) the descent of a large mass of earth or rocks or snow etc.
n. plaything consisting of a sloping chute down which children can slide
n. the act of moving smoothly along a surface while remaining in contact with it"
forward,"n. the person who plays the position of forward in certain games, such as basketball, soccer, or hockey
n. a position on a basketball, soccer, or hockey team
v. send or ship onward from an intermediate post or station in transit
a. at or near or directed toward the front"
look forward to sth.,none
look forward to doing sth.,none
digestion,"n. the process of decomposing organic matter (as in sewage) by bacteria or by chemical action or heat
n. the organic process by which food is converted into substances that can be absorbed into the body
n. learning and coming to understand ideas and information"
recreation,"n an activity that diverts or amuses or stimulates
n activity that refreshes and recreates; activity that renews your health and spirits by enjoyment and relaxation"
entertainment,n. an activity that is diverting and that holds the attention
rural,"a. living in or characteristic of farming or country life
a. of or relating to the countryside as opposed to the city"
athlete,n. a person trained to compete in sports
frequency,"n. the number of occurrences within a given time period
n. the ratio of the number of observations in a statistical category to the total number of observations
n. the number of observations in a given statistical category"
prefer,"v. like better; value more highly
v. promote over another
v. give preference to one creditor over another"
rather than,none
badminton,n. a game played on a court with light long-handled rackets used to volley a shuttlecock over a net
golf,"n. a game played on a large open course with 9 or 18 holes; the object is use as few strokes as possible in playing all the holes
v. play golf"
gymnastics,n. a sport that involves exercises intended to display strength and balance and agility
jog,"n. a sharp change in direction
n. a slow pace of running
v. run for exercise
v. give a slight push to"
cycle,"n. an interval during which a recurring sequence of events occurs
n. a series of poems or songs on the same theme
n. a periodically repeated sequence of events
n. a single complete execution of a periodically repeated phenomenon"
bowling,"n. a game in which balls are rolled at an object or group of objects with the aim of knocking them over or moving them
n. (cricket) the act of delivering a cricket ball to the batsman
n. the playing of a game of tenpins or duckpins etc"
skateboard,"n. a board with wheels that is ridden in a standing or crouching position and propelled by foot
v. ride on a flat board with rollers attached to the bottom"
track,"n. a pair of parallel rails providing a runway for wheels
n. an endless metal belt on which tracked vehicles move over the ground
n. (computer science) one of the circular magnetic paths on a magnetic disk that serve as a guide for writing and reading data
n. a groove on a phonograph recording"
in good,none
balanced,a. being in a state of proper equilibrium
diet,"n. a prescribed selection of foods
n. a legislative assembly in certain countries (e.g., Japan)
n. the usual food and drink consumed by an organism (person or animal)
n. the act of restricting your food intake (or your intake of particular foods)"
stair,n support consisting of a place to rest the foot while ascending or descending a stairway
regularly,"r. in a regular manner
r. having a regular form
r. in a regular way without variation"
net,"n. a trap made of netting to catch fish or birds or insects
n. a goal lined with netting (as in soccer or hockey)
n. game equipment consisting of a strip of netting dividing the playing area in tennis or badminton
n. an open fabric of string or rope or wire woven together at regular intervals"
court,"n. an assembly (including one or more judges) to conduct judicial business
n. a room in which a lawcourt sits
n. the sovereign and his advisers who are the governing power of a state
n. a specially marked horizontal area within which a game is played"
within,r on the inside
underdog,n. one at a disadvantage and expected to lose
defeat,n. an unsuccessful ending to a struggle or contest
company,"n. an institution created to conduct business
n. small military unit; usually two or three platoons
n. the state of being with someone
n. organization of performers and associated personnel (especially theatrical)"
guy,"n. an informal term for a youth or man
n. an effigy of Guy Fawkes that is burned on a bonfire on Guy Fawkes Day
n. a cable, wire, or rope that is used to brace something (especially a tent)
v. steady or support with a guy wire or cable"
champion,"n. someone who has won first place in a competition
n. someone who fights for a cause
v. protect or fight for as a champion
s. holding first place in a contest"
shot,"n. a solid missile discharged from a firearm
n. a chance to do something
n. a person who shoots (usually with respect to their ability to shoot)
n. an aggressive remark directed at a person like a missile and intended to have a telling effect"
inspiration,"n. arousal of the mind to special unusual activity or creativity
n. a product of your creative thinking and work
n. a sudden intuition as part of solving a problem"
try out for sth.,none
bench,"n. a long seat for more than one person
n. the magistrate or judge or judges sitting in court in judicial capacity to compose the court collectively
n. the reserve players on a team
n. (law) the seat for judges in a courtroom"
replacement,n. the act of furnishing an equivalent person or thing in the place of another
desire,"n. the feeling that accompanies an unsatisfied state
n. an inclination to want things
n. something that is desired
v. feel or have a desire for; want strongly"
crash,"n. a serious accident (usually involving one or more vehicles)
n. a sudden large decline of business or the prices of stocks (especially one that causes additional failures)
n. the act of colliding with something
n. (computer science) an event that causes a computer system to become inoperative"
crash into,none
