glide,"n. the activity of flying a glider
v. move smoothly and effortlessly
v. fly in or as if in a glider plane
v. cause to move or pass silently, smoothly, or imperceptibly"
graceful swaying,none
grove,"n. a small growth of trees without underbrush
n. garden consisting of a small cultivated wood without undergrowth"
hatch,"n. the production of young from an egg
n. shading consisting of multiple crossing lines
n. a movable barrier covering a hatchway
v. emerge from the eggs"
herbivore,n. any animal that feeds chiefly on grass and other plants
hide,"n. the dressed skin of an animal (especially a large animal)
n. body covering of a living animal
v. prevent from being seen or discovered
v. be or go into hiding; keep out of sight, as for protection and safety"
hive,"n. a teeming multitude
v. store, like bees
v. move together in a hive or as if in a hive
v. gather into a hive"
hover,"v. be undecided about something; waver between conflicting positions or courses of action
v. move to and fro
v. hang in the air; fly or be suspended above"
hum,"n. a humming noise
v. sing with closed lips
v. be noisy with activity
v. sound with a monotonous hum"
hybrid,"n. a composite of mixed origin
n. (genetics) an organism that is the offspring of genetically dissimilar parents or stock; especially offspring produced by breeding plants or animals of different varieties or breeds or species
s. produced by crossbreeding"
infest,"v. invade in great numbers
v. live on or in a host, as of parasites"
intake,n. an opening through which fluid is admitted to a tube or container
larva,n. the immature free-living form of most invertebrates and amphibians and fish which at hatching from the egg is fundamentally unlike its parent and must metamorphose
leap,"n. a light, self-propelled movement upwards or forwards
n. an abrupt transition
n. the distance leaped (or to be leaped)
v. pass abruptly from one state or topic to another"
marsupial,"n. mammals of which the females have a pouch (the marsupium) containing the teats where the young are fed and carried
a. of or relating to the marsupials"
massive,"s. imposing in size or bulk or solidity
s. being the same substance throughout
s. imposing in scale or scope or degree or power
s. consisting of great mass; containing a great quantity of matter"
mate,"n. the officer below the master on a commercial ship
n. the partner of an animal (especially a sexual partner)
n. one of a pair
n. South American holly; leaves used in making a drink like tea"
mite,n. any of numerous very small to minute arachnids often infesting animals or plants or stored foods
mushroom,"n. common name for an edible agaric (contrasting with the inedible toadstool)
n. mushrooms and related fleshy fungi (including toadstools, puffballs, morels, coral fungi, etc.)
n. any of various fleshy fungi of the subdivision Basidiomycota consisting of a cap at the end of a stem arising from an underground mycelium
n. a large cloud of rubble and dust shaped like a mushroom and rising into the sky after an explosion (especially of a nuclear bomb)"
naked,"s. having no protecting or concealing cover
s. (of the eye or ear e.g.) without the aid of an optical or acoustical device or instrument
s. devoid of elaboration or diminution or concealment; bare and pure
s. lacking any cover"
organic,"n. a fertilizer that is derived from animal or vegetable matter
a. relating or belonging to the class of chemical compounds having a carbon basis
a. being or relating to or derived from or having properties characteristic of living organisms
a. involving or affecting physiology or bodily organs"
pine,"n. a coniferous tree
n. straight-grained durable and often resinous white to yellowish timber of any of numerous trees of the genus Pinus"
possess,"v. have as an attribute, knowledge, or skill
v. enter into and control, as of emotions or ideas"
prey,"n. a person who is the aim of an attack (especially a victim of ridicule or exploitation) by some hostile person or influence
n. animal hunted or caught for food
v. profit from in an exploitatory manner"
realm,"n a domain in which something is dominant
n the domain ruled by a king or queen
n a knowledge domain that you are interested in or are communicating about"
rear,"n. the back of a military formation or procession
n. the side of an object that is opposite its front
n. the side that goes last or is not normally seen
v. stand up on the hind legs, of quadrupeds"
regurgitate,"v. pour or rush back
v. feed through the beak by regurgitating previously swallowed food
v. repeat after memorization"
rot,"n a state of decay usually accompanied by an offensive odor
n (biology) the process of decay caused by bacterial or fungal action
n unacceptable behavior (especially ludicrously false statements)
v break down
v become physically weaker"
rove,"v move about aimlessly or without any destination, often in search of food or employment
v pass a rope through
v pass through a hole or opening
v fasten by passing through a hole or around something"
scrub,"n. dense vegetation consisting of stunted trees or bushes
n. the act of cleaning a surface by rubbing it with a brush and soap and water
v. clean with hard rubbing
v. wash thoroughly"
scrunch,n. a crunching noise
shell,"n. ammunition consisting of a cylindrical metal casing containing an explosive charge and a projectile; fired from a large gun
n. the material that forms the hard outer covering of many animals
n. the hard usually fibrous outer layer of some fruits especially nuts
n. the exterior covering of a bird's egg"
shelter,"n. a structure that provides privacy and protection from danger
n. protective covering that provides protection from the weather
n. temporary housing for homeless or displaced persons
v. provide shelter for"
shrub,n. a low woody perennial plant usually having several major stems
sleek,s. well-groomed and neatly tailored; especially too well-groomed
stark,"s. complete or extreme
r. completely"
stem,"n. the tube of a tobacco pipe
v. grow out of, have roots in, originate in
v. cause to point inward
v. stop the flow of a liquid"
stride,"n. significant progress (especially in the phrase ""make strides"")
v. walk with long steps
v. cover or traverse by taking long steps"
swift,"n. United States meat-packer who began the use of refrigerated railroad cars (1839-1903)
n. an English satirist born in Ireland (1667-1745)
n. a small bird that resembles a swallow and is noted for its rapid flight"
tap,"n. a small metal plate that attaches to the toe or heel of a shoe (as in tap dancing)
n. a tool for cutting female (internal) screw threads
n. a plug for a bunghole in a cask
n. a light touch or stroke"
teem,"v. be teeming, be abuzz"
trunk,"n. the main stem of a tree; usually covered with bark; the bole is usually the part that is commercially useful for lumber
n. luggage consisting of a large strong case used when traveling or for storage"
twist,"n. a jerky pulling movement
n. social dancing in which couples vigorously twist their hips and arms in time to the music; was popular in the 1960s
n. turning or twisting around (in place)
v. turn in the opposite direction"
uptake,n. a process of taking up or using up or consuming
vegetation,"n. all the plant life in a particular region or period
n. the process of growth in plants
n. an abnormal growth or excrescence (especially a warty excrescence on the valves of the heart)
n. inactivity that is passive and monotonous, comparable to the inactivity of plant life"
viscous,"s having a relatively high resistance to flow
s having the sticky properties of an adhesive"
vulnerable,"a. susceptible to attack
s. susceptible to criticism or persuasion or temptation
s. capable of being wounded or hurt"
worm,"n. any of numerous relatively small elongated soft-bodied animals especially of the phyla Annelida and Chaetognatha and Nematoda and Nemertea and Platyhelminthes; also many insect larvae
n. a person who has a nasty or unethical character undeserving of respect
n. a software program capable of reproducing itself that can spread from one computer to the next over a network
n. screw thread on a gear with the teeth of a worm wheel or rack"
acid,"n. any of various water-soluble compounds having a sour taste and capable of turning litmus red and reacting with a base to form a salt
n. street name for lysergic acid diethylamide
s. having the characteristics of an acid"
awareness,"n. having knowledge of
n. state of elementary or undifferentiated consciousness"
bare,"v. lay bare
s. completely unclothed
s. lacking in amplitude or quantity
a. lacking its natural or customary covering"
bleak,s. unpleasantly cold and damp
breakwater,n. a protective structure of stone or concrete; extends from shore into the water to prevent a beach from washing away
breeze,"n. a slight wind (usually refreshing)
v. blow gently and lightly
v. to proceed quickly and easily"
brunt,n. main force of a blow etc
chill,"n. coldness due to a cold environment
n. a sensation of cold that often marks the start of an infection and the development of a fever
n. a sudden numbing dread
v. depress or discourage"
circulation,"n. the dissemination of copies of periodicals (as newspapers or magazines)
n. movement through a circuit; especially the movement of blood through the heart and blood vessels
n. (library science) the count of books that are loaned by a library over a specified period
n. number of copies of a newspaper or magazine that are sold"
clay,"n. a very fine-grained soil that is plastic when moist but hard when fired
n. United States general who commanded United States forces in Europe from 1945 to 1949 and who oversaw the Berlin airlift (1897-1978)
n. United States politician responsible for the Missouri Compromise between free and slave states (1777-1852)"
climate,"n. the weather in some location averaged over some long period of time
n. the prevailing psychological state"
comet,n. (astronomy) a relatively small extraterrestrial body consisting of a frozen mass that travels around the sun in a highly elliptical orbit
continent,"n. one of the large landmasses of the earth
n. the European mainland
a. having control over urination and defecation"
crater,"n. a faint constellation in the southern hemisphere near Hydra and Corvus
n. a bowl-shaped depression formed by the impact of a meteorite or bomb"
crust,"n. the outer layer of the Earth
n. a hard outer layer that covers something
n. the trait of being rude and impertinent; inclined to take liberties
v. form a crust or form into a crust"
damp,"n. a slight wetness
v. restrain or discourage
s. slightly wet"
disposal,"n. the power to use something or someone
n. the act or means of getting rid of something
n. a kitchen appliance for disposing of garbage"
downpour,n. a heavy rain
drought,"n. a shortage of rainfall
n. a prolonged shortage"
dump,"n. a piece of land where waste materials are dumped
n. (computer science) a copy of the contents of a computer storage device; sometimes used in debugging programs
n. a place where supplies can be stored
v. throw away as refuse"
dusk,v. become dusk
ecliptic,n. the great circle representing the apparent annual path of the sun; the plane of the Earth's orbit around the sun; makes an angle of about 23 degrees with the equator
environment,"n. the totality of surrounding conditions
n. the area in which something exists or lives"
estuary,n. the wide part of a river where it nears the sea; fresh and salt water mix
extreme,"n. the furthest or highest degree of something
s. of the greatest possible degree or extent or intensity
s. far beyond a norm in quantity or amount or degree; to an utmost degree
s. beyond a norm in views or actions"
flicker,"n. a momentary flash of light
n. North American woodpecker
v. move back and forth very rapidly
v. shine unsteadily"
foul,"n. an act that violates the rules of a sport
v. hit a foul ball
v. commit a foul; break the rules
v. spot, stain, or pollute"
fumes,"n gases ejected from an engine as waste products
n a cloud of fine particles suspended in a gas
v be mad, angry, or furious
v emit a cloud of fine particles
v treat with fumes, expose to fumes, especially with the aim of disinfecting or eradicating pests
v be wet with sweat or blood, as of one's face"
flip,"n. hot or cold alcoholic mixed drink containing a beaten egg
n. a sudden, quick movement
n. the act of flipping a coin
n. a dive in which the diver somersaults before entering the water"
gleam,"n. an appearance of reflected light
n. a flash of light (especially reflected light)
v. shine brightly, like a star or a light
v. appear briefly"
glitter,"n. the quality of shining with a bright reflected light
n. the occurrence of a small flash or spark
v. be shiny, as if wet"
highland,"n. elevated (e.g., mountainous) land"
hinterland,n a remote and undeveloped area
horizon,"n. the line at which the sky and Earth appear to meet
n. the range of interest or activity that can be anticipated
n. a specific layer or stratum of soil or subsoil in a vertical cross section of land
n. the great circle on the celestial sphere whose plane passes through the sensible horizon and the center of the Earth"
hurricane,n. a severe tropical cyclone usually with heavy rains and winds moving a 73-136 knots (12 on the Beaufort scale)
inlet,n. an arm off of a larger body of water (often between rocky headlands)
lack,n. the state of needing something that is absent or unavailable
landfill,n. a low area that has been filled in
landward,r. toward land
latitude,"n. the angular distance between an imaginary line around a heavenly body parallel to its equator and the equator itself
n. freedom from normal restraints in conduct
n. an imaginary line around the Earth parallel to the equator
n. scope for freedom of e.g. action or thought; freedom from restriction"
lava,n. rock that in its molten form (as magma) issues from volcanos; lava is what magma is called when it reaches the surface
limestone,n. a sedimentary rock consisting mainly of calcium that was deposited by the remains of marine animals
litter,"n. the offspring at one birth of a multiparous mammal
n. rubbish carelessly dropped or left about (especially in public places)
n. conveyance consisting of a chair or bed carried on two poles by bearers
v. strew"
mantle,"n. the cloak as a symbol of authority
n. United States baseball player (1931-1997)
n. the layer of the earth between the crust and the core
n. (zoology) a protective layer of epidermis in mollusks or brachiopods that secretes a substance forming the shell"
marble,"n. a hard crystalline metamorphic rock that takes a high polish; used for sculpture and as building material
n. a small ball of glass that is used in various games
n. a sculpture carved from marble
v. paint or stain like marble"
marsh,"n. low-lying wet land with grassy vegetation; usually is a transition zone between land and water
n. United States painter (1898-1954)
n. New Zealand writer of detective stories (1899-1982)"
melt,"v. reduce or cause to be reduced from a solid to a liquid state, usually by heating
v. lose its distinct outline or shape; blend gradually
v. become less intense and fade away gradually"
moist,s slightly wet
mount,"n. a mounting consisting of a piece of metal (as in a ring or other jewelry) that holds a gem in place
v. attach to a support
v. fix onto a backing, setting, or support
v. put up or launch"
on the brink,none
on the brink of,none
overwhelm,"v. overcome, as with emotions or perceptual stimuli
v. charge someone with too many tasks"
ozone,n. a colorless gas (O3) soluble in alkalis and cold water; a strong oxidizing agent; can be produced by electric discharge in oxygen or by the action of ultraviolet radiation on oxygen in the stratosphere (where it acts as a screen for ultraviolet radiation)
plateau,n a relatively flat highland
pollution,n. undesirable state of the natural environment being contaminated with harmful substances as a consequence of human activities
pumice,"n. a light glass formed on the surface of some lavas; used as an abrasive
v. rub with pumice, in order to clean or to smoothen"
roll in,none
sheer,"v. cause to sheer
r. straight up or down without a break
r. directly"
silt,n. mud or clay or small rocks deposited by a river or lake
slop over,none
slurry,n. a suspension of insoluble particles (as plaster of Paris or lime or clay etc.) usually in water
source,"n. a document (or organization) from which information is obtained
n. anything that provides inspiration for later work
n. a facility where something is available
n. (technology) a process by which energy or a substance enters a system"
splash,"n. the sound like water splashing
n. a patch of bright color
n. the act of scattering water about haphazardly
v. mark or overlay with patches of contrasting color or texture; cause to appear splashed or spattered"
spray,"n. a pesticide in suspension or solution; intended for spraying
n. a quantity of small objects flying through the air
n. flower arrangement consisting of a single branch or shoot bearing flowers and foliage
n. water in small drops in the atmosphere; blown from waves or thrown up by a waterfall"
spring,"n. the season of growth
n. a metal elastic device that returns to its shape or position when pushed or pulled or pressed
n. a natural flow of ground water
n. a point at which water issues forth"
steep,"n. a steep place (as on a hill)
v. devote (oneself) fully to
v. let sit in a liquid to extract a flavor or to cleanse
a. having a sharp inclination"
stream,"n. a natural body of running water flowing on or under the earth
n. dominant course (suggestive of running water) of successive events or ideas
n. something that resembles a flowing stream in moving continuously
v. to extend, wave or float outward, as if in the wind"
surroundings,"n the environmental condition
n the area in which something exists or lives
v extend on all sides of simultaneously; encircle
v envelop completely
v surround so as to force to give up
v surround with a wall in order to fortify"
swamp,"n. low land that is seasonally flooded; has more woody plants than a marsh and better drainage than a bog
n. a situation fraught with difficulties and imponderables
v. drench or submerge or be drenched or submerged"
thunder,"n. a booming or crashing noise caused by air expanding along the path of a bolt of lightning
v. move fast, noisily, and heavily
v. utter words loudly and forcefully
v. be the case that thunder is being heard"
topsoil,n. the layer of soil on the surface
wipe out,n. a spill in some sport (as a fall from a bicycle or while skiing or being capsized on a surfboard)
wondrous area,none
zone,"n. a locally circumscribed place characterized by some distinctive features
n. any of the regions of the surface of the Earth loosely divided according to latitude or longitude
n. an area or region distinguished from adjacent parts by a distinctive feature or characteristic
n. (anatomy) any encircling or beltlike structure"
advance,"n. an amount paid before it is earned
n. increase in price or value
v. move forward, also in the metaphorical sense
v. bring forward for consideration or acceptance"
airtight,"s. having no weak points
s. not allowing air or gas to pass in or out"
battery,"n. group of guns or missile launchers operated together at one place
n. a device that produces electricity; may have several primary or secondary cells arranged in parallel or series
n. a collection of related things intended for use together
n. a unit composed of the pitcher and catcher"
be intended for ...,none
breakthrough,"n. making an important discovery
n. a penetration of a barrier such as an enemy's defense"
browse,"n. vegetation (such as young shoots, twigs, and leaves) that is suitable for animals to eat
n. reading superficially or at random
n. the act of feeding by continual nibbling
v. look around casually and randomly, without seeking anything in particular"
charcoal,"n. a carbonaceous material obtained by heating wood or other organic matter in the absence of air
n. a stick of black carbon material used for drawing
n. a very dark grey color
n. a drawing made with a stick of black carbon material"
chip,"n. a triangular wooden float attached to the end of a log line
n. a piece of dried bovine dung
n. a thin crisp slice of potato fried in deep fat
n. a small disk-shaped counter used to represent money when gambling"
code,"n. a set of rules or principles or laws (especially written ones)
n. a coding system used for transmitting messages requiring brevity or secrecy
n. (computer science) the symbolic arrangement of data or instructions in a computer program or the set of such instructions
v. attach a code to"
contrive,"v make or work out a plan for; devise
v come up with (an idea, plan, explanation, theory, or principle) after a mental effort
v put or send forth"
conventional,"a. following accepted customs and proprieties
s. conforming with accepted standards
a. (weapons) using energy for propulsion or destruction that is not nuclear energy
a. unimaginative and conformist"
data,n. a collection of facts from which conclusions may be drawn
database,n. an organized body of related information
dearth,"n. an acute insufficiency
n. an insufficient quantity or number"
download,v. transfer a file or program from a central computer to a smaller computer or to a computer at a remote location
ethereal,"a. of or containing or dissolved in ether
s. characterized by unusual lightness and delicacy"
fingerprint,"n. a print made by an impression of the ridges in the skin of a finger; often used for biometric identification in criminal investigations
n. a generic term for any identifying characteristic
v. take an impression of a person's fingerprints"
flash,"n. a sudden intense burst of radiant energy
n. a momentary brightness
n. a short vivid experience
n. a sudden brilliant understanding"
fuel,"n. a substance that can be consumed to produce energy
v. provide with a combustible substance that provides energy
v. provide with fuel
v. take in fuel, as of a ship"
high-tech,a. resembling or making use of highly advanced technology or devices
household,n a social unit living together
instrument,"n. a device that requires skill for proper use
n. the means whereby some act is accomplished
n. a person used by another to gain an end
v. equip with instruments for measuring, recording, or controlling"
laser,n. an acronym for light amplification by stimulated emission of radiation; an optical device that produces an intense monochromatic beam of coherent light
leak,"n. an accidental hole that allows something (fluid or light etc.) to enter or escape
n. soft watery rot in fruits and vegetables caused by fungi
n. a euphemism for urination
n. unauthorized (especially deliberate) disclosure of confidential information"
modem,n. (from a combination of MOdulate and DEModulate) electronic equipment consisting of a device used to connect computers by a telephone line
module,"n. detachable compartment of a spacecraft
n. computer circuit consisting of an assembly of electronic components (as of computer hardware)
n. a self-contained component (unit or item) that is used in combination with other components"
nuclear,"a. (weapons) deriving destructive energy from the release of atomic energy
a. of or relating to or constituting the nucleus of an atom
a. of or relating to or constituting the nucleus of a cell
s. constituting or like a nucleus"
on command,none
permanently online,none
petrol,n a volatile flammable mixture of hydrocarbons (hexane and heptane and octane etc.) derived from petroleum; used mainly as a fuel in internal-combustion engines
petroleum,n. a dark oil consisting mainly of hydrocarbons
photocopy,"n. a photographic copy of written or printed or graphic work
v. reproduce by xerography"
pinprick,"n. a minor annoyance
n. small puncture (as if made by a pin)"
print out,n. the output of a computer in printed form
professional,"n. a person engaged in one of the learned professions
n. an athlete who plays for pay
a. engaged in a profession or engaging in as a profession or means of livelihood
a. of or relating to or suitable as a profession"
pump,"n. a mechanical device that moves fluid or gas by pressure or suction
n. a low-cut shoe without fastenings
v. operate like a pump; move up and down, like a handle or a pedal
v. deliver forth"
recognition,"n. the state or quality of being recognized or acknowledged
n. the process of recognizing something or someone by remembering
n. approval
n. (biology) the ability of one molecule to attach to another molecule that has a complementary shape"
scan,"n. the act of scanning; systematic examination of a prescribed region
n. an image produced by scanning
v. examine minutely or intensely
v. examine hastily"
scarce,a. deficient in quantity or number compared with the demand
seam,"n. joint consisting of a line formed by joining two pieces
n. a stratum of ore or coal thick enough to be mined with profit
v. put together with a seam"
seep,v. pass gradually or leak through or as if through small openings
spacecraft,"n. a craft capable of traveling in outer space; technically, a satellite around the sun"
stereo,"n. reproducer in which two microphones feed two or more loudspeakers to give a three-dimensional effect to the sound
n. two photographs taken from slightly different angles that appear three-dimensional when viewed together"
surf,"n. waves breaking on the shore
v. switch channels, on television"
theory,"n. a well-substantiated explanation of some aspect of the natural world; an organized system of accepted knowledge that applies in a variety of circumstances to explain a specific set of phenomena
n. a belief that can guide behavior"
ultraclean,none
unsolicited,s not asked for
