counteract,v. oppose and mitigate the effects of by contrary actions
enact,v. act out; represent or perform as if in a play
exact,a. marked by strict and particular and complete accordance with fact
inactive,"s. (chemistry) not participating in a chemical reaction; chemically inert
a. (pathology) not progressing or increasing; or progressing slowly
a. not exerting influence or change
a. lacking activity; lying idle or unused"
acute,"a. having or experiencing a rapid onset and short but severe course
s. extremely sharp or intense
s. having or demonstrating ability to recognize or draw fine distinctions
a. of an angle; less than 90 degrees"
acupuncture,n. treatment of pain or disease by inserting the tips of needles at specific points on the skin
acumen,n. a tapering point
aerobics,n. exercise that increases the need for oxygen
aeroplane,n an aircraft that has a fixed wing and is powered by propellers or jets
aerospace,n. the atmosphere and outer space considered as a whole
aerobic,"a. depending on free oxygen or air
a. based on or using the principles of aerobics; enhancing respiratory and circulatory efficiency"
agency,"n. an administrative unit of government
n. a business that serves other businesses
n. the state of being in action or exerting power"
agenda,"n. a temporally organized plan for matters to be attended to
n. a list of matters to be taken up (as at a meeting)"
agitate,"v. try to stir up public opinion
v. cause to be agitated, excited, or roused
v. change the arrangement or position of"
agile,"s. moving quickly and lightly
s. mentally quick"
coagent,n. An associate in an act; a coworker.
alternate,"v. go back and forth; swing back and forth between two states or conditions
v. exchange people temporarily to fulfill certain jobs and functions
v. do something in turns
s. every second one of a series"
alternative,"s. necessitating a choice between mutually exclusive possibilities
s. pertaining to unconventional choices"
alter,"v. make an alteration to
v. remove the ovaries of"
alienate,v. make withdrawn or isolated or emotionally dissociated
ancient,"n. a very old person
n. a person who lived in ancient times
s. belonging to times long past especially of the historical period before the fall of the Western Roman Empire
s. very old"
antique,"n. any piece of furniture or decorative object or the like produced in a former period and valuable because of its beauty or rarity
v. shop for antiques
v. give an antique appearance to
s. made in or typical of earlier times and valued for its age"
antiquity,"n. the historic period preceding the Middle Ages in Europe
n. an artifact surviving from the past"
antiquated,"v make obsolete or old-fashioned
v give an antique appearance to
s so extremely old as seeming to belong to an earlier period"
angle,"n. the space between two lines or planes that intersect; the inclination of one line to another; measured in degrees or radians
n. a member of a Germanic people who conquered England and merged with the Saxons and Jutes to become Anglo-Saxons
v. move or proceed at an angle
v. fish with a hook"
rectangle,n. a parallelogram with four right angles
annual,"n. (botany) a plant that completes its entire life cycle within the space of a year
n. a reference book that is published regularly once every year
a. completing its life cycle within a year
s. occurring or payable every year"
millennium,"n. a span of 1000 years
n. (New Testament) in Revelations it is foretold that those faithful to Jesus will reign with Jesus over the earth for a thousand years; the meaning of these words have been much debated; some denominations (e.g. Jehovah's Witnesses) expect it to be a thousand years of justice and peace and happiness
n. the 1000th anniversary (or the celebration of it)"
anniversary,n. the date on which an event occurred in some previous year (or the celebration of it)
perennial,"n. (botany) a plant lasting for three seasons or more
a. lasting three seasons or more
s. lasting an indefinitely long time; suggesting self-renewal
s. recurring again and again"
apt,"s. (usually followed by `to') naturally disposed toward
s. at risk of or subject to experiencing something usually unpleasant
s. mentally quick and resourceful"
adapt,"v. make fit for, or change to suit a new purpose"
aptitude,n. inherent ability
adept,s. having or showing knowledge and skill and aptitude
aquarium,n. a tank or pool or bowl filled with water for keeping live fish and underwater animals
aquatic,"n. a plant that lives in or on water
a. relating to or consisting of or being in water
a. operating or living or growing in water"
aqueous,"a. similar to or containing or dissolved in water
a. produced by the action of water"
arcade,"n. a covered passageway with shops and stalls on either side
n. a structure composed of a series of arches supported by columns"
archive,"n. a depository containing historical records and documents
v. put into an archive"
monarch,n. large migratory American butterfly having deep orange wings with black and white markings; the larvae feed on milkweed
patriarch,"n. title for the heads of the Eastern Orthodox Churches (in Istanbul and Alexandria and Moscow and Jerusalem)
n. the male head of family or tribe
n. any of the early biblical characters regarded as fathers of the human race
n. a man who is older and higher in rank than yourself"
architect,n. someone who creates plans to be used in making something (such as buildings)
architecture,"n. an architectural product or work
n. the discipline dealing with the principles of design and construction and ornamentation of fine buildings
n. the profession of designing buildings and environments with consideration for their esthetic effect"
architectural,a. of or pertaining to the art and science of architecture
audit,"n. a methodical examination or review of a condition or situation
v. examine carefully for accuracy with the intent of verification
v. attend academic courses without getting credit"
auditory,a. of or relating to the process of hearing
auditorium,n. the area of a theater or concert hall where the audience sits
audiology,n. the measurement of hearing
audio,"n. the audible part of a transmitted signal
n. an audible acoustic wave frequency
n. the sound elements of television"
bullet,n. a projectile that is fired from a gun
symbol,"n. an arbitrary sign (written or printed) that has acquired a conventional significance
n. something visible that by association or convention represents something else that is invisible"
biodiversity,n. the diversity of plant and animal life in a particular habitat (or in the world as a whole)
biometrics,n. a branch of biology that studies biological phenomena and observations by means of statistical analysis
microbiology,n. the branch of biology that studies microorganisms and their effects on humans
brief,"n. a document stating the facts and points of law of a client's case
n. a condensed written summary or abstract
v. give essential information to someone
s. of short duration or distance"
abbreviate,v. shorten
briefcase,n. a case with a handle; for carrying papers or files or books
briefly,r. for a short time
coincide,"v. go with, fall together
v. be the same"
casual,"s. marked by blithe unconcern
s. without or seeming to be without plan or method; offhand
s. appropriate for ordinary or routine occasions
s. occurring or appearing or singled out by chance"
decay,"n. the process of gradually becoming inferior
n. a gradual decrease; as of stored charge or current
n. the organic phenomenon of rotting
n. an inferior state resulting from the process of decaying"
incident,"n. a single distinct event
n. a public disturbance
a. falling or striking of light rays on something"
occasion,"n. reason
n. the time of a particular event
n. an opportunity to do something
v. give occasion to"
casualty,"n. someone injured or killed or captured or missing in a military engagement
n. someone injured or killed in an accident
n. a decrease of military personnel or equipment"
cascade,"n. a small waterfall or series of small waterfalls
n. a succession of stages or operations or processes or units
v. rush down in big quantities, like a cascade
v. arrange (open windows) on a computer desktop so that they overlap each other, with the title bars visible"
campaign,"n. a series of actions advancing a principle or tending toward a particular end
n. several related operations aimed at achieving a particular goal (usually within geographical and temporal constraints)
n. an overland journey by hunters (especially in Africa)
v. run, stand, or compete for an office or a position"
campfire,n. a small outdoor fire for warmth or cooking (as at a camp)
campus,n. a field on which the buildings of a university are situated
anticipate,"v. act in advance of; deal with ahead of time
v. realize beforehand
v. be excited or anxious about
v. be a forerunner of or occur earlier than"
perceive,"v. to become aware of through the senses
v. become conscious of"
susceptible,"a. (often followed by `of' or `to') yielding readily to or capable of
s. easily impressed emotionally"
conceptual,s. being or characterized by concepts or their formation
occupation,"n. the principal activity in your life that you do to earn money
n. the control of a country by military forces of a foreign power
n. any activity that occupies a person's attention
n. the act of occupying or taking possession of a building"
perceptual,a. of or relating to the act of perceiving
recipe,n. directions for making something
conceive,v. become pregnant; undergo conception
capability,"n. the quality of being capable -- physically or intellectually or legally
n. the susceptibility of something to a particular treatment
n. an aptitude that may be developed"
capacity,"n. capability to perform or produce
n. the amount that can be contained
n. the maximum production possible
n. a specified function"
captive,"n. an animal that is confined
n. a person held in the grip of a strong emotion or passion
s. being in captivity
s. giving or marked by complete attention to"
captious,s. tending to find and call attention to faults
captivate,v attract; cause to be enamored
captivity,n. the state of being imprisoned
capture,"n. the act of forcibly dispossessing an owner of property
n. a process whereby a star or planet holds an object in its gravitational field
n. any process in which an atomic or nuclear system acquires an additional particle
n. the act of taking of a person by force"
conception,n. the act of becoming pregnant; fertilization of an ovum by a spermatozoon
deceive,"v. be false to; be dishonest with
v. cause someone to believe an untruth"
encapsulate,"v. enclose in a capsule or other small container
v. put in a short or concise form; reduce in volume"
except,"v take exception to
v prevent from being included or considered or accepted"
handicapped,"n people collectively who are crippled or otherwise physically handicapped
v injure permanently
v attempt to forecast the winner (especially in a horse race) and assign odds for or against a contestant
v put at a disadvantage
s incapable of functioning as a consequence of injury or illness"
hiccup,"n. (usually plural) the state of having reflex spasms of the diaphragm accompanied by a rapid closure of the glottis producing an audible sound; sometimes a symptom of indigestion
v. breathe spasmodically, and make a sound"
misconception,n. an incorrect conception
occupy,"v. live (in a certain place)
v. occupy the whole of"
recapture,"n. a legal seizure by the government of profits beyond a fixed amount
n. the act of taking something back
v. experience anew
v. take up anew"
receptacle,"n. a container that is used to put or keep things in
n. enlarged tip of a stem that bears the floral parts
n. an electrical (or electronic) fitting that is connected to a source of power and equipped to receive an insert"
capsule,"n. a small container
n. a pill in the form of a small rounded gelatinous container with medicine inside
n. a dry dehiscent seed vessel or the spore-containing structure of e.g. mosses
n. a structure that encloses a body part"
capsize,v. overturn accidentally
decapitate,v. cut the head of
cautious,"a. showing careful forethought; never making swift decisions""
s. avoiding excess"
caution,"n. the trait of being cautious; being attentive to possible danger
n. a warning against certain acts
n. judiciousness in avoiding harm or danger
v. warn strongly; put on guard"
cautionary,s. warding off
precaution,"n. a precautionary measure warding off impending danger or damage or injury etc.
n. the trait of practicing caution in advance"
proceed,"v. move ahead; travel onward in time or space
v. follow a certain course"
access,"n. the right to obtain or make use of or take advantage of something (as services or membership)
n. a way of entering or leaving
n. a code (a series of characters or digits) that must be entered in some way (typed or dialed or spoken) to get the use of something (a telephone line or a computer or a local area network etc.)
n. (computer science) the operation of reading or writing stored information"
exceed,"v. be greater in scope or size than some standard
v. be superior or better than some standard"
procedure,"n. a particular course of action intended to achieve a result
n. a mode of conducting legal and parliamentary proceedings"
process,"n. (psychology) the performance of some composite cognitive activity; an operation that affects mental contents
n. a mental process that you are not directly aware of
n. a natural prolongation or projection from a part of an organism either animal or plant
n. a sustained phenomenon or one marked by gradual changes through a series of states"
procession,n. the group action of a collection of people or animals or vehicles moving ahead in more or less regular formation
recession,"n. the state of the economy declines; a widespread decline in the GDP and employment and trade lasting from six months to a year
n. the withdrawal of the clergy and choir from the chancel to the vestry at the end of a church service
n. the act of ceding back"
intercede,v. act between parties with a view to reconciling differences
precede,"v. come before
v. be the predecessor of
v. move ahead (of others) in time or space
v. furnish with a preface or introduction"
precedent,"n. an example that is used to justify similar occurrences at a later time
n. a subject mentioned earlier (preceding in time)
s. preceding in time, order, or significance"
unprecedented,a. having no precedent; novel
secede,v. withdraw from an organization or communion
succession,"n. a group of people or things arranged or following in order
n. the action of following in order
n. (ecology) the gradual and orderly process of change in an ecosystem brought about by the progressive replacement of one community by another until a stable climax is established
n. acquisition of property by descent or by will"
ancestry,n. inherited properties shared with others of your bloodline
ancestral,"s. inherited or inheritable by established rules (usually legal rules) of descent
a. of or belonging to or inherited from an ancestor"
concern,"n. something that interests you because it is important or affects you
n. an anxious feeling
n. a feeling of sympathy for someone or something
n. something or someone that causes anxiety; a source of unhappiness"
certificate,"n. a document attesting to the truth of certain stated facts
v. present someone with a certificate
v. authorize by certificate"
discretion,"n. freedom to act or judge on one's own
n. knowing how to avoid embarrassment or distress
n. the trait of judging wisely and objectively"
discriminate,"v. recognize or perceive the difference
v. treat differently on the basis of sex or race
v. distinguish
a. marked by the ability to see or make fine distinctions"
certification,n. the act of certifying or bestowing a franchise on
unconcerned,"a. lacking in interest or care or feeling
s. easy in mind; not worried
s. not occupied or engaged with"
concentrate,"n. a concentrated form of a foodstuff; the bulk is reduced by removing water
n. a concentrated example of something
v. make denser, stronger, or purer
v. direct one's attention on something"
concentric,a. having a common center
centric,s. having or situated at or near a center
centripetal,"a. tending to move toward a center
s. tending to unify
s. of a nerve fiber or impulse originating outside and passing toward the central nervous system"
precise,a. sharply exact or accurate or delimited
concise,a. expressing much in few words
decision,"n. the act of making up your mind about something
n. a position or opinion or judgment reached after consideration
n. (boxing) a victory won on points when no knockout has occurred
n. the outcome of a game or contest"
excise,"n. a tax that is measured by the amount of business done (not on property or income from real estate)
v. levy an excise tax on
v. remove by cutting"
insecticide,n. a chemical used to kill insects
pesticide,n. a chemical used to kill pests (as rodents or insects)
circle,"n. ellipse in which the two axes are of equal length; a plane curve generated by one point moving at a constant distance from a fixed point
n. something approximating the shape of a circle
n. a curved section or tier of seats in a hall or theater or opera house; usually the first tier above the orchestra
n. any circular or rotating mechanism"
recycle,"v. cause to repeat a cycle
v. use again after processing"
circuit,"n. an electrical device that provides a path for electrical current to flow
n. an established itinerary of venues or events that a particular group of people travel to
n. (law) a judicial division of a state or the United States (so-called because originally judges traveled and held court in different locations); one of the twelve groups of states in the United States that is covered by a particular circuit court of appeals
v. make a circuit"
circus,"n. a travelling company of entertainers; including trained animals
n. a performance given by a traveling company of acrobats, clowns, and trained animals
n. a frenetic disorganized (and often comic) disturbance suggestive of a large public entertainment
n. (antiquity) an open-air stadium for chariot races and gladiatorial games"
encyclopedia,n. a reference work (often in several volumes) containing articles on various topics (often arranged in alphabetical order) dealing with the entire range of human knowledge or with some particular specialty
circumstance,"n. a condition that accompanies or influences some event or activity
n. information that should be kept in mind when making a decision
n. formal ceremony about important occasions"
circumscribe,"v. draw a line around
v. to draw a geometric figure around another figure so that the two are in contact but do not intersect"
circumspect,s. heedful of potential consequences
acclaim,"n. enthusiastic approval
v. praise vociferously"
claim,"n. an assertion of a right (as to money or property)
n. an assertion that something is true or factual
n. demand for something as rightful or due
n. an informal right to something"
reclaim,"v. claim back
v. reuse (materials from waste products)
v. make useful again; transform from a useless or uncultivated state"
proclaim,"v. declare formally; declare someone to be something; of titles
v. state or announce"
declaim,"v. recite in elocution
v. speak against in an impassioned manner"
declaration,"n. a statement that is emphatic and explicit (spoken or written)
n. (law) unsworn statement that can be admitted in evidence in a legal transaction
n. a statement of taxable goods or of dutiable properties"
clarity,n. free from obscurity and easy to understand; the comprehensibility of clear expression
declare,"v. state emphatically and authoritatively
v. state firmly
v. declare to be
v. authorize payments of"
conclude,"v. bring to a close
v. reach a conclusion after a discussion or deliberation
v. come to a close
v. reach agreement on"
disclose,v. disclose to view as by removing a cover
enclose,"v. close in; darkness enclosed him""
v. surround completely"
exclude,"v. prevent from being included or considered or accepted
v. prevent from entering; shut out
v. lack or fail to include"
exclusive,"n. a news report that is reported first by one news organization
s. not divided or shared with others
a. excluding much or all; especially all but a particular group or minority"
include,"v. have as a part, be made up out of
v. consider as part of something
v. add as part of something else; put in as part of a set, group, or category"
inclusive,a. including much or everything; and especially including stated limits
preclude,"v. make impossible, especially beforehand"
closure,"n. a rule for limiting or ending debate in a deliberative body
n. a Gestalt principle of organization holding that there is an innate tendency to perceive incomplete objects as complete and to close or fill gaps and to perceive asymmetric stimuli as symmetric
n. termination of operations
v. terminate debate by calling for a vote"
seclude,v. keep away from others
corporate,"a. of or belonging to a corporation
s. done by or characteristic of individuals acting together
s. organized and maintained as a legal corporation"
corporal,n. a noncommissioned officer in the Army or Air Force or Marines
corps,"n. an army unit usually consisting of two or more divisions and their support
n. a body of people associated together"
corporation,n. a business firm whose articles of incorporation have been approved in some state
corporeal,a. having material or physical form or substance
corpus,"n. a collection of writings
n. the main part of an organ or other bodily structure"
democratic,"a. characterized by or advocating or based upon the principles of democracy or social equality
a. belong to or relating to the Democratic Party
s. representing or appealing to or adapted for the benefit of the people at large"
bureaucracy,"n. nonelective government officials
n. a government that is administered primarily by bureaus that are staffed with nonelective officials
n. any organization in which action is obstructed by insistence on unnecessary procedures and red tape"
democracy,"n. the political orientation of those who favor government by the people or by their elected representatives
n. a political system in which the supreme power lies in a body of citizens who can elect people to represent them"
theocracy,"n. a political unit governed by a deity (or by officials thought to be divinely guided)
n. the belief in government by divine guidance"
decrease,"n. a change downward
n. a process of becoming smaller or shorter
n. the amount by which something decreases
n. the act of decreasing or reducing something"
increase,"n. a change resulting in an increase
n. a process of becoming larger or longer or more numerous or more important
n. the amount by which something increases
n. the act of increasing something"
recreate,v. create anew
recreation,"n an activity that diverts or amuses or stimulates
n activity that refreshes and recreates; activity that renews your health and spirits by enjoyment and relaxation"
create,"v. bring into existence
v. pursue a creative activity; be engaged in a creative activity
v. invest with a new title, office, or rank
v. create by artistic means"
crescent,"n. any shape resembling the curved shape of the moon in its first or last quarters
s. resembling the new moon in shape"
secrete,"v. generate and separate from cells or bodily fluids
v. place out of sight; keep secret"
mediocre,"s. moderate to inferior in quality
s. poor to middling in quality"
credit,"n. money available for a client to borrow
n. an accounting entry acknowledging income or capital items
n. used in the phrase `to your credit' in order to indicate an achievement deserving praise; 
n. arrangement for deferred payment for goods and services"
discredit,"v. cause to be distrusted or disbelieved
v. damage the reputation of"
accredit,"v. grant credentials to
v. provide or send (envoys or embassadors) with official credentials
v. ascribe an achievement to"
credential,n a document attesting to the truth of certain stated facts
credibility,n. the quality of being believable or trustworthy
occur,"v. come to one's mind; suggest itself
v. to be found to exist"
course,"n. education imparted in a series of lessons or meetings
n. a connected series of events or actions or developments
n. general line of orientation
n. a mode of action"
current,"n. a flow of electricity through a conductor
n. a steady flow of a fluid (usually from natural causes)
a. occurring in or belonging to the present time"
currency,"n. the metal or paper medium of exchange that is presently used
n. general acceptance or use"
excursion,n. a journey taken for pleasure
incursion,"n. the act of entering some territory or domain (often in large numbers)
n. the mistake of incurring liability or blame"
recourse,"n. act of turning to for assistance
n. something or someone turned to for assistance or security"
curative,s. tending to cure or restore to health
curriculum,n an integrated course of academic studies
curious,"s. beyond or deviating from the usual or expected
a. eager to investigate and learn or learn more (sometimes about others' concerns)
s. having curiosity aroused; eagerly interested in learning more"
security,"n. the state of being free from danger or injury
n. defense against financial failure; financial independence
n. freedom from anxiety or fear
n. a formal declaration that documents a fact of relevance to finance and investment; the holder has a right to receive interest or dividends"
secure,"v. assure payment of
a. free from fear or doubt; easy in mind
a. free from danger or risk
a. not likely to fail or give way"
