extroverted,s. at ease in talking to others
introverted,"v fold inwards
v turn inside
a given to examining own sensory and perceptual experiences"
inversion,"n. the layer of air near the earth is cooler than an overlying layer
n. abnormal condition in which an organ is turned inward or inside out (as when the upper part of the uterus is pulled into the cervical canal after childbirth)
n. a chemical process in which the direction of optical rotation of a substance is reversed from dextrorotatory to levorotary or vice versa"
invert,"v. make an inversion (in a musical composition)
v. reverse the position, order, relation, or condition of"
universe,"n. everything that exists anywhere
n. everything stated or assumed in a given discussion"
versus,"prep. Against; as, John Doe versus Richard Roe; -- chiefly
   used in legal language, and abbreviated to v. or vs."
converse,"n. a proposition obtained by conversion
v. carry on a conversation
s. of words so related that one reverses the relation denoted by the other
s. turned about in order or relation"
perverse,s. marked by a disposition to oppose and contradict
pervert,"n. a person whose behavior deviates from what is acceptable especially in sexual behavior
v. change the inherent purpose or function of something"
convey,"v. make known; pass on, of information
v. transfer to another
v. transmit a title or property"
previous,"s. just preceding something else in time or order
s. too soon or too hasty"
voyage,"n. a journey to some distant place
v. travel on water propelled by wind or by other means"
impervious,a. not admitting of passage or capable of being affected
individual,"n. a single organism
a. being or characteristic of a single thing or person
s. separate and distinct from others of the same kind
s. characteristic of or meant for a single person or thing"
devise,"n. a will disposing of real property
n. (law) a gift of real property by will
v. give by will, especially real property"
divide,"n. a serious disagreement between two groups of people (typically producing tension or hostility)
v. separate into parts or portions
v. perform a division"
dividend,"n. that part of the earnings of a corporation that is distributed to its shareholders; usually paid quarterly
n. a number to be divided by another number
n. a bonus; something extra (especially a share of a surplus)"
division,"n. an army unit large enough to sustain combat
n. the act or process of dividing
n. an administrative unit in government or business
n. discord that splits a group"
evidence,"n. your basis for belief or disbelief; knowledge on which to base belief
n. an indication that makes something evident
n. (law) all the means by which any alleged matter of fact whose truth is investigated at judicial trial is established or disproved"
visible,"a. capable of being seen; or open to easy view
s. obvious to the eye
s. present and easily available"
visual,"a relating to or using sight
s visible; give me the ocular proof""- Shakespeare"
envisage,v form a mental image of something that is not present or that is not the case
provident,"a. providing carefully for the future
s. careful in regard to your own interests"
revise,v. make revisions in
supervise,"v watch and direct
v keep tabs on; keep an eye on; keep under surveillance"
viewpoint,"n a mental position from which things are viewed
n a place from which something can be viewed"
vision,"n. a vivid mental image
n. the perceptual experience of seeing
n. a religious or mystical experience of a supernatural appearance"
advisory,"n. an announcement that usually advises or warns the public of some threat
s. giving advice"
revive,"v. be brought back to life, consciousness, or strength
v. restore from a depressed, inactive, or unused state"
vital,"s. performing an essential function in the living body
s. manifesting or characteristic of life"
vigorous,"s. characterized by forceful and energetic action or activity
s. strong and active physically or mentally"
viable,s. capable of life or normal growth and development
reinvigorate,"v impart vigor, strength, or vitality to"
revival,"n. bringing again into activity and prominence
n. an evangelistic meeting intended to reawaken interest in religion"
survive,"v. continue to live through hardship or adversity
v. continue in existence after (an adversity, etc.)"
invigorate,"v. impart vigor, strength, or vitality to"
vivacious,s vigorous and animated
vivisect,v. cut (a body) open while still alive
evoke,"v call forth (emotions, feelings, and responses)
v evoke or provoke to appear or occur
v deduce (a principle) or construe (a meaning)
v summon into action or bring into existence, often as if by magic
v call to mind"
invoke,v. cite as an authority; resort to
advocate,"n. a person who pleads for a cause or propounds an idea
n. a lawyer who pleads cases in court"
equivocal,"a. open to two or more interpretations; or of uncertain nature or significance; or (often) intended to mislead
s. open to question
s. uncertain as a sign or indication"
evolve,"v. work out
v. undergo development or evolution"
involve,"v. connect closely and often incriminatingly
v. engage as a participant
v. contain as a part
v. occupy or engage the interest of"
revolution,"n. a drastic and far-reaching change in ways of thinking and behaving
n. the overthrow of a government by those who are governed"
revolve,v. turn on or around an axis or a center
evolution,n. (biology) the sequence of events involved in the evolutionary development of a species or taxonomic group of organisms
volume,"n. the amount of 3-dimensional space occupied by an object
n. a publication that is one of a set of several similar publications
n. a relative amount
n. the magnitude of sound (usually in a specified direction)"
announce,"v. make known; make an announcement
v. announce publicly or officially
v. give the names of
v. foreshadow or presage"
astound,v affect with wonder
ascend,"v. travel up, ""We ascended the mountain""
v. go back in order of genealogical succession
v. become king or queen
v. appear to be moving upward, as by means of tendrils"
arouse,"v. call forth (emotions, feelings, and responses)
v. to begin moving, ""As the thunder started the sleeping children began to stir""
v. stimulate sexually"
avoid,"v. stay clear from; keep away from; keep out of the way of someone or something
v. refrain from doing something"
aware,a. (sometimes followed by `of') having or showing knowledge or understanding or realization or perception
abide,"v dwell
v put up with something or somebody unpleasant"
abandon,"n. the trait of lacking restraint or control; reckless freedom from inhibition or worry
v. forsake, leave behind
v. give up with the intent of never claiming again
v. stop maintaining or insisting on; of ideas or claims"
abase,v cause to feel shame; hurt the pride of
amend,v. make amendments to
amuse,"v. occupy in an agreeable, entertaining or pleasant fashion
v. make (somebody) laugh"
amass,"v collect or gather
v get or gather together"
apace,r with rapid movements
astray,r. away from the right path or direction
avenge,v take revenge for a perceived wrong
alight,"v. to come to rest, settle
v. come down"
afield,"r. far away from home or one's usual surroundings
r. in or into a field (especially a field of battle)
r. off the subject; beyond the point at issue"
abate,v. become less in amount or intensity
atom,"n. (physics and chemistry) the smallest component of an element having the chemical properties of the element
n. (nontechnical usage) a tiny piece of anything"
absorb,"v. become imbued
v. take up mentally
v. take up, as of debts or payments
v. take in, also metaphorically"
abstract,"v. consider a concept without thinking of a specific example; consider abstractly or theoretically
v. consider apart from a particular case or instance
v. give an abstract (of)
a. existing only in the mind; separated from embodiment"
absolute,"n. something that is conceived or that exists independently and not in relation to other things; something that does not depend on anything else and is beyond human control; something that is not relative
a. perfect or complete or pure
s. complete and without restriction or qualification; sometimes used informally as intensifiers
s. not limited by law"
absent,"v. go away or leave
a. not being in a specified place
s. lost in thought; showing preoccupation"
absolutely,"r. completely and without qualification; used informally as intensifiers
r. totally and definitely; without question"
abdicate,"v. give up, such as power, as of monarchs and emperors, or duties and obligations"
abduct,v. pull away from the body
abjure,"v. formally reject or disavow a formerly held belief, usually under pressure"
abrade,v. wear away
abrupt,"s. marked by sudden changes in subject and sharp transitions
s. exceedingly sudden and unexpected
s. extremely steep
s. surprisingly and unceremoniously brusque in manner"
abrogate,v. revoke formally
abstruse,s. difficult to penetrate; incomprehensible to one of ordinary understanding or knowledge
account,"n. a formal contractual relationship established to provide for regular banking or brokerage or business services
n. importance or value
n. a statement of recent transactions and the resulting balance
n. the quality of taking advantage"
assert,"v. state categorically
v. insist on having one's opinions and rights recognized"
approach,"n. ideas or actions intended to deal with a problem or situation
n. the act of drawing spatially closer to something
n. the event of one object coming closer to another
n. the temporal property of becoming nearer in time"
accommodation,"n. a settlement of differences
n. in the theories of Jean Piaget: the modification of internal representations in order to accommodate a changing knowledge of reality
n. living quarters provided for public convenience
n. the act of providing something (lodging or seat or food) to meet a need"
attract,"v. direct toward itself or oneself by means of some psychological power or physical attributes
v. be attractive to
v. exert a force on (a body) causing it to approach or prevent it from moving away"
accustom,v make psychologically or physically used (to something)
accustomed,"a. (often followed by `to') in the habit of or adapted to
s. commonly used or practiced; usual"
acquaint,v. inform
acquaintance,"n. personal knowledge or information about someone or something
n. a relationship less intimate than friendship
n. a person with whom you are acquainted"
appliance,"n. a device or control that is very useful for a particular job
n. durable goods for home or office use"
appoint,"v. create and charge with a task or function
v. assign a duty, responsibility or obligation to
v. furnish"
assault,"n. close fighting during the culmination of a military attack
n. a threatened or attempted physical attack by someone who appears to be able to cause bodily harm if not stopped
n. thoroughbred that won the triple crown in 1946"
attach,"v. cause to be attached
v. be attached; be in contact with
v. become attached"
attempt,n. earnest and conscientious activity intended to do or accomplish something
afflict,"v. cause great unhappiness for; distress
v. cause physical pain or suffering in"
accelerate,"v. move faster
v. cause to move faster"
abound,"v. be abundant or plentiful; exist in large quantities
v. be in a state of movement or action"
absurd,"n. a situation in which life seems irrational and meaningless
s. inconsistent with reason or logic or common sense
s. incongruous; inviting ridicule"
accidentally,"r without advance planning
r of a minor or subordinate nature
r without intention; in an unintentional manner"
accompany,v. go or travel along with
acknowledge,"v. report the receipt of
v. express obligation, thanks, or gratitude for
v. accept as legally binding and valid
v. accept (someone) to be what is claimed or accept his power and authority"
affliction,"n. a state of great suffering and distress due to adversity
n. a condition of suffering or distress due to ill health
n. a cause of great suffering and distress"
aggravate,"v make worse
v exasperate or irritate"
assimilate,"v. become similar to one's environment
v. make similar
v. take (gas, light or heat) into a solution
v. become similar in sound"
allure,n. the power to entice or attract through personal charm
applaud,"v. clap one's hands or shout after performances to indicate approval
v. express approval of"
assure,"v. inform positively and with certainty and confidence
v. assure somebody of the truth of something with the intention of giving the listener confidence"
applause,n. a demonstration of approval by clapping the hands together
allot,"v give out
v allow to have
v administer or bestow, as in small portions"
approximate,"v. be close or similar
s. not quite exact or correct
s. very close in resemblance
s. located close together"
arrogance,n. overbearing pride evidenced by a superior manner toward inferiors
arrow,"n. a mark to indicate a direction or relation
n. a projectile with a straight thin shaft and an arrowhead on one end and stabilizing vanes on the other; intended to be shot from a bow"
ascertain,v. learn or discover with certainty
assiduous,s. marked by care and persistent effort
attest,"v. provide evidence for; stand as proof of; show by one's behavior, attitude, or external attributes
v. authenticate, affirm to be true, genuine, or correct, as in an official capacity
v. establish or verify the usage of"
abhorrent,s. offensive to the mind
aborigine,n. a dark-skinned member of a race of people living in Australia when Europeans arrived
accentuate,"v to stress, single out as important
v put stress on; utter with an accent"
acclimatise,v get used to a certain climate
accordion,n. a portable box-shaped free-reed instrument; the reeds are made to vibrate by air from the bellows controlled by the player
affiliation,"n. a social or business relationship
n. the act of becoming formally connected or joined"
acrobat,n. an athlete who performs acts requiring skill and agility and coordination
acrobatic,s. vigorously active
adjust,"v. alter or regulate so as to achieve accuracy or conform to a standard
v. adapt or conform oneself to new or different conditions
v. make correspondent or conformable
v. decide how much is to be paid on an insurance claim"
address,"n. (computer science) the code that identifies where a piece of information is stored
n. the place where a person or organization can be found or communicated with
n. the act of delivering a formal spoken communication to an audience
n. the manner of speaking to another individual"
adhere,"v. be compatible or in accordance with
v. follow through or carry out a plan without deviation
v. be a devoted follower or supporter
v. stick to firmly"
adjacent,"s. nearest in space or position; immediately adjoining without intervening space
s. having a common boundary or edge; abutting; touching; Massachusetts and Conncecticut""
s. near or close to but not necessarily touching"
addict,"n. someone who is so ardently devoted to something that it resembles an addiction
n. someone who is physiologically dependent on a substance; abrupt deprivation of the substance produces withdrawal symptoms
v. to cause (someone or oneself) to become dependent (on something, especially a narcotic drug)"
admire,"v. feel admiration for
v. look at with admiration"
admission,"n. the act of admitting someone to enter
n. an acknowledgment of the truth of something"
adorn,"v make more attractive by adding ornament, colour, etc.
v be beautiful to look at
v furnish with power or authority; of kings or emperors"
adumbrate,"v describe roughly or briefly or give the main points or summary of
v give to understand"
antibiotic,"n. a chemical substance derivable from a mold or bacterium that can kill microorganisms and cure bacterial infections
a. of or relating to antibiotic drugs"
antibiotics,n a chemical substance derivable from a mold or bacterium that can kill microorganisms and cure bacterial infections
antidote,n. a remedy that stops or controls the effects of a poison
antiseptic,"n. a substance that destroys micro-organisms that carry disease without harming body tissues
a. thoroughly clean and free of or destructive to disease-causing organisms
s. clean and honest
s. freeing from error or corruption"
antipathy,"n. a feeling of intense dislike
n. the object of a feeling of intense aversion; something to be avoided"
automate,v make automatic or control or operate automatically
automatic,"a. operating with minimal human intervention; independent of external control
s. resembling the unthinking functioning of a machine
s. without volition or conscious control"
automatically,r. in a reflex manner
automobile,v. travel in an automobile
autocrat,n a cruel and oppressive dictator
autocratic,s. offensively self-assured or given to exercising usually unwarranted power
autoimmune,a. of or relating to the immune response of the body against substance normally present in the body
bewilder,v. cause to be confused emotionally
behave,"v. behave in a certain manner
v. behave well or properly"
behaviour,"n the action or reaction of something (as a machine or substance) under specified circumstances
n (behavioral attributes) the way a person behaves toward other people
n (psychology) the aggregate of the responses or reactions or movements made by an organism in any situation
n manner of acting or controlling yourself"
belonging,n. happiness felt in a secure relationship
beloved,"n. a beloved person; used as terms of endearment
s. dearly loved"
besiege,"v. surround so as to force to give up
v. cause to feel distressed or worried
v. harass, as with questions or requests"
beware,v. be on one's guard; be cautious or wary about; be alert to
begrudge,v. wish ill or allow unwillingly
bereave,v. deprive through death
bestir,v. become active
beneficial,s. promoting or enhancing well-being
benefit,"n. financial assistance in time of need
n. something that aids or promotes well-being
n. a performance to raise money for a charitable cause
v. be beneficial for"
benevolent,"a. intending or showing kindness
s. generous in providing aid to others"
benediction,n. a ceremonial prayer invoking divine protection
bilateral,"s. having identical parts on each side of an axis
s. affecting or undertaken by two parties
s. having two sides or parts"
bilingual,"n. a person who speaks two languages fluently
s. using or knowing two languages"
biannual,s occurring or payable twice each year
bicycle,"n. a wheeled vehicle that has two wheels and is moved by foot pedals
v. ride a bicycle"
biennial,"n. (botany) a plant having a life cycle that normally takes two seasons from germination to death to complete; flowering biennials usually bloom and fruit in the second season
a. having a life cycle lasting two seasons
s. occurring every second year"
binocular,a. relating to both eyes
binoculars,n. an optical instrument designed for simultaneous use by both eyes
biped,n. an animal with two feet
bisect,v. cut in half or cut in two
collaborate,"v. work together on a common enterprise of project
v. cooperate as a traitor"
connect,"v. connect, fasten, or put together two or more pieces
v. be or become joined or united or linked
v. join by means of communication equipment
v. land on or hit solidly"
communal,"s. for or by a group rather than individuals
a. relating to a small administrative district or community"
community,"n. a group of people living in a particular local area
n. common ownership
n. a group of nations having common interests
n. agreement as to goals"
compromise,"n. a middle way between two extremes
n. an accommodation in which both sides make concessions
v. make a compromise; arrive at a compromise; we all must compromise""
v. settle by concession"
comparison,"n. the act of examining resemblances
n. relation based on similarities and differences
n. qualities that are comparable"
concrete,"n. a strong hard building material composed of sand and gravel and cement and water
v. cover with cement
v. form into a solid mass; coalesce
a. capable of being perceived by the senses; not abstract or imaginary"
condemn,"v. express strong disapproval of
v. declare or judge unfit for use or habitation
v. compel or force into a particular state or activity
v. demonstrate the guilt of (someone)"
conflict,"n. an open clash between two opposing groups (or individuals)
n. opposition between two simultaneous but incompatible feelings
n. a state of opposition between persons or ideas or interests
n. an incompatibility of dates or events"
confront,"v. oppose, as in hostility or a competition
v. deal with (something unpleasant) head on
v. present somebody with something, usually to accuse or criticize
v. be face to face with"
connection,"n. a relation between things or events (as in the case of one causing the other or sharing features with it)
n. the state of being connected
n. an instrumentality that connects
n. (usually plural) a person who is influential and to whom you are connected in some way (as by family or friendship)"
collateral,"n. a security pledged for the repayment of a loan
a. descended from a common ancestor but through different lines
s. serving to support or corroborate
s. accompany, concomitant"
combine,"n. harvester that heads and threshes and cleans grain while moving across the field
v. add together from different sources
v. join for a common purpose or in a common action"
communicate,"v. transmit information
v. transmit thoughts or feelings
v. join or connect
v. be in verbal contact; interchange information or ideas"
compatible,"a. able to exist and perform in harmonious or agreeable combination
a. capable of being used with or connected to other devices or components without modification
s. capable of forming a homogeneous mixture that neither separates nor is altered by chemical interaction"
consistent,"a. (sometimes followed by `with') in agreement or consistent or reliable
s. the same throughout in structure or composition"
contemporary,"n. a person of nearly the same age as another
s. characteristic of the present
s. belonging to the present time"
commerce,"n. transactions (sales and purchases) having the objective of supplying commodities (goods and services)
n. social exchange, especially of opinions, attitudes, etc."
commitment,"n. the act of binding yourself (intellectually or emotionally) to a course of action
n. an engagement by contract involving financial obligation
n. a message that makes a pledge
n. the official act of consigning a person to confinement (as in a prison or mental hospital)"
context,"n. discourse that surrounds a language unit and helps to determine its interpretation
n. the set of facts or circumstances that surround a situation or event"
contingent,"n. a gathering of persons representative of some larger group
n. a temporary military unit
s. possible but not certain to occur
s. determined by conditions or circumstances that follow"
council,"n. a body serving in an administrative capacity
n. (Christianity) an assembly of theologians and bishops and other representatives of different churches or dioceses that is convened to regulate matters of discipline or doctrine
n. a meeting of people for consultation"
coeval,"n a person of nearly the same age as another
s of the same period"
coexist,"v. coexist peacefully, as of nations
v. exist together"
coexistence,n. existing peacefully together
cohere,"v. cause to form a united, orderly, and aesthetically consistent whole
v. have internal elements or parts logically connected so that aesthetic consistency results"
coincidence,"n. an event that might have been arranged although it was really accidental
n. the quality of occupying the same position or area in space"
collaborative,s. accomplished by collaboration
collapse,"n. an abrupt failure of function or complete physical exhaustion
n. a natural event caused by something suddenly falling down or caving in
v. break down, literally or metaphorically
v. fold or close up"
collate,"v. compare critically; of texts
v. to assemble in proper sequence"
colleague,"n. an associate that one works with
n. a person who is member of one's class or profession"
committee,"n. a special group delegated to consider some matter
n. a self-constituted organization to promote something"
commute,"n. a regular journey of some distance to and from your place of work
v. exchange positions without a change in value
v. travel back and forth regularly, as between one's place of work and home
v. exchange a penalty for a less severe one"
comparatively,r in a relative manner; by comparison to something else
complicated,s. difficult to analyze or understand
compliment,"n. a remark (or act) expressing praise and admiration
v. say something to someone that expresses praise
v. express respect or esteem for"
concord,"n. capital of the state of New Hampshire; located in south central New Hampshire on the Merrimack river
n. town in eastern Massachusetts near Boston where the first battle of the American Revolution was fought
v. arrange by concord or agreement"
concur,v. happen simultaneously
confer,"v. have a conference in order to talk something over
v. present"
confluence,"n. a place where things merge or flow together (especially rivers)
n. a flowing together"
congratulate,v. express congratulations
consciousness,n. an alert cognitive state in which you are aware of yourself and your situation
consistency,"n. the property of holding together and retaining its shape
n. a harmonious uniformity or agreement among things or parts
n. logical coherence and accordance with the facts
n. (logic) an attribute of a logical system that is so constituted that none of the propositions deducible from the axioms contradict one another"
