penetrate,"v. pass into or through, often by overcoming resistance
v. come to understand
v. make one's way deeper into or through
v. insert the penis into the vagina or anus of"
perpetrate,"v. perform an act, usually with a negative connotation"
pollinate,v. fertilize by transfering pollen
radiate,"v. send out rays or waves
v. send out real or metaphoric rays
v. extend or spread outward from a center or focus or inward towards a center
v. cause to be seen by emitting light as if in rays"
rehabilitate,"v. help to readapt, as to a former state of health or good repute
v. reinstall politically
v. restore to a state of good condition or operation"
rotate,"v. exchange on a regular basis
v. perform a job or duty on a rotating basis
v. cause to turn on an axis or center"
separate,"n. a garment that can be purchased separately and worn in combinations with other garments
v. act as a barrier between; stand between
v. force, take, or pull apart
v. divide into components or constituents"
sophisticate,"n. a worldly-wise person
v. make less natural or innocent
v. alter and make impure, as with the intention to deceive"
somnambulate,v walk in one's sleep
stagnate,"v. stand still
v. cause to stagnate
v. cease to flow; stand without moving"
stipulate,"v. specify as a condition or requirement in a contract or agreement; make an express demand or provision in an agreement
v. give a guarantee or promise of
v. make an oral contract or agreement in the verbal form of question and answer that is necessary to give it legal force"
ventilate,"v. expose to the circulation of fresh air so as to retard spoilage
v. circulate through and freshen
v. furnish with an opening to allow air to circulate or gas to escape"
annotate,v. add explanatory notes to or supply with critical comments
authenticate,v. establish the authenticity of something
calibrate,"v. make fine adjustments or divide into marked intervals for optimal measuring
v. mark (the scale of a measuring instrument) so that it can be read in the desired units
v. measure the caliber of"
accurate,"a. conforming exactly or almost exactly to fact or to a standard or performing with total accuracy
s. (of ideas, images, representations, expressions) characterized by perfect conformity to fact or truth; strictly correct"
adequate,"a. having the requisite qualities or resources to meet a task
s. sufficient for the purpose
s. about average; acceptable"
appropriate,"v. take possession of by force, as after an invasion
a. suitable for a particular person or place or condition etc"
compassionate,a. showing or having compassion
intimate,"v. give to understand
s. marked by close acquaintance, association, or familiarity
s. involved in a sexual relationship
s. thoroughly acquainted through study or experience"
passionate,a. having or expressing strong emotions
ultimate,"n. the finest or most superior quality of its kind
a. furthest or highest in degree or order; utmost or extreme
s. being the last or concluding element of a series"
vertebrate,"n. animals having a bony or cartilaginous skeleton with a segmented spinal column and a large brain enclosed in a skull or cranium
a. having a backbone or spinal column"
considerate,a. showing concern for the rights and feelings of others
inanimate,"a. belonging to the class of nouns denoting nonliving things
a. not endowed with life"
articulate,"v. unite by forming a joint or joints
v. express or state clearly
a. expressing yourself easily or characterized by clear expressive language"
sedate,"v. cause to be calm or quiet as by administering a sedative to
s. characterized by dignity and propriety"
candidate,n. someone who is considered for something (for an office or prize or honor etc.)
doctorate,n one of the highest earned academic degrees conferred by a university
operation,"n. the state of being in effect or being operative
n. a business especially one run on a large scale
n. a planned activity involving many people performing various actions
n. (computer science) data processing in which the result is completely specified by a rule (especially the processing that results from a single instruction)"
definition,"n. a concise explanation of the meaning of a word or phrase or symbol
n. clarity of outline"
admiration,"n. a feeling of delighted approval and liking
n. a favorable judgment"
addition,"n. a component that is added to something to improve it
n. the act of adding one thing to another
n. a quantity that is added
n. a suburban area laid out in streets and lots for a future residential area"
anticipation,"n. an expectation
n. something expected (as on the basis of a norm)
n. anticipating with confidence of fulfillment"
assimilation,"n. the state of being assimilated; people of different backgrounds come to see themselves as part of a larger national family
n. the social process of absorbing one cultural group into harmony with another
n. the process of absorbing nutrients into the body after digestion"
administration,"n. a method of tending to or managing the affairs of a some group of people (especially the group's business affairs)
n. the persons (or committees or departments etc.) who make up a body for the purpose of administering something
n. the act of administering medication
n. the act of meting out justice according to the law"
aviation,"n. the aggregation of a country's military aircraft
n. the operation of aircraft to provide transportation
n. the art of operating aircraft"
civilization,"n. a society in an advanced state of social development (e.g., with complex legal and political and religious organizations)
n. the social process whereby societies achieve an advanced stage of development and organization"
cognition,n. the psychological result of perception and learning and reasoning
collaboration,"n. act of working jointly
n. act of cooperating traitorously with an enemy that is occupying your country"
combination,"n. a collection of things that have been combined; an assemblage of separate parts or qualities
n. a coordinated sequence of chess moves
n. a sequence of numbers or letters that opens a combination lock
n. a group of people (often temporary) having a common purpose"
configuration,n. an arrangement of parts or elements
consolidation,"n. combining into a solid mass
n. the act of combining into an integral whole
n. something that has consolidated into a compact mass"
destination,n. the ultimate goal for which something is done
foundation,"n. the basis on which something is grounded
n. an institution supported by an endowment
n. lowest support of a structure
n. education or instruction in the fundamentals of a field of knowledge"
fabrication,"n. a deliberately false or improbable account
n. writing in a fictional form
n. the act of making something (a product) from raw materials"
immigration,"n. migration into a place (especially migration to a country of which you are not a native in order to settle there)
n. the body of immigrants arriving during a specified interval"
insulation,"n. the state of being isolated or detached
n. the act of protecting something by surrounding it with material that reduces or prevents the transmission of sound or heat or electricity"
irrigation,"n. supplying dry land with water by means of ditches etc
n. (medicine) cleaning a wound or body organ by flushing or washing out with water or a medicated solution"
migration,"n. the movement of persons from one country or locality to another
n. a group of people migrating together (especially in some given time period)
n. (chemistry) the nonrandom movement of an atom or radical from one place to another within a molecule"
moderation,"n. quality of being moderate and avoiding extremes
n. the action of lessening in severity or intensity"
precipitation,"n. the quantity of water falling to earth at a specific place within a specified period of time
n. the process of forming a chemical precipitate
n. the falling to earth of any form of water (rain or snow or hail or sleet or mist)"
presentation,"n. the activity of formally presenting something (as a prize or reward)
n. a show or display; the act of presenting something to sight or view
n. the act of making something publicly available; presenting news or other information by broadcasting or printing it
n. the act of presenting a proposal"
reputation,"n. notoriety for some particular characteristic
n. the general estimation that the public has for a person"
revelation,"n. an enlightening or astonishing disclosure
n. communication of knowledge to man by a divine or supernatural agency
n. the last book of the New Testament; contains visionary descriptions of heaven and of conflicts between good and evil and of the end of the world; attributed to Saint John the Apostle"
satisfaction,"n. the contentment one feels when one has fulfilled a desire, need, or expectation
n. (law) the payment of a debt or fulfillment of an obligation
n. act of fulfilling a desire or need or appetite"
sensation,"n. an unelaborated elementary awareness of stimulation
n. a general feeling of excitement and heightened interest
n. a state of widespread public excitement and interest"
temptation,"n. something that seduces or has the quality to seduce
n. the desire to have or do something that you know you should avoid"
accreditation,n. the act of granting credit or recognition (especially with respect to educational institution that maintains suitable standards)
adoration,"n. the act of admiring strongly
n. the worship given to God alone"
adaptation,"n. a written work (as a novel) that has been recast in a new form
n. the process of adapting to something (such as environmental conditions)
n. (physiology) the responsive adjustment of a sense organ (as the eye) to varying conditions (as of light)"
aeration,"n. the process of exposing to air (so as to purify)
n. the act of charging a liquid with a gas making it effervescent"
affirmation,"n. the act of affirming or asserting or stating something
n. (religion) a solemn declaration that serves the same purpose as an oath (if an oath is objectionable to the person on religious or ethical grounds)
n. a judgment by a higher court that the judgment of a lower court was correct and should stand"
aggravation,"n. an exasperated feeling of annoyance
n. unfriendly behavior that causes anger or resentment
n. action that makes a problem or a disease (or its symptoms) worse"
alienation,"n. the feeling of being alienated from other people
n. separation resulting from hostility
n. (law) the voluntary and absolute transfer of title and possession of real property from one person to another"
audition,"n. a test of the suitability of a performer
v. perform in order to get a role"
consolation,"n. the comfort you feel when consoled in times of disappointment
n. the act of consoling; giving relief in affliction"
contamination,"n. the state of being contaminated
n. the act of contaminating or polluting; including (either intentionally or accidentally) unwanted substances or factors"
conversation,n. the use of speech for informal exchange of views or ideas or information etc.
cultivation,"n. socialization through training and education to develop one's mind or manners
n. (agriculture) production of food by preparing the land to grow crops (especially on a large scale)
n. the process of fostering the growth of something"
demolition,n. the act of demolishing
denomination,"n. a group of religious congregations having its own organization and a distinctive faith
n. a class of one kind of unit in a system of numbers or measures or weights or money"
dictation,"n. speech intended for reproduction in writing
n. matter that has been dictated and transcribed; a dictated passage"
dissemination,"n. the opening of a subject to widespread discussion and debate
n. the property of being diffused or dispersed"
documentation,"n. confirmation that some fact or statement is true through the use of documentary evidence
n. documentary validation"
domination,"n. social control by dominating
n. power to dominate or defeat"
donation,"n a voluntary gift (as of money or service or ideas) made to some worthwhile cause
n act of giving in common with others for a common purpose especially to a charity"
elaboration,n. developing in intricate and painstaking detail
elicitation,n stimulation that calls up (draws forth) a particular class of behaviors
exploitation,"n. the act of making some area of land or water more profitable or productive or useful
n. an act that exploits or victimizes someone (treats them unfairly)"
federation,"n. an organization formed by merging several groups or parties
n. the act of constituting a political unity out of a number of separate states or colonies or provinces so that each member retains the management of its internal affairs"
fluctuation,"n. a wave motion
n. the quality of being unsteady and subject to changes"
inclination,"n. an attitude of mind especially one that favors one alternative over others
n. (astronomy) the angle between the plane of the orbit and the plane of the ecliptic stated in degrees
n. (geometry) the angle formed by the x-axis and a given line (measured counterclockwise from the positive half of the x-axis)
n. that toward which you are inclined to feel a liking"
industrialization,n. the development of industry on an extensive scale
integration,"n. the action of incorporating a racial or religious group into a community
n. an operation used in the calculus whereby the integral of a function is determined"
isolation,"n. a state of separation between persons or groups
n. a feeling of being disliked and alone
n. the act of isolating something; setting something apart from others
n. (psychiatry) a defense mechanism in which memory of an unacceptable act or impulse is separated from the emotion originally associated with it"
limitation,"n. the quality of being limited or restricted
n. (law) a time period after which suits cannot be brought
n. an act of limiting or restricting (as by regulation)"
meditation,"n. continuous and profound contemplation or musing on a subject or series of subjects of a deep or abstruse nature
n. (religion) contemplation of spiritual matters (usually on religious or philosophical subjects)"
modification,"n. slightly modified copy; not an exact copy
n. the grammatical relation that exists when a word qualifies the meaning of the phrase"
motivation,"n. the psychological feature that arouses an organism to action toward a desired goal; the reason for the action; that which gives purpose and direction to behavior
n. the condition of being motivated
n. the act of motivating; providing incentive"
participation,n. the condition of sharing in common with others (as fellows or partners etc.)
petition,v. write a petition for something to somebody; request formally and in writing
precognition,n. knowledge of an event before it occurs
preparation,"n. the activity of putting or setting in order in advance of some act or purpose
n. (music) a note that produces a dissonant chord is first heard in a consonant chord"
radiation,"n. energy that is radiated or transmitted in the form of rays or waves or particles
n. the act of spreading outward from a central source
n. the spontaneous emission of a stream of particles or electromagnetic rays in nuclear decay
n. the spread of a group of organisms into new habitats"
rendition,"n. a performance of a musical composition or a dramatic role etc.
n. handing over prisoners to countries where torture is allowed
n. the act of interpreting something as expressed in an artistic performance"
requisition,"n. the act of requiring; an authoritative request or demand, especially by a military or public authority that takes something over (usually temporarily) for military or public use
n. an official form on which a request in made
v. make a formal request for official services"
sterilization,"n. the act of making an organism barren or infertile (unable to reproduce)
n. the procedure of making some object free of live bacteria or other microorganisms (usually by heat or chemical means)"
urbanization,"n. the condition of being urbanized
n. the social process whereby cities grow and societies become more urban"
variation,"n. an instance of change; the rate or magnitude of change
n. an activity that varies from a norm or standard
n. a repetition of a musical theme in which it is modified or embellished
n. an artifact that deviates from a norm or standard"
verification,n. (law) an affidavit attached to a statement confirming the truth of that statement
vibration,"n. the act of vibrating
n. a distinctive emotional aura experienced instinctively"
violation,n. an act that disregards an agreement or a right
negative,"n. a reply of denial
n. a piece of photographic film showing an image with light and shade or colors reversed
a. characterized by or displaying negation or denial or opposition or resistance; having no positive features
a. expressing or consisting of a negation or refusal or denial"
generative,"a. having the ability to produce or originate
s. producing new life or offspring"
representative,"n. a person who represents others
s. serving to represent or typify
a. standing for something else
s. being or characteristic of government by representation in which citizens exercise power through elected officers and representatives"
cumulative,s increasing by successive addition
exploitative,s. tending to exploit or make use of
imperative,"n. some duty that is essential and urgent
a. requiring attention or action
a. relating to verbs in the imperative mood"
lucrative,s. producing a sizeable profit
meditative,s deeply or seriously thoughtful; 
preventative,"n remedy that prevents or slows the course of an illness or disease
n any obstruction that impedes or is burdensome
n an agent or device intended to prevent conception
a tending to prevent or hinder
s preventing or contributing to the prevention of disease"
vegetative,"a. of or relating to an activity that is passive and monotonous
s. relating to involuntary bodily functions"
territory,"n. an area of knowledge or interest
n. the geographical area under the jurisdiction of a sovereign state"
dormitory,"n. a college or university building containing living quarters for students
n. a large sleeping room containing several beds"
laboratory,"n a workplace for the conduct of scientific research
n a region resembling a laboratory inasmuch as it offers opportunities for observation and practice and experimentation"
laundry,"n. garments or white goods that can be cleaned by laundering
n. workplace where clothes are washed and ironed"
lavatory,"n a room or building equipped with one or more toilets
n a bathroom sink that is permanently installed and connected to a water supply and drainpipe; where you can wash your hands and face
n a toilet that is cleaned of waste by the flow of water through it"
machinery,"n. machines or machine systems collectively
n. a system of means and activities whereby a social institution functions"
forestry,n. the science of planting and caring for forests and the management of growing timber
poultry,n. flesh of chickens or turkeys or ducks or geese raised for food
directory,"n. an alphabetical list of names and addresses
n. (computer science) a listing of the files stored in memory (usually on a hard disk)"
scenery,"n. the painted structures of a stage set that are intended to suggest a particular locale
n. the appearance of a place"
compulsory,s. required by rule
peremptory,"s. not allowing contradiction or refusal
s. putting an end to all debate or action"
satisfactory,"a. giving satisfaction
s. meeting requirements"
exploratory,a. serving in or intended for exploration or discovery
mandatory,"n the recipient of a mandate
n a territory surrendered by Turkey or Germany after World War I and put under the tutelage of some other European power until they are able to stand by themselves
s required by rule"
transitory,s lasting a very short time
blurry,s indistinct or hazy in outline
prolonged,"v lengthen in time; cause to be or last longer
v lengthen or extend in duration or space
s relatively long in duration; tediously protracted
s drawn out or made longer spatially"
crowded,a. overfilled or compacted or concentrated
congested,s. overfull as with blood
doomed,"n. people who are destined to die soon
s. marked for certain death
s. marked by or promising bad fortune"
frightened,s. made afraid
isolated,"s. not close together in time
s. cut off or left behind
s. under forced isolation especially for health reasons"
limited,"a. small in range or scope
s. including only a part
s. mediocre
s. not excessive"
biased,s. favoring one person or side over another
contrived,s. showing effects of planning or manipulation
pulverized,"v make into a powder by breaking up or cause to become dust
v destroy completely
v become powder or dust
s consisting of fine particles"
vested,s. fixed and absolute and without contingency
begrimed,imp. & p. p. of Begrime
volunteer,"n. (military) a person who freely enlists for service
n. a person who performs voluntary work
v. tell voluntarily
v. agree freely"
refugee,n. an exile who flees for safety
auctioneer,n. an agent who conducts an auction
personnel,"n group of people willing to obey orders
n the department responsible for hiring and training and placing employees and for setting policies for personnel management"
vessel,"n. a tube in which a body fluid circulates
n. a craft designed for water transportation
n. an object used as a container (especially for liquids)"
molecule,n. (physics and chemistry) the simplest structural unit of an element or compound
banquet,"n. a ceremonial dinner party for many people
n. a meal that is well prepared and greatly enjoyed"
blanket,"n. bedding that keeps a person warm in bed
n. anything that covers
n. a layer of lead surrounding the highly reactive core of a nuclear reactor
v. cover as if with a blanket"
booklet,n. a small book usually having a paper cover
cabinet,"n. a piece of furniture resembling a cupboard with doors and shelves and drawers; for storage or display
n. persons appointed by a head of state to head executive departments of government and act as official advisers
n. a storage compartment for clothes and valuables; usually it has a lock
n. housing for electronic instruments, as radio or television"
chapel,n. a place of worship that has its own altar
droplet,n. a tiny drop
gravel,"n. rock fragments and pebbles
v. cover with gravel"
leaflet,n. part of a compound leaf
morsel,"n. a small quantity of anything
n. a small amount of solid food; a mouthful"
parcel,"n. the allotment of some amount by dividing something
v. divide into parts
v. cover with strips of canvas
v. make into a wrapped container"
trinket,n cheap showy jewelry or ornament on clothing
turret,n. a small tower extending above a building
channel,"n. a path over which electrical signals can pass
n. a passage for water (or other fluids) to flow through
n. a deep and relatively narrow body of water (as in a river or a harbor or a strait linking two larger bodies) that allows the best passage for vessels
n. (often plural) a means of communication or access"
tunnel,"n. a passageway through or under something, usually underground (especially one for trains or cars)
v. force a way through"
strengthen,"v. make strong or stronger
v. gain strength"
tighten,"v. make tight or tighter
v. become tight or tighter"
heighten,"v. become more extreme
v. make more extreme; raise in quantity, degree, or intensity
v. increase the height of"
fasten,"v. cause to be firmly attached
v. become fixed or fastened
v. attach to"
sharpen,"v. make sharp or sharper
v. make crisp or more crisp and precise
v. become sharp or sharper
v. make (images or sounds) sharp or sharper"
slacken,"v. become looser or slack
v. make slack as by lessening tension or firmness"
weaken,"v. lessen the strength of
v. become weaker"
efficiency,"n. the ratio of the output to the input of any system
n. skillfulness in avoiding wasted time and effort"
consequence,"n. a phenomenon that follows and is caused by some previous phenomenon
n. the outcome of an event especially as relative to an individual
n. having important effects or influence"
emergency,"n. a sudden unforeseen crisis (usually involving danger) that requires immediate action
n. a state in which martial law applies"
essence,n. any substance possessing to a high degree the predominant properties of a plant or drug or other natural product from which it is extracted
existence,"n the state or fact of existing
n everything that exists anywhere"
preference,"n. a strong liking
n. the right or chance to choose
n. grant of favor or advantage to one over another (especially to a country or countries in matters of international trade, such as levying duties)"
residence,"n. any address at which you dwell more than temporarily
n. the official house or establishment of an important person (as a sovereign or president)"
sequence,"n. serial arrangement in which things follow in logical order or a recurrent pattern
n. a following of one thing after another in time
n. film consisting of a succession of related shots that develop a given subject in a movie
n. several repetitions of a melodic phrase in different keys"
deficiency,"n the state of needing something that is absent or unavailable
n lack of an adequate quantity or number"
adolescence,"n. the time period between the beginning of puberty and adulthood
n. in the state that someone is in between puberty and adulthood"
complacency,n. the feeling you have when you are satisfied with yourself
delinquency,"n. nonpayment of a debt when due
n. a tendency to be negligent and uncaring
n. an antisocial misdeed in violation of the law by a minor"
