structure,"n. a thing constructed; a complex entity constructed of many parts
n. the manner of construction of something and the arrangement of its parts
n. the complex composition of knowledge as elements and their combinations
n. a particular complex anatomical part of a living thing"
collapse,"n. an abrupt failure of function or complete physical exhaustion
n. a natural event caused by something suddenly falling down or caving in
v. break down, literally or metaphorically
v. fold or close up"
pressure,"n. the force applied to a unit area of surface; measured in pascals (SI unit) or in dynes (cgs unit)
n. a force that compels
n. the somatic sensation that results from applying force to an area of skin
n. an oppressive condition of physical or mental or social or economic distress"
connection,"n. a relation between things or events (as in the case of one causing the other or sharing features with it)
n. the state of being connected
n. an instrumentality that connects
n. (usually plural) a person who is influential and to whom you are connected in some way (as by family or friendship)"
sunlight,n. the rays of the sun
gas,"n. the state of matter distinguished from the solid and liquid states by: relatively low density and viscosity; relatively great expansion and contraction with changes in pressure and temperature; the ability to diffuse readily; and the spontaneous tendency to become distributed uniformly throughout any container
n. a fluid in the gaseous state having neither independent shape nor volume and being able to expand indefinitely
v. attack with gas; subject to gas fumes"
transparent,s. easily understood or seen through (because of a lack of subtlety)
radiation,"n. energy that is radiated or transmitted in the form of rays or waves or particles
n. the act of spreading outward from a central source
n. the spontaneous emission of a stream of particles or electromagnetic rays in nuclear decay
n. the spread of a group of organisms into new habitats"
radiate,"v. send out rays or waves
v. send out real or metaphoric rays
v. extend or spread outward from a center or focus or inward towards a center
v. cause to be seen by emitting light as if in rays"
infrared,"n. the infrared region of the electromagnetic spectrum; electromagnetic wave frequencies below the visible range
n. electromagnetic radiation with wavelengths longer than visible light but shorter than radio waves
s. having or employing wavelengths longer than light but shorter than radio waves; lying outside the visible spectrum at its red end"
visible,"a. capable of being seen; or open to easy view
s. obvious to the eye
s. present and easily available"
tend,"v. have a tendency or disposition to do or be something; be inclined
v. have care of or look after
v. manage or run"
distinctly,"r. clear to the mind; with distinct mental discernment
r. in a distinct and distinguishable manner
r. to a distinct degree"
distinct,"s. (often followed by `from') not alike; different in nature or quality
a. easy to perceive; especially clearly outlined
s. recognizable; marked"
villainy,"n. the quality of evil by virtue of villainous behavior
n. a criminal or vicious act"
creep,"n. someone unpleasantly strange or eccentric
n. a slow longitudinal movement or deformation
n. a pen that is fenced so that young animals can enter but adults cannot
v. grow or spread, often in such a way as to cover (a surface)"
estimate,"n. an approximate calculation of quantity or degree or worth
n. a judgment of the qualities of something or somebody
n. a statement indicating the likely cost of some job
n. the respect with which a person is held"
polar,"s. having a pair of equal and opposite charges
a. located at or near or coming from the earth's poles
a. of or existing at or near a geographical pole or within the Arctic or Antarctic Circles"
melt,"v. reduce or cause to be reduced from a solid to a liquid state, usually by heating
v. lose its distinct outline or shape; blend gradually
v. become less intense and fade away gradually"
factor,"n. anything that contributes causally to a result
n. any of the numbers (or symbols) that form a product when multiplied together
n. an independent variable in statistics
v. resolve into factors"
disappear,"v. get lost, as without warning or explanation"
acre,"n. a unit of area (4840 square yards) used in English-speaking countries
n. a territory of western Brazil bordering on Bolivia and Peru
n. a town and port in northwestern Israel in the eastern Mediterranean"
replace,"v. substitute a person or thing for (another that is broken or inefficient or lost or no longer working or yielding what is expected)
v. put something back where it belongs"
scrub,"n. dense vegetation consisting of stunted trees or bushes
n. the act of cleaning a surface by rubbing it with a brush and soap and water
v. clean with hard rubbing
v. wash thoroughly"
consume,"v. serve oneself to, or consume regularly
v. spend extravagantly
v. destroy completely
v. use up (resources or materials)"
perspective,n. the appearance of things relative to one another as determined by their distance from the viewer
replant,v. plant again or anew
nuclear,"a. (weapons) deriving destructive energy from the release of atomic energy
a. of or relating to or constituting the nucleus of an atom
a. of or relating to or constituting the nucleus of a cell
s. constituting or like a nucleus"
alternative,"s. necessitating a choice between mutually exclusive possibilities
s. pertaining to unconventional choices"
interior,"a. situated within or suitable for inside a building
s. inside and toward a center
s. of or coming from the middle of a region or country"
solar,a. relating to or derived from the sun or utilizing the energies of the sun
compete,v. compete for something; engage in a contest; measure oneself against others
military,"n. the military forces of a nation
a. of or relating to the study of the principles of warfare
a. characteristic of or associated with soldiers or the military
a. associated with or performed by members of the armed services as contrasted with civilians"
do harm,none
do sb. harm,none
serve as,none
from year to year,none
in all likelihood,none
come about,none
go up,none
make up,"n an event that is substituted for a previously cancelled event
n the way in which someone or something is composed
n cosmetics applied to the face to improve or change your appearance"
first of all,none
to make matters worse,none
at first,none
by itself,none
cut down,none
most of all,none
object to,none
vessel,"n. a tube in which a body fluid circulates
n. a craft designed for water transportation
n. an object used as a container (especially for liquids)"
orbit,"n. the (usually elliptical) path described by one celestial body in its revolution about another
n. the path of an electron around the nucleus of an atom"
storage,"n. the act of storing something
n. the commercial enterprise of storing goods and materials
n. (computer science) the process of storing information in a computer memory or on a magnetic tape or disk"
rocket,"n. any vehicle self-propelled by a rocket engine
n. a jet engine containing its own propellant and driven by reaction propulsion
n. erect European annual often grown as a salad crop to be harvested when young and tender
n. propels bright light high in the sky, or used to propel a lifesaving line or harpoon"
engine,"n. motor that converts thermal energy to mechanical work
n. something used to achieve a purpose
n. an instrument or machine that is used in warfare, such as a battering ram, catapult, artillery piece, etc."
complicated,s. difficult to analyze or understand
launch,"n. a motorboat with an open deck or a half deck
v. propel with force
v. launch for the first time; launch on a maiden voyage
v. get going; give impetus to"
cell,"n. any small compartment
n. (biology) the basic structural and functional unit of all organisms; they may exist as independent units of life (as in monads) or may form colonies or tissues as in higher plants and animals
n. a device that delivers an electric current as the result of a chemical reaction
n. a small unit serving as part of or as the nucleus of a larger political movement"
beam,"n. long thick piece of wood or metal or concrete, etc., used in construction
n. a group of nearly parallel lines of electromagnetic radiation
n. a column of light (as from a beacon)
n. (nautical) breadth amidships"
vacuum,"n. the absence of matter
n. a region that is devoid of matter
n. an electrical home appliance that cleans by suction
v. clean with a vacuum cleaner"
gravity,"n. (physics) the force of attraction between all masses in the universe; especially the attraction of the earth's mass for bodies near its surface
n. a solemn and dignified feeling"
laboratory,"n a workplace for the conduct of scientific research
n a region resembling a laboratory inasmuch as it offers opportunities for observation and practice and experimentation"
tank,"n. an enclosed armored military vehicle; has a cannon and moves on caterpillar treads
n. a large (usually metallic) vessel for holding gases or liquids
n. as much as a tank will hold
v. store in a tank by causing (something) to flow into it"
crust,"n. the outer layer of the Earth
n. a hard outer layer that covers something
n. the trait of being rude and impertinent; inclined to take liberties
v. form a crust or form into a crust"
resource,"n. available source of wealth; a new or reserve supply that can be drawn upon when needed
n. a source of aid or support that may be drawn upon when needed
n. the ability to deal resourcefully with unusual problems"
aluminum,n. a silvery ductile metallic element found primarily in bauxite
sphere,"n. a particular environment or walk of life
n. any spherically shaped artifact
n. the geographical area in which one nation is very influential
n. a solid figure bounded by a spherical surface (including the space it encloses)"
settlement,"n. a conclusive resolution of a matter and disposition of it
n. something settled or resolved; the outcome of decision making
n. an area where a group of families live together"
outer,"a. being on the outside or further from a center
s. located outside
s. being on or toward the outside of the body"
surgeon,n. a physician who specializes in surgery
self-confidence,n freedom from doubt; belief in yourself and your abilities
making,n. (usually plural) the components needed for making or doing something
resident,"n. someone who lives at a particular place for a prolonged period or who was born there
a. living in a particular place"
conclude,"v. bring to a close
v. reach a conclusion after a discussion or deliberation
v. come to a close
v. reach agreement on"
surgical,"a. of or relating to or involving or used in surgery
a. relating to or requiring or amenable to treatment by surgery especially as opposed to medicine
s. performed with great precision"
competently,r. with competence; in a competent capable manner
emergency,"n. a sudden unforeseen crisis (usually involving danger) that requires immediate action
n. a state in which martial law applies"
encounter,n. a casual meeting with a person or thing
dread,"n fearful expectation or anticipation
v be afraid or scared of; be frightened of
s causing fear or dread or terror"
infrequently,r. not many times
relax,"v. become less tense, rest, or take one's ease
v. make less taut
v. cause to feel relaxed
v. become less tense, less formal, or less restrained, and assume a friendlier manner"
relaxation,"n. (physiology) the gradual lengthening of inactive muscle or muscle fibers
n. (physics) the exponential return of a system to equilibrium after a disturbance
n. an occurrence of control or strength weakening"
residency,"n. the act of dwelling in a place
n. the position of physician who is receiving special training in a hospital (usually after completing an internship)"
resolve,"v. make clearly visible
v. find the solution"
resolution,"n. a formal expression by a meeting; agreed to by a vote
n. finding a solution to a problem
n. analysis into clear-cut components
n. (computer science) the number of pixels per square inch on a computer-generated display; the greater the resolution, the better the picture"
considered,s. carefully weighed
dwell,"v. originate (in)
v. exist or be situated within"
confident,"a. having or marked by confidence or assurance
s. not liable to error in judgment or action"
butterfly,"n. diurnal insect typically having a slender body with knobbed antennae and broad colorful wings
n. a swimming stroke in which the arms are thrown forward together out of the water while the feet kick up and down
v. flutter like a butterfly
v. cut and spread open, as in preparation for cooking"
abdomen,n. the region of the body of a vertebrate between the thorax and the pelvis
anticipate,"v. act in advance of; deal with ahead of time
v. realize beforehand
v. be excited or anxious about
v. be a forerunner of or occur earlier than"
anticipation,"n. an expectation
n. something expected (as on the basis of a norm)
n. anticipating with confidence of fulfillment"
sweat,"n. condensation of moisture on a cold surface
v. excrete perspiration through the pores in the skin"
stab,"n. a strong blow with a knife or other sharp pointed instrument
v. stab or pierce"
belly,"n. a protruding abdomen
n. a part that bulges deeply
n. the hollow inside of something
n. the underpart of the body of certain vertebrates such as snakes or fish"
puncture,"n. loss of air pressure in a tire when a hole is made by some sharp object
n. a small hole made by a sharp object
n. the act of puncturing or perforating
v. pierce with a pointed object; make a hole into"
compound,"n. a whole formed by a union of two or more elements or parts
n. (chemistry) a substance formed by chemical union of two or more elements or ingredients in definite proportion by weight
n. an enclosure of residences and other building (especially in the Orient)
v. put or add together"
fracture,"n. breaking of hard tissue such as bone
n. the act of cracking something
v. violate or abuse
v. interrupt, break, or destroy"
compound fracture,none
inevitably,r. in such a manner as could not be otherwise
inevitable,"n. an unavoidable event
a. incapable of being avoided or prevented
s. invariably occurring or appearing"
err,v. to make a mistake or be incorrect
surgery,"n. the branch of medical science that treats disease or injury by operative procedures
n. a room where a doctor or dentist can be consulted"
sole,"n. the underside of footwear or a golf club
n. lean flesh of any of several flatfish
n. the underside of the foot
n. right-eyed flatfish; many are valued as food; most common in warm seas especially European"
responsibility,n. a form of trustworthiness; the trait of being answerable to someone for something or being responsible for one's conduct
conceited,s. characteristic of false pride; having an exaggerated sense of self-importance
conceit,"n. an elaborate poetic image or a far-fetched comparison of very dissimilar things
n. a witty or ingenious turn of phrase
n. an artistic device or effect
n. the trait of being unduly vain and conceited; false pride"
trying,s. hard to endure
uncertainty,n. being unsettled or in doubt or dependent on chance
draw to a close,none
live with,none
dwell on,none
in practice,none
butterflies in the stomach,none
open up,none
in advance,none
at one time or another,none
sit on,none
mud,"n. water soaked soil; soft wet earth
n. slanderous remarks or charges
v. plaster with mud"
camel,n. cud-chewing mammal used as a draft or saddle animal in desert regions
fog,"n. droplets of water vapor suspended in the air near the ground
n. an atmosphere in which visibility is reduced because of a cloud of some substance"
petrol,n a volatile flammable mixture of hydrocarbons (hexane and heptane and octane etc.) derived from petroleum; used mainly as a fuel in internal-combustion engines
routine,"n. an unvarying or habitual method or procedure
n. a set sequence of steps, part of larger computer program"
injection,"n. the forceful insertion of a substance under pressure
n. any solution that is injected (as into the skin)
n. the act of putting a liquid into the body by means of a syringe"
ambulance,n. a vehicle that takes people to and from hospitals
stoop,"n. an inclination of the top half of the body forward and downward
n. small porch or set of steps at the front entrance of a house
v. descend swiftly, as if on prey
v. sag, bend, bend over or down"
tough-looking,none
peer,"n. a person who is of equal standing with another in a group
n. a nobleman (duke or marquis or earl or viscount or baron) who is a member of the British peerage
v. look searchingly"
vacant,"s. void of thought or knowledge
s. without an occupant or incumbent"
dealer,"n. a firm engaged in trading
n. a seller of illicit goods
n. the person who distributes the playing cards in a card game"
stream,"n. a natural body of running water flowing on or under the earth
n. dominant course (suggestive of running water) of successive events or ideas
n. something that resembles a flowing stream in moving continuously
v. to extend, wave or float outward, as if in the wind"
addict,"n. someone who is so ardently devoted to something that it resembles an addiction
n. someone who is physiologically dependent on a substance; abrupt deprivation of the substance produces withdrawal symptoms
v. to cause (someone or oneself) to become dependent (on something, especially a narcotic drug)"
urinate,v. pass after the manner of urine
illusion,"n. an erroneous mental representation
n. something many people believe that is false"
occupy,"v. live (in a certain place)
v. occupy the whole of"
tough,"a. not given to gentleness or sentimentality
a. physically toughened
a. resistant to cutting or chewing"
gunshot,n the act of shooting a gun
rage,"n. a state of extreme anger
n. something that is desired intensely
n. violent state of the elements
v. be violent; as of fires and storms"
disperse,"v. to cause to separate and go in different directions
v. move away from each other; 
v. separate (light) into spectral rays"
drift,"n. a force that moves something along
n. the gradual departure from an intended course due to external influences (as a ship or plane)
n. a process of linguistic change over a period of time
n. a large mass of material that is heaped up by the wind or by water currents"
challenge,"n. a demanding or stimulating situation
n. a call to engage in a contest or fight
n. questioning a statement and demanding an explanation
n. a formal objection to the selection of a particular person as a juror"
addicted,a. compulsively or physiologically dependent on something habit-forming
foster,"n. United States songwriter whose songs embody the sentiment of the South before the American Civil War (1826-1864)
v. promote the growth of
v. bring up under fosterage; of children
v. help develop, help grow"
custody,n. holding by the police
pray,"v. address a deity, a prophet, a saint or an object of worship; say a prayer"
confront,"v. oppose, as in hostility or a competition
v. deal with (something unpleasant) head on
v. present somebody with something, usually to accuse or criticize
v. be face to face with"
jeans,"n (usually plural) close-fitting trousers of heavy denim for manual work or casual wear
n a coarse durable twill-weave cotton fabric"
property,"n. something owned; any tangible or intangible possession that is owned by someone; 
n. a basic or essential attribute shared by all members of a class
n. a construct whereby objects or individuals can be distinguished
n. any movable articles or objects used on the set of a play or movie"
heartbeat,n. an animating or vital unifying force
throat,"n. the passage to the stomach and lungs; in the front part of the neck below the chin and above the collarbone
n. an opening in the vamp of a shoe at the instep
n. a passage resembling a throat in shape or function; 
n. the part of an animal's body that corresponds to a person's throat"
fuss,"n. an angry disturbance
v. worry unnecessarily or excessively"
thug,n an aggressive and violent young criminal
wage,n. something that remunerates
pusher,"n. one who intrudes or pushes himself forward
n. an unlicensed dealer in illegal drugs
n. someone who pushes"
tragedy,n. drama in which the protagonist is overcome by some superior force or circumstance; excites terror or pity
cautious,"a. showing careful forethought; never making swift decisions""
s. avoiding excess"
caution,"n. the trait of being cautious; being attentive to possible danger
n. a warning against certain acts
n. judiciousness in avoiding harm or danger
v. warn strongly; put on guard"
organization,"n. a group of people who work together
n. the act of organizing a business or an activity related to a business
n. an ordered manner; orderliness by virtue of being methodical and well organized
n. the activity or result of distributing or disposing persons or things properly or methodically"
leadership,"n. the activity of leading
n. the body of people who lead a group
n. the status of a leader
n. the ability to lead"
establish,"v. set up or found
v. set up or lay the groundwork for
v. bring about
v. use as a basis for; found on"
extend,"v. make available; provide
v. reach outward in space
v. expand the influence of
v. open or straighten out; unbend"
extension,"n. a mutually agreed delay in the date set for the completion of a job or payment of a debt
n. act of expanding in scope; making more widely available
n. an educational opportunity provided by colleges and universities to people who are not enrolled as regular students
n. act of stretching or straightening out a flexed limb"
prompt,"n. a cue given to a performer (usually the beginning of the next line to be spoken)
n. (computer science) a symbol that appears on the computer screen to indicate that the computer is ready to receive a command
v. serve as the inciting cause of
v. assist (somebody acting or reciting) by suggesting the next words of something forgotten or imperfectly learned"
abandon,"n. the trait of lacking restraint or control; reckless freedom from inhibition or worry
v. forsake, leave behind
v. give up with the intent of never claiming again
v. stop maintaining or insisting on; of ideas or claims"
explode,"v. cause to burst with a violent release of energy
v. burst outward, usually with noise
v. show a violent emotional reaction
v. be unleashed; emerge with violence or noise"
impact,"n. the striking of one body against another
n. a forceful consequence; a strong effect
v. press or wedge together; pack together"
right off,none
right away,none
move in,none
shoot up,none
hang out,n a frequently visited place
rise to,none
addicted to,none
be addicted to,none
turn over,n. a dish made by folding a piece of pastry over a filling
check on,none
check in,n. the act of reporting your presence (as at an airport or a hotel)
take to,none
talk back,none
take a stand,none
set ... on fire,none
set fire to,none
step up,n the act of increasing something
run into,none
get through to sb.,none
purse,"n. a sum of money spoken of as the contents of a money purse
n. a small bag for carrying money
n. a sum of money offered as a prize
v. contract one's lips into a rounded shape"
strap,"n. an elongated leather strip (or a strip of similar material) for binding things together or holding something in position
n. hanger consisting of a loop of leather suspended from the ceiling of a bus or train; passengers hold onto it
n. a band that goes over the shoulder and supports a garment or bag
n. whip consisting of a strip of leather used in flogging"
violently,r. in a violent manner
grip,"n. the friction between a body and the surface on which it moves (as between an automobile tire and the road)
n. worker who moves the camera around while a film or television show is being made
n. an intellectual hold or understanding
v. hold fast or firmly"
loose,"a. not compact or dense in structure or arrangement
s. (of a ball in sport) not in the possession or control of any player
a. not tight; not closely constrained or constricted or constricting
s. not tense or taut"
release,"n. merchandise issued for sale or public showing (especially a record or film)
n. a process that liberates or discharges something
n. a device that when pressed will release part of a mechanism
n. activity that frees or expresses creative energy or emotion"
pop,"n. a sweet drink containing carbonated water and flavoring
n. a sharp explosive sound as from a gunshot or drawing a cork
v. hit a pop-fly
v. make a sharp explosive noise"
furnished,a. provided with whatever is necessary for a purpose (as furniture or equipment or authority)
switch,"n. control consisting of a mechanical or electrical or electronic device for making or breaking or changing the connections in a circuit
n. hairpiece consisting of a tress of false hair; used by women to give shape to a coiffure
n. railroad track having two movable rails and necessary connections; used to turn a train from one track to another or to store rolling stock
n. a flexible implement used as an instrument of punishment"
towel,"n. a rectangular piece of absorbent cloth (or paper) for drying or wiping
v. wipe with a towel"
drip,"n. flowing in drops; the formation and falling of drops of liquid
n. the sound of a liquid falling drop by drop
n. (architecture) a projection from a cornice or sill designed to protect the area below from rainwater (as over a window or doorway)
v. fall in drops"
frown,"n. a facial expression of dislike or displeasure
v. look angry or sullen, wrinkle one's forehead, as if to signal disapproval"
