retain,"v. hold back within
v. allow to remain in a place or position or maintain a property or feature
v. secure and keep for possible future use or application
v. keep in one's mind"
upperclassman,none
academic,"a. associated with academia or an academy
s. hypothetical or theoretical and not expected to produce an immediate or practical result
s. marked by a narrow focus on or display of learning especially its trivial aspects"
award,"n. a grant made by a law court
n. a tangible symbol signifying approval or distinction
v. give, especially as an honor or reward
v. give as judged due or on the basis of merit"
capability,"n. the quality of being capable -- physically or intellectually or legally
n. the susceptibility of something to a particular treatment
n. an aptitude that may be developed"
capacity,"n. capability to perform or produce
n. the amount that can be contained
n. the maximum production possible
n. a specified function"
challenging,"s. stimulating interest or thought
s. disturbingly provocative"
corporate,"a. of or belonging to a corporation
s. done by or characteristic of individuals acting together
s. organized and maintained as a legal corporation"
digital,"a. displaying numbers rather than scale positions
a. relating to or performed with the fingers
a. of a circuit or device that represents magnitudes in digits"
diploma,n. a document certifying the successful completion of a course of study
distinct,"s. (often followed by `from') not alike; different in nature or quality
a. easy to perceive; especially clearly outlined
s. recognizable; marked"
elect,"v. select by a vote for an office or membership
v. choose
s. selected as the best
s. elected but not yet installed in office"
enhance,"v. increase
v. make better or more attractive"
enable,v. render capable or able for some task
entry,"n. an item inserted in a written record
n. a written record of a commercial transaction"
equip,"v. provide with (something) usually for a specific purpose
v. provide with abilities or understanding"
ensure,"v make certain of
v be careful or certain to do something; make certain of something"
exchange,"n. chemical process in which one atom or ion or group changes places with another
n. a mutual expression of views (especially an unpleasant one)
n. the act of changing one thing for another thing
n. the act of giving something in return for something received"
exploit,"v. use or manipulate to one's advantage
v. draw from; make good use of"
facilitate,"v. make easier
v. increase the likelihood of (a response)"
facility,"n. a building or place that provides a particular service or is used for a particular industry
n. a natural effortlessness
n. something designed and created to serve a particular function and to afford a particular convenience or service
n. a service that an organization or a piece of equipment offers you"
foster,"n. United States songwriter whose songs embody the sentiment of the South before the American Civil War (1826-1864)
v. promote the growth of
v. bring up under fosterage; of children
v. help develop, help grow"
global,s. involving the entire earth; not limited or provincial in scope
grant,"n. any monetary aid
n. the act of providing a subsidy
n. (law) a transfer of property by deed of conveyance
n. Scottish painter; cousin of Lytton Strachey and member of the Bloomsbury Group (1885-1978)"
holistic,a. emphasizing the organic or functional relation between parts and the whole
impact,"n. the striking of one body against another
n. a forceful consequence; a strong effect
v. press or wedge together; pack together"
independent,"a. free from external control and constraint
a. (of a clause) capable of standing syntactically alone as a complete sentence
s. not controlled by a party or interest group"
innovation,"n a creation (a new device or process) resulting from study and experimentation
n the creation of something in the mind
n the act of starting something for the first time; introducing something new"
institution,"n. an organization founded and united for a specific purpose
n. an establishment consisting of a building or complex of buildings where an organization for the promotion of some cause is situated
n. a custom that for a long time has been an important feature of some group or society"
interdisciplinary,a. drawing from or characterized by participation of two or more fields of study
joint,"n. (anatomy) the point of connection between two bones or elements of a skeleton (especially if it allows motion)
n. a disreputable place of entertainment
n. junction by which parts or objects are joined together
n. marijuana leaves rolled into a cigarette for smoking"
locate,"v. discover the location of; determine the place of; find by searching or examining
v. assign a location to"
noteworthy,"s. worthy of notice
s. worthy of notice"
particularly,"r. to a distinctly greater extent or degree than is common
r. specifically or especially distinguished from others"
private,"n. an enlisted man of the lowest rank in the Army or Marines
a. confined to particular persons or groups or providing privacy
s. concerning things deeply private and personal"
property,"n. something owned; any tangible or intangible possession that is owned by someone; 
n. a basic or essential attribute shared by all members of a class
n. a construct whereby objects or individuals can be distinguished
n. any movable articles or objects used on the set of a play or movie"
prowess,n a superior skill that you can learn by study and practice and observation
religious,"n. a member of a religious order who is bound by vows of poverty and chastity and obedience
s. concerned with sacred matters or religion or the church
a. having or showing belief in and reverence for a deity
a. of or relating to clergy bound by monastic vows"
responsibility,n. a form of trustworthiness; the trait of being answerable to someone for something or being responsible for one's conduct
rigorous,"s. rigidly accurate; allowing no deviation from a standard
s. demanding strict attention to rules and procedures"
strategy,n. the branch of military science dealing with military command and the planning and conduct of a war
supervise,"v watch and direct
v keep tabs on; keep an eye on; keep under surveillance"
sustain,"v. supply with necessities and support
v. admit as valid"
tutor,"v. be a tutor to someone; give individual instruction
v. act as a guardian to someone"
tutorial,"n. a session of intensive tuition given by a tutor to an individual or to a small number of students
a. of or relating to tutors or tutoring"
undergraduate,n. a university student who has not yet received a first degree
underpin,v. support from beneath
venture,"n. any venturesome undertaking especially one with an uncertain outcome
n. a commercial undertaking that risks a loss but promises a profit
v. proceed somewhere despite the risk of possible dangers
v. put at risk"
well-being,n a contented state of being happy and healthy and prosperous
apply for,none
at large,none
in support of,none
on average,none
on the basis of,none
alumni,n a person who has received a degree from a school (high school or college or university)
assure,"v. inform positively and with certainty and confidence
v. assure somebody of the truth of something with the intention of giving the listener confidence"
challenge,"n. a demanding or stimulating situation
n. a call to engage in a contest or fight
n. questioning a statement and demanding an explanation
n. a formal objection to the selection of a particular person as a juror"
constructive,"a. constructing or tending to construct or improve or promote development
s. emphasizing what is laudable or hopeful or to the good"
contemplate,"v. look at thoughtfully; observe deep in thought
v. consider as a possibility"
contribute,"v. contribute to some cause
v. be conducive to"
critical,"a. marked by a tendency to find and call attention to errors and flaws
a. at or of a point at which a property or phenomenon suffers an abrupt change especially having enough mass to sustain a chain reaction
a. characterized by careful evaluation and judgment
s. urgently needed; absolutely necessary"
desire,"n. the feeling that accompanies an unsatisfied state
n. an inclination to want things
n. something that is desired
v. feel or have a desire for; want strongly"
ethical,"a. of or relating to the philosophical study of ethics
a. conforming to accepted standards of social or professional behavior
s. adhering to ethical and moral principles"
explore,"v. travel to or penetrate into
v. examine minutely
v. examine (organs) for diagnostic purposes"
extinction,"n. no longer active; extinguished
n. no longer in existence
n. the reduction of the intensity of radiation as a consequence of absorption and radiation"
extraordinary,"a. beyond what is ordinary or usual; highly unusual or exceptional or remarkable
s. far more than usual or expected
s. (of an official) serving an unusual or special function in addition to those of the regular officials"
face,"n. the front of the human head from the forehead to the chin and ear to ear
n. the general outward appearance of something
n. the striking or working surface of an implement
n. a part of a person that is used to refer to a person"
fauna,n. all the animal life in a particular region or period
flora,"n all the plant life in a particular region or period
n (botany) a living organism lacking the power of locomotion"
forefront,n. the part in the front or nearest the viewer
foundation,"n. the basis on which something is grounded
n. an institution supported by an endowment
n. lowest support of a structure
n. education or instruction in the fundamentals of a field of knowledge"
frontiers,"n a wilderness at the edge of a settled area of a country
n an international boundary or the area (often fortified) immediately inside the boundary
n an undeveloped field of study; a topic inviting research and development"
generate,"v. bring into existence
v. produce (energy)"
ignite,v. cause to start burning; subject to fire or great heat
immensely,r to an exceedingly great extent or degree
intellectual,"n. a person who uses the mind creatively
s. of or associated with or requiring the use of the mind
a. appealing to or using the intellect"
model,"n. a hypothetical description of a complex entity or process
n. a type of product
n. a person who poses for a photographer or painter or sculptor
n. representation of something (sometimes on a smaller scale)"
passionate,a. having or expressing strong emotions
prejudice,"v. disadvantage by prejudice
v. influence (somebody's) opinion in advance"
pluralistic,a. of or relating to the philosophical doctrine of pluralism
pursuit,"n. the act of pursuing in an effort to overtake or capture
n. a search for an alternative that meets cognitive criteria"
revolutionize,"v. change radically
v. overthrow by a revolution, of governments
v. fill with revolutionary ideas"
rewarding,a. providing personal satisfaction
scholarly,a. characteristic of scholars or scholarship
transfer,"n. someone who transfers or is transferred from one position to another
n. the act of transfering something from one form to another
n. a ticket that allows a passenger to change conveyances
n. application of a skill learned in one situation to a different but similar situation"
transform,"v. subject to a mathematical transformation
v. change or alter in form, appearance, or nature
v. change in outward structure or looks
v. convert (one form of energy) to another"
urge,"n. an instinctive motive
n. a strong restless desire
v. force or impel in an indicated direction"
values,n. beliefs of a person or social group in which they have an emotional investment (either for or against something)
based on,none
be based on,none
related to,none
be related to,none
life-altering,none
participate in,none
share with,none
take advantage of,none
aide,n. someone who acts as assistant
sick leave,none
aftereffect,"n. any result that follows its cause after an interval
n. a delayed effect of a drug or therapy"
awesome,s inspiring awe or admiration or wonder
bonus,"n. anything that tends to arouse
n. an additional payment (or other remuneration) to employees as a means of increasing output"
budget,"n. a sum of money allocated for a particular purpose
n. a summary of intended expenditures along with proposals for how to meet them
v. make a budget"
buoyant,"s. tending to float on a liquid or rise in air or gas
s. characterized by liveliness and lightheartedness"
bureaucracy,"n. nonelective government officials
n. a government that is administered primarily by bureaus that are staffed with nonelective officials
n. any organization in which action is obstructed by insistence on unnecessary procedures and red tape"
compensation,"n. something (such as money) given or received as payment or reparation (as for a service or loss or injury)
n. (psychiatry) a defense mechanism that conceals your undesirable shortcomings by exaggerating desirable behaviors"
consultant,n an expert who gives advice
crusty,s. brusque and surly and forbidding
display,"n. something intended to communicate a particular impression
n. something shown to the public
n. a visual representation of something
n. behavior that makes your feelings public"
electron,n. an elementary particle with negative charge
extracurricular,"s. outside the regular academic curriculum
s. outside the regular duties of your job or profession"
fake,"n. something that is a counterfeit; not what it seems to be
s. not genuine or real; being an imitation of the genuine article; it's real synthetic fur"""
frosty,s. covered with frost
insult,n. a deliberately offensive act or something producing the effect of deliberate disrespect
intent,n. the intended meaning of a communication
metric,a. based on the meter as a standard of measurement
mission,"n. an organization of missionaries in a foreign land sent to carry on religious work
n. an operation that is assigned by a higher headquarters
n. a special assignment that is given to a person or group
n. the organized work of a religious missionary"
multiply,"v. combine by multiplication
v. combine or increase by multiplication
r. in several ways; in a multiple manner"
obsess,v. be preoccupied with something
palpable,"a. capable of being perceived; especially capable of being handled or touched or felt
s. can be felt by palpation"
particle,"n. a body having finite mass and internal structure but negligible dimensions
n. a function word that can be used in English to form phrasal verbs"
pretend,v. put forward a claim and assert right or possession of
privilege,"n. a special advantage or immunity or benefit not enjoyed by all
n. (law) the right to refuse to divulge information obtained in a confidential relationship
v. bestow a privilege upon"
scheme,"n. an elaborate and systematic plan of action
v. form intrigues (for) in an underhand manner
v. devise a system or form a scheme for"
spreadsheet,n. a screen-oriented interactive program enabling a user to lay out financial data on the screen
symphonic,"a. relating to or characteristic or suggestive of a symphony
s. harmonious in sound"
tedious,"s so lacking in interest as to cause mental weariness
s using or containing too many words"
triumph,n. the exultation of victory
trough,"n. a narrow depression (as in the earth or between ocean waves or in the ocean bed)
n. a long narrow shallow receptacle"
wave,"n. one of a series of ridges that moves across the surface of a liquid (especially across a large body of water)
n. a movement like that of a sudden occurrence or increase in a specified phenomenon
n. (physics) a movement up and down or back and forth
n. something that rises rapidly"
weenie,n a smooth-textured sausage of minced beef or pork usually smoked; often served on a bread roll
coerce someone into something,none
dig in,none
freak out,none
have a stake in something,none
jolly someone into something,none
allure,n. the power to entice or attract through personal charm
appealing,a. able to attract interest or draw favorable attention
assignment,"n. a duty that you are assigned to perform (especially in the armed forces)
n. the instrument by which a claim or right or interest or property is transferred from one person to another
n. the act of distributing something to designated places or persons
n. an undertaking that you have been assigned to do (as by an instructor)"
associate,"n. a person who joins with others in some activity or endeavor
n. a person with subordinate membership in a society, institution, or commercial enterprise
n. any event that usually accompanies or is closely connected with another
v. make a logical or causal connection"
attractive,"a. pleasing to the eye or mind especially through beauty or charm
s. having power to arouse interest
a. having the properties of a magnet; the ability to draw or pull;"
bachelor,"n. a man who has never been married
v. lead a bachelor's existence"
balance,"n. a state of equilibrium
n. equality between the totals of the credit and debit sides of an account
n. equality of distribution
n. the difference between the totals of the credit and debit sides of an account"
careerist,n. a professional who is intent on furthering his or her career by any possible means and often at the expense of their own integrity
category,n. a general concept that marks divisions or coordinations in a conceptual scheme
characteristic,"n. a distinguishing quality
n. the integer part (positive or negative) of the representation of a logarithm; in the expression log 643 = 2.808 the characteristic is 2
n. any measurable property of a device measured under closely specified conditions
a. typical or distinctive"
confirm,"v. establish or strengthen as with new evidence or facts
v. strengthen or make more firm
v. make more firm
v. support a person for a position"
connection,"n. a relation between things or events (as in the case of one causing the other or sharing features with it)
n. the state of being connected
n. an instrumentality that connects
n. (usually plural) a person who is influential and to whom you are connected in some way (as by family or friendship)"
consequence,"n. a phenomenon that follows and is caused by some previous phenomenon
n. the outcome of an event especially as relative to an individual
n. having important effects or influence"
crisis,"n. an unstable situation of extreme danger or difficulty
n. a crucial stage or turning point in the course of something"
designate,"v. assign a name or title to
s. appointed but not yet installed in office"
disaster,n. an act that has disastrous consequences
eligible,a. qualified for or allowed or worthy of being chosen
entrepreneur,n. someone who organizes a business venture and assumes the risk for it
environmental,"a. of or relating to the external conditions or surroundings
a. concerned with the ecological effects of altering the environment"
executive,"n. a person responsible for the administration of a business
n. persons who administer the law
a. having the function of carrying out plans or orders etc."
explorer,n. someone who travels into little known regions (especially for some scientific purpose)
further,"s. more distant in especially degree
r. to or at a greater extent or degree or a more advanced stage (`further' is used more often than `farther' in this abstract sense)
r. in addition or furthermore; further, they should be here already"""
genuine,"a. not fake or counterfeit
s. not pretended; sincerely felt or expressed"
harmonizer,n. One who harmonizes.
idealist,n. someone guided more by ideals than by practical considerations
identity,"n. the distinct personality of an individual regarded as a persisting entity
n. the individual characteristics by which a thing or person is recognized or known
n. an operator that leaves unchanged the element on which it operates
n. exact sameness"
luster,"n. a quality that outshines the usual
n. a surface coating for ceramics or porcelain"
network,"n. an interconnected system of things or people
n. (broadcasting) a communication system consisting of a group of broadcasting stations that all transmit the same programs
n. a system of intersecting lines or channels
n. (electronics) a system of interconnected electronic components or circuits"
non-profit,s. not commercially motivated
outreach,n. the act of reaching out
personality,"n. the complex of all the attributes--behavioral, temperamental, emotional and mental--that characterize a unique individual
n. a person of considerable prominence"
prestigious,s. exerting influence by reason of high status or prestige
prospect,"n. the possibility of future success
v. search for something desirable
v. explore for useful or valuable things or substances, such as minerals"
rank,"n. a row or line of people (especially soldiers or police) standing abreast of one another
n. relative status
v. take or have a position relative to others
v. take precedence or surpass others in rank"
ranking,"n. position on a scale in relation to others in a sport
s. having a higher rank"
rankings,"n. position on a scale in relation to others in a sport
v. take or have a position relative to others
v. assign a rank or rating to"
recruit,"n. a recently enlisted soldier
n. any new member or supporter (as in the armed forces)
v. seek to employ
v. cause to assemble or enlist in the military"
reflect,"v. manifest or bring back
v. to throw or bend back (from a surface)
v. be bright by reflecting or casting light
v. show an image of"
reputation,"n. notoriety for some particular characteristic
n. the general estimation that the public has for a person"
respondent,"n. the codefendant (especially in a divorce proceeding) who is accused of adultery with the corespondent
n. someone who responds"
secure,"v. assure payment of
a. free from fear or doubt; easy in mind
a. free from danger or risk
a. not likely to fail or give way"
spill,"n. liquid that is spilled
n. the act of allowing a fluid to escape
n. a sudden drop from an upright position
v. cause or allow (a liquid substance) to run or flow from a container"
spot,"n. a short section or illustration (as between radio or tv programs or in a magazine) that is often used for advertising
n. a small contrasting part of something
n. a section of an entertainment that is assigned to a specific performer or performance
n. a business establishment for entertainment"
tablet,"n. a slab of stone or wood suitable for bearing an inscription
n. a small flat compressed cake of some substance"
account for,none
arm candy,none
as well as,none
at least,none
break down,"n. a mental or physical breakdown
n. a cessation of normal operation
n. an analysis into mutually exclusive categories"
break down into,none
build something on something,none
base something on something,none
come in,none
for starters,none
in addition,none
disposal,"n. the power to use something or someone
n. the act or means of getting rid of something
n. a kitchen appliance for disposing of garbage"
promotion,"n. a message issued in behalf of some product or cause or idea or person or institution
n. act of raising in rank or position
n. encouragement of the progress or growth or acceptance of something"
clearance sale,none
expiration date,none
address,"n. (computer science) the code that identifies where a piece of information is stored
n. the place where a person or organization can be found or communicated with
n. the act of delivering a formal spoken communication to an audience
n. the manner of speaking to another individual"
agency,"n. an administrative unit of government
n. a business that serves other businesses
n. the state of being in action or exerting power"
alter,"v. make an alteration to
v. remove the ovaries of"
analysis,"n. an investigation of the component parts of a whole and their relations in making up the whole
n. the abstract separation of a whole into its constituent parts in order to study the parts and their relations
n. a form of literary criticism in which the structure of a piece of writing is analyzed
n. the use of closed-class words instead of inflections: e.g., `the father of the bride' instead of `the bride's father'"
appeal,"n. attractiveness that interests or pleases or stimulates
n. (law) a legal proceeding in which the appellant resorts to a higher court for the purpose of obtaining a review of a lower court decision and a reversal of the lower court's judgment or the granting of a new trial
v. take a court case to a higher court for review
v. request earnestly (something from somebody); ask for aid or protection"
automatically,r. in a reflex manner
available,"a. obtainable or accessible and ready for use or service
s. not busy; not otherwise committed
s. convenient for use or disposal"
billboard,n. large outdoor signboard
calendar,"n. a system of timekeeping that defines the beginning and length and divisions of the year
n. a list or register of events (appointments or social events or court cases etc)
n. a tabular array of the days (usually for one year)
v. enter into a calendar"
campaign,"n. a series of actions advancing a principle or tending toward a particular end
n. several related operations aimed at achieving a particular goal (usually within geographical and temporal constraints)
n. an overland journey by hunters (especially in Africa)
v. run, stand, or compete for an office or a position"
candidate,n. someone who is considered for something (for an office or prize or honor etc.)
canny,s showing self-interest and shrewdness in dealing with others
chip,"n. a triangular wooden float attached to the end of a log line
n. a piece of dried bovine dung
n. a thin crisp slice of potato fried in deep fat
n. a small disk-shaped counter used to represent money when gambling"
