parade,"n. a ceremonial procession including people marching
n. an extended (often showy) succession of persons or things
n. a visible display
v. walk ostentatiously"
torch,"n. a light usually carried in the hand; consists of some flammable substance
v. burn maliciously, as by arson"
circumstance,"n. a condition that accompanies or influences some event or activity
n. information that should be kept in mind when making a decision
n. formal ceremony about important occasions"
policy,"n. a plan of action adopted by an individual or social group
n. a line of argument rationalizing the course of action of a government
n. written contract or certificate of insurance"
emphasize,"v to stress, single out as important
v give extra weight to (a communication)"
virtue,"n. the quality of doing what is right and avoiding what is wrong
n. morality with respect to sexual relations
n. a particular moral excellence"
apply,"v. be pertinent or relevant or applicable
v. ask (for something)
v. refer (a word or name) to a person or thing
v. apply oneself to"
interview,"n. the questioning of a person (or a conversation in which information is elicited); often conducted by journalists
v. conduct an interview in television, newspaper, and radio reporting
v. discuss formally with (somebody) for the purpose of an evaluation
v. go for an interview in the hope of being hired"
advertise,"v. call attention to
v. make publicity for; try to sell (a product)"
advertisement,n a public promotion of some product or service
local,"n. public transport consisting of a bus or train that stops at all stations or stops
a. relating to or applicable to or concerned with the administration of a city or town or district rather than a larger area
a. of or belonging to or characteristic of a particular locality or neighborhood
a. affecting only a restricted part or area of the body"
suburb,n. a residential district located on the outskirts of a city
slim,"v take off weight
s being of delicate or slender build
s small in quantity"
awkward,"s. causing inconvenience
a. lacking grace or skill in manner or movement or performance
s. difficult to handle or manage especially because of shape
s. not elegant or graceful in expression"
depress,"v. lower someone's spirits; make downhearted
v. lower (prices or markets)
v. lessen the activity or force of"
depression,"n. a mental state characterized by a pessimistic sense of inadequacy and a despondent lack of activity
n. a long-term economic state characterized by unemployment and low prices and low levels of trade and investment
n. sad feelings of gloom and inadequacy
n. a period during the 1930s when there was a worldwide economic depression and mass unemployment"
brick,"n. rectangular block of clay baked by the sun or in a kiln; used as a building or paving material
n. a good fellow; helpful and trustworthy"
gravel,"n. rock fragments and pebbles
v. cover with gravel"
evergreen,"n. a plant having foliage that persists and remains green throughout the year
a. (of plants and shrubs) bearing foliage throughout the year"
shrub,n. a low woody perennial plant usually having several major stems
fume,"v. be mad, angry, or furious
v. emit a cloud of fine particles"
sandy-coloured,none
moustache,n an unshaved growth of hair on the upper lip
forehead,"n the part of the face above the eyes
n the large cranial bone forming the front part of the cranium: includes the upper part of the orbits"
disapproval,"n. a feeling of disliking something or what someone is doing
n. the expression of disapproval
n. the act of disapproving or condemning"
colonel,n. a commissioned military officer in the United States Army or Air Force or Marines who ranks above a lieutenant colonel and below a brigadier general
private,"n. an enlisted man of the lowest rank in the Army or Marines
a. confined to particular persons or groups or providing privacy
s. concerning things deeply private and personal"
bootlace,n. a long lace for fastening boots
undo,"v. cancel, annul, or reverse an action or its effect
v. cause the ruin or downfall of"
ah,"interj. An exclamation, expressive of surprise, pity, complaint,
   entreaty, contempt, threatening, delight, triumph, etc., according to
   the manner of utterance."
grunt,"n. the short low gruff noise of the kind made by hogs
n. an unskilled or low-ranking soldier or other worker
n. medium-sized tropical marine food fishes that utter grunting sounds when caught
v. issue a grunting, low, animal-like noise"
stale,"v. urinate, of cattle and horses
a. lacking freshness, palatability, or showing deterioration from age"
cabbage,"n. any of various types of cabbage
n. any of various cultivars of the genus Brassica oleracea grown for their edible leaves or flowers"
crumb,"n. a very small quantity of something
n. small piece of e.g. bread or cake
v. coat with bread crumbs
v. break into crumbs"
certificate,"n. a document attesting to the truth of certain stated facts
v. present someone with a certificate
v. authorize by certificate"
bloodshot,s. (of an eye) reddened as a result of locally congested blood vessels; inflamed
vital,"s. performing an essential function in the living body
s. manifesting or characteristic of life"
mumble,"n. a soft indistinct utterance
v. talk indistinctly; usually in a low voice
v. grind with the gums; chew without teeth and with great difficulty"
attach,"v. cause to be attached
v. be attached; be in contact with
v. become attached"
obviously,r. unmistakably (`plain' is often used informally for `plainly')
obvious,a. easily perceived by the senses or grasped by the mind
consist,"v. have its essential character; be comprised or contained in; be embodied in
v. be consistent in form, tenor, or character; be congruous
v. be composed of"
range,"n. the limits within which something can be effective
n. a large tract of grassy open land on which livestock can graze
n. a series of hills or mountains
n. a place for shooting (firing or driving) projectiles of various kinds"
cricket,"n. leaping insect; male makes chirping noises by rubbing the forewings together
n. a game played with a ball and bat by two teams of 11 players; teams take turns trying to score runs
v. play cricket"
set-up,n. the way something is organized or arranged
dismay,v. fill with apprehension or alarm; cause to be unpleasantly surprised
algebra,n. the mathematics of generalized arithmetical operations
geometry,n. the pure mathematics of points and lines and curves and surfaces
incompetent,"n. someone who is not competent to take effective action
a. legally not qualified or sufficient
a. not qualified or suited for a purpose
s. not doing a good job"
competent,"a. properly or sufficiently qualified or capable or efficient
s. adequate for the purpose
a. legally qualified or sufficient"
leisure,"n. time available for ease and relaxation
n. freedom to choose a pastime or enjoyable activity"
salary,n something that remunerates
plus,"a. on the positive side or higher end of a scale
s. involving advantage or good"
protest,"n. a formal and solemn declaration of objection
n. the act of protesting; a public (often organized) manifestation of dissent
n. the act of making a strong public expression of disagreement and disapproval
v. utter words of protest"
straw,"n. plant fiber used e.g. for making baskets and hats or as fodder
n. a thin paper or plastic tube used to suck liquids into the mouth
v. cover or provide with or as if with straw
s. of a pale yellow color like straw; straw-colored"
prospect,"n. the possibility of future success
v. search for something desirable
v. explore for useful or valuable things or substances, such as minerals"
constitute,v. form or compose
ultimate,"n. the finest or most superior quality of its kind
a. furthest or highest in degree or order; utmost or extreme
s. being the last or concluding element of a series"
indignity,n. an affront to one's dignity or self-esteem
be short of,none
smell of,none
judging by,none
attach importance to,none
in common,none
consist of,none
in turn,none
series,"n. similar things placed in order or happening one after another
n. a periodical that appears at scheduled times
n. (sports) several contests played successively by the same teams
n. (electronics) connection of components in such a manner that current flows first through one and then through the other"
disgust,"n. strong feelings of dislike
v. fill with distaste
v. cause aversion in; offend the moral sense of"
attitude,"n. a complex mental state involving beliefs and feelings and values and dispositions to act in certain ways
n. a theatrical pose created for effect
n. position of aircraft or spacecraft relative to a frame of reference (the horizon or direction of motion)"
optical,a. of or relating to or involving light or optics
sake,"n. a reason for wanting something done
n. Japanese alcoholic beverage made from fermented rice; usually served hot
n. the purpose of achieving or obtaining"
thunder,"n. a booming or crashing noise caused by air expanding along the path of a bolt of lightning
v. move fast, noisily, and heavily
v. utter words loudly and forcefully
v. be the case that thunder is being heard"
Negro,s. relating to or characteristic of or being a member of the traditional racial division of mankind having brown to black pigmentation and tightly curled hair
flight,"n. a formation of aircraft in flight
n. an instance of traveling by air
n. a stairway (set of steps) between one floor or landing and the next
n. an air force unit smaller than a squadron"
punch,"n. (boxing) a blow with the fist
n. an iced mixed drink usually containing alcohol and prepared for multiple servings; normally served in a punch bowl
n. a tool for making holes or indentations
v. deliver a quick blow to"
typewriter,n. hand-operated character printer for printing written messages one character at a time
mail,"n. the bags of letters and packages that are transported by the postal service
n. the system whereby messages are transmitted via the post office
n. a conveyance that transports the letters and packages that are conveyed by the postal system
n. any particular collection of letters or packages that is delivered"
worthy,"n. an important, honorable person (word is often used humorously)
a. having worth or merit or value; being honorable or admirable
s. having qualities or abilities that merit recognition in some way"
modest,"a. marked by simplicity; having a humble opinion of yourself
s. not large but sufficient in size or amount
s. free from pomp or affectation
a. not offensive to sexual mores in conduct or appearance"
yo-yo,n. a toy consisting of a spool that is reeled up and down on a string by motions of the hand
ease,"n. freedom from difficulty or hardship or effort
n. a freedom from financial difficulty that promotes a comfortable state
n. freedom from constraint or embarrassment
v. move gently or carefully"
display,"n. something intended to communicate a particular impression
n. something shown to the public
n. a visual representation of something
n. behavior that makes your feelings public"
loop,"n. anything with a round or oval shape (formed by a curve that is closed and does not intersect itself)
n. an inner circle of advisors (especially under President Reagan)
n. the basic pattern of the human fingerprint
n. a computer program that performs a series of instructions repeatedly until some specified condition is satisfied"
balance,"n. a state of equilibrium
n. equality between the totals of the credit and debit sides of an account
n. equality of distribution
n. the difference between the totals of the credit and debit sides of an account"
impress,"n. the act of coercing someone into government service
v. impress positively
v. produce or try to produce a vivid impression of
v. mark or stamp with or as if with pressure"
personality,"n. the complex of all the attributes--behavioral, temperamental, emotional and mental--that characterize a unique individual
n. a person of considerable prominence"
universe,"n. everything that exists anywhere
n. everything stated or assumed in a given discussion"
logic,"n. the branch of philosophy that analyzes inference
n. reasoned and reasonable judgment
n. the principles that guide reasoning within a given field or situation
n. the system of operations performed by a computer that underlies the machine's representation of logical operations"
simplicity,"n. the quality of being simple or uncompounded
n. a lack of penetration or subtlety
n. absence of affectation or pretense"
function,"n. (mathematics) a mathematical relation such that each element of a given set (the domain of the function) is associated with an element of another set (the range of the function)
n. what something is used for
n. the actions and activities assigned to or required or expected of a person or group
n. a relation such that one thing is dependent on another"
intellectual,"n. a person who uses the mind creatively
s. of or associated with or requiring the use of the mind
a. appealing to or using the intellect"
frustrate,"v hinder or prevent (the efforts, plans, or desires) of
v treat cruelly"
frustration,"n. the feeling that accompanies an experience of being thwarted in attaining your goals
n. an act of hindering someone's plans or efforts
n. a feeling of annoyance at being hindered or criticized"
jealousy,"n. a feeling of jealous envy (especially of a rival)
n. zealous vigilance"
jealous,s. suspicious or unduly suspicious or fearful of being displaced by a rival
vanity,n. the quality of being valueless or futile
ambition,"n. a cherished desire
n. a strong drive for success
v. have as one's ambition"
ambitious,"a. having a strong desire for success or achievement
s. requiring full use of your abilities or resources"
immune,"n. a person who is immune to a particular infection
a. relating to the condition of immunity
s. secure against
s. relating to or conferring immunity (to disease or infection)"
immunity,"n. (medicine) the condition in which an organism can resist disease
n. the quality of being unaffected by something"
emotion,n. any strong feeling
pretension,"n. a false or unsupportable quality
n. the advancing of a claim"
correspond,v. exchange messages
stationery,n. paper cut to an appropriate size for writing letters; usually with matching envelopes
watermark,n. a distinguishing mark impressed on paper during manufacture; visible when paper is held up to the light
pad,"n. a number of sheets of paper fastened together along one edge
n. the large floating leaf of an aquatic plant (as the water lily)
n. a block of absorbent material saturated with ink; used to transfer ink evenly to a rubber stamp
n. a flat mass of soft material used for protection, stuffing, or comfort"
razor,"n. edge tool used in shaving
v. shave with a razor"
shave,"n. the act of removing hair with a razor
v. remove body hair with a razor
v. cut closely
v. cut the price of"
shrug,"n. a gesture involving the shoulders
v. raise one's shoulders to indicate indifference or resignation"
finally,r. after an unspecified period of time or an especially long delay
tube,"n. conduit consisting of a long hollow object (usually cylindrical) used to hold and conduct objects or liquids or gases
n. electronic device consisting of a system of electrodes arranged in an evacuated glass or metal envelope
n. (anatomy) any hollow cylindrical body structure
v. provide with a tube or insert a tube into"
beam,"n. long thick piece of wood or metal or concrete, etc., used in construction
n. a group of nearly parallel lines of electromagnetic radiation
n. a column of light (as from a beacon)
n. (nautical) breadth amidships"
beard,"n. the hair growing on the lower part of a man's face
n. a tuft or growth of hairs or bristles on certain plants such as iris or grasses
n. a person who diverts suspicion from someone (especially a woman who accompanies a male homosexual in order to conceal his homosexuality)
n. hairy growth on or near the face of certain mammals"
thereafter,r. from that time on
revert,"v. go back to a previous state
v. undergo reversion, as in a mutation"
exclusively,r without any others being included or involved
exclusive,"n. a news report that is reported first by one news organization
s. not divided or shared with others
a. excluding much or all; especially all but a particular group or minority"
theorist,n. someone who theorizes (especially in science or art)
equation,"n. a mathematical statement that two expressions are equal
n. the act of regarding as equal"
application,"n. the act of bringing something to bear; using it for a particular purpose
n. a verbal or written request for assistance or employment or admission to a school
n. the work of applying something; 
n. a program that gives a computer instructions that provide the user with tools to accomplish a task"
theory,"n. a well-substantiated explanation of some aspect of the natural world; an organized system of accepted knowledge that applies in a variety of circumstances to explain a specific set of phenomena
n. a belief that can guide behavior"
theoretical,"a. concerned primarily with theories or hypotheses rather than practical considerations
a. concerned with theories rather than their practical applications"
reactor,n. an electrical device used to introduce reactance into a circuit
atomic,"a. of or relating to or comprising atoms
s. immeasurably small"
atom,"n. (physics and chemistry) the smallest component of an element having the chemical properties of the element
n. (nontechnical usage) a tiny piece of anything"
photoelectric,a. of or pertaining to photoelectricity
series,"n. similar things placed in order or happening one after another
n. a periodical that appears at scheduled times
n. (sports) several contests played successively by the same teams
n. (electronics) connection of components in such a manner that current flows first through one and then through the other"
curiosity,n. a state in which you want to learn more about something
observe,"v. watch attentively
v. behave as expected during of holidays or rites
v. stick to correctly or closely
v. conform one's action or practice to"
repeatedly,r. several time
dunk,"n. a basketball shot in which the basketball is propelled downward into the basket
v. immerse briefly into a liquid so as to wet, coat, or saturate
v. make a dunk shot, in basketball"
deduce,"v. reason by deduction; establish by deduction
v. conclude by reasoning; in logic"
deduction,"n. an amount or percentage deducted
n. something that is inferred (deduced or entailed or implied)
n. reasoning from the general to the particular (or from cause to effect)"
principle,"n. a basic generalization that is accepted as true and that can be used as a basis for reasoning or conduct
n. a rule or standard especially of good behavior
n. a basic truth or law or assumption
n. a rule or law concerning a natural phenomenon or the function of a complex system"
flaw,"n. defect or weakness in a person's character
n. an imperfection in a plan or theory or legal document that causes it to fail or that reduces its effectiveness
v. add a flaw or blemish to; make imperfect or defective"
reasoning,n. thinking that is coherent and logical
pursue,"v. follow in or as if in pursuit
v. carry further or advance"
approach,"n. ideas or actions intended to deal with a problem or situation
n. the act of drawing spatially closer to something
n. the event of one object coming closer to another
n. the temporal property of becoming nearer in time"
solution,"n. a homogeneous mixture of two or more substances; frequently (but not necessarily) a liquid solution
n. a statement that solves a problem or explains how to solve the problem
n. a method for solving a problem
n. the set of values that give a true statement when substituted into an equation"
puzzle,"n. a particularly baffling problem that is said to have a correct solution
n. a game that tests your ingenuity
v. be uncertain about; think about without fully understanding or being able to decide"
fame,"n. the state or quality of being widely honored and acclaimed
n. favorable public reputation"
profound,"a. showing intellectual penetration or emotional depth
s. of the greatest intensity; complete
s. coming from deep within one
s. situated at or extending to great depth; too deep to have been sounded or plumbed"
capable,"a. (usually followed by `of') having capacity or ability
s. possibly accepting or permitting
a. (followed by `of') having the temperament or inclination for"
capability,"n. the quality of being capable -- physically or intellectually or legally
n. the susceptibility of something to a particular treatment
n. an aptitude that may be developed"
household,n a social unit living together
household word,none
civilized,"a. having a high state of culture and development both social and technological
s. marked by refinement in taste and manners"
civilize,v. raise from a barbaric to a civilized state
civilization,"n. a society in an advanced state of social development (e.g., with complex legal and political and religious organizations)
n. the social process whereby societies achieve an advanced stage of development and organization"
bewilder,v. cause to be confused emotionally
statesman,n. a man who is a respected leader in national or international affairs
at ease,none
off balance,none
come to terms with,none
as far as,none
mean nothing to,none
believe in,none
so much so that,none
a series of,none
take apart,none
work out,n the activity of exerting your muscles in various ways to keep fit
capable of,none
single out,none
literature,"n. creative writing of recognized artistic value
n. the humanistic study of a body of literature
n. published writings in a particular style on a particular subject
n. the profession or art of a writer"
lover,"n. a person who loves someone or is loved by someone
n. a significant other to whom you are not related by marriage"
mankind,n all of the living human inhabitants of the earth
explosive,"n. a chemical substance that undergoes a rapid chemical change (with the production of gas) on being heated or struck
a. serving to explode or characterized by explosion or sudden outburst
s. liable to lead to sudden change or violence
s. sudden and loud"
weapon,"n. any instrument or instrumentality used in fighting or hunting
n. a means of persuading or arguing"
injure,v. cause injuries or bodily harm to
useless,a. having no beneficial use or incapable of functioning usefully
deserve,v. be worthy or deserving
skillful,"s having or showing knowledge and skill and aptitude
s done with delicacy and skill"
financial,a involving financial matters
outstanding,"s. distinguished from others in excellence
s. having a quality that thrusts itself into attention
s. owed as a debt"
original,"n. something that serves as a model or a basis for making copies
s. preceding all others in time or being as first made or performed
s. (of e.g. information) not secondhand or by way of something intermediary
a. being or productive of something fresh and unusual; or being as first made or thought of"
glory,"n. a state of high honor
n. brilliant radiant beauty
v. rejoice proudly"
villain,"n. a wicked or evil person; someone who does evil deliberately
n. the principal bad character in a film or work of fiction"
dioxide,n. an oxide containing two atoms of oxygen in the molecule
poisonous,"s. having the qualities or effects of a poison
s. not safe to eat
s. marked by deep ill will; deliberately harmful"
poison,"n. any substance that causes injury or illness or death of a living organism
n. anything that harms or destroys
v. spoil as if by poison
v. kill with poison"
essential,"s. absolutely necessary; vitally necessary
a. basic and fundamental
a. being or relating to or containing the essence of a plant etc"
convert,"n. a person who has been converted to another religious or political belief
v. change from one system to another or to a new plan or policy
v. change the nature, purpose, or function of something
v. change religious beliefs, or adopt a religious belief"
tissue,"n. part of an organism consisting of an aggregate of cells having a similar structure and function
n. a soft thin (usually translucent) paper"
liberate,v. grant freedom to
apparently,r. from appearances alone
apparent,"s. clearly revealed to the mind or the senses or judgment
s. appearing as such but not necessarily so"
likelihood,n. the probability of a specified outcome
low-lying,"s. having a small elevation above the ground or horizon or sea level
s. lying below the normal level"
coastal,"a. of or relating to a coast
a. located on or near or bordering on a coast"
fraction,"n. a component of a mixture that has been separated by a fractional process
n. a small part or item forming a piece of a whole
n. the quotient of two rational numbers"
steadily,"r. at a steady rate or pace
r. in a steady manner"
steady,"v. make steady
a. not subject to change or variation especially in behavior
s. securely in position; not shaky
s. not easily excited or upset"
inland,"a. situated away from an area's coast or border
r. towards or into the interior of a region"
splash,"n. the sound like water splashing
n. a patch of bright color
n. the act of scattering water about haphazardly
v. mark or overlay with patches of contrasting color or texture; cause to appear splashed or spattered"
beneath,r in or to a place that is lower
starvation,"n. a state of extreme hunger resulting from lack of essential nutrients over a prolonged period
n. the act of depriving of food or subjecting to famine"
starve,"v. be hungry; go without food
v. die of food deprivation
v. deprive of food
v. deprive of a necessity and cause suffering"
widespread,s. widely circulated or diffused
