marrow,"n. the fatty network of connective tissue that fills the cavities of bones
n. any of various squash plants grown for their elongated fruit with smooth dark green skin and whitish flesh
n. very tender and very nutritious tissue from marrowbones
n. large elongated squash with creamy to deep green skins"
merge,"v become one
v mix together different elements
v join or combine"
mode,"n. a particular functioning condition or arrangement
n. any of various fixed orders of the various diatonic notes within an octave
n. the most frequent value of a random variable"
nucleus,"n. a part of the cell containing DNA and RNA and responsible for growth and reproduction
n. the positively charged dense center of an atom
n. (astronomy) the center of the head of a comet; consists of small solid particles of ice and frozen gas that vaporizes on approaching the sun to form the coma and tail
n. any histologically identifiable mass of neural cell bodies in the brain or spinal cord"
odds,"n. the likelihood of a thing occurring rather than not occurring
n. the ratio by which one better's wager is greater than that of another"
pulse,"n. the rhythmic contraction and expansion of the arteries with each beat of the heart
n. the rate at which the heart beats; usually measured to obtain a quick evaluation of a person's health
n. edible seeds of various pod-bearing plants (peas or beans or lentils etc.)
v. produce or modulate (as electromagnetic waves) in the form of short bursts or pulses or cause an apparatus to produce pulses"
reject,"v. refuse to accept or acknowledge
v. reject with contempt
v. refuse entrance or membership"
rejection,"n. the act of rejecting something
n. the state of being rejected
n. (medicine) an immunological response that refuses to accept substances or organisms that are recognized as foreign"
release,"n. merchandise issued for sale or public showing (especially a record or film)
n. a process that liberates or discharges something
n. a device that when pressed will release part of a mechanism
n. activity that frees or expresses creative energy or emotion"
remission,"n. an abatement in intensity or degree (as in the manifestations of a disease)
n. (law) the act of remitting (especially the referral of a law case to another court)"
roar,"n. the sound made by a lion
v. make a loud noise, as of wind, water, or vehicles
v. act or proceed in a riotous, turbulent, or disorderly way
v. laugh unrestrainedly and heartily"
session,"n. a meeting for execution of a group's functions
n. a meeting devoted to a particular activity"
sibling,n. a person's brother or sister
soul-baring,none
therapy,n. (medicine) the act of caring for someone (as by medication or remedial training etc.)
transplant,"n. an operation moving an organ from one organism (the donor) to another (the recipient)
n. the act of removing something from one location and introducing it in another location
v. lift and reset in another soil or situation
v. be transplantable"
unapologetically,none
vein,"n. a blood vessel that carries blood from the capillaries toward the heart
n. a distinctive style or manner
n. any of the vascular bundles or ribs that form the branching framework of conducting and supporting tissues in a leaf or other plant organ
n. a layer of ore between layers of rock"
vulnerable,"a. susceptible to attack
s. susceptible to criticism or persuasion or temptation
s. capable of being wounded or hurt"
against the odds,none
clean up,n. (baseball) the fourth position in the batting order (usually filled by the best batter on the team)
get down to,none
in the case of,none
make sense of,none
put aside,none
turn out,"n. The act of coming forth; a leaving of houses, shops,
   etc.; esp., a quitting of employment for the purpose of forcing
   increase of wages; a strike; -- opposed to lockout.
n. A short side track on a railroad, which may be occupied
   by one train while another is passing on a main track; a shunt; a
   siding; a switch.
n. That which is prominently brought forward or exhibited;
   hence, an equipage; as, a man with a showy carriage and horses is said
   to have a fine turn-out.
n. The aggregate number of persons who have come out, as
   from their houses, for a special purpose.
n. Net quantity of produce yielded."
up to,none
activate,"v. make active or more active
v. make more adsorptive
v. aerate (sewage) so as to favor the growth of organisms that decompose organic matter
v. make (substances) radioactive"
address,"n. (computer science) the code that identifies where a piece of information is stored
n. the place where a person or organization can be found or communicated with
n. the act of delivering a formal spoken communication to an audience
n. the manner of speaking to another individual"
disconnect,"v. make disconnected, disjoin or unfasten"
legitimate,"v. show or affirm to be just and legitimate
v. make (an illegitimate child) legitimate; declare the legitimacy of (someone)
a. of marriages and offspring; recognized as lawful
s. based on known statements or events or conditions"
reset,"n. device for resetting instruments or controls
v. set anew
v. set to zero"
accessible,"a. capable of being reached
s. capable of being read with comprehension
s. easily obtained
s. easy to get along with or talk to; friendly"
accomplish,"v put in effect
v to gain with effort"
aware,a. (sometimes followed by `of') having or showing knowledge or understanding or realization or perception
backup,"n. an accumulation caused by clogging or a stoppage
n. (computer science) a copy of a file or directory on a separate storage device"
charge,"n. an impetuous rush toward someone or something
n. (criminal law) a pleading describing some wrong or offense
n. the price charged for some article or service
n. the quantity of unbalanced electricity in a body (either positive or negative) and construed as an excess or deficiency of electrons"
compel,"v. force somebody to do something
v. necessitate or exact"
contain,"v. be divisible by
v. be capable of holding or containing"
delay,"n. time during which some action is awaited
n. the act of delaying; inactivity resulting in something being put off until a later time
v. cause to be slowed down or delayed
v. act later than planned, scheduled, or required"
dispose,"v. give, sell, or transfer to another
v. make receptive or willing towards an action or attitude or belief
v. place or put in a particular order"
encrypt,v convert ordinary language into code
expose,"n. the exposure of an impostor or a fraud
v. expose or make accessible to some action or influence
v. to show, make visible or apparent
v. expose to light, of photographic film"
hassle,n. disorderly fighting
malicious,a. having the nature of or resulting from malice
nonetheless,r despite anything to the contrary (usually following a concession)
primary,"n. a preliminary election where delegates or nominees are chosen
n. one of the main flight feathers projecting along the outer edge of a bird's wing
n. (astronomy) a celestial body (especially a star) relative to other objects in orbit around it
a. of first rank or importance or value; direct and immediate rather than secondary"
promptly,"r. with little or no delay
r. in a punctual manner
r. at once (usually modifies an undesirable occurrence)"
rack,"n. framework for holding objects
n. rib section of a forequarter of veal or pork or especially lamb or mutton
n. an instrument of torture that stretches or disjoints or mutilates victims
n. a support for displaying various articles"
recycle,"v. cause to repeat a cycle
v. use again after processing"
replace,"v. substitute a person or thing for (another that is broken or inefficient or lost or no longer working or yielding what is expected)
v. put something back where it belongs"
snap,"n. a spell of cold weather
n. the noise produced by the rapid movement of a finger from the tip to the base of the thumb on the same hand
n. a sudden breaking
n. a fastener used on clothing; fastens with a snapping sound"
theft,n the act of taking something from someone unlawfully
transaction,n. the act of transacting within or between groups (as carrying on commercial activities)
unauthorized,"a. not endowed with authority
s. without official authorization"
unbiased,s. without bias
unique,"s. (followed by `to') applying exclusively to a given category or condition or locality
s. highly unusual or rare but not the single instance"
vendor,n someone who promotes or exchanges goods or services for money
wipe,v. rub with a circular motion
dispose of,none
steer clear of,none
take control of,none
track down,none
allegation,"n. (law) a formal accusation against somebody (often in a court of law)
n. statements affirming or denying certain matters of fact that you are prepared to prove"
breach,"n. a failure to perform some promised act or obligation
n. an opening (especially a gap in a dike or fortification)"
captivating,"v attract; cause to be enamored
s capturing interest as if by a spell"
conspiracy,"n. a secret agreement between two or more people to perform an unlawful act
n. a plot to carry out some harmful or illegal act (especially a political plot)
n. a group of conspirators banded together to achieve some harmful or illegal purpose"
entrepreneurial,"a. of or relating to an entrepreneur
s. willing to take risks in order to make a profit"
extort,"v. obtain through intimidation
v. obtain by coercion or intimidation
v. get or cause to become in a difficult or laborious manner"
hack,"n. one who works hard at boring tasks
n. a mediocre and disdained writer
n. a tool (as a hoe or pick or mattock) used for breaking up the surface of the soil
n. an old or over-worked horse"
high-stakes,none
lodging,n. the act of lodging
lure,n. qualities that attract by seeming to promise some kind of reward
machinations,n a crafty and involved plot to achieve your (usually sinister) ends
regale,v. provide with choice or abundant food or drink
restitution,"n. the act of restoring something to its original state
n. getting something back again"
snare,"n. a surgical instrument consisting of wire hoop that can be drawn tight around the base of polyps or small tumors to sever them; used especially in body cavities
n. strings stretched across the lower head of a snare drum; they make a rattling sound when the drum is hit
n. a trap for birds or small mammals; often has a slip noose"
sting,"n. a kind of pain; something as sudden and painful as being stung
n. a painful wound caused by the thrust of an insect's stinger into skin
v. deliver a sting to
v. cause an emotional pain, as if by stinging"
tactic,n. a plan for attaining a particular goal
charge ... with ...,none
on the money,none
right on the money,none
