circulation,"n. the dissemination of copies of periodicals (as newspapers or magazines)
n. movement through a circuit; especially the movement of blood through the heart and blood vessels
n. (library science) the count of books that are loaned by a library over a specified period
n. number of copies of a newspaper or magazine that are sold"
compete,v. compete for something; engage in a contest; measure oneself against others
competitive,"a. involving competition or competitiveness
s. subscribing to capitalistic competition
s. showing a fighting disposition"
complex,"n. a conceptual whole made up of complicated and related parts
n. a compound described in terms of the central atom to which other atoms are bound or coordinated
n. (psychoanalysis) a combination of emotions and impulses that have been rejected from awareness but still influence a person's behavior
a. complicated in structure; consisting of interconnected parts"
compromise,"n. a middle way between two extremes
n. an accommodation in which both sides make concessions
v. make a compromise; arrive at a compromise; we all must compromise""
v. settle by concession"
consumer,n. a person who uses goods or services
convey,"v. make known; pass on, of information
v. transfer to another
v. transmit a title or property"
counteract,v. oppose and mitigate the effects of by contrary actions
creativity,n. the ability to create
demographic,"n. a statistic characterizing human populations (or segments of human populations broken down by age or sex or income etc.)
a. of or relating to demography"
dispute,"n. a disagreement or argument about something important
n. coming into conflict with"
dominate,"v. be in control
v. have dominance or the power to defeat over
v. look down on"
economy,"n. the system of production and distribution and consumption
n. the efficient use of resources
n. frugality in the expenditure of money or resources
n. an act of economizing; reduction in cost"
edition,"n. the form in which a text (especially a printed book) is published
n. all of the identical copies of something offered to the public at the same time
n. an issue of a newspaper"
editorial,"a. of or relating to an article stating opinions or giving perspectives
a. relating to or characteristic of an editor"
embedded,"s. enclosed firmly in a surrounding mass
s. inserted as an integral part of a surrounding whole"
employ,"n the state of being employed or having a job
v put into service; make work or employ for a particular purpose or for its inherent or natural purpose
v engage or hire for work"
essential,"s. absolutely necessary; vitally necessary
a. basic and fundamental
a. being or relating to or containing the essence of a plant etc"
execute,"v. kill as a means of socially sanctioned punishment
v. murder in a planned fashion
v. carry out the legalities of
v. sign in the presence of witnesses"
expansion,"n. the act of increasing (something) in size or volume or quantity or scope
n. a function expressed as a sum or product of terms
n. a discussion that provides additional information"
financially,r. from a financial point of view
implant,"n. a prosthesis placed permanently in tissue
v. fix or set securely or deeply
v. become attached to and embedded in the uterus"
influence,"n. a power to affect persons or events especially power based on prestige etc
n. causing something without any direct or apparent effort
n. a cognitive factor that tends to have an effect on what you do
n. the effect of one thing (or person) on another"
inform,"v. impart knowledge of some fact, state or affairs, or event to
v. give character or essence to
v. act as an informer"
initial,"n. the first letter of a word (especially a person's name)
v. mark with one's initials
s. occurring at the beginning"
integrity,"n. an undivided or unbroken completeness or totality with nothing wanting
n. moral soundness"
intensely,r. in an intense manner
manufacturer,"n. a business engaged in manufacturing some product
n. someone who manufactures something"
matchbook,n. a small folder of paper safety matches
medieval,"a. relating to or belonging to the Middle Ages
s. as if belonging to the Middle Ages; old-fashioned and unenlightened"
miscellaneous,"s consisting of a haphazard assortment of different kinds
s having many aspects"
opportunity,n. a possibility due to a favorable combination of circumstances
orchestrate,v. write an orchestra score for
permit,"n. large game fish; found in waters of the West Indies
v. consent to, give permission"
personalized,s. pointedly referring to or concerning a person's individual personality or intimate affairs especially offensively
persuade,"v. cause somebody to adopt a certain position, belief, or course of action; twist somebody's arm"
pervasive,s spreading or spread throughout
poster,n. a sign posted in a public place as an advertisement
primarily,r. of primary import
promote,"v. contribute to the progress or growth of
v. give a promotion to or assign to a higher position
v. be changed for a superior chess or checker piece
v. change a pawn for a better piece by advancing it to the eighth row, or change a checker piece for a more valuable piece by moving it to the row closest to your opponent"
promotional,"a. of or relating to serving as publicity
a. of or relating to advancement"
regional,"a. characteristic of a region
s. related or limited to a particular region"
regular,"n. a regular patron
n. a soldier in the regular army
n. a dependable follower (especially in party politics)
n. a garment size for persons of average height and weight"
reliance,"n. certainty based on past experience
n. the state of relying on something"
schedule,"n. an ordered list of times at which things are planned to occur
v. plan for an activity or event
v. make a schedule; plan the time and place for events"
selective,"s. tending to select; characterized by careful choice
s. characterized by very careful or fastidious selection"
stance,n. standing posture
strategy,n. the branch of military science dealing with military command and the planning and conduct of a war
survival,"n. a state of surviving; remaining alive
n. a natural process resulting in the evolution of organisms best adapted to the environment
n. something that survives"
target,"n. a reference point to shoot at
n. the location of the target that is to be hit
n. sports equipment consisting of an object set up for a marksman or archer to aim at
v. intend (something) to move towards a certain goal"
transit,"v. make a passage or journey from one place to another
v. pass across (a sign or house of the zodiac) or pass across (the disk of a celestial body or the meridian of a place)
v. revolve (the telescope of a surveying transit) about its horizontal transverse axis in order to reverse its direction
v. cause or enable to pass through"
undue,"a. not yet payable
a. not appropriate or proper (or even legal) in the circumstances
s. lacking justification or authorization"
into being,none
come into being,none
up to,none
reliance on,none
such,"s. of so extreme a degree or extent
r. to so extreme a degree"
be such,none
result in,none
compete with,none
bring prices down,none
in response,none
point out,none
essential to,none
abuse,"n. a rude expression intended to offend or hurt
v. use foul or abusive language towards
v. use wrongly or improperly or excessively"
assault,"n. close fighting during the culmination of a military attack
n. a threatened or attempted physical attack by someone who appears to be able to cause bodily harm if not stopped
n. thoroughbred that won the triple crown in 1946"
bargain,"n. an agreement between parties (usually arrived at after discussion) fixing obligations of each
n. an advantageous purchase
v. come to terms; arrive at an agreement"
blatantly,r. in a blatant manner
bombardment,n. the act (or an instance) of subjecting a body or substance to the impact of high-energy particles (as electrons or alpha rays)
chatter,"n. the rapid series of noises made by the parts of a machine
n. the high-pitched continuing noise made by animals (birds or monkeys)
v. click repeatedly or uncontrollably
v. cut unevenly with a chattering tool"
dandruff,"n. a condition in which white scales of dead skin are shed by the scalp
n. loose scales shed from the scalp"
destructive,a. causing destruction or much damage
discard,"n. anything that is cast aside or discarded
n. (cards) the act of throwing out a useless card or of failing to follow suit
n. getting rid something that is regarded as useless or undesirable
v. throw or cast away"
discreetly,r. with discretion; prudently and with wise self-restraint
disguise,"n. an outward semblance that misrepresents the true nature of something
n. any attire that modifies the appearance in order to conceal the wearer's identity
n. the act of concealing the identity of something by modifying its appearance
v. make unrecognizable"
elaborate,"v. add details, as to an account or idea; clarify the meaning of and discourse in a learned way, usually in writing
v. produce from basic elements or sources; change into a more developed product
v. work out in detail
s. marked by complexity and richness of detail"
eliminate,"v. kill in large numbers
v. remove from a contest or race
v. remove (an unknown variable) from two or more equations"
finance,"n. the commercial activity of providing funds and capital
n. the branch of economics that studies the management of money and other assets
n. the management of money and credit and banking and investments
v. obtain or provide money for"
intelligence,"n. the ability to comprehend; to understand and profit from experience
n. a unit responsible for gathering and interpreting information about an enemy
n. secret information about an enemy (or potential enemy)
n. the operation of gathering information about an enemy"
jolt,"n. a sudden jarring impact
v. move or cause to move with a sudden jerky motion
v. disturb (someone's) composure"
methodically,r. in a methodical manner
numb,"v. make numb or insensitive
s. so frightened as to be unable to move; stunned or paralyzed with terror; petrified"
omnipresent,s. being present everywhere at once
onslaught,n. a sudden and severe onset of trouble
relentless,"s not to be placated or appeased or moved by entreaty
s never-ceasing"
reveal,v. disclose directly or through prophets
roundabout,"n a road junction at which traffic streams circularly around a central island
n a large, rotating machine with seats for children to ride or amusement
s marked by obliqueness or indirection in speech or conduct
s deviating from a straight course"
shampoo,"n. cleansing agent consisting of soaps or detergents used for washing the hair
n. the act of washing your hair with shampoo
v. use shampoo on (hair)"
sponsor,"v. assume sponsorship of
v. assume responsibility for or leadership of"
spray,"n. a pesticide in suspension or solution; intended for spraying
n. a quantity of small objects flying through the air
n. flower arrangement consisting of a single branch or shoot bearing flowers and foliage
n. water in small drops in the atmosphere; blown from waves or thrown up by a waterfall"
stage,"n. a large platform on which people can stand and can be seen by an audience
n. the theater as a profession (usually `the stage')
n. a section or portion of a journey or course
n. any scene regarded as a setting for exhibiting or doing something"
undisputed,s. generally agreed upon; not subject to dispute
unscrupulous,a. without scruples or principles
vacancy,n. being unoccupied
be taken in,none
carry on,none
come in,none
come in contact with,none
cut down,none
cut down on,none
in short,none
in the midst of,none
play a major role,none
pick out,none
turn a blind eye,none
turn a blind eye to,none
weed out,none
acclaim,"n. enthusiastic approval
v. praise vociferously"
concubine,n. a woman who cohabits with an important man
Diva,n a distinguished female operatic singer; a female operatic star
debut,"n. the presentation of a debutante in society
v. present for the first time to the public
v. appear for the first time in public
v. make one's debut"
portrayal,"n. a word picture of a person's appearance and character
n. acting the part of a character on stage; dramatically representing the character by speech and action and gesture"
resume,"v. take up or begin anew
v. return to a previous location or condition
v. assume anew"
seizure,"n. a sudden occurrence (or recurrence) of a disease
n. the taking possession of something by legal process"
territory,"n. an area of knowledge or interest
n. the geographical area under the jurisdiction of a sovereign state"
tragicomedy,n. a dramatic composition involving elements of both tragedy and comedy usually with the tragic predominating
transcend,"v be greater in scope or size than some standard
v be superior or better than some standard"
version,"n. an interpretation of a matter from a particular viewpoint
n. something a little different from others of the same type
n. manual turning of a fetus in the uterus (usually to aid delivery)"
withdraw,"v. pull back or move away or backward
v. remove (a commodity) from (a supply source)"
make one's debut,none
settle in,none
acrobatics,"n. the gymnastic moves of an acrobat
n. the performance of stunts while in flight in an aircraft"
advocate,"n. a person who pleads for a cause or propounds an idea
n. a lawyer who pleads cases in court"
aftermath,n. the consequences of an event (especially a catastrophic event)
alienation,"n. the feeling of being alienated from other people
n. separation resulting from hostility
n. (law) the voluntary and absolute transfer of title and possession of real property from one person to another"
ban,"n. 100 bani equal 1 leu in Moldova
n. 100 bani equal 1 leu in Romania
n. an official prohibition or edict against something
v. forbid the public distribution of ( a movie or a newspaper)"
calamitous,s (of events) having extremely unfortunate or dire consequences; bringing ruin
catastrophe,"n. a state of extreme (usually irremediable) ruin and misfortune
n. a sudden violent change in the earth's surface"
civilian,"n. a nonmilitary citizen
a. associated with civil life or performed by persons who are not active members of the military"
declare,"v. state emphatically and authoritatively
v. state firmly
v. declare to be
v. authorize payments of"
despite,n. contemptuous disregard
dissolve,"n. (film) a gradual transition from one scene to the next; the next scene is gradually superimposed as the former scene fades out
v. become weaker
v. cause to go into a solution
v. come to an end"
dowager,n. a widow holding property received from her deceased husband
drama,"n. an episode that is turbulent or highly emotional
n. the literary genre of works intended for the theater
n. the quality of being arresting or highly emotional"
dynasty,n. a sequence of powerful leaders in the same family
elegant,"a. refined and tasteful in appearance or behavior or style
s. suggesting taste, ease, and wealth
s. displaying effortless beauty and simplicity in movement or execution"
elite,n. a group or class of persons enjoying superior intellectual or social or economic status
emperor,"n. the male ruler of an empire
n. red table grape of California
n. large moth of temperate forests of Eurasia having heavily scaled transparent wings"
empress,n. a woman emperor or the wife of an emperor
equality,"n. the quality of being the same in quantity or measure or value or status
n. a state of being essentially equal or equivalent; equally balanced"
establish,"v. set up or found
v. set up or lay the groundwork for
v. bring about
v. use as a basis for; found on"
exclusively,r without any others being included or involved
feat,n. a notable achievement
feature,"n. a prominent attribute or aspect of something
n. the characteristic parts of a person's face: eyes and nose and mouth and chin
n. the principal (full-length) film in a program at a movie theater
n. a special or prominent article in a newspaper or magazine"
imperial,"n. a small tufted beard worn by Emperor Napoleon III
n. a piece of luggage carried on top of a coach
a. relating to or associated with an empire
a. of or belonging to the British Imperial System of weights and measures"
impersonate,"v. assume or act the character of
v. represent another person with comic intentions"
individual,"n. a single organism
a. being or characteristic of a single thing or person
s. separate and distinct from others of the same kind
s. characteristic of or meant for a single person or thing"
maestro,n. an artist of consummate skill
military,"n. the military forces of a nation
a. of or relating to the study of the principles of warfare
a. characteristic of or associated with soldiers or the military
a. associated with or performed by members of the armed services as contrasted with civilians"
muddle,v. make into a puddle
nobility,"n. a privileged class holding hereditary titles
n. the quality of elevation of mind and exaltation of character or ideals or conduct
n. the state of being of noble birth"
notably,r. especially; in particular
occasion,"n. reason
n. the time of a particular event
n. an opportunity to do something
v. give occasion to"
opera,"n. a drama set to music; consists of singing with orchestral accompaniment and an orchestral overture and interludes
n. a commercial browser
n. a building where musical dramas are performed"
originate,"v. come into existence; take on form or shape
v. bring into being
v. begin a trip at a certain point, as of a plane, train, bus, etc."
patron,"n. a regular customer
n. the proprietor of an inn
n. someone who supports or champions something"
perform,"v. carry out or perform an action
v. perform a function
v. give a performance (of something)"
prosperous,"s in fortunate circumstances financially; moderately rich
s very lively and profitable
s marked by peace and prosperity
s presaging or likely to bring good luck"
relatively,r. in a relative manner; by comparison to something else
revive,"v. be brought back to life, consciousness, or strength
v. restore from a depressed, inactive, or unused state"
revolutionary,"s. markedly new or introducing radical change
a. relating to or having the nature of a revolution
a. advocating or engaged in revolution"
revolve,v. turn on or around an axis or a center
royal,"n. a sail set next above the topgallant on a royal mast
n. stag with antlers of 12 or more branches
a. of or relating to or indicative of or issued or performed by a king or queen or other monarch
a. established or chartered or authorized by royalty"
seasoned,"a. aged or processed
s. rendered competent through trial and experience"
summon,"v. call in an official matter, such as to attend court
v. ask to come"
talent,n. a person who possesses unusual innate ability in some field or activity
theme,"n. a unifying idea that is a recurrent element in literary or artistic work
n. (music) melodic subject of a musical composition
v. provide with a particular theme or motive"
thrilling,s. causing quivering or shivering as by cold or fear or electric shock
troupe,n organization of performers and associated personnel (especially theatrical)
venue,"n. the scene of any event or action (especially the place of a meeting)
n. in law: the jurisdiction where a trial will be held"
veteran,"n. a serviceman who has seen considerable active service
n. a person who has served in the armed forces
n. an experienced person who has been through many battles; someone who has given long service"
compared to,none
up until,none
fall into a category,none
revolve around,none
establish itself,none
turning point,none
strike out,n. an out resulting from the batter getting three strikes
on one's own,none
experiment with,none
take on,none
make an impression on,none
deal with,none
archaeologist,n an anthropologist who studies prehistoric people and their culture
calligraphy,n. beautiful handwriting
characterize,v. be characteristic of
civil,"s. applying to ordinary citizens as contrasted with the military
a. not rude; marked by satisfactory (or especially minimal) adherence to social usages and sufficient but not noteworthy consideration for others
a. of or occurring within the state or between or among citizens of the state
a. of or relating to or befitting citizens as individuals"
compose,"v. form the substance of
v. write music
v. put together out of existing material
v. calm (someone, especially oneself); make quiet"
composition,"n. the spatial property resulting from the arrangement of parts in relation to each other and to the whole
n. a mixture of ingredients
n. an essay (especially one written as an assignment)
n. something that is created by arranging several things to form a unified whole"
considerably,r to a great extent or degree
curtail,"v place restrictions on
v terminate or abbreviate before its intended or proper end or its full extent"
demonstrate,v. march in protest; take part in a demonstration
disorderly,"a. undisciplined and unruly
s. in utter disorder"
enforce,"v. ensure observance of laws and rules; 
v. compel to behave in a certain way"
engrave,"v. impress or affect deeply
v. carve or cut into a block used for printing or print from such a block
v. carve or cut a design or letters into"
establish,"v. set up or found
v. set up or lay the groundwork for
v. bring about
v. use as a basis for; found on"
even,"v. become even or more even
v. make even or more even
a. divisible by two
s. equal in degree or extent or amount; or equally matched or balanced"
exponent,"n. someone who expounds and interprets or explains
n. a mathematical notation indicating the number of times a quantity is multiplied by itself"
flexible,"a. capable of being changed
a. able to flex; able to bend easily
s. bending and snapping back readily without breaking"
horizontal,"n. something that is oriented horizontally
a. parallel to or in the plane of the horizon or a base line"
imaginary,"n (mathematics) a number of the form a+bi where a and b are real numbers and i is the square root of -1
s not based on fact; unreal"
incise,v. make an incision into by carving or cutting
inscription,"n. letters inscribed (especially words engraved or carved) on something
n. the activity of inscribing (especially carving or engraving) letters or words"
inspiration,"n. arousal of the mind to special unusual activity or creativity
n. a product of your creative thinking and work
n. a sudden intuition as part of solving a problem"
literal,"s. without interpretation or embellishment
a. limited to the explicit meaning of a word or text
s. avoiding embellishment or exaggeration (used for emphasis)"
logograph,n a single written symbol that represents an entire word or phrase without indicating its pronunciation
mythical,s based on or told of in traditional stories; lacking factual basis or historical validity
oracle,"n. a prophecy (usually obscure or allegorical) revealed by a priest or priestess; believed to be infallible
n. a shrine where an oracular god is consulted"
orderly,"n. a soldier who serves as an attendant to a superior officer
n. a male hospital attendant who has general duties that do not involve the medical treatment of patients
a. devoid of violence or disruption"
paleographer,n. an archeologist skilled in paleography
pictorial,"n. a periodical (magazine or newspaper) containing many pictures
a. pertaining to or consisting of pictures"
predominate,"v. be larger in number, quantity, power, status or importance"
preserve,"n. a domain that seems to be specially reserved for someone
n. a reservation where animals are protected
v. prevent (food) from rotting
v. keep undisturbed for personal or private use for hunting, shooting, or fishing"
prognostication,"n a sign of something about to happen
n a statement made about the future
n knowledge of the future (usually said to be obtained from a divine source)"
rectangular,s. having four right angles
represent,"v. take the place of or be parallel or equivalent to
v. be representative or typical for
v. be a delegate or spokesperson for; represent somebody's interest or be a proxy or substitute for, as of politicians and office holders representing their constituents, or of a tenant representing other tenants in a housing dispute
v. serve as a means of expressing something"
resemblance,n. similarity in appearance or external or superficial details
retouch,v. give retouches to (hair)
rigid,"s. incapable of or resistant to bending
s. incapable of compromise or flexibility
a. designating an airship or dirigible having a form maintained by a stiff unyielding frame or structure"
ritual,"n. any customary observance or practice
n. the prescribed procedure for conducting religious ceremonies
n. stereotyped behavior
a. of or relating to or characteristic of religious rituals"
script,"n. a written version of a play or other dramatic composition; used in preparing for a performance
n. a particular orthography or writing system
v. write a script for"
slight,"v. pay no attention to, disrespect"
simplified,s. made easy or uncomplicated
stroke,"n. (sports) the act of swinging or striking at a ball with a club or racket or bat or cue or hand
n. a sudden loss of consciousness resulting when the rupture or occlusion of a blood vessel leads to oxygen lack in the brain
n. a light touch
n. a light touch with the hands"
stylized,"v represent according to a conventional style
s using artistic forms and conventions to create effects; not natural or spontaneous"
tension,"n. (psychology) a state of mental or emotional strain or suspense
n. the physical condition of being stretched or strained
n. a balance between and interplay of opposing elements or tendencies (especially in art or literature)
n. (physics) a stress that produces an elongation of an elastic physical body"
