heated,"s. made warm or hot (`het' is a dialectal variant of `heated')
s. marked by emotional heat; vehement"
unexpected,a. not expected or anticipated
naturalist,"n. an advocate of the doctrine that the world can be understood in scientific terms
n. a biologist knowledgeable about natural history (especially botany and zoology)"
shortly,"r. for a short time
r. at a short distance"
colonial,"n. a resident of a colony
a. of or relating to or characteristic of or inhabiting a colony
a. of animals who live in colonies, such as ants
s. composed of many distinct individuals united to form a whole or colony"
spacious,"s very large in expanse or scope
s (of buildings and rooms) having ample space"
bare,"v. lay bare
s. completely unclothed
s. lacking in amplitude or quantity
a. lacking its natural or customary covering"
marble,"n. a hard crystalline metamorphic rock that takes a high polish; used for sculpture and as building material
n. a small ball of glass that is used in various games
n. a sculpture carved from marble
v. paint or stain like marble"
rafter,"n. one of several parallel sloping beams that support a roof
v. provide (a ceiling) with rafters"
veranda,n. a porch along the outside of a building (sometimes partly enclosed)
spirited,"a. displaying animation, vigor, or liveliness"
outgrow,"v. grow too large or too mature for
v. grow faster than"
era,"n. a period marked by distinctive character or reckoned from a fixed point or event
n. a major division of geological time; an era is usually divided into two or more periods"
reaction,"n. an idea evoked by some experience
n. a bodily process occurring due to the effect of some antecedent stimulus or agent
n. (mechanics) the equal and opposite force that is produced when any force is applied to a body
n. a response that reveals a person's feelings or attitude"
react,"v. show a response or a reaction to something
v. act against or in opposition to
v. undergo a chemical reaction; react with another substance under certain conditions"
crisis,"n. an unstable situation of extreme danger or difficulty
n. a crucial stage or turning point in the course of something"
ounce,"n. a unit of apothecary weight equal to 480 grains or one twelfth of a pound
n. a unit of weight equal to one sixteenth of a pound or 16 drams or 28.349 grams"
argument,"n. a fact or assertion offered as evidence that something is true
n. a discussion in which reasons are advanced for and against some proposition or proposal
n. a summary of the subject or plot of a literary work or play or movie
n. (computer science) a reference or value that is passed to a function, procedure, subroutine, command, or program"
hostess,"n. a woman host
n. a woman innkeeper"
muscle,"n. one of the contractile organs of the body
n. animal tissue consisting predominantly of contractile cells
n. authority or power or force (especially when used in a coercive way)
v. make one's way by force"
contract,"n. a binding agreement between two or more persons that is enforceable by law
n. (contract bridge) the highest bid becomes the contract setting the number of tricks that the bidder must make
n. a variety of bridge in which the bidder receives points toward game only for the number of tricks he bid
v. enter into a contractual arrangement"
contraction,"n. (physiology) a shortening or tensing of a part or organ (especially of a muscle or muscle fiber)
n. a word formed from two or more words by omitting or combining some sounds
n. the act of decreasing (something) in size or volume or quantity or scope"
motion,"n. a change of position that does not entail a change of location
n. a state of change
n. a formal proposal for action made to a deliberative assembly for discussion and vote
n. the act of changing location from one place to another"
widen,"v. become broader or wider or more extensive
v. make wider
v. extend in scope or range or area"
bait,"n. anything that serves as an enticement
n. something used to lure fish or other animals into danger so they can be trapped or killed
v. lure, entice, or entrap with bait
v. attack with dogs or set dogs upon"
cobra,n. venomous Asiatic and African elapid snakes that can expand the skin of the neck into a hood
likely,"a. has a good chance of being the case or of coming about
s. expected to become or be; in prospect
s. within the realm of credibility"
impulse,n. the act of applying force suddenly
commotion,n. the act of making a noisy disturbance
commanding,s. used of a height or viewpoint
forfeit,"n. something that is lost or surrendered as a penalty; 
n. a penalty for a fault or mistake that involves losing or giving up something
n. the act of losing or surrendering something as a penalty for a mistake or fault or failure to perform etc.
v. lose (s.th.) or lose the right to (s.th.) by some error, offense, or crime"
rupee,"n the basic unit of money in Sri Lanka; equal to 100 cents
n the basic unit of money in Seychelles; equal to 100 cents
n the basic unit of money in Nepal; equal to 100 paisa
n the basic unit of money in Mauritius; equal to 100 cents
n the basic unit of money in Pakistan; equal to 100 paisa
n the basic unit of money in India; equal to 100 paise"
image,"n. an iconic mental representation
n. (mathematics) the set of values of the dependent variable for which a function is defined
n. the general impression that something (a person or organization or product) presents to the public
v. render visible, as by means of MRI"
emerge,"v. come out into view, as from concealment
v. become known or apparent
v. come up to the surface of or rise"
emergence,"n. the gradual beginning or coming forth
n. the becoming visible
n. the act of emerging"
slam,"n. winning all or all but one of the tricks in bridge
n. the noise made by the forceful impact of two objects
n. a forceful impact that makes a loud noise
v. close violently"
host,"n. a person who invites guests to a social event (such as a party in his or her own home) and who is responsible for them while they are there
n. an animal or plant that nourishes and supports a parasite; it does not benefit and is often harmed by the association
n. archaic terms for army
n. any organization that provides resources and facilities for a function or event"
faint,"n. a spontaneous loss of consciousness caused by insufficient blood to the brain
v. pass out from weakness, physical or emotional distress due to a loss of blood supply to the brain
s. deficient in magnitude; barely perceptible; lacking clarity or brightness or loudness etc
s. lacking strength or vigor"
crawl,"n. a very slow movement
n. a swimming stroke; arms are moved alternately overhead accompanied by a flutter kick
n. a slow mode of locomotion on hands and knees or dragging the body
v. move slowly; in the case of people or animals with the body near the ground"
track down,none
be seated,none
spring up,none
at the sight of,none
feel like,none
come to,none
make for,none
ring out,none
light up,none
steep,"n. a steep place (as on a hill)
v. devote (oneself) fully to
v. let sit in a liquid to extract a flavor or to cleanse
a. having a sharp inclination"
despite,n. contemptuous disregard
pace,"n. the rate of moving (especially walking or running)
n. the relative speed of progress or change
n. a step in walking or running
v. walk with slow or fast paces"
overtake,v. catch up with and possibly overtake
wander,v. go via an indirect route or at no set pace
male,"n. an animal that produces gametes (spermatozoa) that can fertilize female gametes (ova)
n. a person who belongs to the sex that cannot have babies
n. the capital of Maldives in the center of the islands
a. being the sex (of plant or animal) that produces gametes (spermatozoa) that perform the fertilizing function in generation"
cheerful,"a. being full of or promoting cheer; having or showing good spirits
s. pleasantly (even unrealistically) optimistic"
noticeable,"a. capable or worthy of being perceived
s. readily noticed"
bounce,"n. the quality of a substance that is able to rebound
n. rebounding from an impact (or series of impacts)
v. spring back; spring away from an impact
v. hit something so that it bounces"
possess,"v. have as an attribute, knowledge, or skill
v. enter into and control, as of emotions or ideas"
distinction,"n. a distinguishing quality
n. a distinguishing difference"
sex,"n. either of the two categories (male or female) into which most organisms are divided
n. all of the feelings resulting from the urge to gratify sexual impulses
n. the properties that distinguish organisms on the basis of their reproductive roles
v. tell the sex (of young chickens)"
assume,"v. take to be the case or to be true; accept without verification or proof
v. take on titles, offices, duties, responsibilities
v. take on a certain form, attribute, or aspect
v. occupy or take on"
skilled,a. having or showing or requiring special skill
demonstrate,v. march in protest; take part in a demonstration
declaration,"n. a statement that is emphatic and explicit (spoken or written)
n. (law) unsworn statement that can be admitted in evidence in a legal transaction
n. a statement of taxable goods or of dutiable properties"
independence,"n. freedom from control or influence of another or others
n. the successful ending of the American Revolution
n. a city in western Missouri; the beginning of the Santa Fe Trail"
obtain,v. come into possession of
besides,"r. making an additional point; anyway; besides, we can't afford it""
r. in addition"
investigation,n. the work of inquiring into something thoroughly and systematically
examination,"n. the act of examining something closely (as for mistakes)
n. a set of questions or exercises evaluating skill or knowledge
n. the act of giving students or candidates a test (as by questions) to determine what they know or have learned"
investigate,"v. investigate scientifically
v. conduct an inquiry or investigation of"
appoint,"v. create and charge with a task or function
v. assign a duty, responsibility or obligation to
v. furnish"
appointment,"n. the act of putting a person into a non-elective position
n. (usually plural) furnishings and equipment (especially for a ship or hotel)
n. the job to which you are (or hope to be) appointed
n. (law) the act of disposing of property by virtue of the power of appointment"
committee,"n. a special group delegated to consider some matter
n. a self-constituted organization to promote something"
capitol,"n. a building occupied by a state legislature
n. the government building in Washington where the United States Senate and the House of Representatives meet"
canoe,"n. small and light boat; pointed at both ends; propelled with a paddle
v. travel by canoe"
on-the-spot,s. at the scene of action
humble,"v. cause to be unpretentious
s. low or inferior in station or quality
a. marked by meekness or modesty; not arrogant or prideful
s. used of unskilled work (especially domestic work)"
origin,"n. properties attributable to your ancestry
n. an event that is a beginning; a first part or stage of subsequent events
n. the point of intersection of coordinate axes; where the values of the coordinates are all zero
n. the source of something's existence or from which it derives or is derived"
gardener,"n. someone who takes care of a garden
n. someone employed to work in a garden"
nobleman,n a titled peer of the realm
dissatisfy,v. fail to satisfy
dissatisfied,"v fail to satisfy
s in a state of sulky dissatisfaction"
threaten,"v. to utter intentions of injury or punishment against:""He threatened me when I tried to call the police""
v. to be a menacing indication of something:""The clouds threaten rain"""
threat,"n. a warning that something unpleasant is imminent
n. declaration of an intention or a determination to inflict harm on another"
reject,"v. refuse to accept or acknowledge
v. reject with contempt
v. refuse entrance or membership"
rejection,"n. the act of rejecting something
n. the state of being rejected
n. (medicine) an immunological response that refuses to accept substances or organisms that are recognized as foreign"
nephew,n. a son of your brother or sister
error,"n. a misconception resulting from incorrect information
n. (baseball) a failure of a defensive player to make an out when normal play would have sufficed
n. departure from what is ethically acceptable
n. (computer science) the occurrence of an incorrect result produced by a computer"
judgment,"n. an opinion formed by judging something
n. the act of judging or assessing a person or situation or event
n. (law) the determination by a court of competent jurisdiction on matters submitted to it
n. the cognitive process of reaching a decision or drawing conclusions"
hesitate,"v. pause or hold back in uncertainty or unwillingness
v. interrupt temporarily an activity before continuing"
hesitation,"n. indecision in speech or action
n. the act of pausing uncertainly"
conflict,"n. an open clash between two opposing groups (or individuals)
n. opposition between two simultaneous but incompatible feelings
n. a state of opposition between persons or ideas or interests
n. an incompatibility of dates or events"
unquestioning,s. not inclined to ask questions
criticism,"n. disapproval expressed by pointing out faults or shortcomings
n. a serious examination and judgment of something
n. a written evaluation of a work of literature"
critic,"n. a person who is professionally engaged in the analysis and interpretation of works of art
n. anyone who expresses a reasoned judgment of something
n. someone who frequently finds fault or makes harsh and unfair judgments"
philosophy,"n. the rational investigation of questions about existence and knowledge and ethics
n. any personal belief about how to live or how to deal with a situation"
resent,v. feel bitter or indignant about
action,"n. something done (usually as opposed to something said)
n. the state of being active
n. the series of events that form a plot
n. the trait of being active and energetic and forceful"
perpetual,"s continuing forever or indefinitely
s uninterrupted in time and indefinitely long continuing"
constitution,"n. the act of forming or establishing something
n. the way in which someone or something is composed
n. a United States 44-gun frigate that was one of the first three naval ships built by the United States; it won brilliant victories over British frigates during the War of 1812 and is without doubt the most famous ship in the history of the United States Navy; it has been rebuilt and is anchored in the Charlestown Navy Yard in Boston"
remark,"n. a statement that expresses a personal opinion or belief or adds information
n. explicit notice"
evil,"n. morally objectionable behavior
n. that which causes harm or destruction or misfortune; the good is oft interred with their bones""- Shakespeare
n. the quality of being morally wrong in principle or practice
a. morally bad or wrong"
idealism,"n. (philosophy) the philosophical theory that ideas are the only reality
n. impracticality by virtue of thinking of things in their ideal form rather than as they really are"
archeology,n. the branch of anthropology that studies prehistoric people and their cultures
archaeology,n the branch of anthropology that studies prehistoric people and their cultures
rotation,"n. the act of rotating as if on an axis
n. (mathematics) a transformation in which the coordinate axes are rotated by a fixed angle about the origin
n. a single complete turn (axial or orbital)"
rotate,"v. exchange on a regular basis
v. perform a job or duty on a rotating basis
v. cause to turn on an axis or center"
conservation,"n. an occurrence of improvement by virtue of preventing loss or injury or other change
n. the preservation and careful management of the environment and of natural resources
n. (physics) the maintenance of a certain quantities unchanged during chemical reactions or physical transformations"
conserve,"n. fruit preserved by cooking with sugar
v. keep constant through physical or chemical reactions or evolutionary change
v. keep in safety and protect from harm, decay, loss, or destruction
v. use cautiously and frugally"
superior,"n. one of greater rank or station or quality
n. the head of a religious community
n. a town in northwest Wisconsin on Lake Superior across from Duluth
a. of high or superior quality or performance"
superiority,"n. the quality of being superior
n. the quality of being at a competitive advantage
n. displaying a sense of being better than others"
existence,"n the state or fact of existing
n everything that exists anywhere"
influence,"n. a power to affect persons or events especially power based on prestige etc
n. causing something without any direct or apparent effort
n. a cognitive factor that tends to have an effect on what you do
n. the effect of one thing (or person) on another"
architecture,"n. an architectural product or work
n. the discipline dealing with the principles of design and construction and ornamentation of fine buildings
n. the profession of designing buildings and environments with consideration for their esthetic effect"
tireless,"s showing sustained enthusiastic action with unflagging vitality
s characterized by hard work and perseverance"
writer,"n. writes (books or stories or articles or the like) professionally (for pay)
n. a person who is able to write and has written something"
volume,"n. the amount of 3-dimensional space occupied by an object
n. a publication that is one of a set of several similar publications
n. a relative amount
n. the magnitude of sound (usually in a specified direction)"
thrill,"n. something that causes you to experience a sudden intense feeling or sensation
v. cause to be thrilled by some perceptual input
v. feel sudden intense sensation or emotion"
self-evident,s evident without proof or argument
create,"v. bring into existence
v. pursue a creative activity; be engaged in a creative activity
v. invest with a new title, office, or rank
v. create by artistic means"
creation,"n. the human act of creating
n. an artifact that has been brought into existence by someone
n. the event that occurred at the beginning of something
n. (theology) God's act of bringing the universe into existence"
anniversary,n. the date on which an event occurred in some previous year (or the celebration of it)
countryman,"n. a man from your own country
n. a man who lives in the country and has country ways"
legacy,n (law) a gift of personal property by will
debt,"n. the state of owing something (especially money)
n. money or goods or services owed by one person to another
n. an obligation to pay or do something"
educate,"v. give an education to
v. teach or refine to be discriminative in taste or judgment"
go out of one's way,none
go out of one's way to do sth.,none
leave ... to,none
act on,"n. A stuffed jacket worn under the mail, or (later) a jacket
   plated with mail."
leave behind,none
in existence,"n. Inherence; subsistence.
n. That which exists within; a constituent.
n. Want of being or existence."
above all,none
owe ... to,none
leader,n. a person who rules or guides or inspires others
border,"n. a strip forming the outer edge of something
v. provide with a border or edge
v. lie adjacent to another or share a boundary"
worship,"n. the activity of worshipping
n. a feeling of profound love and admiration
v. show devotion to (a deity)
v. attend religious services"
memorial,"n. a recognition of meritorious service
n. a written statement of facts submitted in conjunction with a petition to an authority
n. a structure erected to commemorate persons or events"
unlike,"a. marked by dissimilarity
a. not equal in amount"
temple,"n. place of worship consisting of an edifice for the worship of a deity
n. the flat area on either side of the forehead
n. an edifice devoted to special or exalted purposes"
Greek,"n. the Hellenic branch of the Indo-European family of languages
n. a native or inhabitant of Greece
a. of or relating to or characteristic of Greece or the Greeks or the Greek language"
annual,"n. (botany) a plant that completes its entire life cycle within the space of a year
n. a reference book that is published regularly once every year
a. completing its life cycle within a year
s. occurring or payable every year"
ceremony,"n. a formal event performed on a special occasion
n. any activity that is performed in an especially solemn elaborate or formal way
n. the proper or conventional behavior on some solemn occasion"
characteristic,"n. a distinguishing quality
n. the integer part (positive or negative) of the representation of a logarithm; in the expression log 643 = 2.808 the characteristic is 2
n. any measurable property of a device measured under closely specified conditions
a. typical or distinctive"
leadership,"n. the activity of leading
n. the body of people who lead a group
n. the status of a leader
n. the ability to lead"
manual,"n. a small handbook
a. of or relating to the hands
a. requiring human effort
s. doing or requiring physical work"
split,"n. extending the legs at right angles to the trunk (one in front and the other in back)
n. a bottle containing half the usual amount
n. a promised or claimed share of loot or money
n. a lengthwise crack in wood"
rail,"n. short for railway
n. a horizontal bar (usually of wood or metal)
n. any of numerous widely distributed small wading birds of the family Rallidae having short wings and very long toes for running on soft mud
v. complain bitterly"
speaker,"n. someone who expresses in language; someone who talks (especially someone who delivers a public speech or someone especially garrulous)
n. the presiding officer of a deliberative assembly"
represent,"v. take the place of or be parallel or equivalent to
v. be representative or typical for
v. be a delegate or spokesperson for; represent somebody's interest or be a proxy or substitute for, as of politicians and office holders representing their constituents, or of a tenant representing other tenants in a housing dispute
v. serve as a means of expressing something"
union,"n. an organization of employees formed to bargain with the employer
n. the United States (especially the northern states during the American Civil War)
n. the state of being joined or united or linked
n. healing process involving the growing together of the edges of a wound or the growing together of broken bones"
civil,"s. applying to ordinary citizens as contrasted with the military
a. not rude; marked by satisfactory (or especially minimal) adherence to social usages and sufficient but not noteworthy consideration for others
a. of or occurring within the state or between or among citizens of the state
a. of or relating to or befitting citizens as individuals"
economy,"n. the system of production and distribution and consumption
n. the efficient use of resources
n. frugality in the expenditure of money or resources
n. an act of economizing; reduction in cost"
pressure,"n. the force applied to a unit area of surface; measured in pascals (SI unit) or in dynes (cgs unit)
n. a force that compels
n. the somatic sensation that results from applying force to an area of skin
n. an oppressive condition of physical or mental or social or economic distress"
congress,"n. the legislature of the United States government
n. a meeting of elected or appointed representatives
n. a national legislative assembly"
territory,"n. an area of knowledge or interest
n. the geographical area under the jurisdiction of a sovereign state"
withdraw,"v. pull back or move away or backward
v. remove (a commodity) from (a supply source)"
individual,"n. a single organism
a. being or characteristic of a single thing or person
s. separate and distinct from others of the same kind
s. characteristic of or meant for a single person or thing"
federal,"n. a member of the Union Army during the American Civil War
n. any federal law-enforcement officer
s. national; especially in reference to the government of the United States as distinct from that of its member units
a. of or relating to the central government of a federation"
preserve,"n. a domain that seems to be specially reserved for someone
n. a reservation where animals are protected
v. prevent (food) from rotting
v. keep undisturbed for personal or private use for hunting, shooting, or fishing"
infinite,"a. having no limits or boundaries in time or space or extent or magnitude
a. of verbs; having neither person nor number nor mood (as a participle or gerund or infinitive)
s. total and all-embracing"
capable,"a. (usually followed by `of') having capacity or ability
s. possibly accepting or permitting
a. (followed by `of') having the temperament or inclination for"
generous,"a. willing to give and share unstintingly
a. not petty in character and mind
s. more than adequate"
opponent,s. characterized by active hostility
thoughtful,"s. having intellectual depth
a. exhibiting or characterized by careful thought
s. acting with or showing thought and good sense
s. considerate of the feelings or well-being of others"
treatment,"n. care provided to improve a situation (especially medical procedures or applications that are intended to relieve illness or injury)
n. the management of someone or something
n. a manner of dealing with something artistically"
hatred,n the emotion of intense dislike; a feeling of dislike so strong that it demands action
procession,n. the group action of a collection of people or animals or vehicles moving ahead in more or less regular formation
former,"n. the first of two or the first mentioned of two
a. referring to the first of two things or persons mentioned (or the earlier one or ones of several); I prefer the former version to the latter one""
s. (used especially of persons) of the immediate past"
