preservation,"n. the activity of protecting something from loss or danger
n. the condition of being (well or ill) preserved
n. a process that saves organic substances from decay"
reserve,"n. something kept back or saved for future use or a special purpose
n. (medicine) potential capacity to respond in order to maintain vital functions
n. the trait of being uncommunicative; not volunteering anything more than necessary
v. hold back or set aside, especially for future use or contingency"
reservation,"n. a district that is reserved for particular purpose
n. a statement that limits or restricts some claim
n. the written record or promise of an arrangement by which accommodations are secured in advance
n. something reserved in advance (as a hotel accommodation or a seat on a plane etc.)"
reservoir,"n. a large or extra supply of something
n. lake used to store water for community use
n. tank used for collecting and storing a liquid (as water or oil)
n. anything (a person or animal or plant or substance) in which an infectious agent normally lives and multiplies"
concern,"n. something that interests you because it is important or affects you
n. an anxious feeling
n. a feeling of sympathy for someone or something
n. something or someone that causes anxiety; a source of unhappiness"
concerning,"v be relevant to
v be on the mind of"
concerned,"a. feeling or showing worry or solicitude
s. involved in or affected by or having a claim to or share in"
discern,v detect with the senses
discerning,"a. having or revealing keen insight and good judgment
s. unobtrusively perceptive and sympathetic
s. able to make or detect effects of great subtlety; sensitive"
crab,"n. decapod having eyes on short stalks and a broad flattened carapace with a small abdomen folded under the thorax and pincers
n. a quarrelsome grouch
n. the edible flesh of any of various crabs
n. a stroke of the oar that either misses the water or digs too deeply"
crawl,"n. a very slow movement
n. a swimming stroke; arms are moved alternately overhead accompanied by a flutter kick
n. a slow mode of locomotion on hands and knees or dragging the body
v. move slowly; in the case of people or animals with the body near the ground"
creep,"n. someone unpleasantly strange or eccentric
n. a slow longitudinal movement or deformation
n. a pen that is fenced so that young animals can enter but adults cannot
v. grow or spread, often in such a way as to cover (a surface)"
cripple,"n. someone who is unable to walk normally because of an injury or disability to the legs or back
v. deprive of strength or efficiency; make useless or worthless
v. deprive of the use of a limb, especially a leg"
scramble,"n. an unceremonious and disorganized struggle
v. to move hurriedly
v. bring into random order
v. make unintelligible"
special,"n. a special offering (usually temporary and at a reduced price) that is featured in advertising
n. a dish or meal given prominence in e.g. a restaurant
n. a television production that features a particular person or work or topic
s. for a special service or occasion"
specialist,"n. an expert who is devoted to one occupation or branch of learning
n. practices one branch of medicine"
specialize,"v. become more focus on an area of activity or field of study
v. suit to a special purpose
v. devote oneself to a special area of work"
specialization,"n. the act of specializing; making something suitable for a special purpose
n. the special line of work you have adopted as your career
n. (biology) the structural adaptation of some body part for a particular function"
speciality,"n an asset of special worth or utility
n a distinguishing trait
n the special line of work you have adopted as your career"
specific,"n. a medicine that has a mitigating effect on a specific disease
a. (sometimes followed by `to') applying to or characterized by or distinguishing something particular or special or unique
s. stated explicitly or in detail
a. relating to or distinguishing or constituting a taxonomic species"
specifically,r. in distinction from others
specify,"v. decide upon or fix definitely
v. determine the essential quality of
v. be specific about"
specification,"n. a detailed description of design criteria for a piece of work
n. naming explicitly
n. (patent law) a document drawn up by the applicant for a patent of invention that provides an explicit and detailed description of the nature and use of an invention"
species,"n. (biology) taxonomic group whose members can interbreed
n. a specific kind of something"
specimen,"n. an example regarded as typical of its class
n. a bit of tissue or blood or urine that is taken for diagnostic purposes"
baffle,"n. a flat plate that controls or directs the flow of fluid or energy
v. check the emission of (sound)"
barn,"n. an outlying farm building for storing grain or animal feed and housing farm animals
n. (physics) a unit of nuclear cross section; the effective circular area that one particle presents to another as a target for an encounter"
bewilder,v. cause to be confused emotionally
bilingual,"n. a person who speaks two languages fluently
s. using or knowing two languages"
bizarre,s. conspicuously or grossly unconventional or unusual
bloc,n. a group of countries in special alliance
blunt,"v. make less intense
v. make less sharp
s. having a broad or rounded end
s. used of a knife or other blade; not sharp"
blur,"n. a hazy or indistinct representation
v. to make less distinct or clear
v. make dim or indistinct
v. become vague or indistinct"
breeze,"n. a slight wind (usually refreshing)
v. blow gently and lightly
v. to proceed quickly and easily"
brink,"n. a region marking a boundary
n. the edge of a steep place"
brisk,"v. become brisk
s. very active"
bruise,"n. an injury that doesn't break the skin but results in some discoloration
v. injure the underlying soft tissue or bone of
v. break up into small pieces for food preparation
v. damage (plant tissue) by abrasion or pressure"
cemetery,n. a tract of land used for burials
cereal,"n. grass whose starchy grains are used as food: wheat; rice; rye; oats; maize; buckwheat; millet
n. a breakfast food prepared from grain
a. made of grain or relating to grain or the plants that produce it"
comet,n. (astronomy) a relatively small extraterrestrial body consisting of a frozen mass that travels around the sun in a highly elliptical orbit
commence,"v take the first step or steps in carrying out an action
v set in motion, cause to start
v get off the ground"
chase,"n. United States politician and jurist who served as chief justice of the United States Supreme Court (1808-1873)
n. a rectangular metal frame used in letterpress printing to hold together the pages or columns of composed type that are printed at one time
v. go after with the intent to catch
v. pursue someone sexually or romantically"
cluster,v. come together as in a cluster or flock
compliment,"n. a remark (or act) expressing praise and admiration
v. say something to someone that expresses praise
v. express respect or esteem for"
console,"n. a scientific instrument consisting of displays and an input device that an operator can use to monitor and control a system (especially a computer system)
n. an ornamental scroll-shaped bracket (especially one used to support a wall fixture)"
cosmetic,"n. a toiletry designed to beautify the body
s. serving an esthetic rather than a useful purpose
s. serving an aesthetic purpose in beautifying the body"
curl,"n. American chemist who with Richard Smalley and Harold Kroto discovered fullerenes and opened a new branch of chemistry (born in 1933)
v. form a curl, curve, or kink
v. twist or roll into coils or ringlets
v. play the Scottish game of curling"
curve,"n. the trace of a point whose direction of motion changes
n. a line on a graph representing data
n. a pitch of a baseball that is thrown with spin so that its path curves as it approaches the batter"
complete,"v. come or bring to a finish or an end; others finished in over 4 hours""
v. bring to a whole, with all the necessary parts or elements
v. complete a pass
v. write all the required information onto a form"
incomplete,"a. not complete or total; not completed
s. not yet finished"
complement,"n. a word or phrase used to complete a grammatical construction
n. a complete number or quantity
n. number needed to make up a whole force
n. something added to complete or embellish or make perfect"
complementary,s. of words or propositions so related that each is the negation of the other
comply,"v. act in accordance with someone's rules, commands, or wishes"
supplement,"n. a quantity added (e.g. to make up for a deficiency)
v. add as a supplement to what seems insufficient
v. serve as a supplement to"
supplementary,s. added to complete or make up a deficiency
accomplish,"v put in effect
v to gain with effort"
implement,"n. instrumentation (a piece of equipment or tool) used to effect an end
v. apply in a manner consistent with its purpose or design"
compel,"v. force somebody to do something
v. necessitate or exact"
compulsion,"n. an urge to do or say something that might be better left undone or unsaid
n. an irrational motive for performing trivial or repetitive actions, even against your will
n. using force to cause something to occur"
compulsory,s. required by rule
expel,v. force to leave or move out
propel,v. cause to move forward with force
repel,"v. cause to move back by force or influence
v. be repellent to; cause aversion in
v. force or drive back"
impulse,n. the act of applying force suddenly
pulse,"n. the rhythmic contraction and expansion of the arteries with each beat of the heart
n. the rate at which the heart beats; usually measured to obtain a quick evaluation of a person's health
n. edible seeds of various pod-bearing plants (peas or beans or lentils etc.)
v. produce or modulate (as electromagnetic waves) in the form of short bursts or pulses or cause an apparatus to produce pulses"
dictionary,n. a reference book containing an alphabetical list of words with information about them
diction,"n the articulation of speech regarded from the point of view of its intelligibility to the audience
n the manner in which something is expressed in words"
addict,"n. someone who is so ardently devoted to something that it resembles an addiction
n. someone who is physiologically dependent on a substance; abrupt deprivation of the substance produces withdrawal symptoms
v. to cause (someone or oneself) to become dependent (on something, especially a narcotic drug)"
addicted,a. compulsively or physiologically dependent on something habit-forming
addictive,a. causing or characterized by addiction
contradict,"v. be in contradiction with
v. deny the truth of"
contradiction,"n. opposition between two conflicting forces or ideas
n. (logic) a statement that is necessarily false
n. the speech act of contradicting someone"
dedicate,"v. open to public use, as of a highway, park, or building
v. inscribe or address by way of compliment
v. set apart to sacred uses with solemn rites, of a church"
dedication,"n. complete and wholehearted fidelity
n. a ceremony in which something (as a building) is dedicated to some goal or purpose
n. a short message (as in a book or musical work or on a photograph) dedicating it to someone or something"
indicate,"v. indicate a place, direction, person, or thing; either spatially or figuratively
v. to state or express briefly
v. suggest the necessity of an intervention; in medicine"
indication,"n. something that serves to indicate or suggest
n. the act of indicating or pointing out by name
n. (medicine) a reason to prescribe a drug or perform a procedure
n. something (as a course of action) that is indicated as expedient or necessary"
indicative,"a. relating to the mood of verbs that is used simple in declarative statements
s. (usually followed by `of') pointing out or revealing clearly"
predict,v. make a prediction about; tell in advance
prediction,"n. the act of predicting (as by reasoning about the future)
n. a statement made about the future"
verdict,n. (law) the findings of a jury on issues of fact submitted to it for decision; can be used in formulating a judgment
index,"n. a numerical scale used to compare variables with one another or with some reference number
n. a number or ratio (a value on a scale of measurement) derived from a series of observed facts; can reveal relative changes as a function of time
n. an alphabetical listing of names and topics along with page numbers where they are discussed
n. the finger next to the thumb"
exit,"n. an opening that permits escape or release
n. the act of going out
v. move out of or depart from
v. lose the lead"
circuit,"n. an electrical device that provides a path for electrical current to flow
n. an established itinerary of venues or events that a particular group of people travel to
n. (law) a judicial division of a state or the United States (so-called because originally judges traveled and held court in different locations); one of the twelve groups of states in the United States that is covered by a particular circuit court of appeals
v. make a circuit"
initial,"n. the first letter of a word (especially a person's name)
v. mark with one's initials
s. occurring at the beginning"
initially,r. at the beginning
initiate,"n. someone who has been admitted to membership in a scholarly field
n. people who have been introduced to the mysteries of some field or activity
v. take the lead or initiative in; participate in the development of
v. accept people into an exclusive society or group, usually with some rite"
initiative,"n readiness to embark on bold new ventures
n the first of a series of actions
s serving to set in motion"
transit,"v. make a passage or journey from one place to another
v. pass across (a sign or house of the zodiac) or pass across (the disk of a celestial body or the meridian of a place)
v. revolve (the telescope of a surveying transit) about its horizontal transverse axis in order to reverse its direction
v. cause or enable to pass through"
transition,"n. a change from one place or state or subject or stage to another
n. a musical passage moving from one key to another
n. a passage that connects a topic to one that follows
v. cause to convert or undergo a transition"
imagine,v. form a mental image of something that is not present or that is not the case
imaginable,s capable of being imagined
imaginary,"n (mathematics) a number of the form a+bi where a and b are real numbers and i is the square root of -1
s not based on fact; unreal"
imaginative,s. (used of persons or artifacts) marked by independence and creativity in thought or action
imagination,"n. the formation of a mental image of something that is not perceived as real and is not present to the senses
n. the ability to form mental images of things or events"
image,"n. an iconic mental representation
n. (mathematics) the set of values of the dependent variable for which a function is defined
n. the general impression that something (a person or organization or product) presents to the public
v. render visible, as by means of MRI"
imitate,"v. reproduce someone's behavior or looks
v. appear like, as in behavior or appearance
v. make a reproduction or copy of"
imitation,"n. the doctrine that representations of nature or human behavior should be accurate imitations
n. something copied or derived from an original
n. copying (or trying to copy) the actions of someone else"
maintain,v. state or assert
maintenance,"n. means of maintenance of a family or group
n. the unauthorized interference in a legal action by a person having no interest in it (as by helping one party with money or otherwise to continue the action) so as to obstruct justice or promote unnecessary litigation or unsettle the peace of the community"
detain,"v deprive of freedom; take into confinement
v stop or halt
v cause to be slowed down or delayed"
detention,"n. a state of being confined (usually for a short time)
n. a punishment in which a student must stay at school after others have gone home"
retain,"v. hold back within
v. allow to remain in a place or position or maintain a property or feature
v. secure and keep for possible future use or application
v. keep in one's mind"
retention,n. the act of retaining something
sustain,"v. supply with necessities and support
v. admit as valid"
sustainable,a. capable of being sustained
analyse,"v consider in detail and subject to an analysis in order to discover essential features or meaning
v break down into components or essential features
v make a mathematical, chemical, or grammatical analysis of; break down into components or essential features
v subject to psychoanalytic treatment"
analyze,"v. consider in detail and subject to an analysis in order to discover essential features or meaning
v. make a mathematical, chemical, or grammatical analysis of; break down into components or essential features
v. break down into components or essential features"
analysis,"n. an investigation of the component parts of a whole and their relations in making up the whole
n. the abstract separation of a whole into its constituent parts in order to study the parts and their relations
n. a form of literary criticism in which the structure of a piece of writing is analyzed
n. the use of closed-class words instead of inflections: e.g., `the father of the bride' instead of `the bride's father'"
analytic,"a. using or subjected to a methodology using algebra and calculus
a. using or skilled in using analysis (i.e., separating a whole--intellectual or substantial--into its elemental parts or basic principles)
a. expressing a grammatical category by using two or more words rather than inflection"
analytical,"a using or skilled in using analysis (i.e., separating a whole--intellectual or substantial--into its elemental parts or basic principles)
a of a proposition that is necessarily true independent of fact or experience"
analytically,r. by virtue of analysis
paralyse,"v make powerless and unable to function
v cause to be paralyzed and immobile"
paralyze,"v. make powerless and unable to function
v. cause to be paralyzed and immobile"
shut,a. not open
shutter,"n. a mechanical device on a camera that opens and closes to control the time of a photographic exposure
n. a hinged blind for a window
v. close with shutters"
shuttle,"n. public transport that consists of a bus or train or airplane that plies back and forth between two points
n. bobbin that passes the weft thread between the warp threads
v. travel back and forth between two points"
motor,"n. machine that converts other forms of energy into mechanical energy and so imparts motion
n. a nonspecific agent that imparts motion"
motel,n. a motor hotel
locomotive,"n. a wheeled vehicle consisting of a self-propelled engine that is used to draw trains along railway tracks
a. of or relating to locomotion"
motion,"n. a change of position that does not entail a change of location
n. a state of change
n. a formal proposal for action made to a deliberative assembly for discussion and vote
n. the act of changing location from one place to another"
motive,s. causing or able to cause motion
motivate,v. give an incentive for action
promote,"v. contribute to the progress or growth of
v. give a promotion to or assign to a higher position
v. be changed for a superior chess or checker piece
v. change a pawn for a better piece by advancing it to the eighth row, or change a checker piece for a more valuable piece by moving it to the row closest to your opponent"
automate,v make automatic or control or operate automatically
automatic,"a. operating with minimal human intervention; independent of external control
s. resembling the unthinking functioning of a machine
s. without volition or conscious control"
mobile,"n. a river in southwestern Alabama; flows into Mobile Bay
n. a port in southwestern Alabama on Mobile Bay
n. sculpture suspended in midair whose delicately balanced parts can be set in motion by air currents
s. migratory"
automobile,v. travel in an automobile
mobilize,"v. make ready for action or use
v. get ready for war
v. cause to move around"
mobilise,"v call to arms; of military personnel
v get ready for war
v make ready for action or use
v cause to move around"
mob,n. a disorderly crowd of people
satisfy,"v. meet the requirements or expectations of
v. make happy or satisfied"
satisfaction,"n. the contentment one feels when one has fulfilled a desire, need, or expectation
n. (law) the payment of a debt or fulfillment of an obligation
n. act of fulfilling a desire or need or appetite"
satisfactory,"a. giving satisfaction
s. meeting requirements"
satisfied,s. filled with satisfaction
saturate,"v. cause (a chemical compound, vapour, solution, magnetic material) to unite with the greatest possible amount of another substance"
deck,"n. any of various platforms built into a vessel
n. street name for a packet of illegal drugs
n. a porch that resembles the deck on a ship
v. be beautiful to look at"
diligent,"s. quietly and steadily persevering especially in detail or exactness
a. characterized by care and perseverance in carrying out tasks"
discrepancy,"n. a difference between conflicting facts or claims or opinions
n. an event that departs from expectations"
disgust,"n. strong feelings of dislike
v. fill with distaste
v. cause aversion in; offend the moral sense of"
dispatch,"n. an official report (usually sent in haste)
n. the act of sending off something
n. the property of being prompt and efficient
n. killing a person or animal"
distil,"v undergo condensation; change from a gaseous to a liquid state and fall in drops
v extract by the process of distillation
v undergo the process of distillation
v give off (a liquid)"
distill,"v. undergo the process of distillation
v. extract by the process of distillation
v. give off (a liquid)"
divine,"v. perceive intuitively or through some inexplicable perceptive powers
v. search by divining, as if with a rod
s. emanating from God
s. being or having the nature of a god; 'tis God-like to create""-J.G.Saxe"
dodge,"n. a quick evasive movement
n. a statement that evades the question by cleverness or trickery
v. make a sudden movement in a new direction so as to avoid
v. move to and fro or from place to place usually in an irregular course"
drift,"n. a force that moves something along
n. the gradual departure from an intended course due to external influences (as a ship or plane)
n. a process of linguistic change over a period of time
n. a large mass of material that is heaped up by the wind or by water currents"
dwarf,"n. a person who is markedly small
n. a plant or animal that is atypically small
v. check the growth of"
earnest,"n. something of value given by one person to another to bind a contract
s. characterized by a firm and humorless belief in the validity of your opinions"
edible,a. suitable for use as food
embark,"v. go on board
v. set out on (an enterprise or subject of study)"
endorse,v. sign as evidence of legal transfer
episode,"n. a happening that is distinctive in a series of related events
n. a brief section of a literary or dramatic work that forms part of a connected series
n. a part of a broadcast serial"
fatigue,"n. temporary loss of strength and energy resulting from hard physical or mental work
n. used of materials (especially metals) in a weakened state caused by long stress
n. (always used with a modifier) boredom resulting from overexposure to something"
feat,n. a notable achievement
feminine,"n. a gender that refers chiefly (but not exclusively) to females or to objects classified as female
a. associated with women and not with men
a. of grammatical gender
s. (music or poetry) ending on an unaccented beat or syllable"
forge,"n. furnace consisting of a special hearth where metal is heated before shaping
n. a workplace where metal is worked by heating and hammering
v. create by hammering
v. make a copy of with the intent to deceive"
frantic,s. excessively agitated; distraught with fear or other violent emotion
fuss,"n. an angry disturbance
v. worry unnecessarily or excessively"
gasp,n. a short labored intake of breath with the mouth open
gossip,"n. a report (often malicious) about the behavior of other people
n. a person given to gossiping and divulging personal information about others"
claim,"n. an assertion of a right (as to money or property)
n. an assertion that something is true or factual
n. demand for something as rightful or due
n. an informal right to something"
exclaim,"v. utter aloud; often with surprise, horror, or joy"
exclamation,"n. an abrupt excited utterance
n. a loud complaint or protest or reproach"
proclaim,"v. declare formally; declare someone to be something; of titles
v. state or announce"
proclamation,n. the formal act of proclaiming; giving public notice
reclaim,"v. claim back
v. reuse (materials from waste products)
v. make useful again; transform from a useless or uncultivated state"
adapt,"v. make fit for, or change to suit a new purpose"
adopt,"v. choose and follow; as of theories, ideas, policies, strategies or plans
v. take up and practice as one's own
v. take into one's family"
apt,"s. (usually followed by `to') naturally disposed toward
s. at risk of or subject to experiencing something usually unpleasant
s. mentally quick and resourceful"
opt,v select as an alternative over another
option,"n. the right to buy or sell property at an agreed price; the right is purchased and if it is not exercised by a stated date the money is forfeited
n. one of a number of things from which only one can be chosen"
optional,a. possible but not necessary; left to personal choice
