same,"a. same in identity
a. closely similar or comparable in kind or quality or quantity or degree
s. unchanged in character or nature"
assemble,"v. create by putting components or members together
v. get people together"
assembly,"n. a group of machine parts that fit together to form a self-contained unit
n. a group of persons who are gathered together for a common purpose
n. a unit consisting of components that have been fitted together
n. the social act of assembling"
resemble,v. appear like; be similar or bear a likeness to
resemblance,n. similarity in appearance or external or superficial details
assimilate,"v. become similar to one's environment
v. make similar
v. take (gas, light or heat) into a solution
v. become similar in sound"
simulate,v. make a pretence of
simultaneous,s occurring or operating at the same time
abundant,a. present in great quantity
abundance,"n. the property of a more than adequate quantity or supply
n. (physics) the ratio of the number of atoms of a specific isotope of an element to the total number of isotopes present
n. (chemistry) the ratio of the total mass of an element in the earth's crust to the total mass of the earth's crust; expressed as a percentage or in parts per million"
redundant,"s more than is needed, desired, or required
s repetition of same sense in different words"
arrange,"v. put into a proper or systematic order
v. make arrangements for
v. adapt for performance in a different way
v. arrange thoughts, ideas, temporal events"
arrangement,"n. an orderly grouping (of things or persons) considered as a unit; the result of arranging
n. an organized structure for arranging or classifying
n. the act of arranging and adapting a piece of music"
range,"n. the limits within which something can be effective
n. a large tract of grassy open land on which livestock can graze
n. a series of hills or mountains
n. a place for shooting (firing or driving) projectiles of various kinds"
rank,"n. a row or line of people (especially soldiers or police) standing abreast of one another
n. relative status
v. take or have a position relative to others
v. take precedence or surpass others in rank"
certain,"s. definite but not specified or identified
a. having or feeling no doubt or uncertainty; confident and assured
a. established beyond doubt or question; definitely known
a. certain to occur; destined or inevitable"
ascertain,v. learn or discover with certainty
certainty,"n. the state of being certain
n. something that is certain"
certificate,"n. a document attesting to the truth of certain stated facts
v. present someone with a certificate
v. authorize by certificate"
certify,"v. guarantee payment on; of checks
v. guarantee as meeting a certain standard
v. declare legally insane"
certification,n. the act of certifying or bestowing a franchise on
universe,"n. everything that exists anywhere
n. everything stated or assumed in a given discussion"
universal,"n. (linguistics) a grammatical rule (or other linguistic feature) that is found in all languages
n. (logic) a proposition that asserts something of all members of a class
n. a behavioral convention or pattern characteristic of all members of a particular culture or of all human beings
s. applicable to or common to all members of a group or set"
advertise,"v. call attention to
v. make publicity for; try to sell (a product)"
anniversary,n. the date on which an event occurred in some previous year (or the celebration of it)
avert,v. turn away or aside
convert,"n. a person who has been converted to another religious or political belief
v. change from one system to another or to a new plan or policy
v. change the nature, purpose, or function of something
v. change religious beliefs, or adopt a religious belief"
conversion,"n. an event that results in a transformation
n. a change in the units or form of an expression: ""conversion from Fahrenheit to Centigrade""
n. a successful free throw or try for point after a touchdown
n. a spiritual enlightenment causing a person to lead a new life"
convertible,"n. a car that has top that can be folded or removed
n. a corporate security (usually bonds or preferred stock) that can be exchanged for another form of security (usually common stock)
n. a sofa that can be converted into a bed
a. capable of being exchanged for or replaced by something of equal value"
divert,"v. send on a course or in a direction different from the planned or intended one
v. withdraw (money) and move into a different location, often secretly and with dishonest intentions"
diversion,"n. an activity that diverts or amuses or stimulates
n. a turning aside (of your course or attention or concern)
n. an attack calculated to draw enemy defense away from the point of the principal attack"
invert,"v. make an inversion (in a musical composition)
v. reverse the position, order, relation, or condition of"
reverse,"n. a relation of direct opposition
n. the gears by which the motion of a machine can be reversed
n. an unfortunate happening that hinders or impedes; something that is thwarting or frustrating
n. the side of a coin or medal that does not bear the principal design"
reversible,"n. a garment (especially a coat) that can be worn inside out (with either side of the cloth showing)
a. capable of reversing or being reversed
a. capable of being reversed or used with either side out"
revert,"v. go back to a previous state
v. undergo reversion, as in a mutation"
traverse,"v. travel across or pass over
v. deny formally (an allegation of fact by the opposing party) in a legal suit"
conversation,n. the use of speech for informal exchange of views or ideas or information etc.
verse,"n. a piece of poetry
n. a line of metrical text
v. compose verses or put into verse
v. familiarize through thorough study or experience"
version,"n. an interpretation of a matter from a particular viewpoint
n. something a little different from others of the same type
n. manual turning of a fetus in the uterus (usually to aid delivery)"
adverse,"s. contrary to your interests or welfare
s. in an opposing direction"
conversely,r. with the terms of the relation reversed
versus,"prep. Against; as, John Doe versus Richard Roe; -- chiefly
   used in legal language, and abbreviated to v. or vs."
diverse,s. distinctly dissimilar or unlike
versatile,"s. having great diversity or variety
s. changeable or inconstant
s. competent in many areas and able to turn with ease from one thing to another
s. able to move freely in all directions"
depend,v. be contingent upon (something that is elided)
dependent,"a. relying on or requiring a person or thing for support, supply, or what is needed
s. contingent on something else
a. (of a clause) unable to stand alone syntactically as a complete sentence"
dependence,n. the state of relying on or being controlled by someone or something else
independent,"a. free from external control and constraint
a. (of a clause) capable of standing syntactically alone as a complete sentence
s. not controlled by a party or interest group"
independence,"n. freedom from control or influence of another or others
n. the successful ending of the American Revolution
n. a city in western Missouri; the beginning of the Santa Fe Trail"
exhibition,"n. the act of exhibiting
n. a collection of things (goods or works of art etc.) for public display"
exhibit,"n. an object or statement produced before a court of law and referred to while giving evidence
v. show an attribute, property, knowledge, or skill"
inhibit,"v. limit the range or extent of
v. limit, block, or decrease the action or function of
v. control and refrain from showing; of emotions, desires, impulses, or behavior"
prohibit,v command against
course,"n. education imparted in a series of lessons or meetings
n. a connected series of events or actions or developments
n. general line of orientation
n. a mode of action"
racecourse,n a course over which races are run
intercourse,n. communication between individuals
occur,"v. come to one's mind; suggest itself
v. to be found to exist"
occurrence,n. an instance of something occurring
current,"n. a flow of electricity through a conductor
n. a steady flow of a fluid (usually from natural causes)
a. occurring in or belonging to the present time"
currency,"n. the metal or paper medium of exchange that is presently used
n. general acceptance or use"
concur,v. happen simultaneously
concurrent,s occurring or operating at the same time
concurrently,r. overlapping in duration
corridor,n. an enclosed passageway; rooms usually open onto it
curriculum,n an integrated course of academic studies
excursion,n. a journey taken for pleasure
incur,v. make oneself subject to; bring upon oneself; become liable to
recur,"v. happen or occur again
v. return in thought or speech to something"
identical,"s. exactly alike; incapable of being perceived as different
s. being the exact same one; not any other:
a. (of twins) derived from a single egg or ovum
s. having properties with uniform values along all axes"
identify,"v. recognize as being; establish the identity of someone or something
v. consider (oneself) as similar to somebody else
v. conceive of as united or associated
v. identify as in botany or biology, for example"
identification,"n. evidence of identity; something that identifies a person or thing
n. the condition of having the identity (of a person or object) established
n. the attribution to yourself (consciously or unconsciously) of the characteristics of another person (or group of persons)"
identity,"n. the distinct personality of an individual regarded as a persisting entity
n. the individual characteristics by which a thing or person is recognized or known
n. an operator that leaves unchanged the element on which it operates
n. exact sameness"
dialog,"n a conversation between two persons
n the lines spoken by characters in drama or fiction
n a literary composition in the form of a conversation between two people"
dialogue,"n. a conversation between two persons
n. the lines spoken by characters in drama or fiction
n. a literary composition in the form of a conversation between two people"
catalog,"n. a book or pamphlet containing an enumeration of things
n. a complete list of things; usually arranged systematically"
catalogue,"v. make an itemized list or catalog of; classify
v. make a catalogue, compile a catalogue"
monolog,none
monologue,"n. a long utterance by one person (especially one that prevents others from participating in the conversation)
n. a (usually long) dramatic speech by a single actor"
prologue,n. an introduction to a play
epilog,"n a short speech (often in verse) addressed directly to the audience by an actor at the end of a play
n a short passage added at the end of a literary work"
epilogue,"n. a short speech (often in verse) addressed directly to the audience by an actor at the end of a play
n. a short passage added at the end of a literary work"
analogy,"n. an inference that if things agree in some respects they probably agree in others
n. drawing a comparison in order to show a similarity in some respect"
logic,"n. the branch of philosophy that analyzes inference
n. reasoned and reasonable judgment
n. the principles that guide reasoning within a given field or situation
n. the system of operations performed by a computer that underlies the machine's representation of logical operations"
logical,a. capable of or reflecting the capability for correct and valid reasoning
ecology,"n. the environment as it relates to living organisms
n. the branch of biology concerned with the relations between organisms and their environment"
ecological,"a. characterized by the interdependence of living organisms in an environment
a. of or relating to the science of ecology"
geology,n. a science that deals with the history of the earth as recorded in rocks
methodology,"n. the branch of philosophy that analyzes the principles and procedures of inquiry in a particular discipline
n. the system of methods followed in a particular discipline"
eloquent,"s. expressing yourself readily, clearly, effectively"
issue,"n. an important question that is in dispute and must be settled
n. one of a series published periodically
n. the act of providing an item for general use or for official purposes (usually in quantity)
n. supplies (as food or clothing or ammunition) issued by the government"
yield,"n. an amount of a product
v. be the cause or source of
v. give in, as to influence or pressure
v. bring in"
impact,"n. the striking of one body against another
n. a forceful consequence; a strong effect
v. press or wedge together; pack together"
loan,n. the temporary provision of money (usually at interest)
slack,"n. dust consisting of a mixture of small coal fragments and coal dust and dirt that sifts out when coal is passed over a sieve
n. a stretch of water without current or movement
n. the quality of being loose (not taut)
n. a cord or rope or cable that is hanging loosely"
semester,"n. one of two divisions of an academic year
n. half a year; a period of 6 months"
survey,"n. a detailed critical inspection
v. consider in a comprehensive way
v. look over carefully or inspect
v. make a survey of; for statistical purposes"
boost,"n. the act of giving hope or support to someone
n. the act of giving a push
v. give a boost to; be beneficial to
v. increase or raise"
obstacle,"n. something immaterial that stands in the way and must be circumvented or surmounted
n. an obstruction that stands in the way (and must be removed or surmounted or circumvented)"
launch,"n. a motorboat with an open deck or a half deck
v. propel with force
v. launch for the first time; launch on a maiden voyage
v. get going; give impetus to"
curb,"n. an edge between a sidewalk and a roadway consisting of a line of curbstones (usually forming part of a gutter)
n. a horse's bit with an attached chain or strap to check the horse
v. keep to the curb"
infant,n a very young child (birth to 1 year) who has not yet begun to walk or talk
enhance,"v. increase
v. make better or more attractive"
faculty,n. one of the inherent cognitive or perceptual powers of the mind
rural,"a. living in or characteristic of farming or country life
a. of or relating to the countryside as opposed to the city"
asset,n. a useful or valuable quality
calorie,"n. a unit of heat equal to the amount of heat required to raise the temperature of one kilogram of water by one degree at one atmosphere pressure; used by nutritionists to characterize the energy-producing potential in food
n. unit of heat defined as the quantity of heat required to raise the temperature of 1 gram of water by 1 degree centigrade at atmospheric pressure"
exert,"v. put to use
v. make a great effort at a mental or physical task"
frustrate,"v hinder or prevent (the efforts, plans, or desires) of
v treat cruelly"
luxury,"n. something that is an indulgence rather than a necessity
n. wealth as evidenced by sumptuous living"
penalty,"n. a payment required for not fulfilling a contract
n. the disadvantage or painful consequences of an action or condition
n. (games) a handicap or disadvantage that is imposed on a competitor (or a team) for an infraction of the rules of the game"
prompt,"n. a cue given to a performer (usually the beginning of the next line to be spoken)
n. (computer science) a symbol that appears on the computer screen to indicate that the computer is ready to receive a command
v. serve as the inciting cause of
v. assist (somebody acting or reciting) by suggesting the next words of something forgotten or imperfectly learned"
release,"n. merchandise issued for sale or public showing (especially a record or film)
n. a process that liberates or discharges something
n. a device that when pressed will release part of a mechanism
n. activity that frees or expresses creative energy or emotion"
resort,n. a hotel located in a resort area
scale,"n. an ordered reference standard
n. relative magnitude
n. the ratio between the size of something and a representation of it
n. a specialized leaf or bract that protects a bud or catkin"
escalator,n. a stairway whose steps move continuously on a circulating belt
ascend,"v. travel up, ""We ascended the mountain""
v. go back in order of genealogical succession
v. become king or queen
v. appear to be moving upward, as by means of tendrils"
descend,"v. move downward and lower, but not necessarily all the way"
descendant,"n. a person considered as descended from some ancestor or race
s. going or coming down
s. proceeding by descent from an ancestor"
ascent,n. an upward slope or grade (as in a road)
descent,"n. a movement downward
n. the act of changing your location in a downward direction
n. the kinship relation between an individual and the individual's progenitors
n. a downward slope or bend"
transcend,"v be greater in scope or size than some standard
v be superior or better than some standard"
rare,"s. not widely known; especially valued for its uncommonness
s. recurring only at long intervals
s. not widely distributed
s. having low density"
scarce,a. deficient in quantity or number compared with the demand
rarely,r. not often
scarcely,"r only a very short time before
r almost not"
scarcity,n. a small and inadequate amount
structure,"n. a thing constructed; a complex entity constructed of many parts
n. the manner of construction of something and the arrangement of its parts
n. the complex composition of knowledge as elements and their combinations
n. a particular complex anatomical part of a living thing"
restructure,v. construct or form anew or provide with a new structure
construct,"v. make by combining materials and parts
v. draw with suitable instruments and under specified conditions
v. create by linking linguistic units
v. create by organizing and linking ideas, arguments, or concepts"
construction,"n. the act of constructing something
n. a group of words that form a constituent of a sentence and are considered as a single unit
n. the creation of a construct; the process of combining ideas into a congruous object of thought
n. drawing a figure satisfying certain conditions as part of solving a problem or proving a theorem"
constructive,"a. constructing or tending to construct or improve or promote development
s. emphasizing what is laudable or hopeful or to the good"
destroy,"v. do away with, cause the destruction or undoing of
v. destroy completely; damage irreparably
v. put (an animal) to death"
destruction,"n. the termination of something by causing so much damage to it that it cannot be repaired or no longer exists
n. an event (or the result of an event) that completely destroys something"
destructive,a. causing destruction or much damage
assist,"n. (sports) the act of enabling another player to make a good play
v. act as an assistant in a subordinate or supportive function"
consist,"v. have its essential character; be comprised or contained in; be embodied in
v. be consistent in form, tenor, or character; be congruous
v. be composed of"
consistent,"a. (sometimes followed by `with') in agreement or consistent or reliable
s. the same throughout in structure or composition"
consistency,"n. the property of holding together and retaining its shape
n. a harmonious uniformity or agreement among things or parts
n. logical coherence and accordance with the facts
n. (logic) an attribute of a logical system that is so constituted that none of the propositions deducible from the axioms contradict one another"
inconsistency,n. the quality of being inconsistent and lacking a harmonious uniformity among things or parts
exist,"v. have an existence, be extant
v. support oneself"
existence,"n the state or fact of existing
n everything that exists anywhere"
coexistence,n. existing peacefully together
subsist,v support oneself
subsistence,"n. minimal (or marginal) resources for subsisting
n. a means of surviving
n. the state of existing in reality; having substance"
insist,"v. be emphatic or resolute and refuse to budge
v. assert to be true"
persist,v. stay behind
persistence,"n the property of a continuous and connected period of time
n persistent determination
n the act of persisting or persevering; continuing or repeating behavior"
persistent,"s. never-ceasing
a. retained; not shed"
resist,"v. stand up or offer resistance to somebody or something
v. withstand the force of something
v. resist immunologically the introduction of some foreign tissue or organ
v. refuse to comply"
resistance,"n. the action of opposing something that you disapprove or disagree with
n. any mechanical force that tends to retard or oppose motion
n. the military action of resisting the enemy's advance
n. the capacity of an organism to defend itself against harmful environmental agents"
resistant,s. impervious to being affected
resistor,n. an electrical device that resists the flow of electrical current
transistor,n. a semiconductor device capable of amplification
auto,n a motor vehicle with four wheels; usually propelled by an internal combustion engine
automatic,"a. operating with minimal human intervention; independent of external control
s. resembling the unthinking functioning of a machine
s. without volition or conscious control"
automation,"n. the act of implementing the control of equipment with advanced technology; usually involving electronic hardware
n. the condition of being automatically operated or controlled
n. equipment used to achieve automatic control or operation"
automobile,v. travel in an automobile
autonomy,"n. immunity from arbitrary exercise of authority: political independence
n. personal independence"
autonomous,"s. (of political bodies) not controlled by outside forces
s. existing as an independent entity
s. (of persons) free from external control and constraint in e.g. action and judgment"
culture,"n. a particular society at a particular time and place
n. the tastes in art and manners that are favored by a social group
n. (biology) the growing of microorganisms in a nutrient medium (such as gelatin or agar)
n. the attitudes and behavior that are characteristic of a particular social group or organization"
cultural,"a. of or relating to the arts and manners that a group favors
s. denoting or deriving from or distinctive of the ways of living built up by a group of people
a. of or relating to the shared knowledge and values of a society
a. relating to the raising of plants or animals"
multicultural,a. of or relating to or including several cultures
cultivate,"v. foster the growth of
v. prepare for crops"
cultivation,"n. socialization through training and education to develop one's mind or manners
n. (agriculture) production of food by preparing the land to grow crops (especially on a large scale)
n. the process of fostering the growth of something"
front,"n. the side that is forward or prominent
n. the outward appearance of a person
n. the side that is seen or that goes first
n. a sphere of activity involving effort"
confront,"v. oppose, as in hostility or a competition
v. deal with (something unpleasant) head on
v. present somebody with something, usually to accuse or criticize
v. be face to face with"
confrontation,"n. a bold challenge
n. discord resulting from a clash of ideas or opinions
n. a hostile disagreement face-to-face
n. the act of hostile groups opposing each other"
frontier,"n. a wilderness at the edge of a settled area of a country
n. an international boundary or the area (often fortified) immediately inside the boundary
n. an undeveloped field of study; a topic inviting research and development"
upfront,s. frank and honest
normal,"a. conforming with or constituting a norm or standard or level or type or social norm; not abnormal
a. in accordance with scientific laws
a. being approximately average or within certain limits in e.g. intelligence and development
s. forming a right angle"
abnormal,"a. not normal; not typical or usual or regular or conforming to a norm
a. departing from the normal in e.g. intelligence and development
s. much greater than the normal"
normalize,"v. become normal or return to its normal state
v. make normal or cause to conform to a norm or standard"
norm,n. a standard or model or pattern regarded as typical
enormous,"s. extraordinarily large in size or extent or amount or power or degree; that a whole civilization should be dependent on technology""- Walter Lippman"
prison,"n. a correctional institution where persons are confined while on trial or for punishment
n. a prisonlike situation; a place of seeming confinement"
imprison,"v. lock up or confine, in or as in a jail
v. confine as if in a prison; he does not let them go out without a chaperone"""
comprise,"v be composed of
v include or contain; have as a component
v form or compose"
enterprise,"n. a purposeful or industrious undertaking (especially one that requires effort or boldness)
n. an organization created for business ventures
n. readiness to embark on bold new ventures"
entrepreneur,n. someone who organizes a business venture and assumes the risk for it
private,"n. an enlisted man of the lowest rank in the Army or Marines
a. confined to particular persons or groups or providing privacy
s. concerning things deeply private and personal"
privacy,"n. the quality of being secluded from the presence or view of others
n. the condition of being concealed or hidden"
deprive,"v. take away possessions from someone
v. keep from having, keeping, or obtaining
v. take away"
privilege,"n. a special advantage or immunity or benefit not enjoyed by all
n. (law) the right to refuse to divulge information obtained in a confidential relationship
v. bestow a privilege upon"
privileged,"a. blessed with privileges
s. not subject to usual rules or penalties"
