gratitude,n. a feeling of thankfulness and appreciation
press,"n. the print media responsible for gathering and publishing news in the form of newspapers or magazines
n. a machine used for printing
n. clamp to prevent wooden rackets from warping when not in use
n. any machine that exerts pressure to form or shape or cut materials or extract liquids or compress solids"
compress,"n. a cloth pad or dressing (with or without medication) applied firmly to some part of the body (to relieve discomfort or reduce fever)
v. make more compact by or as if by pressing
v. squeeze or press together"
compression,"n. the process or result of becoming smaller or pressed together
n. encoding information while reducing the bandwidth or bits required
n. applying pressure"
depress,"v. lower someone's spirits; make downhearted
v. lower (prices or markets)
v. lessen the activity or force of"
depression,"n. a mental state characterized by a pessimistic sense of inadequacy and a despondent lack of activity
n. a long-term economic state characterized by unemployment and low prices and low levels of trade and investment
n. sad feelings of gloom and inadequacy
n. a period during the 1930s when there was a worldwide economic depression and mass unemployment"
suppress,"v. to put down by force or authority
v. put out of one's consciousness
v. reduce the incidence or severity of or stop"
oppress,v. come down on or keep down by unjust use of one's authority
oppression,"n. the act of subjugating by cruelty
n. the state of being kept down by unjust use of force or authority: ""after years of oppression they finally revolted""
n. a feeling of being oppressed"
pressure,"n. the force applied to a unit area of surface; measured in pascals (SI unit) or in dynes (cgs unit)
n. a force that compels
n. the somatic sensation that results from applying force to an area of skin
n. an oppressive condition of physical or mental or social or economic distress"
repression,"n. a state of forcible subjugation
n. (psychiatry) the classical defense mechanism that protects you from impulses or ideas that would cause anxiety by preventing them from becoming conscious
n. the act of repressing; control by holding down"
repressive,s restrictive of action
lapse,"n. a break or intermission in the occurrence of something
v. end, at least for a long time
v. drop to a lower level, as in one's morals or standards
v. let slip"
collapse,"n. an abrupt failure of function or complete physical exhaustion
n. a natural event caused by something suddenly falling down or caving in
v. break down, literally or metaphorically
v. fold or close up"
elapse,v. pass by
long,"a. primarily temporal sense; being or indicating a relatively great or greater than average duration or passage of time or a duration as specified
a. primarily spatial sense; of relatively great or greater than average spatial extension or extension as specified
s. of relatively great height
a. holding securities or commodities in expectation of a rise in prices"
longitude,n. the angular distance between a point on any meridian and the prime meridian at Greenwich
prolong,"v. lengthen in time; cause to be or last longer
v. lengthen or extend in duration or space"
length,"n. the linear extent in space from one end to the other; the longest dimension of something that is fixed in place
n. the property of being the extent of something from beginning to end
n. a section of something that is long and narrow"
lengthy,s relatively long in duration; tediously protracted
linger,"v. remain present although waning or gradually dying
v. take one's time; proceed slowly"
magnificent,s characterized by grandeur
magnify,"v. increase in size, volume or significance"
magnitude,"n. the property of relative size or extent (whether large or small)
n. relative importance"
major,"n. a commissioned military officer in the United States Army or Air Force or Marines; below lieutenant colonel and above captain
n. British statesman who was prime minister from 1990 until 1997 (born in 1943)
n. a university student who is studying a particular field as the principal subject
n. the principal field of study of a student at a university"
majestic,s. majestic in manner or bearing; superior to mundane matters
majesty,n impressiveness in scale or proportion
mark,"n. a number or letter indicating quality (especially of a student's performance)
n. a visible indication made on a surface
n. the impression created by doing something unusual or extraordinary that people notice and remember
n. a symbol of disgrace or infamy"
remark,"n. a statement that expresses a personal opinion or belief or adds information
n. explicit notice"
marked,"s. strongly marked; easily noticeable
s. singled out for notice or especially for a dire fate
a. having or as if having an identifying mark or a mark as specified; often used in combination"
remarkable,s. unusual or striking
margin,"n. the boundary line or the area immediately inside the boundary
n. an amount beyond the minimum necessary
n. the amount of collateral a customer deposits with a broker when borrowing from the broker to buy securities
n. the blank space that surrounds the text on a page"
marginal,s. producing at a rate that barely covers production costs
reply,n. the speech act of continuing a conversational exchange
ply,"n. one of the strands twisted together to make yarn or rope or thread; often used in combination
n. (usually in combinations) one of several layers of cloth or paper or wood as in plywood
v. apply oneself diligently
v. travel a route regularly"
plight,n. a solemn pledge of fidelity
imply,"v. express or state indirectly
v. suggest as a logically necessary consequence; in logic
v. have as a necessary feature"
implication,"n. an accusation that brings into intimate and usually incriminating connection
n. a logical relation between propositions p and q of the form `if p then q'; if p is true then q cannot be false
n. a relation implicated by virtue of involvement or close connection (especially an incriminating involvement)"
implicit,"a. implied though not directly expressed; inherent in the nature of something
s. being without doubt or reserve"
explicate,"v. elaborate, as of theories and hypotheses"
explication,"n. the act of making clear or removing obscurity from the meaning of a word or symbol or expression etc.
n. a detailed explanation of the meaning of something"
explicit,a. precisely and clearly expressed or readily observable; leaving nothing to implication
simple,"n. any herbaceous plant having medicinal properties
a. having few parts; not complex or complicated or involved
a. (botany) of leaf shapes; of leaves having no divisions or subdivisions
s. unornamented"
simplicity,"n. the quality of being simple or uncompounded
n. a lack of penetration or subtlety
n. absence of affectation or pretense"
simplify,v. make simpler or easier or reduce in complexity or extent
simplification,"n. an explanation that omits superfluous details and reduces complexity
n. elimination of superfluous details"
simplistic,s. characterized by extreme and often misleading simplicity
complicate,"v. make more complicated
v. make more complex, intricate, or richer"
complicated,s. difficult to analyze or understand
complication,"n. the act or process of complicating
n. a situation or condition that is complex or confused
n. any disease or disorder that occurs during the course of (or because of) another disease
n. a development that complicates a situation"
complex,"n. a conceptual whole made up of complicated and related parts
n. a compound described in terms of the central atom to which other atoms are bound or coordinated
n. (psychoanalysis) a combination of emotions and impulses that have been rejected from awareness but still influence a person's behavior
a. complicated in structure; consisting of interconnected parts"
complexion,"n. the coloring of a person's face
n. a combination that results from coupling or interlinking
n. a point of view or general attitude or inclination
n. texture and appearance of the skin of the face"
complexity,n. the quality of being intricate and compounded
perplex,v. be a mystery or bewildering to
display,"n. something intended to communicate a particular impression
n. something shown to the public
n. a visual representation of something
n. behavior that makes your feelings public"
deploy,"v. place troops or weapons in battle formation
v. to distribute systematically or strategically"
wrench,"n. a sharp strain on muscles or ligaments
n. a hand tool that is used to hold or twist a nut or bolt
v. twist or pull violently or suddenly, especially so as to remove (something) from that to which it is attached or from where it originates
v. make a sudden twisting motion"
discrete,s. constituting a separate entity or part
arena,"n. the central area of an ancient Roman amphitheater where contests and spectacles were held; especially an area that was strewn with sand
n. a playing field where sports events take place"
bowel,n the part of the alimentary canal between the stomach and the anus
cathedral,"n. any large and important church
n. the principal Christian church building of a bishop's diocese
a. relating to or containing or issuing from a bishop's office or throne"
condolence,n. an expression of sympathy with another's grief
culminate,"v. end, especially to reach a final or climactic stage
v. bring to a head or to the highest point
v. reach the highest or most decisive point
v. reach the highest altitude or the meridian, of a celestial body"
dock,"n. an enclosure in a court of law where the defendant sits during the trial
n. any of certain coarse weedy plants with long taproots, sometimes used as table greens or in folk medicine
n. a platform where trucks or trains can be loaded or unloaded
n. landing in a harbor next to a pier where ships are loaded and unloaded or repaired; may have gates to let water in or out"
exile,"n. a person who is voluntarily absent from home or country
n. a person who is expelled from home or country by authority
n. the act of expelling a person from their native land"
formidable,"s. extremely impressive in strength or excellence
s. inspiring fear"
glossary,n. an alphabetical list of technical terms in some specialized field of knowledge; usually published as an appendix to a text on that field
halt,v. cause to stop
hover,"v. be undecided about something; waver between conflicting positions or courses of action
v. move to and fro
v. hang in the air; fly or be suspended above"
interrogation,"n. a transmission that will trigger an answering transmission from a transponder
n. formal systematic questioning"
lane,"n. a narrow way or road
n. a well-defined track or path; for e.g. swimmers or lines of traffic"
loom,"n. a textile machine for weaving yarn into a textile
v. come into view indistinctly, often threateningly
v. appear very large or occupy a commanding position
v. weave on a loom"
monster,"n. an imaginary creature usually having various human and animal parts
n. a cruel wicked and inhuman person
n. (medicine) a grossly malformed and usually nonviable fetus"
part,"n. something determined in relation to something that includes it
n. something less than the whole of a human artifact
n. a portion of a natural object
n. that which concerns a person with regard to a particular role or situation"
participate,v. share in something
participation,n. the condition of sharing in common with others (as fellows or partners etc.)
participant,n. someone who takes part in an activity
partial,"s. being or affecting only a part; not total
a. showing favoritism"
particle,"n. a body having finite mass and internal structure but negligible dimensions
n. a function word that can be used in English to form phrasal verbs"
counterpart,"n. a person or thing having the same function or characteristics as another
n. a duplicate copy"
portion,"n something determined in relation to something that includes it
n something less than the whole of a human artifact
n the allotment of some amount by dividing something
n assets belonging to or due to or contributed by an individual person or group
n your overall circumstances or condition in life (including everything that happens to you)
n money or property brought by a woman to her husband at marriage
n an individual quantity of food or drink taken as part of a meal
v give out"
proportion,"n. the quotient obtained when the magnitude of a part is divided by the magnitude of the whole
n. magnitude or extent
n. the relation between things (or parts of things) with respect to their comparative quantity, magnitude, or degree
n. harmonious arrangement or relation of parts or elements within a whole (as in a design)"
proportional,"n. one of the quantities in a mathematical proportion
s. properly related in size or degree or other measurable characteristics; usually followed by `to'
s. having a constant ratio"
apart,"s. remote and separate physically or socially
s. having characteristics not shared by others
r. separated or at a distance in place or position or time
r. not taken into account or excluded from consideration"
compartment,"n. a space into which an area is subdivided
n. a partitioned section, chamber, or separate room within a larger enclosed area"
depart,"v. leave
v. go away or leave"
departure,n. the act of departing
impart,"v. transmit (knowledge or skills)
v. transmit or serve as the medium for transmission"
partition,"n. a vertical structure that divides or separates (as a wall divides one room from another)
n. (computer science) the part of a hard disk that is dedicated to a particular operating system or application and accessed as a single unit
n. (anatomy) a structure that separates areas in an organism
v. divide into parts, pieces, or sections"
measure,"n. any maneuver made as part of progress toward a goal
n. how much there is or how many there are of something that you can quantify
n. musical notation for a repeating pattern of musical beats
n. a container of some standard capacity that is used to obtain fixed amounts of a substance"
measurable,"a. capable of being measured
s. of distinguished importance"
measurement,n. the act or process of assigning numbers to phenomena according to a rule
dimension,"n. the magnitude of something in a particular direction (especially length or width or height)
n. one of three Cartesian coordinates that determine a position in space
v. indicate the dimensions on
v. shape or form to required dimensions"
immense,s unusually great in size or amount or degree or especially extent or scope
migrate,"v. move from one country or region to another and settle there
v. move periodically or seasonally"
migrant,"n. traveler who moves from one region or country to another
s. habitually moving from place to place especially in search of seasonal work"
immigrate,"v. migrate to a new environment
v. introduce or send as immigrants
v. come into a new country and change residency"
emigrate,v. leave one's country of residence for a new one
immigrant,n. a person who comes to a country where they were not born in order to settle there
emigrant,n. someone who leaves one country to settle in another
Monday,n. the second day of the week; the first working day
monarch,n. large migratory American butterfly having deep orange wings with black and white markings; the larvae feed on milkweed
monopoly,"n. (economics) a market in which there are many buyers but only one seller
n. exclusive control or possession of something
n. a board game in which players try to gain a monopoly on real estate as pieces advance around the board according to the throw of a die"
money,"n. the most common medium of exchange; functions as legal tender
n. wealth reckoned in terms of money
n. the official currency issued by a government or national bank"
monetary,a. relating to or involving money
mint,"n. any north temperate plant of the genus Mentha with aromatic leaves and small mauve flowers
n. any member of the mint family of plants
n. the leaves of a mint plant used fresh or candied
n. a candy that is flavored with a mint oil"
note,"n. a brief written record
n. a short personal letter
n. a notation representing the pitch and duration of a musical sound
n. a tone of voice that shows what the speaker is feeling"
notice,"n. an announcement containing information about an event
n. the act of noticing or paying attention
n. advance notification (usually written) of the intention to withdraw from an arrangement of contract
n. polite or favorable attention"
notable,"n a celebrity who is an inspiration to others
s worthy of notice
s widely known and esteemed"
noticeable,"a. capable or worthy of being perceived
s. readily noticed"
noteworthy,"s. worthy of notice
s. worthy of notice"
noted,s. worthy of notice or attention
notorious,s known widely and usually unfavorably; 
notify,v inform (somebody) of something
denote,"v. be a sign or indication of
v. have as a meaning"
notation,"n. a technical system of symbols used to represent special things
n. the activity of representing something by a special system of marks or characters"
notion,"n. a general inclusive concept
n. an odd or fanciful or capricious idea
n. (usually plural) small personal articles or clothing or sewing items"
name,"n. a language unit by which a person or thing is known
n. a person's reputation
n. family based on male descent
n. a well-known or notable person"
namely,r. as follows
nickname,"n. a familiar name for a person (often a shortened version of a person's given name)
n. a descriptive name for a place or thing"
nominal,"a. relating to or constituting or bearing or giving a name
s. insignificantly small; a matter of form only (`tokenish' is informal)
a. pertaining to a noun or to a word group that functions as a noun
a. of, relating to, or characteristic of an amount that is not adjusted for inflation"
nominate,"v. propose as a candidate for some honor
v. put forward; nominate for appointment to an office or for an honor or position"
anonymous,"a. having no known name or identity or known source
s. not known or lacking marked individuality"
page,"n. one side of one leaf (of a book or magazine or newspaper or letter etc.) or the written or pictorial matter it contains
n. English industrialist who pioneered in the design and manufacture of aircraft (1885-1962)
n. United States diplomat and writer about the Old South (1853-1922)
n. a boy who is employed to run errands"
propagate,"v. transmit from one generation to the next
v. travel through the air
v. transmit
v. transmit or cause to broaden or spread"
propaganda,n. information that is spread for the purpose of promoting some cause
pair,"n. a set of two similar things considered as a unit
n. two people considered as a unit
n. a poker hand with 2 cards of the same value
v. form a pair or pairs"
impair,v. make worse or less effective
peer,"n. a person who is of equal standing with another in a group
n. a nobleman (duke or marquis or earl or viscount or baron) who is a member of the British peerage
v. look searchingly"
pass,"n. (military) a written leave of absence
n. (American football) a play that involves one player throwing the ball to a teammate
n. the location in a range of mountains of a geological formation that is lower than the surrounding peaks
n. any authorization to pass or go somewhere"
bypass,"n. a surgically created shunt (usually around a damaged part)
v. avoid something unpleasant or laborious"
compass,"n. navigational instrument for finding directions
n. the limit of capability
n. drafting instrument used for drawing circles
v. bring about; accomplish"
overpass,n. bridge formed by the upper level of a crossing of two highways at different levels
surpass,v. be or do something to a greater degree
pastime,n. a diversion that occupies one's time and thoughts (usually pleasantly)
omelete,none
omelette,n beaten eggs or an egg mixture cooked until just set; may be folded around e.g. ham or cheese or jelly
pat,"n. the sound made by a gentle blow
s. exactly suited to the occasion
r. completely or perfectly"
pope,"n. the head of the Roman Catholic Church
n. English poet and satirist (1688-1744)"
reciprocal,"n. something (a term or expression or concept) that has a reciprocal relation to something else
a. concerning each of two or more persons or things; especially given or done in return
s. of or relating to the multiplicative inverse of a quantity or function"
sack,"n. a bag made of paper or plastic for holding customer's purchases
n. the quantity contained in a sack
n. any of various light dry strong white wine from Spain and Canary Islands (including sherry)
n. a woman's full loose hiplength jacket"
sincere,a. open and genuine; not deceitful
splash,"n. the sound like water splashing
n. a patch of bright color
n. the act of scattering water about haphazardly
v. mark or overlay with patches of contrasting color or texture; cause to appear splashed or spattered"
sulfur,n. an abundant tasteless odorless multivalent nonmetallic element; best known in yellow crystals; occurs in many sulphide and sulphate minerals and even in native form (especially in volcanic regions)
tile,"n. a flat thin rectangular slab (as of fired clay or rubber or linoleum) used to cover surfaces
n. a thin flat slab of fired clay used for roofing
n. game equipment consisting of a flat thin piece marked with characters and used in board games like Mah-Jong, Scrabble, etc.
v. cover with tiles"
wreck,"n. something or someone that has suffered ruin or dilapidation
n. a ship that has been destroyed at sea"
uncover,"v. make visible
v. remove all or part of one's clothes to show one's body"
archive,"n. a depository containing historical records and documents
v. put into an archive"
bolt,"n. a sliding bar in a breech-loading firearm that ejects an empty cartridge and replaces it and closes the breech
n. the part of a lock that is engaged or withdrawn with a key
n. a roll of cloth or wallpaper of a definite length
n. a screw that screws into a nut to form a fastener"
casino,"n. a public building for gambling and entertainment
n. a card game in which cards face up on the table are taken with eligible cards in the hand"
cue,"n. an actor's line that immediately precedes and serves as a reminder for some action or speech
n. sports implement consisting of a tapering rod used to strike a cue ball in pool or billiards"
excerpt,"n. a passage selected from a larger work
v. take out of a literary work in order to cite or copy"
foil,"n. a piece of thin and flexible sheet metal
n. anything that serves by contrast to call attention to another thing's good qualities
n. picture consisting of a positive photograph or drawing on a transparent base; viewed with a projector
n. a light slender flexible sword tipped by a button"
gland,n. any of various organs that synthesize substances needed by the body and release it through ducts or directly into the bloodstream
hail,"n. precipitation of ice pellets when there are strong rising air currents
n. many objects thrown forcefully through the air
n. enthusiastic greeting
v. be a native of"
constitute,v. form or compose
constituent,"n. a member of a constituency; a citizen who is represented in a government by officials for whom he or she votes
n. (grammar) a word or phrase or clause forming part of a larger grammatical construction
s. constitutional in the structure of something (especially your physical makeup)"
constitution,"n. the act of forming or establishing something
n. the way in which someone or something is composed
n. a United States 44-gun frigate that was one of the first three naval ships built by the United States; it won brilliant victories over British frigates during the War of 1812 and is without doubt the most famous ship in the history of the United States Navy; it has been rebuilt and is anchored in the Charlestown Navy Yard in Boston"
constitutional,"n. a regular walk taken as a form of exercise
a. of benefit to or intended to benefit your physical makeup
a. sanctioned by or consistent with or operating under the law determining the fundamental political principles of a government"
institute,"n. an association organized to promote art or science or education
v. advance or set forth in court"
institution,"n. an organization founded and united for a specific purpose
n. an establishment consisting of a building or complex of buildings where an organization for the promotion of some cause is situated
n. a custom that for a long time has been an important feature of some group or society"
institutional,"a. relating to or constituting or involving an institution
a. organized as or forming an institution"
substitute,"n. a person or thing that takes or can take the place of another
n. an athlete who plays only when a starter on the team is replaced
v. put in the place of another; switch seemingly equivalent items
v. be a substitute"
substitution,"n. an event in which one thing is substituted for another
n. the act of putting one thing or person in the place of another: ""he sent Smith in for Jones but the substitution came too late to help"""
proper,"a. marked by suitability or rightness or appropriateness
s. having all the qualities typical of the thing specified; not just a snack""
s. limited to the thing specified
s. appropriate for a condition or purpose or occasion or a person's character, needs"
propriety,n. correct or appropriate behavior
property,"n. something owned; any tangible or intangible possession that is owned by someone; 
n. a basic or essential attribute shared by all members of a class
n. a construct whereby objects or individuals can be distinguished
n. any movable articles or objects used on the set of a play or movie"
