triumph,n. the exultation of victory
vulgar,"s lacking refinement or cultivation or taste
s of or associated with the great masses of people
s being or characteristic of or appropriate to everyday language
s conspicuously and tastelessly indecent"
zinc,"n. a bluish-white lustrous metallic element; brittle at ordinary temperatures but malleable when heated; used in a wide variety of alloys and in galvanizing iron; it occurs naturally as zinc sulphide in zinc blende
v. coat or cover with zinc"
mechanics,n. the branch of physics concerned with the motion of bodies in a frame of reference
banquet,"n. a ceremonial dinner party for many people
n. a meal that is well prepared and greatly enjoyed"
bull,"n. uncastrated adult male of domestic cattle
n. a large and strong and heavyset man
n. a serious and ludicrous blunder
n. uncomplimentary terms for a policeman"
cholesterol,n. an animal sterol that is normally synthesized by the liver; the most abundant steroid in animal tissues
crane,"n. United States writer (1871-1900)
n. United States poet (1899-1932)
n. lifts and moves heavy objects; lifting tackle is suspended from a pivoted boom that rotates around a vertical axis
n. large long-necked wading bird of marshes and plains in many parts of the world"
deplore,"v. express strong disapproval of
v. regret strongly"
entertain,"v. provide entertainment for
v. take into consideration, have in view"
flank,"n. the side of military or naval formation
n. a subfigure consisting of a side of something
n. a cut from the fleshy part of an animal's side between the ribs and the leg
n. the side between ribs and hipbone"
galaxy,"n. a splendid assemblage (especially of famous people)
n. (astronomy) a collection of star systems; any of the billions of systems each having many stars and nebulae and dust"
grind,"n. the grade of particle fineness to which a substance is ground
n. the act of grinding to a powder or dust
v. dance by rotating the pelvis in an erotically suggestive way, often while in contact with one's partner such that the dancers' legs are interlaced
v. reduce to small pieces or particles by pounding or abrading"
democracy,"n. the political orientation of those who favor government by the people or by their elected representatives
n. a political system in which the supreme power lies in a body of citizens who can elect people to represent them"
democrat,"n. a member of the Democratic Party
n. an advocate of democratic principles"
democratic,"a. characterized by or advocating or based upon the principles of democracy or social equality
a. belong to or relating to the Democratic Party
s. representing or appealing to or adapted for the benefit of the people at large"
epidemic,"n. a widespread outbreak of an infectious disease; many people are infected at the same time
a. (especially of medicine) of disease or anything resembling a disease; attacking or affecting many individuals in a community or a population simultaneously"
corporation,n. a business firm whose articles of incorporation have been approved in some state
corporate,"a. of or belonging to a corporation
s. done by or characteristic of individuals acting together
s. organized and maintained as a legal corporation"
corps,"n. an army unit usually consisting of two or more divisions and their support
n. a body of people associated together"
corpse,n the dead body of a human being
incorporate,"v. include or contain; have as a component
v. form a corporation
v. unite or merge with something already in existence
s. formed or united into a whole"
incorporated,s. introduced into as a part of the whole
defend,"v. argue or speak in defense of
v. be on the defensive; act against an attack
v. protect against a challenge or attack
v. be the defense counsel for someone in a trial"
defendant,n. a person or institution against whom an action is brought in a court of law; the person being sued or accused
defender,"n. a person who cares for persons or property
n. a fighter who holds out against attack"
defence,"n (psychiatry) an unconscious process that tries to reduce the anxiety associated with instinctive desires
n (sports) the team that is trying to prevent the other team from scoring
n the defendant and his legal advisors collectively
n an organization of defenders that provides resistance against attack
n the speech act of answering an attack on your assertions
n the justification for some act or belief
n a structure used to defend against attack
n a defendant's answer or plea denying the truth of the charges against him
n (military) military action or resources protecting a country against potential enemies
n protection from harm
n the act of defending someone or something against attack or injury"
defense,"n. (military) military action or resources protecting a country against potential enemies
n. protection from harm
n. (sports) the team that is trying to prevent the other team from scoring"
defensive,"n. an attitude of defensiveness (especially in the phrase `on the defensive')
a. intended or appropriate for defending against or deterring aggression or attack
s. attempting to justify or defend in speech or writing"
offend,"v cause to feel resentment or indignation
v act in disregard of laws, rules, contracts, or promises
v strike with disgust or revulsion
v hurt the feelings of"
offence,"n the action of attacking an enemy
n the team that has the ball (or puck) and is trying to score
n a feeling of anger caused by being offended
n a lack of politeness; a failure to show regard for others; wounding the feelings or others
n (criminal law) an act punishable by law; usually considered an evil act"
offense,"n. the team that has the ball (or puck) and is trying to score
n. the action of attacking an enemy"
offensive,"s. violating or tending to violate or offend against
a. for the purpose of attack rather than defense
a. causing anger or annoyance
a. unpleasant or disgusting especially to the senses"
donate,v. give to a charity or good cause
donation,"n a voluntary gift (as of money or service or ideas) made to some worthwhile cause
n act of giving in common with others for a common purpose especially to a charity"
donor,"n. person who makes a gift of property
n. (medicine) someone who gives blood or tissue or an organ to be used in another person (the host)"
endow,"v. give qualities or abilities to
v. furnish with an endowment"
neither,s. not either; not one or the other
neutral,"n. one who does not side with any party in a war or dispute
s. not supporting or favoring either side in a war, dispute, or contest
a. possessing no distinctive quality or characteristics
s. lacking distinguishing quality or characteristics"
neutralize,"v. make politically neutral and thus inoffensive
v. make ineffective by counterbalancing the effect of
v. get rid of (someone who may be a threat) by killing
v. make incapable of military action"
neutralise,"v get rid of (someone who may be a threat) by killing
v make incapable of military action
v make ineffective by counterbalancing the effect of
v make chemically neutral"
negative,"n. a reply of denial
n. a piece of photographic film showing an image with light and shade or colors reversed
a. characterized by or displaying negation or denial or opposition or resistance; having no positive features
a. expressing or consisting of a negation or refusal or denial"
over,"n. (cricket) the division of play during which six balls are bowled at the batsman by one player from the other team from the same end of the pitch
r. at or to a point across intervening space etc.
r. throughout an area
r. throughout a period of time"
overall,"n. (usually plural) work clothing consisting of denim trousers (usually with a bib and shoulder straps)
n. a loose protective coverall or smock worn over ordinary clothing for dirty work
s. involving only main features
s. including everything"
overlap,"n. a representation of common ground between theories or phenomena
n. the property of partial coincidence in time
v. coincide partially or wholly
v. extend over and cover a part of"
overcome,v. get on top of; deal with successfully
overflow,"n. the occurrence of surplus liquid (as water) exceeding the limit or capacity
v. flow or run over (a limit or brim)"
overtake,v. catch up with and possibly overtake
overwhelm,"v. overcome, as with emotions or perceptual stimuli
v. charge someone with too many tasks"
overwhelming,"v overcome, as with emotions or perceptual stimuli
v charge someone with too many tasks
v cover completely or make imperceptible
v overcome by superior force
s so strong as to be irresistible
s very intense"
overthrow,"n. the termination of a ruler or institution (especially by force)
v. cause the downfall of; of rulers"
overturn,"n. an improbable and unexpected victory
v. turn from an upright or normal position
v. cause to overturn from an upright or normal position"
overestimate,"n. an appraisal that is too high
n. a calculation that results in an estimate that is too high
v. make too high an estimate of"
overload,"n. an electrical load that exceeds the available electrical power
n. an excessive burden
v. become overloaded
v. place too much a load on"
overtime,"n. work done in addition to regular working hours
n. playing time beyond regulation, to break a tie
r. beyond the regular time"
example,"n. an item of information that is typical of a class or group
n. punishment intended as a warning to others"
exemplify,"v. be characteristic of
v. clarify by giving an example of"
exemplary,s. worthy of imitation
sample,"n. a small part of something intended as representative of the whole
n. all or part of a natural object that is collected and preserved as an example of its class
v. take a sample of"
fascism,n. a political theory advocating an authoritarian hierarchical government (as opposed to democracy or liberalism)
fascist,"n. an adherent of fascism or other right-wing authoritarian views
a. relating to or characteristic of fascism"
fascinate,"v. to render motionless, as with a fixed stare or by arousing terror or awe"
fascinating,"v cause to be interested or curious
v to render motionless, as with a fixed stare or by arousing terror or awe
v attract; cause to be enamored
s capable of arousing and holding the attention
s capturing interest as if by a spell"
fraction,"n. a component of a mixture that has been separated by a fractional process
n. a small part or item forming a piece of a whole
n. the quotient of two rational numbers"
fracture,"n. breaking of hard tissue such as bone
n. the act of cracking something
v. violate or abuse
v. interrupt, break, or destroy"
fragment,"n. a piece broken off or cut off of something else
n. an incomplete piece"
fragile,s. vulnerably delicate
infringe,"v go against, as of rules and laws
v advance beyond the usual limit"
new,"a. not of long duration; having just (or relatively recently) come into being or been made or acquired or discovered
s. having no previous example or precedent or parallel
s. other than the former one(s); different
a. unaffected by use or exposure"
anew,r again but in a new or different way
renew,"v reestablish on a new, usually improved, basis or make new or like new
v cause to appear in a new form"
renewable,"a. that can be renewed or extended
s. capable of being renewed; replaceable"
novel,"n. an extended fictional work in prose; usually in the form of a story
n. a printed and bound book that is an extended work of fiction
s. pleasantly new or different"
novelty,n. originality by virtue of being new and surprising
innovate,v bring something new to an environment
innovation,"n a creation (a new device or process) resulting from study and experimentation
n the creation of something in the mind
n the act of starting something for the first time; introducing something new"
command,"n. an authoritative direction or instruction to do something
n. a military unit or region under the control of a single officer
n. the power or authority to command
n. availability for use"
commander,"n. someone in an official position of authority who can command or control others
n. a commissioned naval officer who ranks above a lieutenant commander and below a captain"
demand,"n. an urgent or peremptory request
n. the ability and desire to purchase goods and services
n. the act of demanding
v. request urgently and forcefully"
demanding,a. requiring more than usually expected or thought due; especially great patience and effort and skill
continue,"v. continue a certain state, condition, or activity
v. continue talking
v. keep or maintain in unaltered condition; cause to remain or last
v. do something repeatedly and showing no intention to stop"
continual,"a. occurring without interruption; chiefly restricted to what recurs regularly or frequently in a prolonged and closely spaced series
s. `continual' (meaning seemingly uninterrupted) is often used interchangeably with `continuous' (meaning without interruption)"
continuous,"a. continuing in time or space without interruption
a. of a function or curve; extending without break or irregularity"
continuation,"n the act of continuing an activity without interruption
n a part added to a book or play that continues and extends it
n a Gestalt principle of organization holding that there is an innate tendency to perceive a line as continuing its established direction
n the consequence of being lengthened in duration"
continuance,n. the act of continuing an activity without interruption
continuity,"n. uninterrupted connection or union
n. a detailed script used in making a film in order to avoid discontinuities from shot to shot
n. the property of a continuous and connected period of time"
hip,"n. either side of the body below the waist and above the thigh
n. the ball-and-socket joint between the head of the femur and the acetabulum
n. (architecture) the exterior angle formed by the junction of a sloping side and a sloping end of a roof
n. the fruit of a rose plant"
idiot,n. a person of subnormal intelligence
jelly,"n. a preserve made of the jelled juice of fruit
n. any substance having the consistency of jelly or gelatin"
lesbian,"n. a female homosexual
n. a resident of Lesbos
s. of or relating to or characterized by homosexual relations between woman"
masculine,"n. a gender that refers chiefly (but not exclusively) to males or to objects classified as male
a. of grammatical gender
a. associated with men and not with women
s. (music or poetry) ending on an accented beat or syllable"
nickel,"n. a hard malleable ductile silvery metallic element that is resistant to corrosion; used in alloys; occurs in pentlandite and smaltite and garnierite and millerite
n. a United States coin worth one twentieth of a dollar
n. five dollars worth of a drug
v. plate with nickel"
overt,a. open and observable; not secret or hidden
pervasive,s spreading or spread throughout
queer,"v. put in a dangerous, disadvantageous, or difficult position"
rifle,"n. a shoulder firearm with a long barrel and a rifled bore
v. go through in search of something; search through someone's belongings in an unauthorized way"
seam,"n. joint consisting of a line formed by joining two pieces
n. a stratum of ore or coal thick enough to be mined with profit
v. put together with a seam"
slogan,n a favorite saying of a sect or political group
steer,"v. direct the course; determine the direction of travelling
v. direct (oneself) somewhere"
tariff,v. charge a tariff
tribe,"n. a social division of (usually preliterate) people
n. a federation (as of American Indians)
n. (biology) a taxonomic category between a genus and a subfamily"
voucher,"n. someone who vouches for another or for the correctness of a statement
n. a document that serves as evidence of some expenditure"
zigzag,"n. an angular shape characterized by sharp turns in alternating directions
v. travel along a zigzag path
s. having short sharp turns or angles"
bacteria,n. (microbiology) single-celled or noncellular spherical or spiral or rod-shaped organisms lacking chlorophyll that reproduce by fission; important as pathogens and for biochemical properties; taxonomy is difficult; often considered to be plants
bud,"n. a partially opened flower
n. a swelling on a plant stem consisting of overlapping immature leaves or petals
v. develop buds
v. start to grow or develop"
chin,"n. the protruding part of the lower jaw
v. raise oneself while hanging from one's hands until one's chin is level with the support bar"
dole,"n. a share of money or food or clothing that has been charitably given
n. money received from the state"
judge,"n. a public official authorized to decide questions brought before a court of justice
v. determine the result of (a competition)
v. put on trial or hear a case and sit as the judge at the trial of"
judgment,"n. an opinion formed by judging something
n. the act of judging or assessing a person or situation or event
n. (law) the determination by a court of competent jurisdiction on matters submitted to it
n. the cognitive process of reaching a decision or drawing conclusions"
judgement,"n the legal document stating the reasons for a judicial decision
n an opinion formed by judging something
n the cognitive process of reaching a decision or drawing conclusions
n the mental ability to understand and discriminate between relations
n the capacity to assess situations or circumstances shrewdly and to draw sound conclusions
n (law) the determination by a court of competent jurisdiction on matters submitted to it
n the act of judging or assessing a person or situation or event"
judicial,"s. decreed by or proceeding from a court of justice
a. belonging or appropriate to the office of a judge
a. relating to the administration of justice or the function of a judge"
judiciary,"n. persons who administer justice
n. the system of law courts that administer justice and constitute the judicial branch of government"
prejudice,"v. disadvantage by prejudice
v. influence (somebody's) opinion in advance"
jury,"n. a body of citizens sworn to give a true verdict according to the evidence presented in a court of law
n. a committee appointed to judge a competition"
offer,"n. the verbal act of offering
n. something offered (as a proposal or bid)
v. make available or accessible, provide or furnish
v. present for acceptance or rejection"
confer,"v. have a conference in order to talk something over
v. present"
conference,"n. a prearranged meeting for consultation or exchange of information or discussion (especially one with a formal agenda)
n. a discussion among participants who have an agreed (serious) topic"
infer,"v reason by deduction; establish by deduction
v draw from specific cases for more general cases
v conclude by reasoning; in logic
v guess correctly; solve by guessing
v believe to be the case"
inference,n. the reasoning involved in drawing a conclusion or making a logical judgment on the basis of circumstantial evidence and prior conclusions rather than on the basis of direct observation
refer,"v. be relevant to
v. think of, regard, or classify under a subsuming principle or with a general group or in relation to another
v. send or direct for treatment, information, or a decision
v. use a name to designate"
referee,"n. (sports) the chief official (as in boxing or American football) who is expected to ensure fair play
n. an attorney appointed by a court to investigate and report on a case
v. be a referee or umpire in a sports competition
v. evaluate professionally a colleague's work"
reference,"n. the most direct or specific meaning of a word or expression; the class of objects that an expression refers to
n. the act of referring or consulting
n. a publication (or a passage from a publication) that is referred to
n. the relation between a word or phrase and the object or idea it refers to"
transfer,"n. someone who transfers or is transferred from one position to another
n. the act of transfering something from one form to another
n. a ticket that allows a passenger to change conveyances
n. application of a skill learned in one situation to a different but similar situation"
transference,n. (psychoanalysis) the process whereby emotions are passed on or displaced from one person to another; during psychoanalysis the displacement of feelings toward others (usually the parents) is onto the analyst
minister,"n. a person appointed to a high office in the government
n. a diplomat representing one government to another; ranks below ambassador
n. the job of a head of a government department
v. attend to the wants and needs of others"
ministerial,"a. of or relating to a minister of religion or the minister's office
a. of or relating to a government minister or ministry"
ministry,"n. religious ministers collectively (especially Presbyterian)
n. building where the business of a government department is transacted
n. a government department under the direction of a minister
n. the work of a minister of religion"
administer,"v. work in an administrative capacity; supervise or be in charge of
v. perform (a church sacrament) ritually
v. give or apply (medications)
v. direct the taking of"
administration,"n. a method of tending to or managing the affairs of a some group of people (especially the group's business affairs)
n. the persons (or committees or departments etc.) who make up a body for the purpose of administering something
n. the act of administering medication
n. the act of meting out justice according to the law"
administrative,a. of or relating to or responsible for administration
passion,"n. a strong feeling or emotion
n. a feeling of strong sexual desire
n. the suffering of Jesus at the Crucifixion"
passionate,a. having or expressing strong emotions
compassion,"n. a deep awareness of and sympathy for another's suffering
n. the humane quality of understanding the suffering of others and wanting to do something about it"
compassionate,a. showing or having compassion
rot,"n a state of decay usually accompanied by an offensive odor
n (biology) the process of decay caused by bacterial or fungal action
n unacceptable behavior (especially ludicrously false statements)
v break down
v become physically weaker"
rotten,s. having decayed or disintegrated; usually implies foulness
corrode,"v. cause to deteriorate due to the action of water, air, or an acid
v. become destroyed by water, air, or a corrosive such as an acid"
erode,"v. become ground down or deteriorate
v. remove soil or rock"
corrosion,"n. a state of deterioration in metals caused by oxidation or chemical action
n. erosion by chemical action"
erosion,"n. (geology) the mechanical process of wearing or grinding something down (as by particles washing over it)
n. condition in which the earth's surface is worn away by the action of water and wind
n. a gradual decline of something"
stick,"n. an implement consisting of a length of wood
n. a small thin branch of a tree
n. a lever used by a pilot to control the ailerons and elevators of an airplane
n. a rectangular quarter pound block of butter or margarine"
stitch,"n. a link or loop or knot made by an implement in knitting, crocheting, embroidery, or sewing
n. a sharp spasm of pain in the side resulting from running"
sticky,"s. moist as with undried perspiration and with clothing sticking to the body
s. covered with an adhesive material"
chopsticks,n one of a pair of slender sticks used as oriental tableware to eat food with
lipstick,"n. makeup that is used to color the lips
v. form by tracing with lipstick
v. apply lipstick to"
stack,"n. an orderly pile
v. load or cover with stacks
v. arrange in stacks
v. arrange the order of so as to increase one's winning chances"
stalk,"n. a slender or elongated structure that supports a plant or fungus or a plant part or plant organ
n. a hunt for game carried on by following it stealthily or waiting in ambush
n. the act of following prey stealthily
n. a stiff or threatening gait"
stake,"n. instrument of execution consisting of a vertical post that a victim is tied to for burning
n. the money risked on a gamble
n. a strong wooden or metal post with a point at one end so it can be driven into the ground
v. mark with a stake"
stock,"n. the capital raised by a corporation through the issue of shares entitling holders to an ownership interest (equity)
n. the merchandise that a shop has on hand
n. the handle of a handgun or the butt end of a rifle or shotgun or part of the support of a machine gun or artillery gun
n. the reputation and popularity a person has"
strain,"n. (physics) deformation of a physical body under the action of applied forces
n. (psychology) nervousness resulting from mental stress
n. injury to a muscle (often caused by overuse); results in swelling and pain
n. an intense or violent exertion"
constrain,"v hold back
v restrict"
restrain,"v. keep under control; keep in check
v. to close within bounds, limit or hold back from movement
v. hold back"
restraint,"n. the act of controlling by restraining someone or something
n. discipline in personal and social activities
n. a rule or condition that limits freedom
n. a device that retards something's motion"
strict,"s rigidly accurate; allowing no deviation from a standard
s (of rules) stringently enforced
a characterized by strictness, severity, or restraint
s incapable of compromise or flexibility
s severe and unremitting in making demands"
constrict,v. become tight or as if tight
restrict,"v. place restrictions on
v. place under restrictions; limit access to
v. place limits on (extent or access)"
restriction,"n. a principle that limits the extent of something
n. the act of keeping something within specified bounds (by force if necessary)"
terrible,"s causing fear or dread or terror
s exceptionally bad or displeasing
s intensely or extremely bad or unpleasant in degree or quality
s extreme in degree or extent or amount or impact"
