raise,"n. the amount a salary is increased
n. increasing the size of a bet (as in poker)
v. raise the level or amount of something
v. raise from a lower to a higher position"
permission,n. approval to do something
disabled,"n. people collectively who are crippled or otherwise physically handicapped
s. incapable of functioning as a consequence of injury or illness"
teenager,n a juvenile between the onset of puberty and maturity
offer,"n. the verbal act of offering
n. something offered (as a proposal or bid)
v. make available or accessible, provide or furnish
v. present for acceptance or rejection"
suffer,"v. undergo or be subjected to
v. undergo (as of injuries and illnesses)
v. experience (emotional) pain
v. get worse"
serious,"a. concerned with work or important matters rather than play or trivialities
s. of great consequence
s. requiring effort or concentration; complex and not easy to answer or solve"
illness,n. impairment of normal physiological function affecting part or all of an organism
organize,"v. cause to be structured or ordered or operating according to some principle or idea
v. bring order and organization to
v. arrange by systematic planning and united effort"
express,"n. mail that is distributed by a rapid and efficient system
n. public transport consisting of a fast train or bus that makes only a few scheduled stops
n. rapid transport of goods
v. give expression to"
pain,"n. a symptom of some physical hurt or disorder
n. emotional distress; a fundamental feeling that people try to avoid
n. a somatic sensation of acute discomfort
n. a bothersome annoying person"
lonely,"s. marked by dejection from being alone
s. devoid of creatures"
friendship,n. the state of being friends (or friendly)
difficulty,"n. a factor causing trouble in achieving a positive result or tending to produce a negative result
n. a condition or state of affairs almost beyond one's ability to deal with and requiring great effort to bear or overcome
n. the quality of being difficult"
joy,"n. the emotion of great happiness
n. something or someone that provides a source of happiness"
peace,"n. the state prevailing during the absence of war
n. harmonious relations; freedom from disputes
n. the absence of mental stress or anxiety
n. the general security of public places"
hurt,"v. give trouble or pain to
v. cause damage or affect negatively
v. hurt the feelings of
v. feel physical pain"
courage,n. a quality of spirit that enables you to face danger or pain without showing fear
spirits,"n an alcoholic beverage that is distilled rather than fermented
n the vital principle or animating force within living things
n the general atmosphere of a place or situation and the effect that it has on people
n a fundamental emotional and activating principle determining one's character
n any incorporeal supernatural being that can become visible (or audible) to human beings
n the state of a person's emotions (especially with regard to pleasure or dejection)
n the intended meaning of a communication
n animation and energy in action or expression
n an inclination or tendency of a certain kind
v infuse with spirit"
pay,"v. give money, usually in exchange for goods or services
v. do or give something to somebody in return
v. be worth it
v. render"
community,"n. a group of people living in a particular local area
n. common ownership
n. a group of nations having common interests
n. agreement as to goals"
in need,none
voluntary work,none
ask permission,none
suffer from,none
raise one's spirits,none
in order to,none
language,"n. a systematic means of communicating by the use of sounds or conventional symbols
n. the mental faculty or power of vocal communication"
communication,"n. the activity of communicating; the activity of conveying information
n. something that is communicated by or to or between people or groups
n. a connection allowing access between persons or places"
ballet,"n. a theatrical representation of a story that is performed to music by trained dancers
n. music written for a ballet"
accept,"v. consider or hold as true
v. receive willingly something given or offered
v. give an affirmative reply to; respond favorably to
v. react favorably to; consider right and proper"
reject,"v. refuse to accept or acknowledge
v. reject with contempt
v. refuse entrance or membership"
meaning,"n. the message that is intended or expressed or signified
n. the idea that is intended
s. rich in significance or implication"
gesture,"n. motion of hands or body to emphasize or help to express a thought or feeling
n. the use of movements (especially of the hands) to communicate familiar or prearranged signals
n. something done as an indication of intention"
message,"n. a communication (usually brief) that is written or spoken or signaled
n. what a communication that is about something is about
v. send a message to
v. send as a message"
bored,s. tired of the world
part-time,a. involving less than the standard or customary time for an activity
well-dressed,s having tasteful clothing and being scrupulously neat
lady,"n. a polite name for any woman
n. a woman of the peerage in Britain"
sigh,"n. an utterance made by exhaling audibly
n. a sound like a person sighing
v. heave or utter a sigh; breathe deeply and heavily
v. utter with a sigh"
matter,"n. a vaguely specified concern
n. that which has mass and occupies space
n. a problem
n. (used with negation) having consequence"
expression,"n. the feelings expressed on a person's face
n. expression without words
n. the communication (in speech or writing) of your beliefs or opinions
n. (genetics) the process of expressing a gene"
appearance,"n. outward or visible aspect of a person or thing
n. the event of coming into sight
n. formal attendance (in court or at a hearing) of a party in an action
n. a mental representation"
impression,"n. a vague idea in which some confidence is placed
n. an outward appearance
n. all the copies of a work printed at one time
n. (dentistry) an imprint of the teeth and gums in wax or plaster"
towards,"prep. In the direction of; to.
prep. With direction to, in a moral sense; with respect or
   reference to; regarding; concerning.
prep. Tending to; in the direction of; in behalf of.
prep. Near; about; approaching to.
adv. Near; at hand; in state of preparation.
prep. & adv. See Toward."
hold,"n. power by which something or someone is affected or dominated
n. a stronghold
n. a cell in a jail or prison
v. have or hold in one's hands or grip"
later,"s. coming at a subsequent time or stage
r. comparative of the adverb `late'"
remind,v. put in the mind of someone
neck,"n. the part of an organism (human or animal) that connects the head to the rest of the body
n. a narrow elongated projecting strip of land
n. a cut of meat from the neck of an animal
n. a narrow part of an artifact that resembles a neck in position or form"
cross,"n. a wooden structure consisting of an upright post with a transverse piece
n. a representation of the structure on which Jesus was crucified; used as an emblem of Christianity or in heraldry
n. any affliction that causes great suffering
v. fold so as to resemble a cross"
nod,"n. a sign of assent or salutation or command
n. the act of nodding the head
v. express or signify by nodding
v. lower and raise the head, as to indicate assent or agreement or confirmation"
shake,"v. move or cause to move back and forth
v. move with or as if with a tremor
v. undermine or cause to waver
v. get rid of"
sure,"s. physically secure or dependable
s. (of persons) worthy of trust or confidence
s. infallible or unfailing
s. certain not to fail"
body language,none
take place,none
sit up,n. a stomach exercise in which a person sits up from a supine position without using the arms for leverage
make a good impression on ...,none
remind sb. about sth.,none
description,"n. a statement that represents something in words
n. the act of describing something
n. sort or variety"
describe,v. give a description of
fisherman,n. someone whose occupation is catching fish
net,"n. a trap made of netting to catch fish or birds or insects
n. a goal lined with netting (as in soccer or hockey)
n. game equipment consisting of a strip of netting dividing the playing area in tennis or badminton
n. an open fabric of string or rope or wire woven together at regular intervals"
although,"conj. Grant all this; be it that; supposing that;
   notwithstanding; though."
fit,"n. a display of bad temper
n. the manner in which something fits
v. be the right size or shape; fit correctly or as desired
v. make fit"
cormorant,n. large voracious dark-colored long-necked seabird with a distensible pouch for holding fish; used in Asia to catch fish
dive,"n. a headlong plunge into water
n. a steep nose-down descent by an aircraft
v. drop steeply
v. plunge into water"
ready,"n. poised for action
a. completely prepared or in condition for immediate action or use or progress
s. (of especially money) immediately available
s. mentally disposed"
reach,"n. the act of physically reaching or thrusting out
v. reach a destination, either real or abstract
v. reach a point in time, or a certain state or level
v. move forward or upward in order to touch; also in a metaphorical sense"
attract,"v. direct toward itself or oneself by means of some psychological power or physical attributes
v. be attractive to
v. exert a force on (a body) causing it to approach or prevent it from moving away"
hang,"n. the way a garment hangs
n. a gymnastic exercise performed on the rings or horizontal bar or parallel bars when the gymnast's weight is supported by the arms
v. be suspended or hanging
v. cause to be hanging or suspended"
post,"n. the position where someone (as a guard or sentry) stands or is assigned to stand
n. an upright consisting of a piece of timber or metal fixed firmly in an upright position
n. United States aviator who in 1933 made the first solo flight around the world (1899-1935)
n. United States female author who wrote a book and a syndicated newspaper column on etiquette (1872-1960)"
require,"v require as useful, just, or proper
v consider obligatory; request and expect
v make someone do something
v have need of"
practise,"v engage in a rehearsal (of)
v carry out or practice; as of jobs and professions
v learn by repetition"
tool,"n. an implement used in the practice of a vocation
v. drive
v. furnish with tools
v. work with a tool"
scissors,"n. an edge tool having two crossed pivoting blades
n. a wrestling hold in which you wrap your legs around the opponents body or head and put your feet together and squeeze
n. a gymnastic exercise performed on the pommel horse when the gymnast moves his legs as the blades of scissors move"
pattern,"n. a model considered worthy of imitation
v. form a pattern"
character,"n. the inherent complex of attributes that determines a persons moral and ethical actions and reactions
n. an actor's portrayal of someone in a play
n. a person of a specified kind (usually with many eccentricities)
n. good repute"
health,"n. a healthy state of wellbeing free from disease
n. the general condition of body and mind"
luck,"n. an unknown and unpredictable phenomenon that causes an event to result one way rather than another
n. an unknown and unpredictable phenomenon that leads to a favorable outcome"
wedding,"n. the social event at which the ceremony of marriage is performed
n. a party of people at a wedding"
dough,n. a flour mixture stiff enough to knead or roll
rough,"n. the part of a golf course bordering the fairway where the grass is not cut short
a. having or caused by an irregular surface
s. (of persons or behavior) lacking refinement or finesse
a. of the margin of a leaf shape; having the edge cut or fringed or scalloped"
size,"n. the physical magnitude of something (how big it is)
n. the property resulting from being one of a series of graduated measurements (as of clothing)
n. any glutinous material used to fill pores in surfaces or to stiffen fabrics
n. the actual state of affairs"
simple,"n. any herbaceous plant having medicinal properties
a. having few parts; not complex or complicated or involved
a. (botany) of leaf shapes; of leaves having no divisions or subdivisions
s. unornamented"
lovely,s. appealing to the emotions as well as the eye
paper cutting,none
up to,none
set off,"n. That which is set off against another thing; an offset.
n. That which is used to improve the appearance of anything;
   a decoration; an ornament.
n. A counterclaim; a cross debt or demand; a distinct claim
   filed or set up by the defendant against the plaintiff's demand.
n. Same as Offset, n., 4.
n. See Offset, 7."
up and down,none
after dark,none
no more,none
all the time,none
cartoon,"n. a humorous or satirical drawing published in a newspaper or magazine
n. a film made by photographing a series of cartoon drawings to give the illusion of movement when projected in rapid sequence
v. draw cartoons of"
warning,"n. a message informing of danger
n. notification of something, usually in advance"
role-play,none
symbol,"n. an arbitrary sign (written or printed) that has acquired a conventional significance
n. something visible that by association or convention represents something else that is invisible"
bubble,"n. a hollow globule of gas (e.g., air or carbon dioxide)
n. an impracticable and illusory idea
n. a dome-shaped covering made of transparent glass or plastic
v. form, produce, or emit bubbles"
thought,n. the organized beliefs of a period or group or individual
rough,"n. the part of a golf course bordering the fairway where the grass is not cut short
a. having or caused by an irregular surface
s. (of persons or behavior) lacking refinement or finesse
a. of the margin of a leaf shape; having the edge cut or fringed or scalloped"
sketch,"n. preliminary drawing for later elaboration
n. a brief literary description
n. short descriptive summary (of events)
v. make a sketch of"
program,"n. a system of projects or services intended to meet a public need
n. an announcement of the events that will occur as part of a theatrical or sporting event
n. (computer science) a sequence of instructions that a computer can interpret and execute
n. a performance (or series of performances) at a public presentation"
record,"n. anything (such as a document or a phonograph record or a photograph) providing permanent evidence of or information about past events
n. the number of wins versus losses and ties a team has had
n. the sum of recognized accomplishments
n. a compilation of the known facts regarding something or someone"
effect,"n. an impression (especially one that is artificial or contrived)
n. the central meaning or theme of a speech or literary work
n. (of a law) having legal validity
n. a symptom caused by an illness or a drug"
basic,"n. a popular programming language that is relatively easy to learn; an acronym for beginner's all-purpose symbolic instruction code; no longer in general use
n. (usually plural) a necessary commodity for which demand is constant
a. pertaining to or constituting a base or basis
s. reduced to the simplest and most significant form possible without loss of generality"
stage,"n. a large platform on which people can stand and can be seen by an audience
n. the theater as a profession (usually `the stage')
n. a section or portion of a journey or course
n. any scene regarded as a setting for exhibiting or doing something"
pleasant,"a. affording pleasure; being in harmony with your taste or likings
s. (of persons) having pleasing manners or behavior"
detailed,s. developed or executed with care and in minute detail
appear,"v. come into sight or view
v. be issued or published
v. seem to be true, probable, or apparent
v. come into being or existence, or appear on the scene"
actor,"n. a theatrical performer
n. a person who acts and gets things done"
match,"n. lighter consisting of a thin piece of wood or cardboard tipped with combustible chemical; ignites with friction
n. a formal contest in which two or more persons or teams compete
n. a burning piece of wood or cardboard
n. an exact duplicate"
separately,r apart from others
play,"n. a dramatic work intended for performance by actors on a stage
n. a theatrical performance of a drama
n. a preset plan of action in team sports
n. a state in which action is feasible"
score,"n. a written form of a musical composition; parts for different instruments appear on separate staves on large pages
n. a number that expresses the accomplishment of a team or an individual in a game or contest
n. a set of twenty members
n. grounds"
team,"n. a cooperative unit (especially in sports)
n. two or more draft animals that work together to pull something
v. form a team"
star,"n. (astronomy) a celestial body of hot gases that radiates energy derived from thermonuclear reactions in the interior
n. any celestial body visible (as a point of light) from the Earth at night
n. an actor who plays a principal role
n. a plane figure with 5 or more points; often used as an emblem"
mystery,"n. something that baffles understanding and cannot be explained
n. a story about a crime (usually murder) presented as a novel or play or movie"
island,"n. a land mass (smaller than a continent) that is surrounded by water
n. a zone or area resembling an island"
storm,"n. a violent weather condition with winds 64-72 knots (11 on the Beaufort scale) and precipitation and thunder and lightning
n. a violent commotion or disturbance
n. a direct and violent assault on a stronghold
v. take by force"
jacket,"n. a short coat
n. an outer wrapping or casing
n. the outer skin of a potato
n. the tough metal shell casing for certain kinds of ammunition"
wave,"n. one of a series of ridges that moves across the surface of a liquid (especially across a large body of water)
n. a movement like that of a sudden occurrence or increase in a specified phenomenon
n. (physics) a movement up and down or back and forth
n. something that rises rapidly"
comic strip,none
pop out,none
decide on,none
video camera,none
play against,none
weather forecast,none
life jacket,none
thank goodness,none
make it,none
endangered,s. (of flora or fauna) in imminent danger of extinction
file,"n. a set of related records (either written or electronic) kept together
n. a line of persons or things ranged one behind the other
n. office furniture consisting of a container for keeping papers in order
n. a steel hand tool with small sharp teeth on some or all of its surfaces; used for smoothing wood or metal"
giant panda,none
obligation,"n. the state of being obligated to do or pay something
n. a personal relation in which one is indebted for a service or favor
n. a legal agreement specifying a payment or action and the penalty for failure to comply"
wild,"n. a wild primitive state untouched by civilization
a. marked by extreme lack of restraint or control
a. in a natural state; not tamed or domesticated or cultivated
s. in a state of extreme emotion"
bamboo,"n. the hard woody stems of bamboo plants; used in construction and crafts and fishing poles
n. woody tropical grass having hollow woody stems; mature canes used for construction and furniture"
adult,"n. a fully developed person from maturity onward
n. any mature animal
s. (of animals) fully developed"
weight,"n. the vertical force exerted by a mass as a result of gravity
n. sports equipment used in calisthenic exercises and weightlifting; it is not attached to anything and is raised and lowered by use of the hands and arms
n. the relative importance granted to something
n. an artifact that is heavy"
kilogram,n. one thousand grams; the basic unit of mass adopted under the Systeme International d'Unites
population,"n. the people who inhabit a territory or state
n. a group of organisms of the same species inhabiting a given area
n. (statistics) the entire aggregation of items from which samples can be drawn
n. the number of inhabitants (either the total number or the number of a particular race or class) in a given place (country or city etc.)"
behaviour,"n the action or reaction of something (as a machine or substance) under specified circumstances
n (behavioral attributes) the way a person behaves toward other people
n (psychology) the aggregate of the responses or reactions or movements made by an organism in any situation
n manner of acting or controlling yourself"
birth,"n. the time when something begins (especially life)
n. the event of being born
n. a baby born; an offspring"
patch,"n. a piece of cloth used as decoration or to mend or cover a hole
n. a short set of commands to correct a bug in a computer program
v. to join or unite the pieces of
v. provide with a patch; also used metaphorically"
shoulder,"n. the part of the body between the neck and the upper arm
n. a cut of meat including the upper joint of the foreleg
n. a ball-and-socket joint between the head of the humerus and a cavity of the scapula
n. the part of a garment that covers or fits over the shoulder"
central,"n. a workplace that serves as a telecommunications facility where lines from telephones can be connected together to permit communication
a. in or near a center or constituting a center; the inner area"
menu,"n. a list of dishes available at a restaurant
n. the dishes making up a meal
n. (computer science) a list of options available to a computer user
n. an agenda of things to do"
fur,"n. the dressed hairy coat of a mammal
n. dense coat of fine silky hairs on mammals (e.g., cat or seal or weasel)
n. a garment made of the dressed hairy coat of a mammal"
cruel,s (of persons or their actions) able or disposed to inflict pain or suffering
organization,"n. a group of people who work together
n. the act of organizing a business or an activity related to a business
n. an ordered manner; orderliness by virtue of being methodical and well organized
n. the activity or result of distributing or disposing persons or things properly or methodically"
danger,"n. the condition of being susceptible to harm or injury
n. a cause of pain or injury or loss
n. a dangerous place"
face,"n. the front of the human head from the forehead to the chin and ear to ear
n. the general outward appearance of something
n. the striking or working surface of an implement
n. a part of a person that is used to refer to a person"
Asian,"n. a native or inhabitant of Asia
a. of or relating to or characteristic of Asia or the peoples of Asia or their languages or culture"
weigh,"v. have a certain weight
v. determine the weight of
v. to be oppressive or burdensome"
in the wild,none
at birth,none
on one's own,none
close to,none
respond,v. respond favorably or as hoped
complaint,"n. (formerly) a loud cry (or repeated cries) of pain or rage or sorrow
n. an expression of grievance or resentment
n. (civil law) the first pleading of the plaintiff setting out the facts on which the claim for relief is based"
cause,"n. events that provide the generative force that is the origin of something
n. a justification for something existing or happening
v. give rise to; cause to happen or occur, not always intentionally"
chocolate,"n. a food made from roasted ground cacao beans
n. a medium brown to dark-brown color"
dolphin,n. any of various small toothed whales with a beaklike snout; larger than porpoises
click,"n. depression of a button on a computer mouse
v. make a clicking or ticking sound
v. produce a click
v. become clear or enter one's consciousness or emotions"
reason,"n. a rational motive for a belief or action
n. an explanation of the cause of some phenomenon
n. the capacity for rational thought or inference or discrimination
n. a fact that logically justifies some premise or conclusion"
cute,s. obviously contrived to charm
responsibility,n. a form of trustworthiness; the trait of being answerable to someone for something or being responsible for one's conduct
feed,"n. food for domestic livestock
v. provide as food
v. give food to
v. feed into; supply"
according to,none
faithfully,r. in a faithful manner
sofa,n. an upholstered seat for more than one person
noisy,"a. full of or characterized by loud and nonmusical sounds
s. attracting attention by showiness or bright colors"
nearly,"r (of actions or states) slightly short of or not quite accomplished; all but
r in a close manner"
stranger,"n. anyone who does not belong in the environment in which they are found
n. an individual that one is not acquainted with"
common,"a. belonging to or participated in by a community as a whole; public
a. having no special distinction or quality; widely known or commonly encountered; average or ordinary or usual
s. common to or shared by two or more parties
s. commonly encountered"
choice,"n. the person or thing chosen or selected
n. the act of choosing or selecting
s. of superior grade
s. appealing to refined taste"
lie,"n. a statement that deviates from or perverts the truth
n. Norwegian diplomat who was the first Secretary General of the United Nations (1896-1968)
n. position or manner in which something is situated
v. be located or situated somewhere; occupy a certain position"
attention,"n. the process whereby a person concentrates on some features of the environment to the (relative) exclusion of others
n. a general interest that leads people to want to know more
n. a courteous act indicating affection
n. the faculty or power of mental concentration"
scare,n. a sudden attack of fear
believe,"v. accept as true; take to be true
v. be confident about something
v. follow a credo; have a faith; be a believer
v. credit with veracity"
heart,"n. the locus of feelings and intuitions
n. the hollow muscular organ located behind the sternum and between the lungs; its rhythmic contractions move the blood through the body
n. the courage to carry on
n. an inclination or tendency of a certain kind"
heart attack,none
