weigh,"v. have a certain weight
v. determine the weight of
v. to be oppressive or burdensome"
kilogram,n. one thousand grams; the basic unit of mass adopted under the Systeme International d'Unites
centimetre,n a metric unit of length equal to one hundredth of a meter
taller,"a. great in vertical dimension; high in stature
s. lofty in style
s. impressively difficult"
fan,"n. a device for creating a current of air by movement of a surface or surfaces
n. an ardent follower and admirer
v. strike out (a batter), (of a pitcher)
v. make (an emotion) fiercer"
fantastic,"s. extraordinarily good or great; used especially as intensifiers
s. fanciful and unrealistic; foolish
s. existing in fancy only
s. extravagantly fanciful in design, construction, appearance"
themselves,"pron. The plural of himself, herself, and itself. See
   Himself, Herself, Itself."
theatre,"n a building where theatrical performances or motion-picture shows can be presented
n the art of writing and producing plays
n a region in which active military operations are in progress"
go fishing,none
enjoy oneself,none
get ... in,none
life,"n. a characteristic state or mode of living
n. the experience of being alive; the course of human events and activities
n. the course of existence of an individual; the actions and events that occur in living
n. the period during which something is functional (as between birth and death)"
writer,"n. writes (books or stories or articles or the like) professionally (for pay)
n. a person who is able to write and has written something"
photographer,n. someone who takes photographs professionally
film,"n. a medium that disseminates moving pictures
n. photographic material consisting of a base of celluloid covered with a photographic emulsion; used to make negatives or transparencies
n. a thin coating or layer
n. a thin sheet of (usually plastic and usually transparent) material used to wrap or cover things"
digital,"a. displaying numbers rather than scale positions
a. relating to or performed with the fingers
a. of a circuit or device that represents magnitudes in digits"
street cleaner,none
sweep,"n. a wide scope
n. a long oar used in an open boat
n. a movement in an arc
v. move with sweeping, effortless, gliding motions"
broom,"n. a cleaning implement for sweeping; bundle of straws or twigs attached to a long handle
n. any of various shrubs of the genera Cytisus or Genista or Spartium having long slender branches and racemes of yellow flowers
v. finish with a broom"
drive,"n. the act of applying force to propel something
n. a mechanism by which force or power is transmitted in a machine
n. the trait of being highly motivated
n. hitting a golf ball off of a tee with a driver"
street sweeper,none
wife,n. a married woman; a man's partner in marriage
poor,"a. having little money or few possessions
a. characterized by or indicating poverty
a. lacking in specific resources, qualities or substances
s. unsatisfactory"
fairy,"n. a small being, human in form, playful and having magical powers"
wish,"n. a specific feeling of desire
n. an expression of some desire or inclination
n. the particular preference that you have
v. hope for; have a wish"
by hand,none
right away,none
in a short time,none
carry,"n. the act of carrying something
v. have with oneself; have on one's person
v. serve as a means for expressing something
v. bear or be able to bear the weight, pressure,or responsibility of"
online,"a on a regular route of a railroad or bus or airline system
a connected to a computer network or accessible by computer
s being in progress now"
head teacher,none
PS,"n a note appended to a letter after the signature
n a multivalent nonmetallic element of the nitrogen family that occurs commonly in inorganic phosphate rocks and as organic phosphates in all living cells; is highly reactive and occurs in several allotropic forms
n the 16th letter of the Roman alphabet"
mountain,n. a land mass that projects well above its surroundings; higher than a hill
even,"v. become even or more even
v. make even or more even
a. divisible by two
s. equal in degree or extent or amount; or equally matched or balanced"
space,"n. the unlimited expanse in which everything is located
n. an empty area (usually bounded in some way between things)
n. an area reserved for some particular purpose
n. a blank character used to separate successive words in writing or printing"
dinosaur,n. any of numerous extinct terrestrial reptiles of the Mesozoic era
a piece of,none
have a picnic,none
better and better,none
oil,"n. a slippery or viscous liquid or liquefiable substance not miscible with water
n. oil paint containing pigment that is used by an artist
v. cover with oil, as if by rubbing"
oil painting,none
powerful,a. having great power or force or potency or effect
ink,"n. a liquid used for printing or writing or drawing
n. dark protective fluid ejected into the water by cuttlefish and other cephalopods
v. append one's signature to
v. mark, coat, cover, or stain with ink"
Chinese ink painting,none
brush,"n. a dense growth of bushes
n. an implement that has hairs or bristles firmly set into a handle
n. momentary contact
n. conducts current between rotating and stationary parts of a generator or motor"
paints,"n a substance used as a coating to protect or decorate a surface (especially a mixture of pigment suspended in a liquid); dries to form a hard coating
n (basketball) a space (including the foul line) in front of the basket at each end of a basketball court; usually painted a different color from the rest of the court
n makeup consisting of a pink or red powder applied to the cheeks
v make a painting
v apply paint to; coat with paint
v make a painting of
v apply a liquid to; e.g., paint the gutters with linseed oil"
artist,n. a person whose creative work shows sensitivity and imagination
unhappy,"a. experiencing or marked by or causing sadness or sorrow or discontent
s. causing discomfort"
carefully,r. taking care or paying attention
on the left,none
on the right,none
all the time,none
craft,"n. a vehicle designed for navigation in or on water or air or through outer space
n. people who perform a particular kind of skilled work
n. skill in an occupation or trade
n. shrewdness as demonstrated by being skilled in deception"
crown,"n. the Crown (or the reigning monarch) as the symbol of the power and authority of a monarchy
n. the part of a tooth above the gum that is covered with enamel
n. a wreath or garland worn on the head to signify victory
n. an ornamental jeweled headdress signifying sovereignty"
scissors,"n. an edge tool having two crossed pivoting blades
n. a wrestling hold in which you wrap your legs around the opponents body or head and put your feet together and squeeze
n. a gymnastic exercise performed on the pommel horse when the gymnast moves his legs as the blades of scissors move"
tape,"n. a long thin piece of cloth or paper as used for binding or fastening
n. a recording made on magnetic tape
n. the finishing line for a foot race
n. measuring instrument consisting of a narrow strip (cloth or metal) marked in inches or centimeters and used for measuring lengths"
glue,"n. cement consisting of a sticky substance that is used as an adhesive
v. join or attach with or as if with glue
v. be fixed as if by glue"
saw,"n. hand tool having a toothed blade for cutting
v. cut with a saw"
craftsman,"n. a professional whose work is consistently of high quality
n. a creator of great skill in the manual arts
n. a skilled worker who practices some trade or handicraft"
tool,"n. an implement used in the practice of a vocation
v. drive
v. furnish with tools
v. work with a tool"
easily,"r. with ease (`easy' is sometimes used informally for `easily')
r. without question"
himself,"pron. An emphasized form of the third person masculine
   pronoun; -- used as a subject usually with he; as, he himself will bear
   the blame; used alone in the predicate, either in the nominative or
   objective case; as, it is himself who saved himself.
pron. One's true or real character; one's natural temper and
   disposition; the state of being in one's right or sane mind (after
   unconsciousness, passion, delirium, or abasement); as, the man has come
   to himself.
pron. pl. Alt. of Himselven"
still,"n. a static photograph (especially one taken from a movie and used for advertising purposes)
n. an apparatus used for the distillation of liquids; consists of a vessel in which a substance is vaporized by heat and a condenser where the vapor is condensed
v. lessen the intensity of or calm
v. make motionless"
model house,none
a long time ago,none
at work,none
say to oneself,none
long race,none
short race,none
win,"n. a victory (as in a race or other competition)
v. be the winner in a contest or competition; be victorious"
long jump,none
high jump,none
swimsuit,n. tight fitting garment worn for swimming
swimming cap,none
swimming pool,none
warm-up,n. exercising in preparation for strenuous activity
fit,"n. a display of bad temper
n. the manner in which something fits
v. be the right size or shape; fit correctly or as desired
v. make fit"
swimming goggles,none
bell,"n. a hollow device made of metal that makes a ringing sound when struck
n. the sound of a bell being struck
n. (nautical) each of the eight half-hour units of nautical time signaled by strokes of a ship's bell; eight bells signals 4:00, 8:00, or 12:00 o'clock, either a.m. or p.m.
n. the shape of a bell"
neck,"n. the part of an organism (human or animal) that connects the head to the rest of the body
n. a narrow elongated projecting strip of land
n. a cut of meat from the neck of an animal
n. a narrow part of an artifact that resembles a neck in position or form"
ago,"s. gone by; or in the past
r. in the past"
gatekeeper,n. someone who controls access to something
praise,"n. an expression of approval and commendation
n. offering words of homage as an act of worship
v. express approval of"
praise ... for ...,none
sign,"n. a perceptible indication of something not immediately apparent (as a visible clue that something has happened)
n. a public display of a message
n. (medicine) any objective evidence of the presence of a disorder or disease
n. a gesture that is part of a sign language"
middle,"n. an intermediate part or section
n. the middle area of the human torso (usually in front)
n. time between the beginning and the end of a temporal period
v. put in the middle"
special,"n. a special offering (usually temporary and at a reduced price) that is featured in advertising
n. a dish or meal given prominence in e.g. a restaurant
n. a television production that features a particular person or work or topic
s. for a special service or occasion"
path,"n. a way especially designed for a particular use
n. an established line of travel or access
n. a line or route along which something travels or moves"
may,n. the month following April and preceding June
lost,"a. no longer in your possession or control; unable to be found or recovered
a. spiritually or physically doomed or destroyed
a. not gained or won
s. incapable of being recovered or regained"
worry,"n. a strong feeling of anxiety
v. be worried, concerned, anxious, troubled, or uneasy
v. be concerned with
v. disturb the peace of mind of; afflict with mental agitation or distress"
follow,"v. to travel behind, go after, come after
v. come as a logical consequence; follow logically
v. travel along a certain course
v. come after in time, as a result"
in the middle,none
look out,"n. a person employed to keep watch for some anticipated event
n. an elevated post affording a wide view
n. a structure commanding a wide view of its surroundings
n. the act of looking out"
no smoking,none
no swimming,none
get lost,none
some time,r. at some indefinite or unstated time
on the way,none
reuse,v use again after processing
can,"n. airtight sealed metal container for food or drink or paint etc.
n. the quantity contained in a can
n. a buoy with a round bottom and conical top
v. preserve in a can or tin"
rubber,"n. an elastic material obtained from the latex sap of trees (especially trees of the genera Hevea and Ficus) that can be vulcanized and finished into a variety of products
n. any of various synthetic elastic materials whose properties resemble natural rubber
s. returned for lack of funds"
vase,n. an open jar of glass or porcelain used as an ornament or to hold flowers
pen holder,n. A handle for a pen.
envelope,"n. a flat (usually rectangular) container for a letter, thin package, etc.
n. any wrapper or covering
n. a curve that is tangent to each of a family of curves
n. a natural covering (as by a fluid)"
plastic,"n. generic name for certain synthetic or semisynthetic materials that can be molded or extruded into objects or films or filaments or used for making e.g. coatings and adhesives
s. capable of being influenced or formed"
rubbish bin,none
truck,"n. an automotive vehicle suitable for hauling
v. convey (goods etc.) by truck"
piece,"n. a separate part of a whole
n. an item that is an instance of some type; 
n. an instance of some kind
n. an artistic or literary composition"
cloth,n artifact made by weaving or felting or knitting or crocheting natural or synthetic fibers
throw away,"n. words spoken in a casual way with conscious under-emphasis
s. intended to be thrown away after use"
fairy tale,"n. a story about fairies; told to amuse children
n. an interesting but highly implausible story; often told as an excuse"
adult,"n. a fully developed person from maturity onward
n. any mature animal
s. (of animals) fully developed"
well-known,s. widely or fully known
stronger,"a having strength or power greater than average or expected
s not faint or feeble
s having or wielding force or authority
a having a strong physiological or chemical effect
s immune to attack; incapable of being tampered with
s of good quality and condition; solidly built
s of verbs not having standard (or regular) inflection
s being distilled rather than fermented; having a high alcoholic content
s freshly made or left
s strong and sure"
than,"conj. A particle expressing comparison, used after certain
   adjectives and adverbs which express comparison or diversity, as more,
   better, other, otherwise, and the like. It is usually followed by the
   object compared in the nominative case. Sometimes, however, the object
   compared is placed in the objective case, and than is then considered
   by some grammarians as a preposition. Sometimes the object is expressed
   in a sentence, usually introduced by that; as, I would rather suffer
   than that you should want.
adv. Then. See Then."
scarf,"n. a garment worn around the head or neck or shoulders for warmth or decoration
v. masturbate while strangling oneself
v. unite by a scarf joint
v. wrap in or adorn with a scarf"
blow off,"n. A blowing off steam, water, etc.;
adj. as, a blow-off cock or pipe.
adj. An outburst of temper or excitement."
take off,"n. a departure; especially of airplanes
n. the initial ascent of an airplane as it becomes airborne"
Western,"n. a film about life in the western United States during the period of exploration and development
n. a sandwich made from a western omelet
a. relating to or characteristic of the western parts of the world or the West as opposed to the eastern or oriental parts
a. of or characteristic of regions of the United States west of the Mississippi River"
turkey,"n. large gallinaceous bird with fan-shaped tail; widely domesticated for food
n. a Eurasian republic in Asia Minor and the Balkans; on the collapse of the Ottoman Empire in 1918, the Young Turks, led by Kemal Ataturk, established a republic in 1923
n. flesh of large domesticated fowl usually roasted
n. an event that fails badly or is totally ineffectual"
bright,"a. emitting or reflecting light readily or in large amounts
s. having striking color
s. characterized by quickness and ease in learning
s. having lots of light either natural or artificial"
laugh at,none
jack-o'-lantern,n. lantern carved from a pumpkin
pea,"n. seed of a pea plant used for food
n. the fruit or seed of a pea plant
n. a leguminous plant of the genus Pisum with small white flowers and long green pods containing edible green seeds"
pod,"n. the vessel that contains the seeds of a plant (not the seeds themselves)
n. a several-seeded dehiscent fruit as e.g. of a leguminous plant
n. a group of aquatic mammals
n. a detachable container of fuel on an airplane"
forever,r. for a very long or seemingly endless time
bigger,s. large or big relative to something else
excited,a. in an aroused state
bullet,n. a projectile that is fired from a gun
lazy,s. moving slowly and gently
roof,"n. a protective covering that covers or forms the top of a building
n. protective covering on top of a motor vehicle
n. the inner top surface of a covered area or hollow space
v. provide a building with a roof; cover a building with a roof"
yard,"n. a unit of length equal to 3 feet; defined as 91.44 centimeters; originally taken to be the average length of a stride
n. the enclosed land around a house or other building
n. a tract of land enclosed for particular activities (sometimes paved and usually associated with buildings)
n. a tract of land where logs are accumulated"
hit,"n. (baseball) a successful stroke in an athletic contest (especially in baseball)
n. the act of contacting one thing with another
n. a conspicuous success
n. a dose of a narcotic drug"
see the world,none
one by one,none
look out of,none
