until,"prep. To; unto; towards; -- used of material objects.
prep. To; up to; till; before; -- used of time; as, he staid
   until evening; he will not come back until the end of the month.
conj. As far as; to the place or degree that; especially, up to
   the time that; till. See Till, conj."
care for,none
what's more,none
have no choice but to do,none
run free,none
lie around,none
keep sb. from sth.,none
keep sb. from doing sth.,none
faithful to ...,none
be faithful to ...,none
die of,none
keep on,none
unknown,"n. an unknown and unexplored region
n. a variable whose values are solutions of an equation
a. not known
s. not known to exist"
alien,"v. transfer property or ownership
s. not contained in or deriving from the essential nature of something
s. being or from or characteristic of another place or part of the world"
astronaut,n. a person trained to travel in a spacecraft
receive,"v. get something; come into possession of
v. receive a specified treatment (abstract)
v. express willingness to have in one's home or environs
v. accept as true or valid"
hill,"n. a local and well-defined elevation of the land
n. United States railroad tycoon (1838-1916)
n. risque English comedian (1925-1992)
v. form into a hill"
loud,a. characterized by or producing sound of great volume or intensity
explore,"v. travel to or penetrate into
v. examine minutely
v. examine (organs) for diagnostic purposes"
bush,"n. a large wilderness area
n. 43rd President of the United States; son of George Herbert Walker Bush (born in 1946)
n. United States electrical engineer who designed an early analogue computer and who led the scientific program of the United States during World War II (1890-1974)
n. vice president under Reagan and 41st President of the United States (born in 1924)"
quiet,"a. characterized by an absence or near absence of agitation or activity
a. free of noise or uproar; or making little if any sound
s. not showy or obtrusive
a. of the sun characterized by a low level of surface phenomena like sunspots e.g."
round,"n. a charge of ammunition for a single shot
n. (often plural) a series of professional calls (usually in a set order)
n. the usual activities in your day
n. the course along which communications spread"
damage,"n. the occurrence of a change for the worse
n. loss of military equipment
n. the act of damaging something or someone
v. inflict damage upon"
crash,"n. a serious accident (usually involving one or more vehicles)
n. a sudden large decline of business or the prices of stocks (especially one that causes additional failures)
n. the act of colliding with something
n. (computer science) an event that causes a computer system to become inoperative"
frightened,s. made afraid
discover,"v. make a discovery, make a new finding
v. make a discovery
v. see for the first time; make a discovery"
terrible,"s causing fear or dread or terror
s exceptionally bad or displeasing
s intensely or extremely bad or unpleasant in degree or quality
s extreme in degree or extent or amount or impact"
fear,"n. an emotion experienced in anticipation of some specific pain or danger (usually accompanied by a desire to flee or fight)
n. a feeling of profound respect for someone or something
v. be afraid or feel anxious or apprehensive about a possible or probable situation or event
v. be afraid or scared of; be frightened of"
creature,"n. a human being; `wight' is an archaic term
n. a person who is controlled by others and is used to perform unpleasant or dishonest tasks for someone else"
feather,"n. the light horny waterproof structure forming the external covering of birds
n. turning an oar parallel to the water between pulls
v. join tongue and groove, in carpentry
v. cover or fit with feathers"
wonder,"n. the feeling aroused by something strange and surprising
n. something that causes feelings of wonder
v. have a wish or desire to know something
v. place in doubt or express doubtful speculation"
line,"n. a formation of people or things one beside another
n. a mark that is long relative to its width
n. a formation of people or things one behind another
n. a length (straight or curved) without breadth or thickness; the trace of a moving point"
refuse,"v. show unwillingness towards
v. refuse to accept"
spread,"n. process or result of distributing or extending over a wide expanse of space
n. a tasty mixture to be spread on bread or crackers or used in preparing other dishes
n. two facing pages of a book or other publication
n. the expansion of a person's girth (especially at middle age)"
mark,"n. a number or letter indicating quality (especially of a student's performance)
n. a visible indication made on a surface
n. the impression created by doing something unusual or extraordinary that people notice and remember
n. a symbol of disgrace or infamy"
desert,"n. arid land with little or no vegetation
v. leave behind"
tent,"n. a portable shelter (usually of canvas stretched over supporting poles and fastened to the ground with ropes and pegs)
n. a web that resembles a tent or carpet"
knife,"n. edge tool used as a cutting instrument; has a pointed blade with a sharp edge and a handle
n. a weapon with a handle and blade with a sharp point
v. use a knife on"
explain,"v. make plain and comprehensible
v. define"
pleased,"a. experiencing or manifesting pleasure
s. feeling pleasurable satisfaction over something by which you measures your self-worth"
keep quiet,none
because of,none
in fear,none
landing site,none
as soon as possible,none
agree with,none
disagree with,none
Internet,n. a computer network consisting of a worldwide network of computer networks that use the TCP/IP network protocols to facilitate data transmission and exchange
post,"n. the position where someone (as a guard or sentry) stands or is assigned to stand
n. an upright consisting of a piece of timber or metal fixed firmly in an upright position
n. United States aviator who in 1933 made the first solo flight around the world (1899-1935)
n. United States female author who wrote a book and a syndicated newspaper column on etiquette (1872-1960)"
apology,"n. an expression of regret at having caused trouble for someone
n. a formal written defense of something you believe in strongly
n. a poor example"
excuse,"n. a defense of some offensive behavior or some failure to keep a promise etc.
n. a note explaining an absence
v. accept an excuse for
v. grant exemption or release to"
past,"n. the time that has elapsed
n. a earlier period in someone's life (especially one that they have reason to keep secret)
n. a verb tense that expresses actions or states in the past
a. earlier than the present time; no longer current"
present,"n. the period of time that is happening now; any continuous stretch of time including the moment of speech
n. something presented as a gift
n. a verb tense that expresses actions or states at the time of speaking
v. bring forward and present to the mind"
hydrogen,n. a nonmetallic univalent element that is normally a colorless and odorless highly flammable diatomic gas; the simplest and lightest and most abundant element in the universe
wide,"a. having great (or a certain) extent from one side to the other
a. great in degree
s. having ample fabric
s. not on target"
shape,"n. any spatial attributes (especially as defined by outline)
n. the spatial arrangement of something as distinct from its substance
n. a concrete representation of an otherwise nebulous concept
v. make something, usually for a specific function"
cafe,n. a small restaurant where drinks and snacks are sold
recently,r. in the recent past
forever,r. for a very long or seemingly endless time
certainly,r definitely or positively (`sure' is sometimes used informally for `surely')
recommend,"v. push for something
v. make attractive or acceptable"
satisfy,"v. meet the requirements or expectations of
v. make happy or satisfied"
mix,"n. a commercially prepared mixture of dry ingredients
n. an event that combines things in a mixture
n. the act of mixing together
v. combine (electronic signals)"
electronic,"a. of or relating to electronics; concerned with or using devices that operate on principles governing the behavior of electrons
a. of or concerned with electrons"
relax,"v. become less tense, rest, or take one's ease
v. make less taut
v. cause to feel relaxed
v. become less tense, less formal, or less restrained, and assume a friendlier manner"
while,n. a period of indeterminate length (usually short) marked by some action or condition
technology,n. the practical application of science to commerce or industry
software,n. (computer science) written programs or procedures or rules and associated documentation pertaining to the operation of a computer system and that are stored in read/write memory
virus,"n. (virology) ultramicroscopic infectious agent that replicates itself only within cells of living hosts; many are pathogenic; a piece of nucleic acid (DNA or RNA) wrapped in a thin coat of protein
n. a harmful or corrupting agency
n. a software program capable of reproducing itself and usually capable of causing great harm to files or other programs on the same computer"
prepare,"v. to prepare verbally, either for written or spoken delivery
v. educate for a future role or function
v. lead up to and soften by sounding the dissonant note in it as a consonant note in the preceding chord"
in the present,none
at the front,none
on the Internet,none
in the shape of,none
mix ... with ...,none
prepare for,none
in a second,none
