hi,"n an expression of greeting
n a state in the United States in the central Pacific on the Hawaiian Islands"
hello,n. an expression of greeting
pig,"n. a crude block of metal (lead or iron) poured from a smelting furnace
v. live like a pig, in squalor"
I,n. the 9th letter of the Roman alphabet
am,"n a radioactive transuranic metallic element; discovered by bombarding uranium with helium atoms
n a master's degree in arts and sciences
n modulation of the amplitude of the (radio) carrier wave
v have the quality of being; (copula, used with an adjective or a predicate noun)
v be identical to; be someone or something
v occupy a certain position or area; be somewhere
v have an existence, be extant
v happen, occur, take place; this was during the visit to my parents' house""
v be identical or equivalent to
v form or compose
v work in a specific place, with a specific subject, or in a specific function
v represent, as of a character on stage
v spend or use time
v have life, be alive
v to remain unmolested, undisturbed, or uninterrupted -- used only in infinitive form
v be priced at"
a,"n. the 1st letter of the Roman alphabet
n. the blood group whose red cells carry the A antigen"
cat,"n. feline mammal usually having thick soft fur and no ability to roar: domestic cats; wildcats
n. a spiteful woman gossip
v. beat with a cat-o'-nine-tails"
dog,"n. a member of the genus Canis (probably descended from the common wolf) that has been domesticated by man since prehistoric times; occurs in many breeds
n. informal term for a man"
fox,"n. alert carnivorous mammal with pointed muzzle and ears and a bushy tail; most are predators that do not hunt in packs
n. the grey or reddish-brown fur of a fox
n. English statesman who supported American independence and the French Revolution (1749-1806)
n. English religious leader who founded the Society of Friends (1624-1691)"
are,n. a unit of surface area equal to 100 square meters
you,"dat. & obj. The pronoun of the second person, in the nominative,
   dative, and objective case, indicating the person or persons addressed.
   See the Note under Ye."
yes,n. an affirmative
Mr,n a form of address for a man
no,"n. a negative
a. quantifier; used with either mass nouns or plural count nouns for indicating a complete or almost complete lack or zero quantity of
r. referring to the degree to which a certain quality is present
r. not in any degree or manner; not at all"
Miss,"n. a failure to hit (or meet or find etc)
n. a form of address for an unmarried woman
v. fail to perceive or to catch with the senses or the mind
v. feel or suffer from the lack of"
too,"r to a degree exceeding normal or proper limits
r in addition"
my,"a. Of or belonging to me; -- used always attributively; as, my
   body; my book; -- mine is used in the predicate; as, the book is mine.
   See Mine."
name,"n. a language unit by which a person or thing is known
n. a person's reputation
n. family based on male descent
n. a well-known or notable person"
is,"v have the quality of being; (copula, used with an adjective or a predicate noun)
v be identical to; be someone or something
v occupy a certain position or area; be somewhere
v have an existence, be extant
v happen, occur, take place; this was during the visit to my parents' house""
v be identical or equivalent to
v form or compose
v work in a specific place, with a specific subject, or in a specific function
v represent, as of a character on stage
v spend or use time
v have life, be alive
v to remain unmolested, undisturbed, or uninterrupted -- used only in infinitive form
v be priced at"
goodbye,n a farewell remark
bye,n. you advance to the next round in a tournament without playing an opponent
what,"pron., a., & adv. As an interrogative pronoun, used in asking
   questions regarding either persons or things; as, what is this? what
   did you say? what poem is this? what child is lost?
pron., a., & adv. As an exclamatory word: -- (a) Used absolutely
   or independently; -- often with a question following.
pron., a., & adv. Used adjectively, meaning how remarkable, or
   how great; as, what folly! what eloquence! what courage!
pron., a., & adv. Sometimes prefixed to adjectives in an
   adverbial sense, as nearly equivalent to how; as, what happy boys!
pron., a., & adv. As a relative pronoun
pron., a., & adv. Used substantively with the antecedent
   suppressed, equivalent to that which, or those [persons] who, or those
   [things] which; -- called a compound relative.
pron., a., & adv. Used adjectively, equivalent to the . . .
   which; the sort or kind of . . . which; rarely, the . . . on, or at,
   which.
pron., a., & adv. Used adverbially in a sense corresponding to
   the adjectival use; as, he picked what good fruit he saw.
pron., a., & adv. Whatever; whatsoever; what thing soever; --
   used indefinitely.
pron., a., & adv. Used adverbially, in part; partly; somewhat;
   -- with a following preposition, especially, with, and commonly with
   repetition.
n. Something; thing; stuff.
interrog. adv. Why? For what purpose? On what account?"
your,"pron. & a. The form of the possessive case of the personal
   pronoun you."
please,"v. give pleasure to or be pleasing to
v. be the will of or have the will (to)
v. give satisfaction
r. used in polite request"
sit,"v. be seated
v. be around, often idly or without specific purpose
v. be in session
v. be located or situated somewhere"
down,"n. soft fine feathers
n. (American football) a complete play to advance the football
n. English physician who first described Down's syndrome (1828-1896)
n. (usually plural) a rolling treeless highland with little soil"
how,"adv. In what manner or way; by what means or process.
adv. To what degree or extent, number or amount; in what
   proportion; by what measure or quality.
adv. For what reason; from what cause.
adv. In what state, condition, or plight.
adv. By what name, designation, or title.
adv. At what price; how dear."
old,"n. past times (especially in the phrase `in days of old')
a. (used especially of persons) having lived for a relatively long time or attained a specific age
a. of long duration; not new
s. (used for emphasis) very familiar"
five,"n. the cardinal number that is the sum of four and one
s. being one more than four"
one,"n. the smallest whole number or a numeral representing this number
n. a single person or thing
s. used of a single unit or thing; not two or more
s. having the indivisible character of a unit"
nine,"n. the cardinal number that is the sum of eight and one
s. denoting a quantity consisting of one more than eight and one less than ten"
ten,"n. the cardinal number that is the sum of nine and one; the base of the decimal system
s. being one more than nine"
not,r. negation of a word or group of words
panda,"n large black-and-white herbivorous mammal of bamboo forests of China and Tibet; in some classifications considered a member of the bear family or of a separate family Ailuropodidae
n reddish-brown Old World raccoon-like carnivore; in some classifications considered unrelated to the giant pandas"
duck,"n. small wild or domesticated web-footed broad-billed swimming bird usually having a depressed body and short legs
n. (cricket) a score of nothing by a batsman
n. flesh of a duck (domestic or wild)
n. a heavy cotton fabric of plain weave; used for clothing and tents"
bear,"n. massive plantigrade carnivorous or omnivorous mammals with long shaggy coats and strong claws
n. an investor with a pessimistic market outlook; an investor who expects prices to fall and so sells now in order to buy later at a lower price
v. have
v. move while holding up or supporting"
it,n the branch of engineering that deals with the use of computers and telecommunications to retrieve and store and transmit information
thank,v. express gratitude or show appreciation to
letter,"n. a written message addressed to a person or organization
n. the conventional characters of the alphabet used to represent speech
n. owner who lets another person use something (housing usually) for hire
n. a strictly literal interpretation (as distinct from the intention)"
bird,"n. warm-blooded egg-laying vertebrates characterized by feathers and forelimbs modified as wings
n. the flesh of a bird or fowl (wild or domestic) used as food
v. watch and study birds in their natural habitat"
fish,"n. any of various mostly cold-blooded aquatic vertebrates usually having scales and breathing through gills
n. the flesh of fish used as food
v. seek indirectly
v. catch or try to catch fish or shellfish"
look,"n. the act of directing the eyes toward something and perceiving it visually
n. physical appearance
v. perceive with attention; direct one's gaze towards
v. give a certain impression or have a certain outward aspect"
the,"v. i. See Thee.
definite article. A word placed before nouns to limit or
   individualize their meaning.
adv. By that; by how much; by so much; on that account; -- used
   before comparatives; as, the longer we continue in sin, the more
   difficult it is to reform."
fat,"n. a soft greasy substance occurring in organic tissue and consisting of a mixture of lipids (mostly triglycerides)
a. having an (over)abundance of flesh
s. having a relatively large diameter
s. lucrative"
hen,"n. adult female chicken
n. adult female bird
n. flesh of an older chicken suitable for stewing
n. female of certain aquatic animals e.g. octopus or lobster"
bee,"n. any of numerous hairy-bodied insects including social and solitary species
n. a social gathering to carry out some communal task or to hold competitions"
frog,"n. any of various tailless stout-bodied amphibians with long hind limbs for leaping; semiaquatic and terrestrial species
n. a person of French descent
n. a decorative loop of braid or cord
v. hunt frogs for food"
this,"pron. & a. As a demonstrative pronoun, this denotes something
   that is present or near in place or time, or something just mentioned,
   or that is just about to be mentioned.
pron. & a. As an adjective, this has the same demonstrative
   force as the pronoun, but is followed by a noun; as, this book; this
   way to town."
an,n an associate degree in nursing
egg,"n. animal reproductive body consisting of an ovum or embryo together with nutritive and protective envelopes; especially the thin-shelled reproductive body laid by e.g. female birds
n. oval reproductive body of a fowl (especially a hen) used as food
v. throw eggs at
v. coat with beaten egg"
red,"n. red color or pigment; the chromatic color resembling the hue of blood
n. a tributary of the Mississippi River that flows eastward from Texas along the southern boundary of Oklahoma and through Louisiana
s. of a color at the end of the color spectrum (next to orange); resembling the color of blood or cherries or tomatoes or rubies"
hot,"a. used of physical heat; having a high or higher than desirable temperature or giving off heat or feeling or causing a sensation of heat or burning
s. characterized by violent and forceful activity or movement; very intense
a. extended meanings; especially of psychological heat; marked by intensity or vehemence especially of passion or enthusiasm
s. (color) bold and intense"
that,"pron., a., conj., &  As a demonstrative pronoun (pl. Those),
   that usually points out, or refers to, a person or thing previously
   mentioned, or supposed to be understood. That, as a demonstrative, may
   precede the noun to which it refers; as, that which he has said is
   true; those in the basket are good apples.
pron., a., conj., &  As an adjective, that has the same
   demonstrative force as the pronoun, but is followed by a noun.
pron., a., conj., &  As a relative pronoun, that is
   equivalent to who or which, serving to point out, and make definite, a
   person or thing spoken of, or alluded to, before, and may be either
   singular or plural.
pron., a., conj., &  As a conjunction, that retains much of
   its force as a demonstrative pronoun.
pron., a., conj., &  To introduce a clause employed as the
   object of the preceding verb, or as the subject or predicate nominative
   of a verb.
pron., a., conj., &  To introduce, a reason or cause; --
   equivalent to for that, in that, for the reason that, because.
pron., a., conj., &  To introduce a purpose; -- usually
   followed by may, or might, and frequently preceded by so, in order, to
   the end, etc.
pron., a., conj., &  To introduce a consequence, result, or
   effect; -- usually preceded by so or such, sometimes by that.
pron., a., conj., &  In an elliptical sentence to introduce
   a dependent sentence expressing a wish, or a cause of surprise,
   indignation, or the like.
pron., a., conj., &  As adverb: To such a degree; so; as, he
   was that frightened he could say nothing."
bun,n. small rounded bread either plain or sweet
rat,"n. any of various long-tailed rodents similar to but larger than a mouse
n. a pad (usually made of hair) worn as part of a woman's coiffure
v. desert one's party or group of friends, for example, for one's personal advantage
v. employ scabs or strike breakers in"
bag,"n. a flexible container with a single opening
n. the quantity of game taken in a particular period (usually by one person)
n. a container used for carrying money and small personal items or accessories (especially by women)
n. the quantity that a bag will hold"
in,"s. holding office
s. directed or bound inward
s. currently fashionable
r. to or toward the inside of"
cap,"n. a tight-fitting headdress
n. a top (as for a bottle)
n. something serving as a cover or protection
n. a fruiting structure resembling an umbrella or a cone that forms the top of a stalked fleshy fungus such as a mushroom"
colour,"n any material used for its color
n a race with skin pigmentation different from the white race (especially Blacks)
n (physics) the characteristic of quarks that determines their role in the strong interaction
n interest and variety and intensity
n the timbre of a musical sound
n a visual attribute of things that results from the light they emit or transmit or reflect
n an outward or token appearance or form that is deliberately misleading
n the appearance of objects (or light sources) described in terms of a person's perception of their hue and lightness (or brightness) and saturation
v modify or bias
v decorate with colors
v give a deceptive explanation or excuse for
v affect as in thought or feeling
v add color to
v change color, often in an undesired manner
a having or capable of producing colors"
blue,"n. blue color or pigment; resembling the color of the clear sky in the daytime
n. blue clothing
n. any organization or party whose uniforms or badges are blue
n. any of numerous small butterflies of the family Lycaenidae"
and,"conj. A particle which expresses the relation of connection or
   addition. It is used to conjoin a word with a word, a clause with a
   clause, or a sentence with a sentence.
conj. In order to; -- used instead of the infinitival to,
   especially after try, come, go.
conj. It is sometimes, in old songs, a mere expletive.
conj. If; though. See An, conj."
box,"n. a (usually rectangular) container; may have a lid
n. private area in a theater or grandstand where a small group can watch the performance
n. the quantity contained in a box
n. a rectangular drawing"
black,"n. the quality or state of the achromatic color of least lightness (bearing the least resemblance to white)
n. British chemist who identified carbon dioxide and who formulated the concepts of specific heat and latent heat (1728-1799)
n. popular child actress of the 1930's (born in 1928)
n. a person with dark skin who comes from Africa (or whose ancestors came from Africa)"
white,"n. a member of the Caucasoid race
n. the quality or state of the achromatic color of greatest lightness (bearing the least resemblance to black)
n. United States jurist appointed chief justice of the United States Supreme Court in 1910 by President Taft; noted for his work on antitrust legislation (1845-1921)
n. Australian writer (1912-1990)"
hat,"n. headdress that protects the head from bad weather; has shaped crown and usually a brim
n. an informal term for a person's role
v. put on or wear a hat
v. furnish with a hat"
Mrs,n. a form of address for a married woman
fine,"n. money extracted as a penalty
s. minutely precise especially in differences in meaning
s. thin in thickness or diameter
s. characterized by elegance or refinement or accomplishment"
mum,"n. secrecy
s. failing to speak or communicate etc when expected to"
nice,"n. a city in southeastern France on the Mediterranean; the leading resort on the French Riviera
a. pleasant or pleasing or agreeable in nature or appearance
s. done with delicacy and skill"
dad,n. an informal term for a father; probably derived from baby talk
banana,"n. any of several tropical and subtropical treelike herbs of the genus Musa having a terminal crown of large entire leaves and usually bearing hanging clusters of elongated fruits
n. elongated crescent-shaped yellow fruit with soft sweet flesh"
for,"prep. In the most general sense, indicating that in consideration
   of, in view of, or with reference to, which anything is done or takes
   place.
prep. Indicating the antecedent cause or occasion of an action;
   the motive or inducement accompanying and prompting to an act or state;
   the reason of anything; that on account of which a thing is or is done.
prep. Indicating the remoter and indirect object of an act; the
   end or final cause with reference to which anything is, acts, serves,
   or is done.
prep. Indicating that in favor of which, or in promoting which,
   anything is, or is done; hence, in behalf of; in favor of; on the side
   of; -- opposed to against.
prep. Indicating that toward which the action of anything is
   directed, or the point toward which motion is made; /ntending to go to.
prep. Indicating that on place of or instead of which anything
   acts or serves, or that to which a substitute, an equivalent, a
   compensation, or the like, is offered or made; instead of, or place of.
prep. Indicating that in the character of or as being which
   anything is regarded or treated; to be, or as being.
prep. Indicating that instead of which something else controls in
   the performing of an action, or that in spite of which anything is
   done, occurs, or is; hence, equivalent to notwithstanding, in spite of;
   -- generally followed by all, aught, anything, etc.
prep. Indicating the space or time through which an action or
   state extends; hence, during; in or through the space or time of.
prep. Indicating that in prevention of which, or through fear of
   which, anything is done.
conj. Because; by reason that; for that; indicating, in Old
   English, the reason of anything.
conj. Since; because; introducing a reason of something before
   advanced, a cause, motive, explanation, justification, or the like, of
   an action related or a statement made. It is logically nearly
   equivalent to since, or because, but connects less closely, and is
   sometimes used as a very general introduction to something suggested by
   what has gone before.
n. One who takes, or that which is said on, the affrimative side;
   that which is said in favor of some one or something; -- the antithesis
   of against, and commonly used in connection with it."
baby,"n. a very young child (birth to 1 year) who has not yet begun to walk or talk
n. the youngest member of a group (not necessarily young)
n. an unborn child; a human fetus
n. (slang) sometimes used as a term of address for attractive young women"
apple,"n. fruit with red or yellow or green skin and sweet to tart crisp whitish flesh
n. native Eurasian tree widely cultivated in many varieties for its firm rounded edible fruits"
chick,n. young bird especially of domestic fowl
can,"n. airtight sealed metal container for food or drink or paint etc.
n. the quantity contained in a can
n. a buoy with a round bottom and conical top
v. preserve in a can or tin"
find,"v. come upon, as if by accident; meet with
v. come upon after searching; find the location of something that was missed or lost
v. come to believe on the basis of emotion, intuitions, or indefinite grounds
v. obtain through effort or management"
sad,"a. experiencing or showing sorrow or unhappiness
s. of things that make you feel sad"
big,"s. significant
s. loud and firm
s. conspicuous in position or importance
s. prodigious"
monkey,n. any of various long-tailed primates (excluding the prosimians)
sorry,"a feeling or expressing regret or sorrow or a sense of loss over something done or undone
s bad; unfortunate
s without merit
s causing dejection"
yellow,"n. yellow color or pigment; the chromatic color resembling the hue of sunflowers or ripe lemons
v. turn yellow
s. of the color intermediate between green and orange in the color spectrum; of something resembling the color of an egg yolk
s. changed to a yellowish color by age"
