identical,"s. exactly alike; incapable of being perceived as different
s. being the exact same one; not any other:
a. (of twins) derived from a single egg or ovum
s. having properties with uniform values along all axes"
lofty,"s of high moral or intellectual value; elevated in nature or style
s of imposing height; especially standing out above others
s having or displaying great dignity or nobility"
premier,"v. be performed for the first time
v. perform a work for the first time
s. first in rank or degree
s. preceding all others in time"
respective,s. considered individually
roundabout,"n a road junction at which traffic streams circularly around a central island
n a large, rotating machine with seats for children to ride or amusement
s marked by obliqueness or indirection in speech or conduct
s deviating from a straight course"
uphill,"n. the upward slope of a hill
r. against difficulties
r. upward on a hill or incline"
vertical,"n. something that is oriented vertically
a. at right angles to the plane of the horizon or a base line
a. relating to or involving all stages of a business from production to distribution
s. of or relating to different levels in a hierarchy (as levels of social class or income group)"
conceptual,s. being or characterized by concepts or their formation
cultivated,"a. (of land or fields) prepared for raising crops by plowing or fertilizing
s. no longer in the natural state; developed by human care and for human use"
knowledgeable,s. alert and fully informed
linguistic,"a. consisting of or related to language
a. of or relating to the scientific study of language"
papal,a. proceeding from or ordered by or subject to a pope or the papacy regarded as the successor of the Apostles
stylistic,s. of or relating to style (especially in the use of language)
theoretical,"a. concerned primarily with theories or hypotheses rather than practical considerations
a. concerned with theories rather than their practical applications"
barefoot,s. without shoes
breathless,"a. not breathing or able to breathe except with difficulty
s. tending to cause suspension of regular breathing
s. appearing dead; not breathing or having no perceptible pulse"
brisk,"v. become brisk
s. very active"
challenged,"v take exception to
v issue a challenge to
v ask for identification
v raise a formal objection in a court of law"
clinical,"a. relating to a clinic or conducted in or as if in a clinic and depending on direct observation of patients
s. scientifically detached; unemotional"
developmental,a. of or relating to or constituting development
feverish,"s. marked by intense agitation or emotion
s. having or affected by a fever"
husky,"n breed of heavy-coated Arctic sled dog
s muscular and heavily built
s deep and harsh sounding as if from shouting or illness or emotion"
invalid,"n. someone who is incapacitated by a chronic illness or injury
v. force to retire, remove from active duty, as of firemen
a. having no cogency or legal force
s. no longer valid"
limp,"v. walk impeded by some physical limitation or injury
v. proceed slowly or with difficulty
s. not firm
s. lacking in strength or firmness or resilience"
skinny,"n. confidential information about a topic or person
a. of or relating to or resembling skin"
unhealthy,"a. not in or exhibiting good health in body or mind
s. not conducive to good health"
wholesome,"a. conducive to or characteristic of physical or moral well-being
s. sound or exhibiting soundness in body or mind"
alarming,a. frightening because of an awareness of danger
amazed,s. filled with the emotional impact of overwhelming surprise or shock
appetizing,a. appealing to or stimulating the appetite especially in appearance or aroma
comforting,"s. providing freedom from worry
s. affording comfort or solace"
disagreeable,"a. not to your liking
s. unpleasant to interact with
s. not agreeing with your tastes or expectations"
disgusted,s. having a strong distaste from surfeit
dismal,s causing dejection
dreamy,"s. dreamy in mood or nature
s. lacking spirit or liveliness"
drowsy,"s. half asleep
s. showing lack of attention or boredom"
furious,"s marked by extreme and violent energy
s marked by extreme anger
s (of the elements) as if showing violent anger"
hearty,"s. showing warm and heartfelt friendliness
s. providing abundant nourishment
s. endowed with or exhibiting great bodily or mental health
s. consuming abundantly and with gusto"
insane,a. afflicted with or characteristic of mental derangement
ironical,"s characterized by often poignant difference or incongruity between what is expected and what actually is
s humorously sarcastic or mocking"
lonesome,"s being the only one; single and isolated from others
s marked by dejection from being alone"
pitiful,"s inspiring mixed contempt and pity
s bad; unfortunate
s deserving or inciting pity"
playful,a. full of fun and high spirits
regrettable,s. deserving regret
sane,a. mentally healthy; free from mental disorder
senseless,"s not marked by the use of reason
s unresponsive to stimulation
s serving no useful purpose; having no excuse for being
s (of especially persons) lacking sense or understanding or judgment"
sentimental,s. given to or marked by sentiment or sentimentality
subjective,a. taking place within the mind and modified by individual bias
tearful,a. filled with or marked by tears
wretched,"s of very poor quality or condition
s characterized by physical misery
s very unhappy; full of misery
s morally reprehensible
s deserving or inciting pity"
burnt,"v destroy by fire
v shine intensely, as if with heat
v undergo combustion
v cause a sharp or stinging pain or discomfort
v cause to burn or combust
v feel strong emotion, especially anger or passion
v cause to undergo combustion
v burn at the stake
v spend (significant amounts of money)
v feel hot or painful
v burn, sear, or freeze (tissue) using a hot iron or electric current or a caustic agent
v get a sunburn by overexposure to the sun
v create by duplicating data
v use up (energy)
v burn with heat, fire, or radiation
s ruined by overcooking
s treated by heating to a high temperature but below the melting or fusing point
s destroyed or badly damaged by fire"
chaotic,"s. lacking a visible order or organization
s. completely unordered and unpredictable and confusing
a. of or relating to a sensitive dependence on initial conditions"
cracked,"v become fractured; break or crack on the surface only
v make a very sharp explosive sound
v make a sharp sound
v hit forcefully; deal a hard blow, making a cracking noise
v pass through (a barrier)
v break partially but keep its integrity
v break suddenly and abruptly, as under tension
v gain unauthorized access computers with malicious intentions
v suffer a nervous breakdown
v tell spontaneously
v cause to become cracked
v reduce (petroleum) to a simpler compound by cracking
v break into simpler molecules by means of heat
s used of skin roughened as a result of cold or exposure
s of paint or varnish; having the appearance of alligator hide
s informal or slang terms for mentally irregular"
distorted,s. having an intended meaning altered or misrepresented
edible,a. suitable for use as food
erotic,"n. an erotic person
s. giving sexual pleasure; sexually arousing"
existent,a. having existence or being or actuality
forbidding,"n an official prohibition or edict against something
v command against
v keep from happening or arising; make impossible
s harshly uninviting or formidable in manner or appearance
s threatening or foreshadowing evil or tragic developments"
formidable,"s. extremely impressive in strength or excellence
s. inspiring fear"
functional,"a. designed for or capable of a particular function or use
a. involving or affecting function rather than physiology
a. relating to or based on function especially as opposed to structure; it is a functional one""
s. fit or ready for use or service"
furnished,a. provided with whatever is necessary for a purpose (as furniture or equipment or authority)
hairy,"a. having or covered with hair
s. hazardous and frightening"
identifiable,a. capable of being identified
imposing,"v compel to behave in a certain way
v impose something unpleasant
v impose and collect
s impressive in appearance
s used of a person's appearance or behavior; befitting an eminent person"
ingenious,s showing inventiveness and skill
intact,"s. (of a woman) having the hymen unbroken
s. undamaged in any way"
linear,"a. designating or involving an equation whose terms are of the first degree
a. of or in or along or relating to a line; involving a single dimension
s. (of a leaf shape) long and narrow
s. measured lengthwise"
messy,s. dirty and disorderly
monstrous,s. abnormally large
motionless,s not in physical motion
mute,"n. a deaf person who is unable to speak
n. a device used to soften the tone of a musical instrument
s. expressed without speech"
operating,a. involved in a kind of operation
quaint,"s. strange in an interesting or pleasing way
s. very strange or unusual; odd or even incongruous in character or appearance"
queer,"v. put in a dangerous, disadvantageous, or difficult position"
resistant,s. impervious to being affected
restrictive,"a. serving to restrict
s. (of tariff) protective of national interests by restricting imports"
rotten,s. having decayed or disintegrated; usually implies foulness
rugged,"a. sturdy and strong in constitution or construction; enduring
s. very difficult; severely testing stamina or resolution"
scarlet,n. a variable color that is vivid red but sometimes with an orange tinge
shadowy,s. lacking in substance
shining,"n. the work of making something smooth and shiny by rubbing or waxing it
s. marked by exceptional merit"
silky,"s having a smooth, gleaming surface reflecting light"
sown,"v place (seeds) in or on the ground for future growth
v introduce into an environment
v place seeds in or on (the ground)
s sprinkled with seed"
sparkling,"s. shining with brilliant points of light like stars
a. used of wines and waters; charged naturally or artificially with carbon dioxide"
spotted,"v catch sight of
v detect with the senses
v mar or impair with a flaw
v make a spot or mark onto
v become spotted
v mark with a spot or spots so as to allow easy recognition
s having spots or patches (small areas of contrasting color or texture)"
sprung,"v move forward by leaps and bounds
v develop into a distinctive entity
v spring back; spring away from an impact
v develop suddenly
v produce or disclose suddenly or unexpectedly"
static,"n. a crackling or hissing noise caused by electrical interference
n. angry criticism
s. showing little if any change"
tasteful,a. having or showing or conforming to good taste
tranquil,"s (of a body of water) free from disturbance by heavy waves
s not agitated; without losing self-possession"
traveling,"n the act of going from one place to another
v change location; move, travel, or proceed, also metaphorically
v undertake a journey or trip
v make a trip for pleasure
v travel upon or across
v undergo transportation as in a vehicle
v travel from place to place, as for the purpose of finding work, preaching, or acting as a judge"
tricky,"s not to be trusted
s having concealed difficulty
s marked by skill in deception"
unchanged,a. not made or become different
variable,"n. something that is likely to vary; something that is subject to variation
n. a quantity that can assume any of a set of values
n. a symbol (like x or y) that is used in mathematical or logical expressions to represent a variable quantity
a. liable to or capable of change"
weird,"s. strikingly odd or unusual; some weird effect of shadow""- Bram Stoker"
belated,s. after the expected or usual time; delayed
bimonthly,"n. a periodical that is published twice a month or every two months (either 24 or 6 issues per year)
s. occurring every two months
r. every two months"
consequent,s following or accompanying as a consequence
descendent,"n a person considered as descended from some ancestor or race
s going or coming down
s proceeding by descent from an ancestor"
eventual,s. expected to follow in the indefinite future from causes already operating
hourly,"s. occurring every hour or payable by the hour
r. every hour; by the hour"
innumerable,s too numerous to be counted
perpetual,"s continuing forever or indefinitely
s uninterrupted in time and indefinitely long continuing"
prior,n. the head of a religious order; in an abbey the prior is next below the abbot
subsequent,a. following in time or order
abusive,"s. expressing offensive reproach
s. characterized by physical or psychological maltreatment"
affectionate,s. having or displaying warmth or affection
aimless,s. continually changing especially as from one abode or occupation to another
applicable,s. capable of being applied; having relevance
blunt,"v. make less intense
v. make less sharp
s. having a broad or rounded end
s. used of a knife or other blade; not sharp"
boastful,s. exhibiting self-importance
clumsy,"s lacking grace in movement or posture
s not elegant or graceful in expression
s difficult to handle or manage especially because of shape
s showing lack of skill or aptitude"
communicative,"a. of or relating to communication
a. able or tending to communicate"
courteous,"s. exhibiting courtesy and politeness
a. characterized by courtesy and gracious good manners"
crude,"s. not carefully or expertly made
s. conspicuously and tastelessly indecent
s. belonging to an early stage of technical development; characterized by simplicity and (often) crudeness
s. not processed or subjected to analysis"
destined,"v decree or designate beforehand
v design or destine
s headed or intending to head in a certain direction; often used as a combining form as in `college-bound students'
s (usually followed by `to') governed by fate"
dutiful,s. willingly obedient out of a sense of duty and respect;
easygoing,s. relaxed and informal in attitude or standards
elastic,"n. a fabric made of yarns containing an elastic material
a. capable of resuming original shape after stretching or compression; springy
s. able to adjust readily to different conditions"
eloquent,"s. expressing yourself readily, clearly, effectively"
engaging,s. attracting or delighting
feminine,"n. a gender that refers chiefly (but not exclusively) to females or to objects classified as female
a. associated with women and not with men
a. of grammatical gender
s. (music or poetry) ending on an unaccented beat or syllable"
gracious,"a. characterized by charm, good taste, and generosity of spirit
s. disposed to bestow favors"
instinctive,s unthinking; prompted by (or as if by) instinct
liable,"s. subject to legal action
s. (often followed by `to') likely to be affected with
s. held legally responsible"
masculine,"n. a gender that refers chiefly (but not exclusively) to males or to objects classified as male
a. of grammatical gender
a. associated with men and not with women
s. (music or poetry) ending on an accented beat or syllable"
merciful,"a. showing or giving mercy
s. (used conventionally of royalty and high nobility) gracious"
obstinate,v. persist stubbornly
outgoing,"a. leaving a place or a position
a. retiring from a position or office"
pious,a. having or showing or expressing reverence for a deity
responsive,"a. containing or using responses; alternating
a. readily reacting or replying to people or events or stimuli; showing emotion"
sly,s marked by skill in deception
spontaneous,a. happening or arising without apparent external cause
straightforward,"s. free from ambiguity
s. pointed directly ahead"
sullen,"s showing a brooding ill humor
s darkened by clouds"
talkative,"s full of trivial conversation
s unwisely talking too much
s friendly and open and willing to talk"
tireless,"s showing sustained enthusiastic action with unflagging vitality
s characterized by hard work and perseverance"
tolerant,"a. showing respect for the rights or opinions or practices of others
s. able to tolerate environmental conditions or physiological stress
s. showing the capacity for endurance"
virtuous,a. morally excellent
vulgar,"s lacking refinement or cultivation or taste
s of or associated with the great masses of people
s being or characteristic of or appropriate to everyday language
s conspicuously and tastelessly indecent"
advisory,"n. an announcement that usually advises or warns the public of some threat
s. giving advice"
allied,"s. related by common characteristics or ancestry
a. of or relating to or denoting the Allies in World War II
a. of or relating to or denoting the Allies in World War I
s. united in a confederacy or league"
armored,"a. protected by armor (used of persons or things military)
a. used of animals; provided with protective covering
s. equipped with the complete arms and armor of a warrior"
binding,"n. the capacity to attract and hold something
n. strip sewn over or along an edge for reinforcement or decoration
n. the protective covering on the front, back, and spine of a book
s. executed with proper legal authority"
comprehensive,"a. including all or everything
s. broad in scope"
factual,a. of or relating to or characterized by facts
idealistic,"a of or relating to the philosophical doctrine of the reality of ideas
s of high moral or intellectual value; elevated in nature or style"
inactive,"s. (chemistry) not participating in a chemical reaction; chemically inert
a. (pathology) not progressing or increasing; or progressing slowly
a. not exerting influence or change
a. lacking activity; lying idle or unused"
lawful,"a. conformable to or allowed by law
s. according to custom or rule or natural law
s. authorized, sanctioned by, or in accordance with law"
legislative,"a. relating to a legislature or composed of members of a legislature
a. of or relating to or created by legislation"
legitimate,"v. show or affirm to be just and legitimate
v. make (an illegitimate child) legitimate; declare the legitimacy of (someone)
a. of marriages and offspring; recognized as lawful
s. based on known statements or events or conditions"
patriotic,a. inspired by love for your country
payable,"n a liability account showing how much is owed for goods and services purchased on credit
s subject to or requiring payment especially as specified"
qualified,"a. meeting the proper standards and requirements and training for an office or position or task
a. limited or restricted; not absolute"
revealing,"s. disclosing unintentionally
a. showing or making known"
unanimous,"s in complete agreement
s acting together as a single undiversified whole"
unofficial,"a. not having official authority or sanction
s. not officially established"
warring,"v make or wage war
s engaged in war"
wholesale,"n. the selling of goods to merchants; usually in large quantities for resale to consumers
v. sell in large quantities
r. at a wholesale price
r. on a large scale without careful discrimination"
arctic,"n. the regions to the north of the Arctic Circle centered on the North Pole
n. a waterproof overshoe that protects shoes from water or snow
s. extremely cold"
atmospheric,a. relating to or located in the atmosphere
foggy,"s stunned or confused and slow to react (as from blows or drunkenness or exhaustion)
s indistinct or hazy in outline
s filled or abounding with fog or mist
s obscured by fog"
geographical,"a of or relating to the science of geography
a determined by geography"
humid,s. containing or characterized by a great deal of water vapor
inland,"a. situated away from an area's coast or border
r. towards or into the interior of a region"
planetary,a. of or relating to or characteristic of the planet Earth or its inhabitants
polar,"s. having a pair of equal and opposite charges
a. located at or near or coming from the earth's poles
a. of or existing at or near a geographical pole or within the Arctic or Antarctic Circles"
seasonal,a. occurring at or dependent on a particular season
supernatural,"n. supernatural forces and events and beings collectively
a. not existing in nature or subject to explanation according to natural laws; not physical or material"
temperate,"a. (of weather or climate) free from extremes; mild; or characteristic of such weather or climate
a. not extreme in behavior"
tidal,a. of or relating to or caused by tides
abnormal,"a. not normal; not typical or usual or regular or conforming to a norm
a. departing from the normal in e.g. intelligence and development
s. much greater than the normal"
approximate,"v. be close or similar
s. not quite exact or correct
s. very close in resemblance
s. located close together"
commonplace,"s. completely ordinary and unremarkable
s. not challenging; dull and lacking excitement"
concise,a. expressing much in few words
confidential,"s. entrusted with private information and the confidence of another
s. (of information) given in confidence or in secret
s. denoting confidence or intimacy
s. the level of official classification for documents next above restricted and below secret; available only to persons authorized to see documents so classified"
eminent,"s. standing above others in quality or position
s. of imposing height; especially standing out above others"
Fahrenheit,"n. German physicist who invented the mercury thermometer and developed the scale of temperature that bears his name (1686-1736)
a. of or relating to a temperature scale proposed by the inventor of the mercury thermometer"
faultless,s. without fault or error
forceful,a. characterized by or full of force or strength (often but not necessarily physical)
given,"n. an assumption that is taken for granted
s. acknowledged as a supposition"
improper,"a. not suitable or right or appropriate
s. not conforming to legality, moral law, or social convention
s. not appropriate for a purpose or occasion"
inclusive,a. including much or everything; and especially including stated limits
inconvenient,"a. not suited to your comfort, purpose or needs
s. not conveniently timed"
indispensable,"a. not to be dispensed with; essential
s. unavoidable"
insignificant,"s. not worthy of notice
s. signifying nothing
s. of little importance or influence or power; of minor status
a. devoid of importance, meaning, or force"
intelligible,"a. well articulated or enunciated, and loud enough to be heard distinctly"
miraculous,"s being or having the character of a miracle
s peculiarly fortunate or appropriate; as if by divine intervention"
monotonous,"s tediously repetitious or lacking in variety; all work and no play""
s sounded or spoken in a tone unvarying in pitch"
notable,"n a celebrity who is an inspiration to others
s worthy of notice
s widely known and esteemed"
orderly,"n. a soldier who serves as an attendant to a superior officer
n. a male hospital attendant who has general duties that do not involve the medical treatment of patients
a. devoid of violence or disruption"
prospective,a. of or concerned with or related to the future
scanty,"n short underpants for women or children (usually used in the plural)
s lacking in amplitude or quantity"
selective,"s. tending to select; characterized by careful choice
s. characterized by very careful or fastidious selection"
steadfast,s. firm and dependable especially in loyalty
sunk,"v fall or descend to a lower place or level
v cause to sink
v pass into a specified state or condition
v go under, ""The raft sank and its occupants drowned""
v descend into or as if into some soft substance or place
v appear to move downward
v fall heavily or suddenly; decline markedly
v fall or sink heavily
v embed deeply
s doomed to extinction"
surplus,"n a quantity much larger than is needed
s more than is needed, desired, or required"
tolerable,a. capable of being borne or endured
understandable,s capable of being apprehended or understood
undesirable,"n. one whose presence is undesirable
a. not wanted
s. not worthy of being chosen (especially as a spouse)"
unpopular,a. regarded with disfavor or lacking general approval
hereafter,"r. in a future life or state
r. following this in time or order or place; after this"
invariably,"r without variation or change, in every case"
ordinarily,r under normal conditions
subsequently,r. happening at a time subsequent to a reference time
broadly,"r. without regard to specific details or exceptions
r. in a wide fashion"
decidedly,r. without question and beyond doubt
heartily,"r. with gusto and without reservation
r. in a hearty manner"
oddly,"r in a manner differing from the usual or expected
r in a strange manner"
vaguely,r. in a vague way
hopefully,"r. with hope; in a hopeful manner
r. it is hoped"
incidentally,r. of a minor or subordinate nature
respectively,r. in the order given
virtually,r. in essence or effect but not in fact
notwithstanding,r despite anything to the contrary (usually following a concession)
amen,n. a primeval Egyptian personification of air and breath; worshipped especially at Thebes
buffalo,"n. a city on Lake Erie in western New York (near Niagara Falls)
n. meat from an American bison
v. intimidate or overawe"
abound,"v. be abundant or plentiful; exist in large quantities
v. be in a state of movement or action"
prairie,n. a treeless grassy plain
conspicuous,a. obvious to the eye or mind
sticker,"n a small sharp-pointed tip resembling a spike on a stem or leaf
n an adhesive label
n a particularly difficult or baffling question or problem
n a short knife with a pointed blade used for piercing or stabbing"
adhere,"v. be compatible or in accordance with
v. follow through or carry out a plan without deviation
v. be a devoted follower or supporter
v. stick to firmly"
bumper,"n. a glass filled to the brim (especially as a toast)
n. a mechanical device consisting of bars at either end of a vehicle to absorb shock and prevent serious damage"
