incur,v. make oneself subject to; bring upon oneself; become liable to
condemnation,"n. (law) the act of condemning (as land forfeited for public use) or judging to be unfit for use (as a food product or an unsafe building)
n. the condition of being strongly disapproved of"
constituency,n. the body of voters who elect a representative for their area
modernize,v. become technologically advanced
headdress,n. clothing for the head
vogue,"n. the popular taste at a given time
n. a current state of general acceptance and use"
in vogue,none
constituent,"n. a member of a constituency; a citizen who is represented in a government by officials for whom he or she votes
n. (grammar) a word or phrase or clause forming part of a larger grammatical construction
s. constitutional in the structure of something (especially your physical makeup)"
cauliflower,"n. a plant having a large edible head of crowded white flower buds
n. compact head of white undeveloped flowers"
neutralize,"v. make politically neutral and thus inoffensive
v. make ineffective by counterbalancing the effect of
v. get rid of (someone who may be a threat) by killing
v. make incapable of military action"
cholesterol,n. an animal sterol that is normally synthesized by the liver; the most abundant steroid in animal tissues
vendor,n someone who promotes or exchanges goods or services for money
outnumber,v. be larger in number
shopper,"n. someone who visits stores in search of articles to buy
n. a commercial agent who shops at the competitor's store in order to compare their prices and merchandise with those of the store that employs her"
boulevard,n a wide street or thoroughfare
racist,"n. a person with a prejudiced belief that one race is superior to others
s. based on racial intolerance
s. discriminatory especially on the basis of race or religion"
perpetuate,v. cause to continue or prevail
supremacy,n power to dominate or defeat
militant,"n. a militant reformer
s. disposed to warfare or hard-line policies"
pervade,v spread or diffuse through
at the beginning of ...,none
enrollment,"n the act of enrolling
n the body of people (such as students) who register or enroll at the same time"
preparatory,s. preceding and preparing for something
plummet,v. drop sharply
intrinsic,"a. belonging to a thing by its very nature
s. situated within or belonging solely to the organ or body part on which it acts"
kidney,n. either of two bean-shaped excretory organs that filter wastes (especially urea) from the blood and excrete them and water in urine
purify,"v. remove impurities from, increase the concentration of, and separate through the process of distillation
v. make pure or free from sin or guilt
v. become clean or pure or free of guilt and sin"
tumor,n. an abnormal new mass of tissue that serves no purpose
recur,"v. happen or occur again
v. return in thought or speech to something"
lethal,s of an instrument of certain death
forefinger,n the finger next to the thumb
redden,"v. make red
v. turn red or redder"
inflammation,"n. a response of body tissues to injury or irritation; characterized by pain and swelling and redness and heat
n. arousal to violent emotion"
sliding,s. being a smooth continuous motion
depot,"n station where transport vehicles load or unload passengers or goods
n a depository for goods"
squeak,n. a short high-pitched noise
contamination,"n. the state of being contaminated
n. the act of contaminating or polluting; including (either intentionally or accidentally) unwanted substances or factors"
stink,v. be extremely bad in quality or in one's performance
sardine,"n. small fatty fish usually canned
n. any of various small edible herring or related food fishes frequently canned"
tart,"n. a small open pie with a fruit filling
n. a pastry cup with a filling of fruit or custard and no top crust"
muffin,n. a sweet quick bread baked in a cup-shaped pan
taint,"n the state of being contaminated
v place under suspicion or cast doubt upon
v contaminate with a disease or microorganism"
taper,"n. a convex shape that narrows toward a point
n. the property possessed by a shape that narrows toward a point (as a wedge or cone)
v. diminish gradually"
unprecedented,a. having no precedent; novel
sanction,"n. formal and explicit approval
n. a mechanism of social control for enforcing a society's standards
n. the act of final authorization
v. give authority or permission to"
because of ...,none
chronic,"a. being long-lasting and recurrent or characterized by long suffering
s. of long duration
s. habitual"
ailment,n. an often persistent bodily disorder or disease; a cause for complaining
void,"n. an empty area or space
v. clear (a room, house, place) of occupants or empty or clear (a place or receptacle) of something
s. containing nothing"
undermine,"v destroy property or hinder normal operations
v hollow out as if making a cave or opening"
validate,"v. declare or make legally valid
v. prove valid; show or confirm the validity of something
v. give evidence for
v. make valid or confirm the validity of"
segregation,"n. (genetics) the separation of paired alleles during meiosis so that members of each pair of alleles appear in different gametes
n. a social system that provides separate facilities for minority groups
n. the act of segregating or sequestering"
holocaust,"n. an act of mass destruction and loss of life (especially in war or by fire)
n. the mass murder of Jews under the German Nazi regime from 1941 until 1945"
result in ...,none
scrutiny,n. a prolonged intense look
attest,"v. provide evidence for; stand as proof of; show by one's behavior, attitude, or external attributes
v. authenticate, affirm to be true, genuine, or correct, as in an official capacity
v. establish or verify the usage of"
validity,n. the quality of having legal force or effectiveness
socioeconomic,a. involving social as well as economic factors
barter,"n. an equal exchange
v. exchange goods without involving money"
poultry,n. flesh of chickens or turkeys or ducks or geese raised for food
collaborate,"v. work together on a common enterprise of project
v. cooperate as a traitor"
vegetation,"n. all the plant life in a particular region or period
n. the process of growth in plants
n. an abnormal growth or excrescence (especially a warty excrescence on the valves of the heart)
n. inactivity that is passive and monotonous, comparable to the inactivity of plant life"
converse,"n. a proposition obtained by conversion
v. carry on a conversation
s. of words so related that one reverses the relation denoted by the other
s. turned about in order or relation"
organizer,"n. a person who brings order and organization to an enterprise
n. someone who enlists workers to join a union"
malicious,a. having the nature of or resulting from malice
degrade,"v. reduce the level of land, as by erosion
v. lower the grade of something; reduce its worth"
broadcaster,"n. someone who broadcasts on radio or television
n. a mechanical device for scattering something (seed or fertilizer or sand etc.) in all directions"
denounce,"v. speak out against
v. announce the termination of, as of treaties
v. give away information about somebody"
superstar,n someone who is dazzlingly skilled in any field
misfit,n. someone unable to adapt to their circumstances
MLB,none
dub,"n. the new sounds added by dubbing
v. give a nickname to
v. provide (movies) with a soundtrack of a foreign language"
mindless,"s. lacking the thinking capacity characteristic of a conscious being
s. requiring little mental effort
s. not marked by the use of reason"
earthworm,n. terrestrial worm that burrows into and helps aerate soil; often surfaces when the ground is cool or wet; used as bait by anglers
empower,v. give or delegate power or authority to
inhuman,s. belonging to or resembling something nonhuman
sovereignty,"n. government free from external control
n. the authority of a state to govern another state"
entice,v. provoke someone to do something through (often false or exaggerated) promises or persuasion
meek,"s. humble in spirit or manner; suggesting retiring mildness or even cowed submissiveness
s. very docile
s. evidencing little spirit or courage; overly submissive or compliant"
prank,"v. dress or decorate showily or gaudily
v. dress up showily"
play a prank on ...,none
northwestern,"s. situated in or oriented toward the northwest
s. of a region of the United States generally including Washington; Oregon; Idaho; and sometimes Montana; Wyoming"
herald,n. (formal) a person who announces important news
herring,"n. valuable flesh of fatty fish from shallow waters of northern Atlantic or Pacific; usually salted or pickled
n. commercially important food fish of northern waters of both Atlantic and Pacific"
according to ...,none
impeach,"v. challenge the honesty or veracity of
v. charge (a public official) with an offense or misdemeanor committed while in office"
petty,s. contemptibly narrow in outlook
immeasurable,a. impossible to measure
constable,"n. a lawman with less authority and jurisdiction than a sheriff
n. English landscape painter (1776-1837)
n. a police officer of the lowest rank"
interrogate,"v. transmit (a signal) for setting off an appropriate response, as in telecommunication
v. pose a series of questions to"
unidentified,s. not yet identified
metro,n. an electric railway operating below the surface of the ground (usually in a city)
dictatorship,n. a form of government in which the ruler is an absolute dictator (not restricted by a constitution or laws or opposition etc.)
intimidate,"v. make timid or fearful
v. to compel or deter by or as if by threats"
stereotype,n. a conventional or formulaic conception or image
patriotism,n. love of country and willingness to sacrifice for it
freak,n. a person or animal that is markedly unusual or deformed
mimic,"n. someone who mimics (especially an actor or actress)
v. imitate (a person or manner), especially for satirical effect
s. constituting an imitation"
affected,"a. acted upon; influenced
a. speaking or behaving in an artificial way to make an impression"
disobedient,"a. not obeying or complying with commands of those in authority
s. unwilling to submit to authority"
misdirect,v. put a wrong address on
mystify,v. make mysterious
incoherent,"a. without logical or meaningful connection
a. (physics) of waves having no stable definite or stable phase relation
s. unable to express yourself clearly or fluently"
soaked,"v submerge in a liquid
v rip off; ask an unreasonable price
v cover with liquid; pour liquid onto
v leave as a guarantee in return for money
v beat severely
v make drunk (with alcoholic drinks)
v become drunk or drink excessively
v fill, soak, or imbue totally
v heat a metal prior to working it
s very drunk"
widower,n. a man whose wife is dead especially one who has not remarried
pester,v annoy persistently
publicize,v. make public
merchandising,"n the exchange of goods for an agreed sum of money
v engage in the trade of"
prototype,n. a standard or typical example
cameraman,n. a photographer who operates a movie camera
seduce,"v. induce to have sex
v. lure or entice away from duty, principles, or proper conduct"
naive,"a. marked by or showing unaffected simplicity and lack of guile or worldly experience
s. inexperienced"
snub,"n. a refusal to recognize someone you know
s. unusually short"
psychiatry,n. the branch of medicine dealing with the diagnosis and treatment of mental disorders
assassination,n. murder of a public figure by surprise attack
stun,"v. make senseless or dizzy by or as if by a blow
v. overcome as with astonishment or disbelief"
discoverer,"n someone who is the first to think of or make something
n someone who is the first to observe something"
unveil,"v. remove the veil from
v. remove the cover from"
affluent,"n. an affluent person; a person who is financially well off
s. having an abundant supply of money or possessions of value"
rectangular,s. having four right angles
activate,"v. make active or more active
v. make more adsorptive
v. aerate (sewage) so as to favor the growth of organisms that decompose organic matter
v. make (substances) radioactive"
generator,"n. an apparatus that produces a vapor or gas
n. engine that converts mechanical energy into electrical energy by electromagnetic induction
n. someone who originates or causes or initiates something
n. an electronic device for producing a signal voltage"
boarder,"n. someone who forces their way aboard ship
n. a pupil who lives at school during term time"
crunch,"n. the sound of something crunching
n. a critical situation that arises because of a shortage (as a shortage of time or money or resources)
v. make a crushing noise
v. press or grind with a crushing noise"
pickle,"n. vegetables (especially cucumbers) preserved in brine or vinegar
v. preserve in a pickling liquid"
rocker,"n. an attendant who rocks a child in a cradle
n. a performer or composer or fan of rock music
n. a teenager or young adult in the 1960s who wore leather jackets and rode motorcycles
n. a trough that can be rocked back and forth; used by gold miners to shake auriferous earth in water in order to separate the gold"
granddad,n the father of your father or mother
cuddle,"n. a close and affectionate (and often prolonged) embrace
v. move or arrange oneself in a comfortable and cozy position
v. hold (a person or thing) close, as for affection, comfort, or warmth"
throng,v. press tightly together or cram
encircle,v. form a circle around
legislature,n. persons who make or amend or repeal laws
a legislature building,none
thrush,"n. candidiasis of the oral cavity; seen mostly in infants or debilitated adults
n. a woman who sings popular songs
n. songbirds characteristically having brownish upper plumage with a spotted breast"
hover,"v. be undecided about something; waver between conflicting positions or courses of action
v. move to and fro
v. hang in the air; fly or be suspended above"
caterpillar,"n. a wormlike and often brightly colored and hairy or spiny larva of a butterfly or moth
n. a large tracked vehicle that is propelled by two endless metal belts; frequently used for moving earth in construction and farm work"
in order to do ...,none
psychiatrist,n. a physician who specializes in psychiatry
vest,"n. a man's sleeveless garment worn underneath a coat
v. place (authority, property, or rights) in the control of a person or group of persons
v. become legally vested
v. clothe oneself in ecclesiastical garments"
jot,"n a brief (and hurriedly handwritten) note
n a slight but appreciable amount
v write briefly or hurriedly; write a short note of"
respondent,"n. the codefendant (especially in a divorce proceeding) who is accused of adultery with the corespondent
n. someone who responds"
chunk,n. a substantial amount
munch,"n. Norwegian painter (1863-1944)
n. a large bite"
nutritious,s of or providing nourishment
buck,"n. United States author whose novels drew on her experiences as a missionary in China (1892-1973)
n. mature male of various mammals (especially deer or antelope)
v. to strive with determination
v. resist"
breeding,"n. elegance by virtue of fineness of manner and expression
n. helping someone grow up to be an accepted member of the community
n. the production of animals or plants by inbreeding or hybridization"
nip,"n. a small drink of liquor
n. a tart spicy quality
n. a small sharp bite or snip
v. give a small sharp bite to"
assassin,"n. a murderer (especially one who kills a prominent political figure) who kills by a surprise attack and often is hired to do the deed
n. a member of a secret order of Muslims (founded in the 12th century) who terrorized and killed Christian Crusaders"
revolver,n. a pistol with a revolving cylinder (usually having six chambers for bullets)
peek,n. a secret look
poke,"n. tall coarse perennial American herb having small white flowers followed by blackish-red berries on long drooping racemes; young fleshy stems are edible; berries and root are poisonous
v. stir by poking
v. make a hole by poking"
toothpick,n. pick consisting of a small strip of wood or plastic; used to pick food from between the teeth
yolk,n. nutritive material of an ovum stored for the nutrition of an embryo (especially the yellow mass of a bird or reptile egg)
so that ...,none
pry,"v. to move or force, especially in an effort to get something open
v. be nosey
v. make an uninvited or presumptuous inquiry"
roadside,n edge of a way or road or path
boulder,"n. a large smooth mass of rock detached from its place of origin
n. a town in north central Colorado; Rocky Mountains resort center and university town"
rehearse,v. engage in a rehearsal (of)
animated,"a. having life or vigor or spirit
s. made to appear to move as living creatures do"
monologue,"n. a long utterance by one person (especially one that prevents others from participating in the conversation)
n. a (usually long) dramatic speech by a single actor"
bellboy,n. someone employed as an errand boy and luggage carrier around hotels
retrace,"v to go back over again
v reassemble mentally"
look for ...,none
blizzard,n. a storm with widespread snowfall accompanied by strong winds
sling,"n. a highball with liquor and water with sugar and lemon or lime juice
n. a simple weapon consisting of a looped strap in which a projectile is whirled and then released
n. bandage to support an injured forearm; consisting of a wide triangular piece of cloth hanging from around the neck
v. hurl as if with a sling"
snowball,"n. plant having heads of fragrant white trumpet-shaped flowers; grows in sandy arid regions
n. ball of ice cream covered with coconut and usually chocolate sauce
n. ball of crushed ice with fruit syrup
n. snow pressed into a ball for throwing (playfully)"
go out,none
each other,none
rustic,n. an unsophisticated country person
intolerant,a. unwilling to tolerate difference of opinion
spank,"n. a slap with the flat of the hand
v. give a spanking to; subject to a spanking"
signing,"n language expressed by visible hand gestures
v mark with one's signature; write one's name (on)
v approve and express assent, responsibility, or obligation
v be engaged by a written agreement
v engage by written agreement
v communicate silently and non-verbally by signals or signs
v place signs, as along a road
v communicate in sign language
v make the sign of the cross over someone in order to call on God for protection; consecrate"
pact,n a written agreement between two states or sovereigns
surge,"n. a sudden or abrupt strong increase
v. see one's performance improve"
swoop,"n. (music) rapid sliding up or down the musical scale
n. a very rapid raid
n. a swift descent through the air
v. move with a sweep, or in a swooping arc"
reservoir,"n. a large or extra supply of something
n. lake used to store water for community use
n. tank used for collecting and storing a liquid (as water or oil)
n. anything (a person or animal or plant or substance) in which an infectious agent normally lives and multiplies"
carp,"n. the lean flesh of a fish that is often farmed; can be baked or braised
n. any of various freshwater fish of the family Cyprinidae"
sled,"n. a vehicle mounted on runners and pulled by horses or dogs; for transportation over snow
v. ride (on) a sled"
thump,"n. a heavy dull sound (as made by impact of heavy objects)
n. a heavy blow with the hand
v. hit hard with the hand, fist, or some heavy instrument"
lamppost,n. a metal post supporting an outdoor lamp (such as a streetlight)
twitch,"n. a sudden muscle spasm; especially one caused by a nervous condition
v. make an uncontrolled, short, jerky motion
v. move or pull with a sudden motion"
pang,"n. a sudden sharp feeling
n. a mental pain or distress
n. a sharp spasm of pain"
forearm,"n. the part of the superior limb between the elbow and the wrist
v. arm in advance of a confrontation"
showy,s. displaying brilliance and virtuosity
unbutton,v. undo the buttons of
snug,"s. offering safety; well protected or concealed
s. well and tightly constructed"
take ... off,"n. a departure; especially of airplanes
n. the initial ascent of an airplane as it becomes airborne"
mournful,s. expressing sorrow
hoot,"n. a loud raucous cry (as of an owl)
v. to utter a loud clamorous shout
v. utter the characteristic sound of owls"
wail,v. cry weakly or softly
supersonic,"a. (of speed) greater than the speed of sound in a given medium (especially air)
s. having frequencies above those of audible sound"
abbreviate,v. shorten
abort,"n. the act of terminating a project or procedure before it is completed
v. terminate before completion
v. cease development, die, and be aborted
v. terminate a pregnancy by undergoing an abortion"
environmentalist,n. someone who works to protect the environment from destruction or pollution
affix,"n. a linguistic element added to a word to produce an inflected or derived form
v. attach to
v. attach or become attached to a stem word"
censorship,"n counterintelligence achieved by banning or deleting any information of value to the enemy
n deleting parts of publications or correspondence or theatrical performances"
anarchist,n. an advocate of anarchism
agitate,"v. try to stir up public opinion
v. cause to be agitated, excited, or roused
v. change the arrangement or position of"
commercialism,n transactions (sales and purchases) having the objective of supplying commodities (goods and services)
alienate,v. make withdrawn or isolated or emotionally dissociated
TV,"n broadcasting visual images of stationary or moving objects
n an electronic device that receives television signals and displays them on a screen"
ruthless,s without mercy or pity
allot,"v give out
v allow to have
v administer or bestow, as in small portions"
laborious,s characterized by effort to the point of exhaustion; especially physical effort
sheriff,n. the principal law-enforcement officer in a county
apprehend,v. anticipate with dread or anxiety
notorious,s known widely and usually unfavorably; 
villain,"n. a wicked or evil person; someone who does evil deliberately
n. the principal bad character in a film or work of fiction"
on suspicion of ...,none
avert,v. turn away or aside
dynasty,n. a sequence of powerful leaders in the same family
unrest,n. a feeling of restless agitation
censor,"n. someone who censures or condemns
n. a person who is authorized to read publications or correspondence or to watch theatrical performances and suppress in whole or in part anything considered obscene or politically unacceptable
v. subject to political, religious, or moral censorship"
pretext,n. something serving to conceal plans; a fictitious reason that is concocted in order to conceal the real reason
oversight,"n. an unintentional omission resulting from failure to notice something
n. a mistake resulting from inattention"
under the pretext of ...,none
on the pretext of ...,none
decree,"n. a legally binding command or decision entered on the court record (as if issued by a court or judge)
v. issue a decree"
centralize,v. make central
illogical,a. lacking in correct logical relation
bonfire,n. a large outdoor fire that is lighted as a signal or in celebration
chant,"n. a repetitive song in which as many syllables as necessary are assigned to a single tone
v. recite with musical intonation; recite as a chant or a psalm"
grandeur,"n the quality of being magnificent or splendid or grand
n the quality of elevation of mind and exaltation of character or ideals or conduct"
gravel,"n. rock fragments and pebbles
v. cover with gravel"
pulp,"n. any soft or soggy mass
n. a soft moist part of a fruit
n. a mixture of cellulose fibers
n. an inexpensive magazine printed on poor quality paper"
clog,"n. footwear usually with wooden soles
n. any object that acts as a hindrance or obstruction
v. become or cause to become obstructed
v. dance a clog dance"
sewer,"n. a waste pipe that carries away sewage or surface water
n. someone who sews"
townspeople,n the people living in a municipality smaller than a city
commemorate,"v. mark by some ceremony or observation
v. call to remembrance; keep alive the memory of someone or something, as in a ceremony
v. be or provide a memorial to a person or an event"
bust,"n. a sculpture of the head and shoulders of a person
n. an occasion for excessive eating or drinking"
loyalist,n. a person who is loyal to their allegiance (especially in times of revolt)
confound,"v be confusing or perplexing to; cause to be unable to think clearly
v mistake one thing for another"
deceptive,"s. causing one to believe what is not true or fail to believe what is true
s. designed to deceive or mislead either deliberately or inadvertently"
hypocrite,n. a person who professes beliefs and opinions that he or she does not hold in order to conceal his or her real feelings or motives
amenity,n pleasantness resulting from agreeable conditions
dabble,"v. dip a foot or hand briefly into a liquid
v. play in or as if in water, as of small children
v. work with in an amateurish manner
v. bob forward and under so as to feed off the bottom of a body of water"
billiards,n. any of several games played on rectangular cloth-covered table (with cushioned edges) in which long tapering cue sticks are used to propel ivory (or composition) balls
stepmother,n. the wife of your father by a subsequent marriage
darn,v. repair by sewing
zigzag,"n. an angular shape characterized by sharp turns in alternating directions
v. travel along a zigzag path
s. having short sharp turns or angles"
nick,"n. (British slang) a prison
v. cut slightly, with a razor
v. cut a nick into
v. divide or reset the tail muscles of"
extended,"a. fully extended or stretched forth
s. beyond the literal or primary sense"
