jurisdiction,n. in law; the territory within which power can be exercised
frustrating,"s. discouraging by hindering
s. preventing realization or attainment of a desire"
upgrade,"n. software that provides better performance than an earlier version did
n. a reservation that is improved
n. the property possessed by a slope or surface that rises
n. hardware that provides better performance than an earlier version did"
laptop,n. a portable computer small enough to use in your lap
PC,n a small digital computer based on a microprocessor and designed to be used by one person at a time
personal computer,none
victimize,"v. make a victim of
v. punish unjustly
v. deprive of by deceit"
irrational,"a. not consistent with or using reason
a. real but not expressible as the quotient of two integers"
unethical,a. not conforming to approved standards of social or professional behavior
warp,"n. a shape distorted by twisting or folding
n. a moral or mental distortion
n. yarn arranged lengthways on a loom and crossed by the woof"
withhold,"v. hold back; refuse to hand over or share
v. retain and refrain from disbursing; of payments"
ambiguous,"a. having more than one possible meaning
s. having no intrinsic or objective meaning; not organized in conventional patterns"
zoom,"v. move along very quickly
v. move with a low humming noise"
jellyfish,n. any of numerous usually marine and free-swimming coelenterates that constitute the sexually reproductive forms of hydrozoans and scyphozoans
underwater,"s beneath the surface of the water
s growing or remaining under water"
addiction,"n. being abnormally tolerant to and dependent on something that is psychologically or physically habit-forming (especially alcohol or narcotic drugs)
n. an abnormally strong craving
n. (Roman law) a formal award by a magistrate of a thing or person to another person (as the award of a debtor to his creditor); a surrender to a master"
afflict,"v. cause great unhappiness for; distress
v. cause physical pain or suffering in"
preacher,n. someone whose occupation is preaching the gospel
baron,"n. a nobleman (in various countries) of varying rank
n. a British peer of the lowest rank
n. a very wealthy or powerful businessman"
agonize,"v. cause to agonize
v. suffer agony or anguish"
creed,n. any system of principles or beliefs
for days,none
be true to ...,none
nationwide,"s occurring or extending throughout a country or nation
r extending throughout an entire nation"
aspire,v have an ambitious plan or a lofty goal
presidency,"n. the tenure of a president
n. the office and function of president"
boosted by ...,none
brood,"n. the young of an animal cared for at one time
v. think moodily or anxiously about something
v. hang over, as of something threatening, dark, or menacing
v. sit on (eggs)"
impeachment,n. a formal document charging a public official with misconduct in office
cleanup,n. (baseball) the fourth position in the batting order (usually filled by the best batter on the team)
profoundly,r. to a great depth psychologically
disillusion,"n freeing from false belief or illusions
v free from enchantment"
aim at ...,none
the political world,none
falter,"v. be unsure or weak
v. move hesitatingly, as if about to give way"
custard,n. sweetened mixture of milk and eggs baked or boiled or frozen
cut down on ...,none
botany,n. the branch of biology that studies plants
novelty,n. originality by virtue of being new and surprising
glaze,"n. any of various thin shiny (savory or sweet) coatings applied to foods
n. a glossy finish on a fabric
n. a coating for ceramics, metal, etc.
v. coat with a glaze"
obsess,v. be preoccupied with something
mystical,"a relating to or characteristic of mysticism
a relating to or resembling mysticism
s having an import not apparent to the senses nor obvious to the intelligence; beyond ordinary understanding"
demon,n. someone extremely diligent or skillful
deathbed,"n. the last few hours before death
n. the bed on which a person dies"
at one's deathbed,none
on one's deathbed,none
authoritative,"s. having authority or ascendancy or influence
s. of recognized authority or excellence
s. sanctioned by established authority"
documentation,"n. confirmation that some fact or statement is true through the use of documentary evidence
n. documentary validation"
reconsider,"v. consider again; give new consideration to; usually with a view to changing
v. consider again (a bill) that had been voted upon before, with a view to altering it"
become available,none
relish,"n. spicy or savory condiment
n. the taste experience when a savoury condiment is taken into the mouth"
legendary,s. so celebrated as to having taken on the nature of a legend
scenic,"s. used of locations; having beautiful natural scenery
a. of or relating to the stage or stage scenery"
misty,s. wet with mist
shareholder,n someone who holds shares of stock in a corporation
habitually,r. according to habit or custom
scan,"n. the act of scanning; systematic examination of a prescribed region
n. an image produced by scanning
v. examine minutely or intensely
v. examine hastily"
stock quote,none
tar,v. coat with tar
sicken,"v. get sick
v. upset and make nauseated
v. make sick or ill"
theorist,n. someone who theorizes (especially in science or art)
smack,"n. a sailing ship (usually rigged like a sloop or cutter) used in fishing and sailing along the coast
n. an enthusiastic kiss
n. the act of smacking something; a blow delivered with an open hand
v. deliver a hard blow to"
arrogance,n. overbearing pride evidenced by a superior manner toward inferiors
speculate,"v. to believe especially on uncertain or tentative grounds
v. talk over conjecturally, or review in an idle or casual way and with an element of doubt or without sufficient reason to reach a conclusion
v. invest at a risk"
invader,n. someone who enters by force in order to conquer
layout,"n. a plan or design of something that is laid out
n. the act of laying out (as by making plans for something)"
yearn,v. have affection for; feel tenderness for
entrepreneur,n. someone who organizes a business venture and assumes the risk for it
eel,"n. the fatty flesh of eel; an elongate fish found in fresh water in Europe and America; large eels are usually smoked or pickled
n. voracious snakelike marine or freshwater fishes with smooth slimy usually scaleless skin and having a continuous vertical fin but no ventral fins"
pest,"n. a persistently annoying person
n. any unwanted and destructive insect or other animal that attacks food or crops or livestock etc."
bearing,"n. relevant relation or interconnection
n. the direction or path along which something moves or along which it lies
n. dignified manner or conduct
n. a rotating support placed between moving parts to allow them to move easily"
displacement,"n. (chemistry) a reaction in which an elementary substance displaces and sets free a constituent element from a compound
n. (psychiatry) a defense mechanism that transfers affect or reaction from the original object to some more acceptable one
n. to move something from its natural environment"
expanse,n. a wide and open space or area as of surface or land or sky
rap,"n. a gentle blow
n. voluble conversation
n. genre of African-American music of the 1980s and 1990s in which rhyming lyrics are chanted to a musical accompaniment; several forms of rap have emerged
v. strike sharply"
uplift,"n. a brassiere that lifts and supports the breasts
v. lift up from the earth, as by geologic forces
v. lift up or elevate"
vibration,"n. the act of vibrating
n. a distinctive emotional aura experienced instinctively"
antibody,"n. any of a large variety of proteins normally present in the body or produced in response to an antigen which it neutralizes, thus producing an immune response"
countenance,"n. the appearance conveyed by a person's face
n. the human face (`kisser' and `smiler' and `mug' are informal terms for `face' and `phiz' is British)"
deodorant,n. a toiletry applied to the skin in order to mask unpleasant odors
disability,n. the condition of being unable to perform as a consequence of physical or mental unfitness
eyeball,n. the ball-shaped capsule containing the vertebrate eye
fingernail,n. the nail at the end of a finger
immortality,"n. the quality or state of being immortal
n. perpetual life after death"
posture,"n the arrangement of the body and its limbs
n characteristic way of bearing one's body
n a rationalized mental attitude
n capability in terms of personnel and materiel that affect the capacity to fight a war
v behave affectedly or unnaturally in order to impress others
v assume a posture as for artistic purposes"
skeleton,"n. something reduced to its minimal form
n. a scandal that is kept secret
n. the internal supporting structure that gives an artifact its shape"
spine,"n. a small sharp-pointed tip resembling a spike on a stem or leaf
n. the part of a book's cover that encloses the inner side of the book's pages and that faces outward when the book is shelved
n. a sharp rigid animal process or appendage; as a porcupine quill or a ridge on a bone or a ray of a fish fin"
agitation,"n. a mental state of extreme emotional disturbance
n. a state of agitation or turbulent change or development
n. the feeling of being agitated; not calm"
anguish,"n. extreme mental distress
n. extreme distress of body or mind
v. suffer great pains or distress"
aspiration,"n. a will to succeed
n. a manner of articulation involving an audible release of breath"
bewilderment,n. confusion resulting from failure to understand
compassion,"n. a deep awareness of and sympathy for another's suffering
n. the humane quality of understanding the suffering of others and wanting to do something about it"
conceit,"n. an elaborate poetic image or a far-fetched comparison of very dissimilar things
n. a witty or ingenious turn of phrase
n. an artistic device or effect
n. the trait of being unduly vain and conceited; false pride"
dilemma,n. state of uncertainty or perplexity especially as requiring a choice between equally unfavorable options
discretion,"n. freedom to act or judge on one's own
n. knowing how to avoid embarrassment or distress
n. the trait of judging wisely and objectively"
distraction,"n. mental turmoil
n. an obstacle to attention
n. the act of distracting; drawing someone's attention away from something"
ecstasy,"n. a state of being carried away by overwhelming emotion
n. a state of elated bliss"
estimation,"n a document appraising the value of something (as for insurance or taxation)
n the respect with which a person is held
n an approximate calculation of quantity or degree or worth
n a judgment of the qualities of something or somebody"
gut,"n. a narrow channel or strait
v. empty completely; destroy the inside of
v. remove the guts of"
humiliation,"n. state of disgrace or loss of self-respect
n. an instance in which you are caused to lose your prestige or self-respect
n. depriving one of self-esteem"
hypocrisy,"n. an expression of agreement that is not supported by real conviction
n. insincerity by virtue of pretending to have qualities or beliefs that you do not really have"
indulgence,"n. an inability to resist the gratification of whims and desires
n. a disposition to yield to the wishes of someone
n. the act of indulging or gratifying a desire"
integrity,"n. an undivided or unbroken completeness or totality with nothing wanting
n. moral soundness"
intuition,"n. instinctive knowing (without the use of rational processes)
n. an impression that something might be the case"
longing,n. prolonged unfulfilled desire or need
lust,n. self-indulgent sexual desire (personified as one of the deadly sins)
mockery,"n showing your contempt by derision
n a composition that imitates or misrepresents somebody's style, usually in a humorous way
n humorous or satirical mimicry"
mourning,n. state of sorrow over the death or departure of a loved one
perseverance,n. the act of persisting or persevering; continuing or repeating behavior
pretension,"n. a false or unsupportable quality
n. the advancing of a claim"
rapture,"n a state of being carried away by overwhelming emotion
n a state of elated bliss"
sanity,n. normal or sound powers of mind
stimulation,"n. the act of arousing an organism to action
n. any stimulating information or event; acts to arouse action
n. (physiology) the effect of a stimulus (on nerves or organs etc.)"
temperament,"n. excessive emotionalism or irritability and excitability (especially when displayed openly)
n. an adjustment of the intervals (as in tuning a keyboard instrument) so that the scale can be used to play in different keys"
chord,"n. a straight line connecting two points on a curve
n. a combination of three or more notes that blend harmoniously when sounded together
v. play chords on (a string instrument)"
comma,"n. a punctuation mark (,) used to indicate the separation of elements within the grammatical structure of a sentence
n. anglewing butterfly with a comma-shaped mark on the underside of each hind wing"
commentary,n a written explanation or criticism or illustration that is added to a book or other textual material
lyric,"n. the text of a popular song or musical-comedy number
n. a short poem of songlike quality
v. write lyrics for (a song)
s. expressing deep emotion"
revision,"n. the act of revising or altering (involving reconsideration and modification)
n. the act of rewriting something"
screening,"n. the display of a motion picture
n. fabric of metal or plastic mesh
n. testing objects or persons in order to identify those with particular characteristics"
alpha,"n. the 1st letter of the Greek alphabet
n. the beginning of a series or sequence
s. first in order of importance"
anatomy,"n. the branch of morphology that deals with the structure of animals
n. a detailed analysis"
carnival,"n. a festival marked by merrymaking and processions
n. a traveling show; having sideshows and rides and games of skill etc."
clone,"n. a group of genetically identical cells or organisms derived from a single cell or individual by some kind of asexual reproduction
v. make multiple identical copies of"
communion,"n. the act of participating in the celebration of the Eucharist
n. sharing thoughts and feelings
n. (Christianity) a group of Christians with a common religious faith who practice the same rites"
critique,"n an essay or article that gives a critical evaluation (as of a book or play)
n a serious examination and judgment of something
v appraise critically"
dedication,"n. complete and wholehearted fidelity
n. a ceremony in which something (as a building) is dedicated to some goal or purpose
n. a short message (as in a book or musical work or on a photograph) dedicating it to someone or something"
delta,"n. a low triangular area of alluvial deposits where a river divides before entering a larger body of water
n. an object shaped like an equilateral triangle
n. the 4th letter of the Greek alphabet"
divinity,"n. the quality of being divine
n. white creamy fudge made with egg whites"
dynamics,n. the branch of mechanics concerned with the forces that cause motions of bodies
enlightenment,"n. education that results in understanding and the spread of knowledge
n. a movement in Europe from about 1650 until 1800 that advocated the use of reason and individualism instead of tradition and established doctrine"
festivity,n any joyous diversion
formulation,"n. a substance prepared according to a formula
n. the style of expressing yourself"
imagery,n the ability to form mental images of things or events
implication,"n. an accusation that brings into intimate and usually incriminating connection
n. a logical relation between propositions p and q of the form `if p then q'; if p is true then q cannot be false
n. a relation implicated by virtue of involvement or close connection (especially an incriminating involvement)"
literacy,n. the ability to read and write
materialism,"n. a desire for wealth and material possessions with little interest in ethical or spiritual matters
n. (philosophy) the philosophical theory that matter is the only reality"
motto,n. a favorite saying of a sect or political group
multiplication,"n. a multiplicative increase
n. an arithmetic operation that is the inverse of division; the product of two numbers is computed"
numeral,"n. a symbol used to represent a number
a. of or relating to or denoting numbers"
parable,n. (New Testament) any of the stories told by Jesus to convey his religious message
dandelion,n. any of several herbs of the genus Taraxacum having long tap roots and deeply notched leaves and bright yellow flowers followed by fluffy seed balls
eruption,"n. symptom consisting of a breaking out and becoming visible
n. (of volcanos) pouring out fumes or lava (or a deposit so formed)
n. the emergence of a tooth as it breaks through the gum"
fertility,n. the state of being fertile; capable of producing offspring
galaxy,"n. a splendid assemblage (especially of famous people)
n. (astronomy) a collection of star systems; any of the billions of systems each having many stars and nebulae and dust"
humidity,n. wetness in the atmosphere
ivy,n. Old World vine with lobed evergreen leaves and black berrylike fruits
ozone,n. a colorless gas (O3) soluble in alkalis and cold water; a strong oxidizing agent; can be produced by electric discharge in oxygen or by the action of ultraviolet radiation on oxygen in the stratosphere (where it acts as a screen for ultraviolet radiation)
radium,n. an intensely radioactive metallic element that occurs in minute amounts in uranium ores
spa,"n a health resort near a spring or at the seaside
n a fashionable hotel usually in a resort area
n a place of business with equipment and facilities for exercising and improving physical fitness"
starlight,n. the light of the stars
absorption,"n. (chemistry) a process in which one substance permeates another; a fluid permeates or is dissolved by a liquid or solid
n. (physics) the process in which incident radiated energy is retained without reflection or transmission on passing through a medium"
adolescence,"n. the time period between the beginning of puberty and adulthood
n. in the state that someone is in between puberty and adulthood"
array,"n. an orderly arrangement
n. an impressive display
n. especially fine or decorative clothing
n. an arrangement of aerials spaced to give desired directional characteristics"
blackmail,"n. extortion of money by threats to divulge discrediting information
v. exert pressure on someone through threats
v. obtain through threats"
blur,"n. a hazy or indistinct representation
v. to make less distinct or clear
v. make dim or indistinct
v. become vague or indistinct"
buttonhole,n. a hole through which buttons are pushed
calling,"n the particular occupation for which you are trained
v assign a specified (usually proper) proper name to
v ascribe a quality to or give a name of a common noun that reflects a quality
v get or try to get into communication (with someone) by telephone
v utter a sudden loud cry
v order, request, or command to come
v pay a brief visit
v call a meeting; invite or command to meet
v read aloud to check for omissions or absentees
v send a message or attempt to reach someone by radio, phone, etc.; make a signal to in order to transmit a message
v utter a characteristic note or cry
v stop or postpone because of adverse conditions, such as bad weather
v greet, as with a prescribed form, title, or name
v make a stop in a harbour
v demand payment of (a loan)
v make a demand, as for a card or a suit or a show of hands
v give the calls (to the dancers) for a square dance
v indicate a decision in regard to
v make a prediction about; tell in advance
v require the presentation of for redemption before maturation
v challenge (somebody) to make good on a statement; charge with or censure for an offense
v declare in the capacity of an umpire or referee
v lure by imitating the characteristic call of an animal
v order or request or give a command for
v order, summon, or request for a specific duty or activity, work, role
v utter in a loud voice or announce
v challenge the sincerity or truthfulness of
v consider or regard as being
v rouse somebody from sleep with a call"
coeducation,n. education of men and women in the same institutions
confinement,"n. the act of restraining of a person's liberty by confining them
n. the state of being confined"
congregation,"n. a group of people who adhere to a common faith and habitually attend a given church
n. an assemblage of people or animals or things collected together
n. the act of congregating"
cookery,n the act of preparing something (as food) by the application of heat
craze,"n. state of violent mental agitation
n. a fine crack in a glaze or other surface
v. develop a fine network of cracks"
decency,"n. the quality of conforming to standards of propriety and morality
n. the quality of being polite and respectable"
detachment,"n. the act of releasing from an attachment or connection
n. a small unit of troops of special composition"
drawback,n. the quality of being a hindrance
eccentricity,"n. strange and unconventional behavior
n. (geometry) a ratio describing the shape of a conic section; the ratio of the distance between the foci to the length of the major axis
n. a circularity that has a different center or deviates from a circular path"
epidemic,"n. a widespread outbreak of an infectious disease; many people are infected at the same time
a. (especially of medicine) of disease or anything resembling a disease; attacking or affecting many individuals in a community or a population simultaneously"
etiquette,n. rules governing socially acceptable behavior
fad,n. an interest followed with exaggerated zeal
fatality,"n. a death resulting from an accident or a disaster
n. the quality of being able to cause death or fatal disasters"
fellowship,n. money granted (by a university or foundation or other agency) for advanced study or research
footlight,"n. One of a row of lights in the front of the stage in a
   theater, etc., and on a level therewith."
gloom,"n. a state of partial or total darkness
n. a feeling of melancholy apprehension
n. an atmosphere of depression and melancholy"
goodwill,"n (accounting) an intangible asset valued according to the advantage or reputation a business has acquired (over and above its tangible assets)
n the friendly hope that something will succeed
n a disposition to kindness and compassion"
hybrid,"n. a composite of mixed origin
n. (genetics) an organism that is the offspring of genetically dissimilar parents or stock; especially offspring produced by breeding plants or animals of different varieties or breeds or species
s. produced by crossbreeding"
ignition,"n. the process of initiating combustion or catching fire
n. the mechanism that ignites the fuel in an internal-combustion engine
n. the act of setting something on fire"
imprint,"n. a distinctive influence
n. an identification of a publisher; a publisher's name along with the date and address and edition that is printed at the bottom of the title page
n. an impression produced by pressure or printing
n. a device produced by pressure on a surface"
individuality,n. the quality of being individual
infancy,"n. the early stage of growth or development
n. the earliest state of immaturity"
intercourse,n. communication between individuals
intimacy,"n close or warm friendship
n a usually secretive or illicit sexual relationship
n a feeling of being intimate and belonging together"
kinship,n. (anthropology) relatedness or connection by blood or marriage or adoption
parting,"n the act of departing politely
n a line of scalp that can be seen when sections of hair are combed in opposite directions
v go one's own way; move apart
v discontinue an association or relation; go different ways
v leave
v come apart
v force, take, or pull apart"
permanence,n. the property of being able to exist for an indefinite duration
placement,"n. the spatial property of the way in which something is placed
n. contact established between applicants and prospective employees
n. the act of putting something in a certain place"
potentiality,"n the inherent capacity for coming into being
n an aptitude that may be developed"
proficiency,"n. the quality of having great facility and competence
n. skillfulness in the command of fundamentals deriving from practice and familiarity"
progression,n. a series with a definite pattern of advance
readiness,"n. the state of having been made ready or prepared for use or action (especially military action)
n. prompt willingness"
relevance,n. the relation of something to the matter at hand
secrecy,n. the trait of keeping things secret
siren,"n. a sea nymph (part woman and part bird) supposed to lure sailors to destruction on the rocks where the nymphs lived
n. a warning signal that is a loud wailing sound
n. an acoustic device producing a loud often wailing sound as a signal or warning
n. eellike aquatic North American salamander with small forelimbs and no hind limbs; have permanent external gills"
sophistication,"n. being expert or having knowledge of some technical subject
n. the quality or character of being intellectually sophisticated and worldly through cultivation or experience or disillusionment
n. falsification by the use of sophistry; misleading by means of specious fallacies"
specialty,"n an asset of special worth or utility
n a distinguishing trait
n the special line of work you have adopted as your career"
