unusual,"a. not usual or common or ordinary
s. not commonly encountered"
update,"n. news that updates your information
v. modernize or bring up to date
v. bring up to date; supply with recent information
v. bring to the latest state of technology"
upgrade,"n. software that provides better performance than an earlier version did
n. a reservation that is improved
n. the property possessed by a slope or surface that rises
n. hardware that provides better performance than an earlier version did"
uphold,"v. stand up for; stick up for; of causes, principles, or ideals
v. support against an opponent"
upset,"n. the act of disturbing the mind or body
n. a tool used to thicken or spread metal (the end of a bar or a rivet etc.) by forging or hammering or swaging
n. the act of upsetting something
v. disturb the balance or stability of"
up-to-date,"s. reflecting the latest information or changes
s. in accord with the most fashionable ideas or style"
urban,"a. relating to or concerned with a city or densely populated area
a. located in or characteristic of a city or city life"
urge,"n. an instinctive motive
n. a strong restless desire
v. force or impel in an indicated direction"
urgent,s compelling immediate action
utilize,v. convert (from an investment trust to a unit trust)
unanimous,"s in complete agreement
s acting together as a single undiversified whole"
uncover,"v. make visible
v. remove all or part of one's clothes to show one's body"
undermine,"v destroy property or hinder normal operations
v hollow out as if making a cave or opening"
union,"n. an organization of employees formed to bargain with the employer
n. the United States (especially the northern states during the American Civil War)
n. the state of being joined or united or linked
n. healing process involving the growing together of the edges of a wound or the growing together of broken bones"
unify,v. become one
unity,"n an undivided or unbroken completeness or totality with nothing wanting
n the smallest whole number or a numeral representing this number
n the quality of being united into one"
upper,"n. piece of leather or synthetic material that forms the part of a shoe or boot above the sole that encases the foot
s. the topmost one of two
s. higher in place or position
s. superior in rank or accomplishment"
upright,"n. a vertical structural member as a post or stake
n. a piano with a vertical sounding board
s. in a vertical position; not sloping"
uproar,"n a state of commotion and noise and confusion
n loud confused noise from many sources"
utter,"v. express audibly; utter sounds (not necessarily words)
v. put into circulation"
ultraviolet,"n. radiation lying in the ultraviolet range; wave lengths shorter than light but longer than X rays
s. having or employing wavelengths shorter than light but longer than X-rays; lying outside the visible spectrum at its violet end"
umbrella,"n. a lightweight handheld collapsible canopy
n. a formation of military planes maintained over ground operations or targets
n. having the function of uniting a group of similar things
s. covering or applying simultaneously to a number of similar items or elements or groups"
utmost,n. the greatest possible degree
value,"n. a numerical quantity measured or assigned or computed
n. the quality (positive or negative) that renders something desirable or valuable
n. the amount (of money or goods or services) that is considered to be a fair equivalent for something else
n. relative darkness or lightness of a color"
valuable,"n. something of value
a. having great material or monetary value especially for use or exchange
s. having worth or merit or value"
variety,"n. (biology) a taxonomic category consisting of members of a species that differ from others of the same species in minor but heritable characteristics
n. a difference that is usually pleasant"
various,"s of many different kinds purposefully arranged but lacking any uniformity
s considered individually
s distinctly dissimilar or unlike
s having great diversity or variety"
vast,s unusually great in size or amount or degree or especially extent or scope
vain,"s characteristic of false pride; having an exaggerated sense of self-importance
s unproductive of success"
vanity,n. the quality of being valueless or futile
valid,"a. well grounded in logic or truth or having legal force
s. still legally acceptable"
invalid,"n. someone who is incapacitated by a chronic illness or injury
v. force to retire, remove from active duty, as of firemen
a. having no cogency or legal force
s. no longer valid"
vary,"v. be subject to change in accordance with a variable
v. make something more diverse and varied"
variation,"n. an instance of change; the rate or magnitude of change
n. an activity that varies from a norm or standard
n. a repetition of a musical theme in which it is modified or embellished
n. an artifact that deviates from a norm or standard"
venture,"n. any venturesome undertaking especially one with an uncertain outcome
n. a commercial undertaking that risks a loss but promises a profit
v. proceed somewhere despite the risk of possible dangers
v. put at risk"
version,"n. an interpretation of a matter from a particular viewpoint
n. something a little different from others of the same type
n. manual turning of a fetus in the uterus (usually to aid delivery)"
versus,"prep. Against; as, John Doe versus Richard Roe; -- chiefly
   used in legal language, and abbreviated to v. or vs."
via,"n. A road way.
prep. By the way of; as, to send a letter via Queenstown to
   London."
vice,n. a specific form of evildoing
vicious,"s (of persons or their actions) able or disposed to inflict pain or suffering
s having the nature of vice
s bringing or deserving severe rebuke or censure
s marked by deep ill will; deliberately harmful"
victim,"n. an unfortunate person who suffers from some adverse circumstance
n. a person who is tricked or swindled"
video,"n. the visible part of a television transmission
n. (computer science) the appearance of text and graphics on a video display"
view,"n. the visual percept of a region
n. the act of looking or seeing or observing
n. the range of the eye
n. purpose; the phrase `with a view to' means `with the intention of' or `for the purpose of'"
viewpoint,"n a mental position from which things are viewed
n a place from which something can be viewed"
vigorous,"s. characterized by forceful and energetic action or activity
s. strong and active physically or mentally"
violent,"a. acting with or marked by or resulting from great force or energy or emotional intensity
s. effected by force or injury rather than natural causes
s. (of colors or sounds) intensely vivid or loud"
violence,"n. an act of aggression (as one against a person who resists)
n. a turbulent state resulting in injuries and destruction etc."
virtual,"s. being actually such in almost every respect
s. existing in essence or effect though not in actual fact"
virtue,"n. the quality of doing what is right and avoiding what is wrong
n. morality with respect to sexual relations
n. a particular moral excellence"
vision,"n. a vivid mental image
n. the perceptual experience of seeing
n. a religious or mystical experience of a supernatural appearance"
vital,"s. performing an essential function in the living body
s. manifesting or characteristic of life"
vivid,s. having the clarity and freshness of immediate experience
vocabulary,"n. a listing of the words used in some enterprise
n. a language user's knowledge of words
n. the system of techniques or symbols serving as a means of expression (as in arts or crafts)"
vocation,"n the particular occupation for which you are trained
n a body of people doing the same kind of work"
void,"n. an empty area or space
v. clear (a room, house, place) of occupants or empty or clear (a place or receptacle) of something
s. containing nothing"
volunteer,"n. (military) a person who freely enlists for service
n. a person who performs voluntary work
v. tell voluntarily
v. agree freely"
voluntary,"n. composition (often improvised) for a solo instrument (especially solo organ) and not a regular part of a religious service or musical performance
a. of your own free will or design; done by choice; not forced or compelled
a. controlled by individual volition"
vacant,"s. void of thought or knowledge
s. without an occupant or incumbent"
vanish,"v. become invisible or unnoticeable
v. cease to exist
v. decrease rapidly and disappear"
vehicle,"n. a conveyance that transports people or objects
n. a medium for the expression or achievement of something
n. any substance that facilitates the use of a drug or pigment or other material that is mixed with it"
verge,"n. the limit beyond which something happens or changes
n. a grass border along a road
v. border on; come close to"
verify,"v. confirm the truth of
v. attach or append a legal verification to (a pleading or petition)"
versatile,"s. having great diversity or variety
s. changeable or inconstant
s. competent in many areas and able to turn with ease from one thing to another
s. able to move freely in all directions"
violate,"v. fail to agree with; be in violation of; as of rules or patterns
v. destroy"
voyage,"n. a journey to some distant place
v. travel on water propelled by wind or by other means"
vibrate,"v. shake, quiver, or throb; move back and forth rapidly, usually in an uncontrolled manner"
vicinity,n. a surrounding or nearby region
virgin,"n. a person who has never had sex
s. being used or worked for the first time"
vote,"n. a choice that is made by counting the number of people in favor of each alternative
n. the opinion of a group as determined by voting
n. a body of voters who have the same interests
n. the total number of voters who participated"
vulgar,"s lacking refinement or cultivation or taste
s of or associated with the great masses of people
s being or characteristic of or appropriate to everyday language
s conspicuously and tastelessly indecent"
vulnerable,"a. susceptible to attack
s. susceptible to criticism or persuasion or temptation
s. capable of being wounded or hurt"
vacuum,"n. the absence of matter
n. a region that is devoid of matter
n. an electrical home appliance that cleans by suction
v. clean with a vacuum cleaner"
van,"n. (Great Britain) a closed railroad car that carries baggage or freight
n. a camper equipped with living quarters
n. a truck with an enclosed cargo space"
vegetarian,n. eater of fruits and grains and nuts; someone who eats no meat or fish or (often) any animal products
vegetation,"n. all the plant life in a particular region or period
n. the process of growth in plants
n. an abnormal growth or excrescence (especially a warty excrescence on the valves of the heart)
n. inactivity that is passive and monotonous, comparable to the inactivity of plant life"
ventilate,"v. expose to the circulation of fresh air so as to retard spoilage
v. circulate through and freshen
v. furnish with an opening to allow air to circulate or gas to escape"
verbal,"s. communicated in the form of words
a. of or relating to or formed from words in general
a. of or relating to or formed from a verb
a. relating to or having facility in the use of words"
verdict,n. (law) the findings of a jury on issues of fact submitted to it for decision; can be used in formulating a judgment
vertical,"n. something that is oriented vertically
a. at right angles to the plane of the horizon or a base line
a. relating to or involving all stages of a business from production to distribution
s. of or relating to different levels in a hierarchy (as levels of social class or income group)"
vessel,"n. a tube in which a body fluid circulates
n. a craft designed for water transportation
n. an object used as a container (especially for liquids)"
veteran,"n. a serviceman who has seen considerable active service
n. a person who has served in the armed forces
n. an experienced person who has been through many battles; someone who has given long service"
vinegar,"n. sour-tasting liquid produced usually by oxidation of the alcohol in wine or cider and used as a condiment or food preservative
n. dilute acetic acid"
violet,"n. any of numerous low-growing violas with small flowers
n. a variable color that lies beyond blue in the spectrum"
violin,n. bowed stringed instrument that is the highest member of the violin family; this instrument has four strings and a hollow body and an unfretted fingerboard and is played with a bow
virus,"n. (virology) ultramicroscopic infectious agent that replicates itself only within cells of living hosts; many are pathogenic; a piece of nucleic acid (DNA or RNA) wrapped in a thin coat of protein
n. a harmful or corrupting agency
n. a software program capable of reproducing itself and usually capable of causing great harm to files or other programs on the same computer"
vocal,"a. relating to or designed for or using the singing voice
a. having or using the power to produce speech or sound
s. full of the sound of voices"
volcano,n. a mountain formed by volcanic material
volleyball,"n. a game in which two teams hit an inflated ball over a high net using their hands
n. an inflated ball used in playing volleyball"
vowel,"n. a speech sound made with the vocal tract open
n. a letter of the alphabet standing for a spoken vowel"
valve,"n. a structure in a hollow organ (like the heart) with a flap to insure one-way flow of fluid through it
n. device in a brass wind instrument for varying the length of the air column to alter the pitch of a tone
n. control consisting of a mechanical device for controlling the flow of a fluid
n. the entire one-piece shell of a snail and certain other molluscs"
vapour,"n a visible suspension in the air of particles of some substance
n the process of becoming a vapor"
vase,n. an open jar of glass or porcelain used as an ornament or to hold flowers
veil,"n. a membranous covering attached to the immature fruiting body of certain mushrooms
v. to obscure, or conceal with or as if with a veil"
vein,"n. a blood vessel that carries blood from the capillaries toward the heart
n. a distinctive style or manner
n. any of the vascular bundles or ribs that form the branching framework of conducting and supporting tissues in a leaf or other plant organ
n. a layer of ore between layers of rock"
velocity,n distance travelled per unit time
velvet,"n. a silky densely piled fabric with a plain back
s. smooth and soft to sight or hearing or touch or taste
s. resembling velvet in having a smooth soft surface"
verse,"n. a piece of poetry
n. a line of metrical text
v. compose verses or put into verse
v. familiarize through thorough study or experience"
veto,"n. a vote that blocks a decision
n. the power or right to prohibit or reject a proposed or intended act (especially the power of a chief executive to reject a bill passed by the legislature)
v. vote against; refuse to endorse; refuse to assent"
volume,"n. the amount of 3-dimensional space occupied by an object
n. a publication that is one of a set of several similar publications
n. a relative amount
n. the magnitude of sound (usually in a specified direction)"
viable,s. capable of life or normal growth and development
warn,"v. notify of danger, potential harm, or risk
v. admonish or counsel in terms of someone's behavior
v. ask to go away
v. notify, usually in advance"
wave,"n. one of a series of ridges that moves across the surface of a liquid (especially across a large body of water)
n. a movement like that of a sudden occurrence or increase in a specified phenomenon
n. (physics) a movement up and down or back and forth
n. something that rises rapidly"
wage,n. something that remunerates
waken,"v cause to become awake or conscious
v stop sleeping"
wallet,n. a pocket-size case for holding papers and paper money
wander,v. go via an indirect route or at no set pace
warmth,n. the quality of having a moderate degree of heat
waste,"n. any materials unused and rejected as worthless or unwanted
n. useless or profitless activity; using or expending or consuming thoughtlessly or carelessly
n. (law) reduction in the value of an estate caused by act or neglect
v. spend thoughtlessly; throw away"
weak,"a. wanting in physical strength
s. tending downward in price
s. deficient or lacking in some skill
s. (used of verbs) having standard (or regular) inflection"
wealth,"n. the state of being rich and affluent; having a plentiful supply of material goods and money
n. the quality of profuse abundance
n. an abundance of material possessions and resources
n. property that has economic utility: a monetary value or an exchange value"
wealthy,s having an abundant supply of money or possessions of value
wear,"n. impairment resulting from long use
n. the act of having on your person as a covering or adornment
v. be dressed in
v. have on one's person"
weigh,"v. have a certain weight
v. determine the weight of
v. to be oppressive or burdensome"
weight,"n. the vertical force exerted by a mass as a result of gravity
n. sports equipment used in calisthenic exercises and weightlifting; it is not attached to anything and is raised and lowered by use of the hands and arms
n. the relative importance granted to something
n. an artifact that is heavy"
weapon,"n. any instrument or instrumentality used in fighting or hunting
n. a means of persuading or arguing"
weary,"v exhaust or get tired through overuse or great strain or stress
v lose interest or become bored with something or somebody
s physically and mentally fatigued"
weave,"n. pattern of weaving or structure of a fabric
v. interlace by or as if by weaving
v. create a piece of cloth by interlacing strands of fabric, such as wool or cotton
v. to move or cause to move in a sinuous, spiral, or circular course"
web,"n. an intricate network suggesting something that was formed by weaving or interweaving
n. an intricate trap that entangles or ensnares its victim
n. a fabric (especially a fabric in the process of being woven)
n. membrane connecting the toes of some aquatic birds and mammals"
website,n a computer connected to the internet that maintains a series of web pages on the World Wide Web
webpage,n a document connected to the World Wide Web and viewable by anyone connected to the internet who has a web browser
weekday,n. any day except Sunday (and sometimes except Saturday)
weekly,"n. a periodical that is published every week (or 52 issues per year)
s. of or occurring every seven days"
weep,"v shed tears because of sadness, rage, or pain"
weird,"s. strikingly odd or unusual; some weird effect of shadow""- Bram Stoker"
welfare,"n governmental provision of economic assistance to persons in need
n something that aids or promotes well-being
n a contented state of being happy and healthy and prosperous"
whale,"n. any of the larger cetacean mammals having a streamlined body and breathing through a blowhole on the head
v. hunt for whales"
wheat,"n. annual or biennial grass having erect flower spikes and light brown grains
n. grains of common wheat; sometimes cooked whole or cracked as cereal; usually ground into flour"
wheel,"n. a simple machine consisting of a circular frame with spokes (or a solid disc) that can rotate on a shaft or axle (as in vehicles or other machines)
n. forces that provide energy and direction
n. a circular helm to control the rudder of a vessel
v. change directions as if revolving on a pivot"
whisper,"n. speaking softly without vibration of the vocal cords
v. speak softly; in a low voice"
whatsoever,s one or some or every or all without specification
whereas,"adv. At which place; where.
conj. Considering that; it being the case that; since; --
   used to introduce a preamble which is the basis of declarations,
   affirmations, commands, requests, or like, that follow.
conj. When in fact; while on the contrary; the case being in
   truth that; although; -- implying opposition to something that
   precedes; or implying recognition of facts, sometimes followed by a
   different statement, and sometimes by inferences or something
   consequent."
whip,"n. an instrument with a handle and a flexible lash that is used for whipping
n. a legislator appointed by the party to enforce discipline
n. a dessert made of sugar and stiffly beaten egg whites or cream and usually flavored with fruit
n. (golf) the flexibility of the shaft of a golf club"
whirl,"n. confused movement
n. the shape of something rotating rapidly
v. cause to spin
v. fly around"
whistle,"n. the sound made by something moving rapidly or by steam coming out of a small aperture
n. the act of signalling (e.g., summoning) by whistling or blowing a whistle
n. a small wind instrument that produces a whistling sound by blowing into it
n. acoustic device that forces air or steam against an edge or into a cavity and so produces a loud shrill sound"
wholly,r. to a complete degree or to the full or entire extent (`whole' is often used informally for `wholly')
wicked,a. morally bad in principle or practice
widespread,s. widely circulated or diffused
width,n. the extent of something from side to side
wink,"n. closing one eye quickly as a signal
v. signal by winking
v. force to go away by blinking"
wisdom,"n. accumulated knowledge or erudition or enlightenment
n. the trait of utilizing knowledge and experience with common sense and insight
n. ability to apply knowledge or experience or understanding or common sense and insight
n. the quality of being prudent and sensible"
wit,n. a message whose ingenuity or verbal skill or incongruity has the power to evoke laughter
withdraw,"v. pull back or move away or backward
v. remove (a commodity) from (a supply source)"
withhold,"v. hold back; refuse to hand over or share
v. retain and refrain from disbursing; of payments"
withstand,"v resist or confront with resistance
v stand up or offer resistance to somebody or something"
witness,"n. someone who sees an event and reports what happened
n. testimony by word or deed to your religious faith
n. (law) a person who attests to the genuineness of a document or signature by adding their own signature
n. (law) a person who testifies under oath in a court of law"
wind,"n. air moving (sometimes with considerable force) from an area of high pressure to an area of low pressure
n. a tendency or force that influences events
n. breath
n. empty rhetoric or insincere or exaggerated talk"
wipe,v. rub with a circular motion
wonder,"n. the feeling aroused by something strange and surprising
n. something that causes feelings of wonder
v. have a wish or desire to know something
v. place in doubt or express doubtful speculation"
worth,"n. an indefinite quantity of something having a specified value
n. the quality that renders something desirable or valuable or useful
n. French couturier (born in England) regarded as the founder of Parisian haute couture; noted for introducing the bustle (1825-1895)
s. having a specified value"
wound,"n. an injury to living tissue (especially an injury involving a cut or break in the skin)
n. a casualty to military personnel resulting from combat
n. a figurative injury (to your feelings or pride)
n. the act of inflicting a wound"
worldwide,s. spanning or extending throughout the entire world
worship,"n. the activity of worshipping
n. a feeling of profound love and admiration
v. show devotion to (a deity)
v. attend religious services"
wrap,"n. cloak that is folded or wrapped around a person
n. a sandwich in which the filling is rolled up in a soft tortilla
v. arrange or fold as a cover or protection
v. crash into so as to coil around"
ward,"n. a person who is under the protection or in the custody of another
n. a district into which a city or town is divided for the purpose of administration and elections
n. block forming a division of a hospital (or a suite of rooms) shared by patients who need a similar kind of care
n. English economist and conservationist (1914-1981)"
warfare,"n the waging of armed conflict against an enemy
n an active struggle between competing entities"
warrant,"n. a writ from a court commanding police to perform specified acts
n. a type of security issued by a corporation (usually together with a bond or preferred stock) that gives the holder the right to purchase a certain amount of common stock at a stated price"
warranty,n a written assurance that some product or service will be provided or will meet certain specifications
waterfall,n. a steep descent of the water of a river
waterproof,"n. any fabric impervious to water
v. make watertight"
weed,"n. any plant that crowds out cultivated plants
n. a black band worn by a man (on the arm or hat) as a sign of mourning
v. clear of weeds"
weld,"n. United States abolitionist (1803-1895)
n. a metal joint formed by softening with heat and fusing or hammering together
v. join together by heating
v. unite closely or intimately"
wholesome,"a. conducive to or characteristic of physical or moral well-being
s. sound or exhibiting soundness in body or mind"
wholesomely,r in a wholesome manner
workshop,"n. small workplace where handcrafts or manufacturing are done
n. a brief intensive course for a small group; emphasizes problem solving"
wreath,n. flower arrangement consisting of a circular band of foliage or flowers for ornamental purposes
wreck,"n. something or someone that has suffered ruin or dilapidation
n. a ship that has been destroyed at sea"
wrench,"n. a sharp strain on muscles or ligaments
n. a hand tool that is used to hold or twist a nut or bolt
v. twist or pull violently or suddenly, especially so as to remove (something) from that to which it is attached or from where it originates
v. make a sudden twisting motion"
wretched,"s of very poor quality or condition
s characterized by physical misery
s very unhappy; full of misery
s morally reprehensible
s deserving or inciting pity"
