prescription,"n. directions prescribed beforehand; the action of prescribing authoritative rules or directions
n. written instructions for an optician on the lenses for a given person
n. written instructions from a physician or dentist to a druggist concerning the form and dosage of a drug to be issued to a given patient
a. available only with a doctor's written prescription"
prestige,n. a high standing achieved through success or influence or wealth etc.
prestigious,s. exerting influence by reason of high status or prestige
presume,"v. constitute reasonable evidence for
v. take liberties or act with too much confidence"
presumably,r. by reasonable assumption
pretext,n. something serving to conceal plans; a fictitious reason that is concocted in order to conceal the real reason
prevail,"v. be valid, applicable, or true
v. continue to exist
v. prove superior
v. use persuasion successfully"
prevalent,s most frequent or common
prey,"n. a person who is the aim of an attack (especially a victim of ridicule or exploitation) by some hostile person or influence
n. animal hunted or caught for food
v. profit from in an exploitatory manner"
probe,"n. an inquiry into unfamiliar or questionable activities
n. a flexible slender surgical instrument with a blunt end that is used to explore wounds or body cavities
n. an exploratory action or expedition
n. an investigation conducted using a flexible surgical instrument to explore an injury or a body cavity"
proceed,"v. move ahead; travel onward in time or space
v. follow a certain course"
procedure,"n. a particular course of action intended to achieve a result
n. a mode of conducting legal and parliamentary proceedings"
proclaim,"v. declare formally; declare someone to be something; of titles
v. state or announce"
proficiency,"n. the quality of having great facility and competence
n. skillfulness in the command of fundamentals deriving from practice and familiarity"
profile,"n. an analysis (often in graphical form) representing the extent to which something exhibits various characteristics
n. an outline of something (especially a human face as seen from one side)
n. biographical sketch
n. a vertical section of the Earth's crust showing the different horizons or layers"
prominent,"s having a quality that thrusts itself into attention
s conspicuous in position or importance"
promising,s. showing possibility of achievement or excellence
propaganda,n. information that is spread for the purpose of promoting some cause
propel,v. cause to move forward with force
property,"n. something owned; any tangible or intangible possession that is owned by someone; 
n. a basic or essential attribute shared by all members of a class
n. a construct whereby objects or individuals can be distinguished
n. any movable articles or objects used on the set of a play or movie"
prophet,"n. an authoritative person who divines the future
n. someone who speaks by divine inspiration; someone who is an interpreter of the will of God"
proportion,"n. the quotient obtained when the magnitude of a part is divided by the magnitude of the whole
n. magnitude or extent
n. the relation between things (or parts of things) with respect to their comparative quantity, magnitude, or degree
n. harmonious arrangement or relation of parts or elements within a whole (as in a design)"
prosecute,"v. conduct a prosecution in a court of law
v. bring a criminal action against (in a trial)
v. carry out or participate in an activity; be involved in"
protein,n. any of a large group of nitrogenous organic compounds that are essential constituents of living cells; consist of polymers of amino acids; essential in the diet of animals for growth and for repair of tissues; can be obtained from meat and eggs and milk and legumes
protest,"n. a formal and solemn declaration of objection
n. the act of protesting; a public (often organized) manifestation of dissent
n. the act of making a strong public expression of disagreement and disapproval
v. utter words of protest"
province,n. the proper sphere or extent of your activities
provoke,"v. evoke or provoke to appear or occur
v. provide the needed stimulus for"
prudent,a. careful and sensible; marked by sound judgment
publish,"v. prepare and issue for public distribution or sale
v. have (one's written work) issued for publication"
publication,"n. a copy of a printed work offered for distribution
n. the communication of something to the public; making information generally known
n. the business of issuing printed matter for sale or distribution"
publicity,n. the quality of being open to public view
pulse,"n. the rhythmic contraction and expansion of the arteries with each beat of the heart
n. the rate at which the heart beats; usually measured to obtain a quick evaluation of a person's health
n. edible seeds of various pod-bearing plants (peas or beans or lentils etc.)
v. produce or modulate (as electromagnetic waves) in the form of short bursts or pulses or cause an apparatus to produce pulses"
punctual,a. acting or arriving or performed exactly at the time appointed
palace,"n. a large and stately mansion
n. the governing group of a kingdom
n. a large ornate exhibition hall
n. official residence of an exalted person (as a sovereign)"
pad,"n. a number of sheets of paper fastened together along one edge
n. the large floating leaf of an aquatic plant (as the water lily)
n. a block of absorbent material saturated with ink; used to transfer ink evenly to a rubber stamp
n. a flat mass of soft material used for protection, stuffing, or comfort"
paddle,"n. small wooden bat with a flat surface; used for hitting balls in various games
n. a blade of a paddle wheel or water wheel
n. an instrument of punishment consisting of a flat board
n. a short light oar used without an oarlock to propel a canoe or small boat"
pail,n. the quantity contained in a pail
pamphlet,"n a small book usually having a paper cover
n a brief treatise on a subject of interest; published in the form of a booklet"
panorama,n. a picture (or series of pictures) representing a continuous scene
panda,"n large black-and-white herbivorous mammal of bamboo forests of China and Tibet; in some classifications considered a member of the bear family or of a separate family Ailuropodidae
n reddish-brown Old World raccoon-like carnivore; in some classifications considered unrelated to the giant pandas"
pants,"n underpants worn by women
n the noise made by a short puff of steam (as from an engine)
n (usually in the plural) a garment extending from the waist to the knee or ankle, covering each leg separately
n a short labored intake of breath with the mouth open
v breathe noisily, as when one is exhausted
v utter while panting, as if out of breath"
paw,"n. a clawed foot of an animal especially a quadruped
v. scrape with the paws
v. touch clumsily"
parachute,n. rescue equipment consisting of a device that fills with air and retards your fall
parade,"n. a ceremonial procession including people marching
n. an extended (often showy) succession of persons or things
n. a visible display
v. walk ostentatiously"
paradigm,"n. systematic arrangement of all the inflected forms of a word
n. the generally accepted perspective of a particular discipline at a given time"
parameter,"n. a constant in the equation of a curve that can be varied to yield a family of similar curves
n. any factor that defines a system and determines (or limits) its performance
n. a quantity (such as the mean or variance) that characterizes a statistical population and that can be estimated by calculations from sample data"
parasite,n. an animal or plant that lives in or on a host (another animal or plant); it obtains nourishment from the host without benefiting or killing the host
particle,"n. a body having finite mass and internal structure but negligible dimensions
n. a function word that can be used in English to form phrasal verbs"
pasture,n. a field covered with grass or herbage and suitable for grazing by livestock
pat,"n. the sound made by a gentle blow
s. exactly suited to the occasion
r. completely or perfectly"
pathetic,"s. inspiring mixed contempt and pity
s. inspiring scornful pity"
patrol,"n. a detachment used for security or reconnaissance
n. the activity of going around or through an area at regular intervals for security purposes
n. a group that goes through a region at regular intervals for the purpose of security
v. maintain the security of by carrying out a patrol"
patron,"n. a regular customer
n. the proprietor of an inn
n. someone who supports or champions something"
penny,"n. a fractional monetary unit of Ireland and the United Kingdom; equal to one hundredth of a pound
n. a coin worth one-hundredth of the value of the basic unit"
pea,"n. seed of a pea plant used for food
n. the fruit or seed of a pea plant
n. a leguminous plant of the genus Pisum with small white flowers and long green pods containing edible green seeds"
peach,"n. cultivated in temperate regions
n. downy juicy fruit with sweet yellowish or whitish flesh"
peanut,"n. underground pod of the peanut vine
n. widely cultivated American plant cultivated in tropical and warm regions; showy yellow flowers on stalks that bend over to the soil so that seed pods ripen underground
n. a young child who is small for his age
n. pod of the peanut vine containing usually 2 nuts or seeds; `groundnut' and `monkey nut' are British terms"
pearl,"n. a smooth lustrous round structure inside the shell of a clam or oyster; much valued as a jewel
v. gather pearls, from oysters in the ocean"
pebble,n. a small smooth rounded rock
pedal,"n. a lever that is operated with the foot
v. operate the pedals on a keyboard instrument
a. of or relating to the feet"
peninsula,n. a large mass of land projecting into a body of water
pepper,"n. climber having dark red berries (peppercorns) when fully ripe; southern India and Sri Lanka; naturalized in northern Burma and Assam
n. pungent seasoning from the berry of the common pepper plant of East India; use whole or ground
n. sweet and hot varieties of fruits of plants of the genus Capsicum
v. add pepper to"
perfume,"n. a toiletry that emits and diffuses a fragrant odor
v. fill or impregnate with an odor
v. apply perfume to"
perish,v pass from physical life and lose all bodily attributes and functions necessary to sustain life
permeate,v. spread or diffuse through
petition,v. write a petition for something to somebody; request formally and in writing
petrol,n a volatile flammable mixture of hydrocarbons (hexane and heptane and octane etc.) derived from petroleum; used mainly as a fuel in internal-combustion engines
petroleum,n. a dark oil consisting mainly of hydrocarbons
pest,"n. a persistently annoying person
n. any unwanted and destructive insect or other animal that attacks food or crops or livestock etc."
petty,s. contemptibly narrow in outlook
pharmacy,"n. the art and science of preparing and dispensing drugs and medicines,"
pilot,"n. someone who is licensed to operate an aircraft in flight
n. a person qualified to guide ships through difficult waters going into or out of a harbor"
pin,"n. a piece of jewelry that is pinned onto the wearer's garment
n. informal terms for the leg
n. cylindrical tumblers consisting of two parts that are held in place by springs; when they are aligned with a key the bolt can be thrown
n. flagpole used to mark the position of the hole on a golf green"
pipe,"n. a tube with a small bowl at one end; used for smoking tobacco
n. a long tube made of metal or plastic that is used to carry water or oil or gas etc.
n. a hollow cylindrical shape
n. a tubular wind instrument"
pigeon,n. wild and domesticated birds having a heavy body and short legs
pilgrim,"n. someone who journeys in foreign lands
n. one of the colonists from England who sailed to America on the Mayflower and founded the colony of Plymouth in New England in 1620
n. someone who journeys to a sacred place as an act of religious devotion"
pillar,"n. a fundamental principle or practice
n. a prominent supporter"
pillow,"n. a cushion to support the head of a sleeping person
v. rest on or as if on a pillow"
pinch,"n. a painful or straitened circumstance
n. an injury resulting from getting some body part squeezed
n. a squeeze with the fingers
v. squeeze tightly between the fingers"
pine,"n. a coniferous tree
n. straight-grained durable and often resinous white to yellowish timber of any of numerous trees of the genus Pinus"
pint,"n. a British imperial capacity measure (liquid or dry) equal to 4 gills or 568.26 cubic centimeters
n. a United States dry unit equal to 0.5 quart or 33.6 cubic inches
n. a United States liquid unit equal to 16 fluid ounces; two pints equal one quart"
pirate,"n. someone who robs at sea or plunders the land from the sea without having a commission from any sovereign nation
n. a ship that is manned by pirates
v. copy illegally; of published material"
pistol,n. a firearm that is held and fired with one hand
piston,"n. United States neoclassical composer (1894-1976)
n. mechanical device that has a plunging or thrusting motion"
planet,"n. (astronomy) any of the nine large celestial bodies in the solar system that revolve around the sun and shine by reflected light; Mercury, Venus, Earth, Mars, Jupiter, Saturn, Uranus, Neptune, and Pluto in order of their proximity to the sun; viewed from the constellation Hercules, all the planets rotate around the sun in a counterclockwise direction
n. any celestial body (other than comets or satellites) that revolves around a star"
plaster,"n. a mixture of lime or gypsum with sand and water; hardens into a smooth solid; used to cover walls and ceilings
n. a surface of hardened plaster (as on a wall or ceiling)
n. adhesive tape used in dressing wounds
v. apply a heavy coat to"
plateau,n a relatively flat highland
plough,"n a group of seven bright stars in the constellation Ursa Major
n a farm tool having one or more heavy blades to break the soil and cut a furrow prior to sowing
v move in a way resembling that of a plow cutting into or going through the soil
v to break and turn over earth especially with a plow"
plug,"n. blockage consisting of an object designed to fill a hole tightly
n. an electrical device with two or three pins that is inserted in a socket to make an electrical connection
v. fill or close tightly with or as if with a plug
v. persist in working hard"
plumber,n. a craftsman who installs and repairs pipes and fixtures and appliances
pitch,"n. the property of sound that varies with variation in the frequency of vibration
n. (baseball) the act of throwing a baseball by a pitcher to a batter
n. a vendor's position (especially on the sidewalk)
n. degree of deviation from a horizontal plane"
plight,n. a solemn pledge of fidelity
pneumonia,n. respiratory disease characterized by inflammation of the lung parenchyma (excluding the bronchi) with congestion caused by viruses or bacteria or irritants
postcard,n. a card for sending messages by post without an envelope
poke,"n. tall coarse perennial American herb having small white flowers followed by blackish-red berries on long drooping racemes; young fleshy stems are edible; berries and root are poisonous
v. stir by poking
v. make a hole by poking"
pond,n. a small lake
pope,"n. the head of the Roman Catholic Church
n. English poet and satirist (1688-1744)"
porch,n. a structure attached to the exterior of a building often forming a covered entrance
poultry,n. flesh of chickens or turkeys or ducks or geese raised for food
powder,"n. a solid substance in the form of tiny loose particles; a solid that has been pulverized
n. any of various cosmetic or medical preparations dispensed in the form of a pulverized powder
v. apply powder to"
preach,"v. deliver a sermon
v. speak, plead, or argue in favor of"
preface,"n a short introductory essay preceding the text of a book
v furnish with a preface or introduction"
pregnant,a. carrying developing offspring within the body or being about to produce new life
premier,"v. be performed for the first time
v. perform a work for the first time
s. first in rank or degree
s. preceding all others in time"
prick,"n. the act of puncturing with a small point
v. cause a stinging pain
v. to cause a sharp emotional pain"
priest,"n. a clergyman in Christian churches who has the authority to perform or administer various religious rites; one of the Holy Orders
n. a person who performs religious duties and ceremonies in a non-Christian religion"
prince,n. a male member of a royal family other than the sovereign (especially the son of a sovereign)
princess,n. a female member of a royal family other than the queen (especially the daughter of a sovereign)
prose,"n. ordinary writing as distinguished from verse
n. matter of fact, commonplace, or dull expression"
prototype,n. a standard or typical example
psychiatry,n. the branch of medicine dealing with the diagnosis and treatment of mental disorders
psychology,n. the science of mental life
pub,n tavern consisting of a building with a bar and public rooms; often provides light meals
pump,"n. a mechanical device that moves fluid or gas by pressure or suction
n. a low-cut shoe without fastenings
v. operate like a pump; move up and down, like a handle or a pedal
v. deliver forth"
punch,"n. (boxing) a blow with the fist
n. an iced mixed drink usually containing alcohol and prepared for multiple servings; normally served in a punch bowl
n. a tool for making holes or indentations
v. deliver a quick blow to"
puppet,"n. a small figure of a person operated from above with strings by a puppeteer
n. a doll with a hollow head of a person or animal and a cloth body; intended to fit over the hand and be manipulated with the fingers"
purple,"n. a purple color or pigment
n. of imperial status
v. become purple
v. color purple"
purse,"n. a sum of money spoken of as the contents of a money purse
n. a small bag for carrying money
n. a sum of money offered as a prize
v. contract one's lips into a rounded shape"
puff,"n. a short light gust of air
n. a light inflated pastry or puff shell
n. exaggerated praise (as for promotional purposes)
n. a slow inhalation (as of tobacco smoke)"
pyramid,"n. a polyhedron having a polygonal base and triangular sides with a common vertex
n. (stock market) a series of transactions in which the speculator increases his holdings by using the rising market value of those holdings as margin for further purchases
n. a massive monument with a square base and four triangular sides; begun by Cheops around 2700 BC as royal tombs in ancient Egypt
v. enlarge one's holdings on an exchange on a continued rise by using paper profits as margin to buy additional amounts"
quality,"n. an essential and distinguishing attribute of something or someone
n. a degree or grade of excellence or worth
n. a characteristic property that defines the apparent individual nature of something
n. high social status"
qualitative,"a. involving distinctions based on qualities
a. relating to or involving comparisons based on qualities"
qualification,"n. an attribute that must be met or complied with and that fits a person for something
n. the act of modifying or changing the strength of some idea"
quantity,"n. an adequate or large amount
n. the concept that something has a magnitude and can be represented in mathematical expressions by a constant or a variable"
quantify,"v. use as a quantifier
v. express as a number or measure or quantity"
quantitative,"a. expressible as a quantity or relating to or susceptible of measurement
a. relating to the measurement of quantity
a. (of verse) having a metric system based on relative duration of syllables"
question,"n. an instance of questioning
n. the subject matter at issue
n. a sentence of inquiry that asks for a reply
n. an informal reference to a marriage proposal"
quiet,"a. characterized by an absence or near absence of agitation or activity
a. free of noise or uproar; or making little if any sound
s. not showy or obtrusive
a. of the sun characterized by a low level of surface phenomena like sunspots e.g."
quarterly,"n. a periodical that is published every quarter (or four issues per year)
a. of or relating to or consisting of a quarter
r. in diagonally opposed quarters of an escutcheon
r. in three month intervals"
quit,"v put an end to a state or an activity
v give up or retire from a position
v go away or leave
v turn away from; give up
v give up in the face of defeat of lacking hope; admit defeat"
quiz,"n. an examination consisting of a few short questions
v. examine someone's knowledge of something"
quota,"n. a prescribed number
n. a proportional share assigned to each participant
n. a limitation on imports"
quote,"v. repeat a passage from
v. name the price of
v. refer to for illustration or proof
v. put quote marks around"
queer,"v. put in a dangerous, disadvantageous, or difficult position"
quench,"v. satisfy (thirst)
v. electronics: suppress (sparking) when the current is cut off in an inductive circuit, or suppress (an oscillation or discharge) in a component or device
v. reduce the degree of (luminescence or phosphorescence) in (excited molecules or a material) by adding a suitable substance"
quest,"n. the act of searching for something
v. make a search (for)
v. search the trail of (game)
v. seek alms, as for religious purposes"
questionnaire,n. a form containing a set of questions; submitted to people to gain statistical information
queue,"n. a line of people or vehicles waiting for something
n. (information processing) an ordered list of tasks to be performed or messages to be transmitted
n. a braid of hair at the back of the head"
quilt,"n. bedding made of two layers of cloth filled with stuffing and stitched together
v. stitch or sew together
v. create by stitching together"
quiver,"n. case for holding arrows
v. shake with fast, tremulous movements"
raise,"n. the amount a salary is increased
n. increasing the size of a bet (as in poker)
v. raise the level or amount of something
v. raise from a lower to a higher position"
rapid,"n. a part of a river where the current is very fast
s. done or occurring in a brief period of time
s. characterized by speed; moving with or capable of moving with high speed"
race,"n. any competition
n. a contest of speed
n. people who are believed to belong to the same genetic stock
v. compete in a race"
racial,"a. of or related to genetically distinguished groups of people
a. of or characteristic of race or races or arising from differences among groups"
radical,"n. a person who has radical ideas or opinions
n. (mathematics) a quantity expressed as the root of another quantity
n. a character conveying the lexical meaning of a logogram
s. arising from or going to the root or source"
radioactive,a. exhibiting or caused by radioactivity
rail,"n. short for railway
n. a horizontal bar (usually of wood or metal)
n. any of numerous widely distributed small wading birds of the family Rallidae having short wings and very long toes for running on soft mud
v. complain bitterly"
railroad,"v. supply with railroad lines
v. transport by railroad"
range,"n. the limits within which something can be effective
n. a large tract of grassy open land on which livestock can graze
n. a series of hills or mountains
n. a place for shooting (firing or driving) projectiles of various kinds"
rank,"n. a row or line of people (especially soldiers or police) standing abreast of one another
n. relative status
v. take or have a position relative to others
v. take precedence or surpass others in rank"
rare,"s. not widely known; especially valued for its uncommonness
s. recurring only at long intervals
s. not widely distributed
s. having low density"
rarely,r. not often
rate,"n. a magnitude or frequency relative to a time unit
n. amount of a charge or payment relative to some basis
n. a quantity or amount or measure considered as a proportion of another quantity or amount or measure
v. assign a rank or rating to"
rational,"a. consistent with or based on or using reason
a. capable of being expressed as a quotient of integers
s. having its source in or being guided by the intellect (as distinguished from experience or emotion)"
realize,"v. make real or concrete; give reality or substance to
v. convert into cash; of goods and property
v. expand or complete (a part in a piece of baroque music) by supplying the harmonies indicated in the figured bass"
recent,s. new
regard,"n. (usually plural) a polite expression of desire for someone's welfare
n. a feeling of friendship and esteem
v. look at attentively"
relation,"n. an abstraction belonging to or characteristic of two entities or parts together
n. an act of narration
n. (usually plural) mutual dealings or connections among persons or groups"
remain,"v. be left; of persons, questions, problems, results, evidence, etc."
remind,v. put in the mind of someone
reply,n. the speech act of continuing a conversational exchange
republic,n. a form of government whose head of state is not a monarch
request,"n. a formal message requesting something that is submitted to an authority
n. the verbal act of requesting
v. express the need or desire for; ask for
v. ask (a person) to do something"
require,"v require as useful, just, or proper
v consider obligatory; request and expect
v make someone do something
v have need of"
respect,"n. (usually preceded by `in') a detail or point
n. an attitude of admiration or esteem
v. regard highly; think much of
v. show respect towards"
react,"v. show a response or a reaction to something
v. act against or in opposition to
v. undergo a chemical reaction; react with another substance under certain conditions"
