fare,"n. the sum charged for riding in a public conveyance
n. a paying (taxi) passenger
n. the food and drink that are regularly served or consumed
v. eat well"
farewell,"n. an acknowledgment or expression of goodwill at parting
n. the act of departing politely"
fascinate,"v. to render motionless, as with a fixed stare or by arousing terror or awe"
fashion,"n. characteristic or habitual practice
n. the latest and most admired style in clothes and cosmetics and behavior
n. consumer goods (especially clothing) in the current mode
v. make out of components (often in an improvising manner)"
fashionable,"a. being or in accordance with current social fashions
s. patronized by"
fault,"n. (geology) a crack in the earth's crust resulting from the displacement of one side with respect to the other
n. (electronics) equipment failure attributable to some defect in a circuit (loose connection or insulation failure or short circuit etc.)
n. responsibility for a bad situation or event
n. (sports) a serve that is illegal (e.g., that lands outside the prescribed area)"
faulty,"s. characterized by errors; not agreeing with a model or not following established rules; the wrong side of the road"""
favor,"n. an act of gracious kindness
n. an advantage to the benefit of someone or something
n. an inclination to approve"
feature,"n. a prominent attribute or aspect of something
n. the characteristic parts of a person's face: eyes and nose and mouth and chin
n. the principal (full-length) film in a program at a movie theater
n. a special or prominent article in a newspaper or magazine"
federal,"n. a member of the Union Army during the American Civil War
n. any federal law-enforcement officer
s. national; especially in reference to the government of the United States as distinct from that of its member units
a. of or relating to the central government of a federation"
federation,"n. an organization formed by merging several groups or parties
n. the act of constituting a political unity out of a number of separate states or colonies or provinces so that each member retains the management of its internal affairs"
fee,"n. a fixed charge for a privilege or for professional services
n. an interest in land capable of being inherited"
feedback,"n. the process in which part of the output of a system is returned to its input in order to regulate its further output
n. response to an inquiry or experiment"
fellowship,n. money granted (by a university or foundation or other agency) for advanced study or research
female,"n. an animal that produces gametes (ova) that can be fertilized by male gametes (spermatozoa)
n. a person who belongs to the sex that can have babies
a. being the sex (of plant or animal) that produces fertilizable gametes (ova) from which offspring develop
s. characteristic of or peculiar to a woman"
feminine,"n. a gender that refers chiefly (but not exclusively) to females or to objects classified as female
a. associated with women and not with men
a. of grammatical gender
s. (music or poetry) ending on an unaccented beat or syllable"
festival,"n. a day or period of time set aside for feasting and celebration
n. an organized series of acts and performances (usually in one place)"
fire,"n. the event of something burning (often destructive)
n. the act of firing weapons or artillery at an enemy
n. the process of combustion of inflammable materials producing heat and light and (often) smoke
n. a fireplace in which a relatively small fire is burning"
fireman,"n. play in which children pretend to put out a fire
n. a member of a fire department who tries to extinguish fires"
fireplace,n. an open recess in a wall at the base of a chimney where a fire can be built
firm,"n. the members of a business organization that owns or operates one or more establishments
s. marked by firm determination or resolution; not shakable
s. not soft or yielding to pressure
s. strong and sure"
fiber,"n. a slender and greatly elongated substance capable of being spun into yarn
n. any of several elongated, threadlike cells (especially a muscle fiber or a nerve fiber)
n. a leatherlike material made by compressing layers of paper or cloth"
fiction,n. a literary work based on the imagination and not necessarily on fact
fierce,s. marked by extreme intensity of emotions or convictions; inclined to react violently; fervid
figure,"n. a diagram or picture illustrating textual material
n. a model of a bodily form (especially of a person)
n. a combination of points and lines and planes that form a visible palpable shape
n. an amount of money expressed numerically"
file,"n. a set of related records (either written or electronic) kept together
n. a line of persons or things ranged one behind the other
n. office furniture consisting of a container for keeping papers in order
n. a steel hand tool with small sharp teeth on some or all of its surfaces; used for smoothing wood or metal"
finance,"n. the commercial activity of providing funds and capital
n. the branch of economics that studies the management of money and other assets
n. the management of money and credit and banking and investments
v. obtain or provide money for"
financial,a involving financial matters
fitting,"n. a small and often standardized accessory to a larger system
n. putting clothes on to see whether they fit
s. in harmony with the spirit of particular persons or occasion
s. being precisely fitting and right"
flaw,"n. defect or weakness in a person's character
n. an imperfection in a plan or theory or legal document that causes it to fail or that reduces its effectiveness
v. add a flaw or blemish to; make imperfect or defective"
flexible,"a. capable of being changed
a. able to flex; able to bend easily
s. bending and snapping back readily without breaking"
flight,"n. a formation of aircraft in flight
n. an instance of traveling by air
n. a stairway (set of steps) between one floor or landing and the next
n. an air force unit smaller than a squadron"
flavor,n. (physics) the six kinds of quarks
float,"n. the time interval between the deposit of a check in a bank and its payment
n. the number of shares outstanding and available for trading by the public
n. an elaborate display mounted on a platform carried by a truck (or pulled by a truck) in a procession or parade
n. a hand tool with a flat face used for smoothing and finishing the surface of plaster or cement or stucco"
fresh,"a. recently made, produced, or harvested
s. (of a cycle) beginning or occurring again
s. original and of a kind not seen before
a. not canned or otherwise preserved"
frighten,"v. cause fear in
v. drive out by frightening"
flu,n an acute febrile highly contagious viral disease
focus,"n. the concentration of attention or energy on something
n. maximum clarity or distinctness of an image rendered by an optical system
n. maximum clarity or distinctness of an idea
n. a central point or locus of an infection in an organism"
folk,n. people in general (often used in the plural)
forbid,v. command against
forecast,v. predict in advance
forehead,"n the part of the face above the eyes
n the large cranial bone forming the front part of the cranium: includes the upper part of the orbits"
foremost,"s. preceding all others in spatial position
s. situated closest to the bow
r. prominently forward"
foresee,"v realize beforehand
v picture to oneself; imagine possible
v act in advance of; deal with ahead of time"
formal,"a. being in accord with established forms and conventions and requirements (as e.g. of formal dress)
s. characteristic of or befitting a person in authority
a. (of spoken and written language) adhering to traditional standards of correctness and without casual, contracted, and colloquial forms
s. logically deductive"
forth,"n. a river in southern Scotland that flows eastward to the Firth of Forth
r. forward in time or order or degree
r. out into view"
forthcoming,s. available when required or as promised
fortunate,"a. having unexpected good fortune
s. supremely favored
s. presaging good fortune"
forum,"n. a public meeting or assembly for open discussion
n. a public facility to meet for open discussion"
foster,"n. United States songwriter whose songs embody the sentiment of the South before the American Civil War (1826-1864)
v. promote the growth of
v. bring up under fosterage; of children
v. help develop, help grow"
found,"n. food and lodging provided in addition to money
a. come upon unexpectedly or after searching"
foundation,"n. the basis on which something is grounded
n. an institution supported by an endowment
n. lowest support of a structure
n. education or instruction in the fundamentals of a field of knowledge"
frequency,"n. the number of occurrences within a given time period
n. the ratio of the number of observations in a statistical category to the total number of observations
n. the number of observations in a given statistical category"
frequent,"v. be a regular or frequent visitor to a certain place
a. coming at short intervals or habitually
s. frequently encountered;"
friction,"n. the resistance encountered when one body is moved in contact with another
n. effort expended in moving one object over another with pressure"
fruitful,a. productive or conducive to producing in abundance
frustrate,"v hinder or prevent (the efforts, plans, or desires) of
v treat cruelly"
fulfill,"v put in effect
v meet the requirements or expectations of
v fill or meet a want or need"
function,"n. (mathematics) a mathematical relation such that each element of a given set (the domain of the function) is associated with an element of another set (the range of the function)
n. what something is used for
n. the actions and activities assigned to or required or expected of a person or group
n. a relation such that one thing is dependent on another"
fund,"n. a reserve of money set aside for some purpose
v. convert (short-term floating debt) into long-term debt that bears fixed interest and is represented by bonds
v. place or store up in a fund for accumulation
v. provide a fund for the redemption of principal or payment of interest"
fundamental,"n. any factor that could be considered important to the understanding of a particular business
n. the lowest tone of a harmonic series
s. being or involving basic facts or principles
s. far-reaching and thoroughgoing in effect especially on the nature of something"
fur,"n. the dressed hairy coat of a mammal
n. dense coat of fine silky hairs on mammals (e.g., cat or seal or weasel)
n. a garment made of the dressed hairy coat of a mammal"
furious,"s marked by extreme and violent energy
s marked by extreme anger
s (of the elements) as if showing violent anger"
furnish,v. provide or equip with furniture
fabricate,v. make up something artificial or untrue
fabulous,"s. extremely pleasing
s. based on or told of in traditional stories; lacking factual basis or historical validity
s. barely credible"
famine,n. a severe shortage of food (as through crop failure) resulting in violent hunger and starvation and death
fasten,"v. cause to be firmly attached
v. become fixed or fastened
v. attach to"
fatigue,"n. temporary loss of strength and energy resulting from hard physical or mental work
n. used of materials (especially metals) in a weakened state caused by long stress
n. (always used with a modifier) boredom resulting from overexposure to something"
feasible,s. capable of being done with means at hand and circumstances as they are
feeble,"s. pathetically lacking in force or effectiveness
s. lacking strength"
fertile,a. capable of reproducing
fertilizer,n. any substance such as manure or a mixture of nitrates used to make soil more fertile
filter,"n. device that removes something from whatever passes through it
n. an electrical device that alters the frequency spectrum of signals passing through it
v. remove by passing through a filter"
flame,"v. be in flames or aflame
v. criticize harshly, usually via an electronic medium"
flash,"n. a sudden intense burst of radiant energy
n. a momentary brightness
n. a short vivid experience
n. a sudden brilliant understanding"
flatter,v. praise somewhat dishonestly
flattering,a. showing or representing to advantage
fling,"n. the act of flinging
v. throw with force or recklessness
v. move in an abrupt or headlong manner"
flock,"n. a church congregation guided by a pastor
n. a group of birds
n. a group of sheep or goats
v. move as a crowd or in a group"
flourish,"n. a showy gesture
n. an ornamental embellishment in writing
n. a display of ornamental speech or language
n. the act of waving"
fluctuate,"v. cause to fluctuate or move in a wavelike pattern
v. move or sway in a rising and falling or wavelike pattern
v. be unstable"
fluent,s. smooth and unconstrained in movement
fluid,"n. a substance that is fluid at room temperature and pressure
n. continuous amorphous matter that tends to flow and to conform to the outline of its container: a liquid or a gas
s. subject to change; variable
s. characteristic of a fluid; capable of flowing and easily changing shape"
flush,"n. a poker hand with all 5 cards in the same suit
n. a sudden rapid flow (as of water)
v. flow freely
v. glow or cause to glow with warm color or light"
forge,"n. furnace consisting of a special hearth where metal is heated before shaping
n. a workplace where metal is worked by heating and hammering
v. create by hammering
v. make a copy of with the intent to deceive"
format,"n. the organization of information according to preset specifications (usually for computer processing)
n. the general appearance of a publication
v. set (printed matter) into a specific format
v. determine the arrangement of (data) for storage and display (in computer science)"
formation,"n. an arrangement of people or things acting as a unit
n. the act of fabricating something in a particular shape
n. a particular spatial arrangement
n. natural process that causes something to form"
formidable,"s. extremely impressive in strength or excellence
s. inspiring fear"
formula,"n. a group of symbols that make a mathematical statement
n. a conventionalized statement expressing some fundamental principle
n. a representation of a substance using symbols for its constituent elements
n. a liquid food for infants"
formulate,v. prepare according to a formula
foul,"n. an act that violates the rules of a sport
v. hit a foul ball
v. commit a foul; break the rules
v. spot, stain, or pollute"
fraction,"n. a component of a mixture that has been separated by a fractional process
n. a small part or item forming a piece of a whole
n. the quotient of two rational numbers"
fracture,"n. breaking of hard tissue such as bone
n. the act of cracking something
v. violate or abuse
v. interrupt, break, or destroy"
fragile,s. vulnerably delicate
fragment,"n. a piece broken off or cut off of something else
n. an incomplete piece"
fragrant,a. pleasant-smelling
frame,"n. the framework for a pair of eyeglasses
n. a single one of a series of still transparent pictures forming a cinema, television or video film
n. a single drawing in a comic_strip
n. an application that divides the user's display into two or more windows that can be scrolled independently"
framework,"n. the underlying structure
n. a structure supporting or containing something"
fraud,"n. intentional deception resulting in injury to another person
n. something intended to deceive; deliberate trickery intended to gain an advantage"
freight,"n. transporting goods commercially at rates cheaper than express rates
n. the charge for transporting something by common carrier
v. transport commercially as cargo
v. load with goods for transportation"
fringe,"n. one of the light or dark bands produced by the interference and diffraction of light
n. a social group holding marginal or extreme views
n. an ornamental border consisting of short lengths of hanging threads or tassels
v. adorn with a fringe"
frontier,"n. a wilderness at the edge of a settled area of a country
n. an international boundary or the area (often fortified) immediately inside the boundary
n. an undeveloped field of study; a topic inviting research and development"
frown,"n. a facial expression of dislike or displeasure
v. look angry or sullen, wrinkle one's forehead, as if to signal disapproval"
fuse,"n. an electrical device that can interrupt the flow of electrical current when it is overloaded
n. any igniter that is used to initiate the burning of a propellant
v. become plastic or fluid or liquefied from heat
v. equip with a fuse; provide with a fuse"
fuss,"n. an angry disturbance
v. worry unnecessarily or excessively"
futile,s. producing no result or effect
fabric,n. artifact made by weaving or felting or knitting or crocheting natural or synthetic fibers
finite,"a. bounded or limited in magnitude or spatial or temporal extent
a. of verbs; relating to forms of the verb that are limited in time by a tense and (usually) show agreement with number and person"
fortnight,n. a period of fourteen consecutive days
frank,"n. a member of the ancient Germanic peoples who spread from the Rhine into the Roman Empire in the 4th century
n. a smooth-textured sausage of minced beef or pork usually smoked; often served on a bread roll
v. exempt by means of an official pass or letter, as from customs or other checks
s. clearly manifest; evident"
friendly,"n. troops belonging to or allied with your own military forces
a. characteristic of or befitting a friend
s. inclined to help or support; not antagonistic or hostile
a. easy to understand or use"
fable,n. a short moral story (often with animal characters)
feast,"n. something experienced with great delight
v. partake in a feast or banquet
v. provide a feast or banquet for"
feat,n. a notable achievement
ferry,"n. a boat that transports people or vehicles across a body of water and operates on a regular schedule
n. transport by boat or aircraft
v. transport from one place to another
v. transport by ferry"
feudal,a. of or relating to or characteristic of feudalism
flee,v. run away quickly
fleet,"n. group of aircraft operating together under the same ownership
n. group of motor vehicles operating together under the same ownership
n. a group of steamships operating together under the same ownership
n. a group of warships organized as a tactical unit"
flour,"n. fine powdery foodstuff obtained by grinding and sifting the meal of a cereal grain
v. cover with flour
v. convert grain into flour"
foam,"n. a mass of small bubbles formed in or on a liquid
n. a lightweight material in cellular form; made by introducing gas bubbles during manufacture
v. become bubbly or frothy or foaming"
fog,"n. droplets of water vapor suspended in the air near the ground
n. an atmosphere in which visibility is reduced because of a cloud of some substance"
fossil,"n. the remains (or an impression) of a plant or animal that existed in a past geological age and that has been excavated from the soil
a. characteristic of a fossil"
frost,"n. ice crystals forming a white deposit (especially on objects outside)
n. the formation of frost or ice on a surface
n. United States poet famous for his lyrical poems on country life in New England (1874-1963)
v. decorate with frosting"
funeral,n. a ceremony at which a dead person is buried or cremated
furnace,"n. an enclosed chamber in which heat is produced to heat buildings, destroy refuse, smelt or refine ores, etc."
flap,"n. any broad thin and limber covering attached at one edge; hangs loose or projects freely
n. the motion made by flapping up and down
n. a movable piece of tissue partly connected to the body
n. a movable airfoil that is part of an aircraft wing; used to increase lift or drag"
flare,"n. a shape that spreads outward
n. a sudden burst of flame
n. a burst of light used to communicate or illuminate
n. reddening of the skin spreading outward from a focus of infection or irritation"
footstep,"n. the act of taking a step in walking
n. the distance covered by a step"
frog,"n. any of various tailless stout-bodied amphibians with long hind limbs for leaping; semiaquatic and terrestrial species
n. a person of French descent
n. a decorative loop of braid or cord
v. hunt frogs for food"
fry,"n. English painter and art critic (1866-1934)
n. English dramatist noted for his comic verse dramas (born 1907)
v. be excessively hot
v. cook on a hot surface using fat"
fume,"v. be mad, angry, or furious
v. emit a cloud of fine particles"
filial,"a. designating the generation or the sequence of generations following the parental generation
a. relating to or characteristic of or befitting an offspring"
gain,"n. the amount by which the revenue of a business exceeds its cost of operating
v. obtain advantages, such as points, etc.
v. increase or develop
v. earn on some commercial or business transaction; earn as salary or wages"
game,"n. a contest with rules to determine a winner
n. a single play of a sport or other contest
n. an amusement or pastime
n. animal hunted for food or sport"
gather,"n. sewing consisting of small folds or puckers made by pulling tight a thread in a line of stitching
n. the act of gathering something
v. assemble or get together
v. conclude from evidence"
gay,"s. full of or showing high-spirited merriment
s. given to social pleasures often including dissipation
s. offering fun and gaiety
s. homosexual or arousing homosexual desires"
gap,"n. a conspicuous disparity or difference as between two figures
n. a narrow opening
n. a difference (especially an unfortunate difference) between two opinions or two views or two situations
v. make an opening or gap in"
garment,n. an article of clothing
gasp,n. a short labored intake of breath with the mouth open
gaze,"n. a long fixed look
v. look at with fixed eyes"
gentle,"v. stroke soothingly
s. soft and mild; not harsh or stern or severe
s. having or showing a kindly or tender nature
s. quiet and soothing"
gender,n. a grammatical category in inflected languages governing the agreement between nouns and pronouns and adjectives; in some languages it is quite arbitrary but in Indo-European languages it is usually based on sex or animateness
gene,n. (genetics) a segment of DNA that is involved in producing a polypeptide chain; it can include regions preceding and following the coding DNA as well as introns between the exons; it is considered a unit of heredity
genetic,"a. pertaining to or referring to origin
a. of or relating to the science of genetics"
generalize,"v. draw from specific cases for more general cases
v. speak or write in generalities
v. become systemic and spread throughout the body"
generate,"v. bring into existence
v. produce (energy)"
generator,"n. an apparatus that produces a vapor or gas
n. engine that converts mechanical energy into electrical energy by electromagnetic induction
n. someone who originates or causes or initiates something
n. an electronic device for producing a signal voltage"
generous,"a. willing to give and share unstintingly
a. not petty in character and mind
s. more than adequate"
genius,"n. someone who has exceptional intellectual ability and originality
n. exceptional creative ability"
gift,n. something acquired without compensation
giant,"n. any creature of exceptional size
n. an unusually large enterprise
n. a very large person; impressive in size or qualities
n. someone or something that is abnormally large and powerful"
glad,"a. showing or causing joy and pleasure; especially made happy
s. eagerly disposed to act or to be of service
s. feeling happy appreciation"
glance,"n. a quick look
v. throw a glance at; take a brief look at
v. hit at an angle"
glamor,n. alluring beauty or charm (often with sex-appeal)
glare,"n. a light within the field of vision that is brighter than the brightness to which the eyes are adapted
n. an angry stare
v. be sharply reflected
v. shine intensely"
glimpse,"n. a brief or incomplete view
n. a vague indication
v. catch a glimpse of or see briefly"
glitter,"n. the quality of shining with a bright reflected light
n. the occurrence of a small flash or spark
v. be shiny, as if wet"
globe,n. a sphere on which a map (especially of the earth) is represented
global,s. involving the entire earth; not limited or provincial in scope
goal,"n. the state of affairs that a plan is intended to achieve and that (when achieved) terminates behavior intended to achieve it
n. game equipment consisting of the place toward which players of a game try to advance a ball or puck in order to score points
n. a successful attempt at scoring"
gorgeous,s. dazzlingly beautiful
govern,"v. direct or strongly influence the behavior of
v. exercise authority over; as of nations
v. require to be in a certain grammatical case, voice, or mood"
governor,"n. the head of a state government
n. a control that maintains a steady speed in a machine (as by controlling the supply of fuel)"
gown,"n. a woman's dress, usually with a close-fitting bodice and a long flared skirt, often worn on formal occasions
n. the members of a university as distinguished from the other residents of the town in which the university is located
n. protective garment worn by surgeons during operations
n. outerwear consisting of a long flowing garment used for official or ceremonial occasions"
grade,"n. a relative position or degree of value in a graded group
n. the gradient of a slope or road or other surface
n. a degree of ablaut
n. the height of the ground on which something stands"
greet,"v. express greetings upon meeting someone
v. send greetings to
v. react to in a certain way
v. be perceived by"
greeting,n. (usually plural) an acknowledgment or expression of good will (especially on meeting)
