able,"a. (usually followed by `to') having the necessary means or skill or know-how or authority to do something
s. have the skills and qualifications to do things well
s. having inherent physical or mental ability or capacity
s. having a strong healthy body"
ability,"n. the quality of being able to perform; a quality that permits or facilitates achievement or accomplishment
n. possession of the qualities (especially mental qualities) required to do something or get something done"
above,"n. an earlier section of a written text
s. appearing earlier in the same text
r. at an earlier place
r. in or to a place that is higher"
aboard,"r. on a ship, train, plane or other vehicle
r. on first or second or third base
r. side by side
r. part of a group"
abstract,"v. consider a concept without thinking of a specific example; consider abstractly or theoretically
v. consider apart from a particular case or instance
v. give an abstract (of)
a. existing only in the mind; separated from embodiment"
abound,"v. be abundant or plentiful; exist in large quantities
v. be in a state of movement or action"
abundant,a. present in great quantity
be abundant in,none
abandon,"n. the trait of lacking restraint or control; reckless freedom from inhibition or worry
v. forsake, leave behind
v. give up with the intent of never claiming again
v. stop maintaining or insisting on; of ideas or claims"
absence,"n. the state of being absent
n. failure to be present
n. the time interval during which something or somebody is away
n. the occurrence of an abrupt, transient loss or impairment of consciousness (which is not subsequently remembered), sometimes with light twitching, fluttering eyelids, etc.; common in petit mal epilepsy"
absent,"v. go away or leave
a. not being in a specified place
s. lost in thought; showing preoccupation"
be absent from,none
absorb,"v. become imbued
v. take up mentally
v. take up, as of debts or payments
v. take in, also metaphorically"
abnormal,"a. not normal; not typical or usual or regular or conforming to a norm
a. departing from the normal in e.g. intelligence and development
s. much greater than the normal"
academic,"a. associated with academia or an academy
s. hypothetical or theoretical and not expected to produce an immediate or practical result
s. marked by a narrow focus on or display of learning especially its trivial aspects"
academics,n. an educator who works at a college or university
academy,"n. a secondary school (usually private)
n. an institution for the advancement of art or science or literature
n. a school for special training
n. a learned establishment for the advancement of knowledge"
access,"n. the right to obtain or make use of or take advantage of something (as services or membership)
n. a way of entering or leaving
n. a code (a series of characters or digits) that must be entered in some way (typed or dialed or spoken) to get the use of something (a telephone line or a computer or a local area network etc.)
n. (computer science) the operation of reading or writing stored information"
accident,"n. an unfortunate mishap; especially one causing damage or injury
n. anything that happens suddenly or by chance without an apparent cause"
accidental,"n. a musical notation that makes a note sharp or flat or natural although that is not part of the key signature
s. happening by chance or unexpectedly or unintentionally"
acclaim,"n. enthusiastic approval
v. praise vociferously"
accompany,v. go or travel along with
accomplish,"v put in effect
v to gain with effort"
accord,"n. concurrence of opinion
n. sympathetic compatibility
v. allow to have"
in accordance with,none
in accord with,none
according to,none
accordingly,r. in accordance with
account,"n. a formal contractual relationship established to provide for regular banking or brokerage or business services
n. importance or value
n. a statement of recent transactions and the resulting balance
n. the quality of taking advantage"
accountant,n. someone who maintains and audits business accounts
accumulate,v. collect or gather
accurate,"a. conforming exactly or almost exactly to fact or to a standard or performing with total accuracy
s. (of ideas, images, representations, expressions) characterized by perfect conformity to fact or truth; strictly correct"
accuracy,"n. the quality of being near to the true value
n. (mathematics) the number of significant figures given in a number"
precision,n the quality of being reproducible in amount or performance
achieve,v. to gain with effort
acid,"n. any of various water-soluble compounds having a sour taste and capable of turning litmus red and reacting with a base to form a salt
n. street name for lysergic acid diethylamide
s. having the characteristics of an acid"
acquire,"v. locate (a moving entity) by means of a tracking system such as radar
v. win something through one's efforts"
acquisition,"n. the act of contracting or assuming or acquiring possession of something
n. something acquired"
act,"n. a legal document codifying the result of deliberations of a committee or society or legislative body
n. something that people do or cause to happen
n. a subdivision of a play or opera or ballet
n. a short theatrical performance that is part of a longer program"
activity,"n. any specific behavior
n. (chemistry) the capacity of a substance to take part in a chemical reaction"
active,"n. a person who is a participating member of an organization
a. tending to become more severe or wider in scope
s. engaged in or ready for military or naval operations
a. disposed to take action or effectuate change"
activate,"v. make active or more active
v. make more adsorptive
v. aerate (sewage) so as to favor the growth of organisms that decompose organic matter
v. make (substances) radioactive"
acute,"a. having or experiencing a rapid onset and short but severe course
s. extremely sharp or intense
s. having or demonstrating ability to recognize or draw fine distinctions
a. of an angle; less than 90 degrees"
add,"v. make an addition (to); join or combine or unite with others; increase the quality, quantity, size or scope of
v. state or say further
v. make an addition by combining numbers
v. constitute an addition"
admit,"v. declare to be true or admit the existence or reality or truth of
v. allow to enter; grant entry to
v. allow participation in or the right to be part of; permit to exercise the rights, functions, and responsibilities of
v. afford possibility"
admission,"n. the act of admitting someone to enter
n. an acknowledgment of the truth of something"
adventure,n. a wild and exciting undertaking (not necessarily lawful)
the advent of ...,none
adapt,"v. make fit for, or change to suit a new purpose"
adopt,"v. choose and follow; as of theories, ideas, policies, strategies or plans
v. take up and practice as one's own
v. take into one's family"
addition,"n. a component that is added to something to improve it
n. the act of adding one thing to another
n. a quantity that is added
n. a suburban area laid out in streets and lots for a future residential area"
additional,s further or added
address,"n. (computer science) the code that identifies where a piece of information is stored
n. the place where a person or organization can be found or communicated with
n. the act of delivering a formal spoken communication to an audience
n. the manner of speaking to another individual"
adjust,"v. alter or regulate so as to achieve accuracy or conform to a standard
v. adapt or conform oneself to new or different conditions
v. make correspondent or conformable
v. decide how much is to be paid on an insurance claim"
administer,"v. work in an administrative capacity; supervise or be in charge of
v. perform (a church sacrament) ritually
v. give or apply (medications)
v. direct the taking of"
administration,"n. a method of tending to or managing the affairs of a some group of people (especially the group's business affairs)
n. the persons (or committees or departments etc.) who make up a body for the purpose of administering something
n. the act of administering medication
n. the act of meting out justice according to the law"
adolescent,"n. a juvenile between the onset of puberty and maturity
a. relating to or peculiar to or suggestive of an adolescent
s. being of the age 13 through 19
s. displaying or suggesting a lack of maturity"
advance,"n. an amount paid before it is earned
n. increase in price or value
v. move forward, also in the metaphorical sense
v. bring forward for consideration or acceptance"
advanced,"s. farther along in physical or mental development
s. comparatively late in a course of development
s. ahead of the times
s. at a higher level in training or knowledge or skill"
adverse,"s. contrary to your interests or welfare
s. in an opposing direction"
adversity,"n. a state of misfortune or affliction
n. a stroke of ill fortune; a calamitous event"
advertise,"v. call attention to
v. make publicity for; try to sell (a product)"
advisable,a. worthy of being recommended or suggested; prudent or wise
advocate,"n. a person who pleads for a cause or propounds an idea
n. a lawyer who pleads cases in court"
affirm,"v. to declare or affirm solemnly and formally as true
v. say yes to"
afford,"v. be able to spare or give up
v. have the financial means to do something or buy something
v. afford access to"
against,"prep. Abreast; opposite to; facing; towards; as, against the
   mouth of a river; -- in this sense often preceded by over.
prep. From an opposite direction so as to strike or come in
   contact with; in contact with; upon; as, hail beats against the roof.
prep. In opposition to, whether the opposition is of
   sentiment or of action; on the other side; counter to; in contrariety
   to; hence, adverse to; as, against reason; against law; to run a race
   against time.
prep. By of before the time that; in preparation for; so as
   to be ready for the time when."
age,"n. how long something has existed
n. a time of life (usually defined in years) at which some particular qualification or power arises
v. begin to seem older; get older
v. make older"
agree,"v. be in accord; be in agreement
v. consent or assent to a condition, or agree to do something
v. show grammatical agreement
v. be agreeable or suitable"
agreement,"n. the statement (oral or written) of an exchange of promises
n. compatibility of observations
n. harmony of people's opinions or actions or characters
n. the thing arranged or agreed to"
agency,"n. an administrative unit of government
n. a business that serves other businesses
n. the state of being in action or exerting power"
agent,"n. an active and efficient cause; capable of producing a certain effect
n. a representative who acts on behalf of other persons or organizations
n. a substance that exerts some force or effect
n. a businessman who buys or sells for another in exchange for a commission"
search agent,none
aggravate,"v make worse
v exasperate or irritate"
aggressive,"a. having or showing determination and energetic pursuit of your ends; positive in his convictions""
s. tending to spread quickly
s. characteristic of an enemy or one eager to fight"
aid,"n. a resource
n. the activity of contributing to the fulfillment of a need or furtherance of an effort or purpose
n. money to support a worthy person or cause"
alone,"s. isolated from others
s. lacking companions or companionship
s. exclusive of anyone or anything else
s. radically distinctive and without equal"
alarm,"n. fear resulting from the awareness of danger
n. a device that signals the occurrence of some undesirable event
n. an automatic signal (usually a sound) warning of danger
v. warn or arouse to a sense of danger or call to a state of preparedness"
alike,"a. having the same or similar characteristics
r. equally
r. in a like manner"
allege,v. report or maintain
alliance,"n. the state of being allied or confederated
n. a connection based on kinship or marriage or common interest
n. an organization of people (or countries) involved in a pact or treaty
n. a formal agreement establishing an association or alliance between nations or other groups to achieve a particular aim"
ally,"n. a friendly nation
n. an associate who provides cooperation or assistance
v. become an ally or associate, as by a treaty or marriage"
ally with,none
allocate,v. distribute according to a plan or set apart for a special purpose
allow,"v. let have
v. give or assign a resource to a particular person or cause
v. allow or plan for a certain possibility; concede the truth or validity of something
v. grant as a discount or in exchange"
allowance,"n. an amount allowed or granted (as during a given period)
n. a sum granted as reimbursement for expenses
n. an amount added or deducted on the basis of qualifying circumstances
n. a permissible difference; allowing some freedom to move within limits"
make some allowance,none
alphabet,n. a character set that includes letters and is used to write a language
alter,"v. make an alteration to
v. remove the ovaries of"
alternate,"v. go back and forth; swing back and forth between two states or conditions
v. exchange people temporarily to fulfill certain jobs and functions
v. do something in turns
s. every second one of a series"
alternative,"s. necessitating a choice between mutually exclusive possibilities
s. pertaining to unconventional choices"
amateur,"n. someone who pursues a study or sport as a pastime
n. an athlete who does not play for pay
s. engaged in as a pastime"
amaze,v. affect with wonder
ambition,"n. a cherished desire
n. a strong drive for success
v. have as one's ambition"
ambitious,"a. having a strong desire for success or achievement
s. requiring full use of your abilities or resources"
amend,v. make amendments to
amount,"n. the relative magnitude of something with reference to a criterion
v. be tantamount or equivalent to"
ample,"a. more than enough in size or scope or capacity
s. affording an abundant supply
s. fairly large"
amplify,v. increase the volume of
amplifier,n. electronic equipment that increases strength of signals passing through it
amuse,"v. occupy in an agreeable, entertaining or pleasant fashion
v. make (somebody) laugh"
answer,"n. a statement (either spoken or written) that is made to reply to a question or request or criticism or accusation
n. the speech act of replying to a question
n. the principal pleading by the defendant in response to plaintiff's complaint; in criminal law it consists of the defendant's plea of `guilty' or `not guilty' (or nolo contendere); in civil law it must contain denials of all allegations in the plaintiff's complaint that the defendant hopes to controvert and it can contain affirmative defenses or counterclaims
n. a nonverbal reaction"
anxious,"s. eagerly desirous
s. causing or fraught with or showing anxiety"
anybody,"n. Any one out of an indefinite number of persons; anyone;
   any person.
n. A person of consideration or standing."
anything,"n. Any object, act, state, event, or fact whatever; thing of
   any kind; something or other; aught; as, I would not do it for
   anything.
n. Expressing an indefinite comparison; -- with as or like.
adv. In any measure; anywise; at all."
analyse,"v consider in detail and subject to an analysis in order to discover essential features or meaning
v break down into components or essential features
v make a mathematical, chemical, or grammatical analysis of; break down into components or essential features
v subject to psychoanalytic treatment"
analyze,"v. consider in detail and subject to an analysis in order to discover essential features or meaning
v. make a mathematical, chemical, or grammatical analysis of; break down into components or essential features
v. break down into components or essential features"
analysis,"n. an investigation of the component parts of a whole and their relations in making up the whole
n. the abstract separation of a whole into its constituent parts in order to study the parts and their relations
n. a form of literary criticism in which the structure of a piece of writing is analyzed
n. the use of closed-class words instead of inflections: e.g., `the father of the bride' instead of `the bride's father'"
analytic,"a. using or subjected to a methodology using algebra and calculus
a. using or skilled in using analysis (i.e., separating a whole--intellectual or substantial--into its elemental parts or basic principles)
a. expressing a grammatical category by using two or more words rather than inflection"
ancestor,n. someone from whom you are descended (but usually more remote than a grandparent)
ancient,"n. a very old person
n. a person who lived in ancient times
s. belonging to times long past especially of the historical period before the fall of the Western Roman Empire
s. very old"
angel,"n. spiritual being attendant upon God
n. invests in a theatrical production
n. the highest waterfall; has more than one leap; flow varies seasonally"
anniversary,n. the date on which an event occurred in some previous year (or the celebration of it)
annual,"n. (botany) a plant that completes its entire life cycle within the space of a year
n. a reference book that is published regularly once every year
a. completing its life cycle within a year
s. occurring or payable every year"
announce,"v. make known; make an announcement
v. announce publicly or officially
v. give the names of
v. foreshadow or presage"
annoy,"v. cause annoyance in; disturb, especially by minor irritations"
anticipate,"v. act in advance of; deal with ahead of time
v. realize beforehand
v. be excited or anxious about
v. be a forerunner of or occur earlier than"
antique,"n. any piece of furniture or decorative object or the like produced in a former period and valuable because of its beauty or rarity
v. shop for antiques
v. give an antique appearance to
s. made in or typical of earlier times and valued for its age"
anxiety,"n. (psychiatry) a relatively permanent state of worry and nervousness occurring in a variety of mental disorders, usually accompanied by compulsive behavior or attacks of panic
n. a vague unpleasant emotion that is experienced in anticipation of some (usually ill-defined) misfortune"
anxious,"s. eagerly desirous
s. causing or fraught with or showing anxiety"
apple,"n. fruit with red or yellow or green skin and sweet to tart crisp whitish flesh
n. native Eurasian tree widely cultivated in many varieties for its firm rounded edible fruits"
apology,"n. an expression of regret at having caused trouble for someone
n. a formal written defense of something you believe in strongly
n. a poor example"
apologize,"v. acknowledge faults or shortcomings or failing
v. defend, explain, clear away, or make excuses for by reasoning"
apparent,"s. clearly revealed to the mind or the senses or judgment
s. appearing as such but not necessarily so"
appeal,"n. attractiveness that interests or pleases or stimulates
n. (law) a legal proceeding in which the appellant resorts to a higher court for the purpose of obtaining a review of a lower court decision and a reversal of the lower court's judgment or the granting of a new trial
v. take a court case to a higher court for review
v. request earnestly (something from somebody); ask for aid or protection"
appetite,n. a feeling of craving something
apply,"v. be pertinent or relevant or applicable
v. ask (for something)
v. refer (a word or name) to a person or thing
v. apply oneself to"
application,"n. the act of bringing something to bear; using it for a particular purpose
n. a verbal or written request for assistance or employment or admission to a school
n. the work of applying something; 
n. a program that gives a computer instructions that provide the user with tools to accomplish a task"
applicable,s. capable of being applied; having relevance
appliance,"n. a device or control that is very useful for a particular job
n. durable goods for home or office use"
appoint,"v. create and charge with a task or function
v. assign a duty, responsibility or obligation to
v. furnish"
appointment,"n. the act of putting a person into a non-elective position
n. (usually plural) furnishings and equipment (especially for a ship or hotel)
n. the job to which you are (or hope to be) appointed
n. (law) the act of disposing of property by virtue of the power of appointment"
appreciate,"v. recognize with gratitude; be grateful for
v. be fully aware of; realize fully
v. gain in value
v. increase the value of"
approach,"n. ideas or actions intended to deal with a problem or situation
n. the act of drawing spatially closer to something
n. the event of one object coming closer to another
n. the temporal property of becoming nearer in time"
appropriate,"v. take possession of by force, as after an invasion
a. suitable for a particular person or place or condition etc"
approve,"v. give sanction to
v. judge to be right or commendable; think well of"
approval,"n. a feeling of liking something or someone good
n. acceptance as satisfactory
n. a message expressing a favorable opinion"
approximate,"v. be close or similar
s. not quite exact or correct
s. very close in resemblance
s. located close together"
apt,"s. (usually followed by `to') naturally disposed toward
s. at risk of or subject to experiencing something usually unpleasant
s. mentally quick and resourceful"
arm,"n. a human limb; technically the part of the superior limb between the shoulder and the elbow but commonly used to refer to the whole superior limb
n. any projection that is thought to resemble a human arm
n. the part of an armchair or sofa that supports the elbow and forearm of a seated person
v. prepare oneself for a military confrontation"
architect,n. someone who creates plans to be used in making something (such as buildings)
architecture,"n. an architectural product or work
n. the discipline dealing with the principles of design and construction and ornamentation of fine buildings
n. the profession of designing buildings and environments with consideration for their esthetic effect"
arise,"v. originate or come into being
v. rise to one's feet
v. result or issue"
army,"n. a permanent organization of the military land forces of a nation or state
n. a large number of people united for some specific purpose"
arouse,"v. call forth (emotions, feelings, and responses)
v. to begin moving, ""As the thunder started the sleeping children began to stir""
v. stimulate sexually"
arrange,"v. put into a proper or systematic order
v. make arrangements for
v. adapt for performance in a different way
v. arrange thoughts, ideas, temporal events"
array,"n. an orderly arrangement
n. an impressive display
n. especially fine or decorative clothing
n. an arrangement of aerials spaced to give desired directional characteristics"
arrest,n. the state of inactivity following an interruption
arrow,"n. a mark to indicate a direction or relation
n. a projectile with a straight thin shaft and an arrowhead on one end and stabilizing vanes on the other; intended to be shot from a bow"
artistic,"a. relating to or characteristic of art or artists
s. satisfying aesthetic standards and sensibilities"
assistant,n. a person who contributes to the fulfillment of a need or furtherance of an effort or purpose
ascend,"v. travel up, ""We ascended the mountain""
v. go back in order of genealogical succession
v. become king or queen
v. appear to be moving upward, as by means of tendrils"
ash,"n. the residue that remains when something is burned
n. any of various deciduous pinnate-leaved ornamental or timber trees of the genus Fraxinus
n. strong elastic wood of any of various ash trees; used for furniture and tool handles and sporting goods such as baseball bats
v. convert into ashes"
ashamed,a. feeling shame or guilt or embarrassment or remorse
ashore,r. towards the shore from the water
aside,"n. a line spoken by an actor to the audience but not intended for others on the stage
r. on or to one side
r. out of the way (especially away from one's thoughts)
r. placed or kept separate and distinct as for a purpose"
assemble,"v. create by putting components or members together
v. get people together"
assembly,"n. a group of machine parts that fit together to form a self-contained unit
n. a group of persons who are gathered together for a common purpose
n. a unit consisting of components that have been fitted together
n. the social act of assembling"
assess,"v. charge (a person or a property) with a payment, such as a tax or a fine
v. estimate the value of (property) for taxation"
assessable,"s. capable of being assessed especially for the purpose of taxation
s. capable of being considered carefully"
asset,n. a useful or valuable quality
assign,"v. give out
v. select something or someone for a specific purpose
v. transfer one's right to
v. decide as to where something belongs in a scheme"
assignment,"n. a duty that you are assigned to perform (especially in the armed forces)
n. the instrument by which a claim or right or interest or property is transferred from one person to another
n. the act of distributing something to designated places or persons
n. an undertaking that you have been assigned to do (as by an instructor)"
assist,"n. (sports) the act of enabling another player to make a good play
v. act as an assistant in a subordinate or supportive function"
assistance,"n the activity of contributing to the fulfillment of a need or furtherance of an effort or purpose
n a resource"
associate,"n. a person who joins with others in some activity or endeavor
n. a person with subordinate membership in a society, institution, or commercial enterprise
n. any event that usually accompanies or is closely connected with another
v. make a logical or causal connection"
