aged,"n. people who are old collectively
s. advanced in years; (`aged' is pronounced as two syllables)
s. at an advanced stage of erosion (pronounced as one syllable)
s. having attained a specific age; (`aged' is pronounced as one syllable)"
impressed,s. deeply or markedly affected or influenced
employee,n. a worker who is hired to perform a job
absentee,n. one that is absent or not in residence
appointee,"n. an official who is appointed
n. a person who is appointed to a job or position"
broaden,"v. make broader
v. become broader"
wooden,"s. made or consisting of (entirely or in part) or employing wood
s. lacking ease or grace"
chicken,"n. the flesh of a chicken used for food
n. a domestic fowl bred for flesh or eggs; believed to have been developed from the red jungle fowl
n. a foolhardy competition; a dangerous activity that is continued until one competitor becomes afraid and stops
s. easily frightened"
darken,"v. become dark or darker
v. tarnish or stain
v. make dark or darker"
maiden,"n an unmarried girl (especially a virgin)
n (cricket) an over in which no runs are scored
s serving to set in motion"
dependence,n. the state of relying on or being controlled by someone or something else
emergence,"n. the gradual beginning or coming forth
n. the becoming visible
n. the act of emerging"
insistence,"n. continual and persistent demands
n. the act of insisting on something"
banker,"n. a financier who owns or is an executive in a bank
n. the person in charge of the bank in a gambling game"
boiler,n. sealed vessel where water is converted to steam
chatter,"n. the rapid series of noises made by the parts of a machine
n. the high-pitched continuing noise made by animals (birds or monkeys)
v. click repeatedly or uncontrollably
v. cut unevenly with a chattering tool"
carrier,"n. someone whose employment involves carrying something
n. a self-propelled wheeled vehicle designed specifically to carry something
n. an inactive substance that is a vehicle for a radioactive tracer of the same substance and that assists in its recovery after some chemical reaction
n. a person or firm in the business of transporting people or goods or messages"
woodpecker,n. bird with strong claws and a stiff tail adapted for climbing and a hard chisel-like bill for boring into wood for insects
actress,n. a female actor
hostess,"n. a woman host
n. a woman innkeeper"
waitress,n. a woman waiter
careful,"a. exercising caution or showing care or attention
s. cautiously attentive
s. unhurried and with care and dignity
s. full of cares or anxiety"
handful,"n. a small number or amount
n. the quantity that can be held in the hand"
doubtful,"s. open to doubt or suspicion
s. fraught with uncertainty or doubt
s. unsettled in mind or opinion"
dishful,n the quantity that a dish will hold
purify,"v. remove impurities from, increase the concentration of, and separate through the process of distillation
v. make pure or free from sin or guilt
v. become clean or pure or free of guilt and sin"
beautify,"v make more beautiful
v be beautiful to look at
v make more attractive by adding ornament, colour, etc."
uglify,v. make ugly
classify,"v. arrange or order by classes or categories
v. declare unavailable, as for security reasons"
fatherhood,"n. the kinship relation between an offspring and the father
n. the status of a religious leader
n. the status of a father"
childhood,"n. the time of person's life when they are a child
n. the state of a child between infancy and adolescence"
likelihood,n. the probability of a specified outcome
boyhood,n. the childhood of a boy
commercial,"n. a commercially sponsored ad on radio or television
a. connected with or engaged in or sponsored by or used in commerce or commercial enterprises
a. of or relating to commercialism
s. of the kind or quality used in commerce; average or inferior"
confidential,"s. entrusted with private information and the confidence of another
s. (of information) given in confidence or in secret
s. denoting confidence or intimacy
s. the level of official classification for documents next above restricted and below secret; available only to persons authorized to see documents so classified"
facial,"n. cranial nerve that supplies facial muscles
n. care for the face that usually involves cleansing and massage and the application of cosmetic creams
a. of or concerning the face
a. of or pertaining to the outside surface of an object"
historian,n. a person who is an authority on history and who studies it and writes about it
Egyptian,"n. a native or inhabitant of Egypt
n. the ancient and now extinct language of Egypt under the Pharaohs; written records date back to 3000 BC
a. of or relating to or characteristic of Egypt or its people or their language"
musician,"n. someone who plays a musical instrument (as a profession)
n. artist who composes or conducts music as a profession"
Canadian,"n. a native or inhabitant of Canada
n. a river rising in northeastern New Mexico and flowing eastward across the Texas panhandle to become a tributary of the Arkansas River in Oklahoma
a. of or relating to Canada or its people"
poetic,"a. of or relating to poetry
s. characterized by romantic imagery
a. of or relating to poets
s. characteristic of or befitting poetry"
critic,"n. a person who is professionally engaged in the analysis and interpretation of works of art
n. anyone who expresses a reasoned judgment of something
n. someone who frequently finds fault or makes harsh and unfair judgments"
logic,"n. the branch of philosophy that analyzes inference
n. reasoned and reasonable judgment
n. the principles that guide reasoning within a given field or situation
n. the system of operations performed by a computer that underlies the machine's representation of logical operations"
organic,"n. a fertilizer that is derived from animal or vegetable matter
a. relating or belonging to the class of chemical compounds having a carbon basis
a. being or relating to or derived from or having properties characteristic of living organisms
a. involving or affecting physiology or bodily organs"
mimic,"n. someone who mimics (especially an actor or actress)
v. imitate (a person or manner), especially for satirical effect
s. constituting an imitation"
electrician,n. a person who installs or repairs electrical or telephone lines
technician,"n. someone whose occupation involves training in a specific technical process
n. someone known for high skill in some intellectual or artistic technique"
logician,n. a person skilled at symbolic logic
physics,"n. the science of matter and energy and their interactions
n. the physical properties, phenomena, and laws of something"
dynamics,n. the branch of mechanics concerned with the forces that cause motions of bodies
economics,n. the branch of social science that deals with the production and distribution and consumption of goods and services and their management
ageing,"n acquiring desirable qualities by being left undisturbed for some time
n the organic process of growing older and showing the effects of increasing age
v begin to seem older; get older
v grow old or older
v make older
s growing old"
building,"n. a structure that has a roof and walls and stands more or less permanently in one place
n. the occupants of a building"
exciting,"a. creating or arousing excitement
s. stimulating interest and discussion"
clothing,n. a covering designed to be worn on a person's body
fascinating,"v cause to be interested or curious
v to render motionless, as with a fixed stare or by arousing terror or awe
v attract; cause to be enamored
s capable of arousing and holding the attention
s capturing interest as if by a spell"
inflation,"n. a general and progressive increase in prices
n. (cosmology) a brief exponential expansion of the universe (faster than the speed of light) postulated to have occurred shortly after the big bang
n. the act of filling something with air"
mansion,n. a large and imposing house
discussion,"n. an extended communication (often interactive) dealing with some particular topic
n. an exchange of views on some topic"
carnation,"n. Eurasian plant with pink to purple-red spice-scented usually double flowers; widely cultivated in many varieties and many colors
n. a pink or reddish-pink color
s. pink or pinkish"
civilisation,"n the social process whereby societies achieve an advanced stage of development and organization
n a particular society at a particular time and place
n a society in an advanced state of social development (e.g., with complex legal and political and religious organizations)
n the quality of excellence in thought and manners and taste"
civilization,"n. a society in an advanced state of social development (e.g., with complex legal and political and religious organizations)
n. the social process whereby societies achieve an advanced stage of development and organization"
modernisation,n making modern in appearance or behavior
authorisation,"n a document giving an official instruction or command
n the power or right to give orders or make decisions
n official permission or approval
n the act of conferring legality or sanction or formal warrant"
realise,"v earn on some commercial or business transaction; earn as salary or wages
v convert into cash; of goods and property
v expand or complete (a part in a piece of baroque music) by supplying the harmonies indicated in the figured bass
v make real or concrete; give reality or substance to
v be fully aware or cognizant of
v perceive (an idea or situation) mentally"
realize,"v. make real or concrete; give reality or substance to
v. convert into cash; of goods and property
v. expand or complete (a part in a piece of baroque music) by supplying the harmonies indicated in the figured bass"
advertise,"v. call attention to
v. make publicity for; try to sell (a product)"
publicise,"v call attention to
v make public"
childish,s. indicating a lack of maturity
finish,"n. the place designated as the end (as of a race or journey)
n. designated event that concludes a contest (especially a race)
n. the downfall of someone (as of persons on one side of a conflict)
n. (wine tasting) the taste of a wine on the back of the tongue (as it is swallowed)"
foolish,a. devoid of good sense or judgment
flourish,"n. a showy gesture
n. an ornamental embellishment in writing
n. a display of ornamental speech or language
n. the act of waving"
dentist,n. a person qualified to practice dentistry
capitalist,"n. a conservative advocate of capitalism
n. a person who invests capital in a business (especially a large business)
a. of or relating to capitalism or capitalists"
moralist,n. a philosopher who specializes in morals and moral problems
communist,"n. a member of the communist party
n. a socialist who advocates communism
a. relating to or marked by communism"
addictive,a. causing or characterized by addiction
detective,"n. a police officer who investigates crimes
n. an investigator engaged or employed in obtaining information not easily available to the public"
explosive,"n. a chemical substance that undergoes a rapid chemical change (with the production of gas) on being heated or struck
a. serving to explode or characterized by explosion or sudden outburst
s. liable to lead to sudden change or violence
s. sudden and loud"
appreciative,"s. feeling or expressive of gratitude
s. having or showing appreciation or a favorable critical judgment or opinion"
native,"n. an indigenous person who was born in a particular place
n. a person born in a particular place or country
n. indigenous plants and animals
a. characteristic of or existing by virtue of geographic origin"
endless,"s. tiresomely long; seemingly without end
s. infinitely great in number
s. having the ends united so as to form a continuous whole"
homeless,"n. someone unfortunate without housing
n. poor people who unfortunately do not have a home to live in
s. without nationality or citizenship"
hopeless,"a. without hope because there seems to be no possibility of comfort or success
s. of a person unable to do something skillfully
s. certain to fail
s. (informal to emphasize how bad it is) beyond hope of management or reform"
costly,s. having a high price
largely,"r. in large part; mainly or chiefly
r. on a large scale"
friendly,"n. troops belonging to or allied with your own military forces
a. characteristic of or befitting a friend
s. inclined to help or support; not antagonistic or hostile
a. easy to understand or use"
widely,"r. to a great degree
r. so as to leave much space or distance between"
agreement,"n. the statement (oral or written) of an exchange of promises
n. compatibility of observations
n. harmony of people's opinions or actions or characters
n. the thing arranged or agreed to"
basement,"n. the lowermost portion of a structure partly or wholly below ground level; often used for storage
n. the ground floor facade or interior in Renaissance architecture"
development,"n. act of improving by expanding or enlarging or refining
n. a process in which something passes by degrees to a different stage (especially a more advanced or mature stage)
n. a recent event that has some relevance for the present situation
n. a district that has been developed to serve some purpose"
equipment,n. an instrumentality needed for an undertaking or to perform a service
kindness,"n. the quality of being warmhearted and considerate and humane and sympathetic
n. a kind act"
weakness,"n. the property of lacking physical or mental strength; liability to failure under pressure or stress or strain
n. the condition of being financially weak
n. a penchant for something even though it might not be good for you"
brightness,"n. the location of a visual perception along a continuum from black to white
n. intelligence as manifested in being quick and witty"
inventor,n. someone who is the first to think of or make something
detector,"n. any device that receives a signal or stimulus (as heat or pressure or light or motion etc.) and responds to it in a distinctive manner
n. rectifier that extracts modulation from a radio carrier wave
n. electronic equipment that detects the presence of radio signals or radioactivity"
horror,"n. intense and profound fear
n. something that inspires dislike; something horrible"
sailor,n. any member of a ship's crew
terror,"n. a person who inspires fear or dread
n. a very troublesome child
n. the use of extreme fear in order to coerce people (especially for political reasons)"
friendship,n. the state of being friends (or friendly)
citizenship,"n. the status of a citizen with rights and duties
n. conduct as a citizen"
fellowship,n. money granted (by a university or foundation or other agency) for advanced study or research
membership,"n. the body of members of an organization or group
n. the state of being a member"
expansion,"n. the act of increasing (something) in size or volume or quantity or scope
n. a function expressed as a sum or product of terms
n. a discussion that provides additional information"
suspension,"n. a mixture in which fine particles are suspended in a fluid where they are supported by buoyancy
n. an interruption in the intensity or amount of something
n. a mechanical system of springs or shock absorbers connecting the wheels and axles to the chassis of a wheeled vehicle
n. the act of suspending something (hanging it from above so it moves freely)"
division,"n. an army unit large enough to sustain combat
n. the act or process of dividing
n. an administrative unit in government or business
n. discord that splits a group"
tiresome,s so lacking in interest as to cause mental weariness
troublesome,s. difficult to deal with
fearsome,s causing fear or dread or terror
certainty,"n. the state of being certain
n. something that is certain"
seventy,"n. the cardinal number that is the product of ten and seven
s. being ten more than sixty"
cruelty,"n. a cruel act; a deliberate infliction of pain and suffering
n. feelings of extreme heartlessness
n. the quality of being cruel and causing tension or annoyance"
sixty,"n. the cardinal number that is the product of ten and six
s. being ten more than fifty"
actual,"a. presently existing in fact and not merely potential or possible
s. taking place in reality; not pretended or imitated
s. being or reflecting the essential or genuine character of something
s. existing in act or fact"
gradual,"n. (Roman Catholic Church) an antiphon (usually from the Book of Psalms) immediately after the epistle at Mass
a. proceeding in small stages
a. (of a topographical gradient) not steep or abrupt"
mutual,"s common to or shared by two or more parties
a concerning each of two or more persons or things; especially given or done in return"
backward,"a. directed or facing toward the back or rear
a. (used of temperament or behavior) marked by a retiring nature
s. retarded in intellectual development
s. having made less than normal progress"
forward,"n. the person who plays the position of forward in certain games, such as basketball, soccer, or hockey
n. a position on a basketball, soccer, or hockey team
v. send or ship onward from an intermediate post or station in transit
a. at or near or directed toward the front"
heavenward,"s. directed toward heaven or the sky
r. toward heaven"
sleepy,s. ready to fall asleep
discovery,"n. the act of discovering something
n. something that is discovered
n. a productive insight
n. (law) compulsory pretrial disclosure of documents relevant to a case; enables one side in a litigation to elicit information from the other side concerning the facts in the case"
woody,"a. made of or containing or resembling wood
s. made hard like wood as the result of the deposition of lignin in the cell walls"
jealousy,"n. a feeling of jealous envy (especially of a rival)
n. zealous vigilance"
disable,"v. make unable to perform a certain action
v. injure permanently"
ability,"n. the quality of being able to perform; a quality that permits or facilitates achievement or accomplishment
n. possession of the qualities (especially mental qualities) required to do something or get something done"
able,"a. (usually followed by `to') having the necessary means or skill or know-how or authority to do something
s. have the skills and qualifications to do things well
s. having inherent physical or mental ability or capacity
s. having a strong healthy body"
habilitate,v. qualify for teaching at a university in Europe
activity,"n. any specific behavior
n. (chemistry) the capacity of a substance to take part in a chemical reaction"
exact,a. marked by strict and particular and complete accordance with fact
react,"v. show a response or a reaction to something
v. act against or in opposition to
v. undergo a chemical reaction; react with another substance under certain conditions"
anniversary,n. the date on which an event occurred in some previous year (or the celebration of it)
annuity,n. income from capital investment paid in a series of regular payments
annals,"n. reports of the work of a society or learned body etc
n. a chronological account of events in successive years"
artifact,n. a man-made object taken as a whole
article,"n. nonfictional prose forming an independent part of a publication
n. one of a class of artifacts
n. a separate section of a legal document (as a statute or contract or will)
n. (grammar) a determiner that may indicate the specificity of reference of a noun phrase"
artful,a. marked by skill in achieving a desired end especially with cunning or craft
articular,a. relating to or affecting the joints of the body
articulate,"v. unite by forming a joint or joints
v. express or state clearly
a. expressing yourself easily or characterized by clear expressive language"
audience,"n. a gathering of spectators or listeners at a (usually public) performance
n. the part of the general public interested in a source of information or entertainment"
auditor,"n. a student who attends a course but does not take it for credit
n. a qualified accountant who inspects the accounting records and practices of a business or other organization"
audible,"n. a football play is changed orally after both teams have assumed their positions at the line of scrimmage
a. heard or perceptible by the ear"
auditorium,n. the area of a theater or concert hall where the audience sits
authentic,"s. conforming to fact and therefore worthy of belief
s. not counterfeit or copied"
automatic,"a. operating with minimal human intervention; independent of external control
s. resembling the unthinking functioning of a machine
s. without volition or conscious control"
autism,n. (psychiatry) an abnormal absorption with the self; marked by communication disorders and short attention span and inability to treat others as people
autonomy,"n. immunity from arbitrary exercise of authority: political independence
n. personal independence"
abandon,"n. the trait of lacking restraint or control; reckless freedom from inhibition or worry
v. forsake, leave behind
v. give up with the intent of never claiming again
v. stop maintaining or insisting on; of ideas or claims"
banal,s. repeated too often; overfamiliar through overuse
banish,"v. expel from a community or group
v. ban from a place of residence, as for punishment
v. expel, as if by official decree
v. drive away"
baseborn,"s of low birth or station (`base' is archaic in this sense)
s illegitimate"
subbase,n. the lowest molding of an architectural base or of a baseboard
basis,"n. the fundamental assumptions from which something is begun or developed or calculated or explained
n. the most important or necessary part of something"
basic,"n. a popular programming language that is relatively easy to learn; an acronym for beginner's all-purpose symbolic instruction code; no longer in general use
n. (usually plural) a necessary commodity for which demand is constant
a. pertaining to or constituting a base or basis
s. reduced to the simplest and most significant form possible without loss of generality"
biochemistry,n. the organic chemistry of compounds and processes occurring in organisms; the effort to understand biology within the context of chemistry
biography,n. an account of the series of events making up a person's life
biology,"n. the science that studies living organisms
n. characteristic life processes and phenomena of living organisms"
antibiotic,"n. a chemical substance derivable from a mold or bacterium that can kill microorganisms and cure bacterial infections
a. of or relating to antibiotic drugs"
percent,n a proportion in relation to a whole (which is usually the amount per hundred)
percentage,n. a proportion in relation to a whole (which is usually the amount per hundred)
centennial,"n. the 100th anniversary (or the celebration of it)
a. of or relating to or completing a period of 100 years"
central,"n. a workplace that serves as a telecommunications facility where lines from telephones can be connected together to permit communication
a. in or near a center or constituting a center; the inner area"
concentrate,"n. a concentrated form of a foodstuff; the bulk is reduced by removing water
n. a concentrated example of something
v. make denser, stronger, or purer
v. direct one's attention on something"
concentric,a. having a common center
circle,"n. ellipse in which the two axes are of equal length; a plane curve generated by one point moving at a constant distance from a fixed point
n. something approximating the shape of a circle
n. a curved section or tier of seats in a hall or theater or opera house; usually the first tier above the orchestra
n. any circular or rotating mechanism"
cyclone,"n. (meteorology) rapid inward circulation of air masses about a low pressure center; circling counterclockwise in the northern hemisphere and clockwise in the southern
n. a violent rotating windstorm"
circulate,"v. cause to become widely known
v. cause be distributed
v. move through a space, circuit or system, returning to the starting point
v. cause to move in a circuit or system"
cycle,"n. an interval during which a recurring sequence of events occurs
n. a series of poems or songs on the same theme
n. a periodically repeated sequence of events
n. a single complete execution of a periodically repeated phenomenon"
civil,"s. applying to ordinary citizens as contrasted with the military
a. not rude; marked by satisfactory (or especially minimal) adherence to social usages and sufficient but not noteworthy consideration for others
a. of or occurring within the state or between or among citizens of the state
a. of or relating to or befitting citizens as individuals"
civic,a. of or relating or belonging to a city
civilise,"v teach or refine to be discriminative in taste or judgment
v raise from a barbaric to a civilized state"
discover,"v. make a discovery, make a new finding
v. make a discovery
v. see for the first time; make a discovery"
coverage,"n. the total amount and type of insurance carried
n. the extent to which something is covered
n. the news as presented by reporters for newspapers or radio or television"
recover,"v. get or find back; recover the use of
v. regain a former condition after a financial loss
v. regain or make up for
v. cover anew"
dentist,n. a person qualified to practice dentistry
denture,n. a dental appliance that artificially replaces missing teeth
indented,"v set in from the margin
v cut or tear along an irregular line so that the parts can later be matched for authentication
v make a depression into
v notch the edge of or make jagged
v bind by or as if by indentures, as of an apprentice or servant"
dedicate,"v. open to public use, as of a highway, park, or building
v. inscribe or address by way of compliment
v. set apart to sacred uses with solemn rites, of a church"
