abnormal,"a. not normal; not typical or usual or regular or conforming to a norm
a. departing from the normal in e.g. intelligence and development
s. much greater than the normal"
abstract,"v. consider a concept without thinking of a specific example; consider abstractly or theoretically
v. consider apart from a particular case or instance
v. give an abstract (of)
a. existing only in the mind; separated from embodiment"
absorb,"v. become imbued
v. take up mentally
v. take up, as of debts or payments
v. take in, also metaphorically"
absent,"v. go away or leave
a. not being in a specified place
s. lost in thought; showing preoccupation"
antonym,"n. a word that expresses a meaning opposed to the meaning of another word, in which case the two words are antonyms of each other"
antiwar,none
antibody,"n. any of a large variety of proteins normally present in the body or produced in response to an antigen which it neutralizes, thus producing an immune response"
Antarctic,n. the region around the south pole: Antarctica and surrounding waters
antiaircraft,"n. artillery designed to shoot upward at airplanes
s. designed for defense from a surface position against air attack"
bewilder,v. cause to be confused emotionally
before,"r earlier in time; previously
r at or in the front"
belittle,"v cause to seem less serious; play down
v express a negative opinion of
v lessen the authority, dignity, or reputation of"
beneath,r in or to a place that is lower
bicycle,"n. a wheeled vehicle that has two wheels and is moved by foot pedals
v. ride a bicycle"
biannual,s occurring or payable twice each year
biweekly,n. a periodical that is published twice a week or every two weeks (either 104 or 26 issues per year)
bystander,n. a nonparticipant spectator
byproduct,"n a secondary and sometimes unexpected consequence
n a product made during the manufacture of something else"
byword,n a condensed but memorable saying embodying some important fact of experience that is taken as true by many people
bywork,"n. Work aside from regular work; subordinate or secondary
   business."
cooperate,v work together on a common enterprise of project
collateral,"n. a security pledged for the repayment of a loan
a. descended from a common ancestor but through different lines
s. serving to support or corroborate
s. accompany, concomitant"
coaction,n act of working jointly
collocate,"v. have a strong tendency to occur side by side
v. group or chunk together in a certain order or place side by side"
compassion,"n. a deep awareness of and sympathy for another's suffering
n. the humane quality of understanding the suffering of others and wanting to do something about it"
conflict,"n. an open clash between two opposing groups (or individuals)
n. opposition between two simultaneous but incompatible feelings
n. a state of opposition between persons or ideas or interests
n. an incompatibility of dates or events"
correlate,"n. either of two or more related or complementary variables
v. to bear a reciprocal or mutual relation
v. bring into a mutual, complementary, or reciprocal relation"
comment,"n. a written explanation or criticism or illustration that is added to a book or other textual material
v. make or write a comment on
v. explain or interpret something"
condense,"v. undergo condensation; change from a gaseous to a liquid state and fall in drops
v. remove water from
v. cause a gas or vapor to change into a liquid
v. become more compact or concentrated"
corroborate,v. support with evidence or authority or make more certain or confirm
compatriot,n. a person from your own country
congregate,"v. come together, usually for a purpose"
decode,v. convert code into ordinary language
destruction,"n. the termination of something by causing so much damage to it that it cannot be repaired or no longer exists
n. an event (or the result of an event) that completely destroys something"
devalue,"v. remove the value from; deprive of its value
v. lower the value or quality of"
deforest,v. remove the trees from
depopulation,n. the condition of having reduced numbers of inhabitants (or no inhabitants at all)
diffident,"s. showing modest reserve
a. lacking self-confidence"
diffuse,"v. move outward
s. spread out; not concentrated in one place
s. lacking conciseness"
difficult,a. not easy; requiring great physical or mental effort to accomplish or comprehend or endure
diffluence,n. Alt. of Diffluency
dislike,"n. a feeling of aversion or antipathy
v. have or feel a dislike or distaste for"
disable,"v. make unable to perform a certain action
v. injure permanently"
distract,v. draw someone's attention away from something
disappear,"v. get lost, as without warning or explanation"
discourage,v. deprive of courage or hope; take away hope from; cause to feel discouraged
ecology,"n. the environment as it relates to living organisms
n. the branch of biology concerned with the relations between organisms and their environment"
economy,"n. the system of production and distribution and consumption
n. the efficient use of resources
n. frugality in the expenditure of money or resources
n. an act of economizing; reduction in cost"
ecotourism,n. tourism to exotic or threatened ecosystems to observe wildlife or to help preserve nature
economic,"a. of or relating to an economy, the system of production and management of material wealth
a. of or relating to the science of economics
s. using the minimum of time or resources necessary for effectiveness
s. concerned with worldly necessities of life (especially money)"
embrace,"n. the act of clasping another person in the arms (as in greeting or affection)
n. the state of taking in or encircling
n. a close affectionate and protective acceptance
v. include in scope; include as part of something broader; have as one's sphere or territory"
enlist,"v. join the military
v. engage somebody to enter the army"
embody,"v. represent, as of a character on stage
v. represent or express something abstract in tangible form"
enlarge,"v. make larger
v. become larger or bigger"
empower,v. give or delegate power or authority to
enlighten,"v. make understand
v. give spiritual insight to; in religion"
expel,v. force to leave or move out
ex-wife,none
extract,"v. remove, usually with some force or effort; also used in an abstract sense
v. get despite difficulties or obstacles
v. separate (a metal) from an ore
v. calculate the root of a number"
ex-president,n. a former president
extraordinary,"a. beyond what is ordinary or usual; highly unusual or exceptional or remarkable
s. far more than usual or expected
s. (of an official) serving an unusual or special function in addition to those of the regular officials"
extravagant,s. recklessly wasteful
extracurricular,"s. outside the regular academic curriculum
s. outside the regular duties of your job or profession"
foresee,"v realize beforehand
v picture to oneself; imagine possible
v act in advance of; deal with ahead of time"
foreword,n. a short introductory essay preceding the text of a book
foreshadow,v indicate by signs
illegal,a. prohibited by law or by official or accepted rules
illustrate,"v. depict with an illustration
v. supply with illustrations"
illogical,a. lacking in correct logical relation
illuminate,v. add embellishments and paintings to (medieval manuscripts)
impossible,"n. something that cannot be done
a. not capable of occurring or being accomplished or dealt with
s. totally unlikely
s. used of persons or their behavior"
inability,"n. lack of ability (especially mental ability) to do something
n. lacking the power to perform"
imprison,"v. lock up or confine, in or as in a jail
v. confine as if in a prison; he does not let them go out without a chaperone"""
include,"v. have as a part, be made up out of
v. consider as part of something
v. add as part of something else; put in as part of a set, group, or category"
impress,"n. the act of coercing someone into government service
v. impress positively
v. produce or try to produce a vivid impression of
v. mark or stamp with or as if with pressure"
infect,"v. communicate a disease to
v. contaminate with a disease or microorganism
v. corrupt with ideas or an ideology
v. affect in a contagious way"
immobile,a. not capable of movement or of being moved
incorrect,"a. not correct; not in conformity with fact or truth
s. (of a word or expression) not agreeing with grammatical principles"
international,"n. any of several international socialist organizations
a. concerning or belonging to all or at least two or more nations"
interact,v. act together or towards others or with others
interstellar,a. between or among stars
interview,"n. the questioning of a person (or a conversation in which information is elicited); often conducted by journalists
v. conduct an interview in television, newspaper, and radio reporting
v. discuss formally with (somebody) for the purpose of an evaluation
v. go for an interview in the hope of being hired"
intracity,none
intrapersonal,none
intranet,n. a restricted computer network; a private network created using World Wide Web software
introduce,"v. cause to come to know personally
v. bring something new to an environment
v. bring in or establish in a new place or environment
v. bring before the public for the first time, as of an actor, song, etc."
introspect,v. reflect on one's own thoughts and feelings
introvert,"n. (psychology) a person who tends to shrink from social contacts and to become preoccupied with their own thoughts
v. turn inside"
irregular,"n. merchandise that has imperfections; usually sold at a reduced price without the brand name
a. contrary to rule or accepted order or general practice
s. not occurring at expected times
a. (used of the military) not belonging to or engaged in by regular army forces"
irrigate,"v. supply with a constant flow or sprinkling of some liquid, for the purpose of cooling, cleansing, or disinfecting"
irreplaceable,a. impossible to replace
irruption,"n. a sudden violent entrance; a bursting in
n. a sudden sharp increase in the relative numbers of a population"
kilogram,n. one thousand grams; the basic unit of mass adopted under the Systeme International d'Unites
kilometer,n. a metric unit of length equal to 1000 meters (or 0.621371 miles)
kilobyte,"n. a unit of information equal to 1000 bytes
n. a unit of information equal to 1024 bytes"
macroscale,none
macroeconomics,n. the branch of economics that studies the overall working of a national economy
macrostructure,none
malnutrition,n. a state of poor nutrition; can result from insufficient or excessive or unbalanced diet or from inability to absorb foods
malevolent,s. wishing or appearing to wish evil to others; arising from intense ill will or hatred
malignant,a. dangerous to health; characterized by progressive and uncontrolled growth (especially of a tumor)
malefaction,n. A crime; an offense; an evil deed.
malcontent,n. a person who is discontented or disgusted
microphone,n. device for converting sound waves into electrical energy
microwave,"n. a short electromagnetic wave (longer than infrared but shorter than radio waves); used for radar and microwave ovens and for transmitting telephone, facsimile, video and data
n. kitchen appliance that cooks food by passing an electromagnetic wave through it; heat results from the absorption of energy by the water molecules in the food
v. cook or heat in a microwave oven"
microworld,none
misunderstand,v interpret in the wrong way
misfortune,"n. unnecessary and unforeseen trouble resulting from an unfortunate event
n. an unfortunate state resulting from unfavorable outcomes"
mistrust,"n doubt about someone's honesty
n the trait of not trusting others
v regard as untrustworthy; regard with suspicion; have no faith or confidence in"
multimedia,n. transmission that combine media of communication (text and graphics and sound etc.)
multiangular,none
multilingual,a. using or knowing more than one language
nonsense,"n. a message that seems to convey no meaning
s. having no intelligible meaning"
nonstop,"s. (of a journey especially a flight) occurring without stops
r. without stopping"
nonviolent,"a. abstaining (on principle) from the use of violence
s. achieved without bloodshed"
outlive,v. live longer than
outbreak,n. a sudden violent spontaneous occurrence (usually of some undesirable condition)
outperform,v be or do something to a greater degree
outflow,n. the process of flowing out
overcrowded,"v cause to crowd together too much
v crowd together too much"
overhead,"n. (nautical) the top surface of an enclosed space on a ship
n. a hard return hitting the tennis ball above your head
a. located or originating from above
r. above your head; in the sky"
overpower,v. overcome by superior force
overburden,"n. the surface soil that must be moved away to get at coal seams and mineral deposits
v. burden with too much work or responsibility
v. load with excessive weight"
overthrow,"n. the termination of a ruler or institution (especially by force)
v. cause the downfall of; of rulers"
postpone,v. hold back to a later time
postmodern,a of or relating to postmodernism
postwar,a. belonging to the period after a war
predict,v. make a prediction about; tell in advance
prewar,a. existing or belonging to a time before a war
prepay,v. pay for something before receiving it
progress,"n. the act of moving forward (as toward a goal)
n. a movement forward
v. develop in a positive way"
pronoun,n. a function word that is used in place of a noun or noun phrase
prolong,"v. lengthen in time; cause to be or last longer
v. lengthen or extend in duration or space"
pro-consul,"n. an official in a modern colony who has considerable administrative power
n. a provincial governor of consular rank in the Roman Republic and Roman Empire
n. an anthropoid ape of the genus Proconsul"
recall,"n. a request by the manufacturer of a defective product to return the product (as for replacement or repair)
n. a call to return
n. a bugle call that signals troops to return
n. the process of remembering (especially the process of recovering information by mental effort)"
resist,"v. stand up or offer resistance to somebody or something
v. withstand the force of something
v. resist immunologically the introduction of some foreign tissue or organ
v. refuse to comply"
rearrange,v. put into a new order or arrangement
reflect,"v. manifest or bring back
v. to throw or bend back (from a surface)
v. be bright by reflecting or casting light
v. show an image of"
reproduction,"n. the process of generating offspring
n. recall that is hypothesized to work by storing the original stimulus input and reproducing it during recall
n. the act of making copies
n. the sexual activity of conceiving and bearing offspring"
stepmother,n. the wife of your father by a subsequent marriage
stepchild,n. a child of your spouse by a former marriage
stepbrother,n. a brother who has only one parent in common with you
subway,"n an electric railway operating below the surface of the ground (usually in a city)
n an underground tunnel or passage enabling pedestrians to cross a road or railway"
subtropics,n. regions adjacent to the tropics
subordinate,"n. an assistant subject to the authority or control of another
v. rank or order as less important or consider of less value
v. make subordinate, dependent, or subservient
a. lower in rank or importance"
subconscious,s. just below the level of consciousness
subeditor,n. an assistant editor
superpower,n a state powerful enough to influence events throughout the world
supernutrition,none
superiority,"n. the quality of being superior
n. the quality of being at a competitive advantage
n. displaying a sense of being better than others"
supersonic,"a. (of speed) greater than the speed of sound in a given medium (especially air)
s. having frequencies above those of audible sound"
supervise,"v watch and direct
v keep tabs on; keep an eye on; keep under surveillance"
surface,"n. the outer boundary of an artifact or a material layer constituting or resembling such a boundary
n. the extended two-dimensional outer boundary of a three-dimensional object
n. the outermost level of the land or sea
n. a superficial aspect as opposed to the real nature of something"
surround,v. extend on all sides of simultaneously; encircle
surpass,v. be or do something to a greater degree
surrender,"n. the delivery of a principal into lawful custody
v. give up or agree to forgo to the power or possession of another
v. relinquish possession or control over"
transparent,s. easily understood or seen through (because of a lack of subtlety)
transfer,"n. someone who transfers or is transferred from one position to another
n. the act of transfering something from one form to another
n. a ticket that allows a passenger to change conveyances
n. application of a skill learned in one situation to a different but similar situation"
transfrontier,none
transform,"v. subject to a mathematical transformation
v. change or alter in form, appearance, or nature
v. change in outward structure or looks
v. convert (one form of energy) to another"
ultraliberal,none
ultraviolet,"n. radiation lying in the ultraviolet range; wave lengths shorter than light but longer than X rays
s. having or employing wavelengths shorter than light but longer than X-rays; lying outside the visible spectrum at its violet end"
ultrapure,none
ultracritical,none
uncertain,"a. lacking or indicating lack of confidence or assurance
a. not established beyond doubt; still undecided or unknown
a. not certain to occur; not inevitable
s. not consistent or dependable"
unfold,"v. open to the view
v. extend or stretch out to a greater or the full length
v. spread out or open from a closed or folded state"
unacceptable,"s. not adequate to give satisfaction
a. not acceptable; not welcome
s. not conforming to standard usage; `You can access your cash at any of 300 automatic tellers'"""
unpack,v. remove from its packing
underground,"n. a secret group organized to overthrow a government or occupation force
r. in or into hiding or secret operation
r. beneath the surface of the earth"
underestimate,"n. an estimation that is too low; an estimate that is less than the true or actual value
v. make too low an estimate of"
underofficer,n. A subordinate officer.
underscore,"n. a line drawn underneath (especially under written matter)
v. give extra weight to (a communication)"
underdeveloped,s. not yet fully developed
uphold,"v. stand up for; stick up for; of causes, principles, or ideals
v. support against an opponent"
uproot,"v. move (people) forcibly from their homeland into a new and foreign environment
v. destroy completely, as if down to the roots
v. pull up by or as if by the roots"
upgrade,"n. software that provides better performance than an earlier version did
n. a reservation that is improved
n. the property possessed by a slope or surface that rises
n. hardware that provides better performance than an earlier version did"
vice-president,none
vice-chairman,none
vice-manager,none
withdraw,"v. pull back or move away or backward
v. remove (a commodity) from (a supply source)"
withhold,"v. hold back; refuse to hand over or share
v. retain and refrain from disbursing; of payments"
withstand,"v resist or confront with resistance
v stand up or offer resistance to somebody or something"
dependability,n. the quality of being dependable or reliable
sensibility,"n. mental responsiveness and awareness
n. refined sensitivity to pleasurable or painful impressions"
variability,n. the quality of being subject to variation
resistibility,"n.. The quality of being resistible; resistibleness.
n.. The quality of being resistant; resitstance."
comparable,"a. able to be compared or worthy of comparison
s. conforming in every respect"
credible,"a. capable of being believed
s. (a common but incorrect usage where `credulous' would be appropriate) credulous
s. appearing to merit belief or acceptance"
desirable,"a. worth having or seeking or achieving
s. worthy of being chosen especially as a spouse"
flexible,"a. capable of being changed
a. able to flex; able to bend easily
s. bending and snapping back readily without breaking"
notably,r. especially; in particular
dishonourably,none
reasonably,r. to a moderately sufficient extent or degree
beverage,n. any liquid suitable for drinking
marriage,"n. the state of being a married couple voluntarily joined for life (or until divorce)
n. two people who are married to each other
n. the act of marrying; the nuptial ceremony
n. a close and intimate union"
advantage,"n. the quality of having a superior or more favorable position
n. (tennis) first point scored after deuce
n. benefit resulting from some event or action
v. give an advantage to"
bandage,"n. a piece of soft material that covers and protects an injured part of the body
v. dress by covering or binding"
spoilage,"n. the amount that has spoiled
n. the process of becoming spoiled"
emotional,"a. determined or actuated by emotion rather than reason
a. of more than usual emotion
a. of or pertaining to emotion"
aboriginal,"a. of or pertaining to members of the indigenous people of Australia
s. having existed from the beginning; in an earliest or original stage or state"
hospital,"n. a health facility where patients receive treatment
n. a medical institution where sick or injured people are given medical or surgical care"
exceptional,s. deviating widely from a norm of physical or mental ability; used especially of children below normal in intelligence
appraisal,"n. the classification of someone or something with respect to its worth
n. a document appraising the value of something (as for insurance or taxation)
n. an expert estimation of the quality, quantity, and other characteristics of someone or something"
republican,"n. a member of the Republican Party
n. an advocate of a republic (usually in opposition to a monarchy)
n. a tributary of the Kansas River that flows from eastern Colorado eastward through Nebraska and Kansas
a. relating to or belonging to the Republican Party"
suburban,a. relating to or characteristic of or situated in suburbs
artisan,n a skilled worker who practices some trade or handicraft
civilian,"n. a nonmilitary citizen
a. associated with civil life or performed by persons who are not active members of the military"
disturbance,"n. an unhappy and worried mental state
n. a disorderly outburst or tumult
n. the act of disturbing something or someone; setting something in motion"
vacancy,n. being unoccupied
appearance,"n. outward or visible aspect of a person or thing
n. the event of coming into sight
n. formal attendance (in court or at a hearing) of a party in an action
n. a mental representation"
compliancy,n a disposition or tendency to yield to the will of others
resistant,s. impervious to being affected
accountant,n. someone who maintains and audits business accounts
stimulant,"n. a drug that temporarily quickens some vital process
s. that stimulates"
tolerant,"a. showing respect for the rights or opinions or practices of others
s. able to tolerate environmental conditions or physiological stress
s. showing the capacity for endurance"
assistant,n. a person who contributes to the fulfillment of a need or furtherance of an effort or purpose
fascinate,"v. to render motionless, as with a fixed stare or by arousing terror or awe"
considerate,a. showing concern for the rights and feelings of others
delegate,"n. a person appointed or elected to represent others
v. transfer power to someone
v. give an assignment to (a person) to a post, or assign a task to (a person)"
accentuate,"v to stress, single out as important
v put stress on; utter with an accent"
candidate,n. someone who is considered for something (for an office or prize or honor etc.)
combination,"n. a collection of things that have been combined; an assemblage of separate parts or qualities
n. a coordinated sequence of chess moves
n. a sequence of numbers or letters that opens a combination lock
n. a group of people (often temporary) having a common purpose"
determination,"n. the act of determining the properties of something, usually by research or calculation
n. the quality of being determined to do or achieve something; firmness of purpose
n. deciding or controlling something's outcome or nature"
excitation,"n. the neural or electrical arousal of an organ or muscle or gland
n. something that agitates and arouses"
muscular,"a. of or relating to or consisting of muscle
s. having or suggesting great physical power or force"
particular,"n. a fact about some part (as opposed to general)
n. (logic) a proposition that asserts something about some (but not all) members of a class
s. unique or specific to a person or thing or category
s. separate and distinct from others of the same group or category"
spectacular,"n. a lavishly produced performance
s. characteristic of spectacles or drama"
articular,a. relating to or affecting the joints of the body
kingdom,"n. a domain in which something is dominant
n. a country with a king as head of state
n. the domain ruled by a king or queen
n. a monarchy with a king or queen as head of state"
freedom,n. the condition of being free; the power to act or speak or think without externally imposed restraints
filmdom,n. the personnel of the film industry
wisdom,"n. accumulated knowledge or erudition or enlightenment
n. the trait of utilizing knowledge and experience with common sense and insight
n. ability to apply knowledge or experience or understanding or common sense and insight
n. the quality of being prudent and sensible"
gifted,"v give qualities or abilities to
v give as a present; make a gift of
a endowed with talent or talents"
abandoned,"s. forsaken by owner or inhabitants
s. free from constraint"
