addict,"n. someone who is so ardently devoted to something that it resembles an addiction
n. someone who is physiologically dependent on a substance; abrupt deprivation of the substance produces withdrawal symptoms
v. to cause (someone or oneself) to become dependent (on something, especially a narcotic drug)"
indicate,"v. indicate a place, direction, person, or thing; either spatially or figuratively
v. to state or express briefly
v. suggest the necessity of an intervention; in medicine"
dictionary,n. a reference book containing an alphabetical list of words with information about them
dual,s. a grammatical number category referring to two items or units as opposed to one item (singular) or more than two items (plural)
dubious,s. not convinced
double,"n. a base hit on which the batter stops safely at second base
n. a stand-in for movie stars to perform dangerous stunts
n. someone who closely resembles a famous person (especially an actor)
n. a quantity that is twice as great as another"
duplicate,"n. a copy that corresponds to an original exactly
v. make or do or perform again
v. make a duplicate or duplicates of
s. identically copied from an original"
doubt,"n. the state of being unsure of something
n. uncertainty about the truth or factuality or existence of something
v. consider unlikely or have doubts about
v. lack confidence in or have doubts about"
educate,"v. give an education to
v. teach or refine to be discriminative in taste or judgment"
conduct,"v. direct the course of; manage or control
v. lead, as in the performance of a composition; Barenboim conducted the Chicago symphony for years""
v. lead musicians in the performance of"
deduce,"v. reason by deduction; establish by deduction
v. conclude by reasoning; in logic"
product,"n. an artifact that has been created by someone or some process
n. a quantity obtained by multiplication
n. a chemical substance formed as a result of a chemical reaction
n. a consequence of someone's efforts or of a particular set of circumstances"
defend,"v. argue or speak in defense of
v. be on the defensive; act against an attack
v. protect against a challenge or attack
v. be the defense counsel for someone in a trial"
offensive,"s. violating or tending to violate or offend against
a. for the purpose of attack rather than defense
a. causing anger or annoyance
a. unpleasant or disgusting especially to the senses"
offend,"v cause to feel resentment or indignation
v act in disregard of laws, rules, contracts, or promises
v strike with disgust or revulsion
v hurt the feelings of"
defense,"n. (military) military action or resources protecting a country against potential enemies
n. protection from harm
n. (sports) the team that is trying to prevent the other team from scoring"
affirm,"v. to declare or affirm solemnly and formally as true
v. say yes to"
confirm,"v. establish or strengthen as with new evidence or facts
v. strengthen or make more firm
v. make more firm
v. support a person for a position"
infirm,"s. lacking firmness of will or character or purpose; give me the daggers"" - Shakespeare"
inform,"v. impart knowledge of some fact, state or affairs, or event to
v. give character or essence to
v. act as an informer"
conform,"v. be similar, be in line with"
formation,"n. an arrangement of people or things acting as a unit
n. the act of fabricating something in a particular shape
n. a particular spatial arrangement
n. natural process that causes something to form"
formal,"a. being in accord with established forms and conventions and requirements (as e.g. of formal dress)
s. characteristic of or befitting a person in authority
a. (of spoken and written language) adhering to traditional standards of correctness and without casual, contracted, and colloquial forms
s. logically deductive"
foundation,"n. the basis on which something is grounded
n. an institution supported by an endowment
n. lowest support of a structure
n. education or instruction in the fundamentals of a field of knowledge"
fundamental,"n. any factor that could be considered important to the understanding of a particular business
n. the lowest tone of a harmonic series
s. being or involving basic facts or principles
s. far-reaching and thoroughgoing in effect especially on the nature of something"
profound,"a. showing intellectual penetration or emotional depth
s. of the greatest intensity; complete
s. coming from deep within one
s. situated at or extending to great depth; too deep to have been sounded or plumbed"
fund,"n. a reserve of money set aside for some purpose
v. convert (short-term floating debt) into long-term debt that bears fixed interest and is represented by bonds
v. place or store up in a fund for accumulation
v. provide a fund for the redemption of principal or payment of interest"
genesis,"n. a coming into being
n. the first book of the Old Testament: tells of Creation; Adam and Eve; the Fall of Man; Cain and Abel; Noah and the flood; God's covenant with Abraham; Abraham and Isaac; Jacob and Esau; Joseph and his brothers"
generate,"v. bring into existence
v. produce (energy)"
gene,n. (genetics) a segment of DNA that is involved in producing a polypeptide chain; it can include regions preceding and following the coding DNA as well as introns between the exons; it is considered a unit of heredity
generosity,"n. the trait of being willing to give your money or time
n. acting generously"
imaginable,s capable of being imagined
imaginative,s. (used of persons or artifacts) marked by independence and creativity in thought or action
image,"n. an iconic mental representation
n. (mathematics) the set of values of the dependent variable for which a function is defined
n. the general impression that something (a person or organization or product) presents to the public
v. render visible, as by means of MRI"
liberal,"n. a person who favors a political philosophy of progress and reform and the protection of civil liberties
n. a person who favors an economic theory of laissez-faire and self-regulating markets
s. having political or social views favoring reform and progress
a. tolerant of change; not bound by authoritarianism, orthodoxy, or tradition"
deliberate,s. carefully thought out in advance
illiberal,s. narrow-minded about cherished opinions
liberation,"n. the act of liberating someone or something
n. the attempt to achieve equal rights or status"
airline,"n. a hose that carries air under pressure
n. a commercial enterprise that provides scheduled flights for passengers"
headline,"n. the heading or caption of a newspaper article
v. publicize widely or highly, as if with a headline
v. provide (a newspaper page or a story) with a headline"
linear,"a. designating or involving an equation whose terms are of the first degree
a. of or in or along or relating to a line; involving a single dimension
s. (of a leaf shape) long and narrow
s. measured lengthwise"
liquor,"n. an alcoholic beverage that is distilled rather than fermented
n. a liquid substance that is a solution (or emulsion or suspension) used or obtained in an industrial process
n. the liquid in which vegetables or meat have be cooked"
liquefy,"v. become liquid
v. make (a solid substance) liquid, as by heating
v. become liquid or fluid when heated"
liquidate,"v. eliminate by paying off (debts)
v. convert into cash
v. settle the affairs of by determining the debts and applying the assets to pay them off"
literacy,n. the ability to read and write
literal,"s. without interpretation or embellishment
a. limited to the explicit meaning of a word or text
s. avoiding embellishment or exaggeration (used for emphasis)"
literature,"n. creative writing of recognized artistic value
n. the humanistic study of a body of literature
n. published writings in a particular style on a particular subject
n. the profession or art of a writer"
prolong,"v. lengthen in time; cause to be or last longer
v. lengthen or extend in duration or space"
length,"n. the linear extent in space from one end to the other; the longest dimension of something that is fixed in place
n. the property of being the extent of something from beginning to end
n. a section of something that is long and narrow"
belong,"v. be owned by; be in the possession of
v. be suitable or acceptable
v. be in the right place or situation
v. be rightly classified in a class or category"
lengthen,"v. make longer
v. become long or longer"
major,"n. a commissioned military officer in the United States Army or Air Force or Marines; below lieutenant colonel and above captain
n. British statesman who was prime minister from 1990 until 1997 (born in 1943)
n. a university student who is studying a particular field as the principal subject
n. the principal field of study of a student at a university"
majesty,n impressiveness in scale or proportion
majority,"n. the property resulting from being or relating to the greater in number of two parts; the main part
n. (elections) more than half of the votes
n. the age at which persons are considered competent to manage their own affairs"
manipulate,"v. influence or control shrewdly or deviously
v. hold something in one's hands and move it
v. control (others or oneself) or influence skillfully, usually to one's advantage
v. treat manually, as with massage, for therapeutic purposed"
manuscript,"n. the form of a literary work submitted for publication
n. handwritten book or document"
manifest,"n. a customs document listing the contents put on a ship or plane
v. record in a ship's manifest
v. reveal its presence or make an appearance"
manual,"n. a small handbook
a. of or relating to the hands
a. requiring human effort
s. doing or requiring physical work"
bookmark,n. a marker (a piece of paper or ribbon) placed between the pages of a book to mark the reader's place
demarcate,"v. separate clearly, as if by boundaries
v. set, mark, or draw the boundaries of something"
trademark,"n. a formally registered symbol identifying the manufacturer or distributor of a product
v. register the trademark of"
demarcation,"n the boundary of a specific area
n a conceptual separation or distinction"
medial,s. dividing an animal into right and left halves
amid,"prep. See Amidst.
prep. In the midst or middle of; surrounded or encompassed by;
   among."
mediate,"v. occupy an intermediate or middle position or form a connecting link or stage between two others
a. acting through or dependent on an intervening agency"
midnight,n. 12 o'clock at night; the middle of the night
amend,v. make amendments to
emend,v. make improvements or corrections to
recommend,"v. push for something
v. make attractive or acceptable"
dismount,n. the act of dismounting (a horse or bike etc.)
mountain,n. a land mass that projects well above its surroundings; higher than a hill
surmount,v. be on top of
municipal,"a. relating or belonging to or characteristic of a municipality
s. of or relating to the government of a municipality"
community,"n. a group of people living in a particular local area
n. common ownership
n. a group of nations having common interests
n. agreement as to goals"
communal,"s. for or by a group rather than individuals
a. relating to a small administrative district or community"
neglect,"n. the state of something that has been unused and neglected
v. leave undone or leave out
v. fail to attend to
v. give little or no attention to"
negative,"n. a reply of denial
n. a piece of photographic film showing an image with light and shade or colors reversed
a. characterized by or displaying negation or denial or opposition or resistance; having no positive features
a. expressing or consisting of a negation or refusal or denial"
negate,v. prove negative; show to be false
normal,"a. conforming with or constituting a norm or standard or level or type or social norm; not abnormal
a. in accordance with scientific laws
a. being approximately average or within certain limits in e.g. intelligence and development
s. forming a right angle"
abnormal,"a. not normal; not typical or usual or regular or conforming to a norm
a. departing from the normal in e.g. intelligence and development
s. much greater than the normal"
enormous,"s. extraordinarily large in size or extent or amount or power or degree; that a whole civilization should be dependent on technology""- Walter Lippman"
announce,"v. make known; make an announcement
v. announce publicly or officially
v. give the names of
v. foreshadow or presage"
pronounce,"v. speak, pronounce, or utter in a certain way
v. pronounce judgment on"
denounce,"v. speak out against
v. announce the termination of, as of treaties
v. give away information about somebody"
novelty,n. originality by virtue of being new and surprising
novel,"n. an extended fictional work in prose; usually in the form of a story
n. a printed and bound book that is an extended work of fiction
s. pleasantly new or different"
novation,n. (law) the replacement of one obligation by another by mutual agreement of both parties; usually the replacement of one of the original parties to a contract with the consent of the remaining party
operate,"v. direct or control; projects, businesses, etc.
v. handle and cause to function
v. happen"
cooperate,v work together on a common enterprise of project
operable,"a. capable of being treated by surgical operation
s. usable for a specific purpose"
adopt,"v. choose and follow; as of theories, ideas, policies, strategies or plans
v. take up and practice as one's own
v. take into one's family"
optic,"n the organ of sight
a of or relating to or resembling the eye
a relating to or using sight"
option,"n. the right to buy or sell property at an agreed price; the right is purchased and if it is not exercised by a stated date the money is forfeited
n. one of a number of things from which only one can be chosen"
optics,"n. the branch of physics that studies the physical properties of light
n. optical properties"
apartment,n. a suite of rooms usually on one floor of an apartment house
impart,"v. transmit (knowledge or skills)
v. transmit or serve as the medium for transmission"
counterpart,"n. a person or thing having the same function or characteristics as another
n. a duplicate copy"
depart,"v. leave
v. go away or leave"
compass,"n. navigational instrument for finding directions
n. the limit of capability
n. drafting instrument used for drawing circles
v. bring about; accomplish"
passage,"n. the act of passing from one state or place to the next
n. a section of text; particularly a section of medium length
n. a way through or along which someone or something may pass
n. a journey usually by ship"
surpass,v. be or do something to a greater degree
appear,"v. come into sight or view
v. be issued or published
v. seem to be true, probable, or apparent
v. come into being or existence, or appear on the scene"
disappear,"v. get lost, as without warning or explanation"
reappear,v. appear again
compel,"v. force somebody to do something
v. necessitate or exact"
expulsion,n. the act of expelling or projecting or ejecting
propel,v. cause to move forward with force
impulsive,"s. proceeding from natural feeling or impulse without external stimulus
s. without forethought"
telephone,"n. electronic equipment that converts sound into electrical signals that can be transmitted over distances and then converts received signals back into sounds
n. transmitting speech at a distance"
microphone,n. device for converting sound waves into electrical energy
symphony,n. a long and complex sonata for symphony orchestra
physical,"a. involving the body as distinguished from the mind or spirit
a. relating to the sciences dealing with matter and energy; especially physics
s. having substance or material existence; perceptible to the senses
s. according with material things or natural laws (other than those peculiar to living matter)"
physician,n a licensed medical practitioner
physicist,n. a scientist trained in physics
depict,"v show in, or as in, a picture
v give a description of
v make a portrait of"
picture,"n. a visual representation (of an object or scene or person or abstraction) produced on a surface
n. a situation treated as an observable object
n. illustrations used to decorate or explain a text
n. a typical example of some state or quality"
pictorial,"n. a periodical (magazine or newspaper) containing many pictures
a. pertaining to or consisting of pictures"
birthplace,"n. the place where someone was born
n. where something originated or was nurtured in its early existence"
displace,"v. cause to move, usually with force or pressure
v. terminate the employment of; discharge from an office or position"
replace,"v. substitute a person or thing for (another that is broken or inefficient or lost or no longer working or yielding what is expected)
v. put something back where it belongs"
implant,"n. a prosthesis placed permanently in tissue
v. fix or set securely or deeply
v. become attached to and embedded in the uterus"
supplant,v. take the place or move into the position of
transplant,"n. an operation moving an organ from one organism (the donor) to another (the recipient)
n. the act of removing something from one location and introducing it in another location
v. lift and reset in another soil or situation
v. be transplantable"
complement,"n. a word or phrase used to complete a grammatical construction
n. a complete number or quantity
n. number needed to make up a whole force
n. something added to complete or embellish or make perfect"
plenty,n. a full supply
complete,"v. come or bring to a finish or an end; others finished in over 4 hours""
v. bring to a whole, with all the necessary parts or elements
v. complete a pass
v. write all the required information onto a form"
supplement,"n. a quantity added (e.g. to make up for a deficiency)
v. add as a supplement to what seems insufficient
v. serve as a supplement to"
replete,"v fill to satisfaction
s filled to satisfaction with food or drink
s (followed by `with')deeply filled or permeated"
deport,"v behave in a certain manner
v hand over to the authorities of another country
v expel from a country"
portion,"n something determined in relation to something that includes it
n something less than the whole of a human artifact
n the allotment of some amount by dividing something
n assets belonging to or due to or contributed by an individual person or group
n your overall circumstances or condition in life (including everything that happens to you)
n money or property brought by a woman to her husband at marriage
n an individual quantity of food or drink taken as part of a meal
v give out"
import,"n. commodities (goods or services) bought from a foreign country
n. an imported person brought from a foreign country
v. bring in from abroad
v. transfer (electronic data) into a database or document"
proportion,"n. the quotient obtained when the magnitude of a part is divided by the magnitude of the whole
n. magnitude or extent
n. the relation between things (or parts of things) with respect to their comparative quantity, magnitude, or degree
n. harmonious arrangement or relation of parts or elements within a whole (as in a design)"
apprehend,v. anticipate with dread or anxiety
prehension,n the act of gripping something firmly with the hands (or the tentacles)
comprehend,"v get the meaning of something
v to become aware of through the senses
v include in scope; include as part of something broader; have as one's sphere or territory"
apprehension,"n. fearful expectation or anticipation
n. painful expectation
n. the act of apprehending (especially apprehending a criminal)"
compress,"n. a cloth pad or dressing (with or without medication) applied firmly to some part of the body (to relieve discomfort or reduce fever)
v. make more compact by or as if by pressing
v. squeeze or press together"
oppress,v. come down on or keep down by unjust use of one's authority
depress,"v. lower someone's spirits; make downhearted
v. lower (prices or markets)
v. lessen the activity or force of"
pressure,"n. the force applied to a unit area of surface; measured in pascals (SI unit) or in dynes (cgs unit)
n. a force that compels
n. the somatic sensation that results from applying force to an area of skin
n. an oppressive condition of physical or mental or social or economic distress"
primary,"n. a preliminary election where delegates or nominees are chosen
n. one of the main flight feathers projecting along the outer edge of a bird's wing
n. (astronomy) a celestial body (especially a star) relative to other objects in orbit around it
a. of first rank or importance or value; direct and immediate rather than secondary"
premier,"v. be performed for the first time
v. perform a work for the first time
s. first in rank or degree
s. preceding all others in time"
principal,"n. the original amount of a debt on which interest is calculated
n. the educator who has executive authority for a school
n. capital as contrasted with the income derived from it
n. (criminal law) any person involved in a criminal offense, regardless of whether the person profits from such involvement"
prime,"n. a number that has no factor but itself and 1
n. the second canonical hour; about 6 a.m.
n. the time of maturity when power and vigor are greatest
v. insert a primer into (a gun, mine, or charge) preparatory to detonation or firing"
prince,n. a male member of a royal family other than the sovereign (especially the son of a sovereign)
deprive,"v. take away possessions from someone
v. keep from having, keeping, or obtaining
v. take away"
privacy,"n. the quality of being secluded from the presence or view of others
n. the condition of being concealed or hidden"
privilege,"n. a special advantage or immunity or benefit not enjoyed by all
n. (law) the right to refuse to divulge information obtained in a confidential relationship
v. bestow a privilege upon"
approach,"n. ideas or actions intended to deal with a problem or situation
n. the act of drawing spatially closer to something
n. the event of one object coming closer to another
n. the temporal property of becoming nearer in time"
proximity,"n. the property of being close together
n. the region close around a person or thing
n. a Gestalt principle of organization holding that (other things being equal) objects or events that are near to one another (in space or time) are perceived as belonging together as a unit"
reproach,"n. a mild rebuke or criticism
n. disgrace or shame
v. express criticism towards"
approximate,"v. be close or similar
s. not quite exact or correct
s. very close in resemblance
s. located close together"
probable,"n. an applicant likely to be chosen
a. likely but not certain to be or become true or real
s. apparently destined"
disprove,v. prove to be false
probe,"n. an inquiry into unfamiliar or questionable activities
n. a flexible slender surgical instrument with a blunt end that is used to explore wounds or body cavities
n. an exploratory action or expedition
n. an investigation conducted using a flexible surgical instrument to explore an injury or a body cavity"
approval,"n. a feeling of liking something or someone good
n. acceptance as satisfactory
n. a message expressing a favorable opinion"
psychic,"n. a person apparently sensitive to things beyond the natural range of perception
s. affecting or influenced by the human mind
s. outside the sphere of physical science"
psychal,a. Of or pertaining to the soul; psychical.
psychology,n. the science of mental life
acquaint,v. inform
acquaintance,"n. personal knowledge or information about someone or something
n. a relationship less intimate than friendship
n. a person with whom you are acquainted"
quaintness,"n. the quality of being quaint and old-fashioned; its quaintness was appealing""
n. strangeness as a consequence of being old fashioned"
request,"n. a formal message requesting something that is submitted to an authority
n. the verbal act of requesting
v. express the need or desire for; ask for
v. ask (a person) to do something"
acquire,"v. locate (a moving entity) by means of a tracking system such as radar
v. win something through one's efforts"
requisite,"n anything indispensable
s necessary for relief or supply"
query,"n an instance of questioning
v pose a question"
require,"v require as useful, just, or proper
v consider obligatory; request and expect
v make someone do something
v have need of"
conquer,v. overcome by conquest
misquote,v. quote incorrectly
quota,"n. a prescribed number
n. a proportional share assigned to each participant
n. a limitation on imports"
quotative,none
quote,"v. repeat a passage from
v. name the price of
v. refer to for illustration or proof
v. put quote marks around"
radial,"n. pneumatic tire that has radial-ply casing
a. relating to or near the radius
a. relating to or moving along or having the direction of a radius"
radiant,s radiating or as if radiating light
radiation,"n. energy that is radiated or transmitted in the form of rays or waves or particles
n. the act of spreading outward from a central source
n. the spontaneous emission of a stream of particles or electromagnetic rays in nuclear decay
n. the spread of a group of organisms into new habitats"
range,"n. the limits within which something can be effective
n. a large tract of grassy open land on which livestock can graze
n. a series of hills or mountains
n. a place for shooting (firing or driving) projectiles of various kinds"
arrange,"v. put into a proper or systematic order
v. make arrangements for
v. adapt for performance in a different way
v. arrange thoughts, ideas, temporal events"
rearrange,v. put into a new order or arrangement
arrangement,"n. an orderly grouping (of things or persons) considered as a unit; the result of arranging
n. an organized structure for arranging or classifying
n. the act of arranging and adapting a piece of music"
