arrest,n. the state of inactivity following an interruption
restless,"s. worried and uneasy
s. ceaselessly in motion
a. lacking or not affording physical or mental rest"
restlessly,r. in a restless manner
rude,"s socially incorrect in behavior
s (of persons) lacking in refinement or grace
a lacking civility or good manners
s (used especially of commodities) being unprocessed or manufactured using only simple or minimal processes
s belonging to an early stage of technical development; characterized by simplicity and (often) crudeness"
rudiment,"n. the elementary stages of any subject (usually plural)
n. the remains of a body part that was functional at an earlier stage of life"
erudite,s. having or showing profound knowledge
corrupt,"v. corrupt morally or by intemperance or sensuality
v. alter from the original
a. lacking in integrity
s. containing errors or alterations"
interrupt,"n. a signal that temporarily stops the execution of a program so that another procedure can be carried out
v. make a break in
v. destroy the peace or tranquility of
v. interfere in someone else's activity"
bankrupt,"n. someone who has insufficient assets to cover their debts
v. reduce to bankruptcy
s. financially ruined"
insane,a. afflicted with or characteristic of mental derangement
sanitation,"n. the state of being clean and conducive to health
n. making something sanitary (free of germs) as by sterilizing"
sanity,n. normal or sound powers of mind
sanitary,a. free from filth and pathogens
scope,"n. an area in which something acts or operates or has power or control: ""the range of a supersonic jet"""
telescope,"n. a magnifier of images of distant objects
v. crush together or collapse
v. make smaller or shorter"
horoscope,"n. a prediction of someone's future based on the relative positions of the planets
n. a diagram of the positions of the planets and signs of the zodiac at a particular time and place"
microscope,n. magnifier of the image of small objects
describe,v. give a description of
manuscript,"n. the form of a literary work submitted for publication
n. handwritten book or document"
inscribe,"v. draw within a figure so as to touch in as many places as possible
v. write, engrave, or print as a lasting record
v. address, (a work of literature) in a style less formal than a dedication"
postscript,n. a note appended to a letter after the signature
section,"n. a self-contained part of a larger composition (written or musical)
n. a very thin slice (of tissue or mineral or other substance) for examination under a microscope
n. a distinct region or subdivision of a territorial or political area or community or group of people
n. one of several parts or pieces that fit with others to constitute a whole object"
segment,"n. one of the parts into which something naturally divides
v. divide into segments
v. divide or split up"
intersect,v. meet at a point
segmentation,"n (embryology) the repeated division of a fertilised ovum
n the act of dividing or partitioning; separation by the creation of a boundary that divides or keeps apart"
sensible,"a. able to feel or perceive
s. readily perceived by the senses
s. aware intuitively or intellectually of something sensed"
consent,n. permission to do something
sense,"n. a general conscious awareness
n. the meaning of a word or expression; the way in which a word or expression or situation can be interpreted
n. the faculty through which the external world is apprehended
n. a natural appreciation or ability"
resent,v. feel bitter or indignant about
servant,n. a person working in the service of another (especially in the household)
conserve,"n. fruit preserved by cooking with sugar
v. keep constant through physical or chemical reactions or evolutionary change
v. keep in safety and protect from harm, decay, loss, or destruction
v. use cautiously and frugally"
observe,"v. watch attentively
v. behave as expected during of holidays or rites
v. stick to correctly or closely
v. conform one's action or practice to"
service,"n. work done by one person or group that benefits another
n. an act of help or assistance
n. the act of public worship following prescribed rules
n. a company or agency that performs a public service; subject to government regulation"
inset,"n. a small picture inserted within the bounds or a larger one
v. set or place in"
settle,"n. a long wooden bench with a back
v. settle into a position, usually on a surface or ground
v. settle conclusively; come to terms
v. take up residence and become established"
upset,"n. the act of disturbing the mind or body
n. a tool used to thicken or spread metal (the end of a bar or a rivet etc.) by forging or hammering or swaging
n. the act of upsetting something
v. disturb the balance or stability of"
signal,"n. any nonverbal action or gesture that encodes a message
n. any incitement to action
n. an electric quantity (voltage or current or field strength) whose modulation represents coded information about the source from which it comes
s. notably out of the ordinary"
assign,"v. give out
v. select something or someone for a specific purpose
v. transfer one's right to
v. decide as to where something belongs in a scheme"
design,"n. the act of working out the form of something (as by making a sketch or outline or plan)
n. an arrangement scheme
n. a decorative or artistic work
n. a preliminary sketch indicating the plan for something"
similar,"a. marked by correspondence or resemblance
s. (of words) expressing closely related meanings"
simulate,v. make a pretence of
resemble,v. appear like; be similar or bear a likeness to
simultaneous,s occurring or operating at the same time
assemble,"v. create by putting components or members together
v. get people together"
insist,"v. be emphatic or resolute and refuse to budge
v. assert to be true"
persist,v. stay behind
resist,"v. stand up or offer resistance to somebody or something
v. withstand the force of something
v. resist immunologically the introduction of some foreign tissue or organ
v. refuse to comply"
social,"a. relating to human society and its members
a. living together or enjoying life in communities or organized groups
a. relating to or belonging to or characteristic of high society
s. composed of sociable people or formed for the purpose of sociability"
society,"n. an extended social group having a distinctive cultural and economic organization
n. the fashionable elite"
associate,"n. a person who joins with others in some activity or endeavor
n. a person with subordinate membership in a society, institution, or commercial enterprise
n. any event that usually accompanies or is closely connected with another
v. make a logical or causal connection"
solitary,"n confinement of a prisoner in isolation from other prisoners
n one who lives in solitude
s characterized by or preferring solitude
s of plants and animals; not growing or living in groups or colonies
s lacking companions or companionship
s being the only one; single and isolated from others
s devoid of creatures"
solar,a. relating to or derived from the sun or utilizing the energies of the sun
console,"n. a scientific instrument consisting of displays and an input device that an operator can use to monitor and control a system (especially a computer system)
n. an ornamental scroll-shaped bracket (especially one used to support a wall fixture)"
parasol,n. a handheld collapsible source of shade
specious,s. plausible but false
special,"n. a special offering (usually temporary and at a reduced price) that is featured in advertising
n. a dish or meal given prominence in e.g. a restaurant
n. a television production that features a particular person or work or topic
s. for a special service or occasion"
species,"n. (biology) taxonomic group whose members can interbreed
n. a specific kind of something"
specimen,"n. an example regarded as typical of its class
n. a bit of tissue or blood or urine that is taken for diagnostic purposes"
aspect,"n. a distinct feature or element in a problem
n. a characteristic to be considered
n. the beginning or duration or completion or repetition of the action of a verb"
suspicion,"n. the state of being suspected
n. being of a suspicious nature"
speculate,"v. to believe especially on uncertain or tentative grounds
v. talk over conjecturally, or review in an idle or casual way and with an element of doubt or without sufficient reason to reach a conclusion
v. invest at a risk"
spectacle,"n. something or someone seen (especially a notable or unusual sight)
n. an elaborate and remarkable display on a lavish scale
n. a blunder that makes you look ridiculous; used in the phrase `make a spectacle of' yourself"
despicable,s. morally reprehensible
sphere,"n. a particular environment or walk of life
n. any spherically shaped artifact
n. the geographical area in which one nation is very influential
n. a solid figure bounded by a spherical surface (including the space it encloses)"
atmosphere,"n. a particular environment or surrounding influence
n. the mass of air surrounding the Earth
n. the weather or climate at some place
n. the envelope of gases surrounding any celestial body"
biosphere,n. the regions of the surface and atmosphere of the Earth (or other planet) where living organisms exist
inspire,"v. heighten or intensify
v. supply the inspiration for"
spirit,"n. the vital principle or animating force within living things
n. the general atmosphere of a place or situation and the effect that it has on people
n. a fundamental emotional and activating principle determining one's character
n. any incorporeal supernatural being that can become visible (or audible) to human beings"
aspire,v have an ambitious plan or a lofty goal
respond,v. respond favorably or as hoped
responsible,"a. worthy of or requiring responsibility or trust; or held accountable
s. being the agent or cause"
despond,v. lose confidence or hope; become dejected
response,"n. a result
n. a phrase recited or sung by the congregation following a versicle by the priest or minister
n. the manner in which an electrical or mechanical device responds to an input signal or a range of input signals"
stable,"n. a farm building for housing horses or other livestock
v. shelter in a stable
a. resistant to change of position or condition
s. firm and dependable; subject to little fluctuation"
instance,"n an occurrence of something
n an item of information that is typical of a class or group
v clarify by giving an example of"
constant,"n. a quantity that does not vary
n. a number representing a quantity assumed to have a fixed value in a specified mathematical context
a. steadfast in purpose or devotion or affection"
static,"n. a crackling or hissing noise caused by electrical interference
n. angry criticism
s. showing little if any change"
circumstance,"n. a condition that accompanies or influences some event or activity
n. information that should be kept in mind when making a decision
n. formal ceremony about important occasions"
status,n. the relative position or standing of things or especially persons in a society
install,"v. set up for use
v. put into an office or a position
v. place"
forestall,"v keep from happening or arising; make impossible
v act in advance of; deal with ahead of time"
installment,"n. a payment of part of a debt; usually paid at regular intervals
n. a part of a published serial"
constrain,"v hold back
v restrict"
constrict,v. become tight or as if tight
stringent,s demanding strict attention to rules and procedures
distrain,"v. levy a distress on
v. confiscate by distress
v. legally take something in place of a debt payment"
restrict,"v. place restrictions on
v. place under restrictions; limit access to
v. place limits on (extent or access)"
construct,"v. make by combining materials and parts
v. draw with suitable instruments and under specified conditions
v. create by linking linguistic units
v. create by organizing and linking ideas, arguments, or concepts"
instruct,"v. give instructions or directions for some task
v. make aware of"
obstruct,"v. hinder or prevent the progress or accomplishment of
v. block passage through
v. shut out from view or get in the way so as to hide from sight"
assume,"v. take to be the case or to be true; accept without verification or proof
v. take on titles, offices, duties, responsibilities
v. take on a certain form, attribute, or aspect
v. occupy or take on"
assumption,"n. a hypothesis that is taken for granted
n. the act of taking possession of or power over something
n. celebration in the Roman Catholic Church of the Virgin Mary's being taken up into heaven when her earthly life ended; corresponds to the Dormition in the Eastern Orthodox Church
n. (Christianity) the taking up of the body and soul of the Virgin Mary when her earthly life had ended"
consume,"v. serve oneself to, or consume regularly
v. spend extravagantly
v. destroy completely
v. use up (resources or materials)"
resumption,n. beginning again
summarise,"v be a summary of
v give a summary (of)"
summit,"n. a meeting of heads of governments
v. reach the summit (of a mountain)"
consummate,"v. fulfill sexually
v. make perfect; bring to perfection
s. having or revealing supreme mastery or skill"
assure,"v. inform positively and with certainty and confidence
v. assure somebody of the truth of something with the intention of giving the listener confidence"
insure,v. take out insurance for
reassure,"v. cause to feel sure; give reassurance to
v. give or restore confidence in; cause to feel sure or certain"
surety,n. something clearly established
detail,"n. an isolated fact that is considered separately from the whole
n. a small part that can be considered separately from the whole
n. extended treatment of particulars
n. a crew of workers selected for a particular task"
tailor,"n. a person whose occupation is making and altering garments
v. adjust to a specific need or market"
curtail,"v place restrictions on
v terminate or abbreviate before its intended or proper end or its full extent"
attain,"v to gain with effort
v reach a point in time, or a certain state or level
v find unexpectedly
v reach a destination, either real or abstract"
content,"n. everything that is included in a collection and that is held or included in something
n. the proportion of a substance that is contained in a mixture or alloy etc.
n. the sum or range of what has been perceived, discovered, or learned
v. satisfy in a limited way"
continue,"v. continue a certain state, condition, or activity
v. continue talking
v. keep or maintain in unaltered condition; cause to remain or last
v. do something repeatedly and showing no intention to stop"
contain,"v. be divisible by
v. be capable of holding or containing"
tenure,"n. the term during which some position is held
n. the right to hold property; part of an ancient hierarchical system of holding lands
v. give life-time employment to"
technical,"n. a pickup truck with a gun mounted on it
a. of or relating to technique or proficiency in a practical skill
a. characterizing or showing skill in or specialized knowledge of applied arts and sciences
a. of or relating to a practical subject that is organized according to scientific principles"
technique,n. a practical method or art applied to some particular task
technician,"n. someone whose occupation involves training in a specific technical process
n. someone known for high skill in some intellectual or artistic technique"
protect,"v. shield from danger, injury, destruction, or damage
v. use tariffs to favor domestic industry"
detect,"v. discover or determine the existence, presence, or fact of"
protection,"n. the activity of protecting someone or something
n. the condition of being protected
n. the imposition of duties or quotas on imports in order to protect domestic industry against foreign competition
n. payment extorted by gangsters on threat of violence"
telegram,n. a message transmitted by telegraph
telephone,"n. electronic equipment that converts sound into electrical signals that can be transmitted over distances and then converts received signals back into sounds
n. transmitting speech at a distance"
telescope,"n. a magnifier of images of distant objects
v. crush together or collapse
v. make smaller or shorter"
temperament,"n. excessive emotionalism or irritability and excitability (especially when displayed openly)
n. an adjustment of the intervals (as in tuning a keyboard instrument) so that the scale can be used to play in different keys"
temporary,"n a worker (especially in an office) hired on a temporary basis
a not permanent; not lasting
s lacking continuity or regularity"
temper,"n. a characteristic (habitual or relatively temporary) state of feeling
n. a disposition to exhibit uncontrolled anger
n. the elasticity and hardness of a metal object; its ability to absorb considerable energy before cracking
v. harden by reheating and cooling in oil"
contemporary,"n. a person of nearly the same age as another
s. characteristic of the present
s. belonging to the present time"
contest,"n. an occasion on which a winner is selected from among two or more contestants
n. a struggle between rivals
v. to make the subject of dispute, contention, or litigation"
protest,"n. a formal and solemn declaration of objection
n. the act of protesting; a public (often organized) manifestation of dissent
n. the act of making a strong public expression of disagreement and disapproval
v. utter words of protest"
testify,"v. give testimony in a court of law
v. provide evidence for"
thermal,"n. rising current of warm air
a. relating to or associated with heat
a. of or relating to a hot spring
s. caused by or designed to retain heat"
thermos,n. vacuum flask that preserves temperature of hot or cold drinks
thermometer,n. measuring instrument for measuring temperature
tolerant,"a. showing respect for the rights or opinions or practices of others
s. able to tolerate environmental conditions or physiological stress
s. showing the capacity for endurance"
tolerable,a. capable of being borne or endured
intolerant,a. unwilling to tolerate difference of opinion
touching,"n the event of something coming in contact with the body
n the act of putting two things together with no space between them
v make physical contact with, come in contact with
v perceive via the tactile sense
v affect emotionally
v be relevant to
v be in direct physical contact with; make contact
v have an effect upon
v deal with; usually used with a form of negation
v cause to be in brief contact with
v to extend as far as
v be equal to in quality or ability
v tamper with
v make a more or less disguised reference to
v comprehend
v consume
v color lightly
s arousing affect"
touched,a. having come into contact
retouch,v. give retouches to (hair)
abstract,"v. consider a concept without thinking of a specific example; consider abstractly or theoretically
v. consider apart from a particular case or instance
v. give an abstract (of)
a. existing only in the mind; separated from embodiment"
attract,"v. direct toward itself or oneself by means of some psychological power or physical attributes
v. be attractive to
v. exert a force on (a body) causing it to approach or prevent it from moving away"
contract,"n. a binding agreement between two or more persons that is enforceable by law
n. (contract bridge) the highest bid becomes the contract setting the number of tricks that the bidder must make
n. a variety of bridge in which the bidder receives points toward game only for the number of tricks he bid
v. enter into a contractual arrangement"
treaty,n. a written agreement between two states or sovereigns
treatment,"n. care provided to improve a situation (especially medical procedures or applications that are intended to relieve illness or injury)
n. the management of someone or something
n. a manner of dealing with something artistically"
retreat,"n. (military) withdrawal of troops to a more favorable position to escape the enemy's superior forces or after a defeat
n. a place of privacy; a place affording peace and quiet
n. (military) a signal to begin a withdrawal from a dangerous position
n. (military) a bugle call signaling the lowering of the flag at sunset"
suburb,n. a residential district located on the outskirts of a city
urban,"a. relating to or concerned with a city or densely populated area
a. located in or characteristic of a city or city life"
exurban,none
evaluate,v. form a critical opinion of
valour,n the qualities of a hero or heroine; exceptional or heroic courage when facing danger (especially in battle)
valid,"a. well grounded in logic or truth or having legal force
s. still legally acceptable"
avail,"n. a means of serving
v. use to one's advantage
v. be of use to, be useful to
v. take or use"
inverse,"n. something inverted in sequence or character or effect
s. reversed (turned backward) in order or nature or effect
a. opposite in nature or effect or relation to another quantity"
convert,"n. a person who has been converted to another religious or political belief
v. change from one system to another or to a new plan or policy
v. change the nature, purpose, or function of something
v. change religious beliefs, or adopt a religious belief"
diversify,"v. make (more) diverse
v. spread into new habitats and produce variety or variegate
v. vary in order to spread risk or to expand"
avert,v. turn away or aside
advise,v. inform (somebody) of something
divide,"n. a serious disagreement between two groups of people (typically producing tension or hostility)
v. separate into parts or portions
v. perform a division"
devise,"n. a will disposing of real property
n. (law) a gift of real property by will
v. give by will, especially real property"
evident,"s clearly revealed to the mind or the senses or judgment
s capable of being seen or noticed"
revive,"v. be brought back to life, consciousness, or strength
v. restore from a depressed, inactive, or unused state"
vital,"s. performing an essential function in the living body
s. manifesting or characteristic of life"
vigour,"n forceful exertion
n active strength of body or mind
n an imaginative lively style (especially style of writing)"
vivid,s. having the clarity and freshness of immediate experience
vitamin,n. any of a group of organic substances essential in small quantities to normal metabolism
benevolence,"n. disposition to do good
n. an inclination to do kind or charitable acts
n. an act intending or showing kindness and good will"
voluntary,"n. composition (often improvised) for a solo instrument (especially solo organ) and not a regular part of a religious service or musical performance
a. of your own free will or design; done by choice; not forced or compelled
a. controlled by individual volition"
volition,"n. the capability of conscious choice and decision and intention
n. the act of making a choice"
volunteer,"n. (military) a person who freely enlists for service
n. a person who performs voluntary work
v. tell voluntarily
v. agree freely"
