exposure,"n. vulnerability to the elements; to the action of heat or cold or wind or rain; 
n. the act of subjecting someone to an influencing experience
n. the disclosure of something secret
n. aspect resulting from the direction a building or window faces"
impose,"v compel to behave in a certain way
v impose something unpleasant
v impose and collect"
posture,"n the arrangement of the body and its limbs
n characteristic way of bearing one's body
n a rationalized mental attitude
n capability in terms of personnel and materiel that affect the capacity to fight a war
v behave affectedly or unnaturally in order to impress others
v assume a posture as for artistic purposes"
propose,"v. make a proposal, declare a plan for something
v. ask (someone) to marry you"
proposition,"n. (logic) a statement that affirms or denies something and is either true or false
n. an offer for a private bargain (especially a request for sexual favors)
n. a task to be dealt with
v. suggest sex to"
proposal,"n. something proposed (such as a plan or assumption)
n. the act of making a proposal"
symposium,n. a meeting or conference for the public discussion of some topic especially one in which the participants form an audience and make presentations
postulate,"n. (logic) a proposition that is accepted as true in order to provide a basis for logical reasoning
v. take as a given; assume as a postulate or axiom"
appraisal,"n. the classification of someone or something with respect to its worth
n. a document appraising the value of something (as for insurance or taxation)
n. an expert estimation of the quality, quantity, and other characteristics of someone or something"
appreciable,s. enough to be estimated or measured
appreciably,r. to a noticeable degree
appreciation,"n. understanding of the nature or meaning or quality or magnitude of something
n. an expression of gratitude
n. an increase in price or value"
pregnant,a. carrying developing offspring within the body or being about to produce new life
pregnancy,n. the state of being pregnant; the period from conception to birth when a woman carries a developing fetus in her uterus
comprehend,"v get the meaning of something
v to become aware of through the senses
v include in scope; include as part of something broader; have as one's sphere or territory"
comprehension,n. an ability to understand the meaning or importance of something (or the knowledge acquired as a result)
comprehensive,"a. including all or everything
s. broad in scope"
compression,"n. the process or result of becoming smaller or pressed together
n. encoding information while reducing the bandwidth or bits required
n. applying pressure"
depression,"n. a mental state characterized by a pessimistic sense of inadequacy and a despondent lack of activity
n. a long-term economic state characterized by unemployment and low prices and low levels of trade and investment
n. sad feelings of gloom and inadequacy
n. a period during the 1930s when there was a worldwide economic depression and mass unemployment"
oppress,v. come down on or keep down by unjust use of one's authority
oppression,"n. the act of subjugating by cruelty
n. the state of being kept down by unjust use of force or authority: ""after years of oppression they finally revolted""
n. a feeling of being oppressed"
repression,"n. a state of forcible subjugation
n. (psychiatry) the classical defense mechanism that protects you from impulses or ideas that would cause anxiety by preventing them from becoming conscious
n. the act of repressing; control by holding down"
suppress,"v. to put down by force or authority
v. put out of one's consciousness
v. reduce the incidence or severity of or stop"
interpret,"v. make sense of; assign a meaning to
v. give an interpretation or rendition of"
primitive,"n. a person who belongs to an early stage of civilization
n. a mathematical expression from which another expression is derived
n. a word serving as the basis for inflected or derived forms
s. used of preliterate or tribal or nonindustrial societies"
priority,n. preceding in time
enterprise,"n. a purposeful or industrious undertaking (especially one that requires effort or boldness)
n. an organization created for business ventures
n. readiness to embark on bold new ventures"
enterprising,"a. marked by imagination, initiative, and readiness to undertake new projects"
deprive,"v. take away possessions from someone
v. keep from having, keeping, or obtaining
v. take away"
privacy,"n. the quality of being secluded from the presence or view of others
n. the condition of being concealed or hidden"
approach,"n. ideas or actions intended to deal with a problem or situation
n. the act of drawing spatially closer to something
n. the event of one object coming closer to another
n. the temporal property of becoming nearer in time"
approachable,"a. easy to meet or converse or do business with
s. easily approached"
reproach,"n. a mild rebuke or criticism
n. disgrace or shame
v. express criticism towards"
probability,"n. a measure of how likely it is that some event will occur; a number expressing the ratio of favorable cases to the whole number of cases possible
n. the quality of being probable; a probable event or the most probable event"
probe,"n. an inquiry into unfamiliar or questionable activities
n. a flexible slender surgical instrument with a blunt end that is used to explore wounds or body cavities
n. an exploratory action or expedition
n. an investigation conducted using a flexible surgical instrument to explore an injury or a body cavity"
improper,"a. not suitable or right or appropriate
s. not conforming to legality, moral law, or social convention
s. not appropriate for a purpose or occasion"
proton,n. a stable particle with positive charge equal to the negative charge of an electron
prototype,n. a standard or typical example
prototypical,s representing or constituting an original type after which other similar things are patterned
proximity,"n. the property of being close together
n. the region close around a person or thing
n. a Gestalt principle of organization holding that (other things being equal) objects or events that are near to one another (in space or time) are perceived as belonging together as a unit"
psychiatrist,n. a physician who specializes in psychiatry
psychology,n. the science of mental life
psychological,"s. mental or emotional as opposed to physical in nature
a. of or relating to or determined by psychology"
purify,"v. remove impurities from, increase the concentration of, and separate through the process of distillation
v. make pure or free from sin or guilt
v. become clean or pure or free of guilt and sin"
purity,"n. being undiluted or unmixed with extraneous material
n. the state of being unsullied by sin or moral wrong; lacking a knowledge of evil"
impurity,"n. worthless or dangerous material that should be removed
n. the condition of being impure"
compute,v make a mathematical calculation or computation
acquaint,v. inform
acquaintance,"n. personal knowledge or information about someone or something
n. a relationship less intimate than friendship
n. a person with whom you are acquainted"
quantify,"v. use as a quantifier
v. express as a number or measure or quantity"
quantitative,"a. expressible as a quantity or relating to or susceptible of measurement
a. relating to the measurement of quantity
a. (of verse) having a metric system based on relative duration of syllables"
conqueror,n. someone who is victorious by force of arms
exquisite,"s. intense or sharp
s. lavishly elegant and refined
s. of extreme beauty"
query,"n an instance of questioning
v pose a question"
quest,"n. the act of searching for something
v. make a search (for)
v. search the trail of (game)
v. seek alms, as for religious purposes"
questionnaire,n. a form containing a set of questions; submitted to people to gain statistical information
requisite,"n anything indispensable
s necessary for relief or supply"
quota,"n. a prescribed number
n. a proportional share assigned to each participant
n. a limitation on imports"
radial,"n. pneumatic tire that has radial-ply casing
a. relating to or near the radius
a. relating to or moving along or having the direction of a radius"
radiant,s radiating or as if radiating light
radiate,"v. send out rays or waves
v. send out real or metaphoric rays
v. extend or spread outward from a center or focus or inward towards a center
v. cause to be seen by emitting light as if in rays"
radical,"n. a person who has radical ideas or opinions
n. (mathematics) a quantity expressed as the root of another quantity
n. a character conveying the lexical meaning of a logogram
s. arising from or going to the root or source"
radicalism,n. the political orientation of those who favor revolutionary change in government and society
outrage,n. a wantonly cruel act
outrageous,"s grossly offensive to decency or morality; causing horror
s greatly exceeding bounds of reason or moderation"
rapture,"n a state of being carried away by overwhelming emotion
n a state of elated bliss"
enrapture,v hold spellbound
erase,"v. remove from memory or existence
v. remove by or as if by rubbing or erasing
v. wipe out digitally or magnetically recorded information"
rational,"a. consistent with or based on or using reason
a. capable of being expressed as a quotient of integers
s. having its source in or being guided by the intellect (as distinguished from experience or emotion)"
rationality,"n. the state of having good sense and sound judgment
n. the quality of being consistent with or based on logic"
directory,"n. an alphabetical list of names and addresses
n. (computer science) a listing of the files stored in memory (usually on a hard disk)"
erect,a. upright in position or posture
erection,"n. an erect penis
n. a structure that has been erected"
rectify,"v. math: determine the length of
v. set straight or right
v. convert into direct current"
rectification,"n. (chemistry) the process of refinement or purification of a substance by distillation
n. the conversion of alternating current to direct current
n. determination of the length of a curve; finding a straight line equal in length to a given curve"
regime,"n the organization that is the governing authority of a political unit
n (medicine) a systematic plan for therapy (often including diet)"
regiment,"n. army unit smaller than a division
v. subject to rigid discipline, order, and systematization
v. form (military personnel) into a regiment
v. assign to a regiment"
correlate,"n. either of two or more related or complementary variables
v. to bear a reciprocal or mutual relation
v. bring into a mutual, complementary, or reciprocal relation"
correlation,"n. a reciprocal relation between two or more things
n. a statistical relation between two or more variables such that systematic changes in the value of one variable are accompanied by systematic changes in the other"
reptile,"n. any cold-blooded vertebrate of the class Reptilia including tortoises, turtles, snakes, lizards, alligators, crocodiles, and extinct forms"
ridicule,"n. language or behavior intended to mock or humiliate
v. subject to laughter or ridicule"
ridiculous,"s inspiring scornful pity
s incongruous; inviting ridicule
s broadly or extravagantly humorous; resembling farce"
irrigation,"n. supplying dry land with water by means of ditches etc
n. (medicine) cleaning a wound or body organ by flushing or washing out with water or a medicated solution"
irritate,"v. excite to an abnormal condition, or chafe or inflame
v. excite to some characteristic action or condition, such as motion, contraction, or nervous impulse, by the application of a stimulus"
irritation,"n. the psychological state of being irritated or annoyed
n. (pathology) abnormal sensitivity to stimulation"
rivalry,n the act of competing as for profit or a prize
wardrobe,"n. a tall piece of furniture that provides storage space for clothes; has a door and rails or hooks for hanging clothes
n. collection of clothing belonging to one person
n. collection of costumes belonging to a theatrical company"
robust,"a. sturdy and strong in form, constitution, or construction
s. strong enough to withstand or overcome intellectual challenges or adversity
s. rough and crude"
robustly,r. in a robust manner
corrode,"v. cause to deteriorate due to the action of water, air, or an acid
v. become destroyed by water, air, or a corrosive such as an acid"
corrosion,"n. a state of deterioration in metals caused by oxidation or chemical action
n. erosion by chemical action"
corrosive,"n. a substance having the tendency to cause corrosion (such a strong acids or alkali)
s. spitefully sarcastic"
erosion,"n. (geology) the mechanical process of wearing or grinding something down (as by particles washing over it)
n. condition in which the earth's surface is worn away by the action of water and wind
n. a gradual decline of something"
arrogant,s. having or showing feelings of unwarranted importance out of overbearing pride
arrogance,n. overbearing pride evidenced by a superior manner toward inferiors
romance,"n. the group of languages derived from Latin
n. a novel dealing with idealized events remote from everyday life
v. have a love affair with
v. tell romantic or exaggerated lies"
romantic,"n. a soulful or amorous idealist
a. belonging to or characteristic of Romanticism or the Romantic Movement in the arts"
romanticism,"n. impractical romantic ideals and attitudes
n. a movement in literature and art during the late 18th and early 19th centuries that celebrated nature rather than civilization
n. an exciting and mysterious quality (as of a heroic time or adventure)"
rotary,a. relating to or characterized by rotation
rotate,"v. exchange on a regular basis
v. perform a job or duty on a rotating basis
v. cause to turn on an axis or center"
rotation,"n. the act of rotating as if on an axis
n. (mathematics) a transformation in which the coordinate axes are rotated by a fixed angle about the origin
n. a single complete turn (axial or orbital)"
routine,"n. an unvarying or habitual method or procedure
n. a set sequence of steps, part of larger computer program"
abrupt,"s. marked by sudden changes in subject and sharp transitions
s. exceedingly sudden and unexpected
s. extremely steep
s. surprisingly and unceremoniously brusque in manner"
bankrupt,"n. someone who has insufficient assets to cover their debts
v. reduce to bankruptcy
s. financially ruined"
bankruptcy,"n. a state of complete lack of some abstract property
n. inability to discharge all your debts as they come due
n. a legal process intended to insure equality among the creditors of a corporation declared to be insolvent"
corrupt,"v. corrupt morally or by intemperance or sensuality
v. alter from the original
a. lacking in integrity
s. containing errors or alterations"
corruption,"n. decay of matter (as by rot or oxidation)
n. moral perversion; impairment of virtue and moral principles
n. destroying someone's (or some group's) honesty or loyalty; undermining moral integrity
n. inducement (as of a public official) by improper means (as bribery) to violate duty (as by commiting a felony)"
disrupt,v. throw into disorder
disruption,n. the act of causing disorder
erupt,"v. start abruptly
v. erupt or intensify suddenly
v. start to burn or burst into flames
v. break out"
eruption,"n. symptom consisting of a breaking out and becoming visible
n. (of volcanos) pouring out fumes or lava (or a deposit so formed)
n. the emergence of a tooth as it breaks through the gum"
rupture,"n. state of being torn or burst open
n. a personal or social separation (as between opposing factions)
n. the act of making a sudden noisy break"
sacred,"a. concerned with religion or religious purposes
s. worthy of respect or dedication
s. (often followed by `to') devoted exclusively to a single use or purpose or person"
salvage,"n. property or goods saved from damage or destruction
n. the act of saving goods or property that were in danger of damage or destruction
n. the act of rescuing a ship or its crew or its cargo from a shipwreck or a fire
v. save from ruin, destruction, or harm"
salvation,"n. a means of preserving from harm or unpleasantness
n. the state of being saved or preserved from harm
n. saving someone or something from harm or from an unpleasant situation"
insane,a. afflicted with or characteristic of mental derangement
insanity,n. relatively permanent disorder of the mind
satisfaction,"n. the contentment one feels when one has fulfilled a desire, need, or expectation
n. (law) the payment of a debt or fulfillment of an obligation
n. act of fulfilling a desire or need or appetite"
dissatisfaction,n. the feeling of being displeased and discontent
dissatisfy,v. fail to satisfy
satisfactorily,r. in a satisfactory manner
satisfactory,"a. giving satisfaction
s. meeting requirements"
saturate,"v. cause (a chemical compound, vapour, solution, magnetic material) to unite with the greatest possible amount of another substance"
ascend,"v. travel up, ""We ascended the mountain""
v. go back in order of genealogical succession
v. become king or queen
v. appear to be moving upward, as by means of tendrils"
descendant,"n. a person considered as descended from some ancestor or race
s. going or coming down
s. proceeding by descent from an ancestor"
descent,"n. a movement downward
n. the act of changing your location in a downward direction
n. the kinship relation between an individual and the individual's progenitors
n. a downward slope or bend"
transcend,"v be greater in scope or size than some standard
v be superior or better than some standard"
transcendent,"s. exceeding or surpassing usual limits especially in excellence
s. beyond and outside the ordinary range of human experience or understanding"
conscientious,"s. characterized by extreme care and great effort
a. guided by or in accordance with conscience or sense of right and wrong"
conscientiousness,"n. the quality of being in accord with the dictates of conscience
n. the trait of being painstaking and careful"
consciousness,n. an alert cognitive state in which you are aware of yourself and your situation
escort,"n. the act of accompanying someone or something in order to protect them
n. an attendant who is employed to accompany someone
v. accompany as an escort"
ascribe,v attribute or credit to
postscript,n. a note appended to a letter after the signature
prescription,"n. directions prescribed beforehand; the action of prescribing authoritative rules or directions
n. written instructions for an optician on the lenses for a given person
n. written instructions from a physician or dentist to a druggist concerning the form and dosage of a drug to be issued to a given patient
a. available only with a doctor's written prescription"
scripture,n. any writing that is regarded as sacred by a religious group
subscribe,"v. offer to buy, as of stocks and shares
v. adopt as a belief
v. receive or obtain regularly"
subscript,"n. a character or symbol set or printed or written beneath or slightly below and to the side of another character
a. written or printed below and to one side of another character"
subscription,"n. a payment for consecutive issues of a newspaper or magazine for a given period of time
n. agreement expressed by (or as if expressed by) signing your name
n. a pledged contribution
n. the act of signing your name; writing your signature (as on a document)"
transcript,"n. something that has been transcribed; a written record (usually typewritten) of dictated or recorded speech
n. a reproduction of a written record (e.g. of a legal or school record)"
transcribe,"v. write out from speech, notes, etc.
v. rewrite or arrange a piece of music for an instrument or medium other than that originally intended
v. make a phonetic transcription of
v. convert the genetic information in (a strand of DNA) into a strand of RNA, especially messenger RNA"
sculpture,"n. a three-dimensional work of plastic art
n. creating figures or designs in three dimensions"
section,"n. a self-contained part of a larger composition (written or musical)
n. a very thin slice (of tissue or mineral or other substance) for examination under a microscope
n. a distinct region or subdivision of a territorial or political area or community or group of people
n. one of several parts or pieces that fit with others to constitute a whole object"
intersection,"n. a point where lines intersect
n. a junction where one street or road crosses another
n. a point or set of points common to two or more geometric configurations"
segment,"n. one of the parts into which something naturally divides
v. divide into segments
v. divide or split up"
consecutive,"s. in regular succession without gaps
r. in a consecutive manner"
consecution,"n. A following, or sequel; actual or logical dependence.
n. A succession or series of any kind."
consequence,"n. a phenomenon that follows and is caused by some previous phenomenon
n. the outcome of an event especially as relative to an individual
n. having important effects or influence"
consequent,s following or accompanying as a consequence
persecute,v. cause to suffer
persecution,n. the act of persecuting (especially on the basis of race or religion)
prosecute,"v. conduct a prosecution in a court of law
v. bring a criminal action against (in a trial)
v. carry out or participate in an activity; be involved in"
prosecutor,n. a government official who conducts criminal prosecutions on behalf of the state
sequence,"n. serial arrangement in which things follow in logical order or a recurrent pattern
n. a following of one thing after another in time
n. film consisting of a succession of related shots that develop a given subject in a movie
n. several repetitions of a melodic phrase in different keys"
subsequent,a. following in time or order
subsequently,r. happening at a time subsequent to a reference time
senator,n. a member of a senate
consensus,n. agreement in the judgment or opinion reached by a group as a whole
resent,v. feel bitter or indignant about
resentful,a. full of or marked by resentment or indignant ill will
sensation,"n. an unelaborated elementary awareness of stimulation
n. a general feeling of excitement and heightened interest
n. a state of widespread public excitement and interest"
senseless,"s not marked by the use of reason
s unresponsive to stimulation
s serving no useful purpose; having no excuse for being
s (of especially persons) lacking sense or understanding or judgment"
sensible,"a. able to feel or perceive
s. readily perceived by the senses
s. aware intuitively or intellectually of something sensed"
sensitivity,"n. (physiology) responsiveness to external stimuli; the faculty of sensation
n. the ability to respond to physical stimuli or to register small physical amounts or differences
n. sensitivity to emotional feelings (of self and others)"
sensor,n any device that receives a signal or stimulus (as heat or pressure or light or motion etc.) and responds to it in a distinctive manner
sensory,a. involving or derived from the senses
sentiment,"n. tender, romantic, or nostalgic feeling or emotion"
sentimental,s. given to or marked by sentiment or sentimentality
assert,"v. state categorically
v. insist on having one's opinions and rights recognized"
desert,"n. arid land with little or no vegetation
v. leave behind"
insert,"n. a folded section placed between the leaves of another publication
n. an artifact that is inserted or is to be inserted
v. put or introduce into something
v. introduce"
insertion,n. the act of putting one thing into another
conserve,"n. fruit preserved by cooking with sugar
v. keep constant through physical or chemical reactions or evolutionary change
v. keep in safety and protect from harm, decay, loss, or destruction
v. use cautiously and frugally"
conservative,"n. a person who is reluctant to accept changes and new ideas
n. a member of a Conservative Party
a. resistant to change
s. having social or political views favoring conservatism"
conservation,"n. an occurrence of improvement by virtue of preventing loss or injury or other change
n. the preservation and careful management of the environment and of natural resources
n. (physics) the maintenance of a certain quantities unchanged during chemical reactions or physical transformations"
preservation,"n. the activity of protecting something from loss or danger
n. the condition of being (well or ill) preserved
n. a process that saves organic substances from decay"
reserve,"n. something kept back or saved for future use or a special purpose
n. (medicine) potential capacity to respond in order to maintain vital functions
n. the trait of being uncommunicative; not volunteering anything more than necessary
v. hold back or set aside, especially for future use or contingency"
reservation,"n. a district that is reserved for particular purpose
n. a statement that limits or restricts some claim
n. the written record or promise of an arrangement by which accommodations are secured in advance
n. something reserved in advance (as a hotel accommodation or a seat on a plane etc.)"
observation,"n. the act of making and recording a measurement
n. the act of observing; taking a patient look
n. a remark expressing careful consideration
n. facts learned by observing"
persevere,"v. be persistent, refuse to stop"
perseverance,n. the act of persisting or persevering; continuing or repeating behavior
severe,"s. intensely or extremely bad or unpleasant in degree or quality
s. unsparing and uncompromising in discipline or judgment
s. very bad in degree or extent"
shipment,"n goods carried by a large vehicle
n the act of sending off something"
shipwreck,"n. a wrecked ship (or a part of one)
n. an irretrievable loss
n. an accident that destroys a ship at sea"
