abolish,v. do away with
abolishment,n the act of abolishing a system or practice or institution (especially abolishing slavery)
activate,"v. make active or more active
v. make more adsorptive
v. aerate (sewage) so as to favor the growth of organisms that decompose organic matter
v. make (substances) radioactive"
activity,"n. any specific behavior
n. (chemistry) the capacity of a substance to take part in a chemical reaction"
activist,s. advocating or engaged in activism
enact,v. act out; represent or perform as if in a play
interact,v. act together or towards others or with others
reactor,n. an electrical device used to introduce reactance into a circuit
advantageous,"a. giving an advantage
s. appropriate for achieving a particular end; implies a lack of concern for fairness"
aerial,a. existing or living or growing or operating in the air
agenda,"n. a temporally organized plan for matters to be attended to
n. a list of matters to be taken up (as at a meeting)"
agitate,"v. try to stir up public opinion
v. cause to be agitated, excited, or roused
v. change the arrangement or position of"
agitation,"n. a mental state of extreme emotional disturbance
n. a state of agitation or turbulent change or development
n. the feeling of being agitated; not calm"
agony,"n. intense feelings of suffering; acute mental or physical pain
n. a state of acute pain"
album,"n. one or more recordings issued together; originally released on 12-inch phonograph records (usually with attractive record covers) and later on cassette audiotape and compact disc
n. a book of blank pages with pockets or envelopes; for organizing photographs or stamp collections etc"
alien,"v. transfer property or ownership
s. not contained in or deriving from the essential nature of something
s. being or from or characteristic of another place or part of the world"
alienate,v. make withdrawn or isolated or emotionally dissociated
alienation,"n. the feeling of being alienated from other people
n. separation resulting from hostility
n. (law) the voluntary and absolute transfer of title and possession of real property from one person to another"
alternate,"v. go back and forth; swing back and forth between two states or conditions
v. exchange people temporarily to fulfill certain jobs and functions
v. do something in turns
s. every second one of a series"
alternative,"s. necessitating a choice between mutually exclusive possibilities
s. pertaining to unconventional choices"
amiable,s. disposed to please
amateur,"n. someone who pursues a study or sport as a pastime
n. an athlete who does not play for pay
s. engaged in as a pastime"
ambiguous,"a. having more than one possible meaning
s. having no intrinsic or objective meaning; not organized in conventional patterns"
ample,"a. more than enough in size or scope or capacity
s. affording an abundant supply
s. fairly large"
amplify,v. increase the volume of
amplification,"n. addition of extra material or illustration or clarifying detail
n. the amount of increase in signal power or voltage or current expressed as the ratio of output to input
n. (electronics) the act of increasing voltage or power or current"
amplitude,"n. (physics) the maximum displacement of a periodic wave
n. the property of copious abundance
n. greatness of magnitude"
antique,"n. any piece of furniture or decorative object or the like produced in a former period and valuable because of its beauty or rarity
v. shop for antiques
v. give an antique appearance to
s. made in or typical of earlier times and valued for its age"
triangular,s. having three angles; forming or shaped like a triangle
triangularity,n. the property of being shaped like a triangle
rectangular,s. having four right angles
rectangle,n. a parallelogram with four right angles
unanimous,"s in complete agreement
s acting together as a single undiversified whole"
anniversary,n. the date on which an event occurred in some previous year (or the celebration of it)
annually,r. without missing a year
opaque,"a. not transmitting or reflecting light or radiant energy; impenetrable to sight
s. not clearly understood or expressed"
arbitrary,a. based on or subject to individual discretion or preference or sometimes impulse or caprice
arbitrariness,n the trait of acting unpredictably and more from whim or caprice than from reason or judgment
arc,n. a continuous portion of a circle
arch,"n. a curved shape in the vertical plane that spans an opening
n. a curved bony structure supporting or enclosing organs (especially the inner sides of the feet)
n. a passageway under a curved masonry construction
n. (architecture) a masonry construction (usually curved) for spanning an opening and supporting the weight above it"
architect,n. someone who creates plans to be used in making something (such as buildings)
architecture,"n. an architectural product or work
n. the discipline dealing with the principles of design and construction and ornamentation of fine buildings
n. the profession of designing buildings and environments with consideration for their esthetic effect"
hierarchy,"n. a series of ordered groupings of people or things within a system
n. the organization of people at different ranks in an administrative body"
monarch,n. large migratory American butterfly having deep orange wings with black and white markings; the larvae feed on milkweed
monarchical,"s having the characteristics of or befitting or worthy of a monarch
s ruled by or having the supreme power resting with a monarch"
armor,"n. protective covering made of metal and used in combat
n. a military unit consisting of armored fighting vehicles
n. tough more-or-less rigid protective covering of an animal or plant"
astronomy,n. the branch of physics that studies celestial bodies and the universe as a whole
astronomic,"a. relating or belonging to the science of astronomy
s. inconceivably large"
disastrous,s (of events) having extremely unfortunate or dire consequences; bringing ruin
auction,"n. a variety of bridge in which tricks made in excess of the contract are scored toward game; now generally superseded by contract bridge
n. the public sale of something to the highest bidder
v. sell at an auction"
inaugurate,"v. commence officially
v. open ceremoniously or dedicate formally
v. be a precursor of"
auditory,a. of or relating to the process of hearing
audition,"n. a test of the suitability of a performer
v. perform in order to get a role"
authority,"n. the power or right to give orders or make decisions
n. (usually plural) persons who exercise (administrative) control over others
n. an expert whose views are taken as definitive
n. official permission or approval"
authoritative,"s. having authority or ascendancy or influence
s. of recognized authority or excellence
s. sanctioned by established authority"
authoritatively,r. in an authoritative and magisterial manner
authorize,v. grant authorization or clearance for
aviation,"n. the aggregation of a country's military aircraft
n. the operation of aircraft to provide transportation
n. the art of operating aircraft"
aviator,n. someone who operates an aircraft
aviatress,n a woman aviator
abandon,"n. the trait of lacking restraint or control; reckless freedom from inhibition or worry
v. forsake, leave behind
v. give up with the intent of never claiming again
v. stop maintaining or insisting on; of ideas or claims"
banish,"v. expel from a community or group
v. ban from a place of residence, as for punishment
v. expel, as if by official decree
v. drive away"
banishment,"n. the state of being banished or ostracized (excluded from society by general consent)
n. rejection by means of an act of banishing or proscribing someone"
bandage,"n. a piece of soft material that covers and protects an injured part of the body
v. dress by covering or binding"
embark,"v. go on board
v. set out on (an enterprise or subject of study)"
baron,"n. a nobleman (in various countries) of varying rank
n. a British peer of the lowest rank
n. a very wealthy or powerful businessman"
baroness,n. a noblewoman who holds the rank of baron or who is the wife or widow of a baron
barricade,"n. a barrier (usually thrown up hastily) to impede the advance of an enemy
v. render unsuitable for passage
v. prevent access to by barricading
v. block off with barricades"
barrier,"n. a structure or object that impedes free movement
n. any condition that makes it difficult to make progress or to achieve an objective
n. anything serving to maintain separation by obstructing vision or access"
embarrass,v. cause to be embarrassed; cause to feel self-conscious
embarrassing,s. causing to feel shame or chagrin or vexation
embarrassment,"n. the shame you feel when your inadequacy or guilt is made public
n. the state of being embarrassed (usually by some financial inadequacy)
n. some event that causes someone to be embarrassed"
batter,"n. (baseball) a ballplayer who is batting
n. a liquid or semiliquid mixture, as of flour, eggs, and milk, used in cooking"
battered,"s. damaged by blows or hard usage
s. damaged especially by hard usage
s. exhibiting symptoms resulting from repeated physical and emotional injury"
combat,n. an engagement fought between two military forces
embed,"v. attach to, as a journalist to a military unit when reporting on a war"
rebellion,"n. refusal to accept some authority or code or convention
n. organized opposition to authority; a conflict in which one faction tries to wrest control from another"
beneficial,s. promoting or enhancing well-being
beverage,n. any liquid suitable for drinking
combine,"n. harvester that heads and threshes and cleans grain while moving across the field
v. add together from different sources
v. join for a common purpose or in a common action"
combination,"n. a collection of things that have been combined; an assemblage of separate parts or qualities
n. a coordinated sequence of chess moves
n. a sequence of numbers or letters that opens a combination lock
n. a group of people (often temporary) having a common purpose"
biochemistry,n. the organic chemistry of compounds and processes occurring in organisms; the effort to understand biology within the context of chemistry
embody,"v. represent, as of a character on stage
v. represent or express something abstract in tangible form"
bonus,"n. anything that tends to arouse
n. an additional payment (or other remuneration) to employees as a means of increasing output"
botany,n. the branch of biology that studies plants
botanist,n. a biologist specializing in the study of plants
botanical,n. a drug made from part of a plant (as the bark or root or leaves)
bourgeois,"n. a member of the middle class
s. (according to Marxist thought) being of the property-owning class and exploitive of the working class
s. conforming to the standards and conventions of the middle class
s. belonging to the middle class"
brace,"n. a support that steadies or strengthens something else
n. either of two punctuation marks ({ or }) used to enclose textual material
n. a rope on a square-rigged ship that is used to swing a yard about and secure it
n. elastic straps that hold trousers up (usually used in the plural)"
bracing,s. imparting vitality and energy
embrace,"n. the act of clasping another person in the arms (as in greeting or affection)
n. the state of taking in or encircling
n. a close affectionate and protective acceptance
v. include in scope; include as part of something broader; have as one's sphere or territory"
abbreviation,"n. a shortened form of a word or phrase
n. shortening something by omitting parts of it"
abbreviate,v. shorten
brilliant,"s. of surpassing excellence
s. characterized by grandeur
s. full of light; shining intensely"
embroidery,n. decorative needlework
casualty,"n. someone injured or killed or captured or missing in a military engagement
n. someone injured or killed in an accident
n. a decrease of military personnel or equipment"
coincide,"v. go with, fall together
v. be the same"
coincidence,"n. an event that might have been arranged although it was really accidental
n. the quality of occupying the same position or area in space"
decay,"n. the process of gradually becoming inferior
n. a gradual decrease; as of stored charge or current
n. the organic phenomenon of rotting
n. an inferior state resulting from the process of decaying"
incidence,"n. the relative frequency of occurrence of something
n. the striking of a light beam on a surface"
incidentally,r. of a minor or subordinate nature
calcium,n. a white metallic element that burns with a brilliant light; the fifth most abundant element in the earth's crust; an important component of most plants and animals
calculate,"v. make a mathematical calculation or computation
v. judge to be probable
v. specifically design a product, event, or activity for a certain public"
calculus,"n. a hard lump produced by the concretion of mineral salts; found in hollow organs or ducts of the body
n. the branch of mathematics that is concerned with limits and with the differentiation and integration of functions"
calorie,"n. a unit of heat equal to the amount of heat required to raise the temperature of one kilogram of water by one degree at one atmosphere pressure; used by nutritionists to characterize the energy-producing potential in food
n. unit of heat defined as the quantity of heat required to raise the temperature of 1 gram of water by 1 degree centigrade at atmospheric pressure"
candidate,n. someone who is considered for something (for an office or prize or honor etc.)
anticipate,"v. act in advance of; deal with ahead of time
v. realize beforehand
v. be excited or anxious about
v. be a forerunner of or occur earlier than"
anticipation,"n. an expectation
n. something expected (as on the basis of a norm)
n. anticipating with confidence of fulfillment"
capable,"a. (usually followed by `of') having capacity or ability
s. possibly accepting or permitting
a. (followed by `of') having the temperament or inclination for"
capacity,"n. capability to perform or produce
n. the amount that can be contained
n. the maximum production possible
n. a specified function"
caption,"n. taking exception; especially a quibble based on a captious argument
n. brief description accompanying an illustration
v. provide with a caption, as of a photograph or a drawing"
captive,"n. an animal that is confined
n. a person held in the grip of a strong emotion or passion
s. being in captivity
s. giving or marked by complete attention to"
conceit,"n. an elaborate poetic image or a far-fetched comparison of very dissimilar things
n. a witty or ingenious turn of phrase
n. an artistic device or effect
n. the trait of being unduly vain and conceited; false pride"
conceited,s. characteristic of false pride; having an exaggerated sense of self-importance
conceitedness,n. The state of being conceited; conceit; vanity.
conceive,v. become pregnant; undergo conception
conception,n. the act of becoming pregnant; fertilization of an ovum by a spermatozoon
conceptual,s. being or characterized by concepts or their formation
deceit,"n the quality of being fraudulent
n a misleading falsehood
n the act of deceiving"
deceive,"v. be false to; be dishonest with
v. cause someone to believe an untruth"
exceptional,s. deviating widely from a norm of physical or mental ability; used especially of children below normal in intelligence
intercept,"n. the point at which a line intersects a coordinate axis
v. seize on its way"
interception,"n. the act of intercepting; preventing something from proceeding or arriving
n. (American football) the act of catching a football by a player on the opposing team"
interceptor,n. a fast maneuverable fighter plane designed to intercept enemy aircraft
occupy,"v. live (in a certain place)
v. occupy the whole of"
occupancy,n. an act of being a tenant or occupant
perception,"n. a way of conceiving something
n. the process of perceiving
n. knowledge gained by perceiving"
perceptive,"a. of or relating to perception
a. having the ability to perceive or understand; keen in discernment"
perceptible,"a. capable of being perceived by the mind or senses
s. easily perceived by the senses or grasped by the mind"
principally,r for the most part
recipient,n. a person who receives something
susceptible,"a. (often followed by `of' or `to') yielding readily to or capable of
s. easily impressed emotionally"
susceptibility,n. the state of being susceptible; easily affected
cape,"n. a strip of land projecting into a body of water
n. a sleeveless garment like a cloak but shorter"
charter,"n. a document incorporating an institution and specifying its rights; includes the articles of incorporation and the certificate of incorporation
n. a contract to hire or lease transportation
v. grant a charter to"
discard,"n. anything that is cast aside or discarded
n. (cards) the act of throwing out a useless card or of failing to follow suit
n. getting rid something that is regarded as useless or undesirable
v. throw or cast away"
accord,"n. concurrence of opinion
n. sympathetic compatibility
v. allow to have"
accordance,n. the act of granting rights
cardinal,"n. (Roman Catholic Church) one of a group of more than 100 prominent bishops in the Sacred College who advise the Pope and elect new Popes
n. a variable color averaging a vivid red
n. crested thick-billed North American finch having bright red plumage in the male
s. serving as an essential component"
cordial,"s. politely warm and friendly
s. sincerely or intensely felt"
cordiality,n a cordial disposition
discord,"n. lack of agreement or harmony
n. disagreement among those expected to cooperate
n. strife resulting from a lack of agreement"
cavity,"n. space that is surrounded by something
n. soft decayed area in a tooth; progressive decay can lead to the death of a tooth
n. (anatomy) a natural hollow or sinus within the body"
access,"n. the right to obtain or make use of or take advantage of something (as services or membership)
n. a way of entering or leaving
n. a code (a series of characters or digits) that must be entered in some way (typed or dialed or spoken) to get the use of something (a telephone line or a computer or a local area network etc.)
n. (computer science) the operation of reading or writing stored information"
accessory,"n. clothing that is worn or carried, but not part of your main clothing
n. a supplementary component that improves capability
n. someone who helps another person commit a crime
s. furnishing added support"
inaccessible,"a. capable of being reached only with great difficulty or not at all
s. not capable of being obtained"
concede,"v. admit (to a wrongdoing)
v. be willing to concede
v. give over; surrender or relinquish to the physical control of another
v. acknowledge defeat"
concession,"n. a contract granting the right to operate a subsidiary business
n. the act of conceding or yielding
n. a point conceded or yielded"
concessive,a. of or pertaining to concession
excess,"n. a quantity much larger than is needed
n. immoderation as a consequence of going beyond sufficient or permitted limits
s. more than is needed, desired, or required"
excessively,r. to a degree exceeding normal or proper limits
microprocessor,n. integrated circuit semiconductor chip that performs the bulk of the processing and controls the parts of a system
precede,"v. come before
v. be the predecessor of
v. move ahead (of others) in time or space
v. furnish with a preface or introduction"
precedent,"n. an example that is used to justify similar occurrences at a later time
n. a subject mentioned earlier (preceding in time)
s. preceding in time, order, or significance"
proceeding,n. (law) the institution of a sequence of steps by which legal judgments are invoked
predecessor,n. one who precedes you in time (as in holding a position or office)
recede,v. become faint or more distant
recess,"n. a small concavity
n. an enclosure that is set back or indented
v. put into a recess
v. make a recess in"
recession,"n. the state of the economy declines; a widespread decline in the GDP and employment and trade lasting from six months to a year
n. the withdrawal of the clergy and choir from the chancel to the vestry at the end of a church service
n. the act of ceding back"
succession,"n. a group of people or things arranged or following in order
n. the action of following in order
n. (ecology) the gradual and orderly process of change in an ecosystem brought about by the progressive replacement of one community by another until a stable climax is established
n. acquisition of property by descent or by will"
successor,"n. a person who follows next in order
n. a thing or person that immediately replaces something or someone
n. a person who inherits some title or office"
excel,v. distinguish oneself
accelerate,"v. move faster
v. cause to move faster"
acceleration,"n. an increase in rate of change
n. the act of accelerating; increasing the speed
n. (physics) a rate of increase of velocity"
cemetery,n. a tract of land used for burials
censor,"n. someone who censures or condemns
n. a person who is authorized to read publications or correspondence or to watch theatrical performances and suppress in whole or in part anything considered obscene or politically unacceptable
v. subject to political, religious, or moral censorship"
censorship,"n counterintelligence achieved by banning or deleting any information of value to the enemy
n deleting parts of publications or correspondence or theatrical performances"
census,"n. a periodic count of the population
v. conduct a census"
incentive,n. a positive motivational influence
concentrate,"n. a concentrated form of a foodstuff; the bulk is reduced by removing water
n. a concentrated example of something
v. make denser, stronger, or purer
v. direct one's attention on something"
concentration,"n. the strength of a solution; number of molecules of a substance in a given volume
n. the spatial property of being crowded together
n. strengthening the concentration (as of a solute in a mixture) by removing diluting material
n. increase in density"
eccentric,"n. a person with an unusual or odd personality
a. not having a common center; not concentric"
cereal,"n. grass whose starchy grains are used as food: wheat; rice; rye; oats; maize; buckwheat; millet
n. a breakfast food prepared from grain
a. made of grain or relating to grain or the plants that produce it"
ascertain,v. learn or discover with certainty
ascertainable,s. capable of being ascertained or found out
ascertainment,"n. The act of ascertaining; a reducing to certainty; a
   finding out by investigation; discovery."
concern,"n. something that interests you because it is important or affects you
n. an anxious feeling
n. a feeling of sympathy for someone or something
n. something or someone that causes anxiety; a source of unhappiness"
concerted,s. involving the joint activity of two or more
certainty,"n. the state of being certain
n. something that is certain"
certify,"v. guarantee payment on; of checks
v. guarantee as meeting a certain standard
v. declare legally insane"
certificate,"n. a document attesting to the truth of certain stated facts
v. present someone with a certificate
v. authorize by certificate"
discern,v detect with the senses
discernible,"a. perceptible by the senses or intellect
s. capable of being perceived clearly
s. capable of being seen or noticed"
discreet,a. marked by prudence or modesty and wise self-restraint
discrete,s. constituting a separate entity or part
discreteness,n. the state of being several and distinct
excerpt,"n. a passage selected from a larger work
v. take out of a literary work in order to cite or copy"
excerption,n a passage selected from a larger work
enchant,v. hold spellbound
enchanting,"v hold spellbound
v attract; cause to be enamored
v cast a spell over someone or something; put a hex on someone or something
s capturing interest as if by a spell"
cherish,v be fond of; be attached to
chronic,"a. being long-lasting and recurrent or characterized by long suffering
s. of long duration
s. habitual"
parachute,n. rescue equipment consisting of a device that fills with air and retards your fall
parachutist,n. a person who jumps from aircraft using a parachute
concise,a. expressing much in few words
conciseness,n. terseness and economy in writing and speaking achieved by expressing a great deal in just a few words
concisely,r. in a concise manner; in a few words
suicide,"n. the act of killing yourself
n. a person who kills himself intentionally"
decidedly,r. without question and beyond doubt
decisive,"a. determining or having the power to determine an outcome
s. unmistakable
a. characterized by decision and firmness"
pesticide,n. a chemical used to kill pests (as rodents or insects)
reconcile,v. come to terms
reconciliation,"n. the reestablishing of cordial relations
n. getting two things to correspond"
circular,"n. an advertisement (usually printed on a page or in a leaflet) intended for wide distribution
s. describing a circle; moving in a circle"
circulative,a. of or relating to circulation
circulation,"n. the dissemination of copies of periodicals (as newspapers or magazines)
n. movement through a circuit; especially the movement of blood through the heart and blood vessels
n. (library science) the count of books that are loaned by a library over a specified period
n. number of copies of a newspaper or magazine that are sold"
circus,"n. a travelling company of entertainers; including trained animals
n. a performance given by a traveling company of acrobats, clowns, and trained animals
n. a frenetic disorganized (and often comic) disturbance suggestive of a large public entertainment
n. (antiquity) an open-air stadium for chariot races and gladiatorial games"
