harmony,"n. compatibility in opinion and action
n. the structure of music with respect to the composition and progression of chords
n. a harmonious state of things in general and of their properties (as of colors and sounds); congruity of parts with one another and with the whole
n. agreement of opinions"
haughty,s having or showing arrogant superiority to and disdain of those one views as unworthy
haughtily,r. in a haughty manner
adhere,"v. be compatible or in accordance with
v. follow through or carry out a plan without deviation
v. be a devoted follower or supporter
v. stick to firmly"
adhesive,a. tending to adhere
adhesion,"n. abnormal union of bodily tissues; most common in the abdomen
n. a fibrous band of scar tissue that binds together normally separate anatomical structures"
coherent,"a. marked by an orderly, logical, and aesthetically consistent relation of parts
s. capable of thinking and expressing yourself in a clear and consistent manner
a. (physics) of waves having a constant phase relation
s. sticking together"
cohesive,"s. causing cohesion
s. cohering or tending to cohere; well integrated"
coherence,"n. the state of cohering or sticking together
n. logical and orderly and consistent relation of parts"
hesitate,"v. pause or hold back in uncertainty or unwillingness
v. interrupt temporarily an activity before continuing"
hesitation,"n. indecision in speech or action
n. the act of pausing uncertainly"
inherent,"s existing as an essential constituent or characteristic
s in the nature of something though not readily apparent"
heritage,n. practices that are handed down from the past by tradition
inhibit,"v. limit the range or extent of
v. limit, block, or decrease the action or function of
v. control and refrain from showing; of emotions, desires, impulses, or behavior"
prohibition,"n. a law forbidding the sale of alcoholic beverages
n. a decree that prohibits something
n. the period from 1920 to 1933 when the sale of alcoholic beverages was prohibited in the United States by a constitutional amendment
n. refusal to approve or assent to"
prohibit,v command against
historian,n. a person who is an authority on history and who studies it and writes about it
horrify,v fill with apprehension or alarm; cause to be unpleasantly surprised
horrifying,"v fill with apprehension or alarm; cause to be unpleasantly surprised
s provoking horror"
hospitality,n kindness in welcoming guests or strangers
hospitable,"a. favorable to life and growth
a. disposed to treat guests and strangers with cordiality and generosity
s. having an open mind"
hostage,n. a prisoner who is held by one party to insure that another party will meet specified terms
hostile,"n. troops belonging to the enemy's military forces
a. characterized by enmity or ill will
a. not belonging to your own country's forces or those of an ally
s. impossible to bring into friendly accord"
hostility,"n. a hostile (very unfriendly) disposition
n. a state of deep-seated ill-will
n. the feeling of a hostile person"
humanitarian,"n. someone devoted to the promotion of human welfare and to social reforms
a. of or relating to or characteristic of humanitarianism"
humanitarianism,n. the doctrine that people's duty is to promote human welfare
humanity,n. the quality of being humane
humiliate,v. cause to feel shame; hurt the pride of
humiliation,"n. state of disgrace or loss of self-respect
n. an instance in which you are caused to lose your prestige or self-respect
n. depriving one of self-esteem"
identical,"s. exactly alike; incapable of being perceived as different
s. being the exact same one; not any other:
a. (of twins) derived from a single egg or ovum
s. having properties with uniform values along all axes"
identification,"n. evidence of identity; something that identifies a person or thing
n. the condition of having the identity (of a person or object) established
n. the attribution to yourself (consciously or unconsciously) of the characteristics of another person (or group of persons)"
ideology,n. imaginary or visionary theorization
idiot,n. a person of subnormal intelligence
idiotic,"s insanely irresponsible
s incongruous; inviting ridicule
s having a mental age of three to seven years"
ignite,v. cause to start burning; subject to fire or great heat
ignition,"n. the process of initiating combustion or catching fire
n. the mechanism that ignites the fuel in an internal-combustion engine
n. the act of setting something on fire"
imaginative,s. (used of persons or artifacts) marked by independence and creativity in thought or action
imaginable,s capable of being imagined
imagine,v. form a mental image of something that is not present or that is not the case
imitation,"n. the doctrine that representations of nature or human behavior should be accurate imitations
n. something copied or derived from an original
n. copying (or trying to copy) the actions of someone else"
imperative,"n. some duty that is essential and urgent
a. requiring attention or action
a. relating to verbs in the imperative mood"
imperial,"n. a small tufted beard worn by Emperor Napoleon III
n. a piece of luggage carried on top of a coach
a. relating to or associated with an empire
a. of or belonging to the British Imperial System of weights and measures"
imperialist,n. a believer in imperialism
imperialism,"n. a policy of extending your rule over foreign countries
n. a political orientation that advocates imperial interests
n. any instance of aggressive extension of authority"
inferior,"n. one of lesser rank or station or quality
a. of or characteristic of low rank or importance
a. of low or inferior quality
a. having an orbit between the sun and the Earth's orbit"
insulate,"v. protect from heat, cold, or noise by surrounding with insulating material"
insulator,n. a material such as glass or porcelain with negligible electrical or thermal conductivity
insulation,"n. the state of being isolated or detached
n. the act of protecting something by surrounding it with material that reduces or prevents the transmission of sound or heat or electricity"
peninsula,n. a large mass of land projecting into a body of water
peninsular,a. of or forming or resembling a peninsula
integral,"n. the result of a mathematical integration; F(x) is the integral of f(x) if dF/dx = f(x)
s. constituting the undiminished entirety; lacking nothing essential especially not damaged
a. of or denoted by an integer"
integrate,"v. make into a whole or make part of a whole
v. become one; become integrated
v. calculate the integral of; calculate by integration"
integration,"n. the action of incorporating a racial or religious group into a community
n. an operation used in the calculus whereby the integral of a function is determined"
integrity,"n. an undivided or unbroken completeness or totality with nothing wanting
n. moral soundness"
interim,"n. the time between one event, process, or period and another
s. serving during an intermediate interval of time"
ambition,"n. a cherished desire
n. a strong drive for success
v. have as one's ambition"
ambitious,"a. having a strong desire for success or achievement
s. requiring full use of your abilities or resources"
initiate,"n. someone who has been admitted to membership in a scholarly field
n. people who have been introduced to the mysteries of some field or activity
v. take the lead or initiative in; participate in the development of
v. accept people into an exclusive society or group, usually with some rite"
initiation,"n. a formal entry into an organization or position or office
n. the act of starting something for the first time; introducing something new"
initiative,"n readiness to embark on bold new ventures
n the first of a series of actions
s serving to set in motion"
transit,"v. make a passage or journey from one place to another
v. pass across (a sign or house of the zodiac) or pass across (the disk of a celestial body or the meridian of a place)
v. revolve (the telescope of a surveying transit) about its horizontal transverse axis in order to reverse its direction
v. cause or enable to pass through"
transition,"n. a change from one place or state or subject or stage to another
n. a musical passage moving from one key to another
n. a passage that connects a topic to one that follows
v. cause to convert or undergo a transition"
adjacent,"s. nearest in space or position; immediately adjoining without intervening space
s. having a common boundary or edge; abutting; touching; Massachusetts and Conncecticut""
s. near or close to but not necessarily touching"
adjacency,n. the attribute of being so near as to be touching
eject,"v. put out or expel from a place
v. leave an aircraft rapidly, using an ejection seat or capsule"
inject,"v. give an injection to
v. to introduce (a new aspect or element)
v. force or drive (a fluid or gas) into by piercing
v. take by injection"
injection,"n. the forceful insertion of a substance under pressure
n. any solution that is injected (as into the skin)
n. the act of putting a liquid into the body by means of a syringe"
objective,"n. the lens or system of lenses in a telescope or microscope that is nearest the object being viewed
a. undistorted by emotion or personal bias; based on observable phenomena
a. serving as or indicating the object of a verb or of certain prepositions and used for certain other purposes
s. emphasizing or expressing things as perceived without distortion of personal feelings, insertion of fictional matter, or interpretation"
projector,"n. an optical device for projecting a beam of light
n. an optical instrument that projects an enlarged image onto a screen"
projection,"n. a prediction made by extrapolating from past observations
n. the projection of an image from a film onto a screen
n. any structure that branches out from a central support
n. any solid convex shape that juts out from something"
reject,"v. refuse to accept or acknowledge
v. reject with contempt
v. refuse entrance or membership"
rejection,"n. the act of rejecting something
n. the state of being rejected
n. (medicine) an immunological response that refuses to accept substances or organisms that are recognized as foreign"
subjective,a. taking place within the mind and modified by individual bias
jeopardize,"v pose a threat to; present a danger to
v put at risk"
rejoice,v. feel happiness or joy
rejoicing,n. a feeling of great happiness
adjoin,v. attach or add
adjoining,"v lie adjacent to another or share a boundary
v be in direct physical contact with; make contact
v attach or add"
conjunction,"n. an uninflected function word that serves to conjoin words or phrases or clauses or sentences
n. the grammatical relation between linguistic units (words or phrases or clauses) that are connected by a conjunction
n. (astronomy) apparent meeting or passing of two or more celestial bodies in the same degree of the zodiac"
junction,"n. the place where two or more things come together
n. the state of being joined together
n. something that joins or connects
n. an act of joining or adjoining things"
judicial,"s. decreed by or proceeding from a court of justice
a. belonging or appropriate to the office of a judge
a. relating to the administration of justice or the function of a judge"
prejudice,"v. disadvantage by prejudice
v. influence (somebody's) opinion in advance"
adjustable,"s. capable of being changed so as to match or fit
s. capable of being regulated"
adjustment,"n. making or becoming suitable; adjusting to circumstances
n. the act of adjusting something to match a standard"
justification,"n. something (such as a fact or circumstance) that shows an action to be reasonable or necessary
n. a statement in explanation of some action or belief
n. the act of defending or explaining or making excuses for by reasoning"
juvenile,"n. a young person, not fully developed
a. of or relating to or characteristic of or appropriate for children or young people"
acknowledge,"v. report the receipt of
v. express obligation, thanks, or gratitude for
v. accept as legally binding and valid
v. accept (someone) to be what is claimed or accept his power and authority"
acknowledgement,"n the state or quality of being recognized or acknowledged
n a statement acknowledging something or someone"
collaboration,"n. act of working jointly
n. act of cooperating traitorously with an enemy that is occupying your country"
collaborate,"v. work together on a common enterprise of project
v. cooperate as a traitor"
elaborate,"v. add details, as to an account or idea; clarify the meaning of and discourse in a learned way, usually in writing
v. produce from basic elements or sources; change into a more developed product
v. work out in detail
s. marked by complexity and richness of detail"
elaboration,n. developing in intricate and painstaking detail
collapse,"n. an abrupt failure of function or complete physical exhaustion
n. a natural event caused by something suddenly falling down or caving in
v. break down, literally or metaphorically
v. fold or close up"
elapse,v. pass by
latitude,"n. the angular distance between an imaginary line around a heavenly body parallel to its equator and the equator itself
n. freedom from normal restraints in conduct
n. an imaginary line around the Earth parallel to the equator
n. scope for freedom of e.g. action or thought; freedom from restriction"
dilute,v. lessen the strength or flavor of a solution or mixture
dilution,"n. a diluted solution
n. weakening (reducing the concentration) by the addition of water or a thinner"
lavish,"v. expend profusely; also used with abstract nouns
s. very generous
s. characterized by extravagance and profusion"
relay,"n. the act of passing something along from one person or group to another
n. a crew of workers who relieve another crew
n. a fresh team to relieve weary draft animals
n. a race between teams; each member runs or swims part of the distance"
delegate,"n. a person appointed or elected to represent others
v. transfer power to someone
v. give an assignment to (a person) to a post, or assign a task to (a person)"
delegation,"n a group of representatives or delegates
n authorizing subordinates to make certain decisions"
diligent,"s. quietly and steadily persevering especially in detail or exactness
a. characterized by care and perseverance in carrying out tasks"
diligence,"n. conscientiousness in paying proper attention to a task; giving the degree of care required in a given situation
n. persevering determination to perform a task"
elegant,"a. refined and tasteful in appearance or behavior or style
s. suggesting taste, ease, and wealth
s. displaying effortless beauty and simplicity in movement or execution"
elegance,"n. a refined quality of gracefulness and good taste
n. a quality of neatness and ingenious simplicity in the solution of a problem (especially in science or mathematics)"
eligible,a. qualified for or allowed or worthy of being chosen
elite,n. a group or class of persons enjoying superior intellectual or social or economic status
intellect,"n knowledge and intellectual ability
n the capacity for rational thought or inference or discrimination
n a person who uses the mind creatively"
intellectual,"n. a person who uses the mind creatively
s. of or associated with or requiring the use of the mind
a. appealing to or using the intellect"
intelligent,"a. having the capacity for thought and reason especially to a high degree
s. possessing sound knowledge
s. endowed with the capacity to reason"
intelligible,"a. well articulated or enunciated, and loud enough to be heard distinctly"
selection,n. an assortment of things from which a choice can be made
oblige,"v. bind by an obligation; cause to be indebted
v. provide a service or favor for someone"
obligation,"n. the state of being obligated to do or pay something
n. a personal relation in which one is indebted for a service or favor
n. a legal agreement specifying a payment or action and the penalty for failure to comply"
allege,v. report or maintain
legend,n. a story about mythical or supernatural beings or events
legendary,s. so celebrated as to having taken on the nature of a legend
legislation,"n. law enacted by a legislative body
n. the act of making or enacting laws"
legislative,"a. relating to a legislature or composed of members of a legislature
a. of or relating to or created by legislation"
legitimate,"v. show or affirm to be just and legitimate
v. make (an illegitimate child) legitimate; declare the legitimacy of (someone)
a. of marriages and offspring; recognized as lawful
s. based on known statements or events or conditions"
dilemma,n. state of uncertainty or perplexity especially as requiring a choice between equally unfavorable options
alleviate,"v provide physical relief, as from pain
v make easier"
alleviation,"n the feeling that comes when something burdensome is removed or reduced
n the act of reducing something unpleasant (as pain or annoyance)"
elevate,"v give a promotion to or assign to a higher position
v raise from a lower to a higher position
v raise in rank or condition"
elevation,"n. the event of something being raised upward
n. angular distance above the horizon (especially of a celestial object)
n. distance of something above a reference point (such as sea level)"
lever,"n. a rigid bar pivoted about a fulcrum
n. a simple machine that gives a mechanical advantage when given a fulcrum
n. a flat metal tumbler in a lever lock"
leverage,"n. the mechanical advantage gained by being in a position to use a lever
n. strategic advantage; power to act effectively
n. investing with borrowed money as a way to amplify potential gains (at the risk of greater losses)
v. supplement with leverage"
levy,"n. a charge imposed and collected
n. the act of drafting into military service
v. impose and collect"
relieve,"v. provide physical relief, as from pain
v. free from a burden, evil, or distress
v. take by stealing
v. alleviate or remove (pressure or stress) or make less oppressive"
deliberate,s. carefully thought out in advance
deliberation,"n. (usually plural) discussion of all sides of a question
n. careful consideration
n. the trait of thoughtfulness in action or decision"
deliberately,"r with intention; in an intentional manner
r in a deliberate unhurried manner"
elicit,v. derive by reason
lieutenant,"n. a commissioned military officer
n. an officer in a police force
n. an officer holding a commissioned rank in the United States Navy or the United States Coast Guard; below lieutenant commander and above lieutenant junior grade"
enlighten,"v. make understand
v. give spiritual insight to; in religion"
enlightenment,"n. education that results in understanding and the spread of knowledge
n. a movement in Europe from about 1650 until 1800 that advocated the use of reason and individualism instead of tradition and established doctrine"
twilight,"n. the time of day immediately following sunset
n. the diffused light from the sky when the sun is below the horizon but its rays are refracted by the atmosphere of the earth
n. a condition of decline following successes"
alignment,"n. the spatial property possessed by an arrangement or position of things in a straight line or in parallel lines
n. the act of adjusting or aligning the parts of a device in relation to each other"
linear,"a. designating or involving an equation whose terms are of the first degree
a. of or in or along or relating to a line; involving a single dimension
s. (of a leaf shape) long and narrow
s. measured lengthwise"
linen,"n. a fabric woven with fibers from the flax plant
n. a high-quality paper made of linen fibers or with a linen finish
n. white goods or clothing made with linen cloth"
liner,"n. (baseball) a hit that flies straight out from the batter
n. a piece of cloth that is used as the inside surface of a garment
n. a large commercial ship (especially one that carries passengers on a regular schedule)"
outline,"n. the line that appears to bound an object
n. a sketchy summary of the main points of an argument or theory
n. a schematic or preliminary plan"
streamline,v. contour economically or efficiently
underline,v. draw a line or lines underneath to call attention to
eclipse,"n. one celestial body obscures another
v. cause an eclipse of (a celestial body) by intervention"
literate,"n. a person who can read and write
a. able to read and write
a. versed in literature; dealing with literature
s. knowledgeable and educated in one or several fields"
illiterate,"n. a person unable to read
a. not able to read or write
a. lacking culture, especially in language and literature"
illiteracy,"n. ignorance resulting from not reading
n. an inability to read"
literacy,n. the ability to read and write
literal,"s. without interpretation or embellishment
a. limited to the explicit meaning of a word or text
s. avoiding embellishment or exaggeration (used for emphasis)"
literary,"a. of or relating to or characteristic of literature
s. knowledgeable about literature
s. appropriate to literature rather than everyday speech or writing"
allocate,v. distribute according to a plan or set apart for a special purpose
allocation,n. (computer science) the assignment of particular areas of a magnetic disk to particular data or instructions
locality,n a surrounding or nearby region
location,"n. a point or extent in space
n. a workplace away from a studio at which some or all of a movie may be made"
locate,"v. discover the location of; determine the place of; find by searching or examining
v. assign a location to"
locomotive,"n. a wheeled vehicle consisting of a self-propelled engine that is used to draw trains along railway tracks
a. of or relating to locomotion"
locomotion,"n. the power or ability to move
n. self-propelled movement"
analogue,"n. something having the property of being analogous to something else
a. of a circuit or device having an output that is proportional to the input"
analogous,"s. similar or equivalent in some respects though otherwise dissimilar
a. corresponding in function but not in evolutionary origin"
analogy,"n. an inference that if things agree in some respects they probably agree in others
n. drawing a comparison in order to show a similarity in some respect"
catalogue,"v. make an itemized list or catalog of; classify
v. make a catalogue, compile a catalogue"
log,"n. a segment of the trunk of a tree when stripped of branches
n. a written record of messages sent or received
n. a written record of events on a voyage (of a ship or plane)
n. measuring instrument that consists of a float that trails from a ship by a knotted line in order to measure the ship's speed through the water"
monologue,"n. a long utterance by one person (especially one that prevents others from participating in the conversation)
n. a (usually long) dramatic speech by a single actor"
slogan,n a favorite saying of a sect or political group
longevity,"n. duration of service
n. the property of being long-lived"
longitude,n. the angular distance between a point on any meridian and the prime meridian at Greenwich
prolong,"v. lengthen in time; cause to be or last longer
v. lengthen or extend in duration or space"
eloquent,"s. expressing yourself readily, clearly, effectively"
eloquence,n. powerful and effective language
lubricate,"v. have lubricating properties
v. apply a lubricant to
v. make slippery or smooth through the application of a lubricant"
lubricant,n. a substance capable of reducing friction by making surfaces smooth or slippery
illustrate,"v. depict with an illustration
v. supply with illustrations"
illustration,"n. artwork that helps make something clear or attractive
n. a visual representation (a picture or diagram) that is used make some subject more pleasing or easier to understand"
delusion,"n. (psychology) an erroneous belief that is held in the face of evidence to the contrary
n. a mistaken or unfounded opinion or idea
n. the act of deluding; deception by creating illusory ideas"
delude,v be false to; be dishonest with
illusion,"n. an erroneous mental representation
n. something many people believe that is false"
illusory,s based on or having the nature of an illusion
disillusion,"n freeing from false belief or illusions
v free from enchantment"
illuminate,v. add embellishments and paintings to (medieval manuscripts)
illumination,n. the degree of visibility of your environment
illuminator,"n. One whose occupation is to adorn books, especially
   manuscripts, with miniatures, borders, etc. See Illuminate, v. t., 3.
v. t. A condenser or reflector of light in optical
   apparatus; also, an illuminant."
luminous,s softly bright or radiant
lunar,a. of or relating to or associated with the moon
luxurious,"s displaying luxury and furnishing gratification to the senses
s rich and superior in quality"
luxury,"n. something that is an indulgence rather than a necessity
n. wealth as evidenced by sumptuous living"
analyst,"n. someone who is skilled at analyzing data
n. an expert who studies financial data (on credit or securities or sales or financial patterns etc.) and recommends appropriate business actions
n. a licensed practitioner of psychoanalysis"
analytic,"a. using or subjected to a methodology using algebra and calculus
a. using or skilled in using analysis (i.e., separating a whole--intellectual or substantial--into its elemental parts or basic principles)
a. expressing a grammatical category by using two or more words rather than inflection"
analytical,"a using or skilled in using analysis (i.e., separating a whole--intellectual or substantial--into its elemental parts or basic principles)
a of a proposition that is necessarily true independent of fact or experience"
