visualize,"v. imagine; conceive of; see in one's mind
v. view the outline of by means of an X-ray
v. form a mental picture of something that is invisible or abstract
v. make visible"
visualization,n a mental image that is similar to a visual perception
advocate,"n. a person who pleads for a cause or propounds an idea
n. a lawyer who pleads cases in court"
advocacy,n. active support of an idea or cause etc.; especially the act of pleading or arguing for something
evoke,"v call forth (emotions, feelings, and responses)
v evoke or provoke to appear or occur
v deduce (a principle) or construe (a meaning)
v summon into action or bring into existence, often as if by magic
v call to mind"
provoke,"v. evoke or provoke to appear or occur
v. provide the needed stimulus for"
provocative,"a. serving or tending to provoke, excite, or stimulate; stimulating discussion or exciting controversy
s. exciting sexual desire"
provocation,n. needed encouragement
revoke,"n. the mistake of not following suit when able to do so
v. fail to follow suit when able and required to do so
v. cancel officially"
vocal,"a. relating to or designed for or using the singing voice
a. having or using the power to produce speech or sound
s. full of the sound of voices"
vocational,a. of or relating to a vocation or occupation; especially providing or undergoing training in special skills
volunteer,"n. (military) a person who freely enlists for service
n. a person who performs voluntary work
v. tell voluntarily
v. agree freely"
voluntary,"n. composition (often improvised) for a solo instrument (especially solo organ) and not a regular part of a religious service or musical performance
a. of your own free will or design; done by choice; not forced or compelled
a. controlled by individual volition"
evolution,n. (biology) the sequence of events involved in the evolutionary development of a species or taxonomic group of organisms
revolve,v. turn on or around an axis or a center
devour,"v. destroy completely
v. enjoy avidly
v. eat immoderately
v. eat greedily"
devotion,"n. feelings of ardent love
n. commitment to some purpose
n. (usually plural) religious observance or prayers (usually spoken silently)"
adolescent,"n. a juvenile between the onset of puberty and maturity
a. relating to or peculiar to or suggestive of an adolescent
s. being of the age 13 through 19
s. displaying or suggesting a lack of maturity"
adolescence,"n. the time period between the beginning of puberty and adulthood
n. in the state that someone is in between puberty and adulthood"
air-conditioning,"v control the humidity and temperature of
v equip with an apparatus for controlling the humidity and temperature"
aisle,"n. a long narrow passage (as in a cave or woods)
n. passageway between seating areas as in an auditorium or passenger vehicle or between areas of shelves of goods as in stores
n. part of a church divided laterally from the nave proper by rows of pillars or columns"
allowance,"n. an amount allowed or granted (as during a given period)
n. a sum granted as reimbursement for expenses
n. an amount added or deducted on the basis of qualifying circumstances
n. a permissible difference; allowing some freedom to move within limits"
alloy,"n. a mixture containing two or more metallic elements or metallic and nonmetallic elements usually fused together or dissolving into each other when molten
v. make an alloy of"
appease,"v cause to be more favorably inclined; gain the good will of
v overcome or allay
v make peace with"
appeasement,n. the act of appeasing (as by acceding to the demands of)
appliance,"n. a device or control that is very useful for a particular job
n. durable goods for home or office use"
apt,"s. (usually followed by `to') naturally disposed toward
s. at risk of or subject to experiencing something usually unpleasant
s. mentally quick and resourceful"
aptly,r with competence; in a competent capable manner
antenna,"n. an electrical device that sends or receives radio or television signals
n. sensitivity similar to that of a receptor organ
n. one of a pair of mobile appendages on the head of e.g. insects and crustaceans; typically sensitive to touch and taste"
antennal,a of or relating to antennae
arena,"n. the central area of an ancient Roman amphitheater where contests and spectacles were held; especially an area that was strewn with sand
n. a playing field where sports events take place"
array,"n. an orderly arrangement
n. an impressive display
n. especially fine or decorative clothing
n. an arrangement of aerials spaced to give desired directional characteristics"
artery,"n. a blood vessel that carries blood from the heart to the body
n. a major thoroughfare that bears important traffic"
articulate,"v. unite by forming a joint or joints
v. express or state clearly
a. expressing yourself easily or characterized by clear expressive language"
assassination,n. murder of a public figure by surprise attack
assessment,"n. an amount determined as payable
n. the market value set on assets"
atlas,"n. (Greek mythology) a Titan who was forced by Zeus to bear the sky on his shoulders
n. a collection of maps in book form
n. the 1st cervical vertebra
n. a figure of a man used as a supporting column"
authentic,"s. conforming to fact and therefore worthy of belief
s. not counterfeit or copied"
awkward,"s. causing inconvenience
a. lacking grace or skill in manner or movement or performance
s. difficult to handle or manage especially because of shape
s. not elegant or graceful in expression"
axis,"n. a straight line through a body or figure that satisfies certain conditions
n. the main stem or central part about which plant organs or plant parts such as branches are arranged
n. in World War II the alliance of Germany and Italy in 1936 which later included Japan and other nations
n. the 2nd cervical vertebra; serves as a pivot for turning the head"
badge,"n. an emblem (a small piece of plastic or cloth or metal) that signifies your status (rank or membership or affiliation etc.)
n. any feature that is regarded as a sign of status (a particular power or quality or rank)
v. put a badge on"
baffle,"n. a flat plate that controls or directs the flow of fluid or energy
v. check the emission of (sound)"
bald,"v. grow bald; lose hair on one's head
s. with no effort to conceal
s. lacking hair on all or most of the scalp
s. without the natural or usual covering"
ballet,"n. a theatrical representation of a story that is performed to music by trained dancers
n. music written for a ballet"
banquet,"n. a ceremonial dinner party for many people
n. a meal that is well prepared and greatly enjoyed"
barren,"n. an uninhabited wilderness that is worthless for cultivation
s. not bearing offspring
s. completely wanting or lacking"
batch,"n. all the loaves of bread baked at the same time
n. (often followed by `of') a large number or amount or extent
n. a collection of things or persons to be handled together
v. batch together; assemble or process as a batch"
belly,"n. a protruding abdomen
n. a part that bulges deeply
n. the hollow inside of something
n. the underpart of the body of certain vertebrates such as snakes or fish"
betray,"v. reveal unintentionally
v. deliver to an enemy by treachery"
betrayer,"n one who reveals confidential information in return for money
n a person who says one thing and does another"
beware,v. be on one's guard; be cautious or wary about; be alert to
bewilder,v. cause to be confused emotionally
bewildering,"v be a mystery or bewildering to
v cause to be confused emotionally"
bizarre,s. conspicuously or grossly unconventional or unusual
blacksmith,n. a smith who forges and shapes iron with a hammer and anvil
blaze,"n. a strong flame that burns brightly
n. a light-colored marking
v. shine brightly and intensively
v. burn brightly and intensely"
blink,"n. a reflex that closes and opens the eyes rapidly
v. briefly shut the eyes"
blossom,v. develop or come to a promising stage
blunder,n. an embarrassing mistake
blunderer,n someone who makes mistakes because of incompetence
blunt,"v. make less intense
v. make less sharp
s. having a broad or rounded end
s. used of a knife or other blade; not sharp"
bluntness,n. the quality of being direct and outspoken
blur,"n. a hazy or indistinct representation
v. to make less distinct or clear
v. make dim or indistinct
v. become vague or indistinct"
blurry,s indistinct or hazy in outline
blush,"n. sudden reddening of the face (as from embarrassment or guilt or shame or modesty)
v. turn red, as if in embarrassment or shame
v. become rosy or reddish"
booklet,n. a small book usually having a paper cover
booth,"n. a table (in a restaurant or bar) surrounded by two high-backed benches
n. small area set off by walls for special use
n. United States actor and assassin of President Lincoln (1838-1865)
n. a small shop at a fair; for selling goods or entertainment"
bowel,n the part of the alimentary canal between the stomach and the anus
boycott,"n. a group's refusal to have commercial dealings with some organization in protest against its policies
v. refuse to sponsor; refuse to do business with"
bracket,"n. a category falling within certain defined limits
n. either of two punctuation marks (`<' or `>') used in computer programming and sometimes used to enclose textual material
n. either of two punctuation marks ([ or ]) used to enclose textual material
n. a support projecting from a wall (as to hold a shelf)"
breach,"n. a failure to perform some promised act or obligation
n. an opening (especially a gap in a dike or fortification)"
breakthrough,"n. making an important discovery
n. a penetration of a barrier such as an enemy's defense"
breed,"n. a special variety of domesticated animals within a species
n. a special type
v. copulate with a female, used especially of horses
v. cause to procreate (animals)"
breeder,n. a person who breeds animals
brew,"n. drink made by steeping and boiling and fermenting rather than distilling
v. prepare by brewing
v. sit or let sit in boiling water so as to extract the flavor"
bribe,"n. payment made to a person in a position of trust to corrupt his judgment
v. make illegal payments to in exchange for favors or influence"
bribery,n. the practice of offering something (usually money) in order to gain an illicit advantage
brink,"n. a region marking a boundary
n. the edge of a steep place"
brisk,"v. become brisk
s. very active"
brochure,n a small book usually having a paper cover
bronze,"n. an alloy of copper and tin and sometimes other elements; also any copper-base alloy containing other elements in place of tin
n. a sculpture made of bronze
v. give the color and appearance of bronze to something
s. of the color of bronze"
brood,"n. the young of an animal cared for at one time
v. think moodily or anxiously about something
v. hang over, as of something threatening, dark, or menacing
v. sit on (eggs)"
broody,s. physiologically ready to incubate eggs
bruise,"n. an injury that doesn't break the skin but results in some discoloration
v. injure the underlying soft tissue or bone of
v. break up into small pieces for food preparation
v. damage (plant tissue) by abrasion or pressure"
brutal,"s. harsh
s. disagreeably direct and precise"
brutality,n. a brutal barbarous savage act
buck,"n. United States author whose novels drew on her experiences as a missionary in China (1892-1973)
n. mature male of various mammals (especially deer or antelope)
v. to strive with determination
v. resist"
bud,"n. a partially opened flower
n. a swelling on a plant stem consisting of overlapping immature leaves or petals
v. develop buds
v. start to grow or develop"
budget,"n. a sum of money allocated for a particular purpose
n. a summary of intended expenditures along with proposals for how to meet them
v. make a budget"
budgetary,a. of or relating to a budget
bulletin,"n. a brief report (especially an official statement issued for immediate publication or broadcast)
v. make public by bulletin"
bully,"n. a cruel and brutal fellow
n. a hired thug"
bump,"n. a lump on the body caused by a blow
v. knock against with force or violence
v. dance erotically or dance with the pelvis thrust forward"
burial,n. the ritual placing of a corpse in a grave
bust,"n. a sculpture of the head and shoulders of a person
n. an occasion for excessive eating or drinking"
buzz,"n. sound of rapid vibration
n. a confusion of activity and gossip
v. make a buzzing sound
v. fly low"
bypass,"n. a surgically created shunt (usually around a damaged part)
v. avoid something unpleasant or laborious"
cable,"n. a telegram sent abroad
n. a conductor for transmitting electrical or optical signals or electric power
n. a very strong thick rope made of twisted hemp or steel wire
n. a nautical unit of depth"
cafeteria,n. a restaurant where you serve yourself and pay a cashier
cancel,"v. postpone indefinitely or annul something that was scheduled
v. make up for
v. declare null and void; make ineffective
v. make invalid for use"
cancellation,"n. the act of cancelling; calling off some arrangement
n. the speech act of revoking or annulling or making void"
cane,"n. a stick that people can lean on to help them walk
n. a strong slender often flexible stem as of bamboos, reeds, rattans, or sugar cane
n. a stiff switch used to hit students as punishment
v. beat with a cane"
cannon,"n. a large artillery gun that is usually on wheels
n. heavy gun fired from a tank
n. (Middle Ages) a cylindrical piece of armor plate to protect the arm
n. heavy automatic gun fired from an airplane"
canvas,"n. a heavy, closely woven fabric (used for clothing or chairs or sails or tents)
n. an oil painting on canvas fabric
n. the setting for a narrative or fictional or dramatic account
n. the mat that forms the floor of the ring in which boxers or professional wrestlers compete"
capsule,"n. a small container
n. a pill in the form of a small rounded gelatinous container with medicine inside
n. a dry dehiscent seed vessel or the spore-containing structure of e.g. mosses
n. a structure that encloses a body part"
carve,"v. form by carving
v. engrave or cut by chipping away at a surface
v. cut to pieces"
carver,n. United States botanist and agricultural chemist who developed many uses for peanuts and soy beans and sweet potatoes (1864-1943)
cater,v. supply food ready to eat; for parties and banquets
caterer,n. someone who provides food and service (as for a party)
Catholic,"n. a member of a Catholic church
a. of or relating to or supporting Catholicism
s. free from provincial prejudices or attachments"
Catholicism,n. the beliefs and practices of a Catholic Church
caution,"n. the trait of being cautious; being attentive to possible danger
n. a warning against certain acts
n. judiciousness in avoiding harm or danger
v. warn strongly; put on guard"
cautious,"a. showing careful forethought; never making swift decisions""
s. avoiding excess"
ceramic,"n. an artifact made of hard brittle material produced from nonmetallic minerals by firing at high temperatures
a. of or relating to or made from a ceramic"
ceramist,n a craftsman who shapes pottery on a potter's wheel and bakes them it a kiln
challenge,"n. a demanding or stimulating situation
n. a call to engage in a contest or fight
n. questioning a statement and demanding an explanation
n. a formal objection to the selection of a particular person as a juror"
challenging,"s. stimulating interest or thought
s. disturbingly provocative"
champagne,"n. a white sparkling wine either produced in Champagne or resembling that produced there
n. a region of northeastern France"
champion,"n. someone who has won first place in a competition
n. someone who fights for a cause
v. protect or fight for as a champion
s. holding first place in a contest"
championship,"n. the status of being a champion
n. a competition at which a champion is chosen"
chant,"n. a repetitive song in which as many syllables as necessary are assigned to a single tone
v. recite with musical intonation; recite as a chant or a psalm"
chanter,n. reed pipe with finger holes on which the melody is played
chapel,n. a place of worship that has its own altar
cholesterol,n. an animal sterol that is normally synthesized by the liver; the most abundant steroid in animal tissues
chord,"n. a straight line connecting two points on a curve
n. a combination of three or more notes that blend harmoniously when sounded together
v. play chords on (a string instrument)"
chorus,"n. any utterance produced simultaneously by a group
n. a group of people assembled to sing together
n. a body of dancers or singers who perform together
n. a company of actors who comment (by speaking or singing in unison) on the action in a classical Greek play"
chunk,n. a substantial amount
clamp,"n. a device (generally used by carpenters) that holds things firmly together
v. fasten or fix with a clamp
v. impose or inflict forcefully"
clan,n group of people related by blood or marriage
clannish,"s. characteristic of a clan especially in being unified
s. befitting or characteristic of those who incline to social exclusiveness and who rebuff the advances of people considered inferior"
clash,"n. a state of conflict between persons
n. a state of conflict between colors
v. be incompatible; be or come into conflict
v. disagree violently"
clasp,"n. a fastener (as a buckle or hook) that is used to hold two things together
n. the act of grasping
v. hold firmly and tightly
v. grasp firmly"
client,n. a person who seeks the advice of a lawyer
climax,"n. the highest point of anything conceived of as growing or developing or unfolding
n. the decisive moment in a novel or play
n. the most severe stage of a disease
n. arrangement of clauses in ascending order of forcefulness"
cling,"n. fruit (especially peach) whose flesh adheres strongly to the pit
v. come or be in close contact with; stick or hold together and resist separation
v. to remain emotionally or intellectually attached
v. hold on tightly or tenaciously"
clip,"n. any of various small fasteners used to hold loose articles together
n. an article of jewelry that can be clipped onto a hat or dress
n. the act of clipping or snipping
n. a sharp slanting blow"
clockwise,"a. in the same direction as the rotating hands of a clock
r. in the direction that the hands of a clock move"
clone,"n. a group of genetically identical cells or organisms derived from a single cell or individual by some kind of asexual reproduction
v. make multiple identical copies of"
clutch,"n. a tense critical situation
n. a number of birds hatched at the same time
n. a pedal or lever that engages or disengages a rotating shaft and a driving mechanism
n. a coupling that connects or disconnects driving and driven parts of a driving mechanism"
coalition,n. the state of being combined into one body
coarse,"a. of textures that are rough to the touch or substances consisting of relatively large particles
s. lacking refinement or cultivation or taste
s. of low or inferior quality or value"
coarsely,r. in coarse pieces
cocaine,n. a narcotic (alkaloid) extracted from coca leaves; used as a surface anesthetic or taken for pleasure; can become powerfully addictive
cocktail,"n. a short mixed drink
n. an appetizer served as a first course at a meal"
collide,"v. cause to collide
v. crash together with violent impact"
collision,"n. (physics) a brief event in which two or more bodies come together
n. an accident resulting from violent impact of a moving object
n. a conflict of opposed ideas or attitudes or goals"
comet,n. (astronomy) a relatively small extraterrestrial body consisting of a frozen mass that travels around the sun in a highly elliptical orbit
cometary,a. of or relating to or resembling a comet
commence,"v take the first step or steps in carrying out an action
v set in motion, cause to start
v get off the ground"
commencement,n. an academic exercise in which diplomas are conferred
compromise,"n. a middle way between two extremes
n. an accommodation in which both sides make concessions
v. make a compromise; arrive at a compromise; we all must compromise""
v. settle by concession"
contrive,"v make or work out a plan for; devise
v come up with (an idea, plan, explanation, theory, or principle) after a mental effort
v put or send forth"
contrivance,"n. the faculty of contriving; inventive skill
n. an elaborate or deceitful scheme contrived to deceive or evade
n. an artificial or unnatural or obviously contrived arrangement of details or parts etc."
cork,"n. outer bark of the cork oak; used for stoppers for bottles etc.
n. a port city in southern Ireland
n. the plug in the mouth of a bottle (especially a wine bottle)
v. close a bottle with a cork"
corkage,n. a charge added at a restaurant for every bottle of wine served that was not bought on the premises
corpse,n the dead body of a human being
costume,"n. the attire worn in a play or at a fancy dress ball
n. unusual or period attire not characteristic of or appropriate to the time and place
n. the prevalent fashion of dress (including accessories and hair style as well as garments)
n. the attire characteristic of a country or a time or a social class"
counsel,"n a lawyer who pleads cases in court
n something that provides direction or advice as to a decision or course of action
v give advice to"
counselor,"n. someone who gives advice about problems
n. someone who has supervisory duties at a summer camp"
counterpart,"n. a person or thing having the same function or characteristics as another
n. a duplicate copy"
coupon,"n. a negotiable certificate that can be detached and redeemed as needed
n. a test sample of some substance"
courageous,a possessing or displaying courage; able to face and deal with danger or fear without flinching
coverage,"n. the total amount and type of insurance carried
n. the extent to which something is covered
n. the news as presented by reporters for newspapers or radio or television"
cozy,"s. enjoying or affording comforting warmth and shelter especially in a small space
s. having or fostering a warm or friendly and informal atmosphere
s. suggesting connivance"
coziness,n. a state of warm snug comfort
cradle,"n. a baby bed with sides and rockers
n. birth of a person
v. hold gently and carefully
v. bring up from infancy"
crash,"n. a serious accident (usually involving one or more vehicles)
n. a sudden large decline of business or the prices of stocks (especially one that causes additional failures)
n. the act of colliding with something
n. (computer science) an event that causes a computer system to become inoperative"
crisp,"s. (of something seen or heard) clearly defined
s. tender and brittle
s. pleasantly cold and invigorating
s. pleasingly firm and fresh"
cruelty,"n. a cruel act; a deliberate infliction of pain and suffering
n. feelings of extreme heartlessness
n. the quality of being cruel and causing tension or annoyance"
crumble,"v. fall apart
v. break or fall apart into fragments"
cucumber,"n. a melon vine of the genus Cucumis; cultivated from earliest times for its cylindrical green fruit
n. cylindrical green fruit with thin green rind and white flesh eaten as a vegetable; related to melons"
cute,s. obviously contrived to charm
cutely,r in an attractive manner
cynical,s. believing the worst of human nature and motives; having a sneering disbelief in e.g. selflessness of others
dart,"n. a small narrow pointed missile that is thrown or shot
n. a tapered tuck made in dressmaking
v. run or move very quickly or hastily
v. move with sudden speed"
darter,n. a person or other animal that moves abruptly and rapidly
dazzle,"n. brightness enough to blind partially and temporarily
v. to cause someone to lose clear vision, especially from intense light
v. amaze or bewilder, as with brilliant wit or intellect or skill"
dazzling,s. amazingly impressive; suggestive of the flashing of lightning
deadly,"s. causing or capable of causing death
s. of an instrument of certain death
s. extremely poisonous or injurious; producing venom
s. involving loss of divine grace or spiritual death"
decree,"n. a legally binding command or decision entered on the court record (as if issued by a court or judge)
v. issue a decree"
deem,v. keep in mind or convey as a conviction or view
default,"n. loss due to not showing up
n. act of failing to meet a financial obligation
v. fail to pay up"
defaulter,"n. someone who fails to make a required appearance in court
n. someone who fails to meet a financial obligation
n. a contestant who forfeits a match"
denial,"n. the act of refusing to comply (as with a request)
n. the act of asserting that something alleged is not true
n. (psychiatry) a defense mechanism that denies painful thoughts"
deniable,a. capable of being denied or contradicted
derivation,"n. the source or origin from which something derives (i.e. comes or issues)
n. a line of reasoning that shows how a conclusion follows logically from accepted propositions
n. (descriptive linguistics) the process whereby new words are formed from existing words or bases by affixation"
derivative,"n. a compound obtained from, or regarded as derived from, another compound
n. (linguistics) a word that is derived from another word
s. resulting from or employing derivation"
destined,"v decree or designate beforehand
v design or destine
s headed or intending to head in a certain direction; often used as a combining form as in `college-bound students'
s (usually followed by `to') governed by fate"
destiny,"n. an event (or a course of events) that will inevitably happen in the future
n. the ultimate agency regarded as predetermining the course of events (often personified as a woman)"
destine,v. decree or designate beforehand
