mouse,"n. any of numerous small rodents typically resembling diminutive rats having pointed snouts and small ears on elongated bodies with slender usually hairless tails
n. person who is quiet or timid
n. a hand-operated electronic device that controls the coordinates of a cursor on your computer screen as you move it around on a pad; on the bottom of the device is a ball that rolls on the surface of the pad
v. manipulate the mouse of a computer"
large,"n. a garment size for a large person
a. above average in size or number or quantity or magnitude or extent
s. fairly large or important in effect; influential
s. having broad power and range and scope"
strong,"a. having strength or power greater than average or expected
s. not faint or feeble
s. of verbs not having standard (or regular) inflection
s. freshly made or left"
walk by,none
wake ... up,none
some day,r. some unspecified time in the future
quietly,"r. with little or no sound
r. with little or no activity or no agitation (`quiet' is a nonstandard variant for `quietly')"
weak,"a. wanting in physical strength
s. tending downward in price
s. deficient or lacking in some skill
s. (used of verbs) having standard (or regular) inflection"
loudly,r. with relatively high volume
let ... go,none
the next day,none
net,"n. a trap made of netting to catch fish or birds or insects
n. a goal lined with netting (as in soccer or hockey)
n. game equipment consisting of a strip of netting dividing the playing area in tennis or badminton
n. an open fabric of string or rope or wire woven together at regular intervals"
bite,"n. a wound resulting from biting by an animal or a person
n. a light informal meal
n. (angling) an instance of a fish taking the bait
n. the act of gripping or chewing off with the teeth and jaws"
sharp,"n. a musical notation indicating one half step higher than the note named
n. a long thin sewing needle with a sharp point
s. harsh
a. keenly and painfully felt; as if caused by a sharp edge or point"
sadly,"r. in an unfortunate way
r. with sadness; in a sad manner"
just then,none
soon,r. in the near future
happily,"r. in a joyous manner
r. in an unexpectedly lucky way"
from then on,none
cheer,"n. a cry or shout of approval
v. give encouragement to
v. show approval or good wishes by shouting
v. cause (somebody) to feel happier or more cheerful"
hit,"n. (baseball) a successful stroke in an athletic contest (especially in baseball)
n. the act of contacting one thing with another
n. a conspicuous success
n. a dose of a narcotic drug"
deep,"n. the central and most intense or profound part
n. literary term for an ocean
a. relatively deep or strong; affecting one deeply
s. marked by depth of thinking"
reach,"n. the act of physically reaching or thrusting out
v. reach a destination, either real or abstract
v. reach a point in time, or a certain state or level
v. move forward or upward in order to touch; also in a metaphorical sense"
quickly,r. with rapid movements
pour ... into,none
habit,"n. an established custom
n. (psychology) an automatic pattern of behavior in reaction to a specific situation; may be inherited or acquired through frequent repetition
n. a distinctive attire worn by a member of a religious order
n. the general form or mode of growth (especially of a plant or crystal)"
never,"r. not ever; at no time in the past or future
r. not at all; certainly not; not in any circumstances"
late,"a. being or occurring at an advanced period of time or after a usual or expected time
s. of the immediate past or just previous to the present time
s. having died recently
a. of a later stage in the development of a language or literature; used especially of dead languages"
put ... in order,none
finish,"n. the place designated as the end (as of a race or journey)
n. designated event that concludes a contest (especially a race)
n. the downfall of someone (as of persons on one side of a conflict)
n. (wine tasting) the taste of a wine on the back of the tongue (as it is swallowed)"
tidy,"n. receptacle that holds odds and ends (as sewing materials)
v. put (things or places) in order
a. marked by order and cleanliness in appearance or habits"
bad,"n. that which is below standard or expectations as of ethics or decency
a. having undesirable or negative qualities
s. very intense
s. feeling physical discomfort or pain (`tough' is occasionally used colloquially for `bad')"
sleepy,s. ready to fall asleep
last night,none
fast,"n. abstaining from food
v. abstain from certain foods, as for religious or medical reasons
v. abstain from eating
a. acting or moving or capable of acting or moving quickly"
go into,none
slowly,r. without speed (`slow' is sometimes used informally for `slowly')
badly,"r. to a severe or serious degree
r. evilly or wickedly
r. in a disobedient or naughty way
r. with great intensity (`bad' is a nonstandard variant for `badly')"
healthy,"a. having or indicating good health in body or mind; free from infirmity or disease
s. financially secure and functioning well
s. promoting health; healthful
s. exercising or showing good judgment"
diet,"n. a prescribed selection of foods
n. a legislative assembly in certain countries (e.g., Japan)
n. the usual food and drink consumed by an organism (person or animal)
n. the act of restricting your food intake (or your intake of particular foods)"
a little,none
a few,none
at a time,none
cola,"n. large genus of African trees bearing kola nuts
n. carbonated drink flavored with extract from kola nuts (`dope' is a southernism in the United States)"
need,"n. a condition requiring relief
n. anything that is necessary but lacking
v. have or feel a need for"
road,"n. an open way (generally public) for travel or transportation
n. a way or means to achieve something"
safety,"n. the state of being certain that adverse effects will not be caused by some agent under defined conditions
n. a safe place
n. a score in American football; a player is tackled behind his own goal line"
cross,"n. a wooden structure consisting of an upright post with a transverse piece
n. a representation of the structure on which Jesus was crucified; used as an emblem of Christianity or in heraldry
n. any affliction that causes great suffering
v. fold so as to resemble a cross"
safely,r. with safety; in a safe manner
must,"n. a necessary or essential thing
n. grape juice before or during fermentation
s. highly recommended"
zebra crossing,none
safe,"n. strongbox where valuables can be safely kept
n. a ventilated or refrigerated cupboard for securing provisions from pests
a. free from danger or the risk of harm
s. (of an undertaking) secure from risk"
pavement,n. the paved surface of a thoroughfare
look out for,none
easily,"r. with ease (`easy' is sometimes used informally for `easily')
r. without question"
follow,"v. to travel behind, go after, come after
v. come as a logical consequence; follow logically
v. travel along a certain course
v. come after in time, as a result"
rule,"n. a principle or condition that customarily governs behavior
n. prescribed guide for conduct or action
n. (linguistics) a rule describing (or prescribing) a linguistic practice
n. the duration of a monarch's or government's power"
stay,"n. continuing or remaining in a place or state
n. a judicial order forbidding some action until an event occurs or the order is lifted
n. a thin strip of metal or bone that is used to stiffen a garment (e.g. a corset)
n. (nautical) brace consisting of a heavy rope or wire cable used as a support for a mast or spar"
light,"n. (physics) electromagnetic radiation that can produce a visual sensation
n. any device serving as a source of illumination
n. a particular perspective or aspect of a situation
n. an illuminated area"
Children's Day,none
clown,"n. a rude or vulgar fool
n. a person who amuses others by ridiculous behavior
v. act as or like a clown"
appear,"v. come into sight or view
v. be issued or published
v. seem to be true, probable, or apparent
v. come into being or existence, or appear on the scene"
balloon,"n. large tough nonrigid bag filled with gas or heated air
n. small thin inflatable rubber bag with narrow neck
v. ride in a hot-air balloon
v. become inflated"
begin,"n. Israeli statesman (born in Russia) who (as prime minister of Israel) negotiated a peace treaty with Anwar Sadat (then the president of Egypt) (1913-1992)
v. have a beginning, in a temporal, spatial, or evaluative sense
v. set in motion, cause to start
v. begin to speak or say"
put on,"n a composition that imitates or misrepresents somebody's style, usually in a humorous way
n something intended to deceive; deliberate trickery intended to gain an advantage
n a ludicrous or grotesque act done for fun and amusement"
end,"n. either extremity of something that has length
n. the point in time at which something ends
n. the concluding parts of an event or occurrence
n. a final part or section"
country,"n. the territory occupied by a nation
n. an area outside of cities and towns"
will,"n. a fixed and persistent intent or purpose
n. a legal document declaring a person's wishes regarding the disposal of their property when they die
v. decree or ordain
v. determine by choice"
learn,"v. gain knowledge or skills
v. get to know or become aware of, usually accidentally
v. be a student of a certain subject"
find out,none
magazine,"n. a periodic publication containing pictures and stories and articles of interest to those who purchase it or subscribe to it
n. product consisting of a paperback periodic publication as a physical object
n. a business firm that publishes magazines
n. a light-tight supply chamber holding the film and supplying it for exposure as required"
kangaroo,n. any of several herbivorous leaping marsupials of Australia and New Guinea having large powerful hind legs and a long thick tail
koala,n. sluggish tailless Australian arboreal marsupial with grey furry ears and coat; feeds on eucalyptus leaves and bark
sport-lover,none
Australian football,none
exciting,"a. creating or arousing excitement
s. stimulating interest and discussion"
Sydney,n. the largest Australian city located in southeastern Australia on the Tasman Sea; state capital of New South Wales; Australia's chief port
welcome,"n. the state of being welcome
n. a greeting or reception
v. accept gladly
v. bid welcome to; greet upon arrival"
visitor,n. someone who visits
for example,none
London,"n. the capital and largest city of England; located on the Thames in southeastern England; financial and industrial and cultural center
n. United States writer of novels based on experiences in the Klondike gold rush (1876-1916)"
Oxford,"n. a city in southern England to the northwest of London; site of Oxford University
n. a university town in northern Mississippi; home of William Faulkner
n. a low shoe laced over the instep"
like,"n. a similar kind
n. a kind of person
v. find enjoyable or agreeable
v. be fond of"
Big Ben,none
London Eye,none
Tower Bridge,none
What do you think?,none
month,n. a time unit of approximately 30 days
summer holiday,none
go back to,none
how long,none
stay,"n. continuing or remaining in a place or state
n. a judicial order forbidding some action until an event occurs or the order is lifted
n. a thin strip of metal or bone that is used to stiffen a garment (e.g. a corset)
n. (nautical) brace consisting of a heavy rope or wire cable used as a support for a mast or spar"
sound,"n. the particular auditory effect produced by a given cause
n. the subjective sensation of hearing something
n. mechanical vibrations transmitted by an elastic medium
n. the sudden occurrence of an audible event"
Disneyland,n. an amusement park in Anaheim created in 1955 by Walt Disney
Ocean Park,none
Taipei,n. the capital of Nationalist China; located in northern Taiwan
photo,n a representation of a person or scene in the form of a print or transparent slide; recorded by a camera on light-sensitive material
travel,"n. the act of going from one place to another
v. change location; move, travel, or proceed, also metaphorically
v. undertake a journey or trip
v. make a trip for pleasure"
traveller,n a person who changes location
travel around the world,none
different,"a. unlike in nature or quality or form or degree
s. distinctly separate from the first
s. differing from all others; not ordinary
s. distinct or separate"
dream,"n. a series of mental images and emotions occurring during sleep
n. imaginative thoughts indulged in while awake
n. a state of mind characterized by abstraction and release from reality
n. someone or something wonderful"
future,"n. the time yet to come
n. a verb tense that expresses actions or states in the future
n. bulk commodities bought or sold at an agreed price for delivery at a specified future date
a. yet to be or coming"
care about,none
tooth,"n. hard bonelike structures in the jaws of vertebrates; used for biting and chewing or for attack and defense
n. something resembling the tooth of an animal
n. toothlike structure in invertebrates found in the mouth or alimentary canal or on a shell
n. a means of enforcement"
astronaut,n. a person trained to travel in a spacecraft
spaceship,n a spacecraft designed to carry a crew into interstellar space (especially in science fiction)
football player,none
World Cup,none
dancer,"n. a performer who dances professionally
n. a person who participates in a social gathering arranged for dancing (as a ball)"
pianist,n. a person who plays the piano
come true,none
take care of,none
scientist,n. a person with advanced knowledge of one or more sciences
brave,"n. a North American Indian warrior
n. people who are brave
a. possessing or displaying courage; able to face and deal with danger or fear without flinching
s. brightly colored and showy"
artist,n. a person whose creative work shows sensitivity and imagination
paint,"n. a substance used as a coating to protect or decorate a surface (especially a mixture of pigment suspended in a liquid); dries to form a hard coating
v. make a painting
v. apply paint to; coat with paint
v. make a painting of"
